name,party,date,text,chamber,debate_title,subdebate_title,debate_type,debate_id,subdebate_id
"Thompson, Cameron, MP",LP,1998-11-10,"—I move:
That the address be agreed to.
It is a great honour for me to respond to the speech of His Excellency the Governor-General. To respond when His Excellency lays out the future program of a new government is an honour that has been awarded to just 38 Australians in the history of our Federation. I thank the Prime Minister for his confidence.
Mr Speaker, I congratulate you on your appointment today, and I hope my comments reflect the moment of the occasion.
As the first member to represent the federal division of Blair, I am a proud addition to this place. Covering an area of about 15,000 square kilometres, Blair includes the shires of Kingaroy, Nanango, Kilcoy, Esk, Gatton and Laidley and includes part of the City of Ipswich and Rosalie and Crow's Nest shires. Across this area, traditional primary industries, including beef and dairy farms, peanut, fruit and vegetable growers, are under considerable pressure. Drought and decades of rising costs and falling returns have undermined these industries and the communities they support.
The urban and near urban areas in and around the city of Ipswich make up 30 per cent of Blair's voting population. Development in the city is a matter of priority. In recent years, there have been serious concerns about the future of Ipswich, but lately the city has scored a few home runs that  are worth recording. In particular, we have the establishment of the Ipswich campus of the University of Queensland, and the Global Information Links Internet Project pioneered by the City Council is generating a lot of interest and activity. Now we have plans for an innovative global arts link venture and a rail technology centre, both of which provide an impetus for tourism that has been lacking in the past.
The RAAF Base Amberley is also a source of pride and future growth in the electorate. Currently there is uncertainty about the future of RAAF personnel and their accommodation. The changes that lie ahead must be handled sensitively, recognising the opportunity for growth but providing support for people and families caught up in the process. Blair is a beautiful and productive region with tremendous potential for new growth in areas such as tourism and downstream processing.
Blair received its name from the celebrated Aboriginal opera singer, Harold Blair, who won recognition across the world but never forgot his upbringing. Harold Blair grew up in the small community of Purga near Ipswich. His life took him to the great concert halls of the world, but even at the height of his career Harold Blair was a regular attraction at the old town hall in Ipswich. All members must take a leaf from the book of life as lived by Harold Blair. This is the House of Representatives and each member arrives courtesy of a community of electors whose hopes and dreams we must always place first. We must fight on their behalf, we must show leadership on their behalf, and always we must remember that our neighbours will be the judge when we give account of work done on their behalf.
The reasons according to which each of us are honoured to be selected as a community representative and therefore a member of this House are many and varied. Australia is the world's greatest democracy. Many countries 
 live by democratic principles, but we are especially privileged. In our society Australian values such as mateship, a fair go, a helping hand and a fair day's work remain the unwritten code we all respect. His Excellency referred to the same tradition when he spoke of decency, openness, tolerance and a fair go for all.
The people who are the real source of parliamentary power in this place are our neighbours back at home. The people we meet in the supermarket and on the sports field all aspire to those Australian values and respect those who live by them. When we rise on behalf of our electorates, we should always speak in line with those great Australian principles—in a spirit of mateship, ensuring a fair go, offering a helping hand and never giving or expecting less than a fair day's work for a fair day's pay.
I am here because the people of Blair share those great Australian principles and because they believe that of nine candidates I am the one most capable of being a strong, dedicated and appropriate representative over the coming three year term. I thank the people of Blair for that decision. They did not choose the most controversial candidate, the most divisive candidate or the one with the best publicity. Their choice was for the candidate that came closest to representing the community as a whole. For the great silent majority in Blair, this election result proved that we are supported by a voting system that truly reflects the community mood. It is a system that represents those Australian principles that I salute in this address.
Today the most important challenge I face is to address the needs of that significant minority of people in Blair who did not go to this poll with moderation in mind. By and large, these Australians are not prone to radicalism—they are true conservatives who love this country and want to see a better life for their children. The fact that such a group can be stirred to vote in a strident manner regardless of the consequences is a warning to all in this parliament. Rebuild faith in Australia and our democratic government, rebuild respect for each other, rebuild those 
 longstanding Australian values, or much more could be at risk.
I am truly blessed because my wife, Sharen, has real faith in me. Together, and with the incredible support of my mother-in-law, Betty Grove, we entered a political colosseum 12 months ago and we emerged strong, healthy and in one piece. Because of Sharen's faith, I never ducked a blow in the contest and I know our two sons, Fletcher and Ari, and number three, who will join us in April, will always speak with pride of what we have achieved as a family in the past 12 months. 	I hope that, in the time ahead, there will be many more achievements that help the people of Blair and that our family will regard with pride.
Naturally, my thoughts at this time turn also to my parents, Dorothy and the late Norm Thompson. Much of what I am I owe to Dot and Norm. They instilled in me an understanding and an appreciation of what is great about family life. I hope I can pass some of that appreciation on to my own boys.
Others I must thank include my campaign manager, John Andrews, and workers Christine Trevett and Roy Hopkins-Deacon. These three gave everything to the campaign and deserve three hearty cheers from me.
Peter Clarke, who is the Liberal Party branch development officer in Queensland, moved to Blair for the duration. He lent me his organisational and engineering skills, his car and boundless enthusiasm. Without Peter, assisted by Jeff Matijasevic, all 71 booths in Blair would not have been manned on 3 October and the result may well have been different.
For me a feature of the campaign was the discovery of friendship in places where it was not expected. True friends do stand by you when the chips are down. Daryl Butler, his young son and those many other hard-working friends, like Mark and Sue Phelps and Liberals from across south-east Queensland, will certainly always be welcome at my house.
The President of the Liberal Party in Queensland, Bob Carroll, deserves a great deal of credit. He recognised the importance 
 of the seat of Blair and the fact that it was unique in this campaign. He helped structure campaign activities and material to make the concerns of the people of Blair count.
I also thank the Liberal Party State Executive. I was preselected ahead of a fancied rival. It is easy to speak in hindsight, but plainly the preselection decision taken by the State Executive was right for Blair and the future of the party. The support I received from State Director, Greg Goebel, National Director, Lynton Crosby, and their staff was at all times dedicated and professional.
I place on record special thanks to the Northern Territory Chief Minister, Shane Stone, who campaigned with me in Blair. Shane attracted strong financial support and flew the flag for change and a better future at a dinner in his honour at Kingaroy. His sage advice was a boon to my efforts.constitution
Similarly, I received valuable support of a different character from the Victorian Premier, Jeff Kennett. Jeff chased One Nation down every burrow, and he took up the charge early in the campaign when the strength and direction of my main opponent was impossible to predict. As a result of experiences stretching back over many years, I also salute many in politics who encouraged me. Apart from Shane Stone, these include: former Northern Territory education minister Tom Harris; the member for Fisher, Peter Slipper; and former Deputy Premier of Queensland, Joan Sheldon.
In the campaign, I received encouragement and support from another former Queensland Deputy Premier, Bill Gunn, who did more than anyone else to preserve the strength of the coalition's spirit. An unexpected ally, whose words from out of the blue helped to guarantee a One Nation defeat, was former Governor-General Bill Hayden, who spoke in a forthright manner in support of his community and their interests.
Apart from building many strong and supportive friendships, my background in state and territory politics has shaped my thinking. It has helped me to set goals about building a better future for residents in Blair, particularly those frustrated and disappointed with recent progress. Today, the harsh realities of life are impacting on all Australians, 
 but not all are given access to benefits that compensate for the heavy costs brought about by change.
Many of those who feel the most pain have been made the targets of reduced services and backdoor tax increases by all levels of government over many years. They are the easy marks who are exploited again and again, usually because, after many years of falling revenue, our system has become adept at finding those who will suffer pain in silence. That is a prime source of the fire that has Australian politics in hot water today. Governments cannot continue to be driven by annual bouts of financial blood lust. The victims are out there in Blair and in many other Australian electorates, and they are no longer silent.
That is why I strongly support the government's tax reform package. This system would finally redistribute some of the burden of tax onto the prominent individuals who regularly dodge it. It would create an orderly growth of revenue and balance our budgets without recourse to proxies like speed cameras, user charges, road funding cuts and a whole host of other things that I could name.
Today, I was thrilled to hear His Excellency make the clear point that this government will ensure that the benefits of reform are fairly shared. But as we demand greater competition and improved efficiency on farms, in small businesses and among local and state bureaucracies, so we must do more in this parliament to put our own house in order.
While members of this House go back to their home towns after every sitting, the source of bureaucratic power in this country remains constant and truly remote from most Australians. The depth of duplication between state and Commonwealth departments remains a national shame and a burden that ordinary Australians in my electorate have carried for too long.
I acknowledge that at one time former Labor Prime Minister Bob Hawke advocated a serious reallocation of resources between these two levels of government. I also acknowledge that the government's tax reforms will direct more funding to state authorities, 
 which are the ones that actually provide the vast bulk of services. But it is just not enough. In key areas like health and education, the Commonwealth must begin to look at handing back in their entirety many of the resources that are duplicated.
I do not advocate job losses as part of this process but the state-level integration and staged conversion of duplicated resources to the sharp end of service delivery. In this way, at last, Australians who have campaigned long and hard for many years really would see a significant drop in class sizes and a strong and uniform influx of doctors and health professionals—even in country areas.
I am not a fanatic for states rights nor am I a flat earth economic nut. I have simply witnessed wave after wave of change breaking over the lives of less fortunate Australians—generally those who live in regional areas. The result has been a disastrous flow of population out of those areas, which has sapped confidence and left many wondering whether their communities have a long-term future in this country.
Rising property values and high powered salaries like those offered in our capital cities do make the national economy look good and strong. Unfortunately, they come at a tremendous cost in terms of falling values, salaries and prospects across the vast bulk of the Australian landmass. We should begin to remember the massive investment Australia has made in infrastructure across these areas and the importance of generating regional growth to support that infrastructure in the long term.
In defence of the system, I recall a couple of recent examples where the miracle of telecommunications technology has been used to help turn the tide. Obviously, the government's proposed transaction centres are one example—and I am keen to see a firm commitment to those in Blair. I mark His Excellency's words in that regard, where he noted those transaction centres as a priority for the government.
Another decision was taken by the former coalition government in Queensland to build a departmental call centre at Emerald. That is excellent work, but it is a very small drop in 
 a very big bucket. I know it feels good here in Canberra, but centralism is a cancer that is eating away at our country. I am surely not the font of wisdom on the subject, but we need to lift the debate, and I look forward to hearing from other members on these issues.
When I began this address I referred to the plight of the many important rural industries in Blair. It worries me that, as current population trends continue, the number of MPs speaking on behalf of the dwindling number engaged in these industries is also reducing. Those of us with rural and regional electorates need to work together more strongly and build links with leaders in other levels of government who share our constituency and our concerns.
In Blair, I have vowed to work closely with local authorities to strengthen our hand. In preparation for this address, a number of local mayors agreed to contribute a few lines to highlight areas of mutual concern. Gatton Shire Mayor Bernie Sutton wrote:
Hopefully the Government will recognise the disillusionment and frustration in all rural areas and positively respond to that feeling.
Mayor Sutton gave priority to funding councils and roads. He believes that financial assistance and tax incentives should be given to improve water supplies and that young residents need access to better sport and recreation facilities.
Kingaroy Mayor Roger Nunn wants the Commonwealth to construct new infrastructure to provide jobs. He wrote:
Money spent on infrastructure is never wasted, provided it is carefully planned.
As a local example, Mayor Nunn said building a standard gauge railway to serve the Surat Basin coal development would advantage industries in Kingaroy. It would also link producers in New South Wales with bulk export facilities in Queensland. Ipswich City Mayor, John Nugent, wrote:
The Ipswich region would benefit enormously if the Federal Government restored in real terms the amount spent on road funding to 1983 levels.
Mayor Nugent called for increased financial assistance grants to councils, equal to or better than levels of funding that applied in the mid-1980s. Other local representatives to 
 contribute included Laidley Mayor, Shirley Pitt, who joined the call for improved road funding following community meetings that declared a major intersection at Plainlands on the Warrego Highway a deathtrap. Rosalie is another local shire to advocate road funding as the Commonwealth's top priority.
At Kilcoy, Mayor Alex Brown is campaigning for lower meat inspection fees to promote stability at the Kilcoy Pastoral Co. abattoir which provides 300 local jobs and sustains the Kilcoy community. I recognise that funding and projects of this magnitude do not just materialise, but I endorse these comments from the mayors. Infrastructure, jobs, appropriate industry support and a campaign to boost the morale of people in communities like Ipswich, Gatton, Kingaroy and other centres such as those in Blair must be a high priority for the government and necessary funding should be found.
Mr Speaker, in closing I want to advise members that the words I speak and views I express today are mine. I do give credit to the mayors, however, for their contributions. There is no speech writer, bald or otherwise, hiding away back in my office. I will continue to write my own speeches and I will continue to represent the views of the people of Blair to the best of my ability and in my own words.
—Mr Speaker, I second the motion and reserve my right to speak.
	Debate (on motion by Mr Melham) adjourned.",REPS,<title>GOVERNOR-GENERAL'S SPEECH</title>,<title>Address-in-Reply</title>,Governor-General's Speech,17,1
"Crosio, Janice, MP",ALP,1998-11-10,"—In the adjournment debate tonight I would like first to put on the record my sincere congratulations—which I have already done privately—to you for the high office which you now hold. I feel sure you will do an excellent job in the years to come. I would also like to congratulate the Deputy Speaker and the Second Deputy Speaker on their appointments today. 
What I would like to raise in the adjournment debate tonight is the fact that on the 8th day of this month, last Sunday, I attended what was classified as the blessing of a nursing home on the border of my electorate, in the electorate of Fowler. I raise this particular case in the House to bring to the notice of the government what can be achieved with seed funding of $1.2 million—I might add it was given in the previous government's time—offered to a community to build a nursing home. In this case it was a Croatian village and His Lordship came out from Croatia to do the actual blessing. I would like to put on record my appreciation to Archbishop Josip Bozanich. More importantly, I want to explain to the House that this community, when they first built their church in 1985, having bought the land, had a dream to provide aged accommodation for their community. They were then given a grant by the previous government of $1.2 million to build a hostel. Having then raised something like $1½ million themselves, they completed that hostel and it was opened officially in November 1989.
In June 1995, they applied for, and were given, another grant of $1.2 million to go into what was then the third stage of the dream, to build a nursing home within this village area. That nursing home, I am proud to say, was officially blessed last Sunday and has been licensed now to have in occupation something like 40 residents. The government provided $1.2 million out of a total cost of something like $3 million. The community raised the rest among themselves. They have done that because over 900 families contributed in excess of $1,000 each.
We had another group of certificates given out last Sunday to families who had given over $5,000 each. People who did not have the financial means gave of their time, whether in building, doing pathways or in other accommodation areas that were just so essential to bring this dream into a reality. I would like to commend quite publicly the Australian-Croatian community that worked so hard in the Kardinal Stepinac Village and also place on record my sincere appreciation to the 
 hardworking community and to Father for his work in uniting that community.
I say to this government: look around and see what you can do if you come forward with small capital grants. The community will then rally to provide the proper accommodation for the aged that they care about. This government, I am ashamed to say, since 1996 has stopped all capital funding that would enable anything like this to ever happen again. I know, because I have been working with an Italian group in my area—Italian-Australians—to try to raise money to build an Italian village for the aged. They cannot get the original seed funding that was normally required and so freely given by governments in the past. I think this is a shame. I think this government has to reassess what it is doing with expenditure. I think we have to reassess how communities can become involved and do so much to care for their loved ones and their aged.
I think anybody on the government benches who doubts it has only to take a very short visit to the Kardinal Stepinac Village in St John's Park to see what has been achieved by that hardworking community. Again, I praise them. I praise the young in that community who also had functions to raise money, again to support both the hostel and the nursing home. I say to that community: stand with your heads high. You have done a wonderful job and really achieved so much.
Government members, please look at what can be done with a bit of financial generosity in providing a certain amount of capital funding. We have not seen that in the 1996-97 budget nor the 1997-98 budget. I would like to say to this new Prime Minister—he has now resurrected himself: he is going to be a new Prime Minister, a new leader who is going to look more at social structures and the social structure of the community as a whole—and to his ministers: start by contributing some of the capital funding that is required if we want to see bigger and better nursing homes throughout Australia.
Our people are getting older, our communities are aging. Where government cannot provide either the finance or the resources that are required to house the aged within our 
 community, communities are willing to bear the burden and to raise the finances, as has been proved by the Kardinal Stepinac Village last Sunday, and has been proved by them in the previous 10 years. What they need is just a little bit of assistance at the beginning, a little bit of help, and to know that the government cares about them and cares that they are doing this work within their own community.
I thank that community. I know that the people who are going to occupy this nursing home in the future will thank them and the happy community in that hostel accommodation thanks them so much for the work that they have done. I understand that their next course is to provide self-contained accommodation in a hostel environment as well, and I commend and congratulate them on that because I know that they will achieve it. Congratulations to the Kardinal Stepinac Village on a job well done.",REPS,<title>ADJOURNMENT</title>,<title>Nursing Homes</title>,Adjournment,18,1
