name,party,date,text,chamber,debate_title,subdebate_title,debate_type,debate_id,subdebate_id
"Fischer, Tim, MP",NP,1998-11-10,"—It reflects another era that Charles Edward Barnes entered parlia 
 ment at the age of 57 and stepped down from parliament at the age of 71. Having entered parliament at the age of 57, he had the privilege of serving in cabinet and in the ministry for some eight years of his 14 years as a member of the federal parliament. I commenced politics at the age of 24 in another parliament, and there are many on both sides of the House who are commencing their first day formally in the House of Representatives at much younger ages. I wish them well. I do not think we will see an era again where someone enters parliament at the age of 57 and has the privilege of serving eight years as a minister of the Crown—so much fundamental change has taken place in the decades since that time.
I did not know Charles Edward Barnes—or Ceb Barnes, as his initials led everyone to call him—that well, although I did meet him on two occasions, I think. But he was undoubtedly a gentleman. As Kim Beazley Sr wrote, he was a gentleman to his fingertips. He reflected a dignity about the purposefulness of being a representative for the seat of McPherson and a dignity about the purposefulness of being a minister of the Crown—for Territories and then External Territories. He carried that dignity throughout his career in politics, as an engineer involved in the mining industry in the northern part of Queensland, in his horse breeding after he left politics, and in a range of other activities pursued over the decades of his long, illustrious life.
In terms of his war service, he did not start too well. Landing at Townsville airport in a crosswind, he elected to use the wrong runway—not the one the tower had directed him to. It was just at the build-up towards Pearl Harbour—there were a lot of US aircraft in the area, and the arrangements for radio control were not all that adequate. He managed to do what is called a ground loop upon landing. But as a consequence of doing that ground loop he headed directly at a newly arrived US aircraft, the crew of which had still not got out after arriving a couple of minutes earlier. There was almost a total collision and wipe-out. But Ceb, having hung on grimly and managed to just miss the American aircraft, got out and shook hands 
 with them, as you would imagine that he might do. You could imagine the exchange.
He went on from that to serve in Australia and in New Guinea, and had the privilege of then helping to fashion the way ahead for independence and the early years of independence of our northern neighbour. Ceb Barnes is well regarded around Papua New Guinea. He is well regarded around Queensland. I am pleased to see Don McDonald and Ray Braithwaite, who have been directly involved with him over the years, in the gallery on this occasion. He was committed, dedicated, determined and, as such, a parliamentarian who made a contribution which was above average and one which would be well recognised and is well recognised by this motion today. I have much pleasure in extending a salute to Ceb Barnes on this occasion and in extending sympathy to Barbara and members of the Barnes family.",REPS,<title>CONDOLENCES</title>,"<title>Barnes, Hon. Charles Edward `Ceb'</title>",Condolences,15,1
"Neville, Paul, MP",NP,1998-11-10,"—In speaking today to this condolence motion, I would like to mention that the current member for McPherson, Margaret May, would like to have spoken on this motion but could not do so because she has not yet made her first speech. I hope I can convey the sentiments which I am sure she would wish to convey regarding a predecessor in the seat. I grew up in the Warwick district in the electorate of McPherson. The 39 new members who took their oaths of office or their affirmations this morning could learn a great deal from Ceb Barnes. I certainly did.
In those days, McPherson stretched from the Gold Coast to Inala in Brisbane across the Fassifern valley to Warwick and Stanthorpe. It was a very diverse seat. I can remember as a teenager and junior delegate to the Country Party going to meetings at Boonah and Beaudesert in the back of his old green Rover car. Even in those days, when the young Labor movement, the young Liberals and the young Country Party, as it was then, were emerging—with some trepidation, I might add, from the senior hierarchy of those parties—Ceb Barnes was a mentor for young people in politics.
Ceb was a true Australian. He always exhibited those most appealing characteristics 
 of the Australian country gentleman. He was resourceful and passionate. He had a self-deprecating sense of humour. He had ingenuity, modesty, dignity and a great sense of community obligation and compassion for his fellow man. He was offered a knighthood but declined it because he believed he had been remunerated for public office, and I understand that his family declined a state funeral for the same reason. He was an ingenious mechanic, a handy schoolboy boxer, a world traveller, a skilled pilot—or not quite so skilled if the Deputy Prime Minister is correct—a successful goldminer, an innovative farmer, an accomplished racehorse breeder, a genuine philanthropist, an outstanding politician and an excellent minister.
Ceb Barnes was a minister in the Menzies, Holt, Gorton and McMahon governments, and he proved to be somewhat of a visionary. As the Prime Minister said, he served as Minister for Territories from 1963 to 1968 and then as Minister for External Territories until his retirement in 1972. He oversaw Papua New Guinea's path to independence and was often criticised—I believe wrongly, as recent events in that country have demonstrated—for not hurrying the process. He believed it was not something that should be imposed on the people of Papua New Guinea but was something that should evolve and that they should work towards.
Not an ambitious man, he was reluctant at first to accept the Country Party nomination when the then federal Treasurer Arthur Fadden—or Artie Fadden, as we knew him—offered it to him. I was in the Warwick Town Hall the night that Artie Fadden handed over to Ceb Barnes, and his speech was memorable, like all Artie Fadden speeches were memorable. He had his speech notes marked in different colours and, in the middle of the presentation, he got them mixed up. He then, on the stage of the Warwick Town Hall, flicked them out into piles, restacked them—with his backside to the audience the whole time—never missed a beat, turned around and went on with his speech. That was the night he introduced Ceb Barnes as his successor. Ceb Barnes represented the electorate until 1972, as the Prime Minister said. He was 
 famous for his racehorse Tails and it was interesting that his retirement in 1972 was the same year that he turned Tails out to stud at Canning Downs.
I last saw Ceb Barnes on 17 May this year when I returned to Warwick to open a wing at a nursing home. My wife, Margaret, and I drove to Canning Downs unannounced, and I was pleasantly surprised to find that although he had suffered a slight stroke he strode out to meet us. He was a very imposing man—he was about six feet three or six feet four. He came out onto the verandah and greeted us. He recalled, not in any maudlin way but very lucidly and with great clarity, his time here, and he spoke very positively about the current Prime Minister and the then Speaker, Ian Sinclair.
It is interesting too that, although he had a great respect for the House, he once had a question ruled out of order. In November 1960 he attempted to ask the then Treasurer, Harold Holt, if the then member for East Sydney, Eddie Ward, had been appointed financial editor of the Sydney Morning Herald. The question was ruled out of order despite the fact that Harold Holt was itching to respond to it.
I also recall an incident on the steps of the Warwick Town Hall when Ceb Barnes had come back from Canberra. I think the story has become somewhat apocryphal, but the Chief Hansard Reporter, Bernie Harris, and I could not find it readily in Hansard. The story goes that on one occasion—as Ceb Barnes told me—Eddie Ward asked Bob Menzies whether, prior to the next election, he would swim a crocodile-infested creek in North Queensland, because in the kingdom of Siam at that time to take your place in the legislature you had to show a mark of courage by swimming a crocodile-infested river. Menzies was reputed to have said that he would swim the creek provided the then honourable member for East Sydney went first, because no self-respecting crocodile would stay in the same stream.
Ceb Barnes's wry sense of humour even extended to his deathbed. He made the point that he had outlasted the C.E. Barnes Grandstand at the Warwick showground—you will 
 recall there was a tornado at Warwick about two months ago that took the grandstand. A day or two before his death, someone said something about the grandstand, and Ceb Barnes said, `Well, at least I outlasted that.'
Warwick journalist and friend of mine Gerard Walsh in his Daily News obituary described Ceb Barnes as `a man with a wonderful memory, a great problem solver, the perfect gentleman, a fair dinkum Aussie who made a lasting mark on Australian life, politics, racing, mining, agriculture and aviation'.
Mark McGinness, who penned Ceb's obituary in the Australian, hit the nail on the head when he said that Ceb Barnes was `a quintessential Australian gentleman: tall, vigorous, adventurous, well dressed, wellmoustached, well read, self-contained but never strident in his opinions'. I cannot help thinking that if more of us strove to follow his example there would not be the community disenchantment with this House that we have heard over the last two or three years. He certainly set the bar high for the rest of us. Along with the Prime Minister, the Leader of the Opposition and the Deputy Prime Minister, I extend my sympathy to the Barnes family on the passing of this great Australian.",REPS,<title>CONDOLENCES</title>,"<title>Barnes, Hon. Charles Edward `Ceb'</title>",Condolences,15,1
"Moore, John, MP",LP,1998-11-10,"—Ceb Barnes was a friend of my father's and a person I knew quite well. He was one of nature's gentlemen who frequently came from the rural countryside of Queensland. His family, the late J.H.S Barnes, owned a station in North Queensland and, if history serves me right, in 1917 it was acquired by the then state government at a time when they were taking on any number of private enterprise projects, including coke ovens, mines, smelters and other things, and from that he moved to Canning Downs.
As the Prime Minister outlined, Ceb Barnes left school in 1918, but the Prime Minister did not outline the fact that, after that, Ceb Barnes went exploring. He walked around Cape York and did quite a number of goldmining operations on his own. In that time he grew to know the bush in the north particularly well, and that is why he took such an 
 interest in Aboriginal affairs when he came to this House.
As the Leader of the Opposition said, Ceb Barnes was interested not only in the Aboriginal people of Australia but also very much in the development of New Guinea, where he was interested in, firstly, mining and also in the people in the area. When he came here to take up the ministry of external affairs, as the Leader of the Opposition quite rightly said, he was not particularly well liked by the southern press, particularly the Sydney Morning Herald, which used to refer to him as `Mr Charles Barnes' and then go on to the many derogatory comments that went with it.
When Artie Fadden decided to retire, Ceb Barnes was a very well-known identity on the southern downs. As the Member for Hinkler said, Ceb Barnes very reluctantly—because he was not that sort of guy; he was not the sort of person who sought publicity—took on the nomination and came here in his quiet way and succeeded at quite a late age. When he retired in 1972 he took with him, I think, an ideal life of a country man of that age. My sympathy to his family.
Honourable members having stood in their places—",REPS,<title>CONDOLENCES</title>,"<title>Barnes, Hon. Charles Edward `Ceb'</title>",Condolences,15,1
