name,party,date,text,chamber,debate_title,subdebate_title,debate_type,debate_id,subdebate_id
"Adams, Dick, MP",ALP,1999-02-15,"—I want to use this time to talk about literacy and the `read for the dole' program. Literacy is something that I am not only very familiar with—and I have been active in promoting it both in parliament and outside; it is a very personal part of my own past.
There are a number of myths being perpetuated, especially by the Minister for Education, Training and Youth Affairs. In a press release dated 15 September 1997, he said:
. . . the system is failing tens of thousands of children. It is feeding the unemployment queues and denying children basic skills to participate fully in society.
He has continued, on television and in other pronouncements in parliament and in the media since that time, to build up a perception of a literacy crisis. This set the media off looking for new systems of teaching literacy and for scapegoats for the current problem. A whole host of people have been trying to make money out of teaching the illiterate to read.
I have been looking at what some of the professionals have been saying about this so-called crisis. I have my doubts that we are any worse off than we were, say, 20 years ago. From some work done by Associate Professor Brian Cambourne of the University of Wollongong, I learnt that in the past 20 years three major studies into adult literacy standards have been conducted, and they cast doubts on the claims that there is a literacy crisis. 
A report by Goyen in 1974-75 found that the illiteracy rate was 1.6 per cent among the under-30s but 11.9 per cent among the over-60s. Wickert's 1987-89 study found that, on document and prose reading tasks, more people scored above the mean than below. Both studies found that there were more literacy problems with older and non-English-speaking background groups, and this was also supported in the 1997 study of adult literacy undertaken by the Australian Bureau of Statistics.
Another report, Mapping Literacy Achievement, which was the official report on the 1996 National School English Literacy Survey which involved 8,300 students in years 3 and 5 in all states and in both government and non-government schools, found that indigenous students, students from poor socio-economic backgrounds and students who come from non-English speaking backgrounds experience literacy problems.
But there was a wide range of literacy achievement among Australian children. The top 10 per cent of students in each year are working about five levels ahead of the bottom 10 per cent—not exactly a crisis, more of a skew, with the skills at the bottom level being more difficult to deal with. I am inclined to agree with Andrew Macfarlane, who carried out an analysis of that study which he believed Dr Kemp wanted to use for his own agenda in describing a literacy crisis. Mr Macfarlane commented that while the figures were interesting they probably showed the increasing gap between the socio-economic groups as students got older. But the study was cautious, as it was supposed to be used for setting benchmarks.
I am not satisfied that the big cry of crisis in literacy is valid in the way that it is being portrayed by the minister. It is certainly no worse in children than it was 20 years ago, and in most cases a lot better than in many other developed countries. However, it is not the time to be complacent. I will now quote from the Australian Council of Adult Literacy. Going back to the Wicker study, she found there was a need to use a different definition of literacy from the literacy campaigns of the past. Literacy was no longer 
 seen as the achievement of a basic threshold of reading ability but as integrally linked with how adults use literacy in their everyday lives.
The OECD definition is `how adults use written information to function well'. This report goes on to describe how they develop the tests and the assessment processes and come up with a way of arranging scores grouped at five different levels. I would like to quote directly from the findings of this Australian survey:
A part of the survey was designed to assess participants perceptions of their literacy and numeracy practices. Seventy four per cent of those surveyed do not write regularly—no more than a page once a month at the most.
Twenty five per cent said they never have to write at work and sixty per cent do not read very often—perhaps once a month. Twenty eight per cent said they never have to use maths skills at work. Fourteen per cent of people stated they need help with reading information from government and business and ten per cent wanted help with filling out forms.
When we look at the actual performance of the survey tasks, all of which were considered to be reasonably familiar, and were in common use, the following extrapolations can be made about the levels of literacy skills of Australians aged fifteen to seventy four:
Level 1—2.6 million people
Level 2—3.6 million people
Level 3—4.8 million people
Levels 4/5—2.3 million people.
Based on these and other findings, we can infer that almost half the adult population in Australia can be expected to have difficulty coping with the information processing demands of everyday life. In addition, it was reported that people who are currently unemployed have much greater difficulty than those who are in the work force, and that literacy difficulties appear to increase with age (except for the 15—19 year old age group), particularly for non-English speaking migrants.
Across the whole sample, of people who did not speak English as their first language, approaching half were at the lowest level on the scale. More surprising, perhaps, is that fourteen per cent of those who first spoke English are also at that level.
They finish up by saying that despite the limitations of their study there is clearly cause for concern about adult literacy and numeracy 
 and that funding should not be cut for those struggling with reading and writing.
This report has not dealt with the compulsory side of the government's program. However, it highlights where the problem really does lie. This is backed up by the volunteer tutors—to whom I personally owe so much—who have been working with the problem for many years with little reward. I would like to put on record a letter written by some of those tutors, who are very concerned at the way things are going in adult literacy. The people concerned are Betty Anderson, Jean Lee and Peggy Wolfe, who are wonderful volunteer tutors in the Southern Tasmania region. They wrote a letter to the Hobart Mercury on 11 February which says:
We urge the federal and State governments to provide access to adult literacy and numeracy support for all Australians.
Referring to the recent federal speech, `The Australian Way', we applaud the Prime Minister for expanding the age range in which mutual obligation policy is to include all unemployed people. However, it does not cover all the people who have literacy problems. We feel it is not sufficient, nor should it be compulsory.
An OECD survey conducted in Australia in 1996 shows there are more people who need assistance than those targeted by the Prime Minister. Adult literacy should cater for all adults, employed or not. Why should those in society who are employed or not seeking work and come forward voluntarily be discriminated against? Many people need literacy assistance for job retention, promotion or job change. Others simply seek to improve their quality of life. The current allocation of training hours by the Tasmania State Training Authority to access equality in Tasmania is six per cent, compared with the national average of 17 per cent. Adult literacy and basic education, as one of a diverse range of providers, does not have enough training hours with current funding to meet the needs of clients.
Training in Tasmania would be on a far stronger foundation if access and equity funding were increased to 17 per cent. We feel it is essential that a comprehensive 
 Tasmanian and Australian adult literacy and numerary program be developed to meet the needs of all adults who seek assistance. Another letter actually fingers what I believe lies at the bottom of the problem. Alis Jacob of Kingston asks:
Is illiteracy the real issue or is the fact that the Government cannot adequately justify the loss of opportunities for job seekers across Australia and evident demise of Centrelink?
If this is all about jobs and trying to make people responsible for their own inadequacies, it makes it a pretty rough life when they were not able to do anything about it at the time when they were best fitted to learn.
Gaining literacy must be done at a time when the brain is most susceptible to experimentation and learning, which is when we are young—in family life, at child care and at kindergarten. When a family has no history of reading at home or having books and bedtime stories, it is unlikely that children will be suitably prepared to understand what reading is all about. Learning early and using words and language as games and as something that is stimulating is easy for them. It becomes fun and they feel they are achieving with a base of some sort to build on. School becomes an exciting place and it is possible to build on earlier experiences.
You could hardly say the same of a 24-year-old who has no reading or writing background in family life or anywhere else and who has hidden his disability by looking for employment that does not require either of those skills. Sitting in a classroom with others being forced to undertake lessons is likely to alienate them further. They will feel angry and resentful. They will at best learn whatever is necessary to get them their money and at worst be disruptive, drop out and do whatever is required to acquire a means of living. That leaves them not much more than a life of crime. Neither will be literate in the real sense of the word. It is not their fault that they did not learn as a child. There would be a host of reasons they did not learn. I doubt very much if they would understand the theories of mutual responsibility in relation to literacy—and for good reason. To them, it is really a load of cow manure.
As the reports I have quoted point out, adults and particularly older adults have all sorts of reasons for not reading. Some never went to school. Others went but left early without mastering basic literacy. Others can read and write enough to do basic daily tasks and read the newspaper headlines but would be completely at sea if asked to write a report or develop an argument on something they had read. The other problem is that the concept of work has changed. No longer can people learn on the job. Most jobs require a person to be slotted in at a certain level with all the skills present. You cannot start by making the tea and finding a mentor who can help you through, as did so many of our older achievers in this world.
The government is using its failure to provide this sort of start-up training—it was available under Working Nation, I wish to add; it was there—to penalise the unemployed, to blame them for failing to find work because of their literacy level. Therefore, they must be punished: `No dole. You have failed.' The government will succeed in putting up the crime rate and enlarging the black market, GST or no GST. There is no way out. It is a bit like Emil Zola's Paris—degradation and poverty being the prize, even for the most enterprising person. It is not surprising that something like 70 per cent of those who have been in gaol have literacy problems. As Gregory D. Watson so eloquently put it:
Illiteracy is tied to a cycle of poverty or low income status, undereducation, dependency, poor health and crime. For those who cannot read or write, access to education and good jobs is limited. There is a constraint on their social climb no matter how industrious. Socially the illiterate are disenfranchised. A person who is illiterate, or even functionally illiterate, may have little or no voice in the democratic process. Others decide what is best for them. They are unaware of the great events of history through the richness of literature, the drama of human life on a larger scale. They are unaware of themselves in the context of an evolving world culture they cannot understand. They are oppressed, in no mild sense. What was the privilege of a few has become the birthright of the masses.
How about we start addressing the problem at the real end of it? Flying start programs can help children before they start school and should be part of any assessment for literacy 
 assistance. We can encourage parents to read to their children, helped through adult literacy programs. Reading for a non-critical audience is great practice for those whose skills are limited. We can encourage people to want to learn, not force them with the sword of Damocles hovering over them. There should be more funding to help volunteers continue their good work. Volunteers can help on a one-to-one basis. They are the people that set up a student to go on to the next step—the one that actually gives them the formal qualification.
Parliamentarians should not use disadvantaged people as the scapegoats for their own inadequacies. They should learn more about why they are in the situation that they are and do something about it.
Madam Deputy Speaker, earlier tonight in a speech on the grievance debate you mentioned that the Work for the Dole program was a good one and that 40 weeks would be available for training. Taking the example, again, of a 24-year-old, what chance will he be given of a job by this government? Will he be guaranteed a job once he has done his compulsory reading and numeracy training? Will it be there when he finishes his class? As with our Working Nation, which was not perfect, will there be some training alongside so that he can pick up on his literacy and numeracy at the same time? It is very difficult to learn otherwise.
When we talk, as the member for Ballarat did, about mutual obligation, it is the definition of mutual obligation that we on this side have a few problems with. Mutual obligation works two ways, not one. Working without training and without a future is the same as working in any jobs which were criticised in our time.	I call on the government to set some targets for jobs. They have not done that and they do not seem to want to do so. They bring in work for the dole and read for the dole, but they provide no targets. They give the Australian people no opportunity to make a judgment about their policies.
Let us get rid of this stupid idea of the Minister for Education, Training and Youth Affairs and put something into place that is going to work, to help people learn and give 
 them some dignity. If he does that he will be very surprised to learn that the cost will be a lot less than his current and future programs.
—I thank the honourable member for Lyons for his attention to my earlier address.",REPS,<title>APPROPRIATION BILL (No. 3) 1998-99</title>,<title>Second Reading</title>,Bills,10,1
