name,party,date,text,chamber,debate_title,subdebate_title,debate_type,debate_id,subdebate_id
"Nelson, Dr Brendan, MP",LP,1999-08-10,"—I rise to speak in support of the original Employment, Education and Training Amendment Bill 1999 , not the amendment moved by the member for Dobell. The bill seeks to do a number of things. As the member for Dobell correctly pointed out, it seeks to abolish the National Board of Employment, Education and Training and its subsidiary councils—these being the Australian Language and Literacy Council, the Employment and Skills Council, the Schools Council and the Higher Education Council. In 1987, under the chairmanship of Charles Holton, a task force report delivered to the then Minister for Employment, Education and Training, John Dawkins, recommended that there be a rationalisation of advisory structures in the employment portfolio. It has nothing to do with not understanding or not wanting to understand higher education or anything of the sort, as we have just heard.
One consequence of the establishment of the National Board of Employment, Education and Training was a loss of what were seen to be the positive attributes of the Schools Commission and the Tertiary Education Commission, from whose abolition it emerged. Firstly, their membership was largely representative of the sectors with which they dealt. Secondly, they were responsible for program administration and, consequently, had larger staffs and a greater capacity to set their own research and reporting agendas. Thirdly, the statutory conditions under which they operated had given them greater scope for independent action.
Governments of the day—and at the time, federally, that was a Labor government—and ministers in particular sought advice which 
 bore some relation to budgetary strategy, as any responsible government would. The new advisory arrangements were established by the Employment, Education and Training Act 1988. The critical features of the act were: firstly, a national board to report directly to the minister on all related employment, education and training issues, taking into account any written directions or guidelines from the minister on the government's broad social, economic and budgetary policies; secondly, four advisory councils would report to the board; thirdly, the new board would have no responsibility for program delivery, which would be left entirely to the department; and, fourthly, community based membership of the board and councils.
The Employment, Education and Training Amendment Act 1995 added the Australian Language and Literacy Council to the National Board of Employment, Education and Training structure—and the council had been operating as a committee of the board for several years. That is where all this was at at the time of the change of government in 1996. The government's 1996 higher education policy indicated an intention, as was always intended, to wind up the National Board of Employment, Education and Training—a measure which I would suggest was coveted by the previous government—whilst maintaining the Higher Education Council as an independent body reporting directly to the minister.
In June 1996, several months after the change of government, the Employment, Education and Training Amendment Bill 1996 was introduced to implement the election policy but it was not passed. Nonetheless, the board and the three councils wound up in response to a request from the then minister. The Higher Education Council and the Australian Research Council have continued to operate, with the board's activities being confined specifically to those councils.
The  Employment, Education and Training Amendment Bill 1999  abolishes not only the National Board of Employment, Education and Training but also the Australian Language and Literacy Council, the Employment and Skills Council, the Schools Council and the 
 Higher Education Council. The Australian Research Council will continue and will report directly to the minister. In the light of the recent release of the green paper, that is something that I suggest to the House is highly desirable. Its membership will continue unchanged. Whilst the Australian Vice-Chancellors Committee recommended that the ARC provide broad policy advice to the minister through the Higher Education Council, it nonetheless recommended that the ARC report directly to the minister on the distribution of grant funding and policies relating to its programs.
The opposition, through the member for Dobell, has made a number of points, most if not all of which need some refutation. There is no reason whatsoever on a scholarly basis to believe that the abolition of the National Board of Employment, Education and Training will reduce consultation in any way and it will certainly not reduce independent advice. What it will do is close desks in bureaucracy, possibly to open a few more in the classroom.
From what the member for Dobell has said, the opposition also has some interest in how the government will consult with other interest groups. The National Board of Employment, Education and Training, as I said, was established by the previous government, of which the member for Dobell was, I understand, a proud member. Times and funding mechanisms have changed and so too must the consultative mechanisms. The board and councils have already wound up, as I pointed out to the House, with the exception of the Australian Research Council. If expert advice is required in this area, as in so many areas of government policy direction, expert task forces can be established on an ad hoc basis. For example, we can rely upon the advice of the Business/Higher Education Round Table. I would not dare criticise its composition or its work.
I am sure that the member for Dobell would not criticise the advice that the National Council of Independent Schools Associations would give to government—or that of the Primary English Teachers Association, the National Catholic Education Commission, the 
 Australian Primary School Principals Association or the Australian Secondary School Principals Association. Are these not all sources of wise and well-informed advice to government?
We also have the centres for higher education research and development in Australia. The Australian National Training Authority also plays a pivotal role in, amongst other things, distributing vocational education and training funding to the states and institutions. The Australian Council for Education Research also does that. These and so many other organisations are, to some extent, funded by governments in one form or another and they provide a consistent and reliable source of advice without needing to maintain the National Board for Employment, Education and Training.
A number of existing representative bodies, some of which I have listed, also advise the government on issues that were once covered by the National Board of Employment, Education and Training and the four councils being abolished. Bureaucracy is very important and advice to governments of a high quality is particularly important. We need always to be asking ourselves whether maintaining any kind of board, statutory authority or, indeed, part or all of a government department actually serves the interests of not only the sector but, most importantly, the beneficiaries of it who fund it through their taxes and who ultimately should benefit from it.
Finally, the ARC will not only report directly to the minister but it will promote informed public debate on research in Australia. As the green paper on higher education research and research training actually sets out, it envisages quite a significant role in policy directions for the ARC—for which it has my full support.
Turning to some of the other points that were made by the member for Dobell, Labor, when it was in office, at times promoted higher education as the one and only definition of excellence in education. I felt that, for almost a decade, many young people were of the view that, if they did not achieve a university education and a degree, they were in some way of less value to their families and 
 society and that, even if they came out of university with two degrees, they were in some way inadequately trained. Seventy per cent of Australia's secondary students who did not go on to university could at times be forgiven for feeling that there was less of a place for them in Australian society.
The comments that the member for Dobell made about HECs and about how changes to HECs have discriminated against the interests of those seeking higher education fly in the face of reality. The reality is that, when the government changed in March 1996, only 15 per cent of students in higher education institutions in this country came from the bottom 25 per cent of income earning households. By contrast, 30 per cent came from the top 25 per cent of income earning households—with an average income then of $84,000 a year. Whatever one's definition of social justice is, I would not consider that to be my definition of it. In other words, whatever the previous government was doing to try to deliver equitable social outcomes, it was not succeeding. In other words, the taxes of blue-collar workers throughout the country were being used to fund the education principally of people who come, in many instances, from electorates like the one I am privileged to represent.
In some cases, if not many, teaching and learning in formal education took place outside the context of real life situations, activities and problems. It is essential in my view that both higher education and in particular vocational education and training take place in the context of their application. The pathways from school to university under the previous government for vocational education and training were frequently disjointed. The Dusseldorf Foundation, for example, in March last year when it published its report, Australia's youth—reality and risk, pointed out a few facts which might provide some discomfort to the Labor members of the House. It said:
We need to move from youth management to youth development.
It identified marginalised young people as being the unemployed, those who are not in the labour force or not studying and those 
 who are in precarious part-time employment. It identified the need in particular to address the problems of early school leavers. It also argued for an increased emphasis on schools to industry programs, as a consequence of which we now have the Jobs Pathway Program, which is a schools-industry partnership program, and schools, in many instances, acting as brokers. For example, $12 million was made available to them for the Jobs Pathway Program.
The Dusseldorf Foundation identified that, in 1999, this year, 15 per cent—or 187,000—15- to 19-year-olds were neither in part-time work nor in education. Of these, 70 per cent had not completed year 12. For every young person looking for work, at least one was locked into marginal activities fairly consistently for up to three years. By age 19 there had been no higher education or vocational education and training undertaken by those who had been unemployed for, in many cases, at least one-third of the time since leaving school. The report went on to say:
The key indicators for young people in leaving work during the 1990s either show no improvement or deterioration.
In fact, the key indicators for young people in learning and work during the early to mid-1990s show either no improvement or, as I say, deterioration. Youth unemployment in 1996 was no lower in real terms than it was at the beginning of the decade. Year 10 retention rates had fallen below 1990 levels. Year 11 was below the 1991 level and year 12 had fallen to the 1991 level. Those not completing year 12 were identified as being more likely to enter part-time work unlinked to study than year 12 leavers. That essentially is the picture with which the Howard government was presented in March 1996.
One of the assertions made by the member for Dobell is that enrolments in higher education are declining. Since the introduction of HECs by the Labor government in 1988, the number of enrolments in higher education in Australia has almost doubled. If there has been any slowing in the rate of application for higher education positions in Australia, it owes more to the substantially increased funding made available for new apprentice 
 ships and traineeships under this government and to programs which enable people to undertake vocational education and training as distinct from pursuing higher education and a degree. As I said earlier, young people were studying for degrees when, in their hearts, they were uncertain about whether they would have a job when they were finished and whether the degree was relevant to their personal interests.
Some of the other points need to be refuted. Firstly, in this budget this year—1999-2000—the government is committing over $11 billion per annum over the forward estimates for education and training. The budget saw an increased funding of $870 million for education over the next four years. This budget of over $11 billion includes approximately $5 billion for schooling, $4.2 billion for universities and $1.6 billion for vocational education and training at TAFE and through private providers. This year, direct Commonwealth funding to government schools has increased by 6.8 per cent or $115 million over the previous year.
The point that is lost in the debate, if you can describe it as debate, between the opposition and the Howard government on funding for public schools is that they are called state schools traditionally because they are funded by state governments. The Commonwealth government is not the primary funder of public schools; it is state governments. From memory, I think only 12 per cent of state school funding actually comes from the Commonwealth, but that proportion that is provided by the Commonwealth increased this year by 6.8 per cent. The government has also undertaken reforms to raise literacy and numeracy standards in the early years of school, extending it to secondary level with additional funding of $130 million over the next four years for early and middle years. Therein lies another point that ought to be made. I see that a recent survey found that those who purport to represent the interests of parents in state schools, or public schools, are actually out of step with the people they purport to represent, that over half of the parents surveyed actually disagreed with the 
 policies being espoused by those representing P&F representative organisations.
Australia's students and teachers are going to benefit from $77 million in the quality teacher program over three years to update teacher skills. And so on it goes. In terms of universities, there is another $93.3 million increase over the previous forward estimates, bringing funding to a total of $288 million over three years, and strategic partnerships with industry research and training grants will be allocated another almost $60 million funding to forge stronger links between industry and universities, bringing it to $162 million over three years.
One of the other points that I think ought to be made which is perhaps more of a philosophical nature is that in undertaking these reforms, in abolishing the National Board of Employment, Education and Training and undertaking the other reforms which are included in this bill, we need to reflect upon what is actually the purpose of education. One of the debates that we have not really had is whether education increasingly should be seen to take on a purely utilitarian view or whether on the other hand education should be about learning for life, about education itself. One of the concerns I have is that, increasingly, young people are pursuing training as distinct from education. I say that as a person who was trained as distinct from educated. One of the most compelling speeches that I have read on this was given, not surprisingly perhaps, by Professor David Penington to the Melbourne Winter Conversazione for 1995. I will just quote a couple of things from that address. He said:
The rapid changes that are occurring in the world of work mean that vocational education must increasingly be accompanied by general education. Otherwise, graduates will be trained in skills which will fast disappear and they will be left with little capacity for adaptation and change.
He went on to say:
Control of education to an undue degree by central government in terms of detailed prescriptions of a uniform kind, whether these be national curriculum frameworks or uniform indicators of performance for all institutions of higher education, carries profound dangers. Unless the diversity of human potential is recognised and adequately catered for, 
 not only will individual young people be the losers but the future development of society itself will also suffer.
It is time for countries such as our own to rethink their approaches to education in order to achieve what he described as the proud Confucian tradition of Asian nations in respect for teachers and for education. If we do not, he warned, we could be left far behind. I speak strongly in support of this bill. It is a move in the right direction. It reduces complexity of administration and increases consultation.",REPS,"<title>EMPLOYMENT, EDUCATION AND TRAINING AMENDMENT BILL 1999</title>",<title>Second Reading</title>,Bills,11,1
