name,party,date,text,chamber,debate_title,subdebate_title,debate_type,debate_id,subdebate_id
"Hall, Jill, MP",ALP,1999-08-10,"—The Employment, Education and Training Amendment Bill 1999  seeks to amend the Employment, Education and Training Act 1988, to abolish the National Board of Employment, Education and Training—NBEET—and its subsidiary councils: the Australian Language and Literacy Council, the Employment and Skills Council, the Schools Council and the Higher Education Council. All these councils and NBEET have had a long history of providing quality reports and quality scrutiny and advice to governments. This bill also seeks to amend the act to retain the Australian Research Council, which will report directly to the Minister for Education, Training and Youth Affairs. At least we can be grateful for the fact that one of these councils is going to survive the minister's assault.
This is the Howard government's second attempt to abolish NBEET. The 1996 legislation did not progress through the parliament. The difference between this and the 1996 legislation is that the Higher Education Council is also a casualty of the minister's knife, slicing into the councils that have operated independently in our country, looking at the education, training, skill and employment needs of Australians. We might ask why the minister has gone down the path of deciding to abolish the Higher Education Council when previously he had decided that maybe it did have a role to play and that he would leave it in place. I would like to argue that the reason he is abolishing that council is that he does not like what it is saying. It is the same old story: if you do not like the message, shoot the messenger.
The 1992 report looked at the impact of the government's HECS policies in 1991 and it showed that there was no impact on socially disadvantaged students. Unfortunately, the 1997 report was not quite as convincing in what it had to say. It indicated that government policies were impacting on socially disadvantaged students. There had been a drop in enrolments and, generally speaking, all the indicators that were in place showed that this government's policy was attacking those people who needed the most support to be able to attend university and gain an education, to be put on the same footing as other students who came from a more socially advantaged background. The 1998 report, which was looking at this issue in a little bit more depth, has been lost. Where it is no-one knows. Hopefully it will turn up, but I suspect it will not turn up whilst this government is in power.
The Howard government has really had a vendetta against universities and those students who are not socially advantaged. They have cut the operational grants to universities and they have reduced the HECS repayment threshold. Even the changes that they have made in the area of youth allowance have impacted on students attending university. I have a son and daughter who both go to university, and I have only to listen to them and their friends talking. They worry about the huge debt they are incurring. They know that the policies that this government has put in place are affecting their ability to obtain education. A number of their friends whose parents are unable to support them have had to leave university and get jobs. Some of them are able to attend on a part-time basis, but overall this government's policies are biting and affect the most disadvantaged students.
I think their policies are having the effect that the government want; they are making sure that it is only those people who have money, who are wealthy, the so-called elite—their friends—are the ones who can access university education. Even before the last election, when I was out doorknocking I came across a young woman who complained bitterly to me about the way she was having 
 to pay back many thousands of dollars because of the changes this government had made to the HECS repayment threshold.
University education should be there for everyone. It should not be there only for the wealthy and the elite. It should be something that ordinary Australians and ordinary Australians students who attend public school can access. I really do not believe that is the case with this government. The Howard government's 1999 education budget directed dollars to students attending private schools. They received 21 times more money than public schools. This means that those private schools, particularly those elite private schools, are going to have greater resources. They are going to advantage those students attending those schools: they will have more computers; those students interested in sport will have greater access to elite sporting programs; and all the time the gap between those who are socially advantaged and those who are socially disadvantaged will get bigger and bigger.
This is this government's idea of cross-subsidisation: subsidise the wealthy private schools at the expense of the public schools. I have grown up with the concept that you help those people who need assistance, those in greatest need. But this government says, `If you have got money, if you are advantaged, we will give you a bit more.' Students who are attending public schools are disadvantaged by this government's policies. Then they are disadvantaged by the impact of this government's policies when they attend university. Once again, it is making education affordable and accessible only for the wealthy. Abolition of the merit based equity scholarships has been a further step down the path of supporting those who have at the expense of those who have not or those that are more socially disadvantaged.
The minister is closed to any new ideas or anything that is different from his own ideas. He has pushed through his ideas relating to student unions and pushed for voluntary student unionism. Even his programs that look at literacy and numeracy are about testing rather than about actually improving the literacy and numeracy skills of students. The 
 minister and, I am afraid, the Prime Minister are both idealogues. They are trapped in the 1950s and they cannot get out. This government is an antieducation government, a government that supports only organisations, groups, boards or councils that support its points of view, its doctrines, its ideology.
That is why NBEET was doomed. NBEET was a body that offered independent advice and had independent, new ideas—something this government objects to. You must fit inside the box, you must be philosophically correct, you must lack innovation, you must be controllable. If you are not, you are out, you are cut, you are abolished—it is the end of you. And that is the problem with NBEET and its councils. The councils had community representatives. We all know what this government thinks about community representatives. Its attitude is: `We don't want the community to be involved. We don't want the community to have a say. We don't want any of those ideas to sneak into a report to the government.' Otherwise, it may actually have to look at them or consider them. It wants people it can control. Therefore, what do you do? You abolished the board and its councils.
NBEET has been effectively abolished for some time, because this government has failed to appoint new members to it, and it has been retained only in form and not as an operational body. Yesterday we had the republic debate, when once again the government showed that it would not accept the views of anyone that did not agree with it. The Prime Minister was hell-bent on making sure that he presents a question to the Australian people that is in line with his ideas and that provides him with the best opportunity to get the result he wants. He totally ignored the recommendation of a bipartisan committee. Today we have the government introducing legislation to abolish an independent board and independent councils. It is very much the way this government operates. You have to agree with it, you have to follow its ideology, or else you are out. So yesterday it was the report and the recommendations of the Joint Select Committee on the Republic Referendum; today it is NBEET.
I support the amendment moved by the shadow minister, who is committed to a whole-of-life cross-sectional approach to education. He recognises the importance of a knowledge and skill based society. We must have a cross-sectional approach to education, training and employment. We live in a changing society where education, training, skills and employment needs are paramount. We are looking at very different types of issues in these areas from those we looked at in the past. We are looking at the need for accreditation, credit transfer and pathways. Even school education is very different from the way it used to be. You have students who are involved in vocational education where part of their schooling is done within the traditional classroom, another part of their education may be done at TAFE and another part of their education may be obtaining skills out in the work force.
Our education system, our approach to learning, training and developing skills must be able to encompass this. But I am afraid that this government does not feel that way. That is why it is abolishing the board. That is why it is going to abolish the councils—cost-effective bodies that provided advice to government on education and training for a number of years. The government does not want advice, because it is caught in its ideological warp. Australians are being disadvantaged and left behind because of this government's approach. Governments need independent bodies that can stand back, review policies and make recommendations for new policies and new initiatives. They need to get advice from bodies other than the departments, and they need to get ideas that go outside their own cabinet, their own party room, But this government refuses to do that. You need to look at what works and what does not work. You need to recommend new strategies to meet the needs of our high-tech society. If we do not do that, Australia is going to be left behind. And that is what this government is doing: putting Australia in a position where it will be left behind the rest of the world.
Unfortunately, this government is so tightly locked into its ideology and its 1950s view of 
 Australia that it continues to attack those programs that do not match its philosophy. We have seen the Jobskills program go. We have seen changes to apprenticeships that are disadvantaging young Australians. The Jobtrain program, a skill based program that provided training to people in areas that were identified as areas of need, has gone. LEAP, a program that was designed to help young Australians get skills and formal qualifications while getting experience working on the job, has gone. What has it been replaced with? Work for the Dole. It is a narrow approach that is designed to say, `If you are getting any sort of assistance from the government, we want you to go out and work and pay for it.' It is not about getting skills, it is not about getting education and it is not about getting training.
This government stands condemned for its failure to deliver the programs that will meet the educational and training needs of Australians, a failure that is leading to a society where Australians lack the skills they need to find employment in a highly technical, knowledge based society. The amendment moved by the shadow minister would assist Australians to meet the challenge of the new millennium—something that John Howard's 1950s style government cannot do and something that attacks on independent bodies like NBEET and its councils will not achieve.
Sitting suspended from 6.30 p.m. to 8.00 p.m.",REPS,"<title>EMPLOYMENT, EDUCATION AND TRAINING AMENDMENT BILL 1999</title>",<title>Second Reading</title>,Bills,11,1
