name,party,date,text,chamber,debate_title,subdebate_title,debate_type,debate_id,subdebate_id
"Schultz, Alby, MP",LP,1999-02-15,"—I move:
That this House:
(1)	 places on record concern about the lack of sufficient funding for clinical trials for the treatment and prevention of breast cancer;
(2)	 notes that over 8000 women will be diagnosed with breast cancer in 1998 and that over 2700 women will die of breast cancer in that year; and
(3)	 calls on the Government to consider infrastructure funding which will give the foundation and security for planning and completion of quality, evidence-based research.
Breast cancer is the most significant women's health issue facing this country today. This insidious disease is the most common cancer in women, resulting in approximately 2,700 Australian women dying from breast cancer each year.
Ten years ago, my wife and I became actively involved in raising the awareness of breast cancer in women within the community. My wife, Gloria, through her personal public awareness, educational and fundraising activities, has been instrumental in successfully contributing towards the purchase of two mobile mammography screening units, which operate out of Wagga Wagga in southern New South Wales and the Australian Capital Territory. In 1998, one of these mobile units screened 4,173 women in rural communities in southern New South Wales and northern Victoria.
In 1994, the then federal government finally identified breast cancer as an area of priority 
 for the funding of medical research through the National Health and Medical Research Council. Funding of $16.4 million over four years was announced for the coordination of research findings and dissemination of accessible information, for both doctors and patients, on best practice, treatment and management.
Today, the total amount of funding specifically targeting breast cancer research is in the vicinity of $5 million. The break-up of Commonwealth funding is approximately $3.2 million through the NHMRC, $1 million through the Kathleen Cunningham Foundation and half a million dollars through the CRCs. This compares with funding of $12 million per annum from the Commonwealth government toward Australia's national research effort in HIV-AIDS and related diseases.
I have absolutely no problems with government funding strategies such as the HIV-AIDS strategy. I do, however, have concerns about disproportionate amounts of funding going towards other diseases, while breast cancer has a fatality rate in women five times greater than the fatality rate from HIV-AIDS.
Information I have sourced from the National Breast Cancer Centre regarding breast cancer research shows that the largest source of funding is money provided by syndicated groups. Syndicates are formed by investors or groups of investors who acquire intellectual property as a consequence of their investment in research. Research funded by syndicates is generally not peer reviewed. The $3.69 million of funding for breast cancer research identified in 1996—and it is a deplorable state of affairs when in this House we can only quote figures that were relevant in 1996—represents only two large projects, each of which represents a wide field of inquiry which includes, but is not exclusive to, the area of breast cancer.
The next largest funding source for breast cancer research in Australia in 1996 was the NHMRC, which provided $3.27 million. The NHMRC advises the Commonwealth government on the allocation of funding for medical and scientific research and is responsible for about 40 per cent of Commonwealth funding, the majority of the rest being allocated via 
 infrastructure and salary support for researchers in universities.
The third largest source of funding for breast cancer research is the state and territory cancer organisations. These organisations contributed $1.9 million directly to breast cancer research in 1996, including funds allocated to epidemiology and behavioural research units in some states. In addition, the state and territory cancer organisations  contributed a further $314,000, indirectly, through the Kathleen Cunningham Foundation. Funds from the state and territory cancer organisations, therefore, total approximately $2.21 million.
There needs to be more funding for clinical trials for the treatment and prevention of breast cancer. There is currently no government funding which covers infrastructure—which means that planning is very difficult and clinical trials can take many years to complete. Less than 10 per cent of women who are diagnosed with breast cancer in Australia are currently able to participate in a clinical trial that has the benefits of access to new treatments. Clinical trials have been identified as the most important avenue for advances in treatment to cure more women. Urgent strategies are needed to increase to 25 per cent within three years the number of women who can get access to and participate in a clinical trial. This is the single most important strategy that can have an early impact on reducing the appalling death rates for women in Australia with breast cancer—50 women die every week in this country.
A woman who participates in a clinical trial gets optimal care, but the benefits are available to too few women in Australia at present and this is a funding issue—particularly infrastructure funding. Australia has done more recently to fund breast cancer research. The problem is the research is fragmented all over Australia at different levels with different aims, using different techniques and in many instances various groups are not working cohesively. We need to pull these groups together, increase funding and do more to lower the morbidity and death rate resulting from this disease. We still lag behind the United States on a per capita basis.
We should build on the outstanding performance of national clinical trials through groups such as the Australian New Zealand Breast Cancer Trials Group to encourage more collaborative research, internationally and nationally, and, with laboratory research, to optimise evidence based research through the groups. This will benefit all women in Australia. Infrastructure funding will give the foundation and security for planning and completion of quality, evidence based research more quickly.
The government needs to revisit the issue of breast cancer research funding for clinical trials for the treatment and prevention of breast cancer. Each year, 8,000 Australian women are waiting for us to act. There are obviously some exciting things happening in breast cancer research in the world today, including the use of laser technology to kill cancer cells. This exciting innovation of using a needle to penetrate the breast followed by a laser beam which kills cancer cells within the breast itself offers an opportunity to dispense with lumpectomies and mastectomies which cause significant physical damage, trauma and pain to women undergoing these operations.
This type of research, which is being undertaken in the United States, is heartening, as is the work of Dr Vasso Apostolopoulos, a young women who has identified a revolutionary new formula MF-P which stimulates the body's T-cells to fight the growth of cancerous tumours. Trials of MF-P, which were made possible through the multimillion dollar New Idea Breast Cancer Fund, have shown the most positive results so far in women suffering advanced breast cancer. It is being trialed again on patients who have recently been diagnosed. If the trials go well, a vaccine could be available within five to 10 years. Lack of money for trials needed to put this drug on the market is the prime reason for the five to 10 years delay in this formula being available.
Handing out research funding willy-nilly for short-term political gain or because vocal and indeed powerful lobby groups use their political influence is not a responsible reac 
 tion to critical national health issues which face governments from time to time.
Breast cancer research is not attracting the funds it should be. As I have said, approximately 2,700 Australian women die from breast cancer each year and 8,000 Australian women are diagnosed with breast cancer over the same period. These women need our help. While early detection of breast cancer using mammography screening assists in lowering the morbidity rate in women, breast cancer research is the key to finding a permanent cure for this insidious disease in women. While the current government has recently increased funding for breast cancer projects, we need to do more. Funding for breast cancer research is not sufficient and I call on the government to make more funds available.
I thank the House for allowing me this opportunity to talk on this very sensitive women's health issue.",REPS,<title>PRIVATE MEMBERS BUSINESS</title>,<title>Breast Cancer</title>,Private Members' Business,1,1
"Plibersek, Tanya, MP",ALP,1999-02-15,"—I rise to support the motion by the member for Hume on breast cancer. Breast cancer is a major issue of concern for Australian women. Certainly, more Australian women die from breast cancer than from any other form of cancer. About 2,700 Australian women die each year from breast cancer and one in 11 women are diagnosed with breast cancer during their lifetime. The research response in Australia needs to be well funded, co-ordinated and relevant to the Australian context.
To date our major response to breast cancer has been a national population-based screening program. In June 1990, the ministers responsible for health in all states and territories joined the Commonwealth in agreeing to jointly fund a national mammography screening program. In March 1990, Prime Minister Hawke announced that the Commonwealth government would implement the National Program for the Early Detection of Breast Cancer and committed $64 million in the 1991-92 budget for that program. In the 1994-95 budget, the Commonwealth committed a further $236.6 million over five years from 1994-95 to 1998-99 to continue the program.
The National Program for the Early Detection of Breast Cancer, now known as 
 Breastscreen Australia, was established in 1991 and is now recognised as one of the most comprehensive population-based screening programs in the world. The program provides free screening mammograms at two-yearly intervals mainly to women between the ages of 50 and 69 years. Breastscreen Australia operates in over 500 locations nationwide, via fixed, relocatable and mobile screening units. Screening has increased significantly since commencement of Breastscreen Australia in 1991, with over 52,000 women now being screened each month. The program's aim is to reach a participation rate of 70 per cent among their target group. At present, unfortunately only 54 per cent of women in the target group are being screened.
Mammographic screening is the most effective method of prevention currently available, but it is certainly not fully effective. Early detection while the cancer is still localised in the breast means that women have a 90 per cent chance of survival after five years, whereas if the cancer has spread, the survival rate after five years is only 18 per cent. So the importance of early detection is plain from those figures. However, screening only has a reduction of about 30 to 35 per cent in the death rate from cancer which means that unfortunately the majority of women who are screened still die from breast cancer. That shows us the importance of continuing research in other areas of treatment, certainly in the causes of breast cancer.
The member for Hume has detailed a number of the funding sources for breast cancer. Certainly, the National Health and Medical Research Centre provides a number of breast cancer projects. They also give block grants to the Garvan Institute of Medical Research, to the Walter and Elizabeth Hall Institutes and to a number of other projects which are looking at breast cancer.
They have also set up the National Breast Cancer Centre, which was provided with $16.4 million over four years to coordinate research findings and to disseminate accessible information to patients and doctors on best practice, treatment and management.
In 1996 the National Health and Medical Research Council  tallied up breast cancer 
 research for that year, and it was sadly only $12.24 million at that time, which I do not think compares favourably with the amount of money we have spent on things such as the advertising campaign for the tax package in the lead-up to the last federal election.
But more money for breast cancer research is only part of the challenge. The other challenge is coordinating that research to make sure it is effective. The important challenge is to make sure that every dollar of breast cancer research is well spent as well as increasing the actual amount that is spent. The National Breast Cancer Centre has suggested that a National Action Plan for Breast Cancer Research be developed to ensure that level of coordination. The centre said:
This would provide both government and community with confidence that their funds are being used well. A National Action Plan for Breast Cancer Research which brought together key players and developed a coordinated approach would ensure that funds available for breast cancer research are used optimally through a rigorous peer review system, reassure the community that potential duplication of effort was being avoided, and offer the opportunity for fostering research in areas where additional effort is needed.
They suggest that that plan could have input from the National Health and Medical Research Council, the Kathleen Cunningham Foundation, the National Breast Cancer Centre and the various other research institutes and government departments which have a role in undertaking research in this area.
They suggest that the plan should emphasise the importance of a competitive peer review process for allocating the funding that is available, and continue support for existing research activity, because that activity is already in line with a number of priorities which have been identified as areas for further research, such as biological causes, genetic factors, development of new treatments, risk factors, evaluation of new treatments and diagnosis.
The plan should also undertake further research in areas that are perceived as important by the consumers of breast cancer research but where little research is currently undertaken—that is, psychosocial and supportive care, and alternative therapies. The breast 
 care centre suggets that, with the knowledge that government funding will continue, it is very important not to have any duplication of research. One of the roles that they suggest that either the National Health and Medical Research Council's National Breast Cancer Centre or the Kathleen Cunningham Foundation can play is in providing something like a clearing house for breast cancer research that is currently being undertaken. This would prevent duplication but also allow collaboration between researchers so that money can perhaps be used more effectively by piggybacking on existing research in other areas.
The other particular point that I wanted to make today is that Australia has a relatively small and diffuse population, so one of the challenges for us in an Australian context is to make sure that we take up challenges that may not be covered by research from other countries. One of the most pressing issues is investigation into the experiences of Aboriginal and Torres Strait Islander women with breast cancer. We also have to have a very serious look at the experiences of women living in rural and regional areas—their access to screening and treatment, to peer support networks and to supportive doctors and other clinicians.
The other area I briefly wanted to mention is the success of the use of public figures talking about their experiences with breast cancer. Many people in the Australian community would have read of the experiences of Belinda Emett, the young actor who was only 24 years old when she was diagnosed with breast cancer. The experiences of someone in that position who is willing to share those experiences certainly provide a role model for young women so that they continue to do regular breast self-examination and seek prompt treatment and attention as soon as they have any problems. It is an interesting fact that over half of the breast cancers that are diagnosed in New South Wales are bigger than two centimetres. (Time expired)",REPS,<title>PRIVATE MEMBERS BUSINESS</title>,<title>Breast Cancer</title>,Private Members' Business,1,1
"Moylan, Judi, MP",LP,1999-02-15,"—I take this opportunity to congratulate my colleague the member for Hume for bringing the matter of breast cancer once more to the attention of the House during private 
 members' business. The first time I spoke on this matter in this place was as a new member in 1993 when there was also a motion put forward by one of my male colleagues, the then member for Cowan. It is heartening indeed to see our male colleagues take such an interest in, and have such a commitment to, supporting the research for breast cancer in this country. I know that the member for Hume has had a long association with this issue with his wife, Gloria, who has been a very strong campaigner for better diagnosis of breast cancer and has continued to push for more money for research.
In the latest edition of a publication put out by the Australian Institute of Health and Welfare, the Australasian Association of Cancer Registries and the NHMRC National Breast Cancer Centre, the latest figures that they have published on this go back to 1996, when there were 9,556 new cases of breast cancer diagnosed in women, and 2,623 deaths. When I spoke in 1993 on this matter, I pointed out that women are losing their lives as we go about our business in this place: every few hours, women are dying of the disease of breast cancer.
Although we have greatly improved the diagnostic procedures and the treatment for this disease, we still really have not made enough headway with money for medical research. Women have been very stoic in dealing with this disease. They have been coping, but I do not think that in this time it is sufficient for our nation's women to have to cope. And it is not just the women who have to cope: after my speech in 1993 I had a flood of calls and letters from people all over the country—from husbands of women who had it, from brothers and fathers. It affects many families in our communities.
Those families said me, `What can we do to draw the government's attention to the fact that we need more money for research to find out what is causing breast cancer and then to take steps to improve the treatment?' Those calls resulted in my going back to my office at that time and trying to sketch out a draft of a lobby campaign called `Beat breast cancer—lobby for life'. I was assisted by many of my colleagues in this place to get that lobby 
 under way, and it resulted in more than 100,000 signatures coming to this parliament, and in the then Labor government allocating some more funding. I am pleased also that our government has increased the level of funding for research, but there is still a long way to go.
In addition to that, our government has recognised the severe impact of the disease on the lives of women in rural and remote areas and, in the last election, it made a commitment to improve the support for women having to travel from rural and remote areas to the city for treatment. Women in those areas very often opt for a full and radical mastectomy—that is, the full removal of a breast—when a partial removal would be sufficient. They do that because they cannot afford either the time or the money to travel regularly to the city to have the ongoing treatment that is necessary when a woman has a partial mastectomy or a lumpectomy. So support for rural and remote area women is also extremely important.
Like my colleague, I have a concern also about the relativity of funding for various diseases. Given the high number of deaths among women with breast cancer, we do need to encourage those who are allocating funds for research to look very closely at the impact of this. This is particularly so as this country is now facing an ageing population: there will be more women who will be at risk of breast cancer, and we need to address that.
We have had a number of very good foundations that have supported this work—one in my state is the Hancock Foundation—and have given countless hours. We also have very capable medical researchers. These foundations that raise private money, and the wonderful researchers that we have throughout Australia, need to be supported. They need to be supported by a government that also has the commitment to increase the funding for research. (Time expired)",REPS,<title>PRIVATE MEMBERS BUSINESS</title>,<title>Breast Cancer</title>,Private Members' Business,1,1
"Gerick, Jane, MP",ALP,1999-02-15,"—I am very supportive—as I am sure all members are, on both sides—of any initiative which will maintain or improve the allocation of funds for research into the causes of breast cancer, for further improving the treatments 
 available and for ensuring that all women have access to screening. Breast cancer is an issue which many women will have to face: on average, one out of every 11 women will develop breast cancer. As there is as yet no means of preventing the disease, it is vital that all women have access to screening and that there be an ongoing education program to encourage women to take advantage of the screening program.
It is important that all governments make a real commitment to the funding of research, trials and screening. There needs to be real cooperation between state and federal governments to solve the real health problems and not use each other as an excuse for those problems. The federal government needs to address the lack of Medicare funding, a lack which is causing the state governments to squeeze the programs they offer. They need to address the real health problems rather than offer short-term solutions, and to ensure that adequate funding is allocated for research into breast cancer. I am sure that none of us wishes to see an issue like this turned into a political football. It is an issue where we need to work together to try to solve the problem.
An example of the problems of funding occurred last year in Cannington. The state government made the decision to close the Cannington Breastscreen service, which serviced a large part of my electorate. That decision to close was made on March 28 of last year. The Cannington Breastscreen clinic was one of the most successful clinics of its type in Western Australia. Prior to its closure, 67 per cent of the women aged from 50 to 69 who lived in the region had used the service. This is very close to achieving the target rate of 69 per cent. It compares well with the rest of the state, which has an average of 59 per cent.
Having been open for nine years, and after screening nearly 64,000 women, the clinic closed in March 1998 and women were told to use the services available in the city district. This demonstrated a lack of care for the fact that the women of the region had developed a positive rapport with their own local service. Whilst the clinic has now been reopened, after much public pressure, with 
 petitions being collected, this again demonstrated that the state government was not taking the issue as seriously as it deserved.
The new service has been described as a temporary measure and the staff are still awaiting news of what the future of the service is as they still fear that they will be privatised. Not only is it vital that screening services be available to ensure that women are able to have their breast cancer detected as early as possible, but it is essential that there is a proper accreditation process for all these services to ensure that the highest possible standards are maintained. It is now time for the program to be evaluated. If a woman is diagnosed with breast cancer, there needs to be the assurance that not only will treatment be offered but a service will be there which gives the counselling and support needed, not only for the person suffering breast cancer but also for their family.
While trials are being carried out, it is essential that enough funding is allocated to ensure that the trial can be completed. A document I have received from Breast Cancer Network Australia says that women have entered trials in good faith only to find that the trials are suspended midstream because the funding has run out. An example is a psychological trial in Melbourne where women were asked to send in data on themselves and then asked to cover the cost. It is unreasonable that women who volunteer to participate in trials be expected to meet part of the cost. These women are now expecting that there will be no feedback or outcome of their trial. One of the suggestions of Breast Cancer Network Australia is that a register of breast cancer trials be created which will help women with breast cancer.
All governments need to make a full commitment to fund adequately the research, trials and screening of breast cancer to ensure that women who are affected by this disease receive the best treatment, support and care possible.
—The debate is adjourned and the resumption of the debate will be made an order of the day for the next sitting.",REPS,<title>PRIVATE MEMBERS BUSINESS</title>,<title>Breast Cancer</title>,Private Members' Business,1,1
