name,party,date,text,chamber,debate_title,subdebate_title,debate_type,debate_id,subdebate_id
"Entsch, Warren, MP",LP,1999-02-15,"—I rise this evening to speak on Appropriation Bill (No. 3) 1998-99 , Appropriation Bill (No. 4) 1998-99  and Appropriation (Parliamentary Departments) Bill (No. 2) 1998-99 . Given the limited opportunities I have presently to speak in the House, this gives me an opportunity to raise a number of issues affecting my electorate of Leichhardt at the moment. The first issue I would like to raise has been happening now for some time and relates to air services in the Torres Strait. In recent times, there has been an almost total withdrawal of services from the area on a decision which was made on 7 January 1999 when CASA decided to issue show-cause notices to the airline operators in the Torres Strait area. This show-cause 
 notice was based on the fact that they were selling single seats on their charters rather than chartering the full aircraft.
The problem is that in 1988 there was an amendment made to the regulation which gave the Secretary of CASA the discretion of allowing these operations to continue. He had the discretionary right to allow them to fly. I am somewhat puzzled as to why it has taken 10 years for CASA to get around to enforcing this operation. It is causing major problems in the area. What it means in effect is that for people up there on very limited incomes who are travelling from one island to another, where it would normally cost them $60 or $100 to buy a seat it is now costing them $1,200 or more. That relates to something like one-seventh of their annual income, so it makes it very difficult for them to afford.
Unfortunately about the time that this decision was made there was a tragic accident on Coconut Island with the loss of three lives: the pilot Cheryl Hicks, Ethyl Larry and Belma David. My sincere condolences go to the family of those three people. That accident is being investigated at the moment and there is still no determination as to its cause. Unfortunately there has been a lot of confusion, and people are starting to cloud both the issues, particularly up in the Torres Strait. It is very hard to distinguish what is the problem.
We have had a situation where, when the kids were wanting to travel back to school, the parents would not allow them to travel in any of the aircraft up there, because they were afraid that the aircraft were going to fall out of the sky. As a consequence, 168 kids throughout outer islands of the Torres Strait missed the first few days of school, because the only alternative was a dinghy in very rough conditions. Given the fact that it is the storm season, it puts the kids at a tremendous amount of risk.
Fortunately, John Abednego, the Chairman of the Torres Strait Regional Authority, and I were able to speak with the defence ministers, and we arranged a flight of the 35 Squadron, who sent two Caribous up there. Because of the very close relationship between the defence services—particularly with the great work that 51 Battalion has done— 
 the kids had no hesitation in stepping into a military aircraft. As a consequence, the problem was solved and all the kids were brought in.
Unfortunately it is a one-off. The situation certainly impacted very much on the small operators up there that make a living out of providing a service. It is something that desperately needs to be resolved very quickly. I know that there are difficulties associated with it—issues relating to safety. The reality is that it is absolutely impossible to meet the PRT requirements to allow public transport carrying in that area.
I have had meetings with the hierarchy of CASA on this and explained my position to them. I have also expressed concern at the fact that it took 10 years for them to make a decision to ground these airlines. And they would have known very much that this was going to happen, but at no stage did they think of any contingency plans. One would have thought that the responsible thing to do would have been to suggest that they were going to make some changes but have some alternatives that they were looking at to fix the problem. 
So at the moment we have islands such as Duan, Saibai and Boigu that have gone from an almost daily mail service to being lucky to get one mail service a week, because they are relying on barges now to get the mail out to these places. We have unaffordable airline tickets, and as a consequence more and more people are going on dinghies on journeys of up to 120 kilometres. So it is becoming very difficult for these people to travel, and still there is no decision being made.
As I say, I have spoken to CASA on this and have asked them to do something very quickly, because it is going to affect a lot of people. You cannot send medical supplies or fresh fruit and vegetables for the store on Thursday Island, unless you charter an entire aircraft. So it is impacting right across the broad spectrum. From 7 January to now we are looking at about a month and a half. I think that it has gone on long enough and that CASA needs to sort themselves out and to do something that will restore the services to these regions.
While I am on that, there were another couple of decisions—one last week when, in their wisdom, the local CASA people decided that people in some of the remote places are not allowed to carry animals on aircraft without a sealed container cargo compartment. Unfortunately, most of these small communities do not have the services of vets, and the only way they are going to get any assistance for a sick or injured animal is by carrying them by air or on unsealed roads which are impassable in many cases at this time of the year. They do have the proper pet containers, but they have decided that these people cannot carry animals. In fact, one constituent, Mrs Boyle from Cooktown, took her animal to Cairns. A couple of days later when she wanted to return she was told she was not allowed to take it back. I raised this with the CASA authorities, and they eventually paid to road freight that dog back to Cooktown. That is not a good alternative.
Again I spoke with the CASA people on this, and I was given a very firm undertaking that the local CASA people in my region were misinterpreting the regulations. I was given a commitment that they would immediately write a directive to these people and ask them to reinstate the service of carrying these animals. Unfortunately, one of those that gave me that commitment decided—I think on the next day—to go on leave, and to this day we have not been able to re-establish those services. I think that they have to start to look at their responsibilities with respect to the public up there as far as these sorts of things are concerned. I think they are ridiculous decisions.
Today I have been advised that Cape York is also feeling the effects of it. I have a number of letters here from small cattle station owners who, as we are well aware, have suffered badly in recent years—first of all from the impact native title issues has had on their industry and also from very poor cattle prices. Some of these people are not prepared to lie down and cop it in the neck. They have actually gone out and started small tourist operations—operations like the Strathburn Station and the Eclectus Wilderness Retreat at Iron Range are good examples. 
 These people have gone out and continued to have a go. Now they are told that they cannot get any passengers, because their passengers had been brought in on the mail plane for years and years. Now they cannot get any clients into their operation and they are very fearful that this is going to be the straw that is going to break the camel's back and shut them down.
Again, this is something which really needs to be dealt with. There is no question about safety. Safety is absolutely imperative, particularly the airworthiness of aircraft. But, at the end of the day, we have to realise that airstrips out in the middle of Cape York or Mabuiag Island or Darnley Island or Murray Island or up at Saibai are not the same as Kingsford Smith. As such, we need to make concessions or special allowances for aircraft operating in those areas, whether that be by accepting that there are some limitations with regard to the standard of strips that are available or that there are restrictions with regard to the carrying of certain passengers in Papua New Guinea.
In the Torres Strait, for example, the operators are not allowed to carry Papua New Guinea nationals, because of quarantine and immigration issues. That automatically means that they cannot get the standard RPT; and so there need to be concessions made. I am raising this tonight because I think that we have been very patient. It has been six weeks now, and it is really time that CASA realised the impact that this is having on people in Cape York and in the Torres Strait. CASA needs to sit down and sort this out and get these services operating again.
Quite frankly, they cannot continue to do it the way it is now. In Cape York at the moment, they have had record rain and people are stuck. I have in mind the situation of a woman in Cooktown who recently had a child. She is in hospital and is trying to get back to her remote property. She cannot afford a full charter flight and she has been stranded in Cooktown, away from her young family, for a couple of weeks now. She cannot drive out because the road is impassable: they do not have any roads at this time of year, because they are totally flooded out. 
 You can see the problems and the trauma that it is causing in the area.
I call on CASA to acknowledge the difficulties that are being caused there. We are not asking them to compromise on safety but we are asking them to accept the impacts that this is having on people's everyday lives and to acknowledge that there are remote areas that are very different. For goodness sake, do something to get these people moving again before we see another tragedy where somebody tries to head out but is unable to do so and something happens, whether it be in a dinghy or on an impassable road. At the end of the day, that is very likely to happen; so I would encourage CASA very strongly to deal with this as soon as possible.
I have another issue that I would like to raise. I would like to make the House aware of a fellow in my electorate who is a special human being. His name is Geoff Guest, and his partner is Norma. Geoff has a property in the area called Petford. He is one of those very special people who have been providing special help for kids that none of the other organisations or authorities are able to help. These are kids  with violent upbringings, who come from very troubled homes and Geoff has a very special way with them.
Geoff himself had had a very troubled youth: he was an orphan and was adopted out, and he had a very unhappy childhood. As he grew up, he had the dream of having a cattle property. He bought a small block, of only a couple of a hundred square kilometres, called Emu Creek, out of Petford. Twenty-odd years ago, suddenly he started to find kids turning up at his door, kids who were having all sorts of problems; and so Petford Youth Camp was established. Norma came in about 15 years ago, when her son arrived there. Norma was an Aboriginal woman from Yarrabah, and she became Geoff's partner.
Over all those years they have had over 2,000 kids go through. The way that Geoff does it is this: he has a belief in giving the kids a challenge to achieve, and he does it with horses. He brings brumbies in and usually gives the kids three each as they come in. Basically, they have the responsibility of breaking these horses in, and the achievement 
 of doing that does a hell of a lot for them. Then they go on to rodeos and a whole range of other things. On top of that, for the first time, many of these kids have a sense of belonging. Anybody who has actually been into Norma's kitchen will see the warmth and the love that is there from these two people. Unfortunately, Geoff is getting on in age—he is now 72—and Norma is not in good health.
Geoff has provided a service, as I say, for all those years. Unfortunately, what has happened is that these things cost money, and Geoff and Norma have put every cent they have ever owned into it. Obviously the authorities thought it was a pretty good idea too, because they started sending kids there, and that was probably the mistake. When the authorities did that, of course, they decided that they would contribute; but there are always strings attached. With that contribution, they then decided they wanted control—and I am talking about the Queensland family services department.
As a consequence, we had a situation where we had had the place being run by Geoff and Norma, with over 2,000 kids going through, but last year, when it was taken over by Family Services, they had an administrator, a youth worker, two cooks, an accountant and, of course, Geoff. Norma was there as an adviser, but was not paid. So they had six full-time paid employees. Then they started to criticise what Geoff was doing—and we should point out that the reason they came in there in the first place was that what Geoff was doing was the only thing that was working with these kids.
He is a bit tough with them. There was a comment which Norma made that I read in the Cairns Post recently. She was commenting after Family Services had taken over. They are actually trying to kick them off now: it is crazy. She said that it needed to go back to the old days: plenty of talking and listening, and love and affection. She said,`You don't bribe them. Maybe I was a little too strict with them, but were they scared of me? Yes, they were. I would just tell them what was wrong and right. I taught them to cook, and some of them even came back to work 
 with us years later. Some are vets and some are engineers now.'
Unfortunately, the family services department and the board that have tried to take control there are, through political correctness, trying to destroy Geoff and Norma. It is all about social engineering. They do not agree with the way in which Geoff is doing it. He is one of those square pegs in a round hole. Because he does not fit into the bureaucratic requirements, they suddenly want to throw him out—discard him. They need to realise that Petford is nothing without Geoff Guest and Norma—and, of course, they are nothing without Petford. I think those people should hang their heads in shame. I will read a letter that came to Petford recently from a fellow by the name of Fletcher. He wrote:
Hi, its Fletcher here. I've heard you're having problems. I don't know what to say but to tell you that in everything I have ever been you have done the right and good thing. You are a strong man and I have more respect for you than any living man.
He signs off the letter with the words, `I love you, old man, all my love Fletch.' That is one of many letters that he gets from these kids. I call on the family services department to leave Geoff to do what he does well. Let them continue to operate that. For once, for goodness sake, let commonsense prevail and give them the opportunity to take back Petford to the way it should be. (Time expired)",REPS,<title>APPROPRIATION BILL (No. 3) 1998-99</title>,<title>Second Reading</title>,Bills,10,1
