name,party,date,text,chamber,debate_title,subdebate_title,debate_type,debate_id,subdebate_id
"Snowdon, Warren, MP",ALP,1999-02-15,"—I am pleased to be able to speak in this debate and to raise what I think are important issues, not only for my electorate but nationally. Appropriation Bill (No. 4) 1998-99  contains allocations of money for two particular items which I think bear some discussion this evening. One of those is for $10 million for payment to the Northern Territory for continuation of the Northern Territory Health Indigenous Infrastructure Program to improve living conditions and health standards for indigenous people. The second is a figure of $19 million which, as you will recall, was and remains the cause of a lot of political discussion around this country and in this parliament. It is $19 million for a community education and information program on reform to the Australian tax system.
Let me first address the issue of Aboriginal health. I want to put my remarks in the context of what are seen as being important matters in relation to the overall position in terms of average Aboriginal health. What I would firstly like to do is to give some information about basic indices, which give us a very firm idea of how disadvantaged Aboriginal people are in terms of health generally.
The statistics are pretty well known to most of us, although I fear that the fact that they are well known does not mean that we necessarily react positively to providing appropriate ways to ameliorate those poor health standards. Of course, the figures will vary across Australia depending on circumstances and location. It is that issue of location that will become very important later in this debate for me as I talk about the impact of the second item—that is, the $19 million for the community education program in relation to a GST and what the GST means for people who live in the bush.
Life expectancy for Aboriginal people is 20 years less than for non-Aboriginal Australians. Life expectancy of Aboriginal people is considerably worse than for other comparable indigenous populations, such as the native peoples of the United States and Canada, and 
 the Maoris of Aotearoa. Aboriginal boys born today have only a 45 per cent chance of living to the age of 65. Aboriginal girls have a 54 per cent chance of living to the age of 65. Age standardised death rates for Aboriginal males are 2.8 times those for non-Aboriginal males. Age standardised death rates for Aboriginal females are 3.3 times those for non-Aboriginal females.
Aboriginal people suffer from certain health conditions at a much higher rate than non-Aboriginal people. For example, Aboriginal people have diabetes at a rate 12 to 17 times the non-Aboriginal population. The figure for renal disease is 17.4 times that for the non-Aboriginal population.
Just as an example, of the 64 clients of the Alice Springs renal dialysis unit, 63 at the time these figures were collected—the end of last year—were Aboriginal people. That is a very clear indication of the poor state of Aboriginal health. Health care funding is a very important element of the way in which we address these issues, but it must be funding built within a framework of a comprehensive health policy designed to ameliorate these poor health outcomes.
Despite the greater burden of death and illness that Aboriginal people bear, and contradicting popular misconception, huge amounts of money are not being thrown at the problem. In 1995-96, 2.19 per cent of all Australian recurrent health expenditure was on indigenous Australians—that is only eight per cent higher per capita than for other Australians, despite the vastly greater burden of illness. Unfortunately, a disproportionate amount of this money is spent on expensive end-stage hospital or similar care. Across Australia 55 per cent of health expenditure on Aboriginal people is for hospital care. This amounts to about $1,218 per indigenous person per year spent on hospital care. This is twice the expenditure on non-Aboriginal people in hospitals, which is only $604 per year.
On the other hand, for every $1 that non-Aboriginal Australians access through Medicare, Aboriginal Australians receive 27c. For every $1 that non-Aboriginal Australians get from the pharmaceutical benefits fund, the 
 PBS scheme, Aboriginal Australians get 22c. So you can see that there is a huge disparity in the way we apply these services to indigenous Australians.
The Commonwealth health department through its Aboriginal health section funds Aboriginal primary health care services, which goes some way toward compensating for the lack of Aboriginal access to MBS and PBS funds. However, the level of primary health care expenditure for Aboriginal people is still approximately $100 per person per year less than the national average of $600 per year. That says to me that we have been fed a lot of misconceptions about the way in which health care dollars are spent in this country and about the way in which governments, despite the rhetoric, have been addressing the problems. And I say that not only about this government but also about the previous Labor government and governments before it. Frankly, we have not been doing a good enough job. Despite the scare campaigns and denigrating insults which are made of indigenous Australians generally around issues related to health—that it is their responsibility—it is very clear when you look at the figures that we as a nation have not accepted our share of that responsibility in ensuring that we provide appropriate resources so that they can address the appalling state of Aboriginal health.
We need to understand in that context the vast need for dollars to be spent on indigenous health in this country. That is demonstrated clearly by the morbidity and mortality statistics which I have already referred to.
Measured against need, expenditure on Aboriginal health is clearly and totally inadequate. The clearest way to address this inequity is to ensure Aboriginal access to the large mainstream funding sources of MBS and PBS. That is a challenge to this government—to come up with a way in which they can properly resource Aboriginal communities, and indeed the Northern Territory government in this instance, through the MBS and PBS schemes. Unless we do, we are denying indigenous Australians a fair shake. We are denying them the possibility that some of the appalling health data that I have already 
 referred to can be improved. That means there is a responsibility on all of us.
As I say, I am sorry about the poor outcomes under the previous Labor government—they should have been far better. But because they should have been better under the previous Labor government is no excuse for not doing anything now. My concern is that I do not believe this government is sincere enough or fair dinkum enough about these issues to make a difference. But there is a challenge, and I hope to see them meet that challenge. I certainly know that there are proposals in hand to deal with the MBS and PBS issues and I know that those ideas will come to the federal government. I know that there is widespread support from the community based health services in the Northern Territory which are working in concert with the Northern Territory health department about a proposal which will deal with these issues.
When we are talking about what is required for good health, we need to understand that there is a matrix of things that we need to address. The first, which is not new to me but I think is new to a lot of the bureaucrats and politicians who make judgments about important issues relating to Aboriginal health, is that we need to have an approach to Aboriginal health which is holistic and which addresses a range of needs—the first of which is identity. It is important that you know who you are, what your relationship with others is, what your relationship with the land is and what your culture is. That is fundamental. Yet we have had debates in this country over recent years in relation to native title—and they will emerge again over issues to do with the Northern Territory Land Rights Act—where those very things have been questioned. I had cause last week to discuss in this place the understanding that we non-indigenous Australians have of indigenous Australians. We need to contemplate these things in far more detail.
The second is access to health services—primary health care, hospitals and specialist services. The third is economic activity—being active in the process of living, looking after your country, having a job, caring for 
 your family and the community. I note that the minister is at the table. At some point I would like to have a discussion with him about the failure of his programs to deal with those particular issues in relation to Aboriginal communities in remote Australia. I can give him the detail; I can give him chapter and verse. While I am on the subject of remote communities, I will deal very quickly with another matter and come back to this discussion in a moment.
We discovered from the Senate estimates last week that the concept of mutual obligation extends only to people who live within 90 miles—it should have been 90 kilometres, I am sure—from a government office that deals with these issues. One presumes this is a Centrelink office. Under questioning in the Senate, this was said:
Under the existing mutual obligation rules, people who have to travel more than 90 miles are exempt. But you would certainly be offered the option and, as I explained a little while ago, there are two distance learning providers available in the Northern Territory. I would very much hope that the Centrelink office that was dealing with that person in question . . . 
Let me say to you that that is absolute fairyland stuff. The truth of the matter is that mutual obligation to this government means, `We'll give you money, and we'll make you do things, provided we do not have to pay more to make you do them.' In other words, `If we have to provide program dollars to assist you to train to get the skills we say you need and you live outside of 90 kilometres from Alice Springs, forget it, you won't get them.'
We know already that the Job Network does not provide services to people who live in 90 per cent of the Northern Territory. Basically, it is not covered. So, if you are an Aboriginal person living in the remote areas of the Northern Territory and you are unemployed or on CDP, forget having access to government programs, you just will not have it.
This issue of mutual obligation and the importance of literacy and numeracy applies only to areas where the government believes it wants to spend money. It is clearly not prepared to spend the money where it is most 
 needed: on the people who are most disadvantaged in the labour force, the most impoverished people in this nation—those people who live in these remote communities. They have the worst literacy rates and they have the worst educational outcomes, but this government has chosen by dint of the way in which it expressed its policies, and by the way it is funding and administering them, to ignore their plight.
The Labor Party accepts—indeed, it promoted—the idea of mutual obligation, but we put in place the programs and we funded those programs. We put in place officers to travel to those communities and service those clients, and it has all been taken away by this government. So, when we are dealing with Aboriginal health in the context of their lifestyle and the ability of Aboriginal people to get a job, it has been taken away effectively by the mismanagement of this issue by the government.
Having appropriate infrastructure that suits the way people live—housing, shelter, et cetera—is important. Education appropriate to community need and culture is also important. That is an issue which I would like to come back to, but I do not have time to today. It is very much in the same vein as the way this government is dealing with the issue of employment and the issue of the labour market.
Good tucker is very important—access to bush tucker and healthy store food is especially important for kids to grow into healthy adults. Then there is the need for an active men's and women's culture. Last, but not least, political leadership and the ability to negotiate with the authorities imposed upon Aboriginal people is very important, yet we see this government basically ignoring its advisory body, ATSIC, on these issues, and that body passing a motion of no confidence in the current minister.
I want to pay particular attention to the issue of food. Clearly, one of the issues which is very important is nutrition. If we want to improve health outcomes in Aboriginal communities, we must make sure that there is adequate nutrition. But the government has now proposed a tax regime which will effec 
 tively marginalise further these people. We know already that there are Aboriginal people in Northern and Central Australia who go without food some days of the week because of the costs that are involved in purchasing those products.
Last year the Northern Territory Department of Health undertook a survey of Northern Territory remote community stores. They did some very interesting pricing analyses and the difference in the price of goods in these remote Aboriginal community stores from the price of goods in Darwin and in the other major capital cities. The surveys were carried out in April and July last year in 45 stores throughout the Northern Territory. Bear in mind this was not done by me but by professionals in the Department of Health in the Northern Territory. The total basket was adjusted to meet what was perceived to be 100 per cent of the nutrient requirements and 95 per cent of the energy requirements of this population. On average, there were seven different choices of fruit and 12 different choices of vegetables in community stores. The total basket average costs in communities was $484, which compared with a Darwin price of  $329. So we had a difference between Darwin and these communities of 47 per cent. So, if you live in a remote Aboriginal community, you are being asked to pay 47 per cent more for fruit and vegetables than if you live in Darwin.
But that is not the end of it. I have more—like the Demtel salesman, like these people when they are trying to flog us a GST, telling us what benefits are going to accrue out of this momentous tax they say will be great for the nation. It will not be great for these people. The difference between the costs of buying those same commodities in these Aboriginal controlled community stores—the 45 of them around the Northern Territory—and the costs of the same products in Sydney, Melbourne or Canberra is 61 per cent. The total family basket would cost 61 per cent more than the average across all capital cities.
The fruit and vegie component, which for the purposes of this debate on health is a very important component, would increase massively under a GST. In the Katherine district, 
 it would be 92 per cent more than the average across the capital cities, and in east Arnhem it would be 106 per cent more. The hypothetical family of six would spend up to $614 per fortnight on a food basket in eastern Arnhem Land. The same basket across the average of capital cities would be $310.
I heard the Treasurer this afternoon talking about the benefits of a GST and cuts in income tax. Let me say to the Treasurer, and anyone on the other side of the House who knows anything about the income distribution in this country and regional differences in income distribution, that most of the people I am referring to do not pay tax because their incomes are not high enough. They will get no benefits from tax cuts, but of course they will get an increase of four per cent in their entitlements if they are on a benefit. You do not have to be Einstein, or even a simple mathematician like me, to work out that four per cent is going to make absolutely no difference to these people who are already penalised, because the price of the food—these fresh fruit and vegies which they already pay $614 for—will go up by 10 per cent. You do not have to be too smart to work it out.
This government has yet to come to terms with its obligations. This government has spent $19 million trying to tell Australia the benefits of this GST. This government has yet to acknowledge that the people who will be most disadvantaged by this program, despite people like you and me, will be those who live in these remote communities and are among the most impoverished in Australia's community.
Yet there is not one inkling of any idea by this government as to how to address these issues. Every day we have more and more evidence coming from the Senate committee hearings on the GST, demonstrating time and time again that we are being led down the garden path and told blatant untruths by the government. And we are expected to say to them, `Whoopee! Let's take a tax cut,' and tell these poor people who live in my electorate that they can expect great things out of a GST. You and I both know, and they know—despite the fact that I think this government 
 believes these people are stupid—that you are wrong. These people know that you are misleading them. These people know that the GST is a health tax. These people know that a GST on the fruit and vegetables they buy will impact detrimentally on their health. There are already people in my electorate who go without food because of the costs they have to incur. That will only be exacerbated by this cruel and iniquitous tax.",REPS,<title>APPROPRIATION BILL (No. 3) 1998-99</title>,<title>Second Reading</title>,Bills,10,1
