name,party,date,text,chamber,debate_title,subdebate_title,debate_type,debate_id,subdebate_id
Mr SPEAKER,N/A,1999-08-10,"—I present the Auditor-General's audit reports Nos 1 to 6 of 1999-2000 entitled:
No. 1—Performance audit—Implementing purchaser/provider arrangements between the 
 Department of Health and Aged Care and Centrelink ;
No. 2—Financial control and Administration audit—Use of financial information in management reports ;
No. 3—Performance audit—Electronic Travel Authority—Department of Immigration and Multicultural Affairs ;
No. 4—Performance audit—Fraud control arrangements in Employment, Education, Training and Youth Affairs ;
No. 5—Performance audit—IP Australia—Productivity and client service  and
No. 6—Audit activity report—January to June 1999—Summary of outcomes .
—I approach the dispatch box with some trepidation that my appearance might breach the fashion policy that the Labor Party has found over the break. If you could find a few more policies that would really be something.
—The Leader of the House will come to the point or resume his seat.
Motion (by Mr Reith) agreed to:
That the reports be printed.",REPS,<title>AUDITOR-GENERAL'S REPORTS</title>,<title>Reports Nos 1 to 6 of 1999-2000</title>,Auditor-General's Reports,5,1
"Martin, Stephen, MP",ALP,1999-08-10,"—At the outset one cannot help but remark that the Minister for Defence has gone AWOL without facing the charge. Let us hope that somebody is out there getting the security attendants in their new uniforms to rustle him up and bring him back in here to answer for the absolute shambles of a policy which he is trying to oversee within the Department of Defence. Once again in question time—as occurred yesterday—we witnessed Amateur Hour  when the Minister for Defence, laughingly a cabinet minister, stood in this place and scoffed at tradition and at questions being put to him that went to the heart of the  administration of an $11 billion a year Public Service department charged with the defence of Australia. The minister glibly said, in response to questions put to him on everything ranging from personnel matters through to security arrangements for Australia, `Well, everyone knows what the government's policy is,' and sat down to raucous laughter from his colleagues. Well, they must really think that Australia is just so well connected out there in the rest of the world that he can get away with that nonsense.
Yesterday, the minister went on to say that he expected the highest standards of management from his department. Well, we expect the highest standards of management of his department from this minister. Yesterday we also saw reports that this man who oversights this department referred to senior personnel—and I understand the protocols of this place—as f-wits. We all know what that means. It is 
 reported in the newspaper that this minister referred to senior people in his department in those terms. I find it incredible, but I can also understand why so many leaks are coming out of the Department of Defence. He really knows how to endear himself—the Minister for Defence—going around talking about people like that. But he has a bit of form, this bloke. When he came into government after 1996, he sacked his head of department. Now, of course, he is about trying to sack another bureaucrat, another head of his department.
The Barratt case raises some very interesting circumstances. I understand that, because of sub judice conventions and so on, we cannot go to the merits of the case or otherwise, but what we can do is point out some of the media commentary on this. It really is Days of Our Lives stuff. Mr Barratt was headhunted by the Prime Minister of this country and put into Defence after serving some time in Primary Industries. Because he survived a lemon hunt by Max `the Axe' Moore-Wilton trying to suss out those departmental heads that were no good and they reckoned he was pretty flash, he was given a performance based pay increase. Mr Moore, unfortunately, is a bit unhappy with him, but we do not know why, we do not know how long he has been unhappy with him. He has been distracted from all the duties he is supposed to perform as the Minister for Defence. We have the CDF, Admiral Barrie, saying that senior uniformed personnel have absolutely lost confidence in this minister. We have seen the CDF walking along arm in arm with Mr Barratt for photo opportunities—they are as one, and who is missing out of that little photograph? The minister. The minister is not there with his two senior people that run the defence department.
The minister is renowned for his sackings—it does not stop with departmental heads. He has gone through the Chief of Navy and his Assistant Secretary Acquisitions. I think Major General Hartley is in for the chop after today. Major General Hartley has blown the whistle on the lack of availability of medicos to serve people in the ADF—in times of war certainly but also in times of peace. We are talking about when they go on exercises, like 
 Crocodile that is on at present, when they go to Shoalwater Bay and they are performing duties and training as soldiers, sailors and airmen. The only trouble is we do not have anybody to fix them up if they get crook or if there is an accident. But the minister said, `Don't worry. Everything's all right. I am assured that volunteers will be there at some stage down the track.' Maybe.
This botched attempt to remove Mr Barratt really does take on the parameters of The Bold and the Beautiful. The Canberra Times reported recently some of the details about how he went about sacking this person, quoting from an affidavit given by Max `the Axe' Moore-Wilton. It was fascinating stuff. Max said:
""I said to him, `Jesus Christ, the trouble with you blokes is you have no corporate memory. Barratt put up with years of this from the Labor Party. He has already been an ambassador and he hates Foreign'.
So you are trying to sack the bloke who is head of Defence, and you are going to put him in Foreign Affairs but he hates Foreign Affairs because he came from there once before.
The article continues:
""McIntosh thinks you might be interested—
this is Barratt—
in going to university in the US to learn about defence.
So Sir Malcolm McIntosh, who the minister wants to put in on a six months contract to look after Defence to sort out its problems—and only six months when it probably needs a five-year focus—has decided that the bloke who runs Defence at the moment needs to go to the US to a university to learn about defence. Do not ask me why, if he has got the sack, because he ain't comin' back. He is not coming back to Australia to run Defence. The article gets better. It goes on to say:
Mr Barratt's affidavit also quoted Mr Moore-Wilton telling him that [Foreign Minister Alexander] Downer—
and this is one of the other big three over there that we saw today, and they are pretty good—
""is collaborating in this because Ric Smith— 

our ambassador in China—
is due out of China and there isn't a job for him in Foreign at the present time. The PM's office is also playing a hand in it.""
Mr Barratt said he had replied that he had not the faintest interest in New Zealand, but ""I might be tempted by Paris"", to which Mr Moore-Wilton replied that ""the trouble is that his mate likes it there"".
Who is his mate? It is John Spender. John Spender is already in Paris and he is not going to come out. The article continues:
Mr Barratt said he had replied ""well Max, people have to make choices. If I am to be put out to grass then the grass will have to be lush.
This is the farce we have in Defence at the moment. The minister is so caught up with worrying about his departmental head and giving him the flick that he cannot concentrate on the most important issues.
What are the important issues? Firstly, there was the birthday bash at the barracks for the Prime Minister. That was a big event. He had to worry about that because the minister trotted along with a few invited guests. We all remember this photo.
—Look at the fur!
—Never mind the fur—he is illegal. Why? He is not wearing a seatbelt. He is in a Comcar and he is not wearing a seatbelt. That is against the law. Bob Hawke got into trouble over that. Will this minister? Maybe. But the other issues of concern in Defence at the present time run seriously and they run deep.
With the Defence Reform Program, this minister is oversighting, supposedly, savings of $1 billion to be directed to the pointy end of Defence. What has he got so far? He has a force structure that nobody quite knows what it will end up at. People are bailing out left, right and centre. Why? They are unhappy, morale is low and then this government sticks a fringe benefits tax requirement on them.
—He didn't know that.
—We have asked questions about it. I have to say that the shadow minister for industrial relations is dead right. I do not think that until yesterday the minister 
 knew anything about the fringe benefits tax and the effect it had on the 43½ thousand—or nearly 50,000 now, but they want to get it down to 43½ thousand—serving defence men and women. He had no idea about the effect that might have.
This minister has elevated a second brigade to 28-day readiness so that we have two such brigades. The money required for that—at least $200 million a year to keep it ready—is fine if we need it, but with the savings that are supposed to come from the Defence Reform Program that are not happening they are not redirecting that money anywhere. As we pointed out twice in the last two days, surgical teams are trying to provide capability—and Major General Hartley has commented on what that means.
The Prime Minister has made a commitment on FBT that no group would be worse off under any of the changed tax regime introducing the GST. This minister should know something about the present strategic environment that is out there. We know he has been to Bali with the Prime Minister to talk with the Indonesians, but I seriously wonder if he has turned his attention to things that are required in the strategic review that is under way that will lead to a white paper. The strategic review will be secret; the white paper will be published next year. When the last strategic review came out, two weeks later the Asian economy crashed and yet that strategic review did not even pick it. That had an effect on Australia's capability and the acquisition we need in terms of replacement of the platform for the Australian Defence Force to do what it is supposed to do—defend Australia—and decisions were being made on false premises coming out of that document.
There are also the questions of East Timor and ongoing peacekeeping arrangements in Bougainville. There is the question of continuing defence support for Papua New Guinea. Comments are being made about the minister not knowing that his department is generating intelligence reports and passing them on to Alexander Downer's foreign affairs department—and I bet he does not read them, and if he did he would not know what was in them—and telling them all about 
 Indonesia and East Timor. That is military intelligence coming in that this minister does not know anything about. He then jumps up and down and says, `Oh, don't do that again! Don't do that without telling me! And you're not going to give any of those military secrets away without telling me!'
Who is running that department? When we start to talk about things like block obsolescence—that is, when we need to replace destroyers, F18s, F111s, patrol boats and all those things—who is going to make decisions on this? Not the Minister for Defence—the absent Minister for Defence who is not even here to answer the charge. He cannot concentrate because he is too worried about sacking Mr Barratt and trying to work out which option he should take.
We actually know. The way things are going there is another problem coming for him. We have already seen this. A couple of weeks ago, the minister proudly announced to all and sundry that a $2 billion contract for the new airborne early warning system has just been let to Boeing. What do we find out today? Boeing is being investigated by the United States Congress because it might be giving away secrets. We are in a partnership with the US and yet that arrangement is being investigated by the Congress to see how many of their secrets are being given away. This minister is presiding over $2 billion worth of public expenditure on some platform that we need. However, now questions are being raised over how successful that is likely to be and whether we are going to get all the information we need.
We could also talk about Olympic security or the reserves. If this minister actually got out of the Bushmasters or the photo opportunities being provided on the FFGs or something else and talked to his personnel, he would know that they are concerned about the future of the reserves in this country. People are not prepared to sign up anymore. The need for the reserves to be part of the general defence of this nation is increasing. As we keep raising our preparedness, as we keep increasing the availability of highly trained personnel to participate in all sorts of activities in our region, there is a strategic vacuum. 
 There is a lack of regional leadership coming from this minister and, as a consequence, our international reputation is going through the floor.
This minister needs to do more than simply stand there taking salutes at base visits. He needs to be accountable. He needs to be responsible. He is required by the normal standards of this parliament to come into this place and provide answers to genuine questions being put to him by members of the opposition or to respond to newspaper commentary that even his own department's newspapers are putting out. Army and Navy publications are both raising issues about FBT and other concerns that they have at the moment.
And these are government controlled authorities—a bit like the old Soviet bloc, but they are even allowing letters to be published saying that the FBT impact is just horrendous. We have the office of the revolution in military affairs, which I have said also sounds a bit Stalinist, but that has been created in the department. That is fine, because it has a job that it is going to do. But I have to say that this minister is not doing his job. Yesterday in question time when a question was put to the Prime Minister about the confidence of the ADF in this minister, the Prime Minister after a glib response turned to the Minister for Defence and said, `You owe me a case of Grange for that.' The Minister for Foreign Affairs said, `It would be cheaper if you just resigned.' Dead right! As Barratt said:
The problem with John Moore is that he does not do his homework and he will not listen.
That was reported in the Courier-Mail  on the seventh of this month. It is time not for Mr Barratt to go but for the Minister for Defence, who is on his last tour of duty, to probably think about taking the Wellington or the Paris option himself. This afternoon, though, it is time for this minister to come into this House to explain himself and to defend his handling of his department.",REPS,<title>MATTERS OF PUBLIC IMPORTANCE</title>,<title>Defence Portfolio</title>,Matters of Public Importance,7,1
