name,party,date,text,chamber,debate_title,subdebate_title,debate_type,debate_id,subdebate_id
"Worth, Trish, MP",LP,1999-08-10,"—I would like to begin by thanking the government speakers, the member for Bradfield and the member for Dawson, for taking part in this debate, and also the member for Dobell, the members for Batman, Lawler, Shortland and the Northern Territory; and it is always interesting to listen to the member for Werriwa.
As the member for Werriwa has said, as it turned out, this was a very wide-ranging debate, so I will remind the House what this bill is really about. The  Employment, Education and Training Amendment Bill 1999  amends the Employment, Education and Training Act 1998 to abolish the National Board of Employment, Education and Training, or NBEET, and four of its councils: the Australian Language and Literacy Council, the Employment and Skills Council, the Higher Education Council and the Schools Council. The Australian Research Council and its membership will continue unchanged, and 
 it will operate as an independent council providing advice and will report directly to the minister. The bill also makes minor technical amendments to the act, removing definitions no longer required under the act, removing schedule 1 and retaining the position of director to service the ARC. The bill also includes transitional provisions providing for continuity of membership of the ARC, the councillors and the committees which it assists.
The member for Dobell has made a number of claims, which I will refer to. One claim was that there was no good reason to abolish NBEET. The member for Dobell may not realise that the board and councils being abolished in this bill have already wound up their work and only the ARC is currently working on advice to the minister. There are ample existing representative bodies to give advice to the government on issues which were covered by NBEET and the four councils being abolished. These cover all sectors of education. In addition, as specific issues arise, the government can establish short-term task forces to advise on specific issues. In line with the government's intention to create more independent advisory bodies, the ARC will now provide advice and report directly to the minister and take responsibility for promoting informed public debate on research in Australia.
There were also claims made about the falling number of postgraduate places. In fact, postgraduate places are rising, and the government is committed to ensuring that opportunities for all Australian students continue to increase. Universities' projections indicate that the number of student places will grow between 1996 and 2001. The focus on undergraduates means that more people than ever before are receiving their first opportunity for higher education. As I said, the total of all domestic postgraduate places is rising, with universities forecasting a 10 per cent increase by 2001. Postgraduate fee-paying student places have increased by almost 50 per cent since 1996. The number of research student places continues to rise. Universities project a 7.6 per cent increase between 1996 and 1998, and a further 11 per cent increase 
 is forecast to 2000.	The member for Dobell also made comments about the education budget.
—What education budget?
—The member for Dobell's interjection demands the question: what Labor policy is there on education? From their amendments, there is obviously something, and that is to find another NBEET-like body—
Mr Latham interjecting—
—The member for Werriwa lost a few policy points at the last election, and they have not been replaced. The truth is that the government is committing over $11 billion per annum over the budget and forward estimate period to develop stronger, vibrant education and training sectors into the new millennium. This budget sees increased funding of $870 million over the next four years—not that one would have known that from listening to the opposition debate tonight.
The member for Dobell has moved amendments, but that is an attempt to recreate an NBEET-like body, and the government of course would seek to listen—as I think the member for Werriwa hinted was a good idea—to advice from many different sources. The impact on HECS got a mention, and I remind the member for Dobell that the number of people from disadvantaged groups is increasing steadily. Essentially, HECS remains as it was when Labor introduced it—a scheme that enables people to attend university and defer the cost until they have a reasonable income level.
The member for Lalor made some comments about funding to government schools, and they were also inaccurate. I remind the member for Lalor that government schools get 85 per cent of their public funding from state governments and 15 per cent from the Commonwealth. Non-government schools get 18 per cent of their public funding from state governments and 37 per cent from the Commonwealth. The really important point is that all state governments are overwhelmingly in favour of government schools, but no-one claims that state governments are opposed to 
 non-government schools for this reason. When all sources of public funding are taken into account, that is, Commonwealth and state—and I do hope the member for Lalor is listening to this—governments spend, on average, $5,600 per government school student. The same figure for a non-government student is $3,500. For students at wealthier schools, this figure can be low as $1,500 per student.
The member for Werriwa has been interesting in his discussion of education policy again tonight. I agree with him that muscle power is giving way in many instances to brain power, that mobility is important, and that education and knowledge must be propagated. These are challenges for policymakers. But, having heard this from the member for Werriwa, we would not want to limit our advice from NBEET. It is not time for narrowing; it is time for increasing and receiving advice from a wide range of sources, and that is exactly what the government is doing. Partnerships are being formed between governments, industry and educators, which of course is what is so important for our young people in an ever-changing world.
The member for Werriwa has also made comments about research. He must be making a glowing endorsement of the portable research grants which are recommended and proposed in the `New knowledge, new opportunities' government discussion paper on research and research training which was released on 30 June. I hope that has clarified some of the issues. Again, I thank those who have taken part in this debate.
Question put:
	That the words proposed to be omitted (Mr Lee's amendment) stand part of the question.

The House divided.				[8.54 p.m.]
(Madam Deputy Speaker—Mrs J. Gash)
		Ayes . . . . . . . . . . . . . . . .  73
		Noes . . . . . . . . . . . . . . . .  63
                                          ——
			Majority . . . . . . . . . . . .  10
                                          ——
Voting lists are recorded in the Votes and Proceedings.
Question so resolved in the affirmative.
Original question resolved in the affirmative.
Bill read a second time.
Message from the Governor-General recommending appropriation announced.",REPS,"<title>EMPLOYMENT, EDUCATION AND TRAINING AMENDMENT BILL 1999</title>",<title>Second Reading</title>,Bills,13,1
