name,party,date,text,chamber,debate_title,subdebate_title,debate_type,debate_id,subdebate_id
"Hall, Jill, MP",ALP,2000-09-05,"—Education is the key to success both within Australia and on the world stage. It is the key that unlocks the door to knowledge, success, choice and a bright future. If as a nation we do not make a commitment to education and a commitment to quality education for all Australians—not just the few Australians that can afford to attend the exclusive private schools, the 62 category 1 schools many ministers and members of the government attended—then we as a nation are in real trouble. Education is something that is for everyone. Education is something that is a priority for a nation such as Australia.
In Shortland, the electorate that I represent—in actual fact, in the whole of Newcastle—there is not one category 1 school. So how is this increase in funding of nearly $50 million to 62 schools relevant to the people that live in the Newcastle area? It is not very relevant at all. It shows just where this government's priorities stand. 
This 1950s style government is led by a Prime Minister that sits in his Chesterfield chair, dreaming of the past and seeking to take Australia back to that era—an era where if your mother and father had an education, then you could aspire to a university education. But if your mother and father were ordinary blue-collar workers, working hard just to survive, then you were expected to follow them. The idea was that you had your place in life and that is where you stayed. If you were very lucky, then you could aspire to attend a technical college and maybe end up with a trade. But you must never, ever try to move out of your station in life. This is the vision that our Prime Minister, the Minister for Education, Training and Youth Affairs and the members on the other side of this House have for Australia.  
This government has a distorted, outdated view of the world and the type of society we should live in. It is a view that is built on privilege and a belief that there should be a privileged class. The people that should form that privileged class are the government, the friends of the government and all the `right type' of people—those with money, those that have money now, those with education, those that have education now, those that have property, those that own great wealth and those in big business—and friends like Kerry Packer who gambles more money in one night than most people see in a lifetime. 
This government supports and believes in a culture of privilege and elitism, and nowhere is this more visible than in education where this government demonstrates its philosophy. Nothing can be a greater determinant of wealth and opportunity in life than education. What this government is seeking to do through this SES model is to ensure that only those from a privileged background are able to obtain that education. Study after study has shown that a person's educational level determines their income level, which in turn determines their life opportunities and all the choices they have in life.
This government wants to keep that education in the hands of a very few people, those people that can afford to go to wealthy schools. This government has attacked the public education system in every way and has actually made an art of being able to attack public education. It sees the system as something to be applauded and pursued with a passion. That is the way the ideologues on the other side of the House see it. You only enter the public education system if you cannot afford anything better. It is not a real choice. We really should not do too much to support people who go to private schools. 
 Since the Howard government was elected in 1996, it has embarked on a 10-year campaign of undermining public education. There have been massive cuts to universities—$1 billion out of our universities. Research and development money to universities has gone. There are plans to charge $100,000 to do a degree. What ordinary Australian children coming from ordinary working-class families can afford to pay $100,000 for a degree? I certainly could not have afforded to do that. I could not have afforded to pay that for my children to go to university. What this does is really put university education in the hands of an elite few. There is talk about bringing in vouchers for education. The government wants to replace HECS with real interest rate loans. This is a disgrace. The government has slashed funds to TAFE; it has devised a plan to privatise education in Australia. 
We know this is a government that believes in selling everything off. It has sold Telstra. It is pushing Australia down the privatisation road all the time. But surely you have to draw the line somewhere. Surely education is something that it is the role of government to provide. This government sees it as something that it brokers out to its friends in the private sector. Those that can afford it will get the quality education.
The Commonwealth funding is now being massively biased in favour of the wealthy schools—the schools that the members of this House who sit on the other side of this chamber went to. A majority of them went there. I find myself asking why any government would be so stupid as to jeopardise our future. I can only come up with one answer. That is that they are zealots. And the two head zealots are the Minister for Education, Training and Youth Affairs and the Prime Minister, who are driven by an ideological obsession with the market. This government has pursued the privatisation of Australia's education system with zeal, and it is leading Australian society down the road to a future of lost opportunity and division, a society of haves and have-nots, where there are people living in absolute luxury, people that can have anything they want, whilst on the other hand there are people living from day to day, people that are having to approach charities for handouts, people that work hard and just cannot survive. This is a very sad picture in a country like Australia. 
What this government is doing is entrenching the trends of the past where the children of professional parents were twice as likely as children of unskilled parents to go to university or even complete year 12. This is what it believes our society should be like—that it should be not your ability that determines what level of education you get but rather the family finances. I find myself looking at a number of decisions that are taken, particularly in education, and I feel as though it is a revival of the old feudal system. When I was at university, I looked at the natural order of things. It was put that there is God in the centre, then the nobles. I think that members on the other side of this House see themselves as the nobles. Then there is the middle class, who can aspire and have some money. Finally, you have got the workers. And the workers stay there; they must never look to change their position in life. I think the government sees us as ants and bees where you have the workers and the drones, and that is where they always stay. The queen is at the top. The government's vision of society is not of a modern, 21st century society. It is not an inclusive society. If it were an inclusive society, the government would understand that the wealth of the country should be shared by all. Education should be shared by all. Without sharing education, you cannot share wealth. 
The ministers and our Prime Minister argue that by giving an extra $50 million a year to category 1 schools they are giving students and their parents choice. I ask the minister and the Prime Minister what choice they are giving a family that is struggling to put bread on the table. What choice will they have to go to, say, Scotch College, which has been given quite an airing here in the parliament? Where will they find the fees to pay for that? It is no choice. What the government is doing is taking money that would have been going into a school that they could actually afford to send their children to—the good local public school. What it is doing is taking money and resources away from those schools. What it is doing is ensuring that the public school down the road will not have a computer in it, will not have the same sporting equipment that the rich, category 1 private schools have. I find it absolutely despicable.
The bonanza the government has delivered to the category 1 schools may lead to a school like Melbourne's Wesley College reducing its $11,000 a year fees by $200. That will not benefit ordinary Australians and their children and it certainly will not benefit the people of Newcastle and Central Coast, the people that I represent here in this parliament. When we look at the members of the Howard ministry and where they went to school, we get some understanding of why they are giving category 1 private schools this extra $50 million. John Anderson went to the Kings School, Parramatta. The fees are $11,595. I know there are not too many families in Shortland that could afford that. Peter Costello went to Carey Baptist Grammar, Alexander Downer to Geelong Grammar, Robert Hill and David Kemp to Scotch College, Nick Minchin to Knox Grammar, Jocelyn Newman to Presbyterian Ladies College in Melbourne, Peter Reith to Brighton Grammar School, and Michael Wooldridge to Scotch College—Scotch College yet again!
Well, well, well! It is no wonder that we are here today giving extra money to those category 1 private schools. We are not about delivering quality education to all those kids that live in the south-west of Sydney, the west of Sydney, the Hunter; we are about making sure that those with money, those that come from a privileged background get the absolute, ultimate best!
We in the opposition support giving more funding to needy Catholic schools and independent schools. We are not opposed to that. But what we are really opposed to is the subsidising of wealthy schools, particularly when that subsidisation is at the expense of public schools, at the expense of ordinary Australian children. What it is doing is taking away their opportunity to gain an education. The government's SES does not take into account the resources that schools have either. I was absolutely disgusted when I read in the newspaper that donations and gifts to schools such as Richard Pratt's $1 million cheque to Scotch College last year will be ignored. The resources of the schools are totally ignored. These category 1 schools can get as many donations as they like, they can have as much money in the bank as they like, yet the government is still going to roll out this $50 million to the 62 most wealthy schools in Australia. I find that despicable, unacceptable and un-Australian. This government has a belief that it must redistribute wealth by taking it from those people in the most need and giving it to those in the least need. In other words, it thinks that those people that are poor and struggling or just making ends meet should take money from their pockets and give it to their wealthy friends. 
With this legislation we see examples of how millionaires who live in rural areas will be classified as poor if the postcode fits. Most of us live in areas where there is a mix of income levels and some areas are wealthier than others. But if an area has a substantial amount of people that earn a low income then the wealthy people will still have the education of their children subsidised. It is just not good enough. 
The Howard government's privatisation of our education system will have a devastating effect on the future of our children. This government is lowering the expectation of those Australian students whose parents cannot afford to send their children to school. This is really going back to the 1950s. I was talking to a young indigenous student recently who went along to a conference with other indigenous students. This indigenous student was horrified because she said, `Oh, when I finish year 12, I want to go to university,' and other indigenous students were saying, `Yes, I'd like to go to university too.' But the people that were in charge of this conference were saying, `Well, now, dear, maybe you shouldn't be thinking about going to university. Maybe you should look towards TAFE.' It is more of this stereotyping and putting people into little boxes. The little box areas—indigenous Australians, young Aboriginal people—should not be looking to university! Rather, if they are lucky, they may make it to technical college or TAFE!
This is a government of the 1950s, one that stereotypes all Australian students and Australians, one that has values reminiscent of the past and a destructive agenda, and one that robs students of opportunity. This is a government that is ensuring that only those with money have an education. It is elite. It has an elite approach to education and it wants to ensure that its friends are the elite of our society, that its friends are the ones that get to share the wealth. The Labor opposition do not accept this. We believe that all Australians should be given the opportunity to have a quality education. We believe that to deny bright young Australian students the opportunity to attend university is despicable.
The EBA should be abolished. We should restore funding to disabled students. Educational priority zones will be among things that the Labor Party will do, things that will really improve education in this country. The nations with educated, skilled work forces are the nations that will thrive. All Australians deserve a quality education. Your level of education should be determined by your ability, not your parents' income. If this government continues to privatise our education system, the system that 70 per cent of all Australian students attend, Australia will be the loser.",REPS,<title>STATES GRANTS (PRIMARY AND SECONDARY EDUCATION ASSISTANCE) BILL 2000</title>,<title>Second Reading</title>,Bills,11,1
