name,party,date,text,chamber,debate_title,subdebate_title,debate_type,debate_id,subdebate_id
"Andrews, Kevin, MP",LP,2000-09-05,"—Socioeconomic status is a key predictor of educational disadvantage, although there are of course interesting exceptions as shown by studies both here and overseas. Certain migrant groups from the lowest socioeconomic status groups, among which Asian families figure prominently, do not conform to such predictions. For example, a United States study found that 30 per cent of the children of Indochinese boat people scored better than 90 per cent of American students on mathematics and only slightly less well on language skills. Another fascinating United States study found an illuminating difference between attitudes to failure at school among Caucasian Americans, Chinese Americans and People's Republic of China nationals. The first group, the Caucasian Americans, attributed failure to bad luck or bad schooling. The second group, the Chinese Americans, attributed failure to lack of effort with some allowance for other variables, and the PRC Chinese overwhelmingly put failure down to lack of effort.
In Australia, some ethnic groups have notably outperformed Australian born students and this is even in cases where the IQ of individuals is lower and the socioeconomic status is also lower. One such group of high performers are the children of first generation immigrants of Greek peasant background with either little or no education at all. In all such cases, it seems that the key is the attitude to education held by the parents. Parents in these groups want their children to get the education they never got and they instil in their children an ideal of the value of education and of how it can be used to make a better life. Obversely, a major study in the US, the Coleman report, found that although black youths registered highly on the measure `interest in learning', their inability to imagine that any efforts of theirs could be successful meant that there was a negative correlation between years in schooling and achievement. You need to be able to imagine success before you can achieve it. The same poor Afro-Americans ascribed success more to luck than to effort. So there is a lot more to education outcomes than socioeconomic status alone but, despite the exceptions I have outlined, it has to be said that, sadly, where one is born and where one goes to school does seem to correlate with how one fares in the education system. A recent survey by the Australian Council of Educational Research found that students from poorer areas and those with less well-educated parents are opting for more vocational subjects in year 12.
This States Grants (Primary and Secondary Education Assistance) Bill 2000 represents a sea change in funding arrangements for the school system, particularly for the growing non-government sector. It introduces new funding arrangements in the form of the SES, or socioeconomic status system, for non-government schools for the period 2001 to 2004. It is important to emphasise that this model is based on an independent assessment of the socioeconomic status of the school community and a vigorous and far-reaching consultation process with schools. The bill replaces a complex and outdated assessment of school resources, the Education Resource Index, known as the ERI. One of the problems with the ERI was that schools serving the same community could be funded at different levels under the category levels. Another was to do with disincentive. Schools wanting to raise extra funds through school fetes and the like could have their Commonwealth funding reduced in consequence. Schools were also locked into a funding level which determined their school community even if there had been fundamental changes in the socioeconomic status of that community. 
The ERI, it was also universally agreed, was enormously complex. It was transparent enough when it was first introduced but over the years had built up various layers of opacity, mainly the result of political decisions that had more to do with the electoral process than with logic or rationality. When it first started, there were eight categories, then there were six and then there were 12. Each time the number changed, there were changes to the formula. At one time it measured only expenditure on recurrent resources. It later measured recurrent resources but with a check on expenditure on capital. Then it assessed only income, and after that it checked it against expenditure as well. So ERI has been described as akin to tax law in its increasing complexity over the years. Both the ERI and the new SES have this in common: they assume that Commonwealth funding should be on the basis of needs. This is the continued assumption in the new system of funding: that schools should be financed in accordance with their level of need. This needs to be stressed because otherwise we could be led astray by the overwrought rhetoric of the opposition in this chamber.
The SES model which this bill introduces is the result of consultation with state and territory governments and with both the government and non-government school sectors. The terms of reference for the review of the ERI were circulated in the period from February through to April. After this there was a further round of consultations with the states and territories and, since the introduction of the bill, a national process of consultation across all jurisdictions across all states and territories and national peak bodies between July and August. The overwhelming response from schools to the review was that the ERI mechanism no longer accurately reflected need and did not allow schools to respond to the changing needs of their communities. This was particularly a problem for rural and regional communities throughout Australia. The strong point of the new SES system is that it allows funding along a continuum to reflect the capacity of a community to support a school.
What is also a key to understanding the new system and the reason for its coming into being is the government's belief that all students are entitled to a base level of public funding, regardless of the school which they attend. This means that schools on the highest SES score will have their minimum entitlement set at 13.7 per cent of average government school recurrent costs. The maximum Commonwealth entitlement for the neediest schools and for special schools will be set at 70 per cent of average government school recurrent costs. Increased funding for schools will be phased in over four years and the government has given an undertaking that no school will be financially disadvantaged in moving to the new funding system.
This bill has two important further provisions which are quite novel. The first of these is that schools will not be penalised for raising private income, in line with the government's belief that communities should not be discouraged from providing additional resources for their schools. The second change is that distance education students in non-government schools will become eligible for Commonwealth recurrent funding set at 13.7 per cent of the average government school recurrent costs. Distance education students in the government sector already benefit from this, and this measure gives parity to those in the non-government sector in similar circumstances.
This government takes seriously its responsibility for dealing with the continuing scandal of illiteracy and innumeracy in our schools. At the end of 11 years of Labor negligence of performance assessment in the schools, up to 30 per cent of our children were finishing school unable to read or write with any proficiency. As a result of this bill, literacy and numeracy benchmarks agreed to by Commonwealth and state ministers will be incorporated into regulation. Other performance measures will also be incorporated as they are agreed to by education ministers. This emphasis on accountability and measurement of performance is part of the sea change which the Howard government has brought about in how government deals with schooling. 
The opposition have made a meal out of objecting to any increase in funding for wealthy non-government schools. The points they fail to mention or to take into account in this debate are that, where schools do have high resource levels, that is due to the investment of after tax dollars in fees from parents, donations and sponsorships. This government does not believe in penalties for private investment in education. In any case, communities that have a high capacity for generating funds will be shown up in the SES index and, as a result, will get less public funding for the schools to which they send their children. The opposition have been throwing about a lot of erroneous figures about how much will be going to the most wealthy schools under the new funding arrangements. No individual school among the wealthiest 62 will be funded at an average level, as the Labor Party keeps saying. Some will receive funding at a higher level only because of the guarantee that funding will be maintained where otherwise it might have been reduced. This is to say that such wealthy schools receive that funding only because they were maintained at that level by Labor.
The Commonwealth government is increasing funding for government schools more rapidly than any state government in Australia. This is despite the fact that the states largely control funding for the government sector while the Commonwealth is responsible for the non-government sector. The Commonwealth will be spending $402 million more on government schools this year than in 1996, when the Labor Party legislated the amount of funding for government schools. This represents a 26 per cent increase by the Howard government for government schools over the past four years, yet the number of students in government schools has increased only by 2.3 per cent. Non-government organisations—Catholic and non-Catholic, independent and Christian schools—support this legislation. They see it as providing choice for working-class families.
The Catholic Education Commission have chosen to stay outside the SES system for their own reasons. They employ the SES to distribute funds within their system. The Catholic sector supports the government's legislation and has been urging the opposition to support this bill. Father Tom Doyle, Deputy Chair of the National Catholic Education Commission and Chair of the Victorian Catholic Education Commission, told the Senate committee that he:
... supports the [bill] ... and endorses the Commonwealth's application of the principle of need in making grants to Catholic systemically-funded schools.
This bill is about introducing fairness, equity and social justice into our schools funding. On this side, these concepts are more than just airy nothings. The Labor Party, for all their sound and fury, are supporting this bill. I think that speaks for itself. I commend the legislation to the House.
Sitting suspended from 6.23 p.m. to 8.00 p.m.",REPS,<title>STATES GRANTS (PRIMARY AND SECONDARY EDUCATION ASSISTANCE) BILL 2000</title>,<title>Second Reading</title>,Bills,11,1
"Ellis, Annette, MP",ALP,2000-09-05,"—I am pleased to have the opportunity to speak on the States Grants (Primary and Secondary Education Assistance) Bill 2000. But in doing so I must make the point that a Senate committee is currently inquiring into this legislation. I think it is reasonable to ask why we are debating the bill prior to the findings of that committee being released. It is a legitimate question; the government has yet to answer it in a convincing way. I make that note in passing.
This bill represents the formal legislation for Commonwealth funding for government and non-government schools for the period 2001-04. I understand it represents appropriation of around $18 billion or, in other words, $7.6 billion for government schools and $14 billion for non-government schools. Translated into percentage figures, 35 per cent of Commonwealth-only funding for schools is directed to government schools and 65 per cent is directed to non-government schools. The bill introduces a new method of per capita funding for non-government schools. This new method of funding for non-government schools means changing from the current education resources index, ERI, which assesses a school's total resource levels, to an index which measures the socioeconomic status, SES—occupation, education and income—of all of the parents who send their children to a particular school. The SES is based on the areas of data collection of the Australian Bureau of Statistics. While introducing this new funding formula, the government is also proposing to retain the enrolment benchmark adjustment policy, the EBA. 
I understand that the government conducted a simulation project in 1998 to test the theory of this new funding process. I believe that around 691 schools were involved. However, on the best available information, it seems that the simulation project threw up some interesting outcomes. At this point, I must say that not all of the details and not all of the figures are available from the government, and I must reflect upon my comments earlier in relation to the Senate committee inquiring into this legislation. It seems difficult and somewhat unacceptable for the House to be asked to consider such an incredibly important bill when a Senate inquiry is under way and when all of the figures have not yet been made available to people on this side of the House. One of the interesting outcomes of the simulation project was that three-quarters of the 691 schools involved were better off under the new system and would move to this new SES funding system. Another prediction is that the 63 wealthiest schools in Australia, presently category 1 schools, will receive some $46 million extra funding a year under this bill.
By contrast, I understand that no extra recurrent funding, other than indexation and enrolment adjustments, is provided for government schools. Also, the EBA, the enrolment benchmark adjustment process, will continue to apply. We in the Labor Party have already announced our intention to abolish the unfair EBA and to put back into government schools funding essential for their future—funding which the Howard government is planning to remove from them. The EBA has removed about $60 million from government schools in the past three years, despite the fact that those same schools have enrolled more than 26,000 extra students.
This debate is not class warfare, as the government would like everyone to believe purely on the basis of our objections; it is simply about fairness and equity. I personally do not object to it purely because some private schools seem to do well out of this funding mechanism; but I object, and I object strongly, when I see the funding formula take money from one sector and funnel that money into another sector. It is that inequity that I object to. It is simply not good enough, it is simply not acceptable, when we know that the 70 per cent of children who attend government schools will suffer as a consequence of this government's actions within this bill. The Minister for Education, Training and Youth Affairs has the front to stand in this place time and again, metaphorically with his hand on his heart, and say that funding to government schools has increased under his stewardship. This is simply not the case. I do not believe that either sector—the government school system or the non-government school system—wants to have this debate. The Prime Minister and his minister for education are creating a division between them by applying this retrograde policy through this bill. We will abolish the EBA—that is an absolutely unequivocal statement—and we will invest in an honest and appropriate education system for all of our children. 
An area within education which needs special consideration in this debate is that of students with disabilities. This is a constantly growing problem and a perfect example of where government attention ought to be focused. I recall a Howard government promise back in 1996 that an extra $16 million or so would go towards special education. I am not quite sure whether that was a core or a non-core promise. It must have been non-core because it disappeared, along with many other similar undertakings, between then and now. I believe this bill provides a modest increase in funding in this area for non-government schools, but it does not increase at all the overall level of funding for these students in government schools. In fact, I understand that students with disabilities attending government schools will see per capita funding decrease from $126 to $102 per year. With more than 32,000 of these students, that adds up to around $750,000 a year—a very disturbing outcome in anyone's language. How can anyone call that fair or just?  
 The question of students with disabilities has been in the media to a great degree in recent times, particularly with regard to some non-government schools which have been calling for increased funding to cover their obligations and their requirements when they have children with disabilities attending their schools. I would applaud their call, but I would also say that, in doing so, we must consider what is happening in the government sector as well. When you see a drop in the per capita funding for children with disabilities in government schools from $126 to $102 per year, you can only condemn any government which believes that that is a proper, appropriate, fair or just policy to apply to any student anywhere in this country. Any increase is good, but let us be honest about what is really required.
Unsurprisingly, this bill has become very contentious and has drawn many varied views from many commentators. It would also be fair to say in a very general sense that the private school sector would be more pleased with the outcome of this bill than would the government school sector. I would like to go over the figures produced, I understand, by DETYA, the department concerned, which indicate the following. The average category 1 school will get an extra $800,000 a year. The average Catholic school will get an extra $60,000 a year—that is, 12 times less. The average government school will get a real increase of around $4,000 a year—200 times less. I support fully any extra funding for needy non-government schools. I also believe very strongly in a healthy, fair and just dual system. But to have that fair, healthy and just system, we must ensure that the system is funded in a fair, healthy and just way. Taking dollars from one and funnelling them into another is not fair, just or healthy.
This country's future depends on a government investing in our education system in a proper way. Many of our trading partners are showing investment in education systems and their future that, frankly, put us to shame. Australia is the only country in the OECD where we see spending on education, training and research declining. And it is declining at a rate that no-one could applaud. This government and this minister are failing our children, are failing our future and are failing this country if they continue on this ideological bent. What we should be debating is forward thinking, progressive legislation with fair and just investment in the whole of our education system—legislation that offers hope and reward to every child participating in that education system throughout the country, regardless of their financial circumstances and regardless of where they live. Instead, we see this tawdry attempt at playing around the edges, shifting valuable resources in a crude political game and selling short our children and their educational potential.
What this minister should do is, one, abolish the inequitable and unfair EBA; two, reduce those funding increases for the ERI category 1 schools and redirect that funding to special education in both government and non-government schools; and, three, provide increases in federal funding for government schools to match the significant increases for non-government schools. This is not about trying to drive a wedge between particular sectors of this community. It is not about saying that, if you live in one area and you happen to have the right socio-economic reading from that area, you will get more or less, regardless entirely of what may be required in that area. What it is about is a government and a minister being honest, dropping the ideological cloak that at the moment is encompassing them and saying that the calls for a proper and fair approach to education in this country are correct. 
The figures show the decline in investment. The figures show that some areas are far better off than others. Frankly, the policies that we announced through our national conference recently, with both the priority zones for schools that need the help and the abolition of the EBA, were the first two most important steps that we could see. Rather than the government scoffing at these things, what they need to do is to re-examine very carefully where they actually sit on these issues and to make sure that, at the end of the day, they are going to be able to face up to the outcome of their decisions. The outcome of their decisions will be read by this community at large and will be measured and judged in exactly the same way as this government is approaching them.
In conclusion, I oppose entirely the whole thrust of this government in relation to their education funding policy. I am appalled by the fact that they wish to drive such wedges through our community. We are going back in a debate that was finished many years ago. I would encourage them to consider very carefully the judgment of their actions in the future because, frankly, I do not know very many people out there at all in the general community who are going to applaud the outcome of this bill as it stands.",REPS,<title>STATES GRANTS (PRIMARY AND SECONDARY EDUCATION ASSISTANCE) BILL 2000</title>,<title>Second Reading</title>,Bills,11,1
