name,party,date,text,chamber,debate_title,subdebate_title,debate_type,debate_id,subdebate_id
"Beazley, Kim, MP",ALP,2000-09-05,"—Education is at the heart of the knowledge nation. Every kid has the right to fulfil his or her potential. Every kid has the right to creativity, to be excited by well-motivated, knowledgable teachers and a good curriculum. Every student has the right to good opportunities for the completion of their schooling. We in this place have a duty to reverse the appalling completion rate for our school students which has developed in recent years. Fortunately, the election of state Labor governments around the country is beginning to turn that trend back to where it was before the advent of Liberal state governments and then a federal Liberal government in the early nineties and mid-nineties. But it is only their efforts which are turning this trend around, and their efforts alone are insufficient to bring us to the sorts of levels of completion rates that we will need if we are going to be able to be both a happy society and a competitive nation this century.
These objectives can be achieved only through an education policy dedicated to the health of the whole system and not driven by blind ideology. The Minister for Education, Training and Youth Affairs, Dr Kemp, has been exposed over and over again in his obsession to damage and diminish public education. It is hard to understand how a man in his position can hold the public system—that covering 70 per cent of our young people—in such low regard. What is it that has convinced him that education must be returned to the days when the only road to success was to choose wealthy parents? The only way you could justify his proposed changes would be to think that this country was so well served by its education system, churning out such a surfeit of excellent school leavers in all areas of major economic need, that we should limit the supply. Does anyone think that that description applies to Australia today? No, it is all a case of ideological obsession.
As soon as he got the job in 1996, Dr Kemp set out to diminish the public system. We had evidence of it last year when we got a copy of his leaked submission to cabinet that would have resulted in $100,000 university fees, with the poor being forced into loans at market interest rates. We know that he has been motivated by blind ideology since at least 1991. We know this because we have another remarkable leaked document of a coalition meeting from June of that year. At that meeting Dr Kemp said:
... noted that the Coalition sought to encourage students to move from government to non-government schools and was committed to the funding of non-government schools.
At that meeting it was agreed that Dr Kemp would report back on: 
non-government schools—whether additional expenditure could be offset by reductions in grants to government schools and in untied grants.
So that was his strategy as far back as his opposition days, nearly a decade ago—to get Australian children out of the public sector and into private schools, and to find the extra money by taking it away from the public schools. He has sought to demonise the public schools, demonise the teachers in public schools and diminish their actual resources so that they would find it difficult to achieve the bars that he set them to jump, putting those resources into a select section of private schools. And this is just what he has done with his enrolment benchmark adjustment in which the states lose federal funding if the public school share of the state's enrolment numbers falls. This is a clever financial disincentive to state governments. It is a clever mechanism for diminishing state schools with a spurious argument that conjures some sort of notion of equity as you go through it. He even had the hide to stand up in this place in question time the other day and say this was not an education measure. What else was it supposed to be? It certainly featured as an education savings measure in the 1996 budget.
The States Grants (Primary and Secondary Education Assistance) Amendment Bill gets rid of the old 12 categories of funding for non-government schools. Instead, it introduces a so-called socioeconomic status for funding. Dr Kemp has had a lot of difficulty in explaining how this would work. It seems, from the evidence of officials in parliamentary committees, that the upshot would be that the top 62 category 1 schools in Australia will be the major beneficiaries. The ability of these schools to fund themselves, through their $10,000 fees, through graduand gifts, parental donations and the like, will no longer be taken into account. Their massive resource capabilities would no longer be taken into account. Instead, the addresses of parents would be examined to see whether they fall into wealthy or poor areas, as determined by a four-year-old limited census survey.
Under this system, children of millionaires who nevertheless live in relatively poor areas, such as many rural regions of Australia, will be deemed to be needy and funding to the school would be increased. Elite private schools that admit some of `the underprivileged' on scholarships will be rewarded by extra funding. It is clearly designed to get as many kids as possible out of public schools and into private schools. But this is not Dr Kemp's only motive. This is because his new funding formula does not give to private schools equally.
As many independent commentators have spotted in this legislation, the poor Catholic schools, by far the biggest group in the private school sector, are a loser in this system. We support the decision of the Catholic Education Commission to opt out of David Kemp's new system. The Catholic commission is trying to provide for the nation's 1,600 Catholic schools, some of which are among the poorest of non-government schools. We believe it is totally unfair that they should receive only an extra $157 for each Catholic school student, compared to an average $900 increase for each pupil in elite category 1 schools. The minister likes to claim he has the Catholics' support. The new funding formula has been politely received by the Catholic education authorities. They are always polite in dealing with Commonwealth governments when there is any increase at all in the resources being given to them. But make no mistake: they are alert to the dangers of the new so-called socioeconomic status—or SES—funding. As the Deputy Chair of the National Catholic Education Commission, Father Tom Doyle, said on August 22:
We would still maintain that the SES model in itself was not sufficient and that it needs modification ... that is why we talk about SES plus things like resource indicators and resource availabilities.
Precisely what I have been talking about. We have had it confirmed by high-level education officials that the top 62 schools in Australia will get $50 million extra to share, while the 1,600 Catholic schools receive only $100 million per annum extra. Top category 1 schools, like the ones most of the government frontbench went to, do very nicely, while those in the local Sacred Heart Convent, like the ones at least 40 per cent of my frontbench went to, hardly get enough for a couple of library books. It looks as if David Kemp has taken a spiritual point from St Matthew's Gospel literally as an issue in public policy:  
    For unto every one that hath shall be given, and he shall have abundance: but from him that hath not shall be taken away, even that which he hath.
The origins of David Kemp's position lie deep in history. His views are of a piece with the Liberal Party's opposition to state aid—a debate resolved by my father in the 1970s. The Liberals opposed needs based funding then, and today Dr Kemp has found a formula to try to get back to those days. I remember them well. I remember my father telling me that Malcolm Fraser leant across the dispatch box while he introduced his bills and said to him, `You will not get these bills. They will be defeated in the Senate.' What he was saying was that the poor schools of Australia would not get that funding. They got it after my father was hospitalised with a heart attack, when Lionel Bowen, who in many ways is a more worldly figure than my father, went around to the National Party and gave them a list of the Catholic schools in their electorates which he intended to visit to explain to them the consequences of the coalition's policies. And so it went through.
We in the Labor Party, as evidenced by the fact that we are the authors, are not opposed to private schools receiving a decent share of federal funds. My father's reforms ensured that people who pay their taxes to see a proportion of their money go to the schools attended by their children get some just reward—it is only fair. But we do not support the inequalities in David Kemp's legislation, and we know they are against every wish of ordinary, decent Australians. We know that education is a fundamental concern of Australians and that it is getting more important in this society to get a good education. What we in the Labor Party believe, unlike our opponents, is that a good education is not just a private desire; it is a public investment for the public good. There is simply nothing more important for the future of this country than a good education system. We know, although our government cannot seem to grasp it, that we cannot afford to let our education system run down.
The public system, which the majority of Australians will continue to attend, lies at the heart of our commitment to education. We need every child from every family to get the basic building blocks to allow them to take their place in the revolution going on in our workplaces. We are already 30,000 information technology workers short in this country. We desperately need more science and engineering graduates, as well as more and better teachers in `enabling sciences'. Does David Kemp think they are all going to come out of 62 elite schools? Whenever we raise public education as a national concern, he comes in and makes patronising comments about how the government has some technical education programs or traineeships for the poorer areas of Australia. Of course, many of these programs were begun by Labor in any case. We agree that these programs are essential and that this country needs well-educated, technical trainees. But we need much more than that. We cannot just sit back and hope that somehow we will muddle through, that our education system may, through luck, manage to produce enough high-technology, science-literate, innovative and adaptable workers for the knowledge economy.
As our competitors around the world know, it takes planning, it takes investment and it takes something this government has never had—a commitment to equality of opportunity. The population of this nation is too small to go backwards to David Kemp's notion of the elite—those who deserve the best because they were born into the right families. We need to get the best out of everyone—the kids of struggling working families in the west of Sydney; children of farmers battling to break even in the bush; and sons and daughters of Australians who believe in the public system, who pay their taxes and who want their schools improved. 
The minister often comes into this House and takes refuge in what he perceives to be the failure of public school teachers, yet these people are the backbone of many communities in this nation. For modest pay, these teachers take on big classes, literacy and numeracy problems, sports and music needs, discipline issues and a rapidly changing curriculum. Besides those, these folk take on many of the essential organisational requirements—the sporting, social and voluntary activities—of the towns of regional Australia. I well remember when the Teachers Union in Western Australia organised a work-to-rule to pursue their case. The people who were first to complain about it were all the country football teams that lost their coaches and the local fire brigades that lost their workers. One after the other these teachers, so demonised by this minister, had their full public value drawn to the attention of the bulk of the Australian community in generally Liberal voting electorates.
We all know there are problems. As the government's chief scientist reported recently, many teachers are being forced to teach subjects they are not trained in. It is impossible to excite growing kids into an interest in science and maths—the building blocks of the knowledge revolution—if you do not have any background in these subjects and you are two or three lessons ahead of them. All of the latest research suggests that the best way to improve education is not to change the state and private split, as Dr Kemp believes, but to improve the subject expertise of teachers and to attract high calibre graduates to teaching, with a particular but not exclusive emphasis on science, maths and information technology skills.
We have already begun to address these problems. We have announced details of our teacher development contracts and our teacher excellence scholarships. We will work with communities in disadvantaged areas to introduce education priority zones to lift the quality of education in the areas that need it most. We will assist students, teachers and parents through new technology, with our Learning Gateway web site, giving instant access to a huge range of educational services and a thorough understanding to parents about where their children are going, the sort of curriculum that they are dealing with, where that curriculum will take them and the sorts of tests they will be obliged to confront. That is real community knowledge and community participation, and it will underpin those priority zones, which will be community based. Communities will determine their needs. That need may be for additionally qualified teachers, it may be for special literacy programs or it may be for mentoring programs into ultimate traineeships or onto university. There is a whole range of things—one size does not fit all—in our communities, and this will address them. We will double the number of educational research scholarships at universities, an idea recently taken up by the chief scientist. Beyond this, we will introduce a new category of fellowships to keep the best and brightest Australians here.
Here is something that will be popular with almost everyone in the debate: we will abolish the hated enrolment benchmark adjustment. We will not penalise our public system because of an ideological fixation. Here is the central issue at stake: the minister has to explain to Australians, in a context of scarce public resources, how giving $50 million to category 1 private schools will be a more effective policy than improving opportunities for ordinary kids throughout this country. Until we get an answer to this, we will be seeking to adjourn debate on this legislation. It is an insult for this parliament to be asked to pass a $22 billion bill before the government provides detailed final figures on the bill's true financial effect. We are supposed to be the checkpoint of the accountability of legislation before us. If we cannot get a complete and clear picture of how this very confused model produces a particular outcome for individual schools, no-one can get it. We have an absolute right as the House of Representatives to demand that prior to passage of these bills. 
We are not alone in our criticisms. If the minister does not want to listen to us, there are others he might heed. Take, for example, Victorian Supreme Court Justice Frank Vincent, who is also Chancellor of Victoria University in Melbourne's western suburbs. Justice Vincent, who came from a battling family himself and went to a state school, said on 31 August:
I am decidedly uncomfortable with any of the processes which are increasing the practical discrimination against the poor in this country, and I fear that might be happening at the present time with these new funding structures ... There were, for a period of time, avenues of opportunity for people such as myself, and I'm concerned that those avenues are being cut off dramatically as time progresses.
It is an extraordinary statement from a man in a position to judge. We are going backwards in equity. There has been widespread community outcry about the unfairness of the minister's aims. The Melbourne Age, in a blistering editorial, said: 
    The government's new socioeconomic status funding system for private schools, which will provide the massive windfall gains for the richest schools, will only entrench the disparities within our education system. It is not in the best interests of the nation to go down this path.
The Australian, often a supporter of the government's market driven policies, was equally scathing:
    The reforms are tantamount to conceding defeat in the battle to improve the quality of education available to all. The Government has a duty to spend taxpayers' money where it does most good, for those who need it most.  Dr Kemp's system leaves the elite the richer and education the poorer.
This is a massive indictment. The commentators know it, the education industry knows it and students, teachers and parents know it. It is time for the government to wake up to itself. Under the Howard government, the policy—as in so many other areas—is for the rich to get richer, the poor to get poorer and the middle to be squeezed. Under the Howard education regime, it's back to the four Rs—Reading, 'Riting and 'Rithmetic for the Rich. That is the antithesis to Labor's approach, and that is why we want this debate adjourned—so we can have a proper discussion on the public investment issues associated with education.",REPS,<title>STATES GRANTS (PRIMARY AND SECONDARY EDUCATION ASSISTANCE) BILL 2000</title>,<title>Second Reading</title>,Bills,11,1
