name,party,date,text,chamber,debate_title,subdebate_title,debate_type,debate_id,subdebate_id
"Ellison, Sen Chris",LP,2001-09-19,"—I thank those senators who have contributed to the debate on the second reading. The States Grants (Primary and Secondary Education Assistance) Amendment Bill (No. 2) 2001 amends the States Grants (Primary and Secondary Education Assistance) Act 2001, which authorised establishment assistance funding for the 2001-04 funding period. Establishment grants have been provided to assist new non-government schools with costs incurred in their formative years and also to enable them to be more competitive with existing schools. The bill increases the funding for establishment assistance to non-government schools for the 2001-04 program years in line with current estimates of demand. The act provided for total establishment assistance of $4.7 million for the 2001-04 program years. The amendment bill increases the total funding to just under $14.3 million, an increase of $9.5 million over four years. This amendment bill increases the cap on funding rather than directly increasing the funding for individual schools. It ensures that sufficient funding is available to pay all new schools their full entitlements for the 2001-04 program years. 
The States Grants (Primary and Secondary Education Assistance) Act 2000 provided for two categories of new schools that will be eligible for establishment assistance. All newly commencing systemic and non-systemic schools applying for general recurrent grant funding from 1 January 2001, and newly commencing non-systemic schools that applied for general recurrent grant funding after 11 May 1999 and were approved with effect from 1999 and 2000, are eligible for establishment assistance. Establishment grants are available at the rate of $500 per full-time equivalent or FTE student in the first year of the school's operation and $250 per FTE student in the second year of operation. Newly commencing non-systemic schools that applied for general recurrent grant funding after 11 May 1999 and were approved with effect from 1999 or 2000 are also eligible for establishment grants in 2001 and 2002. New schools not approved before the end of June 2001 will receive nothing without this bill being passed. All 54 schools currently approved for funding—involving nearly 4,000 students—will be denied their second grant instalment, due in October 2001, if this bill does not pass. There will continue to be shortfalls in funding for future years without the passage of this bill. This will affect the funding of new non-government schools across Australia, and the ramifications that I have just pointed to are dramatic indeed.
The shadow minister for education has said that the states grants legislation passed last year included no extra funding for government schools beyond cost supplementation. The government rejects this outright. This ignores the extra $238 million that the coalition provided for government schools in this year's budget. That includes $143 million over four years through funding identified by the enrolment benchmark adjustment and applied to develop students' scientific, mathematical and technological skills; $28.8 million for literacy and numeracy over the 2001-03 period; $23.8 million over five years to support online curricula; $32.7 million over four years to assist people moving from school to further education, by maintaining the important Jobs Pathway program at its current high level; $6.7 million over four years to the Enterprise and Career Education Foundation for extra work placement coordinators in remote areas of central and northern Australia, a very important initiative for regional and remote Australia; and, finally, $2.5 million to pilot career and transition advisers, who are very important for those young Australians looking to their future.
Of the specific schools initiatives in this year's budget, 87 per cent of the funding is directed to the 69 per cent of students in the government sector; that is, the majority of that funding is directed to the 69 per cent of students in this country who are going to government schools. This refutes outright the claims by the shadow minister for education and demonstrates the commitment of this government to the government schools sector. On a proportionate basis, this is $50 million more than government schools could expect on the basis of their enrolments, and that is $20 million more than what Labor is seeking in its amendment to this bill. The shadow education minister has stated that the ALP will support this bill if the government agrees to provide a comparable increase in funding for capital works for government schools. The government is contributing $222 million to state governments this year for capital works in government schools. MCEETYA figures suggest that the total Commonwealth and state funding for capital works in government schools each year would now be in excess of $650 million. Accordingly, this government does not support the amendment proposed by Labor and sees it as totally unnecessary in view of the substantial funding provided by this government to the government schools sector.
There have been a number of allegations made by the Australian Education Union about so-called rorting and loopholes and yesterday we heard Senator Carr raise allegations of fraudulent receipt of an entitlement to establishment grant funding. Firstly, I would point to what Senator Carr himself said, and that is that he recognised that the registration and recognition of new schools is a responsibility of the state registration authority and not of the Commonwealth; that is, it is not the Commonwealth government but the states that approve the formation of new schools. Secondly, all new schools have been legitimately approved as newly commencing schools and have met the requirements of the legislation and the administrative guidelines governing their approval. There has been no evidence to the contrary. If Senator Carr or any other senator has any information about fraud in respect of a particular school then, of course, I will arrange to have that fully investigated and, in the event there is substance in a claim, appropriate investigation or recovery action will follow. But I reiterate: the formation of new schools is approved by the state authority and not by the Commonwealth.
We should not lose sight of the purpose of this bill. The establishment grants policy has already been legislated by this parliament. This bill simply provides the necessary funding to schools that have an entitlement to the funds provided by this legislation. The Commonwealth seeks to improve outcomes for all Australian students, by strengthening both government and non-government schools. To put this in context, it should be noted that this government's spending on government schools is at its highest level ever. Total funding for government schools in 2002 is $2.2 billion, some $669 million more than Labor provided in its last year in office; that amounts to an increase of 43 per cent. In the four years to 2004, total funding to government schools will be around $9 billion. This bill spells good news for those new non-government schools that are being formed and good news for the education sector in Australia, and the government stands on its record of funding strongly both the government and non-government sectors in this country. I reaffirm this government's commitment to a strong government schools sector and a strong non-government schools sector. This bill is a necessary part of that commitment, and I commend it to the Senate.
Question resolved in the affirmative.
Bill read a second time.",SENATE,<title>STATES GRANTS (PRIMARY AND SECONDARY EDUCATION ASSISTANCE) AMENDMENT BILL (NO. 2) 2001</title>,<title>Second Reading</title>,Bills,2,1
"Payne, Sen Marise",LP,2001-09-19,"—I rise to speak in this matters of public interest debate today on the question of the movement of people worldwide. I think this international challenge has been building in the modern world for decades, but in my view it will be one of the great challenges of the 21st century. I do not want that to detract, of course, from the fact that I have previously mentioned on the record that I think the impact of the disease HIV-AIDS is another of those great challenges, and it is ironic indeed that the two, in many locations, are intertwined. 
I think the events of last week put life in focus for the Western world in many ways, but most particularly it puts a focus on our vulnerability. For the people of many countries, war and terrorism have been waged in and around them for decades, the result being that they know only too well the precious and often fleeting nature of human life; and many of them, for a range of reasons, leave their countries. Where do they end up? That is the vexing question.
It was not until I came to this role as a member of the Senate that I gained any experience in the area of immigration. I now suspect that I have acquired much knowledge that I never believed I would get, possibly through my experience chairing the Senate Legal and Constitutional Legislation Committee, through working with Acting Deputy President McKiernan on the Legal and Constitutional References Committee, through the estimates process and even through the Human Rights Subcommittee of the Joint Standing Committee on Foreign Affairs, Defence And Trade. So this is an area in which I take some interest. 
I want to note on the record Australia's exceptional immigration record over more than two centuries. It is ironic, in my view, in the face of the challenge that we now have, that that aspect of our development certainly contrasts in some ways to the United States, Canada and South Africa.
I remember Bryce Courtenay, speaking at a literary lunch in relation to his book The Potato Factory, reflecting on the differences between the genesis of some of those other developed countries of the Western world and saying that because Australia had come out of its penal ancestry, if you like, it had a much more robust, perhaps aggressive, perhaps slightly `bolshie', attitude to life in general. But 20th century movement into Australia has come literally from all corners of the globe, whether you are talking about the Chinese coming into early Sydney and Melbourne or those from England, Ireland, Greece, Italy, Vietnam or the former Yugoslavia. In Greater Western Sydney, where I work, there is an extraordinarily burgeoning African population, which is just fascinating. We have people from the breadth of the Middle East, from the subcontinent, from everywhere. This is an extraordinary nation—it is nothing less—and it is populated by remarkable people.
In fact, I recall that my first official duty as a senator for New South Wales was to represent the education minister at St Felix's Primary School in Bankstown in Sydney for the opening of some extensions. I was stunned to sit in front of maybe 400 children from what seemed to be in excess of 50 different national backgrounds and look at the diversity of the community in which I worked. To hear the then Catholic bishop for the area say hello to those children in about 20 different languages was also a pretty compelling experience as part of that process. We have to encourage and cultivate that diversity and do that in a very tolerant and open fashion. When we face the challenges that we face now, it is absolutely my view that the only way to go about dealing with them is in a considered, logical and positive way, not from a position of scaremongering, nor engendering discrimination.
I think there are popular commentators in this country who are now exploiting this debate in a most disgraceful fashion. For example, I was told by a constituent the other day of a prominent Sydney radio commentator who felt that it somehow added to the debate on Australia's immigration process to sit happily on his Sydney radio program and say to his gentle listeners, `Do you know that in Melbourne, Victoria, apparently there are 40 mosques; apparently in Sydney there are 45.' And so he went on, apparently thinking that that was relevant to some aspect of Australia's immigration debate and that somehow we should take issue with the fact that there were mosques in the cities of Australia. I do not have a question over how people worship and I do not debate how people worship. I spent 10 years of  my life living beside a Turkish mosque in inner city Sydney in the most harmonious environment possible. When people start to exploit this debate on that basis, I think it is totally reprehensible.
This is not just our problem and we cannot claim that we have the only way to deal with it or the best solution, but we do have one approach and as a parliament we are trying to determine how best to take that forward. I want to emphasise, as the Prime Minister has, that we and every country have the right to decide who comes to our country and in what circumstances. That must be the basis of our approach. In terms of asylum seekers and refugees, we must be able to return the non-genuine refugees. 
Mr Acting Deputy President McKiernan, I, as you, have seen this problem elsewhere. Earlier this year, in April, I was invited by the British government to visit Britain and among the issues that I took up on that visit were immigration, detention and border control. Media commentary here occasionally might have one believe that this is the only country in the world with this problem, and that is clearly not the case. Our isolation and, conversely, Britain's proximity to a changing Europe, Africa and the Middle East both guide to a large degree the nature of the differing responses of each of these nations to the movement of people. There are often similar community tensions, I will grant that. Britain does not impose mandatory detention on all its unlawful arrivals, but it has now commissioned four new detention centres to be operated by private sector providers. Its correctional system and facilities, such as Rochester prison, are also used for the detention of unlawful arrivals who may be regarded as dangerous.
The Home Office in the Immigration and Nationality Directorate told me that they are recruiting approximately 700 new officers to locate asylum seekers and unlawful arrivals who have disappeared into the community. Those officers will have powers of restraint and detention. They have extraordinary challenges in Britain which we can never, I suspect, appreciate. When you can have families, including 12 year-old children, clinging under a train coming across the English Channel into Waterloo as a method of trying to enter Britain, you face a completely different situation. I found that contrast particularly compelling. We do not face daily cross-Channel smuggling challenges, which they confront in places like Dover, which I visited. Our distance from the Middle East and fragmenting parts of Europe really does militate against potentially huge numbers of people who are on the move around the world arriving here en masse. I think it is important, though, to note that in dealing with these problems we have to consider what other countries are also experiencing.
I first went to a refugee camp in 1989, in Aranya Prathet in Thailand. For, shall we say, a 24-year-old—which is probably what I was at the time—it was a particularly confronting experience. I had never been anywhere like that in my life. To talk to the women in particular—because there were very few men in that camp; they had disappeared, had been killed, were lost in battle and so on—about the lives that they had, having been forced out of their own countries, was an absolutely extraordinary experience.
More recently I was in Nepal. There are 91,000 Bhutanese refugees settled in about four or five camps in parts of Nepal. At the moment, I suspect they are the victims of inter-country niceties and debate about how to verify their status and where they should go. The challenge for the Bhutanese refugees in Nepal is one being taken up at the moment by the World Food Program. They ask: how are we going to feed these people? They can actually put a date on it. They are not sure how to feed them after the middle of November this year. These are the sorts of international challenges for refugees that people are facing. I met Tibetan refugees in Nepal also. Imagine escaping from the environment of Tibet and going across those mountains into Nepal. You are not just going for a walk in the park here; you are actually making a significant commitment about why you need to leave your own country and, in many cases, your family. What worried me most about the Tibetan refugees I met were the stories about those whom they had left behind, and they are, in so many cases, young women and their children.
I have been—again with you, Mr Acting Deputy President McKiernan—to detention centres in Australia. My most recent visit was to a detention centre at Maribyrnong. On the last occasion I was there we met an Albanian detainee who had arrived in Australia with two of his children. He spoke no English and they spoke no English. They were here on false papers—absolutely granted—but I have never in my life witnessed from a grown man such distress, such desperation and, I think, probably complete isolation. Knowing that his children were maybe twentyfold more isolated and more devastated by the experience and were in a detention centre in this country bothers me enormously. 
In the United States there are three million Mexicans without documents. George Bush said recently, after discussions with President Vicente Fox, that they need to normalise the situation in that regard. At a press conference in September, he said:
If somebody is willing to offer a job others in America aren't willing to do, we ought to welcome that person to the country, and we ought to make that a legal part of our economy.
So there is some constructive movement in that regard.
I have spoken in this place before—in fact as recently as March this year—on the reputation and the activities of the Taliban in Afghanistan. It is an obscenity on the face of the earth—nothing less. Their treatment of women is nothing less than obscene. They have no human rights. They have no freedom. They are excluded from participation in all sectors of life. They do not just tell women what to wear; if women violate the rule of the Taliban, they kill them. It is that simple. If anyone wonders why people might try to escape, I will, with no humility whatsoever, refer them to my speech of 28 March in this chamber in relation to that.
Every day this job shows me that I am extraordinarily privileged personally, that I have every advantage. As a country, broadly speaking, we are very advantaged. We have no choice, in my view, but to approach our challenges on this issue from that perspective and with compassion. In this debate we are talking about people, not commodities. It does not matter how they get here or anywhere else; they are still people and they have basic human rights. I abhor people smuggling. I totally reject it. It is a new and obscene version of pimping and its victims—the people who are smuggled—are pawns. People smugglers should be dealt with—prosecuted to the full extent of the law—and we should strengthen our provisions in dealing with that.
We should look at the challenges that the UNHCR faces in 2001, and you can only do that, in my view, by taking a very big step back. We should look at the fact that, although a total of 139 countries have signed the Geneva Refugee Convention, very few in fact have regular resettlement programs and accept quotas of refugees on an annual basis. We stand in shining contrast to many countries around the world in that regard. We take 10,000 refugees in our offshore resettlement program. Our own migrant intake is in excess of 70,000—we do that well.
But there are aspects of the current debate which are, in my view, verging on the slightly crazy. It is complicated in my city by the debate on ethnic crime. I think there has been a disgraceful lack of political leadership and, in some cases, some acts of commission in political leadership which have exacerbated that problem. There are ethnic communities in my city that are trying very hard to take a responsible approach, most particularly the Lebanese community, and the way they have been treated by political leadership in my state is, in my view, totally offensive.
The Economist—not a publication I am wont to quote all that often, my friends will tell you—wrote an editorial on 8 September this year which it would do many people a great deal of good to read. It comments on what rich countries gain, rather than lose, from immigration. 
I was in East Timor at the time of the Tampa events. We had very limited news—good old Maliana does not really have your CNN and your BBC direct feed. It was strange to be there in that environment—in a growing democracy where the people were trying to escape oppression, in a country where refugees came to Australia at a time of great need for themselves—and to actually hear this debate explode. I do not understand exactly how that happened, and nobody has really been able to explain it to me in the weeks since. 
This is a modern discussion of globalisation—I have said before it has been happening since Marco Polo. We seem able to encourage and manage the movement of capital but not people. I think the UN has a very special role to play in this regard. In the last moments available to me, I would like to say that the UN has just postponed a special session on children because of the horrors visited upon the city of New York and the United States generally. There have been 26 special sessions since 1947. They can be invoked by the Secretary-General, by countries or by the General Assembly. I think it is imperative that the UN consider a special session on refugees and that it review the convention and the 21st century challenges in this area. (Time expired)",SENATE,<title>MATTERS OF PUBLIC INTEREST</title>,<title>Refugees and the Movement of People Worldwide</title>,Matters of Public Interest,3,1
