name,party,date,text,chamber,debate_title,subdebate_title,debate_type,debate_id,subdebate_id,type
"Sciacca, Con, MP",ALP,2001-02-06,"—Over the past couple of years the opposition has shown a great deal of bipartisanship in the management of immigration issues. In particular, the opposition has assisted the government's attempts to stem the rise of people smuggling as a global enterprise and to reduce Australia's attractiveness as a destination for illegal immigrants, especially those without valid claims to refugee status. However, there remain some areas in which the government and Labor cannot agree, where the fundamental differences between our two parties remain. Labor believes that compassion, fairness, flexibility and principles of natural justice should override administrative efficiencies. One such area is the restriction of legal avenues for migration appeals. There are two bills currently in the pipeline that seek to deny the right of review to visa applicants: the judicial review bill, which the minister for immigration has delayed in introducing into the House, and the bill being debated here today, the Migration Legislation Amendment Bill (No. 2) 2000. 
This so-called class action bill is, the opposition believes, based on a flawed rationale and is intended to restrict judicial review by preventing class actions in migration matters before the Federal Court and the High Court. If passed by parliament, this bill would introduce absolute time limits for applications to the High Court in migration matters—an action which in itself may be construed as an attempt to impede the High Court's constitutional rights. In the opposition's opinion, the minister is either misinformed or misguided in his belief that the introduction of legislation such as this bill will lower the costs of litigation in migration matters or shorten delays in appeals of decisions. On the contrary, the minister's crusade to eventually completely restrict the right to seek judicial review in all migration matters with bills such as this one and the judicial review bill, which is on even more tenuous constitutional ground, is likely to result in infinitely higher legal costs, both for the immigration department and their clients, and infinitely longer delays, which in some cases I understand may run into years. 
Class actions are an important instrument by which migration decisions can be challenged, as they offer equity and efficiency. Class actions provide a streamlined process for what could otherwise become a quagmire of individual decisions based on test cases, individual actions by a myriad of appellants or huge numbers of appeals lodged directly in Australia's highest court, the High Court. I am not for one moment, and neither is the opposition, condoning the practices of some migration lawyers who seek to recruit class action applicants by means that are less than ethical or are even misleading. However, we must not fall into the trap where we use the parliament and legislation to micromanage issues such as advertising by migration lawyers in local newspapers. Our goal should be the provision of a low-cost, efficient and equitable avenue for people to exercise their rights to a court hearing. In this respect class actions offer equity and efficiency. Equity comes from low cost to individuals, enabling them access to the courts—access that would otherwise be prohibitive. The courts can operate efficiently when considering class actions and they are able to resolve multiple identical claims in one hearing rather than being required to rule on often thousands of individual judgments.
If the government's concerns are costs and delays, then retaining rather than removing class actions remains a compelling argument. The removal of class actions as a means of stemming rising legal costs and the incidence of litigation does not stand up under any measure of argument. The minister attempts to justify his decision to restrict class actions, group actions and representative proceedings by stating that, of the 14 actions commenced since 1997, none succeeded. In fact, I am sure that by now the minister is aware that in at least one instance a class action has been upheld in the Federal Court. I am referring to the 1998 decision of the Federal Court in Fazal Din versus the Minister for Immigration and Multicultural Affairs. 
A number of other serious concerns were raised by the Joint Standing Committee on Migration and supported by numerous reports submitted by community and welfare organisations. I will refer later to the dissenting report. I thank the members of that committee who dissented for the excellent job they did. One of the most controversial parts of this bill and one which arguably challenges the very nature of the role of the High Court is the imposition of an absolute time limit for lodgment of applications to the High Court. While the minister has tabled amendments extending the time limit from 28 to 35 days—if he has not yet tabled them, I understand he intends to—the principle remains and, being an absolute time limit, the High Court would be unable to amend it. Because the right to apply for review of administrative decisions is conferred on the High Court by the Constitution, it cannot be removed by legislation. Accordingly the government's move to impose a time limit goes beyond being merely a procedural limitation to achieve a policy outcome. Indeed, the imposition of this provision may be considered interference to the judicial process. Section 75 (v) of the Constitution states:
In all matters—
...
(v.) In which a writ of Mandamus or prohibition or injunction is sought against an officer of the Commonwealth:
the High Court shall have original jurisdiction.
Categorically then, migration decisions come within the original jurisdiction of the High Court. While the government may not think that the imposition of time limits interferes with the judicial power of the Commonwealth, I can assure you that many constitutional lawyers would have a field day at the first opportunity of challenging this in court. Based on longstanding legal precedents, such as Lyinage versus R (1967), there is a view indicating that this bill's failure to provide the High Court with a discretion to extend the time limits in appropriate circumstances may constitute an attempt to control the High Court, thus interfering with the judicial process itself. The Howard government and the Minister for Immigration and Multicultural Affairs are entering very dangerous, uncharted waters with such provisions. In a way, the minister should be thanking the Labor Party and the Democrats—who I understand will oppose this bill—for opposing this bill, thus saving him the embarrassment of successful constitutional challenges. Of course, I do not expect any thanks to be forthcoming.
On the basis of policy rather than legal arguments, the introduction of a time limit will almost certainly impose unfair disadvantages on many legitimate applicants for judicial review of migration decisions in a bid to capture those who are said to be intent on abusing the review system. A limit of 28 days or even 35 days is hardly sufficient to allow an individual to learn of an adverse decision, realise their options, find and consult a lawyer and then file in the High Court. In their submission to the Joint Standing Committee on Migration, the National Council of Churches stated:
Asylum seekers should be reasonably expected to have more problems than other administrative law claimants do in meeting strict deadlines. They may need to have the written notification of the decision in their case and their right to review translated and explained. They are often in detention where their freedom of movement, access to communication and legal advice is severely curtailed. If they are in detention—and different issues face people in detention—they have to first realise that they do not have to go to the Federal Court or wait for the minister to turn them down before they can go to the High Court.
Basically if they are in detention they have to try to access a lawyer and there are a lot of problems with external access for people in detention—phones etc. They have to find a migration agent or a lawyer. It cannot be any lawyer, it has to be a lawyer who is registered as a migration agent ... that again cuts down on the amount of pro bono access you can get. Understanding what the court will be able to do for them once they get there is a big problem.
They have to have translators, they have to make sure they have understood the actual reason they were turned down in the first place and they have to explain that to their lawyers. They have to be able to get the notice of the decision or they might have to lodge FOI claims if they need to get specific security information that is related to their case— 
and on and on. They have to do all of this and more in 28 or perhaps 35 days. That is hardly possible and certainly, by no stretch of the imagination, fair. The High Court's proper role is as Australia's final appellate court and arbiter of the Constitution. Yet due to changes such as those contained in this bill, increasingly it is being asked to perform the role of lower courts. Justices of the High Court have expressed their objections on many occasions to performing trial work that should be confined to the lower courts. The changes proposed in this are likely to lead to many cases that could be heard by tribunals going to the High Court in the first instance. With insufficient time to make an informed decision or in some circumstances to gain access to information that is usually released only under freedom of information, lawyers will want to avoid risking actions against them for negligence. I talk about this from some experience, not in migration matters, but negligence on the part of lawyers and the medical profession has become more in vogue in recent years. Obviously, this has not been factored in. Any lawyer who is worried about the possibility of being sued for negligence, given the strict time limit available in which to go to the High Court, would, there is no doubt in my mind, file in the High Court, although probably not being properly prepared. Starting in the High Court may seem a safer bet as matters can be remitted back down the system but cannot move up the system if they miss the deadline.
It is neither appropriate for the High Court to be treated in this manner nor is it efficient use of the court system. With only seven justices on the High Court and almost no capacity to remit matters to the Federal Court, delays will run into years, if not perhaps even decades. It is nonsensical to suggest that these measures will reduce the volume of litigation in migration decisions or that costs to the Commonwealth would be reduced. On the contrary, if these measures lead to channelling an increased workload of migration cases to the High Court, costs that would arise from delays and indefinite extensions for unlawfuls to stay in Australia would also, logically, increase. We can hardly afford that, as we already have over 50,000 undetected overstayers living in the community. There are people being held in detention for long periods of time. Some might be able to get bridging visas and stay out of detention but there might also be additional detention costs. 
Similarly, the measures to prevent class or group actions are equally, if not more, misguided. They are unlikely to stop proceedings that in substance but not form would be considered class actions. The Federal Court of Australia Amendment Act 1991, commenced in 1992, introduced class actions in the Federal Court. Class actions have been possible in the High Court since 1953. It is nonsense to advance an argument against the appropriateness of class actions in migration matters. The migration regulation structure is expressed in the language of classes of visa with common requirements and criteria, which of course apply to classes of persons and would logically therefore warrant class actions. 
A class action is one in which a proceeding is brought on behalf of a group of persons with claims that arise from similar, identical or related circumstances and which raise substantially common questions of fact or law. If class actions were prevented, a lawyer would only need to make relatively small changes to effectively achieve the same results as a class action. With some class actions representing thousands of applicants, under the proposed new arrangements the court would be faced with either hearing thousands of individual but essentially similar cases or running one as the test case and then applying the same decision to the remaining cases. That sounds a reasonable proposition but this amounts to a de facto class action anyway, only more cumbersome and with greater associated red tape, costs and delays.
The argument that forcing lawyers to file individual cases would act as a deterrent because of the filing fees may have some force but will not deter any serious litigant because the court has the power to waive fees and almost always does, I understand, for impecunious applicants. There is anecdotal evidence to support claims by the minister that a small number of practitioners are running dubious class actions and are placing newspaper advertisements vigorously encouraging applicants to join class actions. Whilst the opposition does not in any shape or form support these people—if they are doing it simply for the purposes of making money— this is, nevertheless, how class actions against pharmaceutical companies and tobacco companies, et cetera get started. So, in many respects, what they are doing is not new. 
Introducing such restrictive legislation seems an extreme measure to combat the alleged unethical conduct by some lawyers. If the conduct is unethical, it should be raised directly with the various disciplinary bodies. The irony is, however, that the same lawyers the minister is attacking are likely to be the first to adapt to these changes and further clog up the courts with the increased administration associated with filing individual cases. Nothing is going to stop these lawyers running the same matters as a slew of individual cases filed in the High Court. The courts already have powers to stay or dismiss vexatious or trivial applications. That applies to all actions including class actions. Further, if a member of the action cannot demonstrate a sufficiently common element to the relevant action, that member can be ruled out.
Ultimately, class actions are an efficient means of dealing with matters affecting many individuals with common complaints. Indeed, the restrictions may result in a multiplicity of actions that otherwise could have been dealt with in the one matter as a class action. The government claims it is concerned that members, by joining a class action, are immediately issued with a bridging visa for a period extending to 35 days after consideration of the case by the court. It claims that obtaining the bridging visa is, in itself, sufficient incentive for applicants with no relevant claim to join a class action. The changes will make this worse, not better. Even the government's own advice indicates its uncertainty that the proposed measures would have any material effect on the concerns repeatedly expressed by the minister. The explanatory memorandum says:
For instance, if the bar on class, grouped or otherwise class actions does not increase the number of individual applications, the cost to the Commonwealth, including costs arising from members of these actions prolonging their stay in Australia, may be reduced. However, if the number of individual applicants increases, there may be an increase in litigation costs in addition to costs associated with each individual's prolonged stay in Australia.
So even the explanatory memorandum makes it very clear—it says that in the event we are successful and are able to reduce the number of applications everything will be fine. So straightaway even the minister's own department is saying there is a chance that this might increase the number of applications that go to the High Court and courts. I want to congratulate the department or whoever it is that wrote that explanatory memorandum because they have got it spot on—if you like, they are watching their back. Blind Freddy can see that this is what will happen if you want to do something about stopping these so-called unethical lawyers— and they will argue the case, of course, that they are.
You will not do it by introducing bills like this, where you throw out the baby with the bath water. You have to do whatever is necessary to get the law societies of each of these states—or give more teeth to the Migration Agents Authority—to look at ways these people can be stopped. I abhor the practice of people advertising and saying to asylum seekers, or whoever, `If you pay $500 you can join this action.' There is an enormous amount of money to be made here. As I said, this is not being condoned at all but sometimes you have to give a reasonable response to the problem. It does not matter whether you are an asylum seeker or whether you are an ordinary citizen of this country, the fact is that under international law all of us are entitled to our day in court, if you want to go to court. Once you are here, you are entitled to your day in court.  
The fact is that this action would stop many people from having that day in court. Simply because we are trying to make sure that people do not go to these so-called lawyers that advertise is not a reason for us to get rid of class actions altogether. The minister, to his credit, told me yesterday that he had received alternative advice—and I will mention that in a second—from a legal consultant about what else could be done. One of my colleagues who will be speaking later on this bill will probably refer to that. The advice he received from the lawyers was in terms of what he could do to try to fix the problem by trying to regulate these lawyers that are being, in his words, `unethical'. The fact is that that does not change the situation at all.
The opposition believes that the real purpose of this bill is simply to advance the government's policy of restricting virtually all access to judicial review in migration related matters. The severe restriction or denial of judicial review raises questions regarding the principle of the separation of powers. But whatever their purpose, these provisions will backfire and create more delay, complexity and costs for those who go to clever or sometimes unscrupulous lawyers, while leaving those who do not with no safety net and no effective rights. The minister attempts to sell this to the public on the basis that all these appeals and this bill are doing is stopping judicial review for refugee matters or for those that may not have a proper claim to stay in this country. But the fact is that this would apply also to people who may be refused a visa from a high risk country, or an Australian resident or citizen who is not happy about the way that, for instance, the high risk factor list is being used. This is for all class actions for all migration matters, not just in the area of, say, asylum seekers.
Labor believes that the perceived life and death nature of the administrative decision making process in migration matters requires that special allowance should be made for unforeseen circumstances in making an application to the High Court, which is the court of last resort. The structure of this proposed legislation is driven solely by the government's ulterior motive of restricting access to judicial review in migration matters. The real issues at hand are the number of abuses of the current system by some unscrupulous migration lawyers, the impact of class actions on the workload of the High Court and the lengthy processing times confronting current applicants.
The government does not address these problems by attempting to introduce the Migration Legislation Amendment Bill No. 2 (2000). Whether by design or unintentionally, this proposed legislation panders to those fringe sectors of society who maintain that immigrants and refugees are not entitled to the natural justice that is afforded to Australian citizens.
I believe that we should rise above that, and that the legislation that is presently before the House, debated and passed in this House, should be fair—all legislation in this House should be fair—and benefit all people who have a right to have their case heard in a court of law.
I refer to the dissenting report of the opposition members of the Joint Standing Committee on Migration, signed by my colleagues Dick Adams, the member for Lyons, Julia Irwin, the member for Fowler, Senator Jim McKiernan, Senator for Western Australia and my friend Bernie Ripoll, member for Oxley. In their conclusion they say:
Opposition Members of the Committee maintain that access to class actions should be retained because they are an equitable, economic and efficient avenue through which migration decisions can be challenged. Access to class actions should therefore not be restricted without good and convincing reasons.
Opposition Members have examined the arguments and evidence advanced for restricting access to class actions and have not found them convincing. We are prepared to examine any evidence of abuse and we will always act to curb or stop abuse when it is proven to be happening. The evidence was not presented on this occasion.
We are also very concerned that alternatives to the restriction of access to class actions have apparently not been canvassed. 
We are concerned that the likely effects on the courts and on Commonwealth expenditure were not fully examined before the Bill was introduced.
I did mention that the minister has advised me that he did seek legal advice on other alternatives, specifically for the purpose of trying to curb advertising by certain lawyers. That report says—according to the way he reads it—that that would be very difficult. My colleague the member for Denison will be speaking later in this debate and will be talking about that. I could not agree more with what appears in the conclusion of the dissenting report. It has been said very succinctly: the fact is that there is no evidence to substantiate the restriction of rights in this way.
The government might think that there is some political mileage in it. If you have got to go for political mileage by doing these sorts of things—well, it is a shame; it is an absolute shame. The fact is that this will not do what the minister wants it to do. He has obviously asked his advisers to come up with ways and means of trying to curb the problems that he sees coming from advertising from these migration agents and from migration lawyers. This is not the answer, Minister. I have said to the minister before that if he can come up with something which is reasonable he will get the support of the opposition. The minister's response, of course, is, `Well, what's your solution?' Well, I am not the minister. The opposition is not in government. You are the minister. You come up with the solutions and we will have a look at them—you have got the whole of the department plus advisers ad infinitum. All I have got is one person.
—Oh, tough.
—Well, who are you? You can sit down—through you, Mr Deputy Speaker. Labor opposes this bill and sends it back to the government, asking them to start from scratch and develop policies to realistically achieve their aims without punishing the victims. Later on in the consideration in detail stages I will be moving an amendment that schedule 1, page 3, line 1 to page 9, line 31 be opposed. I will move that at a later stage.
If the government wants to fix the issues that need fixing in immigration, we will assist them. But if it wants to hoodwink us with false agendas wrapped up in pretty rhetoric, we will see through it every time and we will oppose them. The opposition will be opposing schedule 1 of this bill and I will move the appropriate amendment at a later stage.",REPS,<title>MIGRATION LEGISLATION AMENDMENT BILL (NO. 2) 2000</title>,<title>Second Reading</title>,Bills,17,1,speech
