name,party,date,text,chamber,debate_title,subdebate_title,debate_type,debate_id,subdebate_id
"Faulkner, Sen John",ALP,2001-09-19,"—This motion is not supported by the opposition. I do not say that to the chamber lightly, because it has not been the opposition's pattern in this parliament or in the previous parliament to generally oppose such exemption motions. The government is proposing that the Commonwealth Electoral Amendment Bill 2001 be granted exemption from the cut-off, and I think the Senate needs to be clear as to what we are being asked to do here. We are being asked to give the Commonwealth Electoral Amendment Bill priority over other bills and other business before the Senate. Where other bills are introduced in the same period of sittings, they are required to be held over for debate until the next period of sittings—that is, unless there is an exemption. But that is not the case with this bill. The government is asking the Senate to believe that this bill is so important that we should exempt it from the usual procedures that apply in this place.
I want to be very frank about this. These sorts of requests are not unusual, they are not out of the ordinary; they happen quite a lot. During the life of this parliament, very few exemptions from the cut-off have been negatived. In other words, a motion such as that moved by the Manager of Government Business today has not been negatived since 24 June 1996. In the year 2001, 29 bills have been exempted; none have been negatived. In the year 2000, 42 bills were exempted; none were negatived. In the year 1999, 55 bills were exempted; none were negatived. So in three years the Senate agreed to exempting 119 bills from this order of the Senate. In that period of time, we did not see a single request for exemption disagreed with, so this is not a tactic or an approach that the opposition adopt lightly. It is not our standard operating procedure, and every senator in this chamber knows that that is the case. Since the Australian Labor Party lost office in 1996, 328 bills have been exempted from the cut-off; only 18 motions have been negatived, withdrawn or not proceeded with in relation to government proposals to exempt bills from the cut-off. They are the statistics. Let us be clear: we have agreed to exempt 119 bills over the past three years; not one motion for exemption has been negatived. No motion has been negatived since 24 June 1996—a very different approach from this opposition to that taken by the current government when it found itself on this side of the chamber.
These are probably the last two weeks of the 39th Parliament. It is not an ordinary period, it is not an ordinary circumstance. These are extraordinary times. There are probably only six sitting days remaining for the 39th Parliament. There may be another week or two of sittings after these—very few in this building think that is likely. The government is asking the Senate to debate and to pass an extraordinary range of priority legislation, and we in the opposition do not argue that a lot of that legislation ought to be given priority. Have a look at it: it includes bills to enhance government powers in relation to illegal immigrants; there is legislation to excise parts of Australia from the Australian immigration zone; there is legislation to modify the processes of judicial review for asylum seekers; and there is legislation to provide a statutory basis for the operations of Australia's intelligence services, just to mention some. Have a look at today's red: there is a great deal of high priority legislation there.
And the government seems to be building on its own legislation program, adding more and more bills on a daily basis, as it lurches from crisis to crisis. Now we know, courtesy of a communication from the government, that the government is expecting the Senate to deal with in excess of 50 bills in probably six sitting days. That is what we are being asked to do, and as far as this opposition is concerned we are going to cooperate as much as we can with the government to ensure genuine priority legislation, genuine business of government, gets high priority in this place. That has been the way this opposition has worked in the past, and that is the way we are going to work on this occasion.
But at the same time we have the government asking us, asking the parliament, asking the Senate, to accept that a bill which deals exclusively with an internal problem of the Liberal Party, a matter which we believe need not be before the parliament and should not be before the parliament, be given priority over so many other bills of national and international importance. The issue is whether the Commonwealth Electoral Amendment Bill 2001 merits being prioritised and exempted from the cut-off resolution. Why should the Senate prioritise this bill over all that other important legislation? Just in the area of Commonwealth electoral law, there are so many more important issues than the one that is dealt with in this piece of legislation. We say the Senate should not be fast-tracking this bill just to avoid embarrassment for the Liberal Party.
Of course, the bill is very instructive about the legislative priorities of the government. We actually have a parliamentary committee, the Joint Standing Committee on Electoral Matters, currently holding an inquiry into funding and disclosure laws in this country. That inquiry was deferred in August 2000. That is the priority the government puts on this issue: that inquiry was deferred in August 2000, while the government, in relation to the work of that parliamentary committee, prioritised a reference and inquiry into the integrity of the Commonwealth electoral roll. We and the Australian Democrats argued that both issues should be put on the agenda, that they are both important. But no, the funding and disclosure reference was put aside, and only now has that funding and disclosure reference been resuscitated by the government. It really shows you what the government's priority is in these matters.
At public hearings yesterday in this building, and in previous weeks, all the major political parties in this country agreed that there are problems with the current electoral funding and disclosure laws. I commend the submissions made by the Liberal Party, the Labor Party, the Australian Democrats and the AEC to the Joint Standing Committee on Electoral Matters. We have submissions from all the parties, but the issue of the Liberal Party's internal finances has never once been raised before the parliamentary committee that is responsible in this place for dealing with electoral matters. It has never been raised by coalition members before the Joint Standing Committee on Electoral Matters, and it has never been raised by the federal secretariat of the Liberal Party before the Joint Standing Committee on Electoral Matters. In that context, it is quite extraordinary that the government should bring forward this bill and ask the Senate to give it priority. There are so many more important and significant electoral issues that should be before the parliament and that, with a bit of political will from the government, could come before this chamber and be dealt with. More importantly, there are so many other issues that deserve the time and consideration of debate in this chamber.
We have said publicly that a lot of funding and disclosure issues do require the urgent attention of the Joint Standing Committee on Electoral Matters and of the parliament. Those matters deserve priority over this bill and have to be weighed against the other legislative priorities the government has. We do not indicate for one moment that those other matters are not deserving and do not warrant the Senate's time. Of course they do, and they are more important than this particular bill. So I have to say that the bill that the government seeks to exempt from the cut-off today has no public policy benefit. The only beneficiary of this bill is the Liberal Party of Australia, and it will be benefiting through an improper use of the parliament. As such, we say that this bill should not be exempted from the cut-off and should not be given priority in the government's legislative program. We even go further than that and make the obvious point: the bill should never have come before the parliament at all. It should never have come before the parliament at all, because this internal problem in the Liberal Party can be fixed with one letter from Mr Lynton Crosby, the Federal Director of the Liberal Party, to the Australian Electoral Commission. One letter can fix the problem the Liberal Party has. But no, the parliament is being asked to fix the internal problems of the Liberal Party; and that is absolutely unacceptable.
The stated purpose of the Commonwealth Electoral Amendment Bill 2001 is to amend the Commonwealth Electoral Act so that the agent of the Liberal Party's federal secretariat determines the distribution of public funding between the federal secretariat and the state and territory divisions of the Liberal Party. But of course the real purpose of the bill is far more sinister than that: it is to try and get the parliament to fix an internal problem in the Liberal Party and see if they can solve their internal power struggles, because they cannot do it themselves. They cannot run their own party: get the parliament to fix the problem. This is a desperate dash for cash by the Liberal Party's federal secretariat. The fact is that the federal office of the Liberal Party cannot work with its state divisions—in particular, it does not trust its Queensland division. I do not care about that and why should the parliament care about that? Let them fix it. All political parties have internal problems. Political parties are expected to fix it themselves, not to pass legislation in the Commonwealth parliament to try and solve these sorts of problems.
This is a bill before the Commonwealth parliament that addresses the Liberal Party specifically and imposes on the Liberal Party a resolution to the bickering over the disbursement of public funding within the Liberal Party. This bill has nothing whatsoever to do with any other organisation, with any other party, apart from the Liberal Party. The legislation is a disgrace. It is the Liberal Party using the federal parliament to sort out its problems. It might have an innocuous title—the Commonwealth Electoral Amend-ment Bill 2001 sounds straightforward enough—but we have always described it as the Commonwealth Electoral Amendment (Dash for Cash) Bill 2001. That is what it is. If you read the bill, the Liberal Party is mentioned no fewer than 30 times; nearly every paragraph has the Liberal Party mentioned in it. The bill has one purpose—to fix the Liberal Party's internal headaches—no other purpose at all.
With such a significant amount of priority legislation that we in the opposition accept ought to be debated and dealt with, there is no reason that the parliament should be asked to debate this bill now. It is an abuse of the parliament, a misuse of the procedures of the parliament and a misuse of executive government, and we will not accept that approach. We do not do this lightly; it is not our practice to oppose exemption resolutions, and the statistics, as I said, are stark. It is the first time we have done it in this calendar year, we never did it in 2000 and we did not do it in 1999. This is a very different approach to the one that the Liberal Party used when they were on this side of the chamber. There has not been an exemption motion negatived since 24 June 1996, and that shows that we do not oppose these motions lightly. We try to cooperate; we do cooperate wherever possible. We accept that there are times when the cut-off motion cannot apply. We are honest enough to admit that we never supported the cut-off motion in the first place, when it was introduced. I made a number of quite stirring speeches, I thought, at the time in opposition to the introduction of the standing order. We never supported it being adopted because we understood the weaknesses of the proposed standing order. I understood the motivations of the then Senator Chamarette, who proposed the standing order.
We know that there is a lot of urgent legislation that needs to be dealt with, but this parliament needs to accept that, as far as the opposition is concerned, we are going to put a line in the sand about this bill. If this bill is exempted, there will be a long debate. There should not be a long debate about this bill; there should not be any debate about this bill, because this bill should not be before the parliament at all. And if it is to be brought before the parliament, it should not come in during probably the last six days of sitting of the 39th Parliament. Governments have responsibilities in these issues, too. Governments have responsibilities here and this sort of abuse should never be accepted. I think the Labor Party has shown the way through on this: write a letter, send it in to the Australian Electoral Commissioner, just all agree on the disbursement of public funding, and there is no need for legislation. If it is good enough for the Labor Party, it ought to be good enough for the Liberal Party. We will not support this exemption motion and we will certainly not support this legislation.",SENATE,<title>BUSINESS</title>,<title>Consideration of Legislation</title>,Business,0,1
