name,party,date,text,chamber,debate_title,subdebate_title,debate_type,debate_id,subdebate_id,type
"Albanese, Anthony, MP",ALP,2001-02-06,"—The Migration Legislation Amendment Bill (No. 2) 2000 is an attack on a person's right to seek justice. The government are trying to take away a generally accepted right from a very vulnerable group of people. If they get away with it, who will they target next? People seeking judicial review in the area of social security, perhaps. We have already seen attacks on the Social Security Appeals Tribunal and the Administrative Appeals Tribunal. This government attacks legitimate legal rights whenever it is convenient. That is the context in which this bill must be considered. It is a context involving a minister who has, I must say, had a proud history in the past, crossing the floor over the issue of a racist or discriminatory immigration policy. This is a minister who stood up to his own party. 
Unfortunately, with bill after bill before this House, it is very difficult to distinguish the views of the Minister for Immigration and Multicultural Affairs from the views of the former member for Oxley in terms of political intent. Let us have a look at some of the things which have been wound back. First of all we had the three-year waiting period, a measure which has seen a number of migrants to this country left in poverty, left homeless and left relying on charity to provide the basic essentials of life. With regard to refugees, we have seen them vilified. We have seen a linking of the onshore applications with offshore applications so that the minister has been able to go around and say, `These people who are applying onshore are illegal,' which is not true and he knows it is not true under the United Nations definition of refugees. We have seen a minister who has said that people should wait in an orderly way in the queue overseas, when he knows that is simply not possible for people from countries such as Afghanistan, where the Taliban regime is abhorrent to any decent democratic person who supports human rights. To suggest that it is possible to wait in orderly queues in some of those countries is simply not feasible. We have seen, with that linking, the minister arguing that these people are taking the places of those people who are applying offshore. That is only the case because the minister has linked those two numbers which previously were not linked. That is consistent with the vilification that has occurred. These people have been branded as illegal. They have been branded as criminals and drug peddlers, when there is no evidence that the refugees themselves are in that situation. 
The fact is that the Labor Party, and anyone who supports the plight of refugees, does not support the people smugglers, who are prepared to make profit out of people's misery. That is not in question, and action against people smugglers is something that I support. However, the vilification of the refugees themselves that has occurred is entirely inappropriate, and the treatment of these detainees is entirely inappropriate. My colleague the member for Chifley, Roger Price, has pointed out in articles published this week that a three-year-old boy and his father have been held in isolation in a dark, dank hellhole at Port Hedland detention centre. This man was being punished for a hunger strike, and he and his three-year-old son were held for 14 days in Third World conditions in a locked cell in the isolation block. What sort of nation are we that in the year 2001 tolerates that in order to appeal to some rednecks in our society? What sort of society are we when we have a minister who advocates giving people injections and drugging them—a minister of the crown who once stood up for human rights and has the hide to wear an Amnesty International badge on his lapel? 
Many of these detention centres are run by private enterprise, but the only growth in building and construction announced by this government in three budgets has been the building of detention centres. Other countries do not do that. There are more people going to countries such as Italy in a week than come into Australia and make onshore applications in a year. Yet this minister pretended that there were whole villages packing up and coming to Australia. What happened to them? They did not arrive. We hear very little from this minister about the hundreds of people who have been so desperate that they have drowned, people who have died on their way to Australia. That shows the desperation of these people. It also shows the callousness of the people smugglers who are involved, but let us not blame the victims of oppression in reactionary regimes such as Afghanistan for wanting a better life. 
The Vietnamese boat people who came in the 1970s have made an outstanding contribution to Australian society. Just as some people objected to that occurring on narrow, bigoted grounds, so this minister is prepared to appeal to the bigots, to the point where he goes overseas and says, `If you come here, you will be the subject of racist attacks. You are not welcome. This is an intolerant society.' That is what the minister said when he toured these countries. But it is not uniform because the minister has also made a decision to grant 200 special applications to members of the SLA, the South Lebanon Army—people who were engaged in militant conduct and violence against the people of south Lebanon on behalf of the Israeli occupation. That occupation had been roundly condemned and, under UN resolution 425, finally Israel has withdrawn. These people can be settled either where they are in Israel or in other parts of Lebanon, but no, we have a special category introduced.
Those 200 special applications will result in many more than 200 people coming here. What do they have in common? What they have in common is an extreme right-wing view. They are people who have been involved with the Falangists in Lebanon and have been responsible for violence against the Lebanese people. Yet that is okay, according to the government: `We will open up immigration for them because they may settle in marginal seats and will tend to support the conservative side of politics.' Many of them are right-wing reactionaries, but that is okay, according to the government. This minister has compassion for those people but not for women escaping places where they have enforced clitoridectomies and such barbaric behaviour. It is time that the minister stopped the vilification of refugees. It is time that we Australians reasserted ourselves as a compassionate nation, in recognition of the fact that we are the country we are because, whether people be Irish Catholics or Vietnamese refugees or any other race, wherever they have come from, people have come to Australia and made it the great country that it is today. (Time expired)",REPS,<title>MIGRATION LEGISLATION AMENDMENT BILL (NO. 2) 2000</title>,<title>Second Reading</title>,Bills,19,1,speech
"Kelly, De-Anne, MP",NP,2001-02-06,"—I rise tonight to speak on the Migration Legislation Amendment Bill (No. 2) 2000. The member for Grayndler, Mr Albanese, said earlier that many on the coalition side are uncomfortable. Let me assure him: I am not uncomfortable at all. This bill meets the expectations of my constituents perfectly. I will deal with the comments from the member for Grayndler later.
To given an overview of the aims of the bill and the work that the minister is doing, non-citizens or illegal immigrants who may have been unsuccessful asylum seekers have been using the extensive merits review rights enshrined in the migration legislation to allow them to appeal to the Federal Court and the High Court on visa related matters. The view in my electorate is very much: send them home. Labor being soft on illegal immigrants and non-citizens will not get them elected to any seat in North Queensland. There are two matters of concern at present. One is the cost of and the increase in migration litigation. Last year, the Department of Immigration and Multicultural Affairs spent $11 million. They are projected to spend $20 million in 2001-02 in litigious actions, and that does not include the operating cost of the court. To remedy this situation, the minister has introduced the Migration Legislation Amendment (Judicial Review) Bill 1998 [2000]. It has a privative clause which reduces non-citizens' and illegal immigrants' recourse to the Federal Court and the High Court on visa related matters. Of course, this prolongs the proceedings. At the same time, they are eligible for Medicare and other benefits. Sixty per cent of the Federal Court's work is involved in court actions brought by non-citizens. 
Unfortunately, this bill has been languishing in the Senate, thanks to the ALP and the Democrats, since 1998. I have let this fact be known widely to people in my electorate. Everybody knows that the ALP is soft on illegal immigrants. The second matter is that not only is there a great deal of litigious action but there is an alarming trend now to mount court challenges in migration matters through class or group actions. The aim is for large numbers of people to take action obtaining a visa and, again, to prolong their stay in Australia. I want to make it clear that the actions are by people who have no lawful right to stay in Australia. They are not refugees. They are non-citizens. They are illegal immigrants. They are queue jumpers, jumping ahead of those who have adopted a lawful approach to seeking visas or residency in Australia. If it were not for these class actions, these people would be removed.
Let me share with the House a history of class actions. Since October 1997, there have been 14 class actions—the aim being of course to get bridging visas to remain in Australia. Although these bridging visas do not allow non-citizens to work, many of them in fact may work illegally. So what number of these class actions have been successful? None. Ten actions, involving 4,000 participants, have been dismissed by the courts.
The member for Grayndler mentioned the Fazal Din case in 1997. This was a technical case that allowed litigants to take, again, an English speaking test, which some passed and some did not. He also mentioned the Macabenta outcome. It was only decided two to one, so obviously some of the judges did not agree. The reality is that it was still the outcome. It was an unsuccessful outcome. Another major concern is that these class actions have developed a pattern of people moving from one class action to another in order again to prolong their stay. I would like to share with the House the opening statement made by the Department of Immigration and Multicultural Affairs to the Joint Standing Committee on Migration. They mentioned this pattern of litigants moving from one class action to another and that in the Macabenta class action `40 per cent or more of its members were identified as moving between class actions'. In other words, if you cannot succeed in one, move to another and prolong your stay. Maria Macabenta is a case in point as she is now a member of the Ly class action. Ms Macabenta originally challenged her protection visa refusal in July 1996 in the Federal Court. The matter was finalised on 11 July 1997. The class action known as Macabenta commenced on 24 October 1997 and was finalised on 18 June 1999.
We are now four years down the track for the date of Ms Macabenta's original application for a protection visa and its refusal, and Ms Macabenta is still in Australia on a bridging visa granted to her as a member of the Ly action. The Ly class action commenced on 10 June 1999 and is yet to be finalised. As a member of that class action, Ms Macabenta can remain in Australia until that action is concluded. This is an appalling example of how these class actions are being exploited and abused.
—The goldmines for greedy lawyers. 
—Exactly. The member for Cowper is absolutely right. The ALP are leading a lawyer driven recovery: they have no sympathy for citizens and those who are legally attempting to come to Australia. 
I now move to the ALP's concerns and to the concern we have that some of these people, while they do not have a working visa, may in fact be working in Australia. It is interesting that my concern is a concern shared by the member for Batman. Let me refer to question on notice No. 2282 on the Notice Paper from Mr M. J. Ferguson to the Minister for Immigration and Multicultural Affairs. The question reads:
(1) Has his attention been drawn to an article published in the Orient on 29 November 2000 concerning the law offices Adrian Joel and Co relating to class actions on immigration cases.
(2) Does the article advise that class actions represented by Adrian Joel and Co involve so-called asylum seekers whose applications have been rejected by his Department and the Refugee Review Tribunal, irrespective of whether the applicant's visa has expired.
(3) Does the article also advise that once the applicant's name is included in a class action, he or she is automatically entitled to a bridging visa and the right to stay in the country until the case is finalised.
(4) What sum of taxpayers' money has his Department spent in defending the integrity of Australia's migration system against class actions mounted by Adrian Joel and Co and how many (a) class actions has the company mounted and (b) clients are involved in these class actions.
(5) At what stage are the class actions initiated by Adrian Joel and Co and on what are they based?
I hardly thought I would ever be praising the member for Batman, but obviously he is the only member of the opposition that is awake to these concerns. He is obviously concerned that law offices such as Adrian Joel and Co. are mounting class actions. He asks: are they automatically entitled to a bridging visa? Has that been advertised? What sum of taxpayers' money is involved? I am pleased that the member for Batman, as the only responsible member of the opposition, has raised these concerns. What sum of taxpayers' money has been spent? How many class actions have been mounted? How many clients are involved and at what stage are the class actions? It is obvious that the member for Batman is as concerned as we are that these class actions will enable non-citizens to stay in Australia and in many cases take work away from Australians.
—Queuejumpers.
—Exactly—queuejumpers. I would like to read some of the advertisements for these. The member for Batman is absolutely right and should be congratulated for his nationalistic approach. It is a pity he has not been able to convince some of the others in the ALP. Let me read out some of the ads that have been put in the papers. This one, I understand, is in the Tribune International. Allow me to read it to the House.
Permanent residence - Australia. Refugee class action. If you have been rejected by the Refugee Review Tribunal (RRT) you may be able to join our class actions at a very low cost. Our latest action is very easy to join (over 1,200 people have already joined!) It doesn't matter if you are illegal—
I want the ALP to hear this: `It doesn't matter if you are illegal'—
or that your Ministerial Review has been rejected. You still may qualify for a Bridging Visa and become Legal. Please Supply Your Refugee & RRT Decisions. FREE CONSULTATION - You have nothing to lose.
The Australian people do. The legal firm is the one mentioned in the member for Batman's question about the papers. I will read out the next one. Unfortunately, it does not say which paper it is in:
Permanent Residence - Australia. Refugee class actions!
It is pretty much the same as the other ad. It continues:
Please supply your refugee and RRT decisions. It doesn't matter if you are illegal or that your Ministerial Review has been rejected. FREE CONSULTATION.
This is the very thing that people in my electorate are concerned about. I am appalled that the Labor Party is supporting a lawyer-led recovery. None of these class actions has been successful. The only beneficiaries have been the law firms. The Australian people have lost; the litigants have lost; there have been no outcomes from this, other than for the class action lawyers. 
In the time left to me, I would like to move to a related matter, if I may. It involves apologists for those who are obviously working against the interests of the Australian people. I would like to refer to articles in the Australian. There was quite a little flood of them in December last year. We had one on 12 December:
Migrant skills help make a smart society.
That is fine. On Saturday, 9 December:
Ruddock must dismantle the walls of secrecy.
On Tuesday, 5 December:
Kiwis toss Ruddock out the back door.
But the one that really draws our attention is the one of Wednesday, 6 December:
Immigration policy demands flexibility.
Allow me to read this to the House. I will quote from the editorial:
But Immigration Minister Philip Ruddock and his department have acquired a reputation for the pursuit of rigidity as an end in itself. Quite apart from the inhumanity of it, such rigidity is contrary to any enlightened view of the national interest.
Later in this editorial, we will find out what the Australian's view of the national interest is and what they view as the minister's rigidity. I will move on. They go on to say:
... criminal aliens, even if they have been lawful residents for many years and no longer have ties with their native land ...
are being deported. It goes on to tell of:
... one such man, Graham Ernest Taylor, who faces deportation to Britain, which he last saw 33 years ago aged seven.
It then goes on to say:
He is in detention and faces “removal” from the country. Although Mr Taylor was a permanent resident, and had the vote, he was never naturalised. Mr Ruddock's parliamentary secretary, Senator Kay Patterson, decided to cancel his visa. Mr Taylor had failed a good-character test because of his criminal record.
Then, in an extraordinary statement, the editor goes on to say:
Leaving the law to one side ...
We are talking about a criminal alien, so we are going to leave the law to one side. But, anyway, we will allow the editor that little indulgence. He goes on to say:
Mr Ruddock's approach to criminal deportation raises serious questions.
We will find out what the Australian sees as `serious questions'. It goes on to criticise the minister by saying:
At best, however, Mr Ruddock has been sending mixed messages. And there are political reasons for being—or appearing to be—tough with criminal aliens.
I would have thought that there were. In fact, the political reasons, if you like, are law and order. Oddly enough, Australians do not want in their country aliens who are criminals. That is not a political reason; that is a commonsense reason. I hope that the editor of the Australian thinks better of what he said. In the last two paragraphs—and this is the extraordinary thing—the editor says:
Most people would support Mr Ruddock were he to refuse a visa to someone suspected of posing a terrorist threat to Australia.
Indeed they would.
Most would support him were he to cancel the visa of someone who had recently come to Australia to set up a heroin importation scheme.
That is exactly right. Australians have no truck with terrorists or heroin importers. Let me share with the House the criminal charges that Mr Taylor was convicted of, because that is earlier in the article. Remember: these are `political reasons'. The minister has been `rigid'.
... Mr Taylor pleaded guilty to sexual offences involving minors and was sentenced to a 3½-year minimum prison term.
We are very old-fashioned where I come from. People that sexually interfere with minors are called paedophiles. Mr Taylor was a paedophile, and the minister's rigidity was in expelling a non-citizen, a criminal alien convicted of paedophilia. But, according to the Australian, he is not as serious as a terrorist or a heroin importer. I am afraid the cappuccino ghetto in Sydney has somehow blurred the editor of the Australian's moral compass; it is completely rusted. 
—You could represent a cappuccino set.
—Yes, you could be in a cappuccino set.
—Oh, the member for Lowe and I have crossed swords. Here we have the Australian newspaper defending a paedophile, because `really terrorists should be deported and, as for heroin importers, we should cancel their visas but not paedophiles' and `the minister is being rigid'. Let me say that I hope the minister continues to be rigid. I hope that the minister continues to have political reasons like law and order and decency at the forefront and I hope that the pseudointellectuals in the cappuccino ghetto remember that the Australian people do not want criminal aliens convicted of paedophilia in this country. The only thing that needs to change in this editorial to make it true is that, instead of having the Australian, we just put at the top `The UnAustralian', because that is what this rubbishing editorial is—un-Australian. So to the minister: I support absolutely—
—You want to defend paedophiles? Let it be known that the member for Melbourne wants to defend criminal alien paedophiles. That will go down well in your resume. To the minister: I absolutely support this bill on class actions, the lawyer led recovery that the ALP wants. If the ALP continues to frustrate the bills in the Senate that so plainly people want, you are not going to get a leg up in the regions; you are going to get a boot out. So to the minister: congratulations. I hope he continues his rigidity. I hope he continues with his political reasons, because they are exactly what the Australian people want and they are totally supported by my electorate. (Time expired)",REPS,<title>MIGRATION LEGISLATION AMENDMENT BILL (NO. 2) 2000</title>,<title>Second Reading</title>,Bills,19,1,speech
