name,party,date,text,chamber,debate_title,subdebate_title,debate_type,debate_id,subdebate_id
"Cherry, Sen John",AD,2001-09-19,"—I am pleased to speak at long last on the matter of the Ansett collapse and the government's role in it. Governments have responsibilities when dealing with the issues of corporations, particularly when the issues of corporations deal with fundamental parts of infrastructure such as transport. I do not—and the Democrats do not—accept the general principle that this is just a matter of private corporations, that this is just a matter of a company badly managed by Air New Zealand and that we should point the finger, blame them, wash our hands and just hope the market fixes the issue. You are looking at a fundamental part of infrastructure that affects travel around a huge continent and affects our tourism industry, where 20,000 jobs are impacted by tourism and 72,000 are impacted through Ansett's subcontracts and its direct businesses. When you are looking at the effect of a whole economy right across the board in fundamental infrastructure, governments do have responsibilities. We do not accept the basic argument that this is just a matter of a corporation gone bad.
If I could take the Senate back very briefly—a bit of a history lesson—1957 was the last time that Australia's second airline went under. The airline was an airline called Australian National Airways, founded by Sir Charles Kingsford-Smith. At that stage, there was deep concern, because TAA was such a competitive company, that Australia would be in a position where the third airline, Reg Ansett's Ansett, would not be able to provide sufficient competition to TAA.
The Menzies government assisted Ansett to take over ANA and assisted them in a whole range of ways in terms of loan guarantees and business to ensure that Australia had two airlines and a reasonably competitive airline system. That is the sort of thing that governments do. If it was good enough for Bob Menzies, why is it that in 2001 it is not good enough for John Howard?
The Prime Minister cited yesterday the example of Compass where, because the Keating government refused to bail out Compass at the time it went under, that was being used as a pretext to do nothing in respect of Ansett. That highlights the barrenness of discussion of economic policy in this country. Liberal and Labor appear to be running on almost identical policies. Rather than talking about national interest and what do we do to keep our infrastructure appropriately used, our tourism routes open and our regional centres connected, we simply look at the blame game. 
There are a whole range of government instrumentalities which have let Australia down over the last two years. They range from the Foreign Investment Review Board through to CASA, ASIC, ACCC and the Department of Transport and Regional Services. Every government institution failed to see this coming. It is extraordinary that they did not see this coming, because it has been coming for at least four to five months. It has been on the public record since the fleet was grounded at Easter that `Ansett was in deep financial trouble.' For all of that time, the government has simply been sitting on its hands dithering.
It was revealed yesterday by the Prime Minister that his preferred option was the so-called Qantas option, an option that would allow Qantas to take over Air New Zealand, gobble up 80 to 90 per cent of the cross-Tasman traffic and for Ansett then to be on-sold to Singapore Airlines. Despite the fact it was quite clear that the New Zealand government would not accept such an option, because of the lack of competition in the New Zealand market, and that Singapore Airlines was not going to accept such an option, the government persisted with hoping that option would come off. The dithering continued. The cost of that dithering has been that the Ansett group has fallen over and taken with it a very large part of our infrastructure.
The Democrats are joining this motion today because we believe that the Prime Minister and the Deputy Prime Minister have let Australia down by not acting earlier in a decisive manner and by not taking a firm position that Australia needed a competitive and viable airline sector. We are now looking at the prospect of one and a quarter airlines servicing Australia. That simply is not good enough. Right across this country as we speak, there are thousands of people still stranded unable to get fares which two weeks ago were available for a different price. The tourism industry in my home state of Queensland and around Australia is obviously becoming deeply concerned about the lack of action. Combine that with the entire problem we now have with the unattractiveness of air travel because of the events in America and you have a situation crying out for clear national leadership. 
Unfortunately, over the last two months—when the government should have been aware of Ansett's problems and the need for urgent action—the government has had its eye off the ball. The Prime Minister was made aware of the situation of Ansett in a letter in June and again in August but he was too busy fighting his little war against Afghan asylum-seekers, an episode that Dustin Hoffman in Wag the Dog would have been quite proud of. His deputy, it seems, did not have the time either to actually get around to the boring business of running the country and ensuring we have our infrastructure adequately dealt with.
The Democrats are very disappointed that we have come to this situation with Ansett, our tourism industry and our regional centres around Australia. It is still not too late for the government to act decisively and come up with a rescue plan that would ensure Ansett does take to the skies. I was reading the AAP wire before I came in and the administrator is still convinced that it is possible for Ansett to be back in the skies. It would not take very much to ensure that it flies again. What it would take—which this government is not prepared to do—is a breaking out of the ideological logjam that it is just a matter for the markets, just a matter for corporate Australia to sort out. The ideological logjam that Keating and Beazley adopted in 1995 when Compass went under is still being adopted now by this government, and that is the real failure of this government. 
They do not think it is their responsibility to ensure that an airline is actually still flying around this country and to ensure that we have decent trunk routes to service our tourism centres and that regional Australia has got adequate services back into metropolitan Australia. Whether it is provided by government or a private corporation, it is a government responsibility. It is a government responsibility to ensure that the airline industry is competitive. Where was Allan Fels and the ACCC throughout the last six months when Ansett was bleeding, when Virgin was struggling and when Qantas was using its significant market power to build up its market share? Where was the government in terms of ensuring that that market power was not being abused? Where was the government in terms of ensuring that the New Zealand government made a decision so that Air New Zealand knew what it was going to do next?
Back in June, the head of Air New Zealand said that if the New Zealand government rejected their proposal to increase Singapore Airline's share in Air New Zealand then they would look at on-selling Ansett to Singapore Airlines. That would have been a wonderful outcome for Australia in retrospect but the dithering in Auckland—and there has been no assistance by our government to get a decision—has ensured that that did not occur. All of these events show failure of leadership, failure of government and failure of fundamental responsibilities, and Australia is the loser. ",SENATE,<title>MATTERS OF URGENCY</title>,<title>Ansett Australia</title>,Matters of Urgency,16,1
"Crane, Sen Winston",LP,2001-09-19,"—I start my contribution here today by saying that I, like many Australians, am saddened by what has happened to Ansett. I want to place on the public record that I had my first flight across the country with Ansett—I think it was back in 1969—and I have had many flights with them through the Western Australian hinterland. It is indeed a sad day for us, particularly in Western Australia, because they serviced us well.
Having said that, I also must comment on the two contributions that we have just listened to. They were contributions that I would call pathetic whinges: no suggestion of a solution, no acknowledgment that the speakers actually voted for what happened, no recognition of what their spokesmen did, as was drawn out by Senator Ferguson—and you could keep going. Let us hear what our Western Australian Premier said—the view of WA Premier Geoff Gallop as reported in yesterday's media in response to a suggestion from the WA Tourism Council that the WA state government should provide assistance to keep Skywest, a subsidiary of Ansett, going. Premier Gallop seemed in no doubt. He said:
 In the first instance it's got to be a commercial solution and I think all the taxpayers of WA would want us to regard that as the first priority in terms of a solution.
This is a very important issue for us, but there's no way by simply throwing money at the problem and coming up with a short-term solution that doesn't offer long-term sustainability—that's not the way to approach this issue.
That is the view of the Premier of Western Australia, where Ansett has played such a significant role for many years, as you know, Mr Acting Deputy President Lightfoot. It was not a solution adopted by the Labor Party during their previous stint in government. In fact, they could not even find a cent for the people in Compass—not a cent. I will deal with that matter in a moment or two. Our government, however, have put in a significant contribution in dealing with employees' entitlements. We have also given notice that we are going to legislate to change the law to protect employee entitlements—something that you on the other side of the chamber, who sell yourselves as the party of the employees and the workers in this country, would have promoted and done a long time ago if you really and truly believed in it. You had your opportunity; you did not do it. It disappoints me greatly that you come in now and run the line you do, when it has never been your position nor your policy. When you had the opportunity, you did nothing about it.
In my contribution, I particularly want to deal with the role of Mr Anderson and what has occurred with the administrator. But firstly I want to address the issue of superannuation, because there has been a beat-up in the last 24 hours regarding superannuation, trying to make out that the Ansett employees are not going to get their superannuation—another deliberate, misleading lie. It cannot be described as anything else. I will read out a statement I collected before I came in here:
The trustees of Ansett superannuation—
I do not know the name of that—
advise the administrator that employees' superannuation was paid up to 12/9/2001, the day the administrator was appointed.
If you or the ACTU had wanted to pick up the phone, you could have got that information instead of going out there yesterday and misleading the people there— it was grossly wrong and very unfortunate. I think that it behoves all that come into this place and make claims to at least get those claims right. That is very important. I hope that people are listening and that this information gets around, especially to the former employees.
The other point I make in this debate about what has occurred is that Australia is a very fertile ground for flying. There is no doubt in my mind that very soon—and the work is being done at this very moment—we will see another major player operating in the skies here and most of those people will get their jobs back. I predict that their unfortunate circumstances are going to be, for most of them, relatively short term. We have already seen, in terms of air services in rural and remote areas, an issue that I raised last week with the minister: significant replacements of services or emergency arrangements put in place. For people who live in remote areas in my state—and even for me, being in Esperance and not having Skywest down there—it is very important that we get alternative arrangements. I inform the Senate that we now have services back in Kununurra, Laverton, Learmonth, Leinster, Leonora, Meekatharra, Monkey Mia, Mount Keith, Paraburdoo, Port Hedland, Wiluna, Albany, Esperance, Geraldton, Shark Bay, Carnarvon, Exmouth and Newman. If people would like me to table this document, I can table it so that you are well informed. 
To the best of my knowledge, there are only two ports in Western Australia that are not being serviced at this point in time, and within 24 to 36 hours they will be serviced; there will be flights back there. I have the list for the other states; I am not going to read it out because I am dealing with Western Australia now. There have been misleading presentations in the Senate, particularly those we have heard over the last two days from Senator O'Brien, which need correcting for the record. 
—Rubbish.
—You were wrong in what you said about the work that has been done in getting these services back into place. There will be further work to be done—we know that. We know that we have a situation where some of those services will need to be upgraded, but they are coming. At our briefing today, I spoke to the minister regarding Skywest, and arrangements are being put in place at this very moment, as we speak, to see what can be done to get Skywest back in the air in Western Australia. So, as you go through this process, you find that an enormous amount of work has been done. 
I will quickly deal with the issue of Ansett employee assistance, which is one of those very misleading things which have been trampled around without any care whatsoever in this debate, yesterday and today. First of all, in our guarantee of statutory entitlements, we will be covering unpaid wages, unpaid annual leave and unpaid long service, as well as redundancy up to the community standard of eight weeks. If that is not reacting positively to the situation, I do not know what is. Further, in this whole thing we cannot let the board of Air New Zealand off the hook. We cannot let the situation that has occurred with Mr Toomey pass. We cannot let the members of the board go floating by, after they said that there were reserves of $1 billion sitting there when in fact there were none. Those are the issues we have to tackle in the first place. (Time expired)",SENATE,<title>MATTERS OF URGENCY</title>,<title>Ansett Australia</title>,Matters of Urgency,16,1
"McLucas, Sen Jan",ALP,2001-09-19,"—I join the debate on this matter of urgency about the future of Ansett Australia and what that will mean for the regions of Australia especially. At the outset, I want to note some comments from Senator Ferguson when he said that Senator O'Brien had spent 2¾ hours in this chamber arguing on behalf of Ansett. He seemed to be saying that that was something that was possibly a negative thing, and I do not understand that. It was good to see Senator Ferguson here, because he does not often spend a lot of time in this chamber. A lot of his time, I understand, is spent overseas. I also commend Senator O'Brien for his work in the aviation sector, not only during this recent debacle but over many years.
—I'm sure Senator Ferguson's trips were on parliamentary business.
—They probably were, but I can say that Senator O'Brien's work is very parliamentary, and I wish to take this opportunity to commend Senator O'Brien for the work he has done in the aviation sector over a long period. The knowledge of the sector that he has displayed over the period would have been very useful to Mr Anderson in the last six months.
I join the debate on this matter of urgency today to express my concern about the impact that the loss of Ansett services has had on North Queensland and the impact it will have if the services cannot be restored. Like many here, I attended a rally in support of the workers who woke last Friday to the news that they were not required at work that day. About 300 people—flight attendants, pilots, drivers, baggage handlers, ground staff, catering staff—attended the rally in Cairns. Many had long service with Ansett and its associated businesses. They spoke of their commitment to a company that they have seen comprehensively mismanaged in the past few years. They are people who have given long service to Ansett. They have been loyal employees and their futures now are unsure. 
One of the employees spoke about the family of Ansett. She was right. I met quite a number of couples where both partners worked with Ansett and its associated businesses. These families are now facing a future where both workers are potentially looking to find a new job. Many of them were talking about leaving the north. I met a young woman who was extremely distressed. Only one week earlier she and her partner had signed a contract on a new house in our region. These are real people: they have children, they have mortgages and they have been badly treated. Approximately 30 employees of the company Gate Gourmet also joined the rally. These employees are really facing a bleak future. They have been told that, irrespective of the future of Ansett, Gate Gourmet will not reopen. They are rightly concerned about access to entitlements. I understand that Mr Abbott advised yesterday that employees not directly employed by Ansett, including those of Gate Gourmet, will not even receive the same reduced level of entitlements as Ansett employees, if it comes to that. The Gate Gourmet employees will receive even less than Ansett employees.
The loss of approximately 280 to 300 jobs—both direct Ansett jobs and jobs in associated businesses— will have an enormous impact on the economy of Far North Queensland. There are many people whose jobs are dependent on a viable second airline in North Queensland. While there are no definite figures, concern has been expressed that the number of jobs lost in Cairns could be over 1,000. I offer my support to those workers and their families.
I would like to turn now to the broader impact on the economy of North Queensland if Ansett or another airline does not return to the city of Cairns. The Far North Queensland economy is based on tourism and primary production. The tourism industry returns $1.8 billion annually to tropical North Queensland and employs thousands of people. The industry is professional and internationally competitive, but the events of the past week—both the tragedy in the United States and the voluntary administration of Ansett—have shaken this important industry. Last Friday, we saw the loss of 3,300 seats per week between Sydney and Cairns and 4,400 per week between Brisbane and Cairns. Seventy-five per cent of visitors to Far North Queensland—both international and domestic tourists—come by air. Qantas, I understand, have established a new service between Cairns and Brisbane which will replace some of those seats, and they are currently negotiating with the federal government for approval to allow some of their international flights to carry domestic passengers. This will go some way to solving the problem of shifting stranded tourists and local travellers, but it does not solve the long-term problem which will result if Ansett is removed from the air travel industry of this country. That problem is the need for competition on all major routes across the continent.
The tourism industry, as we know, is extremely price sensitive. Most travellers make decisions about their destinations firstly on cost. Destinations like Cairns, Port Douglas, Townsville and the Whitsundays rely on competition in the airline industry to deliver the competitive fares that have opened up these markets to domestic and international tourists alike. Early indications from the international market are mixed. The dual effects of the events in the United States and the Ansett debacle have sent jitters through the tourism industry, but it is early days. Advice from the ATC today is that it will be at least another week before we can truly ascertain the impact of these events on the transport industry. However, I commend and support the actions of Premier Beattie of Queensland in urging the federal government to increase tourism marketing domestically and internationally to provide a buffer against these problems.
The accommodation sector also has real concerns about the loss of our second airline. In the immediate sense, I am aware that hotels and motels that have accepted Ansett holiday vouchers have not been paid for July or August. For smaller operations, this may mean losses of between $2,000 and $4,000. These are small family run motels that cannot afford a loss of that size, but larger institutions and hotels are carrying debts of over $100,000. There will be enormous effects on the cash flow in the Cairns region and in all centres that have high levels of tourist accommodation.
At the rally of Ansett workers last Friday, the Mayor of Cairns, Councillor Kevin Byrne, quite rightly expressed his concern and his anger at the loss of Ansett to the community of Cairns. The often overlooked service to regional centres provided by the airline industry is the carrying of freight. Whilst it is difficult to get hold of comparative figures, I am aware that 1,000 tonnes of product has been moved by Ansett from the Cairns terminal over this calendar year. Because of the availability of space and the regularity of the service, purchasers of North Queensland product through both Qantas and Ansett have been able to adapt their orders to suit their current conditions. Essentially, they are short-ordering, depending on demand. This flexibility will be lost if either Ansett or another carrier cannot replace that lost freight service. In the lead-up to Christmas, the valuable lychee, longan and mango crops will be harvested. These products have a short shelf life and rely on air shipment for sales. Chilled seafood also relies on access to airfreight, and I am aware of seafood retailers with immediate problems in accessing freight.
The issue of competition in the freight sector has long-term ramifications for primary production in the north. Regional services have also been affected in the week prior to the school holidays. The essential message from North Queensland is that in the short term services need to be established to assist with stranded passengers and freight needs. I support the call from the Cairns Chamber of Commerce for assistance from the federal government through the provision of RAAF planes. The broader question, with long-term ramifications, concerns the need for competition in the airline sector to support the professional and competitive tourism industry of Far North Queensland. 
Finally, I want to make some comments about the role of the federal government. This government has been prepared to allow the loss of 17,000 direct jobs, the loss of tens of thousands of indirect jobs, the loss of competition in air travel and in freight movement, and the economies of regional centres to be threatened. The situation is that the government's economic rationalist ideology has stood in the way of a sensible proactive approach to working with Ansett to find a solution for our regions and for our communities.",SENATE,<title>MATTERS OF URGENCY</title>,<title>Ansett Australia</title>,Matters of Urgency,16,1
