name,party,date,text,chamber,debate_title,subdebate_title,debate_type,debate_id,subdebate_id,type
"Ripoll, Bernie, MP",ALP,2001-02-06,"—I am very pleased to speak on this Migration Legislation Amendment Bill (No. 2) 2000, as I welcome the opportunity to highlight the very real concerns that some members of the Joint Standing Committee on Migration have with the proposals being put forward by the government today. Like so much of the migration related legislation that is discussed and debated in this chamber, Migration Legislation Amendment Bill (No. 2) 2000 reinforces the tireless attitude of this government of punishing immigrants by disenfranchising them from the Australian justice system.
I have spoken numerous times on the hardship and humiliation people undergo throughout the Australian migration process. It does not matter what category of entry to Australia a person may choose to apply under, he or she will be subjected to a migration process of relentless suspicion and speculation. Their personal relationships will be questioned, their morality will be examined and their integrity will be undermined. Migration to Australia is pretty much considered a criminal offence by this government, and the amendment bill we are debating tonight further entrenches in our justice system the notion that migrants and refugees are not entitled to Australia's fundamental judicial practice of innocent until proven guilty.
There are two elements of this bill that I find quite alarming. The first relates to the methodology used by the government to examine the utility of class and/or representative actions being used in the system of judicial review. The second concern I have is the implication that the changes to the review jurisdiction of the Federal and Supreme Courts are unconstitutional. Many other things have been said about this bill, but I might just focus on these two particular points. The opposition members of the Joint Standing Committee on Migration tabled a dissenting report on the inquiry into the Migration Legislation Amendment Bill (No. 2) 2000. The dissenting report primarily discussed the inquiry's considerations to restrict access of class actions for judicial review of migration decisions by the Federal Court and the High Court. As is indicated in our report, the inquiry failed to conclude that the use of class and/or representative actions was being abused and being used to simply delay a person's departure from Australia. The inquiry simply did not receive compelling arguments that the abuse of class actions exists at all. The government members of the committee were also forced to accept that the evidence provided to the inquiry was not sufficient to pinpoint class actions as a particular problem.  
The government members concluded that class actions were not an abuse of the system, that the process could be abused and that the level of abuse was not quantified. Yet the government did not provided a sufficient alternative to allay their fears of class action abuse. The key rationale for the class action provisions of this bill could not be and is not sustained. There was no firm evidence of any kind of the claimed abuse of this process, which is the rationale for restricting the access in the first place. But there was no indication that alternatives to the proposed legislative solution had even been considered by the government at all. So the government has a perception that class actions can be abused, and the only solution offered is the removal of the judicial review process. Like so many of the migration decisions made by this government, the outcome is to punish the many in order to catch the few.
The inquiry also considered submissions and testimony from numerous interest groups which indicated that the courts already have mechanisms for filtering and dismissing frivolous or illegitimate applications. Contrary to the government's reasoning, the National Council of Churches of Australia, the NCCA, argued that the failure of a class action case could not be taken as proof of abuse. The Law Council of Australia commented further that the courts have not described any of the unsuccessful class actions as abusive action or behaviour. 
The inquiry heard further evidence that the success rate of class action reviews in the High Court could be remedied if the government showed a commitment to real solutions to migration problems. The government proposal to restrict access to class actions is aimed squarely at the applicants, that is, the ones most likely to be seeking redress through the courts. I do not consider the restriction of class action as an appropriate solution to the alleged abuses. The NCCA pointed out that the lack of merit in some actions may reflect an abuse of legal advice rather than a decision to exploit the review process itself. Alternative remedies to this were discussed at the public hearings conducted by the committee, with an understanding that better access to lawyers and ethical migration agents would enable applicants for judicial review to obtain professional advice to clients on the avenues of appeal and the prospects of their particular case. It was evident to the committee that individual migration agents were well placed to use the class action appeal process to their professional advantage. The Migration Agents Registration Authority, MARA, had failed to address DIMA concerns of this practice being undertaken. The dissenting report concluded:
The performance of MARA, the body that is responsible for monitoring the conduct of registered agents, should be of grave concern to the Government and the migration advice industry in general.
It was clear to the opposition members, and I am sure also to the government members, of the Joint Standing Committee on Migration that alternative action was a viable solution to the government's claims of class action abuse. It was also evident to the opposition members of the committee that the government had not intended to remedy the real problems with the judicial review process in the first instance. Rather, the government has clung to a notion of class action abuse, regardless of an overwhelming lack of evidence, and intends to punish the innocent based on this false premise. 
I have already touched on the notion that migration applicants are subject to an assessment and judicial process unknown to others in Australia. It would appear that the Migration Legislation Amendment Bill (No. 2) 2000 will now institutionalise the inequity of Australian migration regardless of the impact on the Federal and High Courts and potential illegality of judicial review process. An element of the government's explanation for the restriction of class action on migration review decisions has focused on the cost and time class actions take in the court system itself. Despite the government's desire to eliminate review applications in the courts by making the process financially harder on an individual, there is significant potential that restriction of access to class actions would have a negative impact on the court system. Individuals will now be required to commence separate proceedings, which will increase the workload of the courts. Some of those proceedings may also serve as test cases. The success of one proceeding may encourage others of a similar nature. Again, this would mean a greater volume of litigation for the court system, and the justices of the High Court have made very clear their opposition to this prospect.
So what is the government's solution to the potential of litigation increasing? Restrict the rights of the applicant even further. Yes, deny the applicant the opportunity of full and equal judicial review. What an innovative idea from a government against immigration! So, rather than allowing an individual the opportunity to access the full judicial review process of Australia, this bill will introduce a time limit on the making of applications to the High Court for review of migration decisions. The time limits, 28 days from decision, are to be absolute and not able to be varied by the court.
There seems to be a problem with this restriction. There appears to be a debate on whether an absolute time limit for appeal to the High Court is constitutional. This brings me to the second point which I feel has a great impact on this bill. The question which arises is whether the imposition of absolute time limits on applications to the High Court for judicial review impermissibly interfere with the exercise of federal judicial power. As suggested in the research on this specific threat to the separation of powers in Australia's political executive, I am going to leave that debate to the constitutional lawyers. I want specifically to touch on the point that what we have today is a government which is prepared to introduce legislation that could—I stress `could'—undermine the Australian Constitution and tie up the High Court and the Federal Court in further litigation, all because approximately 3,500 people have sought class action judicial review. You might think that 3,500 is a lot of people; it is, but over 10 years it is a reasonable figure.
The astounding part of this debate is that the government has failed to provide sufficient evidence in support of these amendments, it has not considered any viable alternatives to allay its fears of class action abuse and, finally, it has refused to address substantial problems in its own migration process and how these problems are monitored. In light of any evidence of practical gain from these legislative changes, I would recommend that the Migration Legislation Amendment Bill (No. 2) 2000 be referred to the House of Representatives Standing Committee on Legal and Constitutional Affairs for further consideration. I would reserve my right to move, amend or oppose relevant parts of the bill following the committee's report.
Finally, I touch on a couple of issues which are relevant to this debate and poignant. This government is spending disproportionate amounts of taxpayers' money in what it is beating up to be a bigger problem than actually exists. It is spending millions of dollars in places like Woomera, out in the middle of nowhere. If you stand on a building at Woomera and turn 360 degrees, you will not see a tree. If you turn 360 degrees again, you will not see another building. If you keep looking on the horizon for any landmark, you will see that there really are not any. If someone were to leave this detention centre, there would be nowhere to go, as has been seen. That is the reality. Yet to ensure that people are not going to escape from these centres, we build more security, higher walls and bigger fences when they are not needed. It reinforces the mentality and attitude in these centres that these people are not going through a traditional process of migration to Australia and are more than just detainees. They are being made out to be criminals. In effect, after very lengthy periods of waiting—up to two years and I have heard of some which are longer—detainees lose patience with what would be reasonable attitudes towards the government and not knowing. It is more the fact that they are there sometimes for up to 12 or 24 months and do not know what is happening to them. Either they do not have language skills or they do not have any support. They are kept in what are inhospitable conditions. Being on the Joint Standing Committee on Migration, I have visited these places. Our report was entitled `Not the Hilton'. I assure you that Woomera is not the Hilton. 
We are seeing disproportionate amounts of money being spent on a problem which does not exist in the first place. But if you repeat the lie enough and seem to be doing something about something which is not happening in the first place, then people say, `Look, they're doing something about a problem.' But, of course, the problem never existed to start with. The problem manifested itself out of nothing. That concerns me. Regardless of how you classify people, whether they are immigrants through the traditional process of migration, refugees, asylum seekers or others, then sometimes there are no other choices but to come to this country to seek asylum through other than normal channels. The government must be understanding of that.
—They don't have the heart.
—That is right; they do not have the heart. Government members in this debate have used emotional tactics. Why would these people come to this country and destroy their papers, their identification? They say that it is to prolong the process here of trying to identify who they are. Why would you do that? Sooner or later you are identified and, if your claims are not bona fide, then you are deported. What would be the bonus of sitting for 12 months or two years in a detention centre, for example in Woomera in the middle of the desert, when eventually you have to go back? The conditions there are probably harsher than where they have come from.
As I have said in previous debates, I think the hardship which some people go through to leave the persecution and potential death which they face in their own country is sometimes exacerbated by the conditions and the criminality which we impose on these people when they come to our shores. The government has made it very clear from the outset with pamphlets and brochures trying to scare off people. You do not scare off people with lies and with, `If you land on our shore, you are going to be eaten by a crocodile or a shark or you are going to be killed by someone.' These are lies. This is a fraudulent reflection on the Australian nation. This is not what our country is about. This is not who we are as Australians. This is not the identity we built up. We do not do that. Yet it was attempted. It was only through great pressure brought by ordinary Australians here in Australia that we saw the government and the minister take a second look and say, `Hang on, we might be on the wrong track here. We've missed the boat on this politically.'
This is a political issue. This is not really about the migrants, the refugees, the asylum seekers. This is a difficult subject for all governments of any persuasion. It is always difficult to manage migration, but you can do it effectively and responsibly. We are seeing this government not being responsible. It is saying, `If you come here, you will be eaten by a crocodile.' That is not responsible. `If you come here, we will stick you in a detention centre indefinitely and we will not tell you what is happening to you. We will break all of the laws of natural justice. We will break all of the laws of what happens in this country to every other person, regardless of whether or not they are a citizen. We will do that and we will do it irresponsibly.' That is what they are doing. Immigration should not be a political topic. It should be about dealing with these issues. If people come here who are not bona fide, then they will have to leave. On both sides, I think we agree with that. I am talking about the process here, the process which this government says will make things better. 
When DIMA was before us at the public hearings, we asked the supposed experts, the heads of department, some very simple questions—you can check the Hansard for this. I asked, `Will this save the government money?' `Óh, yes, Minister, of course it will, lots of money.' `How much money?' `Just lots.' I said, `Really. That is funny; that is not what the minister says. The minister says that this could cost the Commonwealth money.' They say, “Oh, well, then it might cost money.' So I am saying, `Which one is it? Will it save a lot of money—buckets, big loads—or will it cost us potentially some money?' `We'll get back to you on that.' That was one premise: we have to have this because we have to save money. So that is that one out the door. `Is it constitutional?' `We have advice which says it is.' `Can we have a look at this advice?' `Sure, eventually.' So we get the advice. I can read legalese just a bit. I clearly read that it says you could deduce that it might be constitutional if it were not unconstitutional, if you know what I mean.
The advice basically says, `Look, call it whatever you like, but don't come back to us and blame us and say that we told you it was constitutional because what we are saying is that we are not giving you an opinion.' So it was very good legal advice. When I looked at all of the reasons the government demanded to have these changes, I could not find one bona fide reason based in fact. I could find plenty of reasons based on innuendo and speculation—a whole range of irresponsible reasons—but not one real reason based in fact. If the committee charged with reviewing these bits of legislation had been shown any skerrick of evidence or fact we would have accepted it. We did not accept it because the evidence pointed the other way. It said, `There is no abuse that we can point to in fact.' What we saw was the government saying, `Those facts are not the facts; these are the facts on which we will be basing our decision.' 
The opposition members were left to ponder what we were to do so we wrote a dissenting report. It was the only option we, and the Democrats, had. We do not want to frustrate the process; we simply want the facts to come forward. Who would not want the facts to come forward? But when you have a committee that absolutely refuses to accept the hard cold facts from everyone who comes before it in evidence, what are you to do? You have to write a dissenting report—not to frustrate the system, as I said, but merely to present the facts as they stand, unaltered. 
This bill will not make any changes that will benefit the public, the government, the taxpayer or, more importantly, anyone who is currently sitting in a detention centre. It will not make any difference. If the government were serious about addressing this problem—because there is a problem out of there—it would tackle the problems where they exist. Let us look at migration agents, at their ethics and at how they operate. Let us look at how advertising takes place in the industry. It does not just encourage people to take class-actions, it almost guarantees them a win. Let us look at a whole range of things but let us not point all of the blame to those people who take part in a class action, which they are so entitled to choose, because they are seeking redress. They are seeking the full availability of the law as any other person in their right mind would do. Why wouldn't you? If you have come here and you are bona fide, and you believe you are bona fide, why wouldn't you take any option available to you? Why shouldn't Australia and the government allow that to take place, unless there are other motives, and I am yet to find out what those other motives are? 
Finally, I think this bill is absolutely wrong. It is incorrect, it is misguided, it is irresponsible and it will cost the taxpayer more money rather than less and, in the end, it will make no difference. It will increase the workload of the courts. It will make the work of the courts harder and it will threaten the Constitution. I think these are serious issues, serious concerns, and the government should just take another look. ",REPS,<title>MIGRATION LEGISLATION AMENDMENT BILL (NO. 2) 2000</title>,<title>Second Reading</title>,Bills,19,1,speech
