name,party,date,text,chamber,debate_title,subdebate_title,debate_type,debate_id,subdebate_id,type
"Howard, John, MP",LP,2001-02-06,"—I move:
That this House records its deep regret at the death on 26 December 2000 of John Elden McLeay, former federal minister and member for the division of Boothby, places on record its appreciation of his long and meritorious public service and tenders its profound sympathy to his family in their bereavement and loss.
John Elden McLeay was born in Adelaide on 30 March 1922, the son of the late Sir John and Lady McLeay. After attending Scotch College, Mr McLeay enlisted in the Australian Imperial Force in 1941 and served in New Guinea as a gunner with the 13 Field Regiment Royal Australian Artillery from 1942 to 1943. He joined the Liberal-Country League, later the Liberal Party, in 1940 and was elected to the Unley City Council, where he served from 1949 to 1970, including a period as mayor from 1961 to 1963. 
In 1966 Mr McLeay succeeded his father, a former Speaker of the House of Representatives, the late Sir John McLeay, as the federal member for Boothby and he continued to represent that division in this parliament until his retirement in 1981. During his federal parliamentary career John McLeay held several portfolios, including Assistant Minister to the Minister for Civil Aviation, Minister for Construction and Minister Assisting the Minister for Defence. He also served as Minister for Administrative Services in the Fraser government from 1978 to 1980. As Minister for Construction, he gave great support to the preserving and restoring of some of the most significant Commonwealth owned historic properties. He devoted himself to a wide range of political issues beyond his portfolio responsibility as a minister. He was regarded as controversial by some for the views he held, particularly on foreign affairs issues, in particular his position on South Africa and the then Rhodesia, and he participated in many heated debates in the House on those matters. 
He resigned from parliament in 1981 and was appointed Australia's Consul General to Los Angeles from 1981 to 1983. During this time he founded the Australian-American Chamber of Commerce in Los Angeles. For this he received a special commendation from the United States Secretary of State. He also did much in this period to build the business relationship between Australia and California and the United States as a whole.
John McLeay was very active in the South Australian community, where he founded the Unley Senior Citizens Club and enthusiastically supported both handicap and pensioner organisations. Aside from his political career, John McLeay was a highly successful businessman, founding the family business of McLeay and Sons Carpets in Adelaide, a firm which still operates today. He showed strong leadership qualities, demonstrating highly ethical standards in both his business and his political career. 
As members will know, a state memorial service, attended by a number of our colleagues, was held at Scotch College on 12 January 2001. To his wife, Clythe, their three sons, Travis, Robin and Digby, and their families, I extend, on behalf of myself, the Liberal Party of Australia, of which John McLeay was a very faithful, long serving member, and the parliament, our very deepest sympathy on his death.",REPS,<title>CONDOLENCES</title>,"<title>McLeay, Hon. John Elden</title>",Condolences,0,1,speech
"Beazley, Kim, MP",ALP,2001-02-06,"—On behalf of the Australian Labor Party, I want to support those words of the Prime Minister on the death of the Hon. John Elden McLeay, a former minister of the McMahon and Fraser governments. He was born into a world of politics, both his father and uncle being federal politicians. He was first elected to parliament, as the Prime Minister said, in 1966 for Boothby, succeeding his father who had held the seat for over 16 years. For over 30 years the people of Boothby were represented by a McLeay, and that is a remarkable record. He was a controversial political figure, as the Prime Minister alluded to. That spotlighted his views on a number of matters during the course of the 1970s. Needless to say, those views did not receive wholehearted support on this side of the House.  
He held several portfolios during his time as a minister, being first appointed to the ministry in 1971 in the McMahon government as the Assistant Minister to the Minister for Civil Aviation. In 1975 Mr Fraser appointed him Minister for Construction and Minister Assisting the Minister for Defence. In 1978 he was appointed Minister for Administrative Services, as well as retaining his position as Minister Assisting the Minister for Defence, and he held those portfolios until 1980, retiring in 1981. For a period of time in the late 1970s he was the only South Australian minister in the Fraser government and was identified as the South Australian spokesperson within it for that period of time. As Minister for Construction, as the Prime Minister has said, he paid particular attention to the issues of preservation and restoration of important Commonwealth historic properties. He also had responsibility for fighting for funding for new developments, including the establishment of the Australian Antarctic Division headquarters in Hobart. I would like to offer, on behalf of the opposition, our sincere condolences to his wife, Clythe, and to his family.",REPS,<title>CONDOLENCES</title>,"<title>McLeay, Hon. John Elden</title>",Condolences,0,1,speech
"Southcott, Dr Andrew, MP",LP,2001-02-06,"—I wish to add my comments to this condolence motion. John McLeay was educated at Scotch College, Adelaide, in the heart of the electorate of Boothby. While at school, he captained the teams for cricket, athletics and football. As has already been mentioned, he followed his father and his uncle into federal parliament. He also followed his father as Mayor of Unley. He served as the federal member for Boothby from 1966 until 1981. In his maiden speech, he touched on issues of Australia's security and aged care and referred humorously to following his father into parliament. He did not mention his father by name but congratulated the previous Speaker for his long service and mentioned that:
While he was Mayor of Unley, he put forward a similar suggestion to my federal member, but I found myself in conflict with him on this matter. In fact, I found myself in conflict with him on many occasions.
John McLeay was fiercely anticommunist. He was controversial for his remarks on socialism, communism and Rhodesia and held those views with great conviction. I first met John McLeay five years ago, well after his public life had ceased. He worked actively in the family business until recently. I treasure the time I had with John McLeay, having had the opportunity every three or four months to meet with Harold Young, Jim Forbes and John McLeay at a regular lunch meeting at the Kent Town Hotel. I know that they will miss him and I will miss him as a source of advice. John McLeay had a longstanding friendship with former defence minister Jim Killen which went on long after their time in parliament. John and Clythe would often visit Jim Killen and spend some time with him in Queensland.",REPS,<title>CONDOLENCES</title>,"<title>McLeay, Hon. John Elden</title>",Condolences,0,1,speech
"Downer, Alexander, MP",LP,2001-02-06,"—I would like to add a few words to this condolence motion. I did not know John McLeay very well but I did know him a little. He was a fine member of the Liberal Party in South Australia and, before that, the Liberal Country League. As the Prime Minister said, he served as the member for Boothby from 1966 until 1981. He certainly was always a man of strong principles and beliefs. He was deeply anticommunist. He was also a very strong opponent of socialism and was never afraid to speak out in support of the values he believed in. He was a supporter of Australia's participation in the Vietnam War. That was a very controversial view to hold, particularly towards the end of the 1960s and into the early 1970s, but he never wavered in his belief—whether or not people share it today is another thing—that that was a just war to stop the spread of communism through South-East Asia.
When John McLeay retired in 1981 to take up the position of Consul General in Los Angeles was when I first became involved in politics, contesting the preselection for Boothby, which I did not win. However, we have a very fine member for Boothby now, as we did before in the person of Steele Hall. John McLeay's family served that part of Adelaide extraordinarily well for a very long period. John McLeay will be very much missed by many people in and around Adelaide, in the business community and in the political community. I extend my condolences to his wife and to his three sons. ",REPS,<title>CONDOLENCES</title>,"<title>McLeay, Hon. John Elden</title>",Condolences,0,1,speech
"Worth, Trish, MP",LP,2001-02-06,"—I would like to briefly add my comments to those already made. The southern end of my electorate was once in Boothby. When I first joined the Liberal Party in 1976, my branch, my home and all the connections I have with the party were in Boothby. In fact, at the time he resigned from parliament, I was a prominent member of John McLeay's federal electorate committee. I knew his wife and his sons and would like to add my own words of condolence to them. Without going over the history that has already been given, I certainly remember his retirement from this place and the current member for Mayo's involvement in the preselection when Steele Hall became the member.
Question resolved in the affirmative, honourable members standing in their places.",REPS,<title>CONDOLENCES</title>,"<title>McLeay, Hon. John Elden</title>",Condolences,0,1,speech
"Beazley, Kim, MP",ALP,2001-02-06,"—My question is to the Treasurer. Treasurer, will you adopt Labor's commitment to introduce a once-a-year GST BAS reporting regime?",REPS,<title>QUESTIONS WITHOUT NOTICE</title>,<title>Goods and Services Tax: Business Activity Statement</title>,Questions Without Notice,4,1,question
"Costello, Peter, MP",LP,2001-02-06,"—I very warmly welcome the question. As I said this morning, one has to distinguish between payments and reporting. In relation to quarterly payments, the system of quarterly payments has to continue, obviously, otherwise you would not have money for the states. I notice that the Leader of the Opposition then went out and endorsed the system of quarterly payments. He said, `They would be paying quarterly'—and we agree with that—`they could do it on the basis of the average established in one of those payments, the final of those payments.' What he seemed to be saying is that you pay quarterly. His idea was that you would just take off last year's return. There is only one problem: there is no last year's return on GST, a point that was made to him by John Laws. John Laws said, `Is Peter Costello misleading the people by saying there are no past estimates for them to work on?' The Leader of the Opposition made this statement, basically conceding that I was again right on that point—that there are no past estimates. He said this: `The past estimates will be created by the next BAS statement. You will actually have a year's worth of BASs.' You will not have a year's worth of BASs by the next statement because the next statement is due in April but you will have it by June. So he got that wrong. He said that you will have a year's worth of BASs by the next statement, by June. Essentially, what he is saying is that it has to be done quarterly and, what is more, in the first year—the transitional year—you cannot go off a previous year's statement, so you will actually have to do at least four quarterly returns in the transitional year. That is the policy of the Leader of the Opposition. 
I thought that it was more revealing for this point. I want to explain, when you take a policy-lazy position, the trouble that you get yourself into. Suppose next year that you were to take your quarterly payments off this year's return; suppose next year, in the financial year 2001-02, you were to take your payments off the returns that have to be done this year. It would only work on the basis that the GST base was the same. If you had a rolled-back GST in 2001-02, how could you use the quarterly payments on 2000-01? You would be paying on the current base in respect of a whole new rolled-back GST. The one thing you cannot do in 2001-02 is use this year's return whilst rolling back your base. 
—The Leader of the Opposition on a point of order.
—I rise on a point of order, Mr Speaker. It goes to relevance.
—There is no point of order on relevance. The Treasurer is entirely relevant and has the call.
—The one thing you could not do in a subsequent year is take the returns off this year if you were using a different base because you would be collecting GST on this base which would not be the base in the year of assessment and payment. I do not think he has actually thought for a moment about his roll-back. Since 16 July, he has been promising roll-back. He has not thought about it for one moment and his statement today illustrates how lazy he has been because he is now promising to collect instalments out of an unchanged GST base.
—The member for the Northern Territory!
—The member for the Northern Territory is warned.
—That is what he is promising to do. The government has made the situation entirely clear: the quarterly payments will be continuing. After the first year has been completed—after having the year of experience, which you actually agree with—we will be ensuring that in future years the system is simplified, with all of those transitional matters which are taken out of it. We have already commenced consultation in relation to that. It will be substantially simplified once we have gone through the transitional period—
—Oh, yes. Transitional?
—The Deputy Leader of the Opposition!
—which you actually support and say has to be done. And, Mr Speaker, I can assure the small business community of Australia, which has performed magnificently with now over one million returns in, that where those matters can be simplified they most certainly will be simplified, consistent with a quarterly payment period which even the opposition has now brought itself out to support.",REPS,<title>QUESTIONS WITHOUT NOTICE</title>,<title>Goods and Services Tax: Business Activity Statement</title>,Questions Without Notice,4,1,answer
"Mossfield, Frank, MP",ALP,2001-02-06,"—Mr Speaker, under standing order 150, would you please write to the Treasurer and the Minister for Health and Aged Care seeking answers to questions Nos 2040 and 2041, put on the Notice Paper on 10 October last year?",REPS,<title>QUESTIONS TO MR SPEAKER</title>,<title>Questions on Notice</title>,Questions to the Speaker,5,1,question
"SPEAKER, Mr",N/A,2001-02-06,—I will follow up the matter raised by the member for Greenway.,REPS,<title>QUESTIONS TO MR SPEAKER</title>,<title>Questions on Notice</title>,Questions to the Speaker,5,1,answer
