name,party,date,text,chamber,debate_title,subdebate_title,debate_type,debate_id,subdebate_id
"Kelly, Jackie, MP",LP,2002-12-12,"—by leave—I move:
That the following orders of the day, government business, be discharged:
39	OFFICIAL ESTABLISHMENTS TRUST —RE--PORT—MOTION TO TAKE NOTE OF PAPER: Resumption of debate (from 11 December 2002—Mr Swan) on the motion of Mr Tuckey—That the House take note of the paper.
40	OPERATIONS OF THE REGISTERED HEALTH BENEFITS ORGANISA-TIONS—REPORT—MOTION TO TAKE NOTE OF PAPER: Resumption of debate (from 11 December 2002—Mr Swan) on the motion of Mr Tuckey—That the House take note of the paper.
41	ANGLO-AUSTRALIAN OBSERVATORY—REPORT—MOTION TO TAKE NOTE OF PAPER: Resumption of debate (from 11 December 2002—Mr Swan) on the motion of Mr Tuckey—That the House take note of the paper. 
42	AUSTRALIAN COMMUNICATIONS AUTHORITY—REPORT—MOTION TO TAKE NOTE OF PAPER: Resumption of debate (from 11 December 2002—Mr Swan) on the motion of Mr Tuckey—That the House take note of the paper.
43	SNOWY MOUNTAINS COUNCIL—REPORT—MOTION TO TAKE NOTE OF PAPER: Resumption of debate (from 11 December 2002—Mr Swan) on the motion of Mr Tuckey—That the House take note of the paper.
44	SNOWY MOUNTAINS HYDRO ELECTRIC AUTHORITY—REPORT—MOTION TO TAKE NOTE OF PAPER: Resumption of debate (from 11 December 2002—Mr Swan) on the motion of Mr Tuckey—That the House take note of the paper.
45	SUBMISSION REPORT ON ILO INSTRUMENTS ADOPTED IN 2001—REPORT—MOTION TO TAKE NOTE OF PAPER: Resumption of debate (from 11 December 2002—Mr Swan) on the motion of Mr Tuckey—That the House take note of the paper.
46	GOVERNMENT RESPONSES TO PAR-LIAMENTARY COMMITTEE RE-P-ORTS—PAPER—MOTION TO TAKE NOTE OF PAPER: Resumption of debate (from 11 December 2002—Mr Swan) on the motion of Mr Tuckey—That the House take note of the paper.
47	COMMUNICATIONS—PAPERS—MOTION TO TAKE NOTE OF PAPERS: Resumption of debate (from 11 December 2002—Mr Swan) on the motion of Mr Tuckey—That the House take note of the papers.
62	Indigenous Education and Train-ing 2001—MINISTERIAL STATE--MENT—MOTION TO TAKE NOTE OF PAPER: Resumption of debate (from 14 November 2002—Ms Macklin) on the motion of Jackie Kelly—That the House take note of the paper.
63	FEDERAL PRIVACY COM-MIS-SIONER—REPORT—MOTION TO TAKE NOTE OF PAPER: Resumption of debate (from 14 November 2002—Ms Macklin) on the motion of Mr McGauran—That the House take note of the paper.
64	FOREIGN AFFAIRS, DEFENCE AND TRADE—JOINT STANDING COM-MITTEE—REPORT ON FREEDOM OF RELIGION AND BELIEF—GOV-ERN-MENT RESPONSE—MOTION TO TAKE NOTE OF PAPER: Resumption of debate (from 14 November 2002—Ms Macklin) on the motion of Mr McGauran—That the House take note of the paper. 
65	ENTERPRISE AND CAREER EDU-CATION FOUNDATION—REPORT—MOTION TO TAKE NOTE OF PAPER: Re-sumption of debate (from 13 November 2002—Mr Swan) on the motion of Mr Abb-ott—That the House take note of the paper.
66	ANINDILYAKWA LAND COUNCIL—REPORT—MOTION TO TAKE NOTE OF PAPER: Resumption of debate (from 13 November 2002—Mr Swan) on the motion of Mr Abbott—That the House take note of the paper.
67	LIST OF MULTILATERAL TREATY ACTIONS—PAPER—MOTION TO TAKE NOTE OF PAPER: Resumption of debate (from 13 November 2002—Mr Swan) on the motion of Mr Abbott—That the House take note of the paper.
68	Department of Education, Science and Training—REPORT —MOTION TO TAKE NOTE OF PAPER: Resumption of debate (from 12 November 2002—Mr Swan) on the motion of Mr Abbott—That the House take note of the paper.
69	Commonwealth Scientific and Industrial Research Organi-sa-tion—REPORT—MOTION TO TAKE NOTE OF PAPER: Resumption of debate (from 12 November 2002—Mr Swan) on the motion of Mr Abbott—That the House take note of the paper.
70	Office of the Official Secre-tary to the Governor-Gen-eral—REPORT—MOTION TO TAKE NOTE OF PAPER: Resumption of debate (from 12 November 2002—Mr Swan) on the motion of Mr Abbott—That the House take note of the paper.
71	Australian Security Intelli-gence Organisation—REPORT—MOTION TO TAKE NOTE OF PAPER: Resumption of debate (from 12 November 2002—Mr Swan) on the motion of Mr Abbott—That the House take note of the paper.
72	Insolvency and Trustee Service Australia—REPORT—MOTION TO TAKE NOTE OF PAPER: Resumption of debate (from 12 November 2002—Mr Swan) on the motion of Mr Abbott—That the House take note of the paper. 
73	Operation of the Bankruptcy Act 1966—REPORT—MOTION TO TAKE NOTE OF PAPER: Resumption of debate (from 12 November 2002—Mr Swan) on the motion of Mr Abbott—That the House take note of the paper.
74	National Native Title Tri-bun-al—REPORT—MOTION TO TAKE NOTE OF PAPER: Resumption of debate (from 12 November 2002—Mr Swan) on the motion of Mr Abbott—That the House take note of the paper.
75	Australian Institute of Abor-iginal and Torres Strait Islan-der Studies—REPORT—MOTION TO TAKE NOTE OF PAPER: Resumption of debate (from 12 November 2002—Mr Swan) on the motion of Mr Abbott—That the House take note of the paper.
76	Northern Land Council—REPORT—MOTION TO TAKE NOTE OF PAPER: Resumption of debate (from 12 November 2002—Mr Swan) on the motion of Mr Abbott—That the House take note of the paper.
77	Department of the Environ-ment and Heritage—REPORT—MOTION TO TAKE NOTE OF PAPER: Resumption of debate (from 12 November 2002—Mr Swan) on the motion of Mr Abbott—That the House take note of the paper.
78	Bureau of Meteorology—REPORT—MOTION TO TAKE NOTE OF PAPER: Resumption of debate (from 12 November 2002—Mr Swan) on the motion of Mr Abbott—That the House take note of the paper.
79	Industrial Relations Court of Australia—REPORT—MOTION TO TAKE NOTE OF PAPER: Resumption of debate (from 12 November 2002—Mr Swan) on the motion of Mr Abbott—That the House take note of the paper.
80	National Standards Com-mis-sion—REPORT—MOTION TO TAKE NOTE OF PAPER: Resumption of debate (from 12 November 2002—Mr Swan) on the motion of Mr Abbott—That the House take note of the paper.
81	Equal Opportunity for Women in the Workplace Agency—RE-PORT—MOTION TO TAKE NOTE OF PAPER: Resumption of debate (from 12 November 2002—Mr Swan) on the motion of Mr Abbott—That the House take note of the paper.
83	Private Health Insurance Administration Council—RE-PORT—MOTION TO TAKE NOTE OF PAPER: Resumption of debate (from 12 November 2002—Mr Swan) on the motion of Mr Abbott—That the House take note of the paper.
84	Australian Government Sol-ici-tor—REPORT—MOTION TO TAKE NOTE OF PAPER: Resumption of debate (from 12 November 2002—Mr Swan) on the motion of Mr Abbott—That the House take note of the paper.
85	Attorney-General's Depart-ment—REPORT—MOTION TO TAKE NOTE OF PAPER: Resumption of debate (from 12 November 2002—Mr Swan) on the motion of Mr Abbott—That the House take note of the paper.
86	Indigenous Business Aust-ralia—REPORT—MOTION TO TAKE NOTE OF PAPER: Resumption of debate (from 12 November 2002—Mr Swan) on the motion of Mr Abbott—That the House take note of the paper.
87	Australian Dairy Corpora-tion—REPORT—MOTION TO TAKE NOTE OF PAPER: Resumption of debate (from 12 November 2002—Mr Swan) on the motion of Mr Abbott—That the House take note of the paper.
88	Veterans' Review Board—REPORT—MOTION TO TAKE NOTE OF PAPER: Resumption of debate (from 12 November 2002—Mr Swan) on the motion of Mr Abbott—That the House take note of the paper.
89	Australian Heritage Commis-sion—REPORT—MOTION TO TAKE NOTE OF PAPER: Resumption of debate (from 12 November 2002—Mr Swan) on the motion of Mr Abbott—That the House take note of the paper.
90	Sydney Harbour Federation Trust—REPORT—MOTION TO TAKE NOTE OF PAPER: Resumption of debate (from 12 November 2002—Mr Swan) on the motion of Mr Abbott—That the House take note of the paper.
91	Professional Services Review —REPORT—MOTION TO TAKE NOTE OF PAPER: Resumption of debate (from 12 November 2002—Mr Swan) on the motion of Mr Abbott—That the House take note of the paper. 
92	Federal Police Disciplinary Tribunal—REPORT—MOTION TO TAKE NOTE OF PAPER: Resumption of debate (from 12 November 2002—Mr Swan) on the motion of Mr Abbott—That the House take note of the paper.
93	Department of Employment and Workplace Relations—REPORT—MOTION TO TAKE NOTE OF PAPER: Resumption of debate (from 12 November 2002—Mr Swan) on the motion of Mr Abbott—That the House take note of the paper.
94	Australia New Zealand Food Authority—REPORT—MOTION TO TAKE NOTE OF PAPER: Resumption of debate (from 12 November 2002—Mr Swan) on the motion of Mr Abbott—That the House take note of the paper.
95	Australia Business Arts Foun-dation Ltd—REPORT—MOTION TO TAKE NOTE OF PAPER: Resumption of debate (from 12 November 2002—Mr Swan) on the motion of Mr Abbott—That the House take note of the paper.
96	National Oceans Office—REPORT—MOTION TO TAKE NOTE OF PAPER: Resumption of debate (from 12 November 2002—Mr Swan) on the motion of Mr Abbott—That the House take note of the paper.
97	Refugee Review Tribunal—REPORT—MOTION TO TAKE NOTE OF PAPER: Resumption of debate (from 12 November 2002—Mr Swan) on the motion of Mr Abbott—That the House take note of the paper.
98	Department of Health and Ageing—REPORT—MOTION TO TAKE NOTE OF PAPER: Resumption of debate (from 12 November 2002—Mr Swan) on the motion of Mr Abbott—That the House take note of the paper.
99	Department of Industry, Tourism and Resources—REPORT—MOTION TO TAKE NOTE OF PAPER: Resumption of debate (from 12 November 2002—Mr Swan) on the motion of Mr Abbott—That the House take note of the paper.
100	AUSTRALIAN PUBLIC SERVICE COMMISSION—Workplace Diversity Report—MOTION TO TAKE NOTE OF PAPER: Resumption of debate (from 12 November 2002—Mr Swan) on the motion of Mr Abbott—That the House take note of the paper.
101	AUSTRALIAN PUBLIC SERVICE COM-MISSION—state of the service REPORT—MOTION TO TAKE NOTE OF PAPER: Resumption of debate (from 12 November 2002—Mr Swan) on the motion of Mr Abbott—That the House take note of the paper.
102	Department of the Treasury—REPORT—MOTION TO TAKE NOTE OF PAPER: Resumption of debate (from 12 November 2002—Mr Swan) on the motion of Mr Abbott—That the House take note of the paper.
103	Family Law Council—REPORT—MOTION TO TAKE NOTE OF PAPER: Resumption of debate (from 12 November 2002—Mr Swan) on the motion of Mr Abbott—That the House take note of the paper.
104	Department of Defence—REPORT—MOTION TO TAKE NOTE OF PAPER: Resumption of debate (from 12 November 2002—Mr Swan) on the motion of Mr Abbott—That the House take note of the paper.
105	Private Health Insurance Om-budsman—REPORT—MOTION TO TAKE NOTE OF PAPER: Resumption of debate (from 12 November 2002—Mr Swan) on the motion of Mr Abbott—That the House take note of the paper.
106	National Capital Authority—REPORT—MOTION TO TAKE NOTE OF PAPER: Resumption of debate (from 12 November 2002—Mr Swan) on the motion of Mr Abbott—That the House take note of the paper.
107	Australian Submarine Cor-por-ation—REPORT—MOTION TO TAKE NOTE OF PAPER: Resumption of debate (from 12 November 2002—Mr Swan) on the motion of Mr Abbott—That the House take note of the paper.
108	Employment National Limi-ted—REPORT—MOTION TO TAKE NOTE OF PAPER: Resumption of debate (from 12 November 2002—Mr Swan) on the motion of Mr Abbott—That the House take note of the paper.
109	Department of Immigration and Multicultural and Indigen-ous Affairs—REPORT—MOTION TO TAKE NOTE OF PAPER: Resumption of debate (from 12 November 2002—Mr Swan) on the motion of Mr Abbott—That the House take note of the paper. 
110	Aboriginal and Torres Strait Islander Commission—REPORT —MOTION TO TAKE NOTE OF PAPER: Resumption of debate (from 12 November 2002—Mr Swan) on the motion of Mr Abbott—That the House take note of the paper.
111	Australian Tourist Com-mission—REPORT—MOTION TO TAKE NOTE OF PAPER: Resumption of debate (from 12 November 2002—Mr Swan) on the motion of Mr Abbott—That the House take note of the paper.
112	Department of Finance and Administration—REPORT—MOTION TO TAKE NOTE OF PAPER: Resumption of debate (from 12 November 2002—Mr Swan) on the motion of Mr Abbott—That the House take note of the paper.
113	Corporations and Markets Advisory Committee—REPORT —MOTION TO TAKE NOTE OF PAPER: Resumption of debate (from 12 November 2002—Mr Swan) on the motion of Mr Abbott—That the House take note of the paper.
114	Financial Reporting Council and Australian Accounting Standards Board—REPORTs—MOTION TO TAKE NOTE OF PAPER: Resumption of debate (from 12 November 2002—Mr Swan) on the motion of Mr Abbott—That the House take note of the paper.
115	Australian Office of Finan-cial Management—REPORT—MOTION TO TAKE NOTE OF PAPER: Resumption of debate (from 12 November 2002—Mr Swan) on the motion of Mr Abbott—That the House take note of the paper.
117	Commissioner of Taxation—REPORT—MOTION TO TAKE NOTE OF PAPER: Resumption of debate (from 12 November 2002—Mr Swan) on the motion of Mr Abbott—That the House take note of the paper.
118	Airservices Australia—REPORT—MOTION TO TAKE NOTE OF PAPER: Resumption of debate (from 12 November 2002—Mr Swan) on the motion of Mr Abbott—That the House take note of the paper.
119	Housing Assistance Act 1996—REPORT—MOTION TO TAKE NOTE OF PAPER: Resumption of debate (from 12 November 2002—Mr Swan) on the motion of Mr Abbott—That the House take note of the paper.
120	Alcohol Education and Re-habilitation Foundation Ltd—REPORT—MOTION TO TAKE NOTE OF PAPER: Resumption of debate (from 12 November 2002—Mr Swan) on the motion of Mr Abbott—That the House take note of the paper.
121	Commonwealth Super-annu-ation Scheme Board—REPORT—MOTION TO TAKE NOTE OF PAPER: Resumption of debate (from 12 November 2002—Mr Swan) on the motion of Mr Abbott—That the House take note of the paper.
122	Public Sector Superannuation Scheme Board—REPORT—MOTION TO TAKE NOTE OF PAPER: Resumption of debate (from 12 November 2002—Mr Swan) on the motion of Mr Abbott—That the House take note of the paper.
123	High Court of Australia—REPORT—MOTION TO TAKE NOTE OF PAPER: Resumption of debate (from 12 November 2002—Mr Swan) on the motion of Mr Abbott—That the House take note of the paper.
124	Federal Court of Australia—REPORT—MOTION TO TAKE NOTE OF PAPER: Resumption of debate (from 12 November 2002—Mr Swan) on the motion of Mr Abbott—That the House take note of the paper.
125	Federal Magistrates Service —REPORT—MOTION TO TAKE NOTE OF PAPER: Resumption of debate (from 12 November 2002—Mr Swan) on the motion of Mr Abbott—That the House take note of the paper.
126	Australian Sports Drug Agency—REPORT—MOTION TO TAKE NOTE OF PAPER: Resumption of debate (from 12 November 2002—Mr Swan) on the motion of Mr Abbott—That the House take note of the paper.
127	Army and Air Force Canteen Service Board of Manage-ment—REPORT—MOTION TO TAKE NOTE OF PAPER: Resumption of debate (from 12 November 2002—Mr Swan) on the motion of Mr Abbott—That the House take note of the paper. 
128	Services Trust Funds—REPORTs —MOTION TO TAKE NOTE OF PAPER: Resumption of debate (from 12 November 2002—Mr Swan) on the motion of Mr Abbott—That the House take note of the paper.
129	Royal Australian Air Force Veterans' Residences Trust Fund—REPORT—MOTION TO TAKE NOTE OF PAPER: Resumption of debate (from 12 November 2002—Mr Swan) on the motion of Mr Abbott—That the House take note of the paper.
130	Defence Force Retirement and Death Benefits Scheme—REPORT—MOTION TO TAKE NOTE OF PAPER: Resumption of debate (from 12 November 2002—Mr Swan) on the motion of Mr Abbott—That the House take note of the paper.
131	Military Superannuation and Bene-fits Scheme—REPORT—MOTION TO TAKE NOTE OF PAPER: Resumption of debate (from 12 November 2002—Mr Swan) on the motion of Mr Abbott—That the House take note of the paper.
132	Wet Tropics Management Auth-ority—REPORT—MOTION TO TAKE NOTE OF PAPER: Resumption of debate (from 12 November 2002—Mr Swan) on the motion of Mr Abbott—That the House take note of the paper.
133	Director of National Parks—REPORT—MOTION TO TAKE NOTE OF PAPER: Resumption of debate (from 12 November 2002—Mr Swan) on the motion of Mr Abbott—That the House take note of the paper.
134	Office of Film and Literature Classification Board and Classification Review Board—REPORT—MOTION TO TAKE NOTE OF PAPER: Resumption of debate (from 12 November 2002—Mr Swan) on the motion of Mr Abbott—That the House take note of the paper.
135	Australian Federal Police—REPORT—MOTION TO TAKE NOTE OF PAPER: Resumption of debate (from 12 November 2002—Mr Swan) on the motion of Mr Abbott—That the House take note of the paper.
136	AUSTRALIAN FEDERAL POLICE—REPORT on Assumed Iden-tities—MOTION TO TAKE NOTE OF PAPER: Resumption of debate (from 12 November 2002—Mr Swan) on the mot-ion of Mr Abbott—That the House take note of the paper.
137	Australian Statistics Advis-ory Council—REPORT—MOTION TO TAKE NOTE OF PAPER: Resumption of debate (from 12 November 2002—Mr Swan) on the motion of Mr Abbott—That the House take note of the paper.
138	Commissioner for Super-annuation—REPORT—MOTION TO TAKE NOTE OF PAPER: Resumption of debate (from 12 November 2002—Mr Swan) on the motion of Mr Abbott—That the House take note of the paper.
139	Gene Technology Regula-tor—quarteRly REPORT for 1 January to 30 March 2002—MOTION TO TAKE NOTE OF PAPER: Resumption of debate (from 12 November 2002—Mr Swan) on the motion of Mr Abbott—That the House take note of the paper.
140	Gene Technology Regula-tor—quarterly REPORT for 1 April to 30 June 2002—MOTION TO TAKE NOTE OF PAPER: Resumption of debate (from 12 November 2002—Mr Swan) on the motion of Mr Abbott—That the House take note of the paper.
141	Health Insurance Commis-sion—REPORT—MOTION TO TAKE NOTE OF PAPER: Resumption of debate (from 12 November 2002—Mr Swan) on the motion of Mr Abbott—That the House take note of the paper.
142	Australia Indonesia Instit-ute—REPORT—MOTION TO TAKE NOTE OF PAPER: Resumption of debate (from 12 November 2002—Mr Swan) on the motion of Mr Abbott—That the House take note of the paper.
143	treaty tabled on 12 november 2002—paper—MOTION TO TAKE NOTE OF PAPER: Resumption of debate (from 12 November 2002—Mr Swan) on the motion of Mr Abbott—That the House take note of the paper.
144	HUMAN RIGHTS AND EQUAL OPPOR-TUNITY COMMISSION—REPORT—MOTION TO TAKE NOTE OF PAPER: Resumption of debate (from 23 October 2002—Mr Swan) on the motion of Mr Abbott—That the House take note of the paper. 
145	AUSTRALIAN INSTITUTE OF CRIM-INOLOGY AND CRIMINOLOGY RE-SEARCh COUNCIL—REPORT—MOTION TO TAKE NOTE OF PAPER: Resumption of debate (from 23 October 2002—Mr Swan) on the motion of Mr Abbott—That the House take note of the paper.
146	AUSTRALIAN LAW REFORM COM-MISSION—REPORT—MOTION TO TAKE NOTE OF PAPER: Resumption of debate (from 23 October 2002—Mr Swan) on the motion of Mr Abbott—That the House take note of the paper.
147	OFFICE OF PARLIAMENTARY COUN-SEL—REPORT—MOTION TO TAKE NOTE OF PAPER: Resumption of debate (from 23 October 2002—Mr Swan) on the motion of Mr Abbott—That the House take note of the paper.
148	FAMILY COURT OF AUSTRALIA—REPORT—MOTION TO TAKE NOTE OF PAPER: Resumption of debate (from 23 October 2002—Mr Swan) on the motion of Mr Abbott—That the House take note of the paper.
150	DEPARTMENT OF AGRICULTURE, FISH-ERIES AND FORESTRY—REPORT—MOTION TO TAKE NOTE OF PAPER: Resumption of debate (from 23 October 2002—Mr Swan) on the motion of Mr Abbott—That the House take note of the paper.
151	TOBACCO RESEARCH AND DEVELOPMENT CORPORATION—REPORT—MOTION TO TAKE NOTE OF PAPER: Resumption of debate (from 23 October 2002—Mr Swan) on the motion of Mr Abbott—That the House take note of the paper.
152	COTTON RESEARCH AND DEVELOPMENT CORPORATION—REPORT—MOTION TO TAKE NOTE OF PAPER: Resumption of debate (from 23 October 2002—Mr Swan) on the motion of Mr Abbott—That the House take note of the paper.
153	FOREST AND WOOD PRODUCTS RESEARCH AND DEVELOPMENT CORPORATION—REPORT—MOTION TO TAKE NOTE OF PAPER: Resumption of debate (from 23 October 2002—Mr Swan) on the motion of Mr Abbott—That the House take note of the paper.
154	NATIONAL MUSEUM OF AUST-RALIA—REPORT—MOTION TO TAKE NOTE OF PAPER: Resumption of debate (from 23 October 2002—Mr Swan) on the motion of Mr Abbott—That the House take note of the paper.
155	AUSTRALIAN NATIONAL MARITIME MUSEUM—REPORT—MOTION TO TAKE NOTE OF PAPER: Resumption of debate (from 23 October 2002—Mr Swan) on the motion of Mr Abbott—That the House take note of the paper.
156	NETALERT—REPORT—MOTION TO TAKE NOTE OF PAPER: Resumption of debate (from 23 October 2002—Mr Swan) on the motion of Mr Abbott—That the House take note of the paper.
157	TELSTRA—EQUAL EMPLOYMENT OPPORTUNITY REPORT—MOTION TO TAKE NOTE OF PAPER: Resumption of debate (from 23 October 2002—Mr Swan) on the motion of Mr Abbott—That the House take note of the paper.
158	SBS—REPORT—MOTION TO TAKE NOTE OF PAPER: Resumption of debate (from 23 October 2002—Mr Swan) on the motion of Mr Abbott—That the House take note of the paper.
159	AUSTRALIAN COMMUNICATIONS AUTHORITY—REPORT—MOTION TO TAKE NOTE OF PAPER: Resumption of debate (from 23 October 2002—Mr Swan) on the motion of Mr Abbott—That the House take note of the paper.
160	AUSTRALIAN BROADCASTING AUTHORITY—REPORT—MOTION TO TAKE NOTE OF PAPER: Resumption of debate (from 23 October 2002—Mr Swan) on the motion of Mr Abbott—That the House take note of the paper.
161	AUSTRALIAN BROADCASTING COR-PORATION—REPORT—MOTION TO TAKE NOTE OF PAPER: Resumption of debate (from 23 October 2002—Mr Swan) on the motion of Mr Abbott—That the House take note of the paper.
162	AUSTRALIA POST—REPORT—MOTION TO TAKE NOTE OF PAPER: Resumption of debate (from 23 October 2002—Mr Swan) on the motion of Mr Abbott—That the House take note of the paper.
163	NATIONAL OFFICE FOR THE INFORMATION ECONOMY—REPORT—MOTION TO TAKE NOTE OF PAPER: Resumption of debate (from 23 October 2002—Mr Swan) on the motion of Mr Abbott—That the House take note of the paper. 
164	AUSTRALIAN NATIONAL TRAINING AUTHORITY—REPORT—MOTION TO TAKE NOTE OF PAPER: Resumption of debate (from 23 October 2002—Mr Swan) on the motion of Mr Abbott—That the House take note of the paper.
165	AUSTRALIAN VOCATIONAL EDUCA-TION AND TRAINING SYSTEM—REPORT—VOLUMES 1 AND 2—MOTION TO TAKE NOTE OF PAPER: Resumption of debate (from 23 October 2002—Mr Swan) on the motion of Mr Abbott—That the House take note of the paper.
166	AUSTRALIAN VOCATIONAL EDUCA-TION AND TRAINING SYSTEM—REPORT—VOLUME 3—MOTION TO TAKE NOTE OF PAPER: Resumption of debate (from 23 October 2002—Mr Swan) on the motion of Mr Abbott—That the House take note of the paper.
167	AUSTRALIAN INSTITUTE OF MARINE SCIENCE—REPORT—MOTION TO TAKE NOTE OF PAPER: Resumption of debate (from 23 October 2002—Mr Swan) on the motion of Mr Abbott—That the House take note of the paper.
168	AUSTRALIAN NUCLEAR SCIENCE AND TECHNOLOGY ORGANISA-TION—REPORT—MOTION TO TAKE NOTE OF PAPER: Resumption of debate (from 23 October 2002—Mr Swan) on the motion of Mr Abbott—That the House take note of the paper.
169	AUSTRALIAN RESEARCH COUNCIL —REPORT—MOTION TO TAKE NOTE OF PAPER: Resumption of debate (from 23 October 2002—Mr Swan) on the motion of Mr Abbott—That the House take note of the paper.
170	SEAFARERS SAFETY, REHABILITA-TION AND COMPENSATION AUTH-OR-ITY—REPORT—MOTION TO TAKE NOTE OF PAPER: Resumption of debate (from 23 October 2002—Mr Swan) on the motion of Mr Abbott—That the House take note of the paper.
171	NATIONAL OCCUPATIONAL HEALTH AND SAFETY COM-MISS-ION—REPORT—MOTION TO TAKE NOTE OF PAPER: Resumption of debate (from 23 October 2002—Mr Swan) on the motion of Mr Abbott—That the House take note of the paper.
175	ComLand Limited—REPORT—MOTION TO TAKE NOTE OF PAPER: Resumption of debate (from 23 October 2002—Mr Swan) on the motion of Mr Abbott—That the House take note of the paper.
176	Department of Foreign Affairs and Trade—REPORT—volume 1—MOTION TO TAKE NOTE OF PAPER: Resumption of debate (from 23 October 2002—Mr Swan) on the motion of Mr Abbott—That the House take note of the paper.
177	Department of Foreign Affairs and Trade—REPORT—volume 2—MOTION TO TAKE NOTE OF PAPER: Resumption of debate (from 23 October 2002—Mr Swan) on the motion of Mr Abbott—That the House take note of the paper.
178	Commissioner for Com-plaints—REPORT—MOTION TO TAKE NOTE OF PAPER: Resumption of debate (from 23 October 2002—Mr Swan) on the motion of Mr Abbott—That the House take note of the paper.
179	Aged Care Standards and Accreditation Agency Ltd—REPORT—MOTION TO TAKE NOTE OF PAPER: Resumption of debate (from 23 October 2002—Mr Swan) on the motion of Mr Abbott—That the House take note of the paper.
180	National Industrial Chemi-cals Notification and Assessment Scheme—REPORT—MOTION TO TAKE NOTE OF PAPER: Resumption of debate (from 23 October 2002—Mr Swan) on the motion of Mr Abbott—That the House take note of the paper.
181	Great Barrier Reef Marine Park Authority—REPORT—MOTION TO TAKE NOTE OF PAPER: Resumption of debate (from 23 October 2002—Mr Swan) on the motion of Mr Abbott—That the House take note of the paper.
182	Australian Competition and Consumer Commission—REPORT—MOTION TO TAKE NOTE OF PAPER: Resumption of debate (from 23 October 2002—Mr Swan) on the motion of Mr Abbott—That the House take note of the paper.
183	National Competition Council —REPORT—MOTION TO TAKE NOTE OF PAPER: Resumption of debate (from 23 October 2002—Mr Swan) on the motion of Mr Abbott—That the House take note of the paper. 
184	Albury-Wodonga Development Corporation—REPORT—MOTION TO TAKE NOTE OF PAPER: Resumption of debate (from 23 October 2002—Mr Swan) on the motion of Mr Abbott—That the House take note of the paper.
185	Maritime Industry Finance Com-pany Limited—REPORT—MOTION TO TAKE NOTE OF PAPER: Resumption of debate (from 23 October 2002—Mr Swan) on the motion of Mr Abbott—That the House take note of the paper.
186	National Road Transport Commission—REPORT—MOTION TO TAKE NOTE OF PAPER: Resumption of debate (from 23 October 2002—Mr Swan) on the motion of Mr Abbott—That the House take note of the paper.
187	Stevedoring Industry Finance Committee—REPORT—MOTION TO TAKE NOTE OF PAPER: Resumption of debate (from 23 October 2002—Mr Swan) on the motion of Mr Abbott—That the House take note of the paper.
188	Australian Maritime Safety Authority—REPORT—MOTION TO TAKE NOTE OF PAPER: Resumption of debate (from 23 October 2002—Mr Swan) on the motion of Mr Abbott—That the House take note of the paper.
189	Repatriation Commission and Department of Veterans' Affairs and National Treat-ment Monitoring Committee—REPORTS—MOTION TO TAKE NOTE OF PAPER: Resumption of debate (from 23 October 2002—Mr Swan) on the motion of Mr Abbott—That the House take note of the paper.
190	Department of Veterans' Affairs—Data-Matching Pro-gram—REPORT—MOTION TO TAKE NOTE OF PAPER: Resumption of debate (from 23 October 2002—Mr Swan) on the motion of Mr Abbott—That the House take note of the paper.
191	Aboriginal Hostels Limited—REPORT—MOTION TO TAKE NOTE OF PAPER: Resumption of debate (from 23 October 2002—Mr Swan) on the motion of Mr Abbott—That the House take note of the paper.
192	Australian Hearing—REPORT—MOTION TO TAKE NOTE OF PAPER: Resumption of debate (from 23 October 2002—Mr Swan) on the motion of Mr Abbott—That the House take note of the paper.
193	Australian Institute of Fam-ily Studies—REPORT—MOTION TO TAKE NOTE OF PAPER: Resumption of debate (from 23 October 2002—Mr Swan) on the motion of Mr Abbott—That the House take note of the paper.
194	Australian Institute of Health and Welfare—REPORT —MOTION TO TAKE NOTE OF PAPER: Resumption of debate (from 23 October 2002—Mr Swan) on the motion of Mr Abbott—That the House take note of the paper.
195	Australian Prudential Regu-la-tion Authority—REPORT—MOTION TO TAKE NOTE OF PAPER: Resumption of debate (from 23 October 2002—Mr Swan) on the motion of Mr Abbott—That the House take note of the paper.
196	Australian War Memorial—REPORT—MOTION TO TAKE NOTE OF PAPER: Resumption of debate (from 23 October 2002—Mr Swan) on the motion of Mr Abbott—That the House take note of the paper.
197	Commonwealth Director of Public Prosecutions—REPORT —MOTION TO TAKE NOTE OF PAPER: Resumption of debate (from 23 October 2002—Mr Swan) on the motion of Mr Abbott—That the House take note of the paper.
198	Migration Review Tribunal—REPORT—MOTION TO TAKE NOTE OF PAPER: Resumption of debate (from 23 October 2002—Mr Swan) on the motion of Mr Abbott—That the House take note of the paper.
190	Public Service Commission—REPORT—MOTION TO TAKE NOTE OF PAPER: Resumption of debate (from 23 October 2002—Mr Swan) on the motion of Mr Abbott—That the House take note of the paper.
200	Health Insurance Commiss-ion—Equity and Diversity Report—MOTION TO TAKE NOTE OF PAPER: Resumption of debate (from 23 October 2002—Mr Swan) on the motion of Mr Abbott—That the House take note of the paper.
201	HUMAN RIGHTS AND EQUAL OP-POR-TUNITY COMMISSION—RE-PORT ON VISITS TO IMMIGRATION DETEN-TION CENTRES—MOTION TO TAKE NOTE OF PAPER: Resumption of debate (from 22 October 2002—Mr Swan) on the motion of Mr Abbott—That the House take note of the paper. 
202	AUSTRAC—REPORT—MOTION TO TAKE NOTE OF PAPER: Resumption of debate (from 22 October 2002—Mr Swan) on the motion of Mr Abbott—That the House take note of the paper.
203	CRIMTRAC—REPORT—MOTION TO TAKE NOTE OF PAPER: Resumption of debate (from 22 October 2002—Mr Swan) on the motion of Mr Abbott—That the House take note of the paper.
204	LAND AND WATER AUSTRALIA—REPORT—MOTION TO TAKE NOTE OF PAPER: Resumption of debate (from 22 October 2002—Mr Swan) on the motion of Mr Abbott—That the House take note of the paper.
205	AUSTRALIAN FISHERIES MANAGE-MENT AUTHORITY—REPORT—MOTION TO TAKE NOTE OF PAPER: Resumption of debate (from 22 October 2002—Mr Swan) on the motion of Mr Abbott—That the House take note of the paper.
206	DEFENCE HOUSING AUTHORITY—REPORT—MOTION TO TAKE NOTE OF PAPER: Resumption of debate (from 22 October 2002—Mr Swan) on the motion of Mr Abbott—That the House take note of the paper.
207	EXPORT FINANCE AND INSURANCE CORPORATION—REPORT—MOTION TO TAKE NOTE OF PAPER: Resumption of debate (from 22 October 2002—Mr Swan) on the motion of Mr Abbott—That the House take note of the paper.
208	AUSTRADE—REPORT—MOTION TO TAKE NOTE OF PAPER: Resumption of debate (from 22 October 2002—Mr Swan) on the motion of Mr Abbott—That the House take note of the paper.
209	AUSTRALIAN SAFEGUARDS AND NON-PROLIFERATION OFFICE—REPORT—MOTION TO TAKE NOTE OF PAPER: Resumption of debate (from 22 October 2002—Mr Swan) on the motion of Mr Abbott—That the House take note of the paper.
210	AUSTRALIAN INDUSTRIAL RELA-TIONS COMMISSION AND AUST-RALIAN INDUSTRIAL REGISTRY—REPORTS—MOTION TO TAKE NOTE OF PAPER: Resumption of debate (from 22 October 2002—Mr Swan) on the motion of Mr Abbott—That the House take note of the paper.
211	AUSTRALIAN STRATEGIC POLICY INSTITUTE—REPORT—MOTION TO TAKE NOTE OF PAPER: Resumption of debate (from 22 October 2002—Mr Swan) on the motion of Mr Abbott—That the House take note of the paper.
212	AUSTRALIAN GREENHOUSE OFFICE—REPORT—MOTION TO TAKE NOTE OF PAPER: Resumption of debate (from 22 October 2002—Mr Swan) on the motion of Mr Abbott—That the House take note of the paper.
214	FILM FINANCE CORPORATION AUSTRALIA LIMITED—REPORT—MOTION TO TAKE NOTE OF PAPER: Resumption of debate (from 17 October 2002—Mr Swan) on the motion of Mr Abbott—That the House take note of the paper.
215	INTERNATIONAL AIR SERVICES COMMISSION—REPORT—MOTION TO TAKE NOTE OF PAPER: Resumption of debate (from 17 October 2002—Mr Swan) on the motion of Mr Abbott—That the House take note of the paper.
216	AUSTRALIAN CUSTOMS SERVICE—REPORT—MOTION TO TAKE NOTE OF PAPER: Resumption of debate (from 16 October 2002—Mr Swan) on the motion of Mr Abbott—That the House take note of the paper.
217	AUSTRALIA POST—PAPER—MOTION TO TAKE NOTE OF PAPER: Resumption of debate (from 16 October 2002—Mr Swan) on the motion of Mr Abbott—That the House take note of the paper.
218	TELSTRA—REPORT—MOTION TO TAKE NOTE OF PAPER: Resumption of debate (from 16 October 2002—Mr Swan) on the motion of Mr Abbott—That the House take note of the paper.
219	DEFENCE FORCE REMUNERATION TRIBUNAL—REPORT—MOTION TO TAKE NOTE OF PAPER: Resumption of debate (from 16 October 2002—Mr Swan) on the motion of Mr Abbott—That the House take note of the paper.
220	AUSTRALIAN INDUSTRY DE-VELOP-MENT CORPORATION—REPORT—MOTION TO TAKE NOTE OF PAPER: Resumption of debate (from 16 October 2002—Mr Swan) on the motion of Mr Abbott—That the House take note of the paper. 
221	MEDICAL TRAINING REVIEW PANEL—REPORT—MOTION TO TAKE NOTE OF PAPER: Resumption of debate (from 16 October 2002—Mr Swan) on the motion of Mr Abbott—That the House take note of the paper.
222	JOINT COAL BOARD—REPORT—MOTION TO TAKE NOTE OF PAPER: Resumption of debate (from 16 October 2002—Mr Swan) on the motion of Mr Abbott—That the House take note of the paper.
223	DEPARTMENT OF TRANSPORT AND REGIONAL SERVICES—REPORT—MOTION TO TAKE NOTE OF PAPER: Resumption of debate (from 16 October 2002—Mr Swan) on the motion of Mr Abbott—That the House take note of the paper.
224	ROYAL AUSTRALIAN MINT—REPORT—MOTION TO TAKE NOTE OF PAPER: Resumption of debate (from 16 October 2002—Mr Swan) on the motion of Mr Abbott—That the House take note of the paper.
225	FINAL BUDGET OUTCOME 2001-02—PAPER—MOTION TO TAKE NOTE OF PAPER: Resumption of debate (from 16 October 2002—Mr Swan) on the motion of Mr Abbott—That the House take note of the paper.
226	REPATRIATION MEDICAL AUTHORITY—REPORT—MOTION TO TAKE NOTE OF PAPER: Resumption of debate (from 16 October 2002—Mr Swan) on the motion of Mr Abbott—That the House take note of the paper.
227	RESERVE BANK OF AUSTRALIA—PAPER—MOTION TO TAKE NOTE OF PAPER: Resumption of debate (from 16 October 2002—Mr Swan) on the motion of Mr Abbott—That the House take note of the paper.
228	MEDIBANK PRIVATE—REPORT—MOTION TO TAKE NOTE OF PAPER: Resumption of debate (from 15 October 2002—Mr Swan) on the motion of Mr Abbott—That the House take note of the paper.
229	AUSTRALIAN BUREAU OF STATISTICS—REPORT—MOTION TO TAKE NOTE OF PAPER: Resumption of debate (from 15 October 2002—Mr Swan) on the motion of Mr Abbott—That the House take note of the paper.
230	PUBLIC LENDING RIGHT COMMITTEE—REPORT—MOTION TO TAKE NOTE OF PAPER: Resumption of debate (from 15 October 2002—Mr Swan) on the motion of Mr Abbott—That the House take note of the paper.
231	ABORIGINALS BENEFIT ACCOUNT —REPORT—MOTION TO TAKE NOTE OF PAPER: Resumption of debate (from 15 October 2002—Mr Swan) on the motion of Mr Abbott—That the House take note of the paper.
232	TORRES STRAIT REGIONAL AUTH-ORITY—REPORT—MOTION TO TAKE NOTE OF PAPER: Resumption of debate (from 15 October 2002—Mr Swan) on the motion of Mr Abbott—That the House take note of the paper.
233	WITNESS PROTECTION ACT—REPORT ON OPERATIONS—MOTION TO TAKE NOTE OF PAPER: Re-sum-ption of debate (from 15 October 2002—Mr Swan) on the motion of Mr Abbott—That the House take note of the paper.
234	CRIMES ACT—REPORT ON CON-TROLLED OPERATIONS—MOTION TO TAKE NOTE OF PAPER: Resumption of debate (from 15 October 2002—Mr Swan) on the motion of Mr Abbott—That the House take note of the paper.
235	COMCARE—REPORT—MOTION TO TAKE NOTE OF PAPER: Resumption of debate (from 15 October 2002—Mr Swan) on the motion of Mr Abbott—That the House take note of the paper.
236	SAFETY, REHABILITATION AND COMPENSATION COMMISSION—REPORT—MOTION TO TAKE NOTE OF PAPER: Resumption of debate (from 15 October 2002—Mr Swan) on the motion of Mr Abbott—That the House take note of the paper.
237	AUSTRALIAN SECURITIES AND INVESTMENTS COMMISSION—REPORT—MOTION TO TAKE NOTE OF PAPER: Resumption of debate (from 15 October 2002—Mr Swan) on the motion of Mr Abbott—That the House take note of the paper.
238	Customs act—REPORT ON CONDUCT OF CUSTOMS OFFICERS —MOTION TO TAKE NOTE OF PAPER: Resumption of debate (from 15 October 2002—Mr Swan) on the motion of Mr Abbott—That the House take note of the paper. 
239	CRIMES ACT—REPORT ON AUTHORISATIONS FOR ACQUI-SITION AND USE OF aSSUMED IDENTITIES—MOTION TO TAKE NOTE OF PAPER: Resumption of debate (from 15 October 2002—Mr Swan) on the motion of Mr Abbott—That the House take note of the paper.
240	TREATIES TABLED ON 15 OCTOBER 2002—REPORT—MOTION TO TAKE NOTE OF PAPER: Resumption of debate (from 15 October 2002—Mr Swan) on the motion of Mr Abbott—That the House take note of the paper.
241	COUNCIL FOR ABORIGINAL REC-ON--CILIATION—REPORT—GOV-ERNMENT RESPONSE—MOTION TO TAKE NOTE OF PAPER: Resumption of debate (from 26 September 2002—Mr Swan) on the motion of Mr Abbott—That the House take note of the paper.
242	COUNCIL FOR ABORIGINAL REC-ON-CILIATION—PAPER—MOTION TO TAKE NOTE OF PAPER: Resumption of debate (from 26 September 2002—Mr Swan) on the motion of Mr Abbott—That the House take note of the paper.
243	PRIMARY INDUSTRIES AND REG-IONAL SERVICES—STANDING COM-MITTEE—REPORT ON BIOPROSPEC-TING—GOVERNMENT RESPONSE—MOTION TO TAKE NOTE OF PAPER: Resumption of debate (from 26 September 2002—Mr Swan) on the motion of Mr Abbott—That the House take note of the paper.
244	COMMONWEALTH GRANTS COM-MISSION—REPORT—MOTION TO TAKE NOTE OF PAPER: Resumption of debate (from 25 September 2002—Mr Swan) on the motion of Mr McGauran—That the House take note of the paper.
245	AUSTRALIAN RADIATION PROTEC-TION AND NUCLEAR SAFETY AGENCY—QUARTERLY REPORT—1 JANUARY-31 MARCH 2002—MOTION TO TAKE NOTE OF PAPER: Resumption of debate (from 25 September 2002—Mr Swan) on the motion of Mr McGauran—That the House take note of the paper.
246	AUSTRALIA-CHINA COUNCIL—REPORT—MOTION TO TAKE NOTE OF PAPER: Resumption of debate (from 25 September 2002—Mr Swan) on the motion of Mr McGauran—That the House take note of the paper.
247	OPERATION OF AGED CARE ACT—REPORT—MOTION TO TAKE NOTE OF PAPER: Resumption of debate (from 25 September 2002—Mr Swan) on the motion of Mr McGauran—That the House take note of the paper.
248	AUSTRALIA'S DEVELOPMENT CO-OPERATION PROGRAM—MINIS-TERIAL STATEMENT AND PAPER—MOTION TO TAKE NOTE OF PAPERs: Resumption of debate (from 24 September 2002—Mr Downer) on the motion of Mr Ruddock—That the House take note of the papers.
249	APEC—AUSTRALIA'S INDIVIDUAL ACTION PLAN 2002—PAPER—MOTION TO TAKE NOTE OF PAPER: Resumption of debate (from 24 September 2002—Mr Swan) on the motion of Mr McGauran—That the House take note of the paper.
250	IRAQ—MINISTERIAL STATEMENT AND PAPERS—MOTION TO TAKE NOTE OF PAPERS: Resumption of debate (from 19 September 2002—Mr Lloyd) on the motion of Mr Downer—That the House take note of the papers—And on the amendment moved thereto by Mr Andren, viz.—That all words after “That” be omitted with a view to substituting the following words: “while the House commends the Government for its strong condemnation of terrorists and their activities and its encouragement of Iraq's compliance with United Nations' resolutions, the House believes that Australian Defence Forces should not be involved in any action in Iraq that is not carried out under a United Nations' resolution”.
251	PRODUCTIVITY COMMISSION—RE-PORT ON INDEPENDENT REVIEW OF JOB NETWORK—MOTION TO TAKE NOTE OF PAPER: Resumption of debate (from 19 September 2002—Mr Swan) on the motion of Mr Abbott—That the House take note of the paper.
252	COMMUNICATION UNDER THE CONVENTION AGAINST TORTURE—PAPERS—MOTION TO TAKE NOTE OF PAPERS: Resumption of debate (from 19 September 2002—Mr Swan) on the motion of Mr Abbott—That the House take note of the papers. 
253	TREATIES—JOINT STANDING COM-MITTEE—REPORT 39—GOVERN-MENT RESPONSE—MOTION TO TAKE NOTE OF PAPER: Resumption of debate (from 19 September 2002—Mr Swan) on the motion of Mr Abbott—That the House take note of the paper.
254	PUBLIC ACCOUNTS AND AUDIT—JOINT COMMITTEE—REPORT ON AUDITOR-GENERAL'S ACT 1997—GOV-ERNMENT RESPONSE—MOTION TO TAKE NOTE OF PAPER: Resumption of debate (from 19 September 2002—Mr Swan) on the motion of Mr Abbott—That the House take note of the paper.
255	PUBLIC ACCOUNTS AND AUDIT—JOINT COMMITTEE—REPORT ON COASTWATCH—GOVERNMENT RESPONSE—MOTION TO TAKE NOTE OF PAPER: Resumption of debate (from 19 September 2002—Mr Swan) on the motion of Mr Abbott—That the House take note of the paper.
256	FOREIGN AFFAIRS, DEFENCE AND TRADE—JOINT STANDING COM-MITTEE—REPORT ON AUSTRALIA'S RELATIONS WITH THE MIDDLE EAST—GOVERNMENT RESPONSE—MOTION TO TAKE NOTE OF PAPER: Resumption of debate (from 19 September 2002—Mr Swan) on the motion of Mr Abbott—That the House take note of the paper.
257	AUSTRALIAN LAND TRANSPORT DEVELOPMENT PROGRAM—REPORT—MOTION TO TAKE NOTE OF PAPER: Resumption of debate (from 18 September 2002—Mr Swan) on the motion of Mr Abbott—That the House take note of the paper.
258	ABORIGINAL LAND COMMISS-IONER—REPORT—MOTION TO TAKE NOTE OF PAPER: Resumption of debate (from 18 September 2002—Mr Swan) on the motion of Mr Abbott—That the House take note of the paper.
259	CARPENTARIA LAND COUNCIL ABORIGINAL CORPORATION—REPORT—MOTION TO TAKE NOTE OF PAPER: Resumption of debate (from 18 September 2002—Mr Swan) on the motion of Mr Abbott—That the House take note of the paper.
260	PRIVATE HEALTH INSURANCE—PREM-IUM INCREASES FOR QUARTER BEGINNING 1 APRIL 2002 —REPORT—MOTION TO TAKE NOTE OF PAPER: Resumption of debate (from 18 September 2002—Mr Swan) on the motion of Mr Abbott—That the House take note of the paper.
261	ADVANCE TO THE MINISTER FOR FINANCE—JUNE 2002—PAPER—MOTION TO TAKE NOTE OF PAPER: Resumption of debate (from 18 September 2002—Mr Swan) on the motion of Mr Abbott—That the House take note of the paper.
262	ADVANCE TO THE MINISTER FOR FINANCE—SUPPORTING APPLICATIONS FOR FUNDS—JUNE 2002—PAPER—MOTION TO TAKE NOTE OF PAPER: Resumption of debate (from 18 September 2002—Mr Swan) on the motion of Mr Abbott—That the House take note of the paper.
263	ABORIGINAL AND TORRES STRAIT ISLANDERS AFFAIRS—STANDING COMMITTEE—REPORT ON URBAN DWELL-ING aBORIGINAL AND TORRES STRAIT ISLANDER PEOPLES—GOVERNMENT RESPONSE—MOTION TO TAKE NOTE OF PAPER: Resumption of debate (from 18 September 2002—Mr Swan) on the motion of Mr Abbott—That the House take note of the paper.
264	DEFENCE HOUSING AUTHORITY—STATEMENT OF CORPORATE INTENT 2002-2003—MOTION TO TAKE NOTE OF PAPER: Resumption of debate (from 17 September 2002—Mr Swan) on the motion of Mr Abbott—That the House take note of the paper.
265	PRODUCTIVITY COMMISSION—REPORT ON NATIONAL ACCESS REGIME—MOTION TO TAKE NOTE OF PAPER: Resumption of debate (from 17 September 2002—Mr Swan) on the motion of Mr Abbott—That the House take note of the paper.
266	OPERATION OF WAR CRIMES ACT—REPORT—MOTION TO TAKE NOTE OF PAPER: Resumption of debate (from 17 September 2002—Mr Swan) on the motion of Mr Abbott—That the House take note of the paper.
268	COMMONWEALTH GRANTS COM-MISS-ION—REPORT ON JERVIS BAY TERRITORY—MOTION TO TAKE NOTE OF PAPER: Resumption of debate (from 28 August 2002—Mr Swan) on the motion of Mr Abbott—That the House take note of the paper. 
269	RESERVE BANK OF AUSTRALIA —REPORT—MOTION TO TAKE NOTE OF PAPER: Resumption of debate (from 28 August 2002—Mr Swan) on the motion of Mr Abbott—That the House take note of the paper.
270	NATIONAL HEALTH AND MEDICAL RESEARCH COUNCIL —REPORT—MOTION TO TAKE NOTE OF PAPER: Resumption of debate (from 27 August 2002—Mr S. F. Smith) on the motion of Mr Abbott—That the House take note of the paper.
271	TREATIES TABLEd ON 27 AUGUST 2002—PAPERS—MOTION TO TAKE NOTE OF PAPERS: Resumption of debate (from 27 August 2002—Mr S. F. Smith) on the motion of Mr Abbott—That the House take note of the papers.
272	AUSTRALIA and the asian devel-opment bank—REPORT—MOTION TO TAKE NOTE OF PAPER: Resumption of debate (from 22 August 2002—Mr Swan) on the motion of Mr Abbott—That the House take note of the paper.
273	AUSTRALIA and the IMF—REPORT—MOTION TO TAKE NOTE OF PAPER: Resumption of debate (from 22 August 2002—Mr Swan) on the motion of Mr Abbott—That the House take note of the paper.
274	AUSTRALIA AND THE WORLD BANK—REPORT—MOTION TO TAKE NOTE OF PAPER: Resumption of debate (from 22 August 2002—Mr Swan) on the motion of Mr Abbott—That the House take note of the paper.
275	AUSTRALIAN RIVER CO. LTD—REPORT—MOTION TO TAKE NOTE OF PAPER: Resumption of debate (from 21 August 2002—Mr Swan) on the motion of Mr Abbott—That the House take note of the paper.
276	ONLINE CONTENT CO-REGU-LATORY SCHEME—REPORT FOR PERIOD JULY TO DECEMBER 2001—MOTION TO TAKE NOTE OF PAPER: Resumption of debate (from 21 August 2002—Mr Swan) on the motion of Mr Abbott—That the House take note of the paper.
277	ACCESS TO DEPARTMENTAL RESOURCES BY DR MICHAEL WOOLDRIDGE—REPORT—MOTION TO TAKE NOTE OF PAPER: Resumption of debate (from 20 August 2002—Mr Swan) on the motion of Mr Abbott—That the House take note of the paper.
278	ACCESS TO DEPARTMENTAL RE-SOURCES BY DR MICHAEL WOOLDRIDGE—ERRATUM—MOTION TO TAKE NOTE OF PAPER: Resumption of debate (from 20 August 2002—Mr Swan) on the motion of Mr Abbott—That the House take note of the paper.
279	INDIGENOUS BUSINESS AUST-RALIA—PAPER—MOTION TO TAKE NOTE OF PAPER: Resumption of debate (from 20 August 2002—Mr Swan) on the motion of Mr Abbott—That the House take note of the paper.
280	OFFICE OF THE RENEWABLE ENERGY REGULATOR—REPORT—MOTION TO TAKE NOTE OF PAPER: Resumption of debate (from 20 August 2002—Mr Swan) on the motion of Mr Abbott—That the House take note of the paper.
281	AuSTRALIAN LAND TRANSPORT DEVELOPMENT PROGRAM—REPORT—MOTION TO TAKE NOTE OF PAPER: Resumption of debate (from 20 August 2002—Mr Swan) on the motion of Mr Abbott—That the House take note of the paper.
282	REVIEW OF PRICES SURVEILLANCE ACT—REPORT—MOTION TO TAKE NOTE OF PAPER: Resumption of debate (from 20 August 2002—Mr Swan) on the motion of Mr Abbott—That the House take note of the paper.
283	REVIEW OF PRICES SURVEILLANCE ACT—REPORT—GOVERNMENT RESPONSE—MOTION TO TAKE NOTE OF PAPER: Resumption of debate (from 20 August 2002—Mr Swan) on the motion of Mr Abbott—That the House take note of the paper.
284	LEGAL AND CONSTITUTIONAL AFFAIRS—STANDING COMMITTEE —REPORT ON PROTECTION OF CON-FIDENTIAL PERSONAL AND COM-MERCIAL INFORMATION HELD BY THE COMMONWEALTH—GOV-ERNMENT RESPONSE—MOTION TO TAKE NOTE OF PAPER: Resumption of debate (from 20 August 2002—Mr Swan) on the motion of Mr Abbott—That the House take note of the paper. 
285	pharmaceutical benefits pricing authority—REPORT—MOTION TO TAKE NOTE OF PAPER: Resumption of debate (from 18 June 2002—Mr Swan) on the motion of Mr Abbott—That the House take note of the paper.
286	private health insurance—REPORT—MOTION TO TAKE NOTE OF PAPER: Resumption of debate (from 28 May 2002—Mr Swan) on the motion of Mr Abbott—That the House take note of the paper.
287	IIF INVESTMENTS PTY LIMITED, IIF (CM) INVESTMENTS PTY LIMITED, IIF BIOVENTURES PTY LIMITED, IIF FOUNDATION PTY LIMITED, IIF NEWPORT PTY LIMITED—REPORTS—MOTION TO TAKE NOTE OF PAPERs: Resumption of debate (from 15 May 2002—Mr Swan) on the motion of Mr Abbott—That the House take note of the papers.
288	AuSTRALIAN TECHNOLOGY GROUP LIMITED—Papers—MOTION TO TAKE NOTE OF PAPERS: Resumption of debate (from 15 May 2002—Mr Swan) on the motion of Mr Abbott—That the House take note of the papers.
289	Australia's trade—Paper—MOTION TO TAKE NOTE OF PAPER: Resumption of debate (from 14 May 2002—Mr Swan) on the motion of Fran Bailey—That the House take note of the paper.
290	aged care standards and accreditation agency—Report—MOTION TO TAKE NOTE OF PAPER: Resumption of debate (from 13 February 2002) on the motion of Mr Abbott—That the House take note of the paper.
291	operation of the aged care act 1997—Report—MOTION TO TAKE NOTE OF PAPER: Resumption of debate (from 13 February 2002) on the motion of Mr Abbott—That the House take note of the paper.
Question agreed to. 
Miss JACKIE KELLY (Lindsay—Parliamentary Secretary to the Prime Minister) (7.16 p.m.)—by leave—I move:
That Main Committee order of the day No. 3, government business, and order of the day No. 1, committee and delegation reports, and order of the day No. 1, private Members' business, be returned to the House. 
Question agreed to.
Miss JACKIE KELLY (Lindsay—Parliamentary Secretary to the Prime Minister) (7.17 p.m.)—by leave—I move:
That the following orders of the day returned to the House from the Main Committee in accordance with the resolution agreed to this day, be discharged:
GOVERNMENT BUSINESS
Terrorist Attacks in Bali—Paper—Motion to take note of paper: Resumption of debate (from 5 December 2002) on the motion of Mr Abbott—That the House take note of the paper.
COMMITTEE AND DELEGATION REPORTS
Education and Training—Standing Committee—Report on Education of Boys—Motion to take note of paper: Resumption of debate (from 14 November 2002—Mr Neville) on the motion of Mr Bartlett—That the House take note of the report.
PRIVATE MEMBERS' BUSINESS
Defence Force Personnel: Resumption of debate (from 26 September 2002) on the motion of Mr Hawker—That this House:
(1) recognises the significant contribution Australia's defence servicemen and women are making overseas in places including East Timor, the Persian Gulf and Afghanistan;
(2) praises the skills, dedication and professionalism of these fine young Australians;
(3) draws these matters to the attention of Parliament and all Australians; and
(4) acknowledges the success of the Armed Forces Parliamentary Programme in giving Members of Parliament a greater understanding and better appreciation of the commitment of our defence force personnel,
Question agreed to.",REPS,<title>BUSINESS</title>,<title>Withdrawal</title>,Business,44,1
