name,party,date,text,chamber,debate_title,subdebate_title,debate_type,debate_id,subdebate_id,type
"Bishop, Julie, MP",LP,2002-11-13,"—I rise to speak on the Australian Crime Commission Establishment Bill 2002. There is an old quotation: he who does not prevent a crime when he can, encourages it. The Howard government cannot be so charged, given the innovative and proactive approach it has adopted toward federal law enforcement in Australia. This commitment has included more effective federal policing, with priority accorded to the prevention of illicit drug importation, people smuggling, organised crime, terrorism, cybercrime, money laundering and fraud against the Commonwealth; as well as enhanced intelligence collection, analysis and sharing capabilities; uniform national firearms laws; crime prevention programs; and model uniform national criminal laws.
This commitment on the part of the Commonwealth is most appropriate considering that crime costs the Australian community between $18 billion and $20 billion annually, with the cost of drug offences alone estimated to be at about $2 billion. Such assessments are presently the subject of a House of Representatives committee inquiry, most ably chaired by the member for Mackellar. It is interesting that in the course of that inquiry the committee has been made well aware of the grave concerns about public safety and crime held by many members of the community. We have also had the opportunity to hear contrary evidence from people who maintain that public fear of crime is overstated and mistaken. Of these latter submissions, I am reminded of the words of the then Mayor of Washington DC, Marion Barry, who said, `Outside of the killings, Washington has one of the lowest crime rates in the country'.
The great majority of Australians recognise that crime is a priority for governments, federal and state. But if Commonwealth law enforcement is to have real teeth then important structural changes need to be implemented. This is not simply the opinion of the federal government but a unanimous opinion of Australia's state and territory leaders. During last year's election campaign, the Prime Minister called for a comprehensive re-evaluation of the National Crime Authority, the NCA. Such a re-evaluation was all the more important in the wake of the September 11 terrorist attacks and the expanded role expected of Australian police in dealing with terrorism.
In order to facilitate a national and genuinely federal framework for law enforcement, a summit was convened in April of Commonwealth, state and territory leaders. The communiqué produced by the participants at that summit stipulated 23 different initiatives. Included amongst those 23 initiatives—initiatives that were agreed to unanimously—was the establishment of the Australian Crime Commission, the ACC. It is anticipated that the ACC will replace the NCA, a body which has been tasked with countering serious and organised crime over the past eighteen years. The ACC will be better placed to achieve that objective given the anticipated structural reforms. Such reforms include the incorporation of other law enforcement bodies: the Office of Strategic Crime Assessments, the OSCA; and the Australian Bureau of Criminal Investigation, the ABCI.
By way of background, the OSCA, which is a component of the Criminal Justice Division of the Attorney-General's Department, was established seven years ago. Its duty has been to undertake strategic research into crime trends and threats that might arise in the medium to long term—that is, within five years. The ABCI was established by way of federal-state cooperation in 1981. The bureau facilitates the exchange of information between police services and other law enforcement agencies through analysis, information technology, policy and training, as well as the maintenance of the Australian Criminal Intelligence Database. It is intended that the new ACC, combining the NCA, OSCA and ABCI, will be characterised by improved criminal intelligence collection and analysis, clearer national criminal intelligence priorities and intelligence led investigations of nationalised crime. In this regard, the ACC will improve upon the crime-fighting capabilities of the component parts. A board consisting of 13 voting members and a non-voting Chief Executive Officer will govern the ACC and determine its policy and direction. The CEO will be responsible for day-to-day agency management. 
The chairman of the ACC board will be the Australian Federal Police commissioner, and the other board members will be the eight state and territory police commissioners, the federal director of security, the chair of the Australian Securities and Investments Commission, the head of the Australian Customs Service and the secretary to the Commonwealth Attorney-General's Department. In addition to the board, the reforms will retain the intergovernmental committee that governed the NCA. That committee will be renamed the Intergovernmental Committee of the Australian Crime Commission and will provide a monitoring and oversight function for the ACC. So too the Joint Statutory Committee on the NCA, which will as a consequence of these reforms become the Joint Statutory Committee on the ACC. In terms of staffing and resources, the ACC will initially maintain the NCA-OSCA-ABCI arrangements with a view to moulding the staffing structure to meet operational requirements that will include an in-house investigative capacity. The commission will be headquartered in Canberra but will retain the current NCA offices around the country.
I have already mentioned the parliamentary Joint Committee on the National Crime Authority, but I would like to use this opportunity to comment favourably on the committee's findings on this bill garnered in the course of its inquiry and the competent chairmanship of my friend and colleague the member for Cook. The merit of many of the recommendations put forward by the committee has been recognised by the government in its amendments to the original bill. The government has agreed to recommendation 2 of the report, which is to restore the entitlement for the ACC to develop international law enforcement relationships in the same fashion as the NCA. Section 17 of the NCA Act will be reinserted so as to apply to the ACC. Likewise, the government has agreed to recommendation 3, which suggested that the relevant state or states be informed of proposed ACC operations or investigations within their borders. The Commonwealth has agreed to recommendation 4, that the bill explicitly recognise the responsibility of the CEO for overall management of the ACC, with the Minister for Justice and Customs responsible to the parliament and the CEO to appoint task force heads after consultation with the board.
 Agreement has also been given to recommendations 6, 8, 11, 13 and 15, which cover staff conditions, integrity and complaints regimes, blanket immunity, part-time examiners and further public review. In-principle agreement will also be accorded to recommendation 5, that the minister must not suspend the CEO unless the minister has consulted the board and that proper conditions apply to termination of a CEO; to recommendation 7, which relates to the role of the Commonwealth Ombudsman; to recommendation 9, with respect to the access to information by the future Joint Statutory Committee on the ACC; and to recommendation 12, which deals with ratification of special operations and investigations. Recommendation 14, related to the exercise of special powers by examiners, has also been agreed to in part.
I would like to conclude by considering two important themes to these reforms. First, I am pleased to note the federalist tenor of the ACC. The level of cooperation achieved between the Commonwealth, the states and the territories at both the April summit and the August discussions is to be applauded, and thanks are due to the Minister for Justice and Customs, Senator Chris Ellison. The structure of the ACC board, the retention of the intergovernmental committee, the amendment in relation to operations within state borders and the retention of the NCA office structure are all indicative of a genuinely federal approach to public policy. Australia is a federation of states joined together by their mutual agreement. This is not an operation in which the Commonwealth has sought to reduce state sovereignty nor centralise decision making. Instead, the input of all the states and territories is complemented by the administrative improvements built into the ACC. As such, the ACC is a model for cooperative federalism worthy of the name. 
Second, the establishment of the ACC recognises the unique and imminent threat of terrorism and the connection of terrorism to other forms of criminality. Back in September, a plot was revealed concerning the attempted purchase with the profits of illicit drug trafficking of Stinger shoulder-fired anti-aircraft missiles by al-Qaeda operatives in Hong Kong. It is alleged that these persons attempted to sell half a tonne of heroin and five tonnes of hashish in California in order to finance the Stingers, which are weapons that could be used to down commercial or military aircraft. The spectre of global money laundering connects terrorists to crime—and not surprisingly, given that an estimated $US860 billion has been laundered in this year alone. While only a small amount of this total is related directly to terrorist funding, the money laundering system makes available to terrorists the means of obscuring the sources of support. As such, the fight against transnational crime by way of agencies such as the ACC is crucial to our broader national security. The bill before us will do much to make Australia a safer place. I commend it to the House.",REPS,<title>AUSTRALIAN CRIME COMMISSION ESTABLISHMENT BILL 2002</title>,<title>Second Reading</title>,Bills,27,1,speech
"Kerr, Duncan, MP",ALP,2002-11-13,"—The member for Cook and the shadow minister for justice and customs have each spoken in the debate about the constructive work of the committee reviewing the Australian Crime Commission Establishment Bill 2002, and I join with them in recognising the way in which the government has responded to the bulk of those recommendations. I will address some of the specifics in more detail later on, but I should say a little bit about the way in which we were assisted by witnesses who appeared at the public hearings and who made submissions. The circumstances were not particularly auspicious. Although the government had flagged an intention to move in this direction, there was no legislation produced for a substantial period of time. We were then given to understand that, because of intentions to replace the National Crime Authority with the new Australian Crime Commission so that it would be operational before the commencement of next year, we had to operate in a very shortened time frame.
Despite that, we had some exceptionally competent submissions made to us. I single out, with no disrespect to those whom I do not mention, the submission made to us by Mr Bill Coad, who had previously given great service to the Commonwealth, initially as the head of AUSTRAC and later as the Commonwealth official appointed to review Commonwealth law enforcement arrangements during the time in which I was justice minister. I also note the submissions made by Judge Betty King, a former member of the National Crime Authority; Mr Greg Melick, also a former member of the National Crime Authority; and a former chair of the National Crime Authority who gave evidence in a private capacity, Mr John Broome. I should also acknowledge and thank, in particular, Mr Chris Meaney and Mr Simon Overland. Although there were other officials of the Attorney-General's Department who assisted with the work of the committee, those two carried the greatest weight of those making submissions. I acknowledge too the submission made to the committee by the Australian Law Council, by my former parliamentary and ministerial colleague Michael Lavarch.
All that said, it is a little concerning that at no stage has a fully developed rationale for the changes that have been made been made public by this government. There have been a number of occasions in recent years where the work of the National Crime Authority has been reviewed by the parliamentary Joint Committee on the National Crime Authority. I have served on all of those committee inquiries in recent years, and the tenor of the submissions made both by the government and by private individuals was that the organisation was working broadly well and that the enhanced powers that were conferred upon the organisation in the last parliament were going to give to the National Crime Authority a substantially enhanced capacity to undertake its important work. 
For reasons which still remain obscure, a decision was made to transform that organisation, to reconstruct it in a manner which gave greater emphasis to it being directed by law enforcement officials and to restructure it in a way which gave to a board—constituted largely by state and Commonwealth police commissioners—the management and directing mind of the organisation, rather than to appointees of both the Commonwealth government and of the states who were, in a sense, three royal commissioners exercising both the powers of royal commissioners and the management of the National Crime Authority. That having been agreed by the Commonwealth and state governments, and we being put into a circumstance whereby the government had already advertised for new staff and where the existing organisation was obviously not in a real circumstance able to continue—losing many of its staff because of uncertainty over the future—it would have been irresponsible of us to have approached our task other than to have sought to have found the best accommodation of those large objectives that had been agreed within a very limited period of time.
I think it is a mark of the hard work that was put in by the chair of the committee and by my colleague the member for Maribyrnong, Mr Sercombe, as deputy chair, and the other members who participated in the hearings—a number of whom put themselves to some considerable inconvenience to find the time, in a very compressed framework, to undertake some very serious analysis of this legislation—that the changes that have been agreed by the committee and then broadly adopted by the government are singularly important in transforming a piece of legislation which was, I think, best described as pretty ad hoc and rough and ready into something that this parliament can be pretty satisfied with. It is a tribute to them.
Might I say, though, that I am still disturbed that the decision around which issues will be the subject of the exercise of the coercive powers will now be made, essentially, by police rather than by ministers. I believe it is one of the fundamental issues that goes to the confidence of the community in the way in which our system of justice operates that, ultimately, there be accountability to parliaments for such decisions. Where royal commissions are established, they are established by an act of the executive, but the executive is in turn responsible to the parliament. It has been hitherto unthinkable that we would confer such powers upon police agencies. To emphasise that point I need do no more than refer to evidence given to both the Legal and Constitutional References Committee and the Joint Committee on the National Crime Authority by the Commissioner of the Australian Federal Police, Mr Mick Keelty, when he testified on 15 March 2001, saying:
The AFP enjoys a close strategic partnership with the NCA.
...					...					...
The AFP believes it is appropriate for the NCA to exist as an independent agency. It is inappropriate for any police organisation to have the special powers conferred upon the NCA.
Later, on 2 April 2001, he repeated that `it would not be appropriate to vest those powers into a police agency'. 
We in the committee were mindful that we were asked to report on a bill that had been the product of negotiation and compromise at an officer level between the states and the Commonwealth and that those negotiations had occurred within a framework of a heads of agreement entered into by the Prime Minister and the premiers. We took it as given that the outcomes of those negotiations— albeit conducted without public input— should not be interfered with unless there were good reasons to do so. We in the committee were also mindful that any proposal to vest the powers of the kind of a royal commission or those possessed by the National Crime Authority into a body directed by the heads of Australian law enforcement agencies represented a shift not only of emphasis but also of principle.
There is an outstanding issue, which I think remains important—that there ought be a mechanism of accountability for the determination of the scope of the exercise of such coercive powers through ministers ultimately accountable to their respective parliaments. I understand this issue is still being worked through. There is a broad agreement on a different method from that proposed by those members who participated and added comments. I would hope that mechanism is one which is transparent and gives effect to the broad principle that I am articulating, because I do believe it reflects an important principle, of the kind that was referred to by the member for Bowman—the responsibility of parliamentarians to ensure that they in turn take responsibility for supervising the actions of the executive. 
Debate interrupted. ",REPS,<title>AUSTRALIAN CRIME COMMISSION ESTABLISHMENT BILL 2002</title>,<title>Second Reading</title>,Bills,27,1,speech
"Ripoll, Bernie, MP",ALP,2002-11-13,"—The humble four-wheel drive vehicle has come in for a lot of bashing in recent months. There is no limit to those who will line up to give the four-wheel drives a kick in the bumper and no limit to the denigration heaped on the drivers of this said `pox on society'. I cannot recall such hysteria since the George W. Bush speech on the war on terror: `we'll flush them out', `we'll get them', `down every burrow'. If it sounds like war, it is because it is.
But is all this criticism fair or are they just fair game? There have been some very high-profile critics who want these vehicles banned and who have said things about the drivers that cannot be repeated in this chamber. One of these critics is former Prime Minister Paul Keating, just to name one. The most infamous four-wheel drive hater says that all four-wheel drives should be banned, taxed out of reach and purged from city roads completely. But whatever is said, the reality is that ordinary Australians still regard the humble four-wheel drive as a part of their lives and a part of our culture. Statistics show that sales of four-wheel drives have soared and are still growing, making up over 22 per cent of total vehicle sales.
Gone are the days when only farmers and outback folk owned four-wheel drives. Today the owners of four-wheel drives are mums and dads who need extra seats for a big family or to pick up their kids' schoolfriends, people who want to go fishing and exploring, retired couples who want a vehicle that is big enough to take them all around Australia towing a caravan or boat, and families who want to spend the odd weekend at Fraser Island or Moreton Island—if you are from my area. They are also tradesmen and workers, who have four-wheel drives for use on construction sites and for towing heavy trailers. They are ordinary people who cannot afford more than one vehicle but want a practical motor car. There is a whole range of different people, including the Toorak tractor drivers in their $100,000-plus Range Rovers and the yuppies who never go off-road.
Whoever drives these cars, and for whatever reason, the fact is that obviously they are legal and completely meet Australian safety standards; in fact many of them exceed these standards. According to national road toll figures, four-wheel drives have been involved in 12 per cent of all road fatalities. This is a tragedy, of course, and that number needs to be reduced. It is also an increase from previous years. However, if you compare the increase in the number of four-wheel drives and kilometres travelled, it is on par with statistics for other vehicles. The national road toll is not high because of four-wheel drives; it is high because people have accidents. The main factors known to be involved in causing deaths on our roads are driver fatigue; drink-driving, which is responsible for the majority of fatalities; road conditions or driving contrary to road conditions; inexperienced and young drivers— those most at risk; speeding; and road rage. There are many other factors, such as very poor roads and very dangerous black spot areas; and country roads remain high-risk areas. But nowhere does the four-wheel drive turn up as the reason for and cause of road fatalities—simply because it is not the culprit.
There are many types of four-wheel drive vehicles, including very small two-seater types that weigh less and are smaller than most compact cars. There are four-wheel drive vehicles such as the Subaru WRX or Honda CRV, a sedan and a sports hatch respectively. Then there are those growing in popularity, such as the Hyundai, the Mitsubishi and other makes of four-wheel drive medium sized wagons that are no larger than the average Commodore or Falcon. Not all four-wheel drives are very large, gas-guzzling monsters, as portrayed by some. Many of the large Toyota and Nissan four-wheel drives are also LPG converted to save on fuel costs and reduce pollution, something that the government should seriously consider encouraging—along with a high ethanol content; that would be a great idea as well. 
Four-wheel drives are here, and they are here to stay. We cannot ban them from city roads any more than we can ban red, two-door cars with fluffy dice swinging from the rear-vision mirror. So let's just cut the rubbish and get on with the serious issues, like reducing the incidence of drink-driving, speeding, road rage and so on, and improving our road networks and public transport systems. No one type of vehicle is the scourge of society. It seems that we in the city have just grown intolerant of the yuppie who has traded in his BMW for a Range Rover—ironically, now of course you can buy a four-wheel drive BMW. So that takes care of that. The four-wheel drive yuppie is a symbol of wealth and modern society that most of us do not like, but this is no reason to condemn all four-wheel drives and their owners. So no matter the size, type and safety of the vehicle, do not allow the four-wheel drive to stand alone in the car yard of obscenity. Come on; give the four-wheel drive a chance. It is not some evil, nasty toy of the bourgeois imperialist; it is just a car— that is all it is. And let's not make excuses for our bad drivers, our bad roads, our road ragers and our drink-drivers. They are the culprits, not the humble four-wheel drive.",REPS,<title>ADJOURNMENT</title>,<title>Four-Wheel Drive Vehicles</title>,Adjournment,28,1,speech
