name,party,date,text,chamber,debate_title,subdebate_title,debate_type,debate_id,subdebate_id,type
"Smith, Anthony, MP",LP,2002-11-13,"—I rise to speak on this matter of public importance about bank fees introduced by the member for Bruce. As the Parliamentary Secretary to the Minister for Finance and Administration and member for Fisher said so eloquently in his remarks, this matter of public importance has been moved—
—I hope this isn't full of arrogance and pomposity.
—You just worry about Richard Marles. This MPI has been introduced by a Labor Party that seeks to condemn the government for continuing a policy that Labor introduced. You need to ask yourself why we are debating this MPI today. There are a couple of reasons. We all know how the tactics committees work on each side—government and opposition. When the tactics committee of the opposition sat down this week, it is pretty clear what happened. They said, `We can't do an MPI on trade, because we would have a rebel frontbencher taking a shot at Crean.' Newspaper headlines this week were: `Crean puts Emerson and front bench on notice', `Maverick member is “naive”—Crean', and `Crean takes Emerson to task again'. So the opposition could not introduce an MPI on trade. They could not introduce one on foreign affairs, because yesterday the Leader of the Opposition was running around the press gallery trying to explain his new promises, policy and position on Iraq.  
As the member for Fisher indicated, this is an MPI for a rainy day. It gets wheeled out about once a year—every time the Labor Party have nothing else to talk about—with gross hypocrisy. The Labor Party would have you believe that they would do something different if they ever had the chance.
—Mr Deputy Speaker, unfortunately I rise on the same a point of order for the government's second speaker and ask that the member at least mention bank fees, the topic of this MPI.
 (Mr Jenkins)—The honourable member will resume her seat. The honourable member for Casey knows that he is obliged to be relevant to the matter of public importance.
—Thank you, Mr Deputy Speaker. I was about to do that before I was so rudely interrupted by the member for Gellibrand, who is a good member to make an interjection because the member for Gellibrand replaced former Treasurer Ralph Willis.
As the member for Fisher pointed out, it is worth going back and looking at the history. The reason we are having an argument about bank fees is that we have a deregulated banking system. We have a deregulated banking system because the Labor government deregulated it. It did so in the early 1980s, and it did so with the support of this side of the House. It did it to introduce competition and to provide better services to the community. It also did a number of other things, but at no point did it direct the ACCC to do what the substance of this matter of public importance demands.
It is worth going back, as the member for Fisher did, and looking at the history of that. The previous speaker, the member for Chisholm, said that this did not become a problem until 1998. In 1995, Ralph Willis announced that he was directing the ACCC to do precisely what the member for Bruce now demands. It is worth reading the whole quote.
—You've had seven years to pick it up.
—Just listen to the whole quote:
To spur this process, I will direct the new Australian Competition and Consumer Commission to formally monitor and regularly report on the financial services industry in relation to retail transaction accounts for a period of three years. 
How long did it take him to spur the process? Nothing happened for 7½ months. We know that Ralph was slow. We know Ralph took a long time to get anything done. But he said `to spur this process', and then nothing happened. That was in July 1995. Four days before the 1996 election, he basically reissued the same press release. It was headed `Labor to monitor fees and charges on retail transaction accounts'. After 7½ months he was able to reveal this:
A Labor Government will write to the Chairperson of the Australian Competition and Consumer Commission.
That was four days before the election. This is an important point, which the member for Kooyong just made. What it tells you is that Labor tries to score cheap political points to try to curry favour with a public who are cynical about banks. As the member for Fisher said, we are not here to defend the banks, but the banks operate in a deregulated market that you created. Why would you make such a promise? Basically to curry favour. You have made promises before on banking. If you were ever to return to government, you would not take these steps. We only need to look at your background and your history to see why.  
Unless I am mistaken, the previous speaker, the member for Chisholm, worked in the banking industry, and I think worked for a banking union. I think I am right in saying that. I am not sure how she would have felt—as part of that and as part of the Labor Party—in 1990 when the Commonwealth Bank Officers Association sought a pledge from the Hawke Labor government that they would not sell the Commonwealth Bank. 
—They got it too.
—They got that pledge. In return, they donated to the Hawke campaign. In 1991, Paul Keating announced he was privatising the Commonwealth Bank. I have never heard the member for Chisholm talk about the Commonwealth Bank. It is worth looking at the history. When they announced they were privatising the Commonwealth Bank, what happened? You announced that you were going to privatise it only up to a certain level—only up to, I think, 30 per cent. They said, `I know we promised before the election, I know we swore on a stack of bibles that we would not privatise the Commonwealth Bank, but we are only going to sell a little bit. We are only going to sell 30 per cent. After that, that will be it.'
Then, in 1995, which was a busy year for the former member for Gellibrand, there was a sudden announcement to try to make his budget add up. He announced he was selling a further tranche after promising he would not. In fact, he actually went further. In a signed prospectus—you would not do this if you were in private enterprise—to every single investor, he said:
The government has no intentions whatever of further reducing its shareholding.
—Take it back.
—He did. I regret to say that he did sign it. It was sent to every Commonwealth Bank shareholder. What this tells us is quite simple. The public cannot believe a word you say on banking. The other reason they cannot believe a word you say on banking is that they know your record. Your record on banking they judge as a totality. They judge their total banking costs. You see, unlike the member for Gellibrand and the member for Bruce, the public live in the real world. They judge their whole banking costs. Their whole banking costs consist of three things. They do not like fees, and they are justified in being angry on occasions. Some of the banks do have a sensitivity bypass when it comes to this. But they also care about taxes on banking. They also care about a financial institutions duty, which this government abolished, and a bank account debits tax, which this government is going to abolish. They also know that, for your 13 years of government, that stayed for the whole time. They also know that you fought the last election trying to keep those taxes, because you oppose tax reform. They also know that the biggest banking cost of all is their mortgage repayments, that monthly repayment on their mortgage. They know that movements in interest rates affect their family budget more than any other measure and that, when interest rates were 17 per cent, life was hard. They were 10½ per cent before this government got elected; they are 6½ per cent today. That saves them $4,000 a year and, compared to an interest rate of 17 per cent, the saving is more like $10,000 or $12,000 a year. 
This is an MPI that has been pulled out of the bottom drawer because the opposition tactics group could not find one frontbencher capable of doing an MPI in this rabble of an opposition.
 (Mr Jenkins)—Order! The discussion has concluded. ",REPS,<title>MATTERS OF PUBLIC IMPORTANCE</title>,<title>Banking: Fees</title>,Matters of Public Importance,21,1,speech
"Hall, Jill, MP",ALP,2002-11-13,"— When I ceased speaking prior to question time, I was in the process of responding to members on the other side of the House who suggested that I might be lost for words when talking about their failure to deal with issues relating to telecommunications. I am afraid that their actions in the area of telecommunications bring to mind many words—many words indeed—and they are not flattering. This government has deceived the Australian people. It has one agenda and one agenda only in relation to telecommunications—the sale of Telstra.
Before question time, I was about to point out to the House some of the key measures of the Telecommunications Competition Bill 2002. The bill aims to encourage investment in telecommunications infrastructure by enabling potential investors to obtain up-front certainty through undertakings to the ACCC about assessing access prices and terms and conditions that will apply to future investments; provide greater certainty and more timely access for access seekers by removing merit review of the ACCC arbitration; require the ACCC to produce model terms and conditions for core telecommunications services; and encourage voluntary undertakings to ensure the effective operation of the standard access obligation.
This bill also includes measures to improve the operation of the anticompetitive conduct regime under part 11B of the Trade Practices Act by enabling the ACCC to issue advisory notices before a competition notice is issued; requiring the ACCC to consult with the affected parties before issuing a competition notice; and requiring the preparation and publication of separate regulatory accounts to provide greater transparency of Telstra retail and wholesale operations, particularly in relation to core connection services provided through its network. The bill also removes legal requirements for carriers to have industry development plans—which to me is a worry. 
The government's handling of this legislation has been appalling. It announced that there would be a planned response to the Productivity Commission report on telecommunications competition regulation in April this year. Some seven months after receiving the report, this bill is before us in the parliament. The tabling of the bill in September revealed a very much watered-down version of accounting separation, where the minister will be able to direct the ACCC regarding the required level of accounting separation. This seems to be a common thread in most of the legislation that is appearing before us in this parliament. The minister is really interfering with the operation of so many different things, be it telecommunications, the environment or the legislation I was speaking on last night. I feel that this government has a lot to answer for. I believe that this government does not embrace transparent accounting separation frameworks for Telstra, just as it does not embrace transparency in any area of government.
The government also has a Senate inquiry into the bill, which it instituted in September, but has chosen to pre-empt that debate by putting this bill before the House before the Senate have finished their consideration. I really feel that this government is covering something up and really trying to hide from the Australian people the fact that it has failed in the area of competition in telecommunications. It has not addressed the core issues. There have not been the core improvements or the improvements in service that we would expect. People are still paying so much more for their line rental and phone calls. We are also facing timed calls.
When I was speaking before question time, I mentioned that the Labor Party was moving in the Senate to disallow increases. But, unfortunately for the Australian people, the Democrats have sold them out. We are used to this from the Democrats. The Democrats let the Australian people down when it came to the introduction of the GST and they have let them down again by letting these unfair Telstra price rises go through. The Democrats have a history of not following through and of selling the Australian people out. The big problem now is that the people of Australia are faced with big hikes in their telephone usage costs, and we still have very poor service in a number of areas. 
I support the second reading amendments moved by the member for Melbourne. We definitely have inadequate competition within the telecommunications sector in Australia. Telstra is making enormous profits and people are still waiting much longer than they should to receive the vital services they need. Each day I have numerous phone calls from people within the Shortland electorate, detailing to me the problems not only with Telstra—problems with service delivery, problems with being unable to access mobile phone services, problems with having faults repaired or even problems in connecting to the network—but also with other telcos. One such complaint, which I received about 12 months ago, was quite ludicrous. In this case a business within a shopping centre in the Shortland electorate agreed to sign up with one of the other telecommunications providers. This telecommunications provider transferred to its service not only that business but also the whole shopping centre. As a result of that, when the shopping centre received their bill for the quarter they were absolutely flabbergasted because it was about three times the amount they usually paid. So attempts to introduce competition have been flawed in many ways. We do not have the level of service which we need and we have not got true competition.
The Estens inquiry, which this government commissioned, has delivered the results that the government wanted it to. The inquiry ignored numerous complaints and ignored the submissions which raised issues of great concern to people living in the country and in regional Australia—issues about mobile phone usage, fault repairs and service to country areas. The recommendation made by the Estens inquiry is the recommendation that the government wanted—that is, to deliver the sale of Telstra.  
I believe the Howard government has tried to portray itself as the champion of free enterprise and competition. Yet, when it comes to the telecommunications industry, it has really failed the Australian people dismally. What has it delivered? It has delivered higher prices and a service that is second-rate. The government is driven by a philosophical commitment to sell off Telstra at all costs. In fact, it is probably a little more than a philosophical commitment: it is one driven by dollars and the fact that the government has a few economic problems which it needs to address. Maybe some of those problems were caused by the Treasurer gambling on the international money market. The problem for the government is that by selling Telstra it delivers itself a bucket of money. Telstra should remain in private ownership—
—Hear hear!
—Excuse me, I mean public ownership. I hear the member for Grey interjecting. He is a country member who represents an area that has a second-rate telecommunications service, but he argues for the privatisation of Telstra. I do not think that is good enough. I think he should be in here fighting for a better service for the people of his area and fighting to keep Telstra in public ownership. Telstra still has a giant share of the market. New telcos are experiencing great difficulty in trying to enter the market and many of those that have entered the market have question marks over their long-term viability and the practices that they employ. I highlighted one of those practices earlier—the practice that affected a shopping centre within my electorate.
The only issue that the Howard government is really concerned with is selling Telstra—not improving competition or the service to the Australian people. It is focused purely on the sale of Telstra and on maximising its returns. I believe it is this focus which is driving the Howard government's telecommunications policy and initiatives. I have news for the government: this is not the focus the Australian people want. They want Telstra to remain in public ownership and they want cheaper—not more expensive— phone calls and mobile and Internet services. (Time expired)",REPS,<title>TELECOMMUNICATIONS COMPETITION BILL 2002</title>,<title>Second Reading</title>,Bills,26,1,speech
"Wakelin, Barry, MP",LP,2002-11-13,"—The Telecommunications Competition Bill 2002, which is a bill for an act to amend the law relating to telecommunications and for other purposes, has about 16 parts in it. It is very comprehensive. The minister, his staff and the committee are to be congratulated for the work that has gone into this to create an improved and stronger telecommunications market. Schedule 1 looks at `Pre-selection in favour of carriage service providers', `Industry development plans' and `Access to network information'. Schedule 2 is `Amendment to the Trade Practices Act 1974'. There is a lot of detail in it, from `Model terms and conditions relating to access to core services, etc.', `Merit reviews of final determinations' and `Duration of declarations' through to `Backdating of final determinations', `Guidelines about the ACCC's powers to regulate anti-competitive conduct', `Telecommunications access codes' and part 16, `Record-keeping rules and disclosure directions'. Schedule 3 is `Amendment of the Telecommunications (Carrier Licence Charges) Act 1987'. The bill is very comprehensive, very welcome and important within this dynamic industry and within Australia's geography, and it contributes to one of the strongest economies in the world.
Telstra, effectively, is a monopoly. The debate about privatisation is whether Telstra should be a public monopoly or a private monopoly. Certainly, as a supporter of private enterprise, and as the Prime Minister has said on many occasions, the government are not in any hurry to sell the remaining 51 per cent. But, once certain conditions are satisfied, we will look seriously at it, dependent upon what support there is in the Senate. The ALP are very interesting to me in the way they approach these matters. They always want to control, they always want to regulate, they always want to keep their fingers entwined in complicated restrictions on how a private enterprise system could work. They do not have any confidence in anybody—anybody other than those within the union movement and those with their own control mentality.  
I enjoyed the member for Paterson's contribution because the member for Paterson understands these things very well. With those interesting statistics, he explained how Telstra is much less of a monopoly than it was. I am open to comment about whether it is a partial monopoly or a full monopoly, but certainly, in certain parts of the country, Telstra is a monopoly. But he made a very good point that the dynamics of the telecommunications industry have seen many new entrants. I think he mentioned a figure of something like $29 billion in new investment. There is an important part on the third page of the minister's second reading speech which I will quote to remind the House of another aspect of improved competition in telecommunications. It says:
The government has previously announced that it will encourage a more transparent regulatory market by requiring accounting separation of Telstra's wholesale and retail operations, particularly in relation to the `core' interconnection services provided over the Telstra network. Accounting separation will address competition concerns arising from the level of vertical integration between Telstra's wholesale and retail services and substantially improve the provision of costing and price information to the ACCC as regulator, access seekers and the market.
That is very important. In terms of the history of Telstra, from the days when it was known as Telecom until Labor corporatised it in the early nineties, it has been a dynamic and valuable company, whether publicly owned or partially privately owned. It has been dynamic and very valuable to the community. 
I will quickly describe in a couple of word pictures my own experience as someone who comes from a regional electorate. It is important to remember that the days when eight-gauge fencing wire on old posts carried party line communications, which were not always totally reliable, are not that long ago. All right, it may be 25 or 30 years since we went underground with copper cable, but we have come a remarkable distance in a very short time. We have a fair degree of reliability. We have, in much of my electorate, mobile phone services which have been provided as a direct payment from the government in partnership with the carriers, mainly Telstra. I look at a region like Eyre Peninsula, which has a very intricate network of mobile phone services which would not have been thought to be possible even a few short years ago. 
All the community infrastructure, whether it is in the schools or in a range of other emergency services, is part of the Networking the Nation package, which has meant at least $1 billion has been spent on improving communications in regional Australia. We can see how the government enabled people in regional Australia to have the Internet for local call costs. That was unheard of; we did not think it was possible. But it has been there for many years, and now we see Telstra providing local call access to the Internet as almost a matter of course. Speed and the broadband issue is still with us but it is certainly improving, and availability is improving all the time. On the issue of satellite phones and the last policy, we now have a 50 per cent subsidy for most of Australia. There are some provisos about access to existing phone services, which is commonsense. The contribution allows satellite phones to be available to the part of the community that does not have access to mobile phone services or other services. This is just another example of the government's proactive approach and its determination to service all sectors of society.
The Labor Party are concerned about big business, they are concerned about profits, they are concerned about people actually making a profit. I go back to that time when the Labor minister of the day in the early nineties insisted on corporatising Telstra and having it abide by exactly the same rules as big business, as corporate Australia. We in regional Australia paid $20,000 or $30,000 for connecting a service—that is in 1990 dollars. It was out of the reach of most people. So let's not have too many crocodile tears from Labor. If you look at the fact that the then Telecom, which became Telstra, was required to act as a corporation, with all the principles of big business and with the controlling Labor government insisting on those profits from regional Australia going into revenue and never finding their way back to regional Australia, then you understand that crocodile tears have been shed here about alleged support for regional Australia. And you can understand that the $1 billion which, as I said earlier, has been spent on new infrastructure would never have been spent by Labor in regional Australia—in fact, Labor opposed Networking the Nation with vehemence. The great thing about Networking the Nation was that it came from the community up. It asked the community: what is your requirement? How do you see your need? It got community ownership, investment and participation which would never have been possible under any Labor government. 
The issue of timed local calls is a very interesting one. There is always the big scare tactic about timed local calls, but let us never forget that Labor had already introduced timed local calls into regional Australia in the pastoral regions. Neighbours in the same house in a township like Oodnadatta had a timed local call. Fair enough: perhaps if you were neighbours you could talk over the fence. But if you were down the end of the town you paid a timed local call. With the expenditure of $150 million on the contract with Telstra in the last 12 months, a very large area of Australia has been opened up and given a far better deal in terms of local call access. Local call access in much of the remote parts of Australia is somewhat different to that in the suburbs of Melbourne, Sydney or Canberra.
So there is a very proud story here, both in the history from the PMG days right through to today's Telstra and in its future. There is a very good lesson in keeping out of the road of those who want to progress this country and letting them make decisions within the proper guidelines—and that is what this legislation is about. It is a very good lesson in allowing a dynamic company like Telstra to serve the community to the best of its ability, which I have every confidence that it will. I thank the minister and his team for the effort that has gone into this bill. We look forward to the speedy passage of this legislation, which I understand is expected to be accepted. I am sure it will contribute to the future of Telstra in a very positive way.",REPS,<title>TELECOMMUNICATIONS COMPETITION BILL 2002</title>,<title>Second Reading</title>,Bills,26,1,speech
