name,party,date,text,chamber,debate_title,subdebate_title,debate_type,debate_id,subdebate_id
"Hatton, Michael, MP",ALP,2002-12-12,"—I wish to associate myself with the arguments advanced by my colleagues who have spoken on the Taxation Laws Amendment Bill (No. 6) 2002. I note that no-one from the government has spoken on this bill. I know that the hour is late and the end of the year is actually here, but, if you look at the speaking list, the only reason why this House has not closed down is that people in the opposition are still speaking. It is within our power not to do that. Then nothing would be coming back from the Senate and we would not be proceeding. However, we recognise that we have a duty to the parliament, however pressed we are.
Taxation Laws Amendment Bill (No. 6) 2002 has three elements. I will deal with two of them in passing and one more substantially, and then I will deal with the amendment put by the shadow assistant treasurer. First, very much in passing, is the question of interest withholding tax exemptions. Essentially, they have been directed towards the attempt pursued, in particular, by the member for North Sydney, at least in rhetoric—we are yet to see how much action there will be. It has been a bold attempt, even whilst we were in government, to set up, in conjunction with the state Labor government, Sydney as one of the key financial capitals of the Asia-Pacific. This bill argues that the changes made here in terms of interest tax exemptions deal with bonds and certain other tax concessions, which are given both overseas and in Australia, essentially on the same basis. The argument is that that will provide a stronger basis for investment within Australia, encourage more overseas investment and provide an incentive for people to draw closer to Australia and make Sydney, and indeed Australia, a stronger financial centre. The actual matters in relation to associates and prohibitions—what they can and cannot do, deemed interest payments and all the rest—I will leave to the aficionados.
I note that chapter 3 of the bill deals with friendly society investment products. We know that friendly societies have always been dealt with in ways that are different from a lot of other entities. That is because of their very nature: they were groups that came together to assist each other mutually. There are a number of plans in relation to students, funerals and so on. A series of changes was made whilst we were in government. The context that is provided for this series is that these changes will be put in place in order to harmonise that with a number of other measures that have already been taken. The member of the opposition who preceded me, the member for Stirling, dealt with that at some length.
The key point of the bill is schedule 2, regarding the capital gains exemption for certain compensation payments. This is a very important measure and it is timely given that the German government has taken action with regard to a compensation program for German forced labour. The genesis of that program is a foundation, set up on 12 August 2000, which has about seven subsets regionally within the German federation. The foundation was set up to provide compensation to former slave and forced labourers and certain other victims of injustices suffered during the National Socialist period. This measure is an extension, and a very belated one, of a series of other measures that were put into place much earlier. German governments in the past have certainly found it difficult to come to terms with their history.
I had a direct and particular association with victims of National Socialist policy as an electorate officer for the former member for Blaxland when he was Treasurer. Two people who came to see me had been in concentration camps. Both of them had suffered enormously before and during the war. Not only had they been forced labourers but because they were Jewish they had been placed along with many others in concentration camps. In fact, we know that six million people of Jewish descent were killed in the concentration camps throughout Germany and in occupied Europe during the war. We know that those who did not suffer annihilation suffered deprivation, starvation, torture, mental and physical cruelty, and the other abominations that were visited upon them in the death camps—the medical practices and experimentations. A vast panoply of evil was visited not only on those two people but on the six million who are remembered. Another 5½ million or so people—gipsies, disabled people, people who were different because of their sexual orientation because homosexuals were marked by the Nazis to be treated in a special way, and people who suffered from dwarfism—were brought into the general description of effectively being non-Aryan and, therefore, were up for dissolution or annihilation. People who survived the death camps need to be dealt with in a particularly civil way and in a way which recognises what they have been through. 
You can never put it past bureaucrats—as hard as they try to do their work in a way that is sensitive—not to get bound up in the existing law. At the time those people came to see me, although we recognised that those payments were compensation payments to former victims of concentration camps—and I think they were free of tax—the problem was that they were not free from being taken into account for the purposes of assessing income for social security payments. These people were of pensionable age and, because a good part of their lives had been spent living and working in Australia as post war migrants, when they got the compensation payments from overseas their pensions were affected.
Decades after these people suffered under National Socialism's brutalities, finally the German government stepped up to the mark and said, `Our forebears were responsible and we are sorry for what our forebears delivered to the Jewish people and to others.' I note in passing that that has not happened in this House with this Prime Minister in relation to the depredations of our forebears to the original inhabitants here, but the German government has done it in relation to Nazism. They finally were able to look at their past and to look it in the face. They have struggled to do that because what happened was so terrible and went to the core of what their society was about. I believe that the Japanese have still not faced up to what they did to China as a fascist militarist state prior to the Second World War, through to what happened during the war.
Those people who suffered most waited decades. I think it took me more than two years to get it through our parliamentary processes while we were in government and to get our departmental officials to recognise the inhumanity of not taking that income into account. It was not normal income; it was compensation for being incarcerated in a concentration camp in either Germany, Poland or the Ukraine. Good social policy and good public policy must necessarily take that into account. More than a decade on, in August 2000, the German government finally took the other action they needed to. They said that compensation should be given not only to those people whose relatives were obliterated, to the tune of six million of Jewish descent, but also to those people from all over occupied Europe who were drawn into Germany's factories to serve the war effort as slave labour, including children aged 14 who had their lives permanently damaged by it. They finally got recognition.
So the changes I helped to put through, when I was working for the former Treasurer, were in regard to not only those who had been in concentration camps but also those who had served as forced labour. We tried to open it up so that they could have payments made to them. In this case, we are taking the further step of saying that, if there is a capital gains tax element for either the victims or their direct relatives, it is right and proper to take that into account. This not only encompasses those people but deals with property loss as a result of racial persecution. We know that millions of dollars were ripped away from people not because they committed any crime but because, in the eye of the fuehrer and his Reich, they were non-Aryan—that is, they were not of what the fuehrer and his Reich considered to be the pure race. They were people defined as polluting the Aryan race. 
Simply by being defined in a certain way, those people designated as being Aryan in National Socialist Germany had the right to loot the possessions of the people they destroyed in the concentration camps. It also gave those designated as Aryan the right to walk into every house, every abode and every factory of every family whose lives had been put to the test and take all that those people had built up through their work for the whole of their lives. We know, finally, more than 50 years on, that the Swiss government has been brought to task for its culpability during the war, which came to light a couple of years ago. It was a neutral country but it actually took the life savings of those people who had been robbed and deposited them in the accounts of Swiss banks and others. Finally, the Swiss government has been forced to pay some compensation.
This government is doing the right thing in taking these measures with regard to capital gains tax exemptions. It was right for the Labor Party, when it was in government, to take measures with regard to people's income as compensation and to say, `It's only right. It's only just. It's only proper. It's only the most minor of concessions to take account of what dreadful depredations were suffered not only by those who died but by those who survived and by those who were their progeny. It is important for those people to be recognised.' (Quorum formed)
Having dealt with the weighty matters, I will go to our amendment and the government's depredations on the Australian public at large. The government are at fault because, despite arguments to the contrary, we know that—even though the Prime Minister has said they may actually advance tax cuts in the future—there is a tax bracket creep of $17 billion which this government want to divert to their own uses rather than putting it back into the pockets of the people into whose pockets it should be put back.
Indeed, we see one-third of an article given over to this in the Sydney Morning Herald. This is not a case of reading a paper; it is utilising it, as I have seen the Prime Minister, the Treasurer and virtually every member of that frontbench do. It is not just something you do for a lark or as recreation; this is about dealing with it in the speech. In Matt Wade's article, `Tax cuts in doubt as billion-dollar prop for budget is exposed', he makes the point that, with the amount of bracket creep that the government is not willing to give back, what we are looking at is not a budget surplus—as we know—but a budget deficit. Why are we looking at that? Because, starting from the position of running absolutely scared in February and March of last year, a minimum of $14 billion was wasted by this government last year to get themselves re-elected. Every one of the groups that they saw, they thought they needed to buy off—the superannuees, those who are otherwise retired, the pensioner groups. There was $14 billion of fiscal profligacy from March through to the end of the year. In fact, some could argue that it is not $14 billion, but $20 billion.
The Treasurer and the Prime Minister want to say, `This government has been perpetually in surplus.' Whilst we were in government, we were in surplus for four years, and they were the first four years of budget surplus in the entire history of the Commonwealth. Despite the fact that the coalition ruled for most of the time since Federation, it was Labor that first brought in surpluses. Drawing on what Labor achieved through the 1980s and 1990s in restructuring this economy and providing that firm foundation, there should have continued to be surpluses. There should have been a real surplus; the Treasurer should not have had to flip over on whether this was a cash or an accrual budget.
Last year, we were dealing with accrual accounting. This year, the budget is on a cash basis because the accrual basis format simply says the budget is in deficit. That is why the Treasurer changed—away from headline counting—to another form of accounting. The reality is very simple and this government cannot move away from it. They want to take back most of the bracket creep; they want to cover their hides for the profligacy of $14 billion to $20 billion spent on buying the last election. They want to try to keep the budget notionally in surplus rather than accept the reality of the deficit not only on an accrual basis but also on a cash basis. The second reading amendment moved by the shadow Assistant Treasurer has my total support. (Time expired)",REPS,<title>TAXATION LAWS AMENDMENT BILL (NO. 6) 2002</title>,<title>Second Reading</title>,Bills,54,1
"Danby, Michael, MP",ALP,2002-12-12,"—I rise to support the Taxation Laws Amendment Bill (No. 6) 2002. The bill seeks to make a number of minor changes to the Australian taxation law. I want to focus particularly on the section that will amend the Income Tax Assessment Act 1997 which provides a capital gains tax exemption for payments received by Australian taxpayers under the German Forced Labour Compensation Program. This program provides two types of payments: firstly, for personal wrong or injury, including slavery or forced labour; and, secondly, for property damage or loss where relief under other funds is not available. The payments are made to the victim, to a relative of the victim or to the victim's heir.
Currently, the German Forced Labour Compensation Program payments are not subject to income tax. However, they are subject to capital gains tax in certain circumstances. The amendment extends the current capital gains tax exemption to all payments received by Australian residents under the German Forced Labour Compensation Program. There are approximately 4,000 Australians who have claimed payments under this program, and there are probably many more who are entitled to do so but have not—and that is a subject I will return to in a few minutes. Many other countries have offered similar exemptions. The United States Congress passed legislation in May 2001 exempting survivors of the Nazi Final Solution and their heirs from federal taxes on compensation or restitution payments received after 1 January 2000. Such payments are also exempt from tax in Canada, Finland, France, Greece, Hungary, Israel, the Netherlands and the United Kingdom.
We have all heard that there are two certainties in life: death and taxes. There are other certainties that arise out of the taxes part of that—that is, tax avoidance, tax evasion and tax minimisation, sometimes called aggressive tax planning. Whatever it is called, it is aimed at reducing individuals' liability to taxation. The German Forced Labour Compensation Program payments are currently not subject to ordinary income tax, as they are not income according to ordinary concepts. The program is part of the German economic foundation called Remembrance, Responsibility and the Future, which will provide payments to people who performed slave labour during World War II. The German government and German industry are each providing half of the funds for the foundation.
Around $US5 billion has been contributed to the program to compensate those people who were compelled to work in concentration camps, ghettos or other places of incarceration or other people who were forced to work anywhere in Europe under German occupation under conditions resembling imprisonment or extremely harsh living conditions or perform work under a work program in the Nazi `extermination through work' policy. This was a policy where people were given starvation rations, if rations at all, and were literally worked to death, but some people managed to survive this process because it was stopped by the ending of the war. Each person will receive up to $A12,000. Of course, no amount of money can adequately compensate a person for the horrors they have suffered at the hands of the Hitler regime. However, those reparations by the German government and industry are to be welcomed. I would say they are part of the German government's general remembrance of a part of their history and their atonement for the things that happened. This is an interesting contrast with atonement by the Austrian and the Japanese governments for events during the Second World War, which certainly has not reached anywhere near the degree of importance that it has in Germany.
However, the last thing the government should do with this kind of program and with these types of payments is to tax people at their top marginal rate. I have mentioned that there are many people who do not claim these payments. I can think of a close family friend who is now in his late seventies and is very fit and very active in business. As a young 16-year-old he was taken from Hungary to work with thousands of other slave labourers in a copper mine in Yugoslavia. His story of the work that he did and his liberation, like all of these stories, makes an ordinary Australian who has not experienced these terrors feel in awe of people who could go through such things and lead productive lives afterwards. Of course, many of these people reject these payments as `blood money' that can never compensate for what happened to them or their families. 
These payments are currently subject to capital gains tax because of the broad definitions in the capital gains tax provisions. That tax was introduced by the Hawke-Keating governments over the howls of the coalition, particularly of the current Prime Minister, who was then Leader of the Opposition. I might add that it was introduced to eliminate the greatest form of tax evasion available at the time. At this point it is worth noting that it is the current opposition that consistently has improved the tax system. The Australian Labor Party introduced the capital gains tax and the fringe benefits tax. It was the Australian Labor Party that has attempted and will continue to attempt to simplify the goods and services tax and the business activity statement. Meanwhile, those on the other side of the chamber, who claim to be friends of small business and who, one would have thought, would therefore be responsible for reducing taxes on business, are in fact dumping the tax burden onto middle Australia. The government are the highest taxing government in the nation's history, yet their mates are still getting away with some tax rorts.
The tax system has always made a distinction between income and capital. The distinguished jurist and former chief justice Sir Owen Dixon described capital as a tree and income as the fruit which grew from the tree. Prior to the capital gains tax, only the fruit was taxed while the tree could grow and grow but was not taxed. This led to tax evasion as taxpayers converted taxable income into tax-free capital gains. Capital gains, no less than income, wages, interest, dividends and business profits, increase an individual's economic status and purchasing power. Given the fundamental tenet of our income tax system that tax should be based on the capacity to pay, capital gains should be taxed. The old system was quite unfair and inequitable as it meant that two people who earned the same amount, with the same purchasing power, would be taxed completely differently depending on whether their money was income or a capital gain. As the tax system was distorted the tax liability was more and more skewed towards middle Australia as the wealthy got away scot free on capital gains.
This, in turn, led to a reduction in compliance as middle Australia found the tax system more and more unfair. Over the years, this parliament has introduced a number of exemptions to the capital gains tax provisions. One of the most notable is the exclusion of compensation payments for personal injury and death. This exclusion, in fact, was a major reform and improvement for the insurance industry. Prior to this, compensation payments had to be artificially increased to take account of the significant amount of compensation payments that was taken by the Commonwealth in capital gains tax. This exclusion allowed for a significant reduction in the quantum of compensation payments. These German forced labour compensation program payments are another form of compensation payment, and therefore should not be subject to capital gains tax. They should not be subject to capital gains tax because capital gains tax was never meant to capture these types of payments and because it does not undermine any of the basic principles of the taxation system of fairness, simplicity and equality.
I particularly take this opportunity to pay tribute to the work of the previous speaker, the member for Blaxland, in arranging changes to the system that enabled the issue of these kinds of payments from individuals to be addressed. Just before I finish, I may ask the Minister for Family and Community Services, Senator Vanstone, and her representative in this place, the Minister for Children and Youth Affairs, Mr Anthony, if these payments will also be excluded from consideration in Centrelink payments. These payments are exempted from social security considerations in most other countries. Other similar restitution payments for people who survived the Nazi extermination are exempted from social security considerations, including French payments to orphans of persons who died during the deportation as part of the persecutions during the German occupation of France during World War II and payments from the Dutch fund for needy survivors of the Nazi Final Solution, which are paid through the Executive Council of Australian Jewry. Also, periodic German restitution payments are exempted from the calculation of Australian pensions. I hope these payments will also be exempted. Otherwise, we are giving with one hand and taking away with another. I join members opposite in supporting this bill. ",REPS,<title>TAXATION LAWS AMENDMENT BILL (NO. 6) 2002</title>,<title>Second Reading</title>,Bills,54,1
