name,party,date,text,chamber,debate_title,subdebate_title,debate_type,debate_id,subdebate_id,type
"Ellis, Annette, MP",ALP,2002-11-13,"—I move:
That Standard 9 (Employment Conditions) of the Disability Services (Disability Employment and Rehabilitation program) Standards 2002 made under the Disability Services Amendment (Improved Quality Assurance) Act 2002, be disallowed.
I am speaking today in support of the disallowance motion relative to standard 9 of the Disability Services (Disability Employment and Rehabilitation program) Standards 2002. I do that with very serious concern on behalf of the people represented in this place from the disability sector around the country. This package of standards is attached to the Disability Services Amendment (Improved Quality Assurance) Act 2002, which went through the parliament earlier this year. The standards allow the enactment of accreditation and standard levels for the quality assurance program as it affects business services—currently known as business services but previously referred to as sheltered workshops—so that people employed within those services around the country can begin to enjoy the sorts of conditions of employment that we in the non-disabled sector of our community take for granted.
The new Disability Services (Disability Employment and Rehabilitation program) Standards 2002 will apply to enterprises now known as business services which employ people with disabilities. There are around 500 business services in Australia providing Commonwealth subsidised employment for around 15,000 people. The disability standards will apply to existing business services from 1 January 2005, while new operators established after 1 January 2002 will have 12 months to comply. Many business services and representative bodies such as ACROD are concerned about the potential loss of employment places if workplaces are closed down for failing to meet these new standards. It is therefore essential that business services are provided with maximum assistance and clear guidelines in implementing these standards. Our concern centres on the lack of clarity in standard 9, Employment Conditions, which deals with setting appropriate wages for people with disabilities in accordance with their capabilities and productivity levels. This is partly an industrial relations issue and partly a question of human rights, including the right of people with a disability to participate in the work force. There is a range of views within the sector, and we admit that quite openly. Some disability advocates argue that wage standards should be set according to awards as a matter of principle, although allowing for concessions because of lower productivity of some workers. But business service operators are concerned that awards based instruments might force those wages too high, resulting in a threat of a possibility that some of those enterprises could close down. 
Instead of setting a fair measure and, if necessary, providing assistance to those business services that would struggle to meet the benchmark, the government, in our view, has sought to pit some consumers against some service providers. Instead of proposing a user-friendly consistent guideline for wage setting, standard 9 offers employers an unclear choice. I will quote from the Disability Services (Disability Employment and Rehabilitation program) Standards 2002:
This pro rata wage must be determined through a transparent assessment tool or process such as the supported wage system (SWS) or tools that comply with the criteria referred to in the Guide to good practice: wage determination, including compliance with relevant legislation, validity, reliability, wage outcome and practical application of the tool.
On the one hand employers can use the SWS, a tool designed for use in open—that is, not supported—employment in conjunction with awards. On the other hand, the government directs employers to the Guide to good practice: wage determination, which is not a simple check list but a 25-page document, which concludes that:
No single model for wage determination currently in operation represents best practice.
That is on page 2 of that publication. The consultant who produced the Guide to good practice: wage determination also recommends the development of guidelines for a nationally consistent wage determination system. In a parallel process to all of this, the government is currently finalising just such a national wage assessment tool for people with disabilities but it has not sought, at any stage, to incorporate that new tool into the new standards for business services. According to the minister's office, the consultants hired to develop the new wage assessment tool will deliver their report by December of this year. We understand the tool will then be trialed for approximately three months in a select group of business services. In talking about the new assessment tool, the Department of Family and Community Services says:
... be based on the existing SWS, Supported Wage System tool, used in measuring employee productive capacity in open employment but adapted to the supported employment environment.
Disallowance of standard 9 would force the government to wait six months before reintroducing it, which is enough time to redraft the standard and incorporate the new national wage assessment tool—providing the three-month trial is successful and the tool is acceptable to the industry.
We do not move a disallowance motion of this kind lightly. We believe very strongly in the quality assurance process that is now in place following the passage of the legislation earlier this year. In fact, we have said in this place on a number of occasions that people employed in business services deserve to have no lower an expectation of their remuneration or their standards or conditions of employment than anyone else in the employment place. What we want is consistency, clarity and removal of any confusion. The feedback my colleagues and I have been receiving from people out there in the community within this specialised part of our employment sector is confusion. They are unsure as to what degree the current standard 9, as is provided in that package, will affect any new tool coming along. The government have not announced how—should the new tool currently being developed on their behalf be acceptable and be the answer to the question—it will be incorporated into the package of standards when it becomes available. I hope the minister at the table, the Minister for Family and Community Services, can clarify that for us. 
The bottom line as far as we on this side of the House are concerned is quite simple: the people employed in business services deserve every opportunity possible to continue that employment; the quality assurance process is a good one only if it works and only if it guarantees that any collateral damage—for want of a better term—to the sector and the people employed within it is kept to an absolute and bare minimum. Any business service that fails to gain accreditation by the end of December 2004 will cease to receive Commonwealth funding for employment services for these people. That means it is probable that those business services will close, so the employees within them will lose not only their employment but also the social community in which they interact each day of the week. They will therefore become clients of state and territory disability services, which is a completely different funding game.
We have endorsed and supported the quality assurance work the government have done so far in this sector, but we have made it very clear that the parameters we set are that it will work only if the intent is honest and true and the resources are made available to ensure that the collateral damage I refer to is almost non-existent. I do not want to see one person more than necessary—in fact, I do not want to see one—who is currently employed in a business service in this country lose their spot because of some legislative outfall from this procedure. We have made that very clear all along. The wage assessment tool is the most contentious within the sector—there is no doubt about that—but it is also one of the most important, because it is the method by which people are judged as to the remuneration they receive when they work in these business services. It must be clear, it must be acceptable and it must cause no confusion for the employers.
It has been admitted that the current process involving standard 9 is probably inferior to what is required. For a package of standards to go through both chambers with an inferior important piece within it is a worry; and it is a worry whilst the government admits it is out there trying to create a better piece of wage assessment. We are trying to remove standard 9 from this package—we are not doing so to stop the progress of the standards; the rest have gone through and we are happy with that—so that, in six months time, a proper, considered, assessed and ticked-off standard 9 can be incorporated following the work the government has contracted to. That is the reason we are doing it. We are passionate about it because we believe very strongly that the people employed in these services deserve every amount of encouragement and support they can get.",REPS,<title>DISABILITY SERVICES STANDARD</title>,<title>Disallowance Motion</title>,Miscellaneous,10,1,speech
"King, Catherine, MP",ALP,2002-11-13,"—The Labor Party voted to support the Disability Services Amendment (Improved Quality Assurance) Bill 2002 because it is consistent with our principle that everyone, including those Australians with a disability, deserves the right to fair wages and decent employment conditions. In supporting the bill, though, we believed the real test for the government would be in how it was implemented, what assistance was given to disability services to adapt and how the new quality assurance standards worked on the ground. I have to admit that I have been somewhat sceptical about the government's ability to implement the bill, particularly given the breadth of change required and the limited amount of funds the government is providing to assist, but I have been prepared to see how the implementation goes, to consult with my local disability services and to take their advice. They tell me that, at the first test, the government has them very worried.
The first set of standards we have before us, which relate specifically to organisations providing supported jobs and rehabilitation, is good. The standards package attempts to incorporate into disability employment services principles of workplace transparency, self-development skills, skills development, privacy and good service. I believe the standards are headed in the right direction and will see significant improvements in employment services. However, there are many in the sector—including services in my electorate such as McCallum Disability Services and Ballarat Regional Industries— that are concerned about the potential loss of employment places if workplaces fail to meet the new standards. Business services must be provided with maximum certainty and clear and workable guidelines in implementing the standards. 
The difficulty we and many in the sector have is with standard 9, which deals with employment conditions and specifically the setting of wage rates. Standard 9 falls far short of what the disability employment sector expected. The setting of wage rates and its subsequent impact on the viability of business services is the area of greatest concern for the sector. Business services have indicated their willingness to change, and in fact there are many good examples in the sector where wage setting tools have already been developed. But standard 9 tells business services they have a choice to use either the supported wage system or any other system that they can devise so long as it complies with the Guide to good practice wage determination, which in reality is of no practical assistance.
At the same time, the government has let a contract to develop a national wage assessment tool for people with disabilities. I understand that the consultants are to provide their report in December this year and that the tool is to be trialed for three months in a selected group of business services. It seems somewhat odd to me that government would set a standard—which in reality provides no guidance to the sector as to how to implement it—then require the sector to go down the path of implementation and then, several months later, change the goalposts by providing a national wage assessment tool which, if accepted by the sector, may provide some leadership in the setting of wages. The issue of wage setting goes to the very heart of the viability of business services and their capacity to offer continued employment to some 15,000 people currently in their employ.
In my electorate, McCallum Disability Services and Ballarat Regional Industries are extremely concerned. They accept the need for change. They are active members of ACROD and they have demonstrated significant good faith and participated in meetings with Department of Family and Community Services staff and the minister's advisers to make sure that the standards are workable. But with standard 9 they are concerned that they are being set up to fail. Both services have a long history in Ballarat. Like most business services, they started from a philanthropic base and provide far more than just employment to their work force. They will freely admit that there are problems; many of their workers are not backward in coming forward with these, particularly in relation to wages and employment conditions.
The government must provide certainty to business services. But instead of smoothing the way for reform, standard 9 is creating confusion as to how determine a fair rate of pay for people with disabilities. With the limited amount of funds available to employment services to adapt to these changes, along with the government's failure to grapple with the issue of waiting lists for rehabilitation services or to provide significant growth funding to these services and its apparent inability to show leadership in relation to developing a standard that provides clarity for businesses services across the country in relation to a fair wage system for people with disabilities, I remain concerned that the sector is being set up to fail. Therefore, I am pleased to second the motion moved by the member for Canberra.",REPS,<title>DISABILITY SERVICES STANDARD</title>,<title>Disallowance Motion</title>,Miscellaneous,10,1,speech
"Anthony, Larry, MP",NP,2002-11-13,"—I thank the speakers who have participated in this debate. From the outset I inform the House that the government will not be supporting the opposition's move for disallowance of standard 9—which would not come as a surprise to the opposition. From a personal point of view, before I became an MP I had a fair amount of dealings with disability services. For quite some time, in a voluntary capacity, I was a director of a disability service, and I know the huge challenges that they face. The whole sector has been going through many changes over the last couple of years, and in that regard I acknowledge the comments from other speakers.  
The standards that we are debating are about delivering guaranteed minimum service levels for people with disabilities in all Commonwealth employment services. Indeed, the Commonwealth-state disability agreement—when it is finally ticked off— will provide a substantial increase in Commonwealth funds for employment services, from about $1.2 billion to about $2 billion. We are making enormous financial commitments. We also want to ensure that there are adequate standards and the best possibility for adequate pay for people involved in the disability sector. Disability employment services must meet the standards that we are talking about by 2005. It is not happening tomorrow; it is a considerable time off.
The standard that is the subject of the disallowance motion today ensures that each person with a disability enjoys working conditions comparable to those in the general work force. The key performance indicator of this standard will be the payment of fair wages to all employees. There are a number of methods available, which are already being used, to assess wages in disability employment services. There is, however, no single tool suitable for both open and supported employment—that is what the debate is about today—which is not surprising, given the significant differences between the two types of services. Open employment provides jobs for people in workplaces that have a mix of employees, whereas supported employment is often provided in business services—previously known as sheltered workshops. In the business services workplace, tasks may have been specifically designed for people with severe disabilities and there may not be able workers without disabilities doing these specific tasks. Therefore, we do not wish to mandate a particular wage assessment method for all service types. However, we are working with the sector to develop a new national wage assessment tool that will meet, along with existing tools, the requirements of standard 9 for business services.
If standard 9 is disallowed, it is our view that there will be no standard for wages and conditions for any employment services. This means that employment services may be certified for Commonwealth funding without being required to pay fair wages. The industry sector has told us that they need a new wage assessment tool in order to make standard 9 work effectively. We are in the final stages of developing a new wage assessment tool. It will be available to the industry by early next year. A new wage assessment tool is needed so that services can prepare themselves in time to pay award wages in order to receive certification by December 2004. Employment services that are not certified by this time will not be funded from 2005—and I acknowledge the comments made by members of the opposition. The existing supported wages system does not work satisfactorily for most business services because it has been based on a productivity comparison between an able-bodied worker and a worker with a disability in open employment doing exactly the same job. Independent evaluation of the supported wages system in 2000 found that it was not necessarily suitable for all business services, especially where there are clients with high support needs.
The peak disability employment service, ACROD, has made it clear that the requirement to pay award based wages will be a challenge for many business services. However, ACROD also believes that the new system—that is, standard 9—will ultimately provide better outcomes for people with disabilities. That is the bottom line. Standard 9 deliberately does not specify any particular tool; rather, it specifies criteria against which the tool can be assessed and includes the supported wage system as an example. The new tool will meet these criteria; however, it will not be compulsory, as a number of leading businesses are already paying award based wages using different wage assessments tools that could easily satisfy the standard.
—That is fine.
—That is fine—I acknowledge the comment by the member opposite—so long as they are transparent and they are paying against an award. Employment services and auditors have been given detailed guidelines that were developed against all the proposed standards and key performance indicators. We have provided advice and help from a number of different kinds of services on what does and does not work. However, to ensure consistent and accurate interpretations of both the standards and the performance indicators, the department has funded a training course for auditors. 
The landscape of disability employment services is changing, and I think all of us agree it is changing for the better. People with disabilities, their carers and families will now have confidence in the quality of the employment services they choose. They deserve no less. The government supports all workers having the same basic rights and conditions. We certainly will not back down from that. We have come up with a legislative framework that gives disability employment services a new way of doing business and gives their clients a new confidence. I am sure history will record standard 9 as a defining moment in the ongoing call by people with disabilities for a fair go. To disallow standard 9 would be to disallow people with disabilities a fundamental right—the right to be treated the same as everyone else. Therefore, we will oppose the opposition's motion for disallowance of standard 9 of the disability services standards and we will work with the sector.
Question put:
That the motion (Ms Ellis's) be agreed to.",REPS,<title>DISABILITY SERVICES STANDARD</title>,<title>Disallowance Motion</title>,Miscellaneous,10,1,speech
