name,party,date,text,chamber,debate_title,subdebate_title,debate_type,debate_id,subdebate_id
"Gillard, Julia, MP",ALP,2002-12-12,"—This bill was introduced into the House on 13 March 2002, and here we are many months later finally debating it. Earlier in the year, the bill was referred to the Senate Legal and Constitutional Legislation Committee for inquiry and report by 15 May 2002. The amendments the government has circulated to this bill arise from the recommendations of that Senate committee, and Labor welcomes those changes. 
I will turn firstly to the contents of the bill. The bill makes the following changes to the Migration Act. First, the bill clarifies the immigration status of non-citizen children born in the migration zone—that is, born on the Australian mainland or born in non-excised parts of Australia. Obviously, children are born in Australia to non-citizens who are here in a variety of circumstances, such as on a tourist visa, a temporary entry visa, a student visa and the like. Children can also be born to non-citizens who are not immigration cleared. This applies to detained persons, including asylum seekers, who have not been taken to be immigration cleared until their claim has been processed and a visa has been issued. 
Under the current Migration Act, there is no specific provision as to the immigration status of a child born in these various circumstances. Conceptually under the act, a child who is born to a person here on a valid visa is not immigration cleared and would not be immigration cleared until separately processed. Clearly, as a matter of practice, there are not separate immigration clearance procedures for newborn babies, and the child is assumed to have the same status as his or her parents. This amendment clarifies this matter by providing that, at the moment of birth, a child is immigration cleared if a parent was immigration cleared on last entry into Australia. Put simply, if a parent is immigration cleared and lawfully here, the child will be seen, by virtue of this amendment and as a matter of law, to be immigration cleared and lawfully here as well. If a child is born to a person who does not hold a substantive visa and who has not been immigration cleared, such as an asylum seeker in detention, this amendment provides that the child is not immigration cleared and the child's immigration status will then be dealt with in a substantive visa application process.
Second, the bill clarifies issues relating to the cancellation of special purpose visas. Special purpose visas are used for classes of individuals, such as aircraft crews, crews of visiting vessels and members of foreign armed forces visiting for the purposes of exercises or training. Given that a person qualifies for a visa because of his or her membership of the relevant class of person, if information comes to light about the undesirability of a particular individual within that class, it is necessary to have a process to cancel the visa and to cancel it expeditiously. Currently, section 33 of the Migration Act provides that the minister may cancel such a visa if it is undesirable for the non-citizen holder to travel to and enter Australia or remain in Australia. The visa ceases to be in effect at the end of the day on which the declaration is made.  
It is not clear under the current act whether or not the rules of natural justice apply to such a cancellation and, consequently, whether the individual has a right to be heard in these circumstances. The bill makes it clear that the rules of natural justice do not apply to such a visa cancellation and that the person involved has no right to be heard. This is a sensible clarification. Australia does not owe hearing rights to non-citizens in such circumstances. In addition, there are considerable logistical difficulties with offering such hearing rights to individuals, such as seafarers who may have deserted vessels. The amendment also provides that the declaration to cancel the visa comes into effect immediately.
Third, the bill deals with restrictions on bridging visa holders for onshore applications for visas. Section 48 of the Migration Act provides that a person who has been in Australia and who has made an application for a visa and been unsuccessful can then apply for only a limited number of visa types. This is obviously to prevent people lodging countless applications specifically to remain in the country. There has been some avoidance of the intent of this provision. Specifically, people are travelling overseas a short distance—for example, to Auckland—and then returning and seeking to make a whole new round of onshore applications. The bill proposes to stop this practice by providing that, for the purposes of this section, a non-citizen holding a bridging visa who leaves and re-enters the migration zone is taken to have been continuously in the migration zone despite that travel. It should be noted that, through the amendments the government has circulated to this bill, there is a clarification that the force of this provision does not prevent a person on a bridging visa from lodging a visa application offshore.
Fourth, the bill deals with the imposition of strict liability for people-smuggling offences. Section 233(1)(a) of the Migration Act makes it an offence punishable by imprisonment for 10 years and/or a fine of 1,000 penalty units to participate in `the bringing or coming to Australia of a non-citizen under circumstances from which it might reasonably have been inferred that the non-citizen intended to enter Australia in contravention of the Migration Act'. The provision says nothing about the state of mind of the accused in relation to the circumstances under which the non-citizen is brought to or comes to Australia.
As part of the post Tampa raft of legislation passed by the parliament in September 2001, the Migration Legislation Amendment (Application of Criminal Code) Act 2001 came into effect. The act added the following third point to the matters that the prosecution has to prove in any prosecution under section 233(1)(a) of the Migration Act:
... the accused was aware of a substantial risk that the non-citizen intended to enter Australia in contravention of the Migration Act and, having regard to the circumstances known to him or her, he or she was not justified in taking that risk.
The application of the criminal code act was not meant to change the nature of offences. The explanatory memorandum of that act stated that the relevant offences would continue to have the same meaning and apply in the same way they did prior to the application of the criminal code. This bill therefore corrects the anomaly which arises because the application of the Criminal Code has had an unintended effect. Prior to the government's amendments, the bill also dealt with the application of strict liability to section 241(1) of the Migration Act, which deals with offences in relation to de facto spouses. This provision is not being proceeded with at this stage, largely as a result of recommendations from the Senate legislation committee. The government has indicated its intention to draft a clearer provision and to include it in future legislation.
Labor supports these changes to the Migration Act and therefore supports this bill. But, given the non-controversial nature of this bill, the principal debate before this House is not about the technical provisions which I have spoken about; it is a debate about children in detention which arises squarely from the amendments that have been circulated by me, which I will move and which the member for Gellibrand, in her capacity as Labor's shadow minister for children and youth, will second at the consideration in detail stage. These amendments, if adopted, would amend the power to detain under the Migration Act so that the government would be compelled to do two things. First, it would be compelled to place unaccompanied children into appropriate foster or community care arrangements rather than hold such children in high-security detention facilities like Woomera, Baxter, Port Hedland, Villawood, Maribyrnong and the like. Second, it would compel the government to rehouse children who are currently here with their families in high-security detention in accommodation like that used for the alternative detention trial at Woomera. 
I think it is necessary to draw the attention of the House to some of the details of that trial. I have seen it. That government trial consists of four ordinary houses in which women and children have been allowed to live—that is, male family members have been excluded. It is a group of four houses on a block. The arrangement is secured in two senses. First, one house is allocated for security staff—that is, it is staffed 24 hours a day by guards who maintain a continuous security presence in the facility. Second, the perimeter of the block around the four houses is secured by a light beam which, if broken, sounds an alarm. In question time yesterday, the Minister for Immigration and Multicultural and Indigenous Affairs implied, in my view, that these facilities were not secure. That is simply not the case. On the issue of security, you do not have to take my word for it. It would be better to look at the scoreboard, which shows that no-one has ever absconded from the alternative detention trial at Woomera. That is a situation we can contrast with the Woomera detention facility itself, where absconding has become a matter of routine. So the alternative detention trial houses are secured by guards and a light beam at the perimeter. No-one has ever absconded. That is not true of other high-security facilities like the Woomera facility itself.
It should also be noted that Labor's amendment would compel the government to house whole family groups in this kind of accommodation, including male members such as fathers and brothers. So far, under the government's trial, that has not occurred and the trial has been limited to women and children. As I have said in this House before, and as I have conveyed in writing to all members of this House, there is no credible argument against Labor's amendment. There can be no argument for detaining unaccompanied children in high-security detention. I think we need to remind ourselves in this debate that at one point, under the Howard government, there was an unaccompanied eight-year-old in Woomera. There is no argument for not housing families in accommodation like that of the Woomera alternative detention trial. As I said, I have seen it. The nature of that detention is clearly better for families than being in high-security compounds like Woomera. In truth, no argument about absconding and security exists. Once again, do not take my word for it. That this model would be an adequate way to house families, including fathers and teenage sons, has been endorsed by the minister's own hand-picked Immigration Detention Advisory Group.
Why are these amendments before this House today? This is a further and important step in Labor's yearlong campaign to free children from behind the razor wire. This campaign started on Australia Day, when our leader, Simon Crean, the member for Hotham, called for children to be freed in his Australia Day address. It is a campaign we will continue, and it is a campaign which has already met with some success. Last week in this House the minister for immigration made a major ministerial statement about children in detention. In using the word `major', I am taking a little bit of licence. It was a very lengthy ministerial statement, but when one studied it in detail there were actually three paragraphs that related to the question of children in detention. Nevertheless, those three paragraphs are important. Those important three paragraphs provide that the migration series instructions which guide the work of departmental officials in relation to detention and other matters will be changed so that unaccompanied children are not held in high-security detention facilities. Instead, the standing directive will be to, if possible, move them to foster or community care arrangements. 
The other change contained in the ministerial statement was that the Howard government would seek to negotiate with the South Australian government, the Rann Labor government, to access further housing stock which would enable it to house women and children in accommodation like that used in the Woomera alternative detention trial. Put simply, the ministerial statement last week was about getting unaccompanied children out of detention and about seeking an agreement with the South Australian government to expand the Woomera alternative detention trial, but under the same conditions that that trial is currently used, meaning that it would not include male family members—certainly not adult males, in terms of fathers, and not teenage boys.
Why was that statement made at all? One is entitled to ask that question. The answer is—and this is a matter of public record; any cursory scanning of the newspapers over the past week or so would verify this—that the ministerial statement was made only because it was clear that a number of Liberal moderates had advised the minister for immigration that they would vote for Labor's amendment, which I have outlined today, unless the government moved on the question of children in detention. Amongst the names one sees in the newspaper—and perhaps there are some more Liberal moderates; I do not want to insult anybody by exclusion—are the member for Kooyong, the member for Cook, the member for Hindmarsh and the member for Pearce, who have been seen to run a campaign internally, threatening the minister that he would face the embarrassment of them crossing the floor and voting for Labor's amendment unless he moved on the question of children in detention. That is the only reason the ministerial statement was made last week: because of Labor's campaign to get children out of detention and because of the fact that this amendment was coming up before the parliament.
It is quite clear that Liberal moderates have forced this statement. They have forced it against the better judgment of the minister. The minister on 8 May this year, when asked about relaxing mandatory detention arrangements for women and children—asked about the very thing that he has now done—said this:
You're simply saying to people all you have to do is bring a child with you, turn up in Australia and you have obtained a migration outcome regardless of whether you have an entitlement or not.
—It is still relevant.
—The minister just verified that it is still relevant. What we know, therefore, is that the minister, in his perfect world, would not have made any changes to detention arrangements last week. He would have maintained high-security detention as the model for all comers—unaccompanied children, families with children, women with children and what have you—but he has been forced to move by Liberal moderates who have been shamed into moving by Labor's amendment. The minister has made a ministerial statement and has posited changes in detention arrangements against his better judgment. That is one thing we know about last week's ministerial statement.
The other thing we know about last week's ministerial statement is that it was incredibly rushed. The reason it only contains three paragraphs about the issue the ministerial statement was supposedly about, which is children in detention—in a sea of self-congratulation about its migration policy, there are these three paragraphs about children in detention—is that the government has not as yet come to an arrangement with the South Australian government about access to appropriate housing stock. I have been in this House since 1998; I understand that my period of service in this House pales into insignificance compared with the minister's. But, on the basis of my service in this House, it seems to me that one normally makes a ministerial statement when one has something to announce. It seems to me to follow—not to make too controversial a proposition—that you normally make a ministerial statement when you have something to announce. Minister Ruddock made a ministerial statement to tell us that he was having discussions about something he may or may not be in a position to later announce when he has come to whatever agreement he might come to with the South Australian government. 
So we know about the ministerial statement made last week against Minister Ruddock's better judgment. In terms of timing, it was made last week not because it was ready to go—because the government does not have any operative arrangements with the South Australian government—but because it had to beat into this place today's amendment. The whole thing was about making sure that Liberal moderates did not vote for today's amendment. So that is where we are.
The Minister for Immigration and Multicultural and Indigenous Affairs made reference in question time yesterday to Labor using our good offices to assist with discussions with the South Australian government. I assure the House and the minister that, if he requires Labor's assistance to help him with his workload as minister for immigration, we of course stand ready to assist. I have had a number of discussions with the South Australian government about matters related to Woomera, particularly matters related to children in detention. I have met in that regard with the minister for community services and with the minister for education. I am quite willing to keep assisting the minister with striking an appropriate arrangement with the South Australian government. One could not get a better offer of bipartisanship than offering to do the minister's work for him. We will of course in the coming months, if it is necessary, do what we can to assist this minister to put some content into his ministerial statement and to actually get some housing stock which can be used for the purpose that the ministerial statement says it will be used.
On the one hand, the ministerial statement made last week—despite the fact that it was rushed, that it would not have happened if it had not been for Labor's amendment and that it was made against the minister's better judgment—represents a major advance and a major change for this government. It is the first time in many years of pursuing an absolutely inflexible detention model, and of deriding as lunatic and in league with people smugglers anybody who suggested there should be flexibility in the detention model, that the government have taken a step forward and agreed with, or at least partially agreed with, the proposition that it is not a good thing to have unaccompanied children in high-security detention facilities and that it is not a good thing to have children, even in family groups, in high-security detention facilities. 
We welcome last week's ministerial statement as a step forward. It is a major backdown, given where the government have been. It stands against their rhetoric that any change in detention arrangements would be an opening of the floodgates. It stands against their rhetoric criticising, vilifying and branding as lunatic and as being in league with people smugglers anybody, whether they be from Labor or from refugee advocacy groups, who has the temerity to suggest that perhaps there is a better way for our detention arrangements. We welcome that.
The Liberal moderates, who I have no doubt are following this debate closely, need to think again about whether or not they are going to support Labor's amendment. I understand they have done a pretty remarkable thing—that is, they have got the minister for immigration to move on detention arrangements, and I am not underestimating how difficult an internal battle that would have been—but I say to those Liberal moderates: when we come to vote today, have a think about the following. These changes in detention arrangements arise from migration series instructions. They are not law. There is no compulsion. They are a guideline to direct activity. Minister Ruddock was good enough to correspond with me to indicate why he thought my amendment was not right. I have had cause to study that letter quite closely. One of the reasons he thinks his ministerial statement is better, and that my amendment is not appropriate, is that he wants to maintain a fair bit of discretion in this area. He says in his letter to me things like:
Rather than simplifying decision-making processes, as Labor professes to support, your proposed amendments would introduce blanket requirements that would remove my discretion in deciding on the most appropriate place of detention for certain unlawful non-citizens. 
Too right it would; absolutely. That is what it aims to do. It is aims to ensure that, in terms of a compulsion under the law, the minister has no discretion to determine where kids get held. It is not a question of discretion: will I place this unaccompanied eight-year-old in line with the migration series instructions or will I exercise my discretion in some other way? It is supposed to take away that discretion. We want to take away that discretion, because we want to be absolutely certain that there will never again be a time in this country when there will be an unaccompanied eight-year-old in Woomera. That is why we want an amendment to the Migration Act. Minister Ruddock wants to retain some discretion. Why? We know he does not actually believe in the detention changes he announced last week.
—We know why that occurred with the eight-year old. The eight-year-old was with family and the view was that it was quite inappropriate to take the child away from the family.
—I am coming to the question of whole family groups in a minute, Minister, so it is useful that you have raised it with me. This letter verifies that the minister wants to retain some discretion. I ask the Liberal moderates who have fought hard for this change: how certain are you that it is going to be effective when it does not have the force of law? How certain are you that it is going to be effective when the principal argument the minister puts against it is that he still needs some discretion? That is point 1. Point 2, in terms of the Liberal moderates who are going to vote for Labor's amendment, is that our amendment deals with whole family groups. In the interjection from the minister, he indicated that there is an issue about separating families. We do not think you should separate families. Our amendment deals with whole family groups. It does so deliberately.
The member for Lingiari is in the chamber and, with the constituency he represents, he would know this better than I. This nation has learnt, to its very great cost, what one can do if one separates families—and particularly if one separates children from parents—and what even people of goodwill can do unwittingly. A lot of the stolen children generation occurred because people of goodwill acted unwittingly. Not all of them did, but there was a component of that. We know the terrible misery that can be inflicted, generation after generation, if one smashes up family groups. That is why Labor's amendment deals with keeping family groups together.
I would say to Liberal moderates, who are the kind of people who would have shed tears watching the Bringing them home video and reading the Bringing them home report and who would worry about the scar on this nation's soul and on some of its people from the stolen children generation: if you believe, as I do, that a father has a right equal to that of a mother to be with children and that a brother's participation in a family is as important as a sister's then you must support Labor's amendment. The ministerial statement of last week does not give you that; it does not give you whole family groups. It does not put fathers with families. It does not put brothers with families. If you care about that then you need to take the extra step, come in here at voting time and vote for Labor's amendment. I cannot put that point too strongly. It seems to me that everything we know from human experience is that, if you can keep families together, you should.
The Prime Minister is on the record—in quite a different context: over the use of IVF technology for women without partners, and particularly women who are lesbians—as having put the view that his model, his image and his ideal of a family group means having a mother and a father. If he believes that, why would he have a detention policy that does not reflect that? Labor's amendment does. I say to those Liberal moderates, `I know you have already done a lot of work, I know you have done it against opposition, I know that it has been difficult and I know that there has been advance, but there is more work to do, and that work can only be done by voting for Labor's amendment.' This will not end today. Today, in this House, we will support our amendment. I anticipate that even if some Liberal moderates cross the floor we will be defeated. We will support our amendment in the Senate. I anticipate that in the Senate, with the support of the minor parties, we will carry it. We will bring it back to this House and we will support it again.  
So we are saying to Liberal moderates, `Understand this: you are embarking on a path where every few months between now and the next election you will have to decide, as a matter of conscience, yet again, whether or not you are going to support Labor's amendment.' I am sure that the minister will say parts of this bill are urgent, parts of it are vital and they have to be dealt with now. They are largely technical amendments but, if there is any part of this bill that that argument truly applies to, then I will move it as a private member's bill and Labor will vote for it. So if there is any part of it that you need urgently, let me know. I will move it as a private member's bill, Labor will vote for it and you can have it. But you cannot have this bill in total until you vote for Labor's amendment to get children out of detention. You will face that choice routinely over the coming few years. (Time expired)
Debate (on motion by Mr Randall) adjourned.",REPS,<title>MIGRATION LEGISLATION AMENDMENT BILL (NO. 1) 2002</title>,<title>Second Reading</title>,Bills,20,1
