name,party,date,text,chamber,debate_title,subdebate_title,debate_type,debate_id,subdebate_id
"Irwin, Julia, MP",ALP,2002-12-12,"—Good morning, Mr Speaker. The Sex Discrimination Amendment (Pregnancy and Work) Bill 2002 is probably the best example of a Clayton's amendment that this House has ever seen. It is the amendment you have when you are not having an amendment. The bill is the government's response to the Human Rights and Equal Opportunities Commission report Pregnant and productive: it is a right not a privilege to work while pregnant. The report was commissioned by the Attorney-General in August 1998 and the report was required nine months later, in June 1999. As it was, the report was overdue and was finally delivered in August 1999. After a pregnant pause of nearly three years, mother and baby are not doing well.
The report made a total of 46 recommendations, and 11 of those called on the Attorney-General to amend the Sex Discrimination Act in various ways. Out of the 11 recommendations only three are covered by this bill, and those three changes are largely cosmetic. They are only intended to make the act clearer to employers and employees. You might say that they are like the cream to hide the stretch marks, rather than dealing with the health and wellbeing of mother and baby. I should add that the three areas addressed in this bill are ones where there is a great deal of misunderstanding. Any attempt to clarify these issues is welcome. But the remaining eight recommendations that the Attorney-General has chosen to ignore cover issues which actually extend the rights of pregnant women and adoptive parents. I will come back to those issues later.
Firstly, looking at the recommendations addressed by this bill, I should begin by saying that many cases of discrimination arise out of well-intentioned acts of employers and service providers. They may have acted in what they thought would be in the best interests of the mother—and that in itself would appear to be the cause of many examples of misunderstanding of the act. Making provisions of the Sex Discrimination Act crystal clear to employers and service providers is a welcome and much needed measure.
In the report of the national pregnancy and work inquiry, the Human Rights and Equal Opportunity Commission exposed some alarming figures for employer awareness of equity and discrimination issues. It found in a survey of private sector employers in the Perth area that, while 81.2 per cent of employers of large businesses knew that discrimination on the grounds of pregnancy was unlawful, only 62 per cent of small business employers were aware of that; and in the retail sector—the largest employer of women—only 59.4 per cent of employers were aware. It is quite alarming to think that at the time that survey was conducted in 1998 only three out of five employers were aware that discrimination on the grounds of pregnancy is unlawful. Some 14 years after the Sex Discrimination Act was passed, only three out of five employers were aware of their responsibilities under the act. And the report also indicates that while those three out of five were aware of the overall requirements, there was considerable misunderstanding of how they should be applied.
The report suggests a total of 41 guidelines in plain English and with case studies in order to allow better understanding of the act as it applies to pregnancy. You should not have to be a lawyer to have a basic understanding of how to avoid discriminatory practices in your workplace, but I do not want to suggest that, if it is all too hard, then let us do away with it altogether—let us not throw the baby out with the bath water. Rather, it is better to clarify the act to ensure that it is more likely to be complied with. An understanding on the part of employees is essential if they are to exercise their rights.
Looking at the changes proposed in this bill, item 1 in schedule 1 of the bill changes the definition of sex discrimination to include breastfeeding and the act of expressing milk. This change is in response to recommendation 43 of the report, which calls on the Attorney-General to make sure that breastfeeding is a ground of unlawful discrimination. I would have thought that this was covered in the original act, but now it is clearly stated and leaves no doubt that matters relating to breastfeeding are included as unlawful discrimination. This is an important provision of the act and an issue which over time has seen community attitudes evolve from recognition to acceptance. The development of practices and facilities to allow nursing mothers to enjoy the full range of employment and social activities is a welcome change. The days when nursing mothers were sent off to the ladies toilet to feed an infant are thankfully rare now. But that does not apply everywhere. I have always thought it strange that people who thought you should feed a baby in a toilet would never consider eating their lunch in one. I realise that there is much more to the issue of discrimination when it comes to breastfeeding and that smaller employers and service providers face challenges when meeting their responsibilities in this area. But with the benefit of a clearer understanding of their responsibilities, I believe that a commonsense approach can satisfy all parties. 
The second area covered in this bill again seeks to provide a clearer statement of the requirements of the act. Recommendation 36 of the report of the National Pregnancy and Work Inquiry recommends:
That the Attorney-General clarify section 27 of the Sex Discrimination Act 1984 (Cth) by the insertion of a specific provision that prohibits the asking of questions (whether orally or in writing) which might reasonably be understood as intended to elicit information about whether or when a women intends to become pregnant and/or her intentions in relation to meeting her current or pending family responsibilities.
The explanatory memorandum to the bill points out that this is most commonly applicable in employment recruitment situations. However, it is not limited to employment. The examples given in the explanatory memorandum describe situations of applying to lease rental property and an applicant for a bank loan. With the changes, it should be crystal clear that anyone responsible for recruitment, letting property or handling loan applications—and I would think many other similar transactions—is prohibited from asking questions that may be used to discriminate against a person on the basis of their sex, pregnancy or potential pregnancy or marital status. There are no ifs or buts; asking the question breaches the act. It is not a matter of saying, `I wasn't going to use the information.' Why would you ask in the first place if you were not going to use the information?
I hope that this amending legislation makes it crystal clear—and, short of drawing a picture, it could hardly be made clearer—that this part of the Sex Discrimination Act needs to be widely understood and enforced. But, before I go on to the third change, it is worth going back to the figures I mentioned earlier in relation to the awareness of the requirements of the Sex Discrimination Act. When two out of five employers do not even have a basic understanding of the act and for those who have a basic understanding it is necessary to clarify many issues, you have to ask whether greater effort needs to be put into getting across to businesses their responsibilities under the act. Clarifying parts of the act is one thing, but getting the message through to all parties is even more important.
The third change is to subsection 27(2) of the act. There is in the act an exception to the prohibition on requesting information that allows the provision of medical information concerning pregnancy. This is included for occupational health and safety reasons. I have noted that under the recommended guidelines No. 26 in the report states:
... while it is appropriate to ask a pregnant job applicant to undergo a medical examination, any such medical examination should be undertaken with a view to addressing occupational health and safety concerns and should not in itself lead to, or exacerbate, discrimination on the grounds of pregnancy.
It occurred to me that perhaps an additional guideline might be to restrict access to the results of medical testing where the result has no bearing on any occupational health and safety issue that may otherwise influence the employment decision. This would ensure that the employer did not discriminate against the applicant, as the decision to inform the employer of the condition would be made by the medical practitioner on the basis of occupational health and safety concerns. I would also point out that in the explanatory memorandum, in paragraph 4 of page 4, the example refers to a pregnant employer, which I take it should be a pregnant employee. 
So much for what is in the bill. As I said earlier, out of 46 recommendations of the report, only three are acted upon by way of this amendment and they are Clayton's changes: they do not change the act, they only clarify sections of it. Referring only to the 11 recommendations which are the responsibility of the Attorney-General, where is the amendment to empower the Human Rights and Equal Opportunity Commission to publish enforceable standards in relation to pregnancy and potential pregnancy as stated in recommendation 1? Where is the amendment to extend the coverage of the act to federal statutory employees, judicial office holders and members of parliament? Where is the amendment to ensure coverage of unpaid workers? Where is the amendment to remove the exemption of employment by an instrumentality of a state? Where is the amendment to remove the exemption contained in section 38 for educational institutions established for religious purposes in relation to pregnancy and potential pregnancy? I am happy to see the Attorney-General in the chamber now. I ask the Attorney-General: where is the amendment to the provisions in relation to the award of compensatory damages to enable the award of punitive damages?
All of these recommended amendments referring to the Attorney-General are still in limbo, sitting in the too-hard basket, waiting for another year or another Attorney-General. While we are dealing with a bill whose purpose is to clarify rather than change the act, why is it that recommendation 35 was not taken on board? In that recommendation, the report of the inquiry asked:
That Attorney-General amend the Sex Discrimination Act 1984 ... to make clear that a complaint about a discriminatory advertisement may be made under section 14(1)(a) of the Act notwithstanding that the complainant is not a person directly affected by the advertisement. 
While we are in the process of making amendments to clarify the act, why was that left out? This is a Clayton's amendment—it is the amendment you have when you are not having an amendment. When you need to be seen to be doing something, this is the very least you can do. Out of 46 recommendations of the report of the National Pregnancy and Work Inquiry, the Attorney-General takes action on only three. By contrast, Labor is moving amendments to this bill which will address 10 of the recommendations which fall within the responsibility of the Attorney-General. That seems to indicate that the Attorney-General has absolutely no idea of the extent of the problem of discrimination against pregnant and potentially pregnant women.
As a crude measure of the issue we should note that in 1998 there were 249,000 live births in Australia. In that year, there were 3.73 million women in the work force. When you compare these figures with those of five years earlier in 1993, a clear picture emerges of the relationship between pregnancy and work. In 1993 there were 260,000 live births—that is 11,000 more than in 1998—but there were 3.26 million women in the work force—that is half a million less than in 1998. Today women make up more than 44 per cent of the work force. The images of the male as the breadwinner and the female as the homemaker have long since passed their use-by date. The average age at which a woman has her first child has increased from 26.3 years in 1985 to 28.6 years in 1995. Clearly something is happening to fertility rates and to the make-up of the work force and the two are related. The report of the National Pregnancy and Work inquiry quotes the Australian demographer Professor McDonald as saying:
... if women are provided with opportunities near to equivalent to those of men in education and market employment, but these opportunities are severely curtailed by having children, then, on average, women will restrict the number of children that they have to an extent which leaves fertility at a precariously low long-term level.
The report concluded that:
The low fertility rate indicates a growing trend by women actually making a choice between work and family rather than seeking both. 
The report also quoted from a comparison of male and female managers, finding that in high technology companies two-thirds of female managers did not have children while two-thirds of male managers did. While I have drawn on this example, it is worth noting that workers in manufacturing, retail and personal services can expect the least family-friendly working conditions. All this paints a dismal background for pregnant and potentially pregnant women in the workplace. Women are showing their concern by choosing work ahead of family in increasing numbers.
I would have thought that one important thing that could be done would be to assist women to choose both family and work. One of the more obvious steps would be to address the widespread discrimination against pregnant women. For many women the answer to discrimination is: don't get pregnant. That is their choice, but it need not be. It is not by accident that Scandinavian countries have higher fertility rates than other developed nations. It takes more than the baby bonuses paid to parents who stay at home—it takes a change of attitude in the workplace. When women are protected from discrimination they are free to choose both family and work. It will take the enforcement of standards of conduct and the education of employers and employees as well as service providers to end discrimination. This bill goes just a very short part of the way towards achieving that. Only with the adoption of the remaining recommendations of the report of the National Pregnancy and Work inquiry will we come close to achieving fairness for pregnant and potentially pregnant women. Only then can we expect the issue of declining birth rates to be addressed. Only when women can confidently plan for both a family and a career will we have reached the level of equality that women for such a long time have fought so hard to achieve.
Debate (on motion by Mrs Moylan) adjourned.",REPS,<title>SEX DISCRIMINATION AMENDMENT (PREGNANCY AND WORK) BILL 2002</title>,<title>Second Reading</title>,Bills,65,1
"Williams, Daryl, MP",LP,2002-12-12,"—I move:
That the amendments Nos 1, 5 and 7 insisted on by the Senate be agreed to.
There have been some pretty extraordinary claims made by the opposition in this place about the government's position on this bill. Over the course of this year, while the government has been focusing on getting the bill passed, the opposition has shifted and changed its position and engaged in an exercise of rewriting history which has been second to none. In contrast to that of the opposition, the government's position on this bill has always been clear and consistent. We introduced this legislation because we believe and have always firmly believed that we need this legislation to give our intelligence agencies vital tools to deter and prevent terrorism. We have not wavered from this position and we continue to stand by it.
By contrast, the opposition has had as many different positions on the bill as there are days of the week. First they would not support the powers in the bill, despite the extensive amendments made by the government at the behest of the parliamentary joint committee, which included senior members from their own ranks. Then they sought to defer the debate on the bill to avoid taking a position, because there were significant divisions within their ranks. But, worse still, they then decided the power should be given to the police, despite the fact that the bill has nothing to do with law enforcement and everything to do with collecting intelligence. Then, sensing no doubt that the public had little time for their attempts to frustrate essential functions of the bill, they conceded that these powers should go to ASIO.
But what they propose to give ASIO is powers in a form that we say make them completely unworkable. Not only did all this toing-and-froing put the community at risk by delaying the passage of the bill but the opposition continued to seek to turn the bill into something that would not deliver the protection it was designed to achieve. I am patient, but even I reach a point at which I have to say enough is enough. For me, that point is where the bill no longer does what we have undertaken to the public that it will do, where it can no longer deliver on the promise of clearer powers to our intelligence services to gather intelligence to stop terrorist acts in circumstances where there is no acceptable alternative and where community safety is at risk.
The members opposite have preached long and hard about the things that the Labor Party will not wear. Apparently, they will not wear a system that would permit intelligence agencies to hold and question a person believed to have information about potential terrorist acts. They will not wear such intelligence gathering under a warrant issued by the Attorney-General, who is accountable to the people and the parliament and whose actions may be challenged in the courts. They will not wear a system where that warrant is approved by a federal judge or a retired judge and where the person is questioned in the presence of a senior member of the Administrative Appeals Tribunal or a retired judge. They will not wear a system where the person questioned has the right to a security-cleared lawyer, paid for by the Commonwealth. They will not wear a system where the person can complain to the Inspector-General of Intelligence and Security, who can sit in on the questioning. And more extraordinary still, they will not wear a coercive questioning regime with detention in the strictly controlled circumstances that we propose. Yet the parliamentary joint committee had no problems with that and the member for Brand, Mr Beazley, and Senator Ray appeared to accept our position. They quite eloquently made out the case for the government's regime last night and this morning.  
Let us not forget another level of inconsistency: the Labor Party's New South Wales counterparts have given the New South Wales Police the power to strip-search children between the age of 10 and 18 without a warrant where there is the threat of a terrorist act. The New South Wales Police will be able to search a person's premises and vehicles without a warrant—I repeat, no warrant. There is also no judicial oversight as exists in the government's legislation, just the authorisation of the police minister. Federal Labor has been willing to wear this without a murmur. The government can wear the bill but not the opposition's amendments. 
The opposition's amendments go to matters of fundamental principle that we cannot accept. The government will not pretend to the community that what has come out of the Senate will provide the kind of protection against terrorism that we know we need. We will not do that when we know the opposition's package of amendments effectively renders it useless in the emergency situations it is designed to address and open to challenge. The opposition has exposed itself as being hopelessly divided on this bill. The government has demonstrated time and time again our commitment to community safety, but we will not accept amendments that fundamentally change the nature of the bill. However, the government wants this vital legislation passed before Christmas. In the interests of getting the legislation through and giving the community the benefit of this protection now, we are prepared to accept two of the opposition's amendments. We do not do so lightly. The opposition has made much of the need for the inclusion of state judges as prescribed authorities. Legal advice on this point differs. However, on the basis that the opposition's advice maintains that, in the event the provision with regard to state judges is found to be unconstitutional, it would be excisable and thus would not render the entire bill unconstitutional, we are prepared to accept that provision. (Extension of time granted)
In addition, while we are firmly of the belief that the security environment we are living in is unlikely to change in the foreseeable future and that these powers will be needed for some time to come, we are prepared to accept the opposition's sunset clause on the bill. This will enable this parliament to give the community the protection it needs in the current heightened security environment, secure in the knowledge that these extraordinary powers will necessarily be revisited by the parliament in three years. These are concessions which we are prepared to make because we are committed to getting this legislation passed. We have demonstrated that commitment since the legislation was introduced. We have never wavered from that commitment. Now is the opportunity for the opposition to display a commitment to the security of the Australian people, to accept the government's offer and to support the bill.",REPS,<title>AUSTRALIAN SECURITY INTELLIGENCE ORGANISATION LEGISLATION AMENDMENT (TERRORISM) BILL 2002</title>,<title>Consideration of Senate Message</title>,Bills,67,1
