name,party,date,text,chamber,debate_title,subdebate_title,debate_type,debate_id,subdebate_id
"Andren, Peter, MP",IND,2003-06-25,"—As I was saying last night when I was so politely interrupted by the Speaker, we need a national fund similar to New Zealand's accident compensation scheme. That scheme provides cover for injuries no matter who is at fault and pays weekly compensation equivalent to 80 per cent of normal earnings, to a maximum of $1,300. The scheme pays for medical bills, rehabilitation, retraining, counselling, home and vehicle modification—any of the costs that arise from the injury itself.
It seems that, rather than embracing this sort of broad community contributory scheme, the government in its economic philosophy does not want to have any involvement in commercial activities. Yet I put it to the government that Medicare, in its existing state—heaven knows what shape it might be in down the track—provides a model for universal health coverage. I believe we also need a model for universal environmental health care. Indeed, a universal contributory scheme for this sort of insurance strikes me as the most economical way of delivering the maximum bang for the buck in payouts. As I said last night, at the moment in Australia the money is given to families in a lump sum, and the person may or may not survive for many years after that. Therefore, that money is wasted for the purposes for which it was intended.
Further, compulsory contributions from businesses, organisations and individuals and a tariff on petrol and licences specifically for motor accidents also help to fund the New Zealand scheme. Contrary to claims made last year by the government, New Zealand's scheme does not have out-of-control unfunded liability. Also, recent reforms have actually reduced the premiums and lowered the liability raised prior to those recent reforms. In return, except in cases of gross negligence involving criminal neglect, the injured may not sue for compensation to cover these damages, because their needs are provided for. More to the point, there is no need for individuals and groups to pay exorbitant prices for specific public liability cover. I know that this threatens both the insurance industry and the legal fraternity, but maybe it is time to address the wellbeing of all members of our community.
Over a year ago, on 3 June 2002, I put a motion on the Notice Paper which stated that this House should look at providing such a scheme, which is well within the constitutional powers of the Commonwealth. Part of that motion said:
That this House:
(1) recognises that there is no Constitutional impediment to Commonwealth regulation of insurance claims procedures and the magnitude of insurance claims;
(2) recognises that the Commonwealth has the power to prescribe conditions upon which any person may carry out insurance business of any kind and establish any mechanisms for the supervision of such person and corporations and to regulate their affairs, under section 51(xiv) of the Constitution; 
(3) recognises that the Commonwealth uses this power to regulate the Insurance Act 1973; the Life Insurance Act 1995 and the Insurance Contracts Act 1984;
(4) calls on the Commonwealth to order an inquiry by the Australian Law Reform Commission into the feasibility of a Commonwealth legislative scheme for the insurance industry ...
I think that would have afforded the necessary debate. It was never debated, but I believe it remains the only direct solution to the problem of providing universal and affordable insurance cover for all, especially those community groups in my electorate. As I said earlier in my speech, they continue to find it almost impossible in some cases to raise insurance. The proposal I have put up offers an alternative that absolutely ensures that those community groups—the show societies, fetes, jam stalls and so on—can continue to contribute in that social and very important community way, in particular, to the fabric of rural and regional Australia.",REPS,<title>TRADE PRACTICES AMENDMENT (PERSONAL INJURIES AND DEATH) BILL 2003</title>,<title>Second Reading</title>,Bills,5,1
"Hartsuyker, Luke, MP",NP,2003-06-25,"—I rise today to speak on the Trade Practices Amendment (Personal Injuries and Death) Bill 2003. One of the biggest issues presented to me very early in my term as a new member following the November 2001 federal election was the issue of public liability. Coming from an electorate with a heavy reliance on the tourism industry and on small business and where community groups are an absolutely vital part of our social fabric, the issue of the skyrocketing cost of public liability insurance premiums and the skyrocketing level of claims was something that was brought to my attention time and time again. Out in regional Australia, many of the services which may be provided on a commercial basis in the city are provided by community groups and not-for-profit organisations because of the small population. Deputy Prime Minister John Anderson came to my electorate and talked to members of the tourism industry very early in the term of this parliament about the very grave problems that they were experiencing. Fine attractions such as the Big Banana were seeing insurance premiums rise—in their case, from $39,000 to almost $140,000. There was a huge escalation in premiums but, for these businesses, because tourism is a very competitive industry, there was no ability to increase prices. What were businesses to do? In many cases, businesses were just unable to find any sort of insurance cover at all. People in the horse riding industry—we had a number of companies which operated various trail rides—were forced to cease operation. It was tragic to see the loss of employment and businesses being effectively closed down purely because of a lack of insurance cover.
I am pleased to say that the federal government acted to assist in this situation with a range of measures, which I will come to in a moment. I must also say that the states, to their credit, have cooperated in the process. This was always going to be a problem that needed to be addressed at both the federal and state level. If we had had the degree of cooperation in delivering drought relief for farmers that we have had with the states in relation to public liability insurance—and I see the Minister for Agriculture, Fisheries and Forestry at the table—we would have had a much better package for farmers.
—You are dead right.
—Yes. I would like to talk for a moment about what the federal government has done in concert with the states on public liability. The government has introduced a number of pieces of legislation. First there was the Taxation Laws Amendment (Structured Settlements and Structured Orders) Act 2002, the aim of which was to remove the barriers to structured settlements to encourage people to take an annuity rather than a lump sum. This was to avoid the problem that many who are seriously injured experience when they receive a major lump sum payout, where perhaps that lump sum is not invested wisely and ultimately they do not have enough to meet their increased medical needs and to support them during an extended period of disability. The structured settlements changes aimed to eliminate the prejudice within the tax system which favoured a lump sum rather than an annuity which would provide over the long term for the wellbeing of an injured person.  
Then there was the Commonwealth Volunteers Protection Act 2003. In the electorate of Cowper we are very dependent on a lot of good work by a lot of volunteer groups. The act exempts Commonwealth volunteers from liability. It was another important step. The third piece of legislation introduced by the government was the Trade Practices Amendment (Liability for Recreational Services) Act 2002, which focused on a very important principle: enabling people to take a higher degree of personal responsibility for their own actions. Where people are participating in an inherently dangerous activity—perhaps bungee jumping, skydiving or white water rafting—it is reasonable that people accept that there is a degree of risk involved and that, despite the best practices in the world, accidents and injuries can occur in those very risky activities. This act amended the Trade Practices Act to allow people to sign waivers to accept a degree of personal responsibility in participating in those activities. That was very vital in my electorate because we have a very heavily patronised white water rafting industry. Anyone who has ever been on a white water rafting tour would know that, whilst it is a very exhilarating experience, it is also quite risky, with a very real risk of incurring some form of injury. I have participated on a number of white water rafting expeditions and found the work force involved to be highly trained and professional. Despite that, there is an element of risk, and those amendments to the Trade Practices Act were a way that the federal government could assist in addressing those issues of risk—allowing people to still participate in those activities, but helping to solve the insurance problems which were being generated as a result of unrealistic expectations from some of the community that, when someone is injured, someone else has to pay. That was a very good move.
In my electorate, places such as the Pet Porpoise Pool were experiencing difficulties in getting public liability insurance. They had a very interactive show where people were able to pat the seals and dolphins. The problem was that insurers were running scared that people may be injured during an interaction with the wildlife. As a result of the reforms that have flowed through the system, the progression of reforms from the federal government and the reforms that have been put in place through cooperation with our state governments, the Pet Porpoise Pool—which was realistically looking at the possibility of closure—has been able to secure insurance cover and has been able to continue providing a lot of entertainment for people who visit Coffs Harbour. There are very good employment prospects for the people who work there. So this is the government acting in concert with the states to keep small businesses open.
—Dolphins do bite!
—Indeed they do bite, and it is a very real risk if you interact with animals. 
—I have been bitten by one!
—The member opposite has been bitten by a dolphin. The Trade Practices Amendment (Personal Injuries and Death) Bill 2003, which is before us today, is another plank in the government's reforms of public liability insurance. The bill proposes to remove the right to recover damages for injury or death caused by a breach of part V, division 1 of the Trade Practices Act, which deals with misleading and deceptive conduct, false and misleading representations, bait advertising, harassment, coercion and pyramid selling. This bill provides reinforcement and is another step in our program of reforms to improve the public liability insurance situation. It is part of our program to make sure that small businesses are still able to operate by being able to access insurance at a reasonable price in the marketplace. 
To her credit, Minister Coonan has been very proactive in this field. As part of the program, Minister Coonan in October 2002 released the review of the laws relating to negligence. It covered a range of issues, such as professional negligence, reform of the Trade Practices Act, limitation periods and reforms to assist not-for-profit organisations, limiting liability of public authorities, self-assumption of risk to override common law principles—which I spoke about earlier—proposals to restrict the circumstances in which a person must guard against the negligence of others, and the replacement of joint and several liability with proportionate liability. Minister Coonan has been very active in this area and, to her credit, we are seeing some real results on the ground. Justice Ipp had a number of things to say about the insurance problem and negligence laws. He said:
The fact is that insurance companies are not prepared to provide necessary insurance (or are only prepared to provide it at unaffordable rates) because of the unpredictability of the law, the ease with which plaintiffs succeed and the generosity of the courts in awarding damages.
I am pleased to say that the laws that this government has put in place and acted on are moving in the right direction, and I believe that we are starting to get on top of the problem. There are other factors relating to this issue—such as the disaster of September 11, the collapse of HIH and the fall in investment returns being received by many insurance companies. So it is not just about the issue of claims; there are also other factors within the insurance market: a fall in the capacity of the insurance market and a number of disasters, such as September 11, which previously were not costed into insurance premiums. They all absorb capacity for insurance in the market, making insurance more scarce and, as a result, forcing insurance premiums up. 
The Minister for Small Business and Tourism, Joe Hockey, has also been a very keen champion for small business and the tourism industry. He has been very proactive in those areas. Recently he came to my electorate and toured the coast. He called into a number of tourist attractions. I am pleased to say that, if it were not for the reforms that the government have put in place, I think those tourist attractions may not be operating today. I commend the actions of the government in introducing a range of reforms in public liability insurance. This latest amendment to the Trade Practices Act is another step down that road. I am pleased that we have been able to achieve a degree of cooperation with the states. My only sadness is that we have not been able to achieve the same degree of cooperation with respect to drought reform. If we could achieve that, we would be able to achieve a lot more in that area. We would be able to tailor packages to meet farmers' needs in a much more expeditious way. I think the impact of drought is a very vital issue in regional and rural Australia. A large part of the problem is being generated by the failure of the states to cooperate with the minister for agriculture, Warren Truss. I certainly commend this bill, and I certainly commend the work that the government has done in the area of public liability. ",REPS,<title>TRADE PRACTICES AMENDMENT (PERSONAL INJURIES AND DEATH) BILL 2003</title>,<title>Second Reading</title>,Bills,5,1
"Hunt, Gregory, MP",LP,2003-06-25,"—I rise to speak in support of the Trade Practices Amendment (Personal Injuries and Death) Bill 2003. This bill addresses a problem which I believe is common to representatives of every seat within the House. It is a problem that each of us has within our electorates. People have dedicated their working lives to creating small businesses or larger businesses which focus on adventure tourism and which provide opportunities for physical outdoor activities, such as horse riding, river rafting or rock climbing—activities which involve some form of inherent danger or risk. The very raison d'etre for their existence is that people consciously, wilfully and willingly choose to pursue activities which carry an element of risk—that is their attraction. It is about challenge and personal development. It is about pushing oneself to the edge within controlled circumstances. Each of us has experienced within our electorates, because of the changing nature of the international and domestic insurance market, many of these businesses facing potential closure. The reason for that is the level of personal liability and public liability insurance claims, either the cost of the premiums or the consequences of claims. This bill will address the problems of organisations such as the Ace-Hi Ranch on Boneo Road in my electorate of Flinders, many other horse riding organisations and many other small businesses which are focused on some form of personal challenge and adventure tourism.
In addressing this bill, I wish to proceed in three phases: firstly, to outline the background to the bill; secondly, to address its importance; and, thirdly, to consider some of the specific provisions. In looking at the background to the bill, we find that public liability insurance premiums have been rising greatly in recent years, in particular over the last two years. The Senate Economics Committee inquiry into the impact of public liability and professional indemnity insurance costs identified three principal causes of those increased premiums. Firstly, there was an external shock to the market due to the effects of September 11. It was a shock that resulted in approximately a $60 billion drain on international underwriting and the amount of money available for payouts, and—following the tragedy that was September 11—this shock had a ripple effect throughout the worldwide insurance industry.
Secondly, within Australia, there have been corporate collapses which have taken out major players from within the insurance industry, which in turn has closed the market and has led to a situation where it is much more difficult for those organisations and small businesses seeking public liability insurance to obtain public liability insurance. Thirdly, the hardening of the public liability insurance market has been caused by the level of claims. The nature and level of claims against public liability insurance have increased both in terms of the quantity of claims and the quantum of claims.
The Trade Practices Amendment (Personal Injuries and Death) Bill 2003 goes directly to the question of how we can ensure that there is a reasonable and proportionate level of claims in relation to personal liabilities and injuries—not a level which creates a lottery mentality and a condition where those who have an injury will actually profit from their injury. That is what is driving out small businesses and closing non-profit community organisations and preventing them from carrying out activities. The increasing cost of claims is the specific target of this bill.
This bill is designed to address the cost and availability of public liability insurance. It encourages the states and territories to reform the law of negligence in a nationally consistent manner. It is important to recognise that the bill is part of an overall agreement—brokered between the Assistant Treasurer, Senator Helen Coonan, and the respective state finance ministers—whereby the states will adopt a more regimented negligence policy and steps will be taken at a federal level. The aim of this agreement is to close off a lacuna or an unexpected loophole within the federal Trade Practices Act. This loophole was being exploited by those who would seek to secure additional avenues and grounds for making personal injuries claims. 
In the May 2002 ministerial meeting on public liability insurance, which was attended by Commonwealth, state and territory ministers, a series of agreements were reach-ed, including the agreement to conduct a review of the law of negligence. The finding of that review was that the existing set of laws both at state and at national levels was inadequate to cope with the changed circumstances brought about by the international shocks, the domestic market and the changes in legal practice.
The current legislation at both state and federal levels needs to be amended to address the rising premiums of public liability in-surance. These increased premiums mean reduced availability of public liability insurance and therefore a reduction in the capacity of ordinary businesses and ordinary citizens to go about activities which they deem to be desirable and which they choose voluntarily and willingly to pursue.
A problem with the current legislation is that it does not address the potential exploitation of the Trade Practices Act. Currently the Trade Practices Act allows plaintiffs to bring actions claiming damages for personal injuries resulting from conduct in contravention of division 1, part V of the act. That means—and this is what the review found—that lawyers will inevitably search for different courses on which to base negligence claims. Provisions of the Trade Practice Act will provide an obvious target for this search. 
This bill, in conjunction with state and territory civil liability reforms, will work to prevent legal loopholes allowing alternative courses for claims. The appropriate place to bring claims for negligence is under negligence laws within state and territory jurisdictions. The review of the law of negligence said that in order for such reforms to work two things have to occur: firstly, changes should be made nationally and in a uniform and consistent way; and, secondly, all jurisdictions need to act cooperatively to ensure that this occurs. This bill is part of an improved national response to rising public liability premiums.
Against that background, what is the importance of the bill? The importance of the bill is simple. The public liability insurance review addressed how we can apply common law principles to negligence in order to limit liability resulting from personal injuries; it considered balanced approaches to the limitation of liability and quantum relating to the awarding of damages—that is, how we can ensure that there is going to be a fair, reasonable and adequate response where there is genuine negligence—and it considered the possibility of limiting claims for negligence to three years after the date of the relevant incident.
The bill goes on to address recommendations 19 and 20 of the public liability insurance review. Recommendation 19 suggests that there should be an amendment to the Trade Practices Act to prevent division 1 of part V being used by individuals to pursue damages for personal injuries. Recommendation 20 of the public liability insurance review argues that there should be an amendment to remove the power for the ACCC to bring representative actions for personal injuries under division 1 of part V of the Trade Practices Act. In essence, what these changes are about is ensuring that the Trade Practices Act will focus on trade practice matters and not be used as a de facto base for negligence actions. In particular, the Insurance Council of Australia has expressed its support for recommendations 19 and 20, and there has been widespread support within private business. 
There are three critical benefits which will flow from the process of reform and which will flow through to Australian business. First of all, this public liability insurance reform will provide for greater confidence for businesses. In particular, businesses will benefit from increased certainty, as a potential source of legal action against them is removed. This certainty is particularly important for small businesses that have modest cash flows and significant outlays. If a significant outlay is open to increasing dramatically then, as we have seen, that can have a profound effect on a small business. The second major benefit is that there will be more affordable public liability insurance premiums. The bill is designed to be complemented by other bills within the states and within the Commonwealth regime. It will implement the review of recommendations on the quantum of damages, and already we see that the states are moving on that. The third benefit is that premiums will be monitored with increased attentiveness. At the request of the Parliamentary Secretary to the Treasurer, the ACCC will monitor the cost of the premiums for public liability and professional indemnity insurance. That is a very important role. They are seeking to make sure that any increase in costs is only on the basis of justified market forces, not as an attempt to exploit and to gouge on the basis of the international and national tragedies which have had an effect on the insurance market.
Finally, I wish to briefly address the core provisions of the bill. Item 2 inserts the new subsection 82(1A) into section 82 of the Trade Practices Act 1974. This provides that a person taking civil action to recover damages for personal loss or damage under the Trade Practices Act will be prevented from doing so and that the appropriate place for doing so is under state negligence laws. It is a very simple approach but it is clear, express and absolute. It seeks to avoid a multiplicity of sources and a multiplicity of avenues for what should be a clear point of certainty within the law. Item 5 of the bill inserts the new subsection 87(1AB). This will prevent a court from compensating a person for loss or damage but only to the extent to which the court order is based on conduct contravening division 1 of part V. So an action brought under the Trade Practices Act will focus on action which is in breach of the Trade Practices Act, not on personal liabilities. It should not be a stalking horse.
In summary, this bill is ultimately designed to address the cost and availability of public liability insurance in Australia. In doing so, it helps Australian businesses. In addition, it is part of a package which the Assistant Treasurer, Senator Helen Coonan, has brokered with the states and territories to reform the law of negligence in a nationally consistent manner. I believe it adds to the opportunities and helps provide appropriate levels of protection for businesses such as the Ace-Hi Ranch on Boneo Road in my electorate of Flinders. I commend the bill to the House and I urge all members to support it.",REPS,<title>TRADE PRACTICES AMENDMENT (PERSONAL INJURIES AND DEATH) BILL 2003</title>,<title>Second Reading</title>,Bills,5,1
