name,party,date,text,chamber,debate_title,subdebate_title,debate_type,debate_id,subdebate_id,type
"Coonan, Sen Helen",LP,2003-03-04,"—I am grateful to my colleagues Senator Murray and Senator Conroy for their support for the Taxation Laws Amendment Bill (No. 6) 2002. Their comments have ranged very widely across the taxation landscape. The bill contains a number of very important measures which I will return to in a moment. I should say that it is not my intention to canvass in detail each point that has been made by Senators Conroy and Murray. However, there are a couple of issues that I want to make a few comments on. 
Firstly, I welcome the fact that Senator Conroy supports interest withholding tax. I certainly hope that his commitment to developing Australia as a regional centre for financial services will also be as forthcoming when the foreign expatriates tax reforms are before this place. That is an equally important issue. Senator Conroy also mentioned— at least, I think this is what he was saying— that if we do not get into Asian economic forums, there is no point in providing tax concessions. But in the real world we all know that these concessions can make a real difference—indeed, the difference—to business decisions that will enhance the role of Australian business in the Asian region. The concessions are a very positive move that will make a great difference to business and will no doubt be enhanced by the review of international tax.
Senator Conroy also spoke briefly about what is becoming a very familiar topic—at least advanced by the Labor Party—and that is the government's support for the big end of town, supposedly at the expense of the small end of town, in particular in relation to the compliance burden that all businesses have in managing in the tax system. I want to refute that because there is no doubt that this government has not only addressed but is concerned on an ongoing basis—and I can say this because it concerns me greatly— about business concerns about compliance, particularly with the change to the new tax system. The government recognised business concerns about the compliance burden of the GST and following extensive consultations—which are now the hallmark of this government, particularly in relation to tax laws—made significant changes to streamline the GST payment and reporting arrangements for small business. It has borne fruit, because the December 2001 Dun and Bradstreet National Business Expectations Survey revealed that 76 per cent of respondents found it easier to complete the new, simplified BAS form.
There are a range of views on the issue. Notwithstanding perhaps some recent claims, most professional bodies have reported within the last couple of months that complaints about BAS lodgment have dropped off significantly. Other evidence also suggests that compliance costs have eased as businesses have become more familiar with the new tax system, as indeed the government expected. This was reflected in the survey results of the Yellow Pages Business Index—Small and Medium Enterprises. In the May survey of last year, only six per cent of respondents cited the GST as a concern. Over the financial year, the Australian Taxation Office has also noticed a continuing downward trend in the time taken to prepare and complete business activity statements. 
So the compliance cost implications of the GST must be viewed in the light of the entire tax reform package. Incorporated businesses are benefiting from cuts in company tax from 36 per cent to 30 per cent. Businesses are also benefiting from the removal of the old wholesale sales tax and other embedded taxes. In September last year, in fulfilment of its election commitment to Australian taxpayers, the government introduced legislation into the parliament to establish a statutory office of the Inspector-General of Taxation. It is a great pity that the Labor Party and the Democrats have, thus far, not seen fit to pass the bill to set up the office of the inspector-general, which, as a taxpayers' advocate, would provide significant assistance to small business in the whole area of compliance. The Senate will soon be asked to reconsider the bill, and it is important that the legislation be passed as a matter of urgency so that the inspector-general can start on the important task of improving tax administration for the benefit of all Australians and that, of course, includes ordinary taxpayers and small business. It is a much-needed office to bridge the gap in the current administration of the tax office and it should be passed forthwith.
Senator Murray, in his usual exhaustive and careful way, has outlined what one might regard as a wish list or certainly a list of areas to which he would like to see some attention given in relation to rearranging the tax landscape. In particular, while not replying in detail to every point raised by Senator Murray, I would like to point out that tax cheats are suffering under this government, and will continue to suffer further. I am sure that is something that most Australians— those who pay their fair share of tax—would welcome because we do want a fair system where everyone pays their fair share of tax. In this year's budget, in which we were able to increase the tax office's resources, an initiative taken by the tax office to do with tracking down tax cheats is expected to yield additional tax revenue of about $1,500 million over the forward estimates. 
Recently, the tax commissioner released an outline of the tax office compliance program for 2002-03. I commend it to Senators Conroy and Murray, if they have not had a chance to have a look at it already, because the compliance program identifies possible risks to the revenue and strategies that the tax office has under way to manage these across the range of taxpayer segments. The tax office continues to provide a high level of help and education to assist the vast majority of people who do do the right thing. However, its focus has shifted to more active compliance, including verification activities, field visits and other audits. A key priority, contrary to what Senator Conroy might say, remains targeting big business and high-wealth individuals. In the past five years, the tax office's extensive audit program at the so-called `big end of town' has netted an extra $2.64 billion for the community. This year, one in 10 businesses will be subject to some form of audit, and more than 135,000 people will be required to confirm their tax deductions. The tax office will boost its GST compliance staff by around 350 and its serious noncompliance investigations group to 300. Some other high-profile risks which are receiving close scrutiny from the tax office in 2002-03 are aggressive tax planning, the cash economy, work related and rental property expenses, the correct reporting of capital gains and losses, and illegal tobacco and fuel substitution.
I want to spend another moment or two on the taxation of discretionary trusts. The government has said that it will legislate, with effect from the handing down of the Board of Taxation's report on discretionary trusts, to introduce new provisions in place of section 109UB of the Income Tax Assessment Act dealing with distributions from trusts. The board has recommended these measures, and the government has accepted that they are required to improve the effectiveness of the deemed dividend rules so as to more actively prevent beneficiaries accessing trust income that has borne tax only at the company tax rate, and to remove the unfairness in the operation of section 109UB that is currently inducing some small and medium sized business operators to establish arrangements that enable them to avoid the operation of the section completely. In addition, the board has recommended that the ATO clarify and publish its views on interest deductibility for borrowings used to finance non-assessable distributions to beneficiaries of discretionary trusts. The government has requested clarification and will, if the rulings are unable to deal with the matter, also consider a legislative solution. 
The report notes the success of previous government measures in the following areas: use of non-resident trusts to transfer funds offshore, inappropriate utilisation of losses, circulating distributions and tracing distributions through to the ultimate beneficiaries, personal service income rules and revised social security means test treatment of private trusts and private companies. The report recommends that the government should retain the current flowthrough treatment of distributions of non-assessable amounts by discretionary trusts rather than a company type taxation model. So tax cheats have been suffering under this government, and they will suffer more. This is clearly identified in the compliance schedule.
Having made those remarks, I do not want to take up too much time on the bill which, as I have said, is supported and contains some very important measures. The bill demonstrates the government's clear commitment to a better tax system. It contains four measures, all of which will be of value to taxpayers. Firstly, it will enhance Australia's development as a centre for financial services in the Asia-Pacific region. Secondly, the bill exempts payments made to Australian residents, and their heirs, who suffered injustices and loss during the Nationalist Socialist period. Thirdly, the bill reduces compliance cost for compulsory third party insurers at the time when the transitional rules are ending and they are implementing a new compliance system. Lastly, friendly societies will be allowed a deduction for investment income paid to recipients of income from special purpose investment products, thereby preventing double taxation that may have arisen in some circumstances. Finally, I repeat that I am pleased that my colleagues support this bill and the very sensible measures, the necessary measures, contained in it to ensure the ongoing program of having a fair tax system. I commend this bill to the Senate.
Question agreed to.
Bill read a second time.",SENATE,<title>TAXATION LAWS AMENDMENT BILL (NO. 6) 2002</title>,<title>Second Reading</title>,Bills,15,1,speech
"Sherry, Sen Nick",ALP,2003-03-04,"—We are dealing with two bills cognately. In addressing the Migration Legislation Amendment (Contributory Parents Migration Scheme) Bill 2002 and the Migration (Visa Application) Charge Amendment Bill 2002, I think it is important to start with an acknowledgment of what migrants have contributed to Australia. Migrants have built this nation. The Australian story is in many ways a migrant story. Apart from our Indigenous peoples, we are a nation of migrants. People have come from all around the world, some under the great post-war immigration program, which was aimed at strengthening and populating the nation. Others have come to Australia as the result of war and conflict in their home countries. People have come to Australia under the skilled program and as members of families. Many have come as refugees, having fled their homelands seeking safety and peace for themselves and their families. I am pleased to say that many refugees have found that safety and peace in this country and have been able to rebuild lives and make major contributions to our nation. 
No matter how people have come, it is an understandable desire for migrants to seek to have their family join them. For many people the family is the foundation stone for their lives. I know that the family is the centre of many people's lives particularly their parents' lives. In fact this government would have us believe that they are the only ones in this place concerned about families. But this concern for family life does not seem to extend to migrant families and their overseas parents. It is also important for children to have access to their grandparents. This is particularly important for migrant families. Grandparents are an important source of their language, culture and history. 
Necessarily, parents tend to be older migrants, and research on the economics of migration has consistently shown that age plays a critical role. Younger migrants prove to be a net economic positive, with skilled younger migrants making the greatest economic contribution. Older migrants tend to be a net economic negative, with a cost of support in terms of health and welfare payments outweighing their economic contribution to the nation. Some interesting research recently published in the United States attempted to put a dollar figure on the differences. A highly educated migrant arriving at age 21 was calculated at having a net present value to the economy of $332,000 over their lifetime. For a poorly educated migrant age 21, the net present value was $9,000. For a highly educated 70-year-old migrant, the net present value drops to minus $148,000. For a poorly educated 70-year-old migrant, the net present value drops to minus $166,000. 
Australian research by Dr Birrell and Dr James Jupp shows that welfare dependence by immigrants increases with the age of arrival. Understanding this, but also understanding the importance to families of having their parents with them particularly as parents age, the Labor government sought to strike an equitable balance between the costs of the migration of parents that should be borne by the Australian community and the costs that should be borne privately by sponsoring individuals.
A little bit of history: obviously there have to be some limits on parent migration and in 1998 the then Labor government sought to reduce parent migration by introducing the balance of family test. This means that the number of adult children, Australian citizens or permanent residents living in Australia is equal to, or greater than, the number of children living outside Australia. This helped to ensure that the migration program was focused on those parents who needed to be united with their families in order to achieve adequate personal, social and economic support.
Further changes were made in 1991 when the then Labor government introduced the assurance of support bond at $3,500 for each principal applicant and $1,500 for each additional applicant. Under the scheme the sponsor of the parent migrant paid the bond to the Commonwealth government. The bond was used to fund any welfare payments claimed by the migrant. At the end of two years unused funds were repaid with interest. Welfare payments that exceeded the value of the bond were recoverable from the assurer as a debt to the Commonwealth government. In addition, the then Labor government introduced a migrant health service charge. Under this scheme a non-refundable levy of $822 had to be paid by the sponsor of each parent migrant. 
The aim of these changes was to strike an equitable balance between the health and welfare costs of parent migration that the taxpayer, the Australian community, should bear and the health and welfare costs of parent migration that the sponsoring family should bear. It is important to note that Labor structured these changes so that those seeking to sponsor did not face hardship and those seeking to have their parents migrate faced the same barriers not different barriers. Under these proposed changes the situation will be very different. The bottom line of these changes, introduced by the Liberal government and supported by the Australian Democrats—much to our surprise—is that if you have money your parents can come; if not, you wait in a queue. That queue is now so long, with waiting times well over 10 years, that many parents will die in the queue. 
Labor's understanding of the need for parent migration meant that in the last intake of 1995-96, under a Labor government, the number of parent visas issued was 8,900. On coming to office, the Howard Liberal government immediately took an aggressive approach to limiting parent migration. In addition to announcing a review of the whole system, the Howard Liberal government did the following. Firstly, it introduced measures to tighten the balance of family test. This tightening would have required more than 50 per cent of a parent's children to reside in Australia. In the case of parents with two children, a fairly standard case, this measure would have required both to be living in Australia. The Senate disallowed this change. Secondly, almost as soon as coming to office, the Howard Liberal government successfully introduced a two-year waiting period for social security benefits. Thirdly, the Howard Liberal government introduced a cap on parent visas of $7,600 in 1996-97, which was then slashed to $1,000 in 1997-98.
As a result of this review, the Howard Liberal government amended the relevant regulation in 1998 to introduce new parent visa classes with an assurance of support of $4,000 for principal applicants, $2,000 for additional applicants and a migrant health service charge of $5,000. Under this regulatory regime, 2,800 places would have been made available for parent visas under transitional arrangements for applicants under the old visa classes—that is, the queue with the usual assurance of support and the migrant health service charge. An uncapped number of visas would have been available for those seeking parent visas in the newly created and more expensive queue. With the support of the Democrats, Labor disallowed these regulations in the Senate on the basis they would have imposed hardship on families seeking to have their parents migrate. In response, Minister Ruddock reduced the number of places available for parent visas to a cap of 500, and the cap still remains in place—that is, 500 visas annually around the globe.
In 2000, the Howard Liberal government introduced the Migration Legislation Amendment (Parents and Other Measures) Bill 2000. Part of this bill provided for a new parent visa class with an assurance of support of $10,000 for principal applicants, $4,000 for additional applicants and a migrant health services charge of $25,000 or proof of satisfactory private health insurance cover. The Liberal government was proposing that 4,000 places be allocated to the new and more expensive visa classes. Labor and the Democrats defeated that part of the bill dealing with parent visas. Once again, Labor took the view that the proposal would have created hardship and inequity in creating two queues: one for those with financial resources and one for those without. At that time, the Democrats, particularly Senator Bartlett, agreed with the Labor Party. Senator Bartlett said:
... regulation, particularly on the grounds that it provided a mechanism which meant that basically people who have significant amounts of wealth would get an advantage over those who do not.
He went on to say:
... the Democrats certainly believe that wealth or otherwise of parents should not be a determining factor in whether or not people can get into the country ...
It seems that, in supporting these new measures, the Democrats have now decided that wealth should be a determining factor for parents migration. In 2002-03, the parent visa class remains capped at 500 places. The conditions applying to the visas are the need for an assurance of support of $3,500 for principal applicants and a migrant health services charge of $1,050. Save for the indexing of the migrant health services charge, these visas have the same conditions as imposed by Labor in 1991. Obviously, 500 places per year are nowhere near sufficient to meet demand. If we contrast that cap of 500 places with the 8,900 places available in the last year of Labor government or even the 7,600 places available in the first year of the Howard government, 500 places stand out starkly as a very draconian cap. In implementing and maintaining this cap, the Howard Liberal government has deliberately created a crisis in parent migration. 
There are currently 22,400 applications in the pipeline with 14,800 fully processed and with queue dates. Given the age of many of the persons seeking entry, they will die before they ever reach the front of the queue. This means that families with parents in the queue are desperate. The situation is now so hopeless for them that they will pay any price and do anything that is necessary to get their parents here.
Debate interrupted.",SENATE,<title>MIGRATION LEGISLATION AMENDMENT (CONTRIBUTORY PARENTS MIGRATION SCHEME) BILL 2002</title>,<title>Second Reading</title>,Bills,16,1,speech
"Bartlett, Sen Andrew",AD,2003-03-04,"—I move:
That the Senate take note of the document.
It is appropriate to draw the amendments to the Convention on International Trade in Endangered Species of Wild Fauna and Flora to the attention of the Senate and of the general public. It is one of the major global mechanisms for trying to protect and preserve endangered wildlife that is subject to international trade. These amendments, made at the last convention of the parties in November 2002, highlight the extreme environmental impact that can occur from trading in wildlife of all sorts. It is one of the reasons the Democrats believe all trade agreements should be cognisant of potential environmental impacts, rather than having separate treaties completely disconnected from trade agreements—for example, the free trade agreement with Singapore—and to have trade agreements implicitly recognise the need to ensure that there are not significant environmental impacts as a direct consequence of the trade.
These amendments and the reasons for the proposed treaty action detailed in here quite clearly indicate that trade in wildlife can have a direct negative consequence on the very survival of particular species. There are 12 species, different taxa, that were either listed or moved into appendix 1 of the convention—and appendix 1 is basically those species where international commercial trade is prohibited. All are significantly endangered as a direct consequence of trade in those species, and that is why they are listed here. For example, a chameleon from Madagascar that is significantly endangered is listed as a direct consequence of a high demand in trade for pets. We have many people here in Australia who advocate that we should be trying to build an international pet trade in Australian wildlife. Indeed, there is expanding trade in the United States in some Australian wildlife. I think that is a dangerous practice to promote willy-nilly without a clear examination of the potential environmental impacts on each particular species as well as there being significant animal welfare issues that can apply when Australian native animals are exported into foreign environments and kept as pets. It is no coincidence that many of these species that have been transferred onto appendix 1 are the subject of interested trade from collectors, pet traders and the like. In addition to the chameleon, many different species of birds— six different subspecies of parrot and macaw—as well as different types of turtles have been put into the convention for the first time. 
Plants are also an important part of the convention. In recent times we have seen a little bit of publicity about Australian business people who have been involved in illegal trade in exotic plants. That is a dangerous approach from an environmental point of view, not just because it may make plants extinct but also because it can, and has, led to plants escaping into the wild in foreign environments and becoming exotic weeds and pests. A number of different plant species—orchids, cactus and various types of palm trees—have been listed because they have become endangered due to trade.
It is worth noting a couple of sharks as well: the whale shark and the basking shark are species that are under threat. They are common in Australian waters, but obviously not common enough or they would not be listed in this trade in endangered species convention. It is an important convention, and this is one area where the Australian government have a fairly good record. I support them and encourage the Minister for the Environment and Heritage to keep up those efforts because it is important. (Time expired)
 (Senator Chapman)—Do you care to seek leave to continue your remarks?
—I seek leave to continue my remarks later.
Leave granted; debate adjourned.",SENATE,<title>DOCUMENTS</title>,<title>Convention on International Trade in Endangered Species of Wild Fauna and Flora</title>,Documents,17,1,speech
