name,party,date,text,chamber,debate_title,subdebate_title,debate_type,debate_id,subdebate_id
"Emerson, Craig, MP",ALP,2003-06-25,"—The Workplace Relations Amendment (Transmission of Business) Bill 2002 makes it easier for employers to strip away the wages and working conditions of employees. There are no two ways about it: that is the purpose of the bill; that would be its effect. That is why Labor is opposing it.
The previous speaker asked the Australian people to `walk with us into a new era'. Walk with them into a new era all right! It would be a new era of a journey down the low road of low skills and low wages. This bill, along with many other bills in the parliament in the area of workplace relations, reflects funda-mentally the government's philoso-phy—taking Australia down the low road of low skills and low wages. The government sees that low road as being Australia's future. It is a very bleak future indeed, because it is a future where Australia and Australian workers will be competing on wages against the countries of East Asia and our broader region—countries like China and India. 
No government should enter Australia in a race to the bottom—a race to low skills and low wages. This government has done precisely that. It is certainly not a race which Australians should aspire to win. But that, again, is what the government wants to happen—that Australians, somehow, should win the race to the bottom against China, India and other countries in our region.
In relation to China, some 30 million people on very low incomes are leaving the land with the restructuring of the Chinese economy. They are leaving the land to seek employment in factories in China. China will be the manufacturing powerhouse of the world in the coming decades. This government wants Australia to compete against China on incredibly low wages. That is what this bill is about. It is another instalment in the government's program of Australians competing on that low road of low skills and low wages.
Set against that philosophical background, there are four arguments against this bill. The first is that the government is interested only in helping employers to slash labour costs by enabling certified agreements to be junked in the process of corporate restructuring and contracting out. That is the purpose of the bill—to strip away wages and conditions. If an employee is in one business and that business changes and is transmitted into another business, entitlements are lost and therefore the worker is effectively put on lower wages. That is the purpose of the bill—for workers at one level of wages to be put into a situation where they are subsequently on lower wages.
The second objection is that the bill would disadvantage regional communities in instances such as where banks contract out their services following branch closures. That is a real problem in regional Australia. The flashing red light under the Prime Minister's desk has lost its battery. They thought that it would be better to have the battery wear out and not replace it because, if they stuck another battery in, the red light would start flashing. It will be flashing all right—the whole place will go red—because of the way this government are treating regional Australia. The Treasurer is on the record as saying that there should be lower wages in regional Australia—that somehow this would be a good thing for people living in regional Australia. They are at it again with this bill. This bill allows employees in those banks in regional Australia where jobs were contracted out, or the nature of the business was transferred to another business, to be put in a position of lower pay with a loss of working conditions. We oppose the bill for that reason.
The third compelling argument against this bill is this: when you buy a business, you honour existing commercial agreements—contracts with suppliers and commercial relationships that have been established over many years. When you buy a business, you do not say, `We've now bought this business and we are going to renege on these agreements.' It would be unlawful to renege on contracts that have already been signed with commercial creditors, such as contractors and other businesses. Why shouldn't the same principle apply to employment agreements? Why aren't employees entitled to the same certainty and security as commercial creditors?  
The answer to that is plain: in the eyes of the government there are two classes of people. There are the employers and those on higher incomes and then there are the employees. The government treats employers and contractors on higher incomes with one level of decency and respect, but employees who are in the situation where a business has been transferred get a separate deal—a bad deal, a poor deal—from the government. I do not think anyone with a sense of fairness, with that traditional egalitarian streak on which all Australians pride themselves, could possibly support this two-class system that the government is proposing in this bill where commercial contracts between an employer and another business are honoured—as they should be—but contracts between an employer and his or her employees are not. But that is precisely the proposition that the government is putting forward.
The fourth argument against this bill is that, if employers consider a certified agreement unsuitable, they should seek the agreement of their employees to vary it or terminate it and negotiate a new agreement. After all, that is what workplace democracy is all about. The government is fond of talking about workplace democracy. We support workplace democracy. So why not support a situation where, if a business is transferred, the employees who are transferred with it into the other business get a say in whether or not the certified agreement should remain in place? Perhaps they would express a view that, to maintain the viability of the business, they would be prepared to modify that agreement. Isn't that the decent, reasonable way to proceed instead of the government saying, `No, the employees will have no say in this matter at all'? They should have a say in it.
Employees have an interest in remaining in employment. The argument that this is necessary to keep employees in employment is fallacious in this sense: why wouldn't those employees have a vested interest in keeping their jobs? Wouldn't they be in a better position than the government or anyone else to judge whether there might need to be some modification to wages and to employment conditions in order for them, in this new structure, to retain their jobs? That is exactly what workplace democracy is all about. This government says it is for workplace democracy but, when it comes to this legislation, it says it is against workplace democracy.
The truth is that this legislation is yet another instalment of the government's agenda of stripping away the wages and working conditions of vulnerable workers, because its philosophy is that Australia should travel the low road of low skills and low wages. That is a recipe for disaster, because we will never beat the countries of Asia—China and India in particular—in that race along the low road. A government should never enter us into that race, but that is what this government has done. That is the philosophical difference between the Australian Labor Party and the coalition government. The Australian Labor Party considers that the future of this nation is as a high-skill, high-wage community producing high-value goods and services, especially for export. That is the future. It requires two inputs that this government has been unprepared to provide. The journey along the high road to high skills and high wages requires an investment in education and skills formation in this country that the Howard government has been unwilling to make. You cannot take the journey to high skills without an investment in skills formation.
The Treasurer just yesterday in question time lauded the Australian Industry Group's report into the state of Australian manufacturing. Of course he omitted the section on skills formation, which shows that Australia is lagging badly behind the rest of the world in relation to skills formation. That is one of the two essential items in any agenda to take Australia along the road to high skills and high wages. The other essential item is innovation. An examination of the Australian Industry Group's report shows that, here again in this vital area, Australia lags behind the rest of the world badly. In business spending on research and development we are well behind, and the gap between Australia and the rest of world—certainly the OECD countries—continues to widen year by year. This should be alarming for Australia—and it certainly should be alarming for the Howard government, but it is not. The Howard government has presided over a situation where business spending on research and development as a share of gross domestic product has fallen in each and every year except the last one, in which there was a small increase. The latest figures will be out on 1 July and we will see exactly what is happening there. The government, very consciously, turned its back on the idea of taking Australia down the road of high skills and high wages by cutting the research and development tax concession in its first budget. 
The R&D tax concession was introduced by Labor. Following its introduction, business spending on research and development increased in each and every year. In 1997, as a result of the first budget of this government, the R&D tax concession was cut from 150 per cent to 125 per cent, precipitating the fall in business spending on research and development. The consequence is that innovation in Australia is lethargic at best. The gap between Australia and the rest of the world—the OECD countries—continues to widen.
So the two critical components of a race to the top towards high skills and high wages are missing from this government's agenda—that is, skills formation through education and training and innovation to add high value to our goods and services for export. They are missing, but what are not missing are the essential ingredients for taking Australia down the road of low skills and low wages—the low road. The bill before us today is an important instalment on that agenda, because it allows for the cutting of wages and working conditions of vulnerable workers. Disgracefully for this parliament, this is not a bill to be viewed in isolation. The current Minister for Employment and Workplace Relations introduces pieces of legislation into this parliament with monotonous regularity all with the same purpose. He has introduced legislation which has been blocked in the Senate time and time again that, for businesses with 20 or fewer employees, would result in employees being able to be dismissed unfairly without recourse. The reason for that is that the government wants to put those employees in a vulnerable situation such that they can be told exactly what to do and exactly what wages and conditions they should receive from the employer under the threat of dismissal—and immediate dismissal without recourse.
Another piece of repugnant legislation brought into this parliament by the Minister for Employment and Workplace Relations is legislation to completely strip away the safety net for the lowest paid workers in this country. It does make sense that, if you are keen on Australia being in the race to the bottom of low skills and low wages, you had better take away the safety net for the lowest paid and most vulnerable workers in this country—and that is what the government seeks to do. It is complete folly. It is an unworthy race, it is a betrayal of Australia's national interest and it is a race that we could never possibly win. There is the fundamental difference in this entire area of innovation, industry policy and workplace relations. The government has a philosophy of Australia journeying down the low road to low skills and low wages and the Australian Labor Party has a philosophy of boldly taking Australia along the high road of high skills and high wages. The government's neglect—in fact, deliberate strategy—in these key areas is being reflected in our trade performance, and it is in this area that I want to make a few short remarks. 
Australia's exports of sophisticated manufactured goods—that is, goods embodying high skills and a high level of innovation—slumped 60 per cent since this government came to office. They are 60 per cent lower than the corresponding period of the previous Labor government. Labor embarked upon a program of diversifying Australia's export base away from primary commodities into high-skill, high-wage goods and services. But upon coming to office this government deliberately set upon a strategy of reversing that and, to that extent, it has been very effective. Our exports of primary commodities, in what the Treasurer has described as the worst drought in 100 years, account for 59 per cent of our total merchandise exports, compared with 53 per cent in the last year of the previous Labor government. So not only has this government failed to continue the diversification of Australia's export base into these high-skill, high-wage goods and services; it has reversed it. It is taking Australia back to a farm and quarry where we rely on good seasonal conditions and on high prices for our primary commodities.
Of course, last year Australia's luck ran out again. That is what is going to happen from time to time if your trade strategy is to pray for rain. Sometimes it does not rain and that is called a drought. We had a big one. The government says that it was bad luck. It was not bad luck; it was this deliberate policy of ripping away the employment conditions and wages of the most vulnerable people in Australia. That is a disgraceful policy. It is critical at the next election that the government changes so we can move along the high path of high skills and high wages which, for Australian families, means more secure jobs because they have the skills to stay in those jobs or to move to other jobs to which they aspire. With those improved skills they are less vulnerable to the sorts of callous actions that this government is proposing to take in this legislation. They are the fundamental differences yet again between the Australian Labor Party and the Liberal and National parties. Labor wants to improve the quality of work in this country and the coalition government is intent on tearing it away.",REPS,<title>WORKPLACE RELATIONS AMENDMENT (TRANSMISSION OF BUSINESS) BILL 2002</title>,<title>Second Reading</title>,Bills,9,1
