name,party,date,text,chamber,debate_title,subdebate_title,debate_type,debate_id,subdebate_id
"Kelly, De-Anne, MP",NP,2003-06-25,"—It is interesting to follow one of the Independents in the House, because some of the things that they have said have branded them. I remember what the member for Calare said on the border protection legislation in the last parliament. He stood up here angrily one night and said, `I don't care what my constituents say—I am going to vote the way I want!' Do you know what? I care very deeply about and listen very carefully to my constituents in Dawson. Quite understandably, there was no doubt three, four or five years ago that there was a great deal of disquiet and anger about Telstra's service. We would get scores of phone calls and letters in the office from country people unhappy with connection times, repairs and a whole host of other things. Let me just tell you what has happened since then—
—Do you want some?
—Sorry, Mr Deputy Speaker. I listen to others with courtesy but obviously that does not apply to the Independents.
—I take exception to that!
—I have listened with courtesy and I would like others to pay me the same courtesy. 
 (Mr Jenkins)—Order!
—The reality is that in the last three years I have monitored very carefully complaints coming into my office. From the scores of complaints we would get in a week, we now get approximately one complaint a fortnight. We refer these complaints immediately to Telstra Country Wide and they are generally rectified very quickly.
I have to say that I am very pleased with Telstra Country Wide service—very pleased indeed—as are my constituents. They ring me and tell me they are happy with the service. They cannot believe how quickly things have been rectified. As a response to that, there will be further safeguards in the legislation that is coming before the House. One of the things that people have said to me—quite understandably, with a great deal of concern—is that they wonder what would happen to the level of service if Telstra were to be privatised. They are very happy with it now, but they what to know what would happen. That is quite a reasonable and understandable question, and it is one I asked myself. I waited to see what the minister was going to do about the concerns country people have about the future. Sure, the service is good now in the Dawson electorate, but what will happen in the future? 
I am pleased to see, in the response to Estens—in which all 39 recommendations were taken up—that there is a very big focus on future-proofing. That means that there will be $15.9 million provided for extended mobile phone coverage to small population centres and key highways, $4 million to extend the satellite phone handset subsidy and $10.1 million to support information technology. There is a national broadband strategy, with $2.9 million for the strategy implementation group and $23.7 million—to be matched by the states and territories—to fund investment in broadband in regional areas for connectivity for health, education and local government sectors as well as the broader community. There is $107.8 million for a higher bandwidth incentive scheme to ensure that people in regional areas have access to broadband services at prices broadly equivalent to the prices in urban areas—which is extremely important. 
But it was future-proofing that I was interested in and was looking for particularly. I am pleased to see that, through a licence arrangement, Telstra Country Wide will remain for rural and regional Australians. In terms of future-proofing, reviews of regional telecommunications services will be conducted at least every five years. The concerns that my constituents had about services continuing will certainly be addressed through the future-proofing, and I am very pleased to see that.
I would like to go to some of the statements made by previous speakers. I note that the Labor Party are in a ferment about all of this—but the Labor Party were going to sell Telstra anyway. We know that because, of course, when they were in government one of the leaders brought John Prescott in to talk about how Telstra could be privatised. There is no doubt that the Labor Party would do that. The leading speaker in this debate, the member for Melbourne, put forward a proposal to break up Telstra.
I would like now to go to what the Labor Party actually do as opposed to what they say. It was the Labor Party that privatised the Commonwealth Bank and Qantas. Is there a universal service obligation for the Commonwealth Bank? Do we have unlimited accounts—no fees and charges—for people in rural and regional Australia from the Commonwealth Bank? No, we do not. Do we have a community service obligation for Qantas, which the Labor Party privatised? Can you get unlimited flights out of all of these happy places in rural and regional Australia, thanks to the Labor Party and Qantas? No, you cannot. There is no universal service obligation for anybody through the Commonwealth Bank or through Qantas. No, the Labor Party were happy to just flog them off and take the money, and now they are back here saying that we have not delivered. Let me tell you: the universal service obligation, the community service guarantee and future-proofing will ensure that rural and regional Australians will not cop what the Labor Party made them cop under their privatisation of the Commonwealth Bank and Qantas. 
—You are arguing against the legislation.
—I see that the member for New England is very happy with all the Qantas services into his electorate and very pleased with the fees and charges that the banks are imposing in Tamworth. I hope to hear him next time on an MPI complimenting the Labor Party on what they did for bank fees and for flights into his electorate. I am delighted to hear that he is happy, because not a lot of people are. I want to now move to the Independents—
—There are more of them.
—Not after they start counting things up, mate. There is one less already. In Queensland, the member for Darling Downs is Ray Hopper. Ray came to a meeting recently and said to us that he went in as an Independent. He is a good man; he had good intentions. He went in as an Independent. After he got there, the Labor Party made him head of the local sports club in the parliament—but they did not do anything else for him. They spent a lot of time with him, but they did not do anything. He said that after 12 months he added up what had been delivered to his electorate: $600,000. He went and had a look at what had been delivered to other electorates, and he decided that his electorate was being dudded. He joined the National Party. Do you know what has happened in the 12 months since he joined the National Party? His electorate has got $12 million in opposition, which he can justify. He said, `I was doing the wrong thing by my electorate not being a member of the National Party. I wanted to see things delivered.' Ray Hopper joined the National Party and he has seen it pay for his constituents.
The Independents—with great opportunism, because they thought that the community was going to run with them—decided to oppose our actions to liberate the Iraqi people from a cruel regime. They were going to run with the Labor Party's line and doom people in Iraq to maintaining a murderous and treacherous regime. I will be interested to see what will happen when people in those electorates actually add up what is being delivered to them and what is happening in this parliament, because the National Party backed the liberation of the Iraqi people. We backed a righteous war. And we will continue to back the right things not only for people in other countries but also for our rural and regional constituency. You will never hear a National Party person say, `I do not care what my constituents say.' Let me say that the National Party does care about rural and regional constituents. We will continue to deliver, and you can back our delivery against that of Independents—in fact, you can back us 20 to one. We have seen an Independent who added up the figures as an Independent, decided his electorate was being dudded and has now become a National Party member and has seen things delivered.
I also have a message for the ALP. They are saying that the National Party is going to be done over. The National Party is doing over the Labor Party in Queensland on sugar. The National Party has told the Labor Party in Queensland to back off and go back to the drawing board on sugar. For the Labor Party to come in here and say that we do not deliver for rural and regional Australians is absolutely wrong. The National Party is going to do over the Labor Party in Queensland—like my Liberal colleagues are doing them over on health funding, on public hospitals. The Labor Party in Queensland—like every other state Labor government—is refusing the funding from the Commonwealth. The National Party is going to do over the Labor Party on road funding. I notice the ALP will not commit to Roads of National Importance; we will. We know how important they are. 
Mr TUCKEY (O'Connor—Minister for Regional Services, Territories and Local government) (4.45 p.m.)—I move:
That the business of the day be called on.
Question agreed to.",REPS,<title>MATTERS OF PUBLIC IMPORTANCE</title>,<title>Telstra: Privatisation</title>,Matters of Public Importance,16,1
"Moylan, Judi, MP",LP,2003-06-25,"—On behalf of the Parliamentary Standing Committee on Public Works I present the report of the committee relating to provision of facilities for the ACT multiuser depot, HMAS Harman, ACT.
Ordered that the report be printed.
—by leave—This report deals with a range of new and redeveloped facilities intended to establish a multiuser depot at HMAS Harman for use by part-time reserve and cadet units. The estimated cost of the works is $13.5 million. The multiuser depot concept allows for maximum use and occupancy of a single set of facilities by a number of reserve and cadet units. Typically, these units use the facilities only one evening per week and one weekend per month.
The project described in this report will allow Defence to relocate a number of units currently accommodated throughout the ACT to a single site at HMAS Harman. Under this proposal, seven units—comprising four reserve units, two cadet units and one regular RAAF unit—will be relocated. In addition to the units already accommodated at HMAS Harman, this will bring the total number of units utilising the multiuser depot facilities to 10. At present, reserve and cadet units in the ACT are located at three sites: HMAS Harman; the Werriwa training depot in Allara Street, Civic; and the RAAF Fairbairn base at Canberra Airport. The decision to relocate units and consolidate facilities at a single site is, in part, driven by the planned closure in 2004 of RAAF Fairbairn and by the planned disposal in 2004-05 of the Werriwa training depot.
Defence expects that the establishment of a multiuser depot at HMAS Harman will minimise duplication of facilities across the ACT, resulting in both operational and cost efficiencies. Units will have access to existing messing, accommodation and sporting facilities at Harman and will be supported by existing essential services infrastructure, without additional expenditure by Defence. The completion of the multiuser depot works will also permit the termination of Defence's current lease-back arrangements at RAAF Fairbairn, which will deliver further savings. The proposed works will comprise office accommodation; specialised and shared training facilities; general and weapons storage facilities; vehicle storage and maintenance facilities; separate ablutions facilities for reserves and cadets; overnight, barracks style accommodation; and access to messing, gymnasiuma and medical facilities and parking. 
At the public hearing, Defence informed the committee of two changes made to the design of the new facility since the agency submitted its evidence in March 2003. The new design allows for co-location of the cadet and reserve precincts and the provision of barracks style overnight accommodation for up to 120 cadets. Defence believes that these changes represent better value for money for the Commonwealth. Defence assured the committee that the co-location of the reserves and cadets would not entail concurrent use of the facilities by the two groups. To ensure that Defence meets its duty of care to cadets, separate ablutions blocks will be provided for both unit categories.
In considering the written evidence supplied by Defence, committee members noted that, while the submission outlined a number of proposed energy efficiency measures, no reference was made to consultation with the Australian Greenhouse Office. At the public hearing, Defence stated that it intended to undertake such consultation. The committee recommended that this occur, in order to ensure that the proposed works comply with the relevant sections of the Commonwealth energy policy.
During a confidential briefing on project costs, the committee was curious to learn why the overall budget for the project had remained unchanged despite considerable alterations and additions to the project scope. At the public hearing and in subsequent correspondence, Defence explained that co-location of the reserve and cadet precincts, a reduction in the planned number of classrooms and the excision from the budget of proposed intersection works at Canberra Avenue had freed up funds for expenditure on additional project elements.
Following the public hearing, the committee recommended that Defence provide clarification of altered budget elements and the revised budget as a whole, and that these be supplied to the committee at the earliest opportunity. Defence responded promptly to this request and was able to assure the committee that the revised project costs were in order. The committee was concerned that copies of the revised project costs were not supplied to members prior to the public hearing and requested that in future such documents be made available well in advance of the hearing.
Given that Defence has supplied appropriate budget information and has undertaken to consult with the Australian Greenhouse Office, the committee recommends that the works proposed for the ACT multiuser depot proceed at a cost of $13.5 million. I would like to thank the many people who assisted the committee during its inspections and public hearing, my committee colleagues and the staff of the secretariat. I commend the report to the House.",REPS,<title>COMMITTEES</title>,<title>Public Works Committee</title>,Committees,17,1
"O'Connor, Brendan, MP",ALP,2003-06-25,"—by leave—I wish to supplement the remarks made by the member for Pearce on the report of the Parliamentary Standing Committee on Public Works. The project was undertaken very well. The Department of Defence provided a great deal of assistance to the committee in the way it went about its business. We indicated that there were a number of issues we wanted it to focus on in future matters.
In particular, I want to raise by way of emphasis—not in any way by adding to the report provided by the member for Pearce—the need for members of the Public Works Committee to have before them relevant information, particularly information that may have substantially altered from the time that we first received it. Our recommendation indicates the need for that to happen. We have been given assurances that that will happen more promptly than perhaps it did on this occasion. It is fair to say that the report provided by the member for Pearce properly and comprehensively addresses this matter.  ",REPS,<title>COMMITTEES</title>,<title>Public Works Committee</title>,Committees,17,1
"Moylan, Judi, MP",LP,2003-06-25,"—On behalf of the Parliamentary Standing Committee on Public Works I present the report of the committee relating to provision of facilities for the ACT multiuser depot, HMAS Harman, ACT.
Ordered that the report be printed.
—by leave—This report deals with a range of new and redeveloped facilities intended to establish a multiuser depot at HMAS Harman for use by part-time reserve and cadet units. The estimated cost of the works is $13.5 million. The multiuser depot concept allows for maximum use and occupancy of a single set of facilities by a number of reserve and cadet units. Typically, these units use the facilities only one evening per week and one weekend per month.
The project described in this report will allow Defence to relocate a number of units currently accommodated throughout the ACT to a single site at HMAS Harman. Under this proposal, seven units—comprising four reserve units, two cadet units and one regular RAAF unit—will be relocated. In addition to the units already accommodated at HMAS Harman, this will bring the total number of units utilising the multiuser depot facilities to 10. At present, reserve and cadet units in the ACT are located at three sites: HMAS Harman; the Werriwa training depot in Allara Street, Civic; and the RAAF Fairbairn base at Canberra Airport. The decision to relocate units and consolidate facilities at a single site is, in part, driven by the planned closure in 2004 of RAAF Fairbairn and by the planned disposal in 2004-05 of the Werriwa training depot.
Defence expects that the establishment of a multiuser depot at HMAS Harman will minimise duplication of facilities across the ACT, resulting in both operational and cost efficiencies. Units will have access to existing messing, accommodation and sporting facilities at Harman and will be supported by existing essential services infrastructure, without additional expenditure by Defence. The completion of the multiuser depot works will also permit the termination of Defence's current lease-back arrangements at RAAF Fairbairn, which will deliver further savings. The proposed works will comprise office accommodation; specialised and shared training facilities; general and weapons storage facilities; vehicle storage and maintenance facilities; separate ablutions facilities for reserves and cadets; overnight, barracks style accommodation; and access to messing, gymnasiuma and medical facilities and parking. 
At the public hearing, Defence informed the committee of two changes made to the design of the new facility since the agency submitted its evidence in March 2003. The new design allows for co-location of the cadet and reserve precincts and the provision of barracks style overnight accommodation for up to 120 cadets. Defence believes that these changes represent better value for money for the Commonwealth. Defence assured the committee that the co-location of the reserves and cadets would not entail concurrent use of the facilities by the two groups. To ensure that Defence meets its duty of care to cadets, separate ablutions blocks will be provided for both unit categories.
In considering the written evidence supplied by Defence, committee members noted that, while the submission outlined a number of proposed energy efficiency measures, no reference was made to consultation with the Australian Greenhouse Office. At the public hearing, Defence stated that it intended to undertake such consultation. The committee recommended that this occur, in order to ensure that the proposed works comply with the relevant sections of the Commonwealth energy policy.
During a confidential briefing on project costs, the committee was curious to learn why the overall budget for the project had remained unchanged despite considerable alterations and additions to the project scope. At the public hearing and in subsequent correspondence, Defence explained that co-location of the reserve and cadet precincts, a reduction in the planned number of classrooms and the excision from the budget of proposed intersection works at Canberra Avenue had freed up funds for expenditure on additional project elements.
Following the public hearing, the committee recommended that Defence provide clarification of altered budget elements and the revised budget as a whole, and that these be supplied to the committee at the earliest opportunity. Defence responded promptly to this request and was able to assure the committee that the revised project costs were in order. The committee was concerned that copies of the revised project costs were not supplied to members prior to the public hearing and requested that in future such documents be made available well in advance of the hearing.
Given that Defence has supplied appropriate budget information and has undertaken to consult with the Australian Greenhouse Office, the committee recommends that the works proposed for the ACT multiuser depot proceed at a cost of $13.5 million. I would like to thank the many people who assisted the committee during its inspections and public hearing, my committee colleagues and the staff of the secretariat. I commend the report to the House.",REPS,<title>COMMITTEES</title>,<title>Report</title>,Committees,17,2
"O'Connor, Brendan, MP",ALP,2003-06-25,"—by leave—I wish to supplement the remarks made by the member for Pearce on the report of the Parliamentary Standing Committee on Public Works. The project was undertaken very well. The Department of Defence provided a great deal of assistance to the committee in the way it went about its business. We indicated that there were a number of issues we wanted it to focus on in future matters.
In particular, I want to raise by way of emphasis—not in any way by adding to the report provided by the member for Pearce—the need for members of the Public Works Committee to have before them relevant information, particularly information that may have substantially altered from the time that we first received it. Our recommendation indicates the need for that to happen. We have been given assurances that that will happen more promptly than perhaps it did on this occasion. It is fair to say that the report provided by the member for Pearce properly and comprehensively addresses this matter.  ",REPS,<title>COMMITTEES</title>,<title>Report</title>,Committees,17,2
"Tuckey, Wilson, MP",LP,2003-06-25,"—I move:
That, in accordance with section 5 of the Parliament Act 1974, the House approves the following proposal for work in the Parliamentary Zone which was presented to the House on 23 June 2003, namely: Works to the Treasury Building northern courtyard.
Section 5(1) of the Parliament Act 1974 provides:
No building or other work is to be erected on land within the Parliamentary zone unless ... the Minister has ... caused a proposal for the erection of the building or work to be laid before each House of the Parliament and the proposal has been approved by resolution of each House.
The Treasury Building is located on King Edward Terrace in the parliamentary zone, opposite the National Library of Australia and to the west of Parkes Place. Works approval is now sought for the landscape works comprising the replacement of the existing paving and bollards, the recladding of the low concrete wall along King Edward Terrace, the replacement of soft landscaping and street furniture and the installation of new lighting.
The National Capital Authority has advised that it is prepared to grant works pursuant to section 12(1)(b) of the Australian Capital Territory (Planning and Land Management) Act 1988. As the Parliament House vista is located on the Register of the National Estate, the Australian Heritage Commission has been consulted. In its letters of 20 March 2003 and 28 May 2003, the commission advised that it supports the proposed works. The approval of both houses is sought under section 5 of the Parliament Act 1974 for the landscape works comprising the replacement of the existing paving and bollards, the recladding of the concrete wall along King Edward Terrace, the replacement of soft landscaping and street furniture and the installation of new lighting at the Treasury Building, block 1, section 33, Parkes, ACT.
Question agreed to.",REPS,<title>PARLIAMENTARY ZONE</title>,<title>Approval of Proposal</title>,Parliamentary Zone,18,1
