name,party,date,text,chamber,debate_title,subdebate_title,debate_type,debate_id,subdebate_id,type
"Lees, Sen Meg",IND,2003-03-04,"—In debating this legislation—the Health Amendment (Pharmaceutical Benefits—Budget Measures) Bill 2002 [No. 2], which is designed to increase the cost of medications for Australians—I would like to make four points: firstly, to look at the history of the PBS and why it was originally put in place; secondly, to look at the pressures on it; thirdly, to look at what the government is already doing; and, finally, to look at some issues surrounding the government's attempts to increase copayments at this point in time.
Firstly, let us look at the history of the PBS. The PBS has been in operation in Australia now for over 50 years, and it is a scheme that is envied by many other countries around the world as they struggle with some of the pressures that we are facing due to the increasing cost of medications. It was originally set up to provide equitable access to necessary medication. Up until 1950, there had been some medications made available free of charge to pensioners and war veterans. From that, changes were made to provide a list of 139 `lifesaving and disease preventing drugs'. These were made available free of charge to the whole community. I do not think there are many of us here today that could think back to when drugs were actually free of charge.
The idea of a copayment was adopted 10 years later in 1960. It was five shillings for general patients and hardly supposed to be a major source of funding for the scheme. More likely, from what I have read, it was to flag to patients that there was a cost for the medications they were using and therefore they should be used wisely. Most importantly, back in those days there was no copayment for pensioners. This lasted until the Hawke-Keating government introduced one in 1990 at a cost of $2.50 a script. Between 1983 and 1996 the Labor government was responsible for lifting PBS contributions for general patients by 320 per cent. This certainly has created problems for those families who just miss out on health care cards or who have family members with episodic or continuing illnesses. The government's web site says:
The Commonwealth Government's Pharmaceutical Benefits Scheme (PBS) helps improve the health of all Australian residents by ensuring they have access to necessary and lifesaving medicines at an affordable price.
That is the issue at the heart of the debate that we are having today. I argue strongly that medications are moving out of that affordable range for many low-income families, particularly those families who just miss out on health care cards. Basically, the scheme was set up to make sure we could all get the medications we need and that not only the wealthy could get the latest medication.
When we debated this bill last time I noted some of the specific pressures that had led this government to try to put up charges in the last budget. I lamented the way Treasury seems to deal with the health budget, looking at the PBS as a silo, seeing a large amount of money being used and thinking, `Don't worry about that, we will just take a few million dollars here and another couple of hundred million dollars there.' But some of the pressures are long-term pressures, not just ones that are spotted during a budget process, and they go beyond specific ones relating to those two drugs that drove the very rapid and sharp blip on the screen at the time of the last budget. 
One of the key pressures is the new and more expensive drugs. Some drugs are meant only to target a very small and precise group within the population, so their cost is not a big issue; but for those drugs that are more generally and widely available, such as those for arthritis, that can mean tens of millions of dollars being added to the Pharmaceutical Benefits Scheme. I stress here that any drug has to be proven to be cost effective before it can be listed. It does not just have to do what the manufacturers claim by way of treating or curing the illness. It has to be cost effective. The government has already moved in and is specifically targeting the cost blow-out.
The next obvious reason for pressure is that the population is ageing. The population is a lot more fussy about quality of life issues as it ages. Modern medicine has taken us down the road of more very expensive but successful drugs that have replaced other procedures, particularly surgery. The final reason for pressure is that more people have access to health care cards. This was a specific issue that the government did not budget for when they made the decision to extend health care cards to self-funded retirees—a move that I do not question at all— but they should have budgeted for it and made allowances for the fact that these people, being elderly retirees, were going to be fairly heavy users of the PBS. Therefore, the government should not have been as fussed as they were about the part of the increase that was attributed to more people having access to the PBS.
Those are the only problems I will deal with today. I will move on and look at what the government is already doing. I congratulate this government—indeed, I congratulate the former government and the former Minister for Health and Aged Care, Dr Wooldridge—for starting and continuing with better prescribing campaigns and other measures. The swiping of Medicare cards was introduced to make sure that those accessing medication were Australians who were entitled to access medication. I know the government now gets a lot more information, and some of that information will enable them to more tightly target medications to those Australians who need it, to limit excessive use and to further restrict wastage.
The price-volume agreements have already been discussed in this chamber. Some would argue that the process is now getting a little too tight. Price-volume agreements are a process by which a government tries to limit the cost of medication by driving down the price it is prepared to pay the drug companies for their new drugs. This was the problem with those two specific drugs that were discussed today and the last time we dealt with this legislation. I can say, from looking through some of the recent rulings and measures that are now being taken, that it certainly now is a very tight process. The impact of all of that has yet to wash through the system.
The government has done a number of other things—a crackdown on pharmacy fraud, wider use and availability of generic medication, restrictions on doctor shopping and tighter restrictions on prescribing. These restrictions upset some doctors, and I can understand their frustration in constantly having to seek approval for the use of some medications, but this is aimed at targeting medication specifically at those who can most benefit from them. Then there has been the introduction of the lifestyle scripts, something I have been working on in this chamber for eight or nine years. The system is not fully under way, but it is well on the way. I look forward to being able to assess the results of the system of lifestyle scripts as doctors are able to use them to support what they tell patients by writing down on a script, similar to the script given for medication, some lifestyle suggestions relating to diet or exercise, giving up smoking or reducing alcohol consumption. It is up to the doctor to reinforce what they are telling their patients by putting it in writing. We note that, since the last budget and since the cries of the Treasurer that the PBS was out of control, expenditure has fallen in some months. For example, expenditure in March last year was about 7½ per cent down on March of the year before—and so it jumps around. We will not really know exactly what impact all these measures have until they are given the chance to work. 
I will finally look at some issues surrounding the government's proposal to increase copayments. Copayments already go up every year—they go up with inflation, something this chamber decided to do several years ago. We need to look at the impact of a large increase, which is certainly what the government is talking about. The government itself admits that people are going to think twice before they go to the doctor. Indeed, it is one of the reasons for putting up the prices. If they decide that they really have to go to the doctor, despite the fact that the doctor is not bulk-billing anymore, and they get perhaps two or three scripts, they then have to ask the question, especially if they do not have a health care card: `Can I actually pay for two or three scripts in one hit?' Pharmacists are being asked by people: `Which script is the one I have to have tonight? I can come back on Thursday when I get paid and fix you up for the other two.' In some cases I find pharmacists are running up debt because patients are not able to find the money immediately out of their pocket, particularly if they have already had to put $35, $40 or $45 on the table in order to see the GP and then get the paperwork to claim some of that back from Medicare.
Research by the Health Economics Unit at Monash University has shown that some pensioners are already paying up to 12 per cent of their income on medical copayments. This is a mixture of costs—some of it because of reduced bulk-billing and some of it because of the pharmacy bills they already have to pay—and there is a range of other health costs, such as pain killers, which are not on the PBS. So many elderly patients are already finding a large slice of their income is going on health costs. The federal Department of Health and Ageing estimates that pensioners and other concession card holders will avoid filling about five million scripts if these changes are introduced. I am sure some of that is fair enough. There are people who probably should not have even bothered to go to the doctor, who have spent a day or so in bed and taken some time to get over whatever the illness was. But I am sure just as many, if not more, would genuinely have needed that medication. What will happen, as sometimes does now, is that they end up in the queues in our public hospitals.
If fewer scripts are filled, obviously the PBS silo is going to show at least some stabilisation or a decrease, but this will not be saving any money from the health system as a whole. Many people will end up needing more urgent treatment and far more expensive treatment. The government claims to put so much emphasis on primary care, and we can see some very good examples, such as the immunisation programs, continued funding of antismoking campaigns et cetera. But I do not understand why a government that has done some positive work in the preventative area now wants to turn around and undermine a lot of that by planning these changes. Indeed, I would argue that, if this were to go ahead, it would largely be a cost shift over to the states because it would be in our public hospitals that the bulk of this would be picked up.
In closing, I say, with all the changes and positive measures the government has put in place to assist doctors with better prescribing practices, to target medications to those Australians who need them and will benefit from them and to reduce wastage and fraud, let us give them some time to work. If we then have a situation where the increase in the PBS is considerably more than inflation—I think we have to allow for inflation, but if it is still considerably more—then let us look at other ways of funding this. Let us look at a fairer way of funding this than targeting those most in need, who are the sickest and poorest members of our community.",SENATE,<title>NATIONAL HEALTH AMENDMENT (PHARMACEUTICAL BENEFITS— BUDGET MEASURES) BILL 2002 [NO. 2]</title>,<title>Second Reading</title>,Bills,14,1,speech
