name,party,date,text,chamber,debate_title,subdebate_title,debate_type,debate_id,subdebate_id,type
"Buckland, Sen Geoffrey",ALP,2003-03-04,"—I too rise today to speak on the National Health Amendment (Pharmaceutical Benefits—Budget Measures) Bill 2002 [No. 2]. This is the second time the Senate has debated the measures in this bill, and it is the second time I have risen to speak on the issue. It is becoming a hallmark of this government to regurgitate the same bill over and over again. But interestingly the government only regurgitates and persists with those bills that affect those members of our community who will suffer and be hurt the most.
Like the previous bill, the purpose of this bill is to introduce into the Health and Ageing portfolio budget measures, outcome 2, a specified increase in the patient copayments for the purchase of drugs subsidised under the Pharmaceutical Benefits Scheme. When the government originally introduced this bill last year, it had the outcome of increasing patient copayments by 28 per cent from $22.40 to $28.60 per prescription and safety net threshold payments from $686.40 to $874.90. That was to be effective from January 2003. This translates to an extra $190-odd per year for the cost of essential medicines and an extra $6.20 per script for each of the 300,000 Australians who reach the general safety net. 
In the same manner, this bill seeks to increase concessional copayments by 28 per cent from $3.60 to $4.60 and safety net threshold payments from $187.20 to $239.20, also to be effective from January 2003. We need to ask ourselves how many pensioners and concessional card holders can afford to fork out an extra $1 for each prescription. I would suggest that very, very few could afford to pay. The government calculations attained through Senate estimates proved that the consequences of a proposed increase in the concessional copayment from $3.60 to $4.60 affecting Australian pensioners and concession card holders would result in almost five million prescriptions for essential medicines remaining unfilled. The same calculations showed that Australian families under financial pressure will go without almost half a million prescriptions as a result of the proposed increase in the general copayment from $22.40 to $28.60.
In total, the Pharmaceutical Benefits Scheme calculated by the government will result in families, pensioners and concession card holders going without almost five and a half million prescriptions simply because they cannot afford the increase. And this is from a Prime Minister who fantasises that Australians are relaxed and comfortable. That might be the case for the top end of town, but it is not the case for the average Australian.
Labor rejected this bill the first time, and today we are rejecting it again. The only thing this bill will achieve is to once again leave all Australians, in particular the sickest and poorest Australians, under the peril of not being able to afford the essential medicines they need. Commonsense tells us that essential medicines will keep people healthier longer. The reality is, if prescriptions go unfilled because Australians are unable to afford them, their health will suffer. As a consequence this will lead to greater expenses for medical assistance down the track.
Labor agree that it is essential to deliberate on the value of growth in the PBS, but only through sensible policy. Last year in the budget there were a number of measures that Labor supported and felt were sensible policy. These included increasing the use of generic drugs where appropriate, stopping pharmaceutical fraud both on and by pharmacists and improving the listing procedures for new medicines. Other measures included providing better information to consumers and doctors and increasing the focus on evidence based medicine.
Instead, we are witnessing the consequences of bad decisions made by this government. It is now trying to recoup losses caused by its bad decisions, through false economy, by looking for consumers to pay a larger proportion of the cost of drugs they legitimately need. For the most part, it is looking to concessional patients. This government is banking on 2.8 per cent of pensioner and concession scripts and 1.4 per cent of general scripts going unfilled because people are not able to afford them. Fifty per cent of the $1.1 billion the government wants to save from this copayment increase over four years will come from pensioners.
The true foundation of this bill is to restore the budget bottom line without any consideration or fairness to those most in need. How does the Howard government justify this after making such detrimental mistakes with the PBS in the past, bad mistakes made contrary to wise counsel? I am referring to the blow-out costs created in June 2001 when former Minister Wooldridge listed Celebrex against the recommendations of the Pharmaceutical Benefits Advisory Committee and did nothing to control the huge costs. The committee recommended that Celebrex be priced at $1 a day. The government failed to follow through on a contract negotiated with pharmaceutical manufacturer Pfizer that would have resulted in the price being halved once a certain number of scripts had been issued. Instead, what resulted was a $140 million blow-out in the first nine months of listing, up from an estimated $40 million. That is $100 million more than was estimated. Celebrex was not the only bad decision made by the government. The antinicotine drug Zyban was also listed by the government against expert advice on cost control mechanisms. 
Another perspective the government has had on the PBS was highlighted in November last year when Labor asked Foreign Minister Downer whether he would rule out putting on the agenda for a free trade agreement with the United States the abolition of Australia's PBS. Mr Downer refused to rule out abolishing the Pharmaceutical Benefits Scheme as part of a free trade agreement.
The Pharmaceutical Benefits Scheme has been in operation for 50 years. It is one of the cornerstones of Medicare and a guarantee for every Australian that essential medicines will be available and affordable. This government is clearly willing to place the health of Australians at risk because of pressure from the United States for Australia to abandon the PBS as a condition of entering into a free trade agreement. We can see that the pharmaceutical industry is again seeking to have the Pharmaceutical Benefits Scheme put on the table so far as free trade negotiations are concerned. The government should rule out changes to the Pharmaceutical Benefits Scheme as part of those free trade agreement negotiations. The scheme has served this country well.
In summary, on the seventh anniversary of John Howard's election, we have seen bulk-billing go from 80 per cent to 69.6 per cent over a seven-year period. That is an 11 per cent decline in bulk-billing, and over half of that has come in the last 12 months. Now the Minister for Health and Ageing, Senator Patterson, is saying that if this legislation is not passed then more money will be spent on the Pharmaceuticals Benefits Scheme and there will be less money for other areas. Yet if we allow logic to prevail in this scenario what we are likely to see is a shifted burden of cost onto other areas of Commonwealth and state expenditure, most likely through greater hospitalisation for those people unable to afford their prescriptions. Inevitably, other repercussions will include people with untreated infections and sicknesses spreading those infections and sicknesses around schoolyards, offices and workplaces, adding more financial strain when an adult is at home sick and not out working or when a child is out of school and not getting the benefit of education.
What does the government have to say about the consequences for employers when workers are off work? The government is so adamantly pushing the point that the employer needs to be protected and not disadvantaged in the Workplace Relations Amendment (Fair Dismissal) Bill 2002 [No.2]—which was again rejected yesterday—that I guess the government response would simply be: `Sack them. You're protected.' Labor ardently opposes this bill and sees the time, effort and expense of debating this issue once again in the Senate as the government's political swindle to get, yet again, an opportunity for a double dissolution trigger.",SENATE,<title>NATIONAL HEALTH AMENDMENT (PHARMACEUTICAL BENEFITS— BUDGET MEASURES) BILL 2002 [NO. 2]</title>,<title>Second Reading</title>,Bills,14,1,speech
"Webber, Sen Ruth",ALP,2003-03-04,"—As I am sure most senators in this chamber—if not the Australian public— will recall, the Australian people were on a promise. Of course we have come to understand that some promises are core and some are non-core, but at the time this promise was made in 1996 there was no such distinction. The current Prime Minister told the Australian people that he wanted them to be `relaxed and comfortable'. Here we are seven years on and we find this government taking steps to renege on that promise. How is it that an Australian can feel comfortable and relaxed about the state of health care in this country when costs just keep going up and up? New technologies and procedures mean that we should all feel more comfortable and relaxed about health care today than we did seven years ago. It is one of those things that Australians have come to prize over the years. New cures for diseases, new equipment to treat patients and new hospitals are an ingrained expectation for many of us. Over the course of the last century, we have seen diseases such as polio wiped out through new advancements. New equipment to screen for disease and early identification to increase survivability have been taken for granted.
Health care is one of the most important things to nearly every Australian. If you are sick or a member of your family is sick, you want the best services and facilities that are available. You want to know that Mr Howard's promise, his vision of relaxation and comfort, will be a reality in 2003, especially in the key area of health care. But what we have is one failure after another. Less relaxed but more anxious and less comfortable and greater discomfort is what we have. The coalition government would have us believe that we need to change the way the Pharmaceutical Benefits Scheme operates by increasing copayments or else the whole system will collapse. We are told constantly that the National Health Amendment (Pharmaceutical Benefits—Budget Measures) Bill 2002 [No. 2] amends the scheme to increase the copayment for general and concessional patients to cover the higher cost of drugs. We are told over and over again that health costs are increasing all the time, and the only policy response from this government is to charge us all more. There is no response that looks at efficiencies within health care, at ways to reduce costs or even to increase funding.  
Over the last seven years, we have had to take out private health insurance before we turn 30 or run the risk of higher premiums later in life. At the time we were told that this approach would relieve pressure on the public hospital system and keep premiums down. Those opposite claim that more people in private health insurance means fewer people in the public hospital system. That was the logic behind the policy, we were told. To do this, we have had to fund the rebates on private health insurance to the sum of billions of dollars each year. This amount increases with each year, but do the premiums stay the same? Of course they do not. The fact that the government's policy forced many Australians to take out health insurance when they did not need or want it was irrelevant. Ideology wanted it and ideology got it. Of course, everyone is shocked and amazed that, when someone has to pay for something they do not really need or want, they demand some form of value for money—they want some kind of return. This meant that people put in claims—lots of claims; more claims than anyone expected or the health funds had budgeted for. This must mean that it worked. However, more claims meant more costs in processing them and more payouts—payouts for all sorts of wonderful things like relaxation music and golf clubs.
Instead of premiums becoming cheaper, the funds put their prices up and this government let them. In fact, the Prime Minister's private health insurance rebate costs Australian taxpayers over $2 billion a year and people are still not getting value for money. The Prime Minister has frightened people into taking out private health insurance by making cover two per cent more expensive for each and every year after a person turns 30, if they had not joined prior to turning 30. His policy increased the profit, though, of private health funds fivefold from $176 million in financial year 1998-99 to $852 million in financial year 2000-01, but people are still not getting value for their money.
In his efforts to frighten people into private health insurance Mr Howard has broken two promises, and people are still not getting value for money. In the lead-up to the last federal election, the Prime Minister said that his policies would make private health insurance more affordable. Mr Howard said that his policies would reduce premiums. Since the federal election, we have seen an 18 per cent increase in premiums for HBF and a 66 per cent increase for excess. Again, in the lead-up to the last election, the Prime Minister said, in what he called an `absolute guarantee' as opposed to a core and non-core promise, that any future increases in private health insurance premiums would require his personal approval. Since the federal election, Mr Howard has wiped his hands of his guarantee and broken his promise. On 11 September last year—perhaps when he thought no-one would notice—the Prime Minister announced that he would allow private health funds to increase their premiums each and every year without any explanation. This broken promise will cost the average Australian family with private health insurance an additional $50 to $100 each and every year. It would seem that must have been another non-core promise. I am sure that all Australians are feeling more comfortable and relaxed about these cost increases!
Medicare bulk-billing is collapsing. If it continues at the same rate, within 10 years it will not be available for any Australian. Medicare—an approach that most Australians felt very comfortable and relaxed about prior to 1996—is now something that they feel quite betrayed about. I am sure it is easy to be comfortable and relaxed when it costs you more and you then have to undertake additional effort to get some of the money back through being privately insured! Prior to 1996, you went to the doctor, they swiped your Medicare card, you signed a form and that was that. In retrospect, we now realise that that must have been more difficult, stressful and inconvenient than what we are forced to do today! That must be why presentations at hospital emergency rooms are increasing at an astronomical rate. 
At the Armadale Kelmscott Memorial Hospital in the eastern suburbs of Perth, the rate of presentations at the emergency rooms increased by 2,700 in the year 2001-02. This is in no way linked to the decline in bulk-billing. We know that because the minister tells us that, so it must be true. People must prefer going to emergency rooms to scheduling a visit to their local doctor. People must prefer sitting in waiting rooms for hours on end to see a doctor in a public hospital to making an appointment at the local practice. This novel approach must mean that people presenting at emergency rooms are more comfortable and relaxed about going there than to their local doctor. The time wasted and the inconvenience are obviously all part of some government relaxation plan that the rest of us are not yet privy to.
Now we have the attack on the Pharmaceutical Benefits Scheme. Since the Howard government has come to power, over 60 medicines have been removed from the PBS, but the cost of medicines has increased. The Howard government spent all of last year, and now it has spent some of this year, trying to push through legislation to raise the cost of PBS medicines by 30 per cent. This was necessary, the Prime Minister claimed, because PBS costs were spiralling out of control. This was a lie. Government figures released on 30 September last year showed that the Howard government spent $224 million less on the PBS than its estimate for that item in last year's budget. Despite the government's underspend of that $224 million on the PBS, the Prime Minister is still trying to slug the sickest and poorest Australians with a 30 per cent increase in the cost of essential medicines.
At the time that this legislation was first introduced, the Labor Party suggested a course of action to the government as a means of saving money without having to increase the copayment. But that suggestion was ignored. The government's option is the only one to be considered. Their approach is to increase the copayment, and that is that. Perhaps there are other approaches. Should we not be looking to see whether there are alternative sources of pharmaceuticals? Should we not be negotiating with drug companies to see what can be done to keep costs down? Why should we simply go along with the prevailing trend in health care, which is that we allow drug companies to set high prices for newer procedures and treatments?
The minister has told us in the past that medicines are expensive, the Pharmaceutical Benefits Scheme is extremely generous and there are some courses of drugs that cost thousands of dollars. My question to the drug companies is: why are they so expensive? Of course, I will be told that years and years of research, the cost of getting patents and copyrights, and market developments mean that the drug companies have to charge high prices to get a reasonable return. My concern is what independent analysis of these claims is ever undertaken. Are we being ripped off by drug companies? It is a question that caused no end of discussion in South Africa about certain medication for treating HIV-AIDS. South African authorities sourced cheaper generic medications and then were in legal dispute with the big drug companies. How many other examples of that problem exist? Do we know and, more importantly, do we care? Have we allowed a situation to develop where the health needs of our fellow Australians are being mortgaged to the financial needs of drug companies?
One area that needs to be investigated is how we can source pharmaceuticals on a more cost-effective basis rather than simply paying increasing amounts of money to drug companies. None of the alternative responses are seriously considered by the government as a means of overcoming the problems of the Pharmaceutical Benefits Scheme. Instead, we get the simplistic approach of simply jacking up the price. Why should any of us be surprised that they take this approach? We see it as yet another example of their basic philosophical premise: they are all about comforting the comfortable and afflicting the afflicted. Whilst this government and this Minister for Health and Ageing are in power, there is no capacity for Australians to be comfortable and relaxed about the state of their health care. ",SENATE,<title>NATIONAL HEALTH AMENDMENT (PHARMACEUTICAL BENEFITS— BUDGET MEASURES) BILL 2002 [NO. 2]</title>,<title>Second Reading</title>,Bills,14,1,speech
