name,party,date,text,chamber,debate_title,subdebate_title,debate_type,debate_id,subdebate_id
"Costello, Peter, MP",LP,2004-02-16,"—in reply—In winding up debate on the Corporate Law Economic Reform Program (Audit Reform and Corporate Disclosure) Bill 2003 and the Corporations (Fees) Amendment Bill (No. 2) 2003, I thank all honourable members who have participated in the debate for their contribution. I believe the debate has been of a high standard and it is one of those areas where, although it is quite technical, the public has a vital interest. I appreciate the comments that members have made in relation to this legislation.
This is significant legislation. As I indicated in the second reading speech, it is the ninth stage in our Corporate Law Economic Reform Program, and it builds on previous reform measures in areas of accounting standards, directors' duties, fundraising, takeovers and financial services reform. The legislation contains significant measures covering financial reporting and corporate disclosure, and its provisions will achieve better disclosure outcomes, enhance auditor independence and improve enforcement arrangements in the event of corporate misbehaviour. The legislation generally implements the reforms proposed in the CLERP 9 policy proposal paper, which included the government's response to the recommendations of the Ramsay report, Independence of Australian company auditors, and it also reflects the outcome of subsequent consultations. In addition, the legislation takes account of relevant recommendations of the Joint Committee of Public Accounts and Audit Report 391: Review of independent auditing by registered company auditors and the HIH and Cole royal commissions.
The reforms in this legislation will see the Financial Reporting Council assume responsibility for oversight of setting Australia's auditing standards and the monitoring of auditor independence. As part of these reforms, Australia's auditing standards will be given force of law. To facilitate the implementation of this policy, the legislation contains transitional arrangements whereby auditing standards that have been issued by or on behalf of Australia's professional accounting bodies will be given immediate legal backing. The objective of this provision is to provide a seamless transfer from the existing regime under which standards are enforced through the professional codes of accounting bodies and the new arrangements. 
The requirements for independence of auditors from the entities they audit are being strengthened in line with recent initiatives in Europe and North America. These reforms include a general standard of independence and a requirement that auditors provide directors with an annual independence declaration; a prohibition on a number of specific employment and financial relationships between auditors and their clients which are considered to compromise independence; a waiting period of two years, which will apply to partners of an audit firm or directors of an audit company directly involved in an audit before they can take up a directorship or senior management position with the audit client; and a requirement for auditor rotation after five consecutive years.
The purpose of the continuous disclosure requirements is to ensure that investors have timely and equal access to materially price sensitive information about securities traded on secondary markets. This should ensure that the price of securities reflects their underlying value. While the continuous disclosure framework is basically sound and working well, we believe a number of changes are needed to enhance its effectiveness. The amendments included in the legislation will empower ASIC to issue infringement notices to disclosing entities for breach of the continuous disclosure requirements. In addition, people involved in a contravention of those requirements will be subject to a civil penalty, and the civil penalty which can be imposed on bodies corporate for contravention of the market misconduct provisions will be increased.
The legislation also introduces a number of measures designed to enhance transparency and accountability in relation to decisions surrounding directors' and executives' remuneration. Under one of these measures, details of directors' and executives' remuneration will need to be disclosed clearly in a marked section of the annual directors report. Shareholders will be given an opportunity to comment on the content of the report and vote on a non-binding resolution to adopt the remuneration disclosures.
The concept of a non-binding shareholder vote is new in the Corporations Act; as such, there are no legal precedents for the consequences where directors do not act in accordance with a non-binding resolution. Prior to proceeding with this proposal, the government sought legal advice from the Australian Government Solicitor. The Australian Government Solicitor advised that the failure of directors to abide by a non-binding resolution of shareholders could not, of itself, constitute a breach of directors' duties. This is consistent with the government's intention that a non-binding vote be advisory only. A provision to make it clear that the vote is not binding on the directors or the company has also been included in the legislation.
The introduction of proportionate liability in schedule 3 of the legislation fulfils the Commonwealth's commitment in relation to one of the key measures on which all governments in Australia have agreed, in order to improve the availability and affordability of professional indemnity insurance. A financial reporting panel will be established to provide an alternative, non-binding dispute resolution mechanism where a company and the Australian Securities and Investments Commission differ on the application of accounting standards and the true and fair requirement in the Corporations Act. The Corporations (Fees) Amendment Bill (No. 2) 2003 has also been introduced into this House to allow fees to be charged where companies refer matters to the financial reporting panel.
I would like to take this opportunity to respond to a number of remarks made by speakers during the debate. I am pleased that the opposition appreciates the importance of accurate and timely disclosure to the market. This is fundamental to the objectives of the CLERP 9 legislation. Let me make some observations on some other matters which have arisen during the debate—first, in relation to executive remuneration. Regulations specifying the remuneration disclosure requirements will be available to interested stakeholders prior to being finalised. The regulation-making power under the legislation is broad enough to cover many of the opposition proposals.
The government has, on many occasions, noted the importance of a co-regulatory approach and has looked to the ASX Corporate Governance Council as a source of best practice guidance. The council has put in place strong requirements that can more quickly adapt to changes in shareholder expectations than legislation would otherwise be able to do. The government will examine the amendments to the legislation foreshadowed by the opposition but, as its starting point, the government will pursue its objectives—the objectives of achieving an appropriate balance between directors' and the executives' ability to exercise judgment and due process for shareholders, a balance which we believe this legislation has obtained.
I turn now to audit reform. The opposition has foreshadowed that it will move amendments to the legislation to prohibit auditors providing non-audit services. The legislation requires disclosure of non-audit services, rather than imposing a prohibition on these services. This recognises that there are circumstances in which non-audit services may be beneficially provided by a company auditor. Given the small size of the Australian accounting services market, a prohibition on auditor provided non-audit services may have negative competitive consequences for access to legitimate non-audit services. I note the opposition's intention to insert the HIH recommendation that a four-year cooling off period apply before an auditor directly involved in the audit can join the audit company as a director or in a senior management position. The government included such a requirement in the CLERP 9 bill, released for consultation in October 2003. It was in the light of significant concerns raised in submissions to the government that we implemented the original CLERP proposal. In particular, the four-year cooling-off period was considered to go far beyond international best practice and had the potential to shrink the pool of experts with accounting experience able to serve on company boards.
I note the opposition has foreshadowed a number of amendments relating to shareholder participation. The government considers that informed participation by shareholders is a key plank of corporate governance. However, the government does not consider that the best way of encouraging informed participation is to introduce a raft of new mandatory requirements. Some of the ground sought to be covered by the opposition proposal on shareholder participation is covered by accepted industry standards such as the corporate governance guidelines released by the Australian Stock Exchange. A legislative approach introduces unnecessary legal complexity and uncertainty.
The opposition's proposal to introduce a law providing for a non-binding vote by shareholders in relation to persons holding more than one share position will not necessarily address the problem. It is an issue of commitment, and is not resolved by an arbitrary rule. Further, mandatory voting by a superannuation fund does not guarantee informed participation; it may just encourage arbitrary uninformed voting.
This legislation provides that a person who is involved in a disclosing entity's contravention of the continuous disclosure provisions contravenes the Corporations Act. This is a civil penalty provision. It is not the government's intention that a person who has taken all reasonable steps to comply with their individual responsibility should be liable for contravening the act. It is the government's intention that the showing of due diligence by persons in relation to this responsibility should be a defence. I indicate to the House that the government will ensure—if necessary, by amendment in the Senate—that that is the outcome of these provisions. The defence would operate so that an individual would not be personally liable where a breach of the continuous disclosure obligation occurs where the person took all reasonable steps to ensure that the disclosing entity complied with its continuous disclosure obligations and, after doing so, believed on reasonable grounds that the disclosing entity had complied with its obligations. The approach is modelled on a similar defence applying in relation to the prospectus provisions of the act.
I would like to thank the various bodies and organisations that contributed to the development of the legislation we have been debating today, both in terms of their input during the refining of the government's policy proposals and their comments on the detail of the draft legislation. I would like to thank my parliamentary secretary, the member for Parramatta, who is in the House today, for the assistance he has given in relation to this. I would also like to pay tribute to my former parliamentary secretary, now the Minister for Local Government, Territories and Roads, Senator Ian Campbell, who was so involved in the drawing and consultation in relation to this legislation.
Finally, I would like to acknowledge the invaluable guidance and advice that has been provided by members of the government's Business Regulation Advisory Group during the formulation of the CLERP 9 proposals and the subsequent drafting of the legislation. I believe that this legislation represents world's best practice in relation to corporate governance. We are recognised as leaders in this field and we will continue to be path breakers. We will make sure that Australia has a system of corporate governance and corporate law which compares favourably with that of all the other jurisdictions of the world.
Question agreed to.
Bill read a second time.",REPS,<title>CORPORATE LAW ECONOMIC REFORM PROGRAM (AUDIT REFORM AND CORPORATE DISCLOSURE) BILL 2003</title>,<title>Second Reading</title>,Bills,14,1
