name,party,date,text,chamber,debate_title,subdebate_title,debate_type,debate_id,subdebate_id
"Faulkner, Sen John",ALP,2004-06-21,"—I seek leave to bring forward for debate general business notice of motion No. 907, which stands in my name and in the names of the Leader of the Australian Democrats, Senator Bartlett, and Senator Brown. It is a motion to censure the Minister for Defence. I seek to do that to obviate the necessity for a motion to suspend standing orders. I understand that, while the censure motion may not be agreed on, the process is agreed.
Leave granted.
—Senator Faulkner, I understand that informal arrangements have been made to allocate specific times to each of the speakers in today's debate. With the concurrence of the Senate, I shall ask the clerks to set the clock accordingly.
—I move:
That the Senate censures the Minister for Defence (Senator Hill) for his:
	(a)	failure to take seriously and respond adequately to the reports of abuse of Iraqi prisoners by United States of America personnel, including reports in June and July 2003 of concerns raised by Amnesty International;
	(b)	failure to acknowledge Australia's legal and moral obligations to Iraqi prisoners in general and those captured by Australian forces in particular, noting that it is a crime under the Rome Statute of the International Criminal Court (to which Australia is a signatory) to commit out-rages upon the personal dignity of prisoners;
	(c)	failure to take his accountability responsibilities seriously; and
	(d)	failure to correct the serious com-munications problems within Defence and between Defence and his office, which were revealed by the `Children Overboard' affair. 
Senator Hill's handling of the prisoner abuse issue has been a disgrace. His handling deserves not just censure but sacking by the Prime Minister. He has failed consistently to take seriously and to respond adequately to the multiple reports of prisoner abuse going right back to June last year, when concerns raised by Amnesty International were first reported back to Canberra. He has failed to uphold or even acknowledge Australia's responsibilities not just to those Iraqis captured by Australian forces but to Iraqi detainees more generally. He has made a joke of the concept of ministerial responsibility and he has been just plain incompetent in failing to deal with the communication problems in Defence that he undertook to fix and rectify in the wake of the children overboard scandal. Not only have these failures occurred on Senator Hill's watch; he is still to offer a satisfactory explanation for them.
The only response we have had from Senator Hill and his colleagues is their vociferous and self-righteous defence of the Australian forces in Iraq, a defence against allegations that have never been made. We have never said or alleged that Australian forces have been involved in the abuse of prisoners in Iraq. There is nothing to justify such an allegation. The opposition do not and will not make any such accusation, but the reason I find it necessary to issue such a denial yet again is the government's persistent dishonesty in deliberately behaving as though we have made such an accusation. They insist on putting up this straw man again and again and knocking it down again and again, when it is clear to everyone that it is a complete fabrication. It is obvious that the Prime Minister and his minions have issued instructions that, whenever the prisoner abuse issue is raised, ministers are to react by expressing outrage that anyone has dared to smear the good name of Aussie troops. If you doubt this, I invite you to listen to Senator Hill's contribution when he takes the floor in a few minutes to speak on this censure motion. No doubt we will hear it again.
Throughout this prisoner abuse outrage Senator Hill has shown that he does not get it. He does not understand what all the fuss is about. There he was, on television yesterday morning, accepting responsibility—but responsibility for what? According to Senator Hill the government has made only one mistake throughout this whole saga—that is, that Senator Hill, the Prime Minister, the Chief of the Defence Force and the Secretary of Defence stated publicly that the reports of prisoner abuse had not come to Defence's attention before January of this year, when they had. The abuses were reported by Amnesty International in June and July last year. They were reported by the Red Cross in October and November last year, and again in February this year. And reports of prisoner abuse were referred to in at least 25 situation reports to Canberra from Australian officials in Iraq.
Of itself that is a very serious mistake. It is massively misleading. Normally when a prime minister and ministers mislead parliament and the public there are severe consequences—somebody has to take the rap for misleading—but under Mr Howard ministerial responsibility is not what it used to be. Ministers are no longer responsible for the mistakes of their departments. They are not even responsible now for their own mistakes. It is apparently sufficient to mutter through gritted teeth—as we have seen Senator Hill do—a few words of regret and then move on to the next issue. In the view of the opposition, the misleading of parliament and the public is a serious matter, as is the failure to accept responsibility. But just as serious is Senator Hill's and the government's attitude to prisoner abuse. Their response on this has been hopelessly inadequate. It is as if, deep down, they regard such treatment of prisoners as the inevitable consequence of the war they have so foolishly taken us into: something to be regretted, certainly—especially when it is exposed to the public eye—but something that, in normal circumstances, when it happens behind closed doors, one would turn a blind eye to. 
Was Piers Akerman speaking on behalf of the Howard government again yesterday, as he so often does, when he questioned why everyone was making such a fuss just because the interrogation of Iraqi prisoners was not up to, in his words, `boy scout standards'? If the interrogators had managed to extract useful intelligence then, according to Akerman, good luck to them. Such an attitude is outrageous. It is insidious and it is reprehensible. Let us just remind ourselves what we are dealing with. We are talking about torture. We are talking about turning dogs on naked, defenceless human beings. We are talking about brutal, inhuman, degrading treatment that flouts every relevant legal convention and standard—and we are talking about murder. These are heinous crimes and they were not confined to a couple of cell blocks at Abu Ghraib prison; similar abuses took place at Camp Cropper. 
In relation to Abu Ghraib the abuses appear to have flourished under the regime of Major General Miller. He was sent to Baghdad because the methods he had employed at his most recent posting were regarded as having been very successful. His last posting was to Guantanamo Bay, so not surprisingly that has raised concerns about the treatment of detainees there as well. We are not just dealing with a couple of isolated incidents of abuse that happen to have been recorded on camera. It is critically important that the inquiry that has been instituted by the United States government gets to the bottom of these abuses: their extent, their cause, those who were responsible for committing them and those responsible for condoning and encouraging them.
We have seen massive failures on the part of our government in this situation. You have to look at so many issues here. Look, for example, at Senator Hill's failure to take seriously and respond adequately to the Iraqi prisoner abuse revelations. The opposition believes there has been a gross failure by Senator Hill and the government to honour their obligations, under the Geneva conventions and the other relevant international instruments, towards Iraqi detainees in general and those captured by Australian forces in particular. That is the situation we face in relation to this censure motion. 
I also want to talk about Senator Hill's failure to discharge his accountability responsibilities. We have a situation where Senator Hill basically says, `The buck will never stop with me.' He says, as a minister, that he will never accept responsibility. But the fact is that the buck has not stopped anywhere. The minister has still not explained how he reconciles the Prime Minister's code of conduct with his failure, and that of his senior officials, over a period of 1½ days of questioning before a Senate estimates committee, to correct the record. 
The Prime Minister's code of conduct is clear. It requires that:
Ministers must be honest in their public dealings and should not intentionally mislead the Parliament or the public. Any misconception caused inadvertently should be corrected at the earliest opportunity.
That is Minister Hill's obligation under the Prime Minister's admittedly discredited code of ministerial responsibility. That is the minister's obligation. Yet we know from evidence provided by Senator Hill, by the Secretary of the Department of Defence, Mr Smith, and by General Cosgrove that by the evening of Sunday, 30 May they had all realised that Defence had indeed had access to reports of prisoner abuse at Abu Ghraib well before January this year. We know that Mr Smith and General Cosgrove had, in written briefs, informed the minister of these concerns. All three knew on Sunday, 30 May—this had been identified on that weekend. A formal brief had gone to Minister Hill and on that weekend all three knew, as did the Prime Minister, that the statement that had been issued the previous Friday in the name of Mr Smith and the name of General Cosgrove was incorrect in several particulars. That statement was wrong. So why then did Senator Hill ignore the very clear requirement in the ministerial code of conduct to correct the record `at the earliest opportunity'? Why did he ignore that responsibility? Why did he allow those mistakes and those misconceptions to stay on the public record at a time of intense public interest while the Senate estimates committee was in session for a day and a half? 
I think I know the answer to that question. It has become pretty obvious why Senator Hill did not correct the record at the earliest opportunity, as he is obligated to do. He just took the view that if the Senate committee wanted to get the truth they would have to work for it and that if the Senate committee wanted to get to the bottom of this they would have to ask the right questions. He was never going to front up with the information. He was never going to tell the whole truth about these issues. He put all the onus on non-government senators to ask the right questions at that Senate estimates committee and, hopefully, if the right questions were asked—and they were—the truth would be winkled out. There is no explanation for this except for a contempt of the parliament by Senator Hill, and I say that Senator Hill is deserving of censure for that alone.
Senator Hill is demonstrating this same attitude in his approach to the report of the Defence task force. Dozens of Defence officials were working 24 hours a day for two weeks to turn up every relevant record relating to the abuse of Iraqi prisoners and they pieced together, I think, a comprehensive picture of who knew what, when they knew it and what action, if any, was taken as a consequence. They also specifically dealt with issues arising from the Senate estimates hearings. They produced a report of at least 61 pages in length with annexures equivalent to the size of nine Sydney telephone directories. What did Senator Hill do? He withheld that report on the basis that it was classified, apparently, and in its place he and his staff—not the department or the Defence Force—drafted a 5½-page statement to the Senate with three attached tables. He believes this discharges his obligation to provide an explanation to the Senate. Again he is showing contempt for the parliament and he is showing contempt for the public. Again I say, as would any reasonable person, this warrants censure.
In my speech to the Senate last Wednesday in response to Senator Hill's so-called explanatory statement, I drew attention to his press release of 22 October 2002 claiming that confusion surrounding the `children overboard' incident led to inaccurate information being given to the government. He said he had instructed Defence:
to move quickly to ... ensure there is no repeat of the communication problems experienced ...
He claimed to have already ensured:
a clearer understanding of the incident reporting requirements through the chain of command and the passing of such information to the Minister's office.
I quote him again:
Ministers and decision makers within Defence must be confident that the information they are acting on is delivered in a timely and accurate manner ... 
He also accepted, and these are his words:
responsibility to ensure there are clear lines of communication between the Minister's office and Defence.
When he was asked yesterday to explain why after 20 months the same problems that he had identified as giving rise to the `children overboard' scandal were still evident, he did not have an answer—just a bit of dissembling; just one further communication failure. That is the sort of response you get from this minister. Here is a minister who undertook to fix those problems 20 months ago and who has quite patently failed in that task.
This case goes beyond a case for censure. If Minister Hill had a shred of decency and any respect at all for the conventions of ministerial responsibility, he would have resigned by now.
Opposition senators interjecting—
—But—of course, you are right—he has not got that sort of respect for the conventions of ministerial responsibility. We may not be able to force Senator Hill to resign, but we are able to censure him. I cannot think of a more warranted censure motion. I cannot think of a stronger case for censure in the 15 years that I have been in the Senate. Censure is not a strong enough sanction for Senator Hill. His resignation should follow. He should walk the walk to Mr Howard's office and resign as Minister for Defence. He has palpably failed. Censure is not enough; resignation is appropriate. I commend the motion to the Senate.",SENATE,<title>MINISTER FOR DEFENCE</title>,<title>Censure Motion</title>,Miscellaneous,11,1
