name,party,date,text,chamber,debate_title,subdebate_title,debate_type,debate_id,subdebate_id
"Hunt, Gregory, MP",LP,2004-02-16,"—I rise to speak on the Corporate Law Economic Reform Program (Audit Reform and Corporate Disclosure) Bill 2003, which is a critical part of the government's response to the CLERP 9 reform program, with great passion and energy for what this says about the process of shareholder participation in the economy and in the affairs of individual companies. There are two core concepts to this bill. The first is corporate governance and accountability. Sadly, the names Enron, WorldCom, Global Crossing, Arthur Andersen and HIH have become familiar to us in recent years—not as examples of great corporate triumphs but as failures of the processes of corporate scrutiny and corporate governance and, ultimately, accountability to shareholders.
There are two fundamental flaws which need to be corrected. Firstly, there is oversight of some of the excesses which occur behind closed doors or in ledgers which are not open and, secondly, there can be greater shareholder participation—the American examples in particular show that, but we have had a foretaste within the Australian context. So there must be oversight and there must be participation.
The corporate collapses I have mentioned represent, individually and collectively, not just the loss of jobs but the loss of wealth by individual shareholders, whether they are mum and dad shareholders, are people who have invested their life savings or institutions that have invested collectively on behalf of the different participating members of the economy. In the end it is about people in their homes whose assets are being lost and employees relying upon good corporate governance whose jobs are being lost.
The second great concept within this bill is the notion of asset wealth. Asset wealth is about spreading the base of participation in the economy. It is about giving people a leg-up so that they are not dependent but independent. If there is one thing that we as a government represent, it is the notion of giving people the opportunity to choose their own lives, whether in a social sense or at an economic level. By broadening the shareholder base, the capacity to participate in the economy and the ability of individuals to participate in the ownership of shareholding assets, we increase people's capacity to have control over their own lives and to have security over their own futures. To that extent, this government has an extraordinary record.
Firstly, this government has helped not only to produce the greatest level of shareholding in Australian history but also to make Australia the greatest shareholding democracy in the Western world. That is a measure of the extent to which wealth has been spread across Australia. Whether this has occurred through the distribution of Telstra's assets—to mums and dads, young families, singles, workers, people who otherwise had not participated in the economy—or any of the other broad based distributions of shares through the demutualisation which has occurred within insurance companies, all of them have contributed to shareholder wealth.
Secondly, we see a very simple thing in terms of the asset base: the reduction of capital gains tax by effectively 50 per cent for many shareholders has contributed to the attractiveness of basic shares. Thirdly, only last week we saw the establishment of the basis of a free trade agreement with the United States. That also includes important provisions for US investment into Australia, for building up the wealth of Australian companies which, in the end, impacts on shareholders and employees: jobs and wealth are the outcomes. 
All of this is about corporate law reform but we also see microeconomic reform on the waterfront and through the transportation system, which improves the health—in effect, cleaning the arteries—of the nation's economy and creates the efficiencies which have led Australia to be at the forefront of world economic growth over the last seven years. In the developed world, no other country has maintained such a level of economic growth. There has also been macroeconomic reform of the entire tax system. So the packaging together of corporate reforms for individual companies, microeconomic reforms—which effectively clean and clear the entire transportation systems of the country—and macroeconomic reforms has led to the four core developments: high levels of growth, high levels of employment with commensurately low levels of unemployment, low interest rates and low inflation. It is an unprecedented quadruplet of effects, which has a practical impact on individual lives. This leads to the current CLERP 9 reforms, which build on the previous eight groups of reforms which began in 1997 with CLERP 1.
The four core actions which this bill will take are these. Firstly, the bill will improve company disclosure and overall transparency to the market; it will improve what we know about companies so that the market can make real choices. There are three ways in which it will do that. Firstly, it will impose more stringent auditing requirements; secondly, it will ensure better visibility of executive remuneration; and, thirdly, it will lead to greater accountability for business activities. These three steps lead to the first great reform, which is improving company disclosure and overall transparency to the market. This is an important step forward because it means that the market will be able to see whether there are flaws in a company's practice and that individual shareholders will have transparency and be protected from any untoward actions, whether through an Enron, a WorldCom, a Global Crossing, an HIH or an Arthur Andersen.
The second great wave of reforms contained within this bill mean there will be an enhancement in the reliability and credibility of company financial statements. The bill does this by ensuring that there will be statements to include more, instead of less, information across a range of different areas. Thirdly, the bill will lead to great reforms occurring within the area of enhancing shareholder participation and involvement in key decisions. It will do this by ensuring that there is greater voting privilege and involvement by shareholders at a range of levels; it will also encourage shareholder participation and influence at general meetings. These are real reforms aimed at enhancing the capacity of ordinary mum-and-dad shareholders—of whom there are now more than at any other time in Australian history—to influence, understand and participate in the workings of corporate governance. It is the essence of democracy as well as being the essence of economic democracy.
The fourth great measure within this bill is that it will provide for better enforcement mechanisms for breaches of continuous disclosure requirements in corporations legislation. It provides the teeth to go with the basic principles. In particular, it will increase penalties for breaches in disclosure and actions by corporate leaders where they breach their faith and responsibilities, and it will also ensure that there is an extension of provisions to drill down to individual involvement in wrongdoing by a contravening entity. In essence, there are important provisions such as CFO and CEO sign off of auditing provisions.
Those are the four great waves of reform. They have a real impact, and they go back to where I began. Firstly, they go to the notion of corporate governance and accountability. They enhance corporate governance and accountability so we limit the chance of seeing an Enron, a WorldCom, a Global Crossing, an Arthur Anderson or an HIH. Secondly, and above all else, what we believe in as a government and a political party and what I believe in as an individual is the notion of enhancing asset wealth across as broad a base in the economy as possible. The Corporate Law Economic Reform Program (Audit Reform and Corporate Disclosure) Bill 2003 is ultimately about enhancing and broadening asset wealth, about giving shareholders confidence and about giving shareholders the capacity to participate in the governance and control of their own investments and, ultimately, to protect and enhance their wealth. On that basis, I commend the bills to the House and I urge all members of the House to support the CLERP 9 reforms.",REPS,<title>CORPORATE LAW ECONOMIC REFORM PROGRAM (AUDIT REFORM AND CORPORATE DISCLOSURE) BILL 2003</title>,<title>Second Reading</title>,Bills,14,1
"Cox, David, MP",ALP,2004-02-16,"—The Corporate Law Economic Reform Program (Audit Reform and Corporate Disclosure) Bill 2003 and the Corporations (Fees) Amendment Bill (No. 2) 2003 are being presented in this cognate debate. The Corporations (Fees) Amendment Bill will allow companies to be charged a fee for referring a matter to the newly established Financial Reporting Panel. However, I will focus on the CLERP 9 bill. Labor supports the intention of the CLERP 9 bill and believes that it provides a solid framework for corporate reform. However, it does not go far enough. Labor is concerned that the CLERP 9 bill fails to sufficiently hold boards accountable and to sufficiently empower shareholders. Accordingly, Labor will move a number of amendments to the bill in the Senate.
The CLERP 9 bill represents the culmination of four major reviews, follows on from the release of the original CLERP 9 discussion paper and incorporates recommendations from the HIH royal commission. The CLERP 9 bill covers a variety of areas of reform, including remuneration, continuous disclosure, shareholder participation, conflicts of interest, audit reform, financial reporting, proportionate liability and enforcement. The bill amends a number of acts, including the Corporations Act 2001 and the Australian Securities and Investments Commission Act 2001. Labor has a proud history in relation to ensuing that shareholders are aware of the salaries of corporate executives. In 1998, Labor and the Democrats inserted section 300A in the Corporations Act. This provision required that companies disclose the remuneration paid to their directors and top executives.
In August 2002, Labor released a directions statement called Improving corporate governance. This paper was the first stage in implementing Labor's corporate governance agenda through legislative change. The paper outlined Labor's policy position on a range of corporate governance issues, including executive remuneration. In October 2003, Labor released another paper which set out the second stage of Labor's corporate governance agenda. The paper set out the reforms which Labor believes should form part of the CLERP 9 bill. The paper proposed a range of reforms to executive remuneration, the composition of boards, empowering shareholders, analysts' independence, audit, penalties for misconduct, accounting standards and whistleblower protection. Some of Labor's proposals have been included in the bill we are debating today. In particular, Labor welcomes the government's decision to adopt Labor's policy to give shareholders a say on executive remuneration through a nonbinding vote on the remuneration report.
Today I will outline some of the key amendments which Labor will propose when the bill is debated in the Senate. I will not be outlining all of Labor's amendments, as the Parliamentary Joint Committee on Corporations and Financial Services has not yet conducted the inquiry in relation to the CLERP 9 bill. Further amendments may arise as a result of that examination. This bill and Labor's amendments are part of Labor's microeconomic reform agenda, because the performance and relative competitiveness of Australian companies are influenced by good corporate governance. With most workers having an interest in shares via their superannuation fund, almost every Australian worker has an interest in the performance of Australian companies. These reforms therefore have implications for the success of our retirement incomes policy.
The CLERP 9 bill has been more than 12 months in the making. The original CLERP 9 policy paper was released in September 2002. In light of how executive salaries have escalated, it is amazing to think that the original CLERP 9 policy paper did not even mention executive remuneration. A recent BRW survey of the 20 highest paid CEOs showed that only five have increased shareholder wealth in the last 12 months. A director on a number of boards, Charles Macek, said:
Business needs to recognise that it is part of the community. It needs to engage with the community, and reflect community attitudes. It's a cop-out to justify the process by which we have got here....It is delivering outcomes that clearly are unacceptable to the community.
In light of the recent spate of excessive executive remuneration payments, we have to ask why it is that remuneration packages often do not coincide with shareholder value. The power of the board to set remuneration and the powerlessness of the shareholders to have input into that process too often results in this disconnect. To overcome this disconnect, Labor wants to put checks and balances on the setting of executive remuneration and to empower shareholders.
Labor will propose a number of amendments to executive remuneration provisions in the CLERP 9 bill. Firstly, Labor will prohibit the payment of options, bonus payments and retirement benefits other than statutory superannuation to non-executive directors. Labor believes that remuneration for non-executives should be distinguished from remuneration for executives. According to Corporate Governance International, the role of the non-executive director is to monitor the strategy and performance of the executive arm of the company and to safeguard the interests of shareholders generally. Remuneration for non-executive directors should not provide any disincentive to independent action. The ASX corporate governance guidelines also say that companies should not provide options, bonus payments or retirement benefits to non-executives. In Labor's view this should be a requirement in law.
Secondly, the disclosure requirements for executive remuneration in the bill are not fully known, as much disclosure will be required in the regulations, which have not yet been circulated for comment. The explanatory memorandum notes that regulations will require disclosure of information such as performance hurdles relating to the exercise of options and the payment of short-term and long-term incentives. In Labor's view these disclosures are welcome but do not go far enough. The explanatory memorandum also notes that details of the remuneration to be disclosed will be prescribed in regulations and that companies should provide shareholders with comprehensive disclosure.
In Labor's view comprehensive disclosure would at least require disclosure of the board's policy on duration of contracts, notice periods and termination payments, golden hellos and equity value protection schemes, and require graphs plotting shareholder return for the previous five financial years. The disclosure of this level of information will empower shareholders to make an informed vote on the company's remuneration report. The bill also proposes that information to be disclosed about remuneration paid or payable be the same as that proposed to be disclosed under accounting standard AASB 1046, entitled `Director and executive disclosures by disclosing entities'. Labor has a number of concerns with the accounting standard which will be explored during the joint parliamentary committee's inquiry.
Thirdly, another amendment that Labor will make will be to prohibit non-recourse loans by a company to directors and management. The accounting standard requires disclosure of loans to directors and executives where they exceed $100,000. In Labor's view this does not go far enough. In November last year, Challenger provided a loan to its CEO of $21.2 million to finance his acquisition of 40 million shares in that company. The loan was a non-recourse loan; in other words, if the value of Challenger shares fell below the loan amount outstanding then the company—that is, the shareholders—would wear the loss. This meant that the CEO had all the upside and none of the downside. In Labor's view non-recourse loans to directors and senior managers to buy shares in the company should be prohibited; directors can go to a bank like anyone else.
Fourthly, Labor will move amendments relating to termination payments. The CLERP 9 bill amends the operation of section 200F. Section 200B prevents a payment from being made in connection with retirement from a board or managerial office unless shareholder approval is first obtained. Sections 200F, 200G and 200H provide exceptions to this rule. The changes proposed by this bill will insert an additional requirement on two of the current exemptions. The effect is that, where a payment is made pursuant to one of these exemptions, shareholder approval will be required where the payment exceeds an amount calculated in accordance with the formula specified in proposed section 200F(a)(iii) of the bill or where it exceeds the value of one year's remuneration, whichever is the greatest. Accordingly, payments that do not exceed either amount do not require shareholder approval. In Labor's view the formula sets the threshold for approval too high.
The HIH royal commission identified a number of deficiencies in Australia's regulatory framework and made a series of recommendations to improve the framework. Some of the key recommendations relate to audit reform. The implementation of Justice Owen's recommendations through this bill, such as those requiring rotation of audit partners, cooling-off periods before former audit partners can be employed by their clients and new rules relating to auditor independence, will improve the reliability and credibility of financial statements. Labor will move an amendment to implement Justice Owen's recommendation that four years is an appropriate cooling-off period before audit partners can join their former clients. In Labor's view Justice Owen was correct when he said:
... in my opinion, the proposed mandatory `waiting period' of two years might not be sufficient to arrest a reasonable apprehension that former partners retain an influence over members of the audit team. This is particularly so if those with whom they may have worked for a number of years (and in respect of whom they may have acted as mentor) are members of the audit team. In my opinion, an appropriate `waiting period' would be four years.
In addition, Labor will move an amendment which prohibits the company's auditor from providing certain non-audit services which compromise the independence of the auditor, such as accounting and bookkeeping services, valuation services, resolution of legal disputes, actuarial services and internal audit services.
Labor will also move an amendment to strengthen the role played by auditors. Labor welcomes the CLERP 9 requirement that auditors will be required to attend annual general meetings and answer questions. However, Labor has a proposal to go further, by requiring auditors to specifically report to shareholders and the audit committee on alternative treatments of financial information that had been discussed with management, the ramifications of the use of such alternative treatments and the treatment preferred by the auditor. These would form part of the audit opinion included in the company's annual report. I want to specifically draw the attention of peak accounting bodies to this particular proposal because it is something that they may wish to give their opinions on when the bill is in front of the relevant Senate committee.
The Australian Securities and Investments Commission's 2003 surveillance report on the independence of research analysts found that self-regulation of research reports from investment banks has been a comprehensive failure. In relation to conflicts of interest ASIC said:
We did observe some systemic weaknesses in the ability of entities to adequately identify, manage and disclose conflicts of interest.
ASIC also found that investment banks had ignored industry guidelines. The report found:
... the industry guidelines developed by the Securities and Derivatives Industry Association (SDIA) and the Securities Industry of Australia (SIA) have not been adopted as closely as intended and that there is still significant room for conflicts of interest to occur and to remain unmanaged.
As a result of ASIC's findings, Labor believes that the proposals in this bill to insert a general requirement for a financial services licensee to manage conflicts of interest and for ASIC to produce guidelines on managing conflicts of interest will not be sufficient. Labor will move amendments to prohibit trading by an analyst or researcher in products that are the subject of a current research report within a set time frame; trading by an analyst or researcher against a recommendation or opinion contained in a current research report; the publishing of any reports for a period after the analyst firm has acted in an initial public offer for the company that is the subject of the report; and `spinning', the practice whereby investment banks allocate shares in company floats to clients or potential clients as an inducement for business. Labor will also move amendments to require analysts to disclose in their reports any relevant interest of their own and companies to disclose information provided during briefings to analysts.
One of the key areas where the CLERP 9 bill is lacking is empowering shareholders. Labor believes that a number of other reforms are needed to empower shareholders: first, the requirement that companies put a non-binding resolution to shareholders in relation to the appointment of a director as chair where the director is already the chair of another company; second, the requirement that trustees of super funds vote their proxies; and, third, the requirement that fund managers disclose their voting records and voting policy. Here we have a slight variation from the first discussion paper that the shadow minister put out in which he suggested that fund managers be required to disclose why they voted on particular matters before annual general meetings. This simply requires them to provide information as to what their general voting policy is.
A far greater emphasis is needed on the role that shareholders can play in holding companies accountable. It is important that shareholders, both large and small, take an active interest in how Australian companies are being governed. The old response of simply selling out, known as the `Wall Street walk', is the easy way out. Labor believes that institutional shareholders such as trustees of super funds and funds managers have a responsibility to take an active role in Australian companies.
In addition to Labor's proposals to empower shareholders, Labor will oppose proposals which emasculate shareholders' rights. The Howard government has released a draft bill which attacks shareholders' rights by shortening the notice period required for the calling of company meetings from 28 days to 21 days and by abolishing the right of a single director of a listed company to call a company meeting. Labor will oppose these two proposals contained in the Corporations (Fees) Amendment Bill (No. 2) 2003. Today I have outlined some of the amendments that Labor will propose in the Senate to the CLERP 9 bill. There will be further amendments following the committee's deliberations, including amendments to double penalties for serious breaches of the Corporations Act.",REPS,<title>CORPORATE LAW ECONOMIC REFORM PROGRAM (AUDIT REFORM AND CORPORATE DISCLOSURE) BILL 2003</title>,<title>Second Reading</title>,Bills,14,1
