name,party,date,text,chamber,debate_title,subdebate_title,debate_type,debate_id,subdebate_id
"Evans, Sen Chris",ALP,2004-06-21,"—I rise to support this censure motion. I know it is a very inadequate response to the seriousness of the behaviour of the government, particularly by the Minister for Defence, Senator Hill, but it is the only response open to the Senate. The minister has described it as `political theatre', but I think Australians appreciate the seriousness of the issues involved here. They appreciate the fact that the government has not been honest with them, that it has not come clean about its knowledge of the issues to do with Abu Ghraib prison and the abuse of Iraqi prisoners, and that no-one in government has taken responsibility for that. The minister said he would take responsibility, but none has been taken. I think the minister has been responsible for an act of political cowardice in not taking responsibility for this. We called for his resignation following his failures in these matters. He has chosen not to take that course, so now the Senate is left with no option but to move a censure.
I know some people will say, `That's all very well, but what impact does it have?' It is the only course the Senate can take. We have to try to hold the government accountable; we have to try to make sure that someone does take responsibility for what has occurred. It is true that, after the Howard government lost five or six ministers in its first couple of years, standards of ministerial responsibility were abandoned. No-one takes responsibility for anything inside the Howard government. They took a policy decision after losing five or six ministers in 18 months that no more were to go. It does not matter what you do now, you will be held inside the cabinet because the Howard government does not have any standards of ministerial responsibility any longer. So the Senate has no option but to move a censure to try to hold the government accountable.
It is true that we have much more information now on these matters than we had a couple of weeks ago, but none of that has been volunteered. The government have not come clean willingly with any of this information. It had to be dragged out of them piece by piece, during hour after hour of estimates hearings, when they have had this information for a very long time. None has been volunteered, none has willingly been made available and, despite the minister's contribution today, there has been no attempt to come clean about what has occurred. We are now in a situation where the Senate does not have the ability to hear from Major O'Kane, or any of the other key witnesses involved—the key Australian legal officers who have knowledge of these matters.
We find that the 61-page fact finder report that the Prime Minister commissioned in order to clear the record has not been made available to the Senate or to the Australian people. What we have instead is a 5½-page summary, written in the minister's office, written with a political spin and abusing the Labor Party and the media, but without the 61 pages of fact finding that the defence department undertook. Why shouldn't we see that? If the government is happy to have the record cleared up, why shouldn't we see those 61 pages with the tables and the addendums that make up the full report as to what occurred inside Defence? If the government has nothing to hide, why didn't it table that report? Instead, we have the minister's own work. The reason we did not get the report on the Tuesday as promised was that the minister was in his office rewriting it, making sure that the 61 pages of fact were not presented. Instead, we got his 5½-page summary. 
What we also got were his own tables. The minister decided that he did not want to provide Defence's summary of all the information they found, that he would write his own report and that, in addition, he would draw up his own tables. So he was busy there, tabulating the information that he thought the Senate ought to have. One of the documents purports to be a summary of the reports coming back from Iraq about involvement with Abu Ghraib, prisoner abuse and the ICRC. It is supposed to be a table representing that, but it did not even include Major O'Kane's reports. The reports of the man who has been at the centre of the press coverage of all these issues, the man who was at the centre of the ICRC's responses, were not included in the tables that the minister produced. He did not think they were relevant enough or important enough to be included. That is how slippery the government has been as it has sought to deny full information on these matters. The tables did not even include references to Major O'Kane's reports.
Minister Hill decided to rewrite the 61-page report in his own hand and make it a 5½-page report with selected tables that were his idea of what he thought we should read. It was not what the fact finding report showed, not what the Prime Minister required, but what the minister thought we ought to see. Quite frankly, that is not good enough, and this will not go away until the government comes clean. His report did not include, for instance, the detailed situation report from Lieutenant Colonel Muggleton of 17 February, which expressed his concerns regarding the USA's detention practices and the differences between those detention practices and the Australian detention practices. 
The minister thought it was not appropriate for us to hear about Lieutenant Colonel Muggleton's report and about his concerns. I think the Australian people want to hear about those concerns and they want to know why Lieutenant Colonel Muggleton's report, in which he expressed his concerns back in February, has not been made available. What does the government have to hide? We are denied all these key documents, all these key witnesses and what we get is the minister's own version—a 5½-page version—and his chosen tables which leave out much of the key information.
I think there are three key stages to the development of this issue. The first stage is the pre 10 May stage. That was when the government was receiving report after report about the concerns of Amnesty International and Human Rights Watch, about the visits by Australian legal officers to Abu Ghraib, their liaison with the Red Cross, the drafting of Brigadier General Karpinski's response to Red Cross concerns, the sit reps coming in from our officers in the field and the O'Kane, Muggleton and Kelly reports—all this documentation that was coming into Defence, detailing the serious issues at stake about Abu Ghraib and prisoner abuse. We also had an Iraqi task force, consisting of officers from PM&C, Foreign Affairs and Trade, Defence and the Attorney-General's Department. 
All this information was coming in, but no-one was told—hear no evil, see no evil. Information did not reach any of the ministers. They were badly let down, it is claimed, by their departments. I guess you have to say, `Maybe that's right.' If you are being really charitable you might say, `Maybe it was just a stuff-up.' `Maybe,' as Defence have said, `it was just a stuff-up.' It has nothing to do with the dysfunctional nature of the minister's relationship with Defence; it is just the fact there was a stuff-up. It has nothing to do with the fact that maybe people thought they should not provide this information up the chain because the government does not like to hear news that does not suit its own political view of the world. But the reality is that the government argued that it was a stuff-up. 
I have serious concerns about that explanation. I am not sure that I accept that. But that was the explanation given pre 10 May. But if you do accept that, you cannot accept it after 10 May because we know that, from 10 May onwards, Senator Hill knew. After 10 May Senator Hill had all the relevant information at his fingertips. He was briefed. Why was he briefed? It was not because he was interested; it was not because he was concerned; it was not because he had any intention of doing anything about it, trying to insist that proper treatment occurred or getting to the bottom of why we failed to act to protect proper processes inside Iraq and meet our obligations under the Geneva convention. The reason he acted is that he had to come into parliament on 11 May and answer questions about it. And, in preparing for parliament, he was briefed on the Muggleton sit reps and he was briefed with a copy of the February International Committee of the Red Cross report. 
From 10 February onwards, Minister Hill knew what he needed to know. He knew that there were grave abuse allegations regarding the treatment of those prisoners, and that we had those since February. It was all in the February ICRC report. We know that he had access to the February ICRC report, which details its October 2003 visit to the Abu Ghraib correctional facility, which details the abuse of prisoners and which details them being held naked in cells and being treated appallingly. It is all in that report. The minister had all that information as at 10 May. He had the Australian officers' concerns about American practices of detention. He had the ICRC's reports and Mr Bremner's response to them and he had the description of the abuse at Abu Ghraib. I want to put on the record that the government have attempted to defend their inaction by saying, as the Prime Minister said to parliament on 27 May when he said that the ICRC report of October:
... covered general concerns about detainee conditions and treatment.
That is, the October report did not contain serious allegations of abuse. Minister Hill used terms like the Prime Minister did on 27 May in parliament, when he said the report:
... covered general concerns about detainee conditions and treatment.
That is just a lie; it is just not true. The February ICRC report reports on the October visit and it says things like:
... ICRC delegates directly witnessed and documented a variety of methods used to secure the cooperation of the persons deprived of their liberty with their interrogators. In particular they witnessed the practice of keeping persons deprived of their liberty completely naked in totally empty concrete cells and in total darkness, allegedly for several consecutive days. Upon witnessing such cases, the ICRC interrupted its visits and requested an explanation from the authorities.
That occurred back in October. The government knew in February at the latest about the standard of treatment. The report went on:
Several had been given women's underwear to wear under their jumpsuit (men's underwear was not distributed), which they felt to be humiliating ...
And further:
The ICRC documented other forms of ill-treatment, usually combined with those described above, including threats, insults, verbal violence, sleep deprivation caused by the playing of loud music or constant light in cells devoid of windows, tight handcuffing with flexi-cuffs causing lesions and wounds around the writs. Punishment included being made to walk in the corridors handcuffed and naked, or with women's underwear on the head, or being handcuffed either dressed or naked to the bed bars or the cell door. 
That statement appeared in the ICRC report in October. These sorts of abuses we later saw depicted in those horrible photos. But that was when the ICRC was actually doing its inspections. Of course, the worst of the abuses were not being perpetrated at that time because you had the Red Cross walking through the building. But, even while they were walking through the building in October, they were detailing that abuse. When the Prime Minister went into the parliament on 27 May and said, `The report covered general concerns about detainee conditions and treatment,' that was not true. The Prime Minister was not being honest. Now, I do not think he knew. I do not think he had been briefed. I think that, when he went into parliament, he was acting on information that Senator Hill and his department had provided him with.
From 10 May onwards, Senator Hill allowed the Prime Minister to mislead Australia, to mislead the parliament and to continue to perpetuate the myth that they did not know. Senator Hill knew on 10 May. He was briefed by his department, he was briefed about Lieutenant Colonel Muggleton's sit rep, which detailed the serious concerns, and he was briefed about the ICRC February report, which included a summary of its October visit and the abuse that I have just detailed. When Minister Hill came in here on 11 May he gave up the line that he had earlier run publicly on Lateline that he did not know anything and admitted that he took responsibility for knowing from February onwards. He said that he took responsibility for the government knowing from February onwards. What was that responsibility? It was nothing. He did not correct the record. He did not come clean and say, `We did know from February onwards.' He thought he would get away with it, so he sat tight.
He allowed the Prime Minister to continue to mislead the Australian people because he made no attempt to correct the record and come clean about the abuse. He allowed the Prime Minister to continue to peddle the myth that the ICRC complaints in October were somehow about some minor matters. They were about the very sort of abuse that was revealed in the photos released later in April. They were about the fundamental abuse of the Geneva conventions, about abuse of prisoners through torture, making them wear women's clothing, making them parade naked and chaining them to cell doors. It is all in there; it is all in the report that the minister had on 10 May. He had full knowledge of those issues from that date. What did he do? He did nothing. He did not attempt to correct the record. I think he hoped he would get away with it. He sat tight.
Then, of course, we had stage 3. We had the Sydney Morning Herald's articles, which revealed Major O'Kane's involvement. We had the Smith and Cosgrove press release, which turned out to be wrong. We had Senator Hill being briefed that in fact, despite the protestations to the contrary, the October Red Cross documents had been sitting in the R.G. Casey Building since Major O'Kane returned from Iraq earlier in the year. We had the PM again, on Sunday, 30 May, denying the fact that they had the October reports. Of course, by then, Senator Hill knew that they had them.
The Australian public continued to be misled when Senator Hill knew. I do not know what he thought. I think he thought he would just get away with it. He just sat on his hands while the PM continued to mislead. There was no correction and no admission. Then the estimates hearings started. Did they come clean then? No. On Monday, 31 May there was no correction and no admission. We see today that News Limited's Mr McPhedran says that the minister intervened to stop a proper explanation being given by General Cosgrove and Mr Smith. Certainly, none was given. Piece by piece at the estimates hearings, we had to drag the information out. There were no revelations; there was no owning up and no confession of mistakes. Piece by piece, we had to drag it out. 
What we do know is that, at some stage in all this, the PM had had enough. He was not going to allow his USA trip to be dogged by these allegations. He made it clear that he was going out at 1 p.m. on Tuesday before he went to the USA and he was going to come clean. He was going to go out and say he had been misled. We had the Prime Minister organise his press conference for the Tuesday before he jets off to America to see George Bush. So what happens? At 12.30 p.m., on the second day of estimates, General Cosgrove and Mr Smith made a humiliating apology and took the rap. Thirty minutes before the PM walked out to do his doorstop they said, `Game's up. We accept the fact that we've been misleading the Australian public month after month.'
What we now know is that Senator Hill had full knowledge of this from 10 May onwards, so for 22 days he refused to come clean. He refused to own up and he refused to take any responsibility. In the end, the PM dropped him in it because the PM said, `I'm not going to cop this any more. I've clearly been misled, I'm not going to wear it, I'm going to go out there and say “Sorry, I've been misled; I've been set up by Defence.”' But what we know now is that the department was made to take the rap. It was not Senator Hill. He sat there mute again. Smith and Cosgrove apologised. Senator Hill sat there: `Hear no evil, see no evil, nothing to do with me. I'm just the minister. It's just a terrible mistake. Those public servants, aren't they hopeless? Dear, oh dear, isn't it terrible? They are just so hopeless. What can I do? I just battle on.' That is not right.
What we know is that on 10 May Senator Hill had all the relevant information. He had been briefed. He knew the seriousness of the abuse. He knew that Australian Army officers had been sending back reports month after month expressing concerns and raising the issues, but he had been in denial. He had been hoping to get away with it. He thought that if he just sat there and the estimates did not go too well he would get away with it. In the end, the weight of evidence became too much and the Prime Minister said, `No, I'm out of this. I'm not copping this. You blokes have been feeding me a line that's not right. I've been out there misleading the Australian public; I'm going to come clean. I'm not wearing the rap for this.' He did not want to be dogged by that during his visit to the States. He went out and said `Game's up, lads. I've been misled. I'm not wearing it. Defence has to take the rap.' Thirty minutes before he did that Smith and Cosgrove read out a statement, an apology, which was not even typed. They had to apologise on the run, because they had to clear the air for the Prime Minister.
Where was Senator Hill in this? Senator Hill was missing in action. It was an act of gross political cowardice, because the responsibilities lay with him and he would not take them. He said he would take responsibility, but he has taken none. Even if you accept that it was a bungle at the start, he knew for 22 days and he did nothing to correct the record and nothing to bring the Australian public into the equation with an honest explanation. No wonder the Prime Minister is pretty dirty on him. He allowed the Prime Minister to hang out to dry for 22 days, hoping it would all go away. It did not. In the end the PM said, `The game's up. I'm out of here. You've got to cop this.' But has Senator Hill copped it? No way; it is nothing to do with him! (Time expired)",SENATE,<title>MINISTER FOR DEFENCE</title>,<title>Censure Motion</title>,Miscellaneous,11,1
"Allison, Sen Lyn",AD,2004-06-21,"—Senator Hill deserves censure today for taking Australia into an illegal, pre-emptive strike on Iraq. He deserves censure for not taking responsibility for the abuse of prisoners at Abu Ghraib. Most of all, he deserves censure for the announcement he made yesterday. Australia is to be led by the nose, yet again, into a much more dangerous and much more expensive war but one that is every bit as futile and destabilising as the war in Iraq and every bit as appalling as the treatment of prisoners there. Early next month, the minister will sign a memo of understanding committing Australia to 25 years of cooperation with the US on missile defence. This is Ronald Reagan's Star Wars. It is just as provocative, just as likely to promote the proliferation of nuclear weapons and just as dangerous to our relations with the rest of the world as the war in Iraq. 
President Reagan conceived of Star Wars, President Clinton reignited the program and the Bush administration funds it at $9 billion a year. Minister Hill was admittedly not the first defence minister to come on board. In 1995 the ALP government cooperated on Project Dundee at Woomera—a project for tracking rockets and a precursor to MD. Pine Gap contributes to missile defence—collecting intelligence from the Middle East, Russia, China, South-East Asia and the Pacific. For 29 years Nurrungar has been a ballistic missile early warning ground station.
But Senator Hill is taking Australia into even more dangerous territory. This MOU locks Australia into a dangerous alliance for 25 years, starting with development, testing and evaluation of technologies for the missile defence program in over-the-horizon radar technology and ballistic early missile warning through ship and ground based sensors. In case anyone should think this is about defence, the US Space Command says in its Vision 2020 document that missile defence is part of a `war fighting system'. It also says:
Space is critical to both military and economic instruments of power—the main sources of national strength ... Thus, protecting our freedom to use space and having an ability to deny an enemy's use of space will grow more important in the future.
This is a dangerous vision, a deadly vision. So far 8,000 nuclear physicists around the world have signed a commitment not to work on Star Wars research. But, to Mr Bush, space is the final frontier and the US has already spent $US95 billion on the project. Secret documents in the archives of the US Joint Chiefs of Staff are gradually being declassified and show that the US had planned to drop atomic bombs on Vietnam, North Korea, China and the Soviet Union in a first strike.
The US considered a surprise first strike on Russia with 737 nuclear bombs hitting simultaneously. The only reason they did not was that America had no defence against a retaliatory strike—but we are helping them to develop one. We are actively participating in a system that will allow the US to make a nuclear strike without fear of retaliation. In 1991 Newsweek magazine said that American generals had proposed to George Bush Sr an elaborate plan to use nuclear weapons against Iraq—a hydrogen bomb would be detonated over Baghdad to paralyse communications systems and then neutron bombs would be used against troop enforcements, followed by nuclear bunker busters.
It is said that the US did not use these so-called E-bombs in Iraq because China will soon have them, Russia already does have them and the US cannot protect itself against a retaliatory E-bomb attack. The US said it attacked Iraq because of its links with al-Qaeda—one of the many reasons for that first strike—but that turned out to be a lie. The US threatened to use nuclear bunker busters in Iraq, and Minister Hill admitted in answers to questions in this place and on notice that he did not even bother to ask President Bush if he was going to use these weapons or to urge him not to do so. 
We understand that the next generation of nuclear weapons for use in outer space are called Excalibur. If that happens—and no doubt Minister Hill will not ask for assurances in the MOU that it should not—we will be able to look into the sky and know that there are hydrogen bombs overhead, permanently stationed in orbit. The US project, Prometheus, was given the go-ahead some time ago. This is an atomic rocket designed to go into space. According to Dr Kaku, an American nuclear physicist committed to peace, Star Wars will depend on mini-nuclear power stations for the energy needed to keep them in space. We will have killer satellite technology that could well be hydrogen bombs.
Nuclear war has been contained for 50 years, but times are different now. Russia was bankrupted by the nuclear arms race, leaving the US with an unprecedented military might. There are new nuclear arms players in Pakistan and possibly Iran and North Korea. Israel has nuclear missiles. We are now on the edge of another nuclear proliferation crisis and a new arms race. What does Minister Hill do? He signs Australia up to this madness, just as we were signed up to an illegal attack on Iraq. Will this be another no-questions-asked exercise? Will Australia bother to ask about killer satellites or mini-nuclear power stations in space? Will Minister Hill seek assurances that there will be no nuclear rockets for outer space? 
Will Australia be part of Excalibur, or will we just turn a blind eye to the development of these weapons just as we have turned a blind eye to the abuse of prisoners in Abu Ghraib and to the reports that Iraq's WMD were already destroyed before we joined the attack? Will we claim that all we did was help out with over-the-horizon radar technology and put sensors on our destroyers, just as we have claimed that all we did was hand over Iraqi prisoners? Minister Hill denies responsibility for the fact that they were abused. He says that we were not in charge of the prison. Minister Hill deserves our censure for blindly taking Australia into the most dangerous realm of warfare ever known and for again not having the will or the strength to say `No' to President Bush.",SENATE,<title>MINISTER FOR DEFENCE</title>,<title>Censure Motion</title>,Miscellaneous,11,1
