name,party,date,text,chamber,debate_title,subdebate_title,debate_type,debate_id,subdebate_id
"Murray, Sen Andrew",AD,2004-06-21,"—I rise to take note of the tabling of the report entitled Beyond Cole—The future of the construction industry: confrontation or co-operation? I commence by thanking the secretariat in particular for their hard work in what was a very complex, emotive and difficult task. I also want to acknowledge my appreciation to the chair of the committee. I thought he handled the inquiry rather well, given the tensions that surround this issue. 
The Cole royal commission in both origin and conduct increased the temperature and allegations surrounding the building and construction industry. Political tension between the coalition government and the Labor Party concerning building unions and their conduct has been high both before and since the commission. Although these political tensions have been clearly apparent in the committee's work, looked at objectively the committee has done a considerable service to the BCI—the building and construction industry—not just in putting some balance into the assessment of Cole but in addressing issues and perspectives insufficiently covered by Commissioner Cole.  
My impression is of a diverse range of reactions to the proposed Building and Construction Industry Improvement Bill 2003. As a generalisation, peak employer groups strongly support the proposed legislation and Cole, present union officials in a devilish light and are louder about stronger workplace relations law than about OHS, entitlements, rorts and tax avoidance. Key unions in the ACTU are strongly opposed to the bill and Cole, present union officials in an angelic light but share Cole's concerns about OHS, entitlements, rorts and tax avoidance. Some companies are convinced that the bill is in their interest, some are not and most are silent onlookers. Many who have seen me privately would not appear before the committee but are adamant that the Workplace Relations Act is not curbing unacceptable behaviour in the industry. Other observers, such as academics and law firms, have strongly criticised the bill. Much media commentary has focused on an anti-union bias in Cole and the bill. 
There was much criticism about the Cole royal commission and, therefore, the legitimacy of the bill in dealing with the problems of the BCI. However legitimate the criticism may be of the motivations for directions taken and selectivity of the Cole royal commission, the Cole report properly drew attention to unacceptable industrial practice that challenged the rule of law, undermined the intent of the Workplace Relations Act and adversely affected productivity, efficiency and competition.
The Democrats strongly support the need for greater compliance with the law and more effective law enforcement. The royal commission identified weaknesses in the current mechanisms of enforcing law of general application, including criminal law, industrial relations law, civil law, tax law and state law. Therefore another question we considered during this inquiry was: if one of the key findings of the commission was a weakness in current enforcement mechanisms, how will creating new workplace relations laws solve a problem that has been identified as failure of the market regulators across these fields of law? The committee heard evidence from witness after witness, whether they were industry or union, that regulatory failure was a critical issue, if not the critical issue, facing the BCI. 
The Democrats support a system where all Australians—employers and employees alike—would have the same industrial relations rights and obligations regardless of where they lived. Supporting industry specific regulators would fly in the face of the Democrats' beliefs. We are philosophically, practically and politically antagonistic to the idea of an industry specific regulator. In addition, we believe that it would be a waste of resources to establish an industry specific regulator if better regulation enforcement of the law meant that after a few years they were no longer needed. 
The Democrats support one of the central propositions behind the Building and Construction Industry Improvement Bill 2003 and the Building and Construction Industry Improvement (Consequential and Transitional) Bill 2003—that is, greater regulation and enforcement of workplace relations law is necessary. We do not support the second central proposition behind the bills that industry specific legislation and sweeping new workplace relations law provisions are necessary to achieve this aim. The building and construction industry improvement bills will be opposed outright by the Australian Democrats. They cannot be salvaged or amended. The problems in the industry and in other industries would be far better addressed by enforcement of existing law and the creation of a well-resourced, independent, national workplace relations regulator.  
We are of the opinion that, as for other sectors of the economy such as ACCC, APRA, ASIC, ATO, greater regulation and enforcement of workplace relations law is desirable of itself as a market mechanism and as a social service mechanism and that folding ineffective departmental inspectorates, the Employment Advocate and so on into a standard regulatory body would considerably advance regulatory practice in industrial relations in Australia. We believe that workplace relations law is only as strong as its enforcement and that its enforcement is weak in the BCI. The lack of a well-resourced, active regulator with standard regulatory powers, plus inadequate penalties, is the prime cause of ineffective application and observance of existing law. The Senate inquiry reinforced the fact that better enforcement mechanisms and not new wide-ranging industrial laws were needed. The Democrats believe that there has been enough evidence before the Senate to support the need for an independent national workplace relations regulator. 
Lawlessness might not be the best way to describe non-compliance with the law. The laws do exist, but whether it is tax or workers compensation avoidance or blatant disregard for the Corporations Law, the problem is weak enforcement. While it is quite wrong to characterise the BCI as an industry where the rule of law does not apply, criminality, corruption and thuggery have to be addressed where they exist.
The Senate inquiry also highlighted the problems of having different industrial relations jurisdictions for the industry as well as the desire for a unitary system. The Democrats have consistently argued for years now that we need one industrial relations system, not six. We have a small population, yet we have nine governments and a ridiculous overlap of laws and regulations. There are areas of policy and jurisdiction that the states no longer have sensible involvement in. Like finance, corporations and trade practices law, labour law is one of those areas. The Democrats believe that a unitary system does not have to be achieved with an all or nothing outcome. We strongly urge whichever party is in power in the next term to seriously consider the efficiencies and benefits that can be derived from a unitary industrial relations system.
Having highlighted the Democrats' preference for addressing general mechanisms, the Democrats are not against targeting a problem in the short term. We supported the extension of the life of the interim national building industry task force and would not be opposed to increasing its information gathering powers on a temporary basis while the government worked towards establishing a national workplace relations regulator. We would also support providing additional resources to bodies such as the ACCC, ATO, AIRC, and probably ASIC, to focus on BCI hotspots.
We support the committee's majority recommendation No. 1 and its other recommendations either in full or, in the case of recommendation No. 2, by assessing any legislation on its merits. Our key recommendations are: to oppose the building and construction industry improvement bills; to establish an independent national workplace relations regulator; to include merit based appointments provisions in any legislation created to establish a national workplace relations regulator; to increase penalty provisions under the Workplace Relations Act for all industries; to include whistleblower protection provisions in the WRA; to increase the powers and capacity of the Industrial Relations Commission to make good faith bargaining orders, to resolve disputes on their merits and to make more determinations; and to amend the Workplace Relations Act to enable genuine project agreements to be reached and certified for major projects. Further, we recommend that the government consider legislating a definition of `employee' into the Workplace Relations Act 1996; that the building industry task force play a more active role in pursuing the underpayment of employee entitlements; that the Commonwealth Electoral Act and the Workplace Relations Act be amended to ensure that democratic control of donations remains with members of registered organisations and shareholders; that donations are capped; that donations with strings attached are prohibited; and, that there be better disclosure requirements. 
We believe the Commonwealth Electoral Act and the Workplace Relations Act should be amended as appropriate to ensure democratic control remains vested in the members of political parties and not in the hands of unions or of business. We believe a national unitary industrial relations system should be introduced. In conclusion, we have today announced that we reject the building and construction industry bills. We have offered the remedy of a national regulator and, in the interim, we have agreed to make a number of amendments to the Workplace Relations Act to fulfil our recommendations or some of those.",SENATE,<title>COMMITTEES</title>,"<title>Employment, Workplace Relations and Education References Committee</title>",Committees,20,1
"Bartlett, Sen Andrew",AD,2004-06-21,"—I rise to speak on the Senate Employment and Workplace Relations Committee's report entitled Beyond Cole—The future of the construction industry: confrontation or co-operation?It raises a significant issue. The area of workplace relations, as most senators would be aware, is one where the Democrats are perpetually in a balance of power role. It is the one area above all else where the old divide between Labor and the conservatives from years gone by is still very much in place. We need to consider the best approach for each issue. The approach that my colleague Senator Murray has just detailed highlights a few key aspects of this inquiry and the process behind it. The inquiry stemmed from the Cole royal commission into the building industry. The Democrats' position, as announced by Senator Murray, is that the bills arising from the commission are not salvageable and should be voted down at the second reading. I seek leave to continue my remarks later.
Leave granted; debate adjourned.",SENATE,<title>COMMITTEES</title>,"<title>Employment, Workplace Relations and Education References Committee</title>",Committees,20,1
"Campbell, Sen George",ALP,2004-06-21,"—I present the report of the Employment, Workplace Relations and Education References Committee entitled Beyond Cole—The future of the construction industry: confrontation or co-operation? together with the Hansard record of proceedings and documents presented to the committee
Ordered that the report be printed.
—I seek leave to move a motion in relation to the report.
Leave granted.
—I move:
That the Senate take note of the report.
Tonight I table the Employment, Workplace Relations and Education References Committee's report Beyond Cole—The future of the construction industry: confrontation or co-operation? This report represents Australia's first federal parliamentary committee inquiry into the building and construction industry. It is written in the context of looking at radical legislation proposed by the government to create a separate industrial relations regime for construction workers. It chronicles one of the most biased, poorly drafted and downright simplistic pieces of legislation that has ever been brought to the attention of the Senate.
This legislation is a recipe for disaster. It threatens the stability of the industry and represents an intolerable assault on the rights of construction workers and the principle of employment equity. It is the natural successor to the politically motivated Cole royal commission, which saw the government attempt to use a royal commission in order to corrupt the public mind. For this reason, the Building and Construction Industry Improvement Bill 2003 has been roundly rejected by the committee majority.
This legislation represents a cynical attempt by the government to reincarnate numerous provisions and clauses from previously rejected legislation. It maintains the tradition of workplace relations ministers applying Orwellian titles to their bills. Unfortunately, though, this bill will do nothing to improve the lives of the employers, employees and customers of the building and construction industry. The inquiry elicited 125 submissions, with 141 people appearing as witnesses around the country at 14 public hearings. Submissions came from individuals and organisations on both sides of the industrial fence. The committee sought in vain for direct evidence from builders and developers in support of the proposed legislation. However, the vast majority broadly opposed aspects of the Building and Construction Industry Improvement Bill 2003 and many opposed the bill in its entirety.
The committee noted that evidence from industry bodies supporting the principles of the bill were highly critical of its details. This suggests widespread scepticism of the practicalities of the legislation. For instance, the submission received from the largest construction company, Multiplex, avoided endorsing the bill and proposed its own solution to industrial dispute resolution in the industry. In fact, developers and builders have been conspicuously quiet or unenthusiastic about the government's legislation because this bill will do nothing to improve productivity or solve any of the problems that currently exist in the building industry. The report does not just comment on the bill, however; it also provides a thorough critique of the procedures and outcomes of the Cole royal commission from which this legislation was spawned. The report attempts to cover the spectrum of industry related matters that will be affected by the bill if it is passed. The government seems to be taking a `try and try again' attitude and approach to this area of policy. 
At the heart of the bill is the notion that this industry is so troubled, unproductive and tainted with illegality that it requires the creation of a quarantined industrial relations regime. The whole industry, employers and employees alike—making up around seven per cent of the work force—will be fenced off from the rest of the working population and work, as in a gulag, under a much more exacting and proscriptive structure. Numerous submissions, not to mention evidence given before the committee, show that no-one in the industry is sure exactly where the fence is.
The committee majority found no compelling evidence that the situation in the building industry is so dire, either in terms of productivity or industrial relations, as to justify such extreme measures. The inquiry showed that the conclusions of the Cole royal commission, which underpin this bill, were not just incorrect; they were diametrically opposed to the true problems facing the industry. 
Commissioner Cole concluded that occupational health and safety disputes were being used by unions for spurious or intimidatory reasons. However, witness after witness told us about dangerous working conditions and a lack of occupational health and safety inspectors in some states and territories. Commissioner Cole recommended an expansion of the powers of royal commissions. The committee heard numerous witnesses call into question Commissioner Cole's adherence to standards of procedural fairness and natural justice. Indeed, instead of recommending an expansion of the power of royal commissions, as Commissioner Cole did, we are directing that the Senate investigate the possibility of amending the Royal Commissions Act to ensure some measure of protection for the civil rights of witnesses called before such commissions.
Commissioner Cole warned against practices such as pattern bargaining and project agreements, whereas the committee found that these agreements bring certainty to parties on both sides and ensure industrial harmony and fairness in tendering. Commissioner Cole alleged a culture of lawlessness in the building industry—which is so entrenched as to require that it be regulated separately under the supervision of a powerful building industry task force—whereas the committee was presented with evidence that in 2000-01 an average building worker engaged in industrial action for less than half a day per year.
The committee majority found that most players in the industry are pragmatic and practical people who just want to get on with their jobs. This bill, instead of getting rid of any industrial difficulties, is likely to provoke major industrial confrontation that will cause considerable damage to the industry and the economy. Commissioner Cole largely ignored some of the more pressing issues in the industry, such as skills shortages, workers compensation and entitlements, tax avoidance schemes and phoenix companies.
In short, evidence presented to the committee contradicted almost every conclusion made by Commissioner Cole. If Commissioner Cole's conclusions are wrong then this bill, if passed, would be wrong also. Instead of simplifying the process, this bill would make the laws governing the industry unnecessarily complex. The only people who would benefit would be industrial relations lawyers. Our inquiry was never able to find out who actually called for a royal commission into this industry. No witness we heard from asked for it and very few people were consulted before it was established. 
In its report the committee was forced to rely on speculation because it was not able to put government assumptions about the effects of its proposed legislation through the appropriate inquiry processes. As a consequence of the Minister for Employment and Workplace Relations declining the committee's invitation to appear before it, we were unable to question him on policy details of the bill and the likely consequences of certain provisions of the bill. Departmental officers who appeared for the government could not be expected to answer questions that go to the heart of policy, explaining the reasons behind ministerial policy, let alone speculate on the likely effects of the bill's passage on the state of the industry. 
In essence, the government has escaped effective scrutiny by both houses in the consideration of this bill. The result has been a failure in political processes and a textbook example of how not to make public policy. The future of the building and construction industry will not be secured by an ideological agenda, driven by a government intent on confrontation with the labour movement at any cost; rather, the future of the industry will depend on a cooperative arrangement between capital and labour. 
Finally, I must reluctantly comment on the unacceptable and disappointing behaviour of at least one government senator during the course of the inquiry. He made a number of baseless claims, accusing the unions of intimidating witnesses who wished to appear before the hearings. Allegations were also made that I, as the committee's chair and, indirectly, the secretariat, unduly influenced the choosing of witnesses and the allocation of days for committee hearings. These accusations were made without any evidence and signified the desperation of the government at the fact that the vast majority of witnesses who appeared before the committee were highly critical of the proposed legislation. The government did not like the outcome, so they smeared the process. 
Finally, I would like to thank the secretariat of the Senate Employment, Workplace Relations and Education References Committee, particularly its secretary, John Carter, and research officer, Vanessa Horton, for their hard work and dedication during this inquiry. As always, their professionalism is beyond reproach.",SENATE,<title>COMMITTEES</title>,<title>Report</title>,Committees,20,2
