name,party,date,text,chamber,debate_title,subdebate_title,debate_type,debate_id,subdebate_id
"Andren, Peter, MP",IND,2004-02-16,"—I move:
That this House:
(1)	recognises that feral pigs pose a threat to the nation due to their impact on the welfare of livestock, damage to the environment and natural biodiversity, and potential to harbour exotic animal diseases and zoonoses;
(2)	notes estimates that the population of feral pigs in Australia could be as high as 23 million; and
(3)	calls on the Government to develop a nationally coordinated approach to the feral pig issue.
I am pleased to be able to open debate on this motion that calls on the House to recognise the threat posed to the nation from feral pigs. The damage to Australian agriculture has been put at about $100 million annually, but I contend that this figure is quite misleading. The impact on the environment could well be many times this figure in terms of restoration and repair, while the potential for the spread of disease could be catastrophic. The draft threat abatement plan on feral pigs prepared by the Department of the Environment and Heritage has been welcomed by the Cattle Council and the Australian Veterinary Association, but these organisations believe that the plan fails to include a vital eighth objective—namely, that there should be a coordinated removal of feral pig populations from areas of known low prevalence.
Feral pigs and the problems that they cause are usually associated with the western areas of New South Wales, Queensland and the Northern Territory. However, there is potential for a break-out of pigs in certain parts of my own electorate, particularly areas adjacent to state forests and national parks. A trapping program in the south-east portion of the Central Tablelands Rural Lands Protection Board area has regularly netted between 200 and 300 pigs per annum. At the moment this represents a major threat to water quality. Much of their roaming area covers both the Sydney water catchment and the upper reaches of the Lachlan catchment. Indeed, not that long ago on my way from Canberra, across the Abercrombie River towards the villages to the south of Bathurst, I saw a very healthy boar and sow and half a dozen litter crossing the road in front of me.
—Name him!
—I did not see a nose in the trough, but it was a very recognisable and healthy member of the porcine population. 
The Kanimbla Valley to the east of my electorate has another significant feral pig problem, and control in these areas is described by the board as a `holding operation only'. Likewise, while a baiting program appears to have feral pigs under control in areas like Nangar National Park in the Forbes area, there is an ever present threat of the pig population multiplying if the conditions are right. There could be anywhere up to 23 million feral pigs in this country—that is one for every human inhabitant and several million left over. I am sure the member for Braddon would agree that that is quite a frightening prospect.
The Cattle Council and Australian Veterinary Association believe that, in order to progress control and eradication efforts, a national operational plan should be put in place to incorporate the current programs of the individual states and territories. If we have national programs for things like foot-and-mouth disease, then surely it makes sense that the potential for pigs to spread disease and to harbour exotic disease should be a national concern. Some diseases of concern, such as Japanese encephalitis, also affect humans. Apart from this, the impact of pigs on livestock—including newborn lambs and calves and the resulting production losses—on pasture, creeks and waterways also warrants a national research and control program. According to the Cattle Council and the Veterinary Association, such a program should include an assessment of the diverse state and territory programs, including aerial survey, aerial baiting, trapping strategies, population monitoring and scientific research.
Some communities, including Indigenous communities, regard feral pigs as a food source, while others export feral pig carcasses. These factors need to be examined in the context of any eradication program. All control methods have animal welfare implications, as do current pig shooting and hunting practices. These all need to be part of a national protocol.
Other members in this place can no doubt attest to the damage caused by feral pigs to delicate tropical forest areas, while the impact on native wildlife and plants in national parks and forests throughout the country has yet to be documented in any substantial way. A workshop in Cairns last June saw the Queensland Department of Natural Resources, Mines and Energy, the Australian Veterinary Association, the Cattle Council and rainforest and pest cooperative research councils come together with Environment Australia, state governments, chemical manufacturers, the livestock industry and other stakeholders in the biggest ever feral pig workshop.
The workshop sought an agreement that eradication of the threat from feral pigs is the long-term goal. It agreed it would be necessary to gain the support of the federal government for a nationally coordinated program. The Cattle Council and Veterinary Association do not see the Environment Australia draft threat abatement plan, welcome as it is, as an acceptable or adequate approach to the feral pig problem. This motion calls for the government to develop a nationally coordinated approach to the feral pig problem, and I commend it to the House.
 (Mr Jenkins)—Is the motion seconded?
—I second the motion and reserve my right to speak.",REPS,<title>PRIVATE MEMBERS' BUSINESS</title>,<title>Feral Pigs</title>,Private Members' Business,10,1
"Tollner, David, MP",CLP,2004-02-16,"—I support my good friend the member for Calare's motion. I agree that feral pigs are a threat to the environment; they are in ever-increasing numbers. But I believe this problem presents a big opportunity for Australia as a whole. I come from the Northern Territory, as most members in this place will know. Prior to being elected to this place, I lived on a buffalo holding yard about 65 kilometres out of Darwin. Every afternoon after work I would jump in a bull-catching vehicle, jaunt off through the scrub and get amongst the pigs, as they say in the North. There was no end to the line-up of people who wanted to come out with me. I took out `Crusher' Cleal, a famous rugby league player, and Gary Ablett, a now infamous Aussie Rules player. There was never any shortage of people wanting to go out with me. As a mate of mine the member for Goyder in the Northern Territory Legislative Assembly informed me today, pig hunting is probably the principal pastime of the vast majority of people aged between 16 and 35 in his electorate.
Feral pigs represent a great economic opportunity for Australia. The average pig caught in the Northern Territory is sold for around $1 per kilo to a chiller box operator, who then on-sells it. They dress the pig and then on-sell it to markets overseas. I am informed that feral pig meat goes for about $80 per kilo in the European market and there are not enough processing facilities in Australia to meet that demand. Additionally, a couple of years ago the Japanese wanted 500 pigs sent to them per week, for which they were prepared to pay $60 per kilo.
The big problem I see is not lack of initiative or concern to get rid of the feral pig population in Australia but access to some of the habitats in which feral pigs breed and their numbers increase. A classic example is Kakadu National Park. The government spends close to $1 million a year paying public servants to go out there and humanely shoot feral pigs. Those efforts have not reduced the number of feral pigs, and most Territorians will be able to tell you that the best hunting of pigs occurs on the boundary of Kakadu National Park. The national park is a breeding ground for pigs. We are spending, as I said, in the order of $1 million to eradicate these pigs, irrespective of the fact that there are a number of people who have offered to pay to do the job. Access is the main obstacle. Pastoralists in the Northern Territory found, when the live export markets for cattle decreased, that the only thing that kept them going—that kept them afloat—was their feral pig populations. But additional problems accessing Aboriginal land, involving permit systems, do not present the opportunity for people to get in there and clean up the pig populations.
With regard to hunting pigs, there are some people who have concerns about amateur or professional hunters going into national parks with rifles or the like. I remind the House that pigs can be trapped quite easily without the use of rifles, dogs or knives. Additionally, there are some good checks and balances in the system. Hunters are required to have accreditation so that they know how to properly dress a pig. They leave in vital organs so authorities can identify potential diseases. I commend this motion to the House. (Time expired)",REPS,<title>PRIVATE MEMBERS' BUSINESS</title>,<title>Feral Pigs</title>,Private Members' Business,10,1
"Windsor, Antony, MP",IND,2004-02-16,"—It was with pleasure that I seconded the motion put forward by the member for Calare that promotes a national campaign in relation to feral pig control. If ever there were a need for the nation to take the lead on a particular domestic issue within the agricultural sector, it is on this issue, particularly in regional Australia. There is a need to have a national program, as is being promoted by the Cattle Council, the Australian Veterinary Association and many other groups. 
One of the great difficulties that people have in eradicating feral pigs is the coordination of strategies. I have not only been involved in the shooting of pigs and poisoning of pigs on our own property but have also been on quite a few helicopter shoots in the western parts of New South Wales. In some areas there are quite well coordinated strategies between groups of neighbours, rural lands protection boards and those sorts of organisations; but they are quite small and quite often there are problems with eradication on state boundaries, with different states and organisations having different ways of dealing with the problem. Often you will get a situation arising where one strategy is undertaken on one side of a border and that strategy does not embrace the other side of the border, for some particular reason. It may be due to access provisions, as the member for Solomon mentioned, it may be access to national parks, or it may be bordering a state boundary. There are all sorts of strategic problems with the way the system is set up at the moment.
If we are talking about border protection and the protection of our capacity to be involved in free trade—both very pertinent issues of the day—we really must start to talk about the potential of disease and the way in which it can be spread by feral pigs. That issue must be looked at on a national basis. You cannot leave it to the ad hoc processes that we have now. I do not think that we are doing enough in relation to feral pig control. I support a national program and, as I said, I think it is something that the states should have been looking at. I would take the motion before us one step forward, by calling on all those involved—the Cattle Council, the Australian Veterinary Association, the farming community generally and our trade people—with the federal government taking the lead, to come together in some form of national summit to organise a strategy for feral animal control. I do not just say `feral pig control', although it is probably the worst of the lot, but say `feral animal control'. In my electorate, for instance, there are feral pigs across a wide expanse, but there has also been an outbreak of the dingo population, particularly in the Tenterfield area. There, again, the problem that the member for Solomon commented on, about the breeding grounds within national parks and different strategies adopted for controlling feral animals within national parks, needs to be addressed.
If we are serious about the protection of internal Australia—and we seem to be very serious about our external protective mechanisms and allowing, or not allowing, people to come to our nation—we should be very serious about the threats within, particularly the spread of disease, the impacts on the environment that the member for Calare mentioned, and all the other economic disadvantages that are incurred by allowing these feral animals to go about their business as they are now, without a national approach to the problem.",REPS,<title>PRIVATE MEMBERS' BUSINESS</title>,<title>Feral Pigs</title>,Private Members' Business,10,1
"Cobb, John, MP",NATS,2004-02-16,"—As a farmer who has probably bred and harboured his fair share of pigs over the years, I guess I can sympathise in quite a large part with the member for Calare's motion. Without doubt, the pig is not an animal that is conducive to the Australian landscape—except to those who want to raise them; it certainly is conducive to them. The pig is probably one of the toughest animals you strike out in the bush, and it certainly does do a lot of damage in an environmental sense, but more particularly it does a lot of damage to our domestic livestock. It is a particularly harsh animal on lambing ewes. Anyone who has ever seen a pig attack a live sheep that is bogged in a dam will not have much sympathy for the pig. They are a pretty terrible animal for Australia's domestic livestock.
Without doubt, if we should have an outbreak of foot-and-mouth disease, or any other exotic disease, the pig is probably one of the gravest risks we run—along with foxes and crows—as to what could be carried from one area to another, and pretty rapidly at that. There are, however, parts of this motion that I do have some contention with. One is that the feral pig population is 23 million. I think that is an absolute top figure, and I do not think there is any question that it is that high. If you look at the reports you will see that they say the population is somewhere between 2½ million, or three million, up to 23 million. We are probably looking at a figure of around 13 million or 14 million.
But that is not the main issue. It has been determined pretty strongly that it is almost impossible to eradicate pigs in Australia today. There are areas of concentrated pig population, and there is an enormous impact on not just the domestic farming situation but also the environmental situation. Those concentrations of pigs are what we have to deal with, and it can be done. One of the biggest problems is getting farmers—and I am a farmer, so I ought to know—in an area to agree about how to handle them. In New South Wales, for example, we have the rural lands protection boards, which are funded in large part by the Commonwealth government, to help eradicate them. My wife is a director of the rural lands protection board in our area, and every time they try to run a campaign it is very hard to get all the farmers in the area to combine to do it. If they did, this problem would be a lot easier.
But we do have two situations: we have regions where there are scattered populations of pigs but not a lot of them, and there are areas where pigs are concentrated and where they must, should and can be dealt with. As I said, we have to get cooperation from the farmers, and we also have the other problem referred to by the member for Solomon, which is state and national parks. People who could help us a lot are the pig hunters, who do one hell of a good job, but parks tend to not allow them in. They do baiting and other programs in some cases but, by and large, they do not let pig hunters in. Let me tell you something about pig hunters: they do a good job. I remember that the previous New South Wales Minister for Agriculture, Richard Amery, wanted to ban pig hunting with dogs and so on, but that is the wrong attitude. They are far better off keeping the pig population down than they are hanging around town drinking grog or smoking marijuana. Hunting pigs is what they do, and they do a damn good job. I think that, whether it is them and their dogs, or whatever it is, they are better off doing that than they are hanging around town on the weekends.
It is not true to say there are no programs. The Commonwealth is involved in quite a few programs including through the money we put into cooperative research centres, CRCs, which are involved in research into effective control measures the federal Department of the Environment and Heritage; the Australian government's $1 million animal management grants program; the Natural Heritage Trust grants for on-ground pest animal management and the National Feral Animal Control Program. The state governments have primary responsibility here, because they are the land managers. We can back them up with money—and in western New South Wales we put well over $700,000 into the Rural Lands Protection Board to help it to be done. (Time expired)",REPS,<title>PRIVATE MEMBERS' BUSINESS</title>,<title>Feral Pigs</title>,Private Members' Business,10,1
"Billson, Bruce, MP",LP,2004-02-16,"—I rise to provide encouragement for the member for Calare on his motion on feral pigs and also to put on the record that there are things happening. We can be a little bit upbeat and a little bit positive about the fact that progress is being made. Perhaps his motion best reflects a bit of a `come on', a bit of encouragement to keep that work going. 
What I knew about feral pigs before being asked to speak on this I could have written on the back of a postage stamp, so my research has been quite thorough. I was encouraged to make a contribution. The best thing we can do at a national plan level is to not teach pigs how to swim. I am told, reliably, by my parliamentary colleagues in the north of Victoria that we do not have too many feral pigs there and that, as long as the Murray River flows, the feral pigs will stay mainly in New South Wales. That is the first part of our national plan—to not teach feral pigs to swim!
Feral pigs are a significant problem for farmers because they eat crops, pastures and lambs. The concern of conservation interests around feral pigs is their selective feeding, their trampling and their eating habit called `rooting', where they dig out the roots of plants. That can have a negative impact on native plants and animals, including invertebrates.
I am also grateful to Choquenot, McIlroy and Korn, who in their 1996 publication entitled Managing vertebrate pests: feral pigs, published by the Bureau of Resource Sciences, highlight the quarantine risk that feral pigs represent in respect of the breakout of exotic diseases such as foot-and-mouth disease. On the other hand I am told, and reliably assured by my colleague the member for Solomon, that feral pigs are quite a luxury in the EU. A feral pig hits the EU market at $80 a kilogram, and a feral pig into Japan is $60 a kilogram landed. That represents a substantial return on a natural resource that is causing problems for our farmers, for our environment and for our land managers. 
The government recognises and understands the concern about the impact of feral pigs. As I mentioned earlier, it is not as if the government has been sitting on its hands on this. The livestock production values and the environmental values that are damaged by feral pig populations are a huge motive for federal government involvement. As my colleague Mr Cobb mentioned, nearly three-quarters of a million dollars is being spent this year on tackling feral pigs. But the responsibility rests primarily with the states, as they are the primary land managers and constitutionally the jurisdiction with responsibility for land and water management.
Notwithstanding that fact, it is known that there is a feral pig problem in Kakadu, and steps are being pursued to address that through the threat abatement plan for predation, habitat degradation, competition and disease transmission by feral pigs, known as TAPP. That plan sets the national framework to guide the coordinated implementation of these objectives and actions to contain the spread of feral pigs, which have been recognised as a threatening process. The impact of feral pigs on threatened species in ecological communities is an issue which has been recognised under the Environmental Protection and Biodiversity Conservation Act. For my colleagues on this side, that is a harmonious coming together of interests through the EPBC Act. The three-month public comment period for the threat abatement plan for predation, habitat degradation, competition and disease transmission by feral pigs is now nearing its end. The final version of that plan is currently being prepared for ministerial endorsement. So there are things going on.
There are seven key objectives for the prevention of the establishment of feral pigs in areas where they are not currently present. I draw people's attention to the relatively inconclusive research available about the extent of the problem. To give one example and point out why there is a need for the kinds of research my colleagues have spoken about, there is a thought that the typical density of feral pigs is about one to two animals per square kilometre, but up to 80 pigs per square kilometre have been recorded in the Macquarie Marshes in New South Wales. So you see there are very high concentrations of feral pig populations. As I said earlier, there is an integrated strategy being put in place. I would encourage all the stakeholders to get behind that strategy. 
Feral pig management in national parks is an issue for the Commonwealth. The Kakadu National Park Plan of Management addresses these issues. There is clearly work to be done as we better understand the plight of land managers and the consequences of a pig population that we can only nail down to a range of 3½ million to 23½ million. That is a huge window of potential population and underscores the need for further research and investigation, which is at the heart of the Commonwealth's response.
There are other issues around quantifying the environmental impact on threatened species in ecological communities. An example is turtle eggs. There is evidence that a feral pig can have a devastating impact on the turtle community, and I would encourage cooperative efforts in that area. (Time expired)",REPS,<title>PRIVATE MEMBERS' BUSINESS</title>,<title>Feral Pigs</title>,Private Members' Business,10,1
