name,party,date,text,chamber,debate_title,subdebate_title,debate_type,debate_id,subdebate_id
"Nettle, Sen Kerry",AG,2005-12-06,"—The Australian Greens oppose schedule 1 in the following terms:
(1)    Schedule 1, item 9, page 6 (lines 2 to 11), TO BE OPPOSED.
This amendment has to do with the definition of advocating a terrorist act. The Australian Greens amendment is to oppose the section. It is a section which we had a significant amount of debate about in the Senate inquiry. It is worth noting that, as in previous inquiries held by the Senate Legal and Constitutional Legislation Committee, we were provided with assistance from the Attorney-General’s Department. It indicated that protests like, for example, those outside the front of Woomera Detention Centre at Easter some years ago may well fall under the definition of a terrorist act.
One of the reasons the Australian Greens have a particular objection to this part of the bill is that the definition of a terrorist act is so broad. As I said, we had members of the Attorney-General’s Department indicate to us that they believed it would also include the actions of protesters out the front of somewhere like Woomera Detention Centre. We need to be very aware of and careful about sections like this one, which allow an organisation to be found to be unlawful because it is involved in directly praising the doing of a terrorist act. If a terrorist act is defined that broadly then organisations like the Refugee Action Collective or other groups that advocate activity that the government chooses to define as a terrorist act could be caught in that.
We are well aware from the track record of the government that they are quite willing to use intelligence information to suit their own political agenda. When we look at the way in which definitions around national security were used to support the deportation of the nonviolent peace activist Scott Parkin, it becomes very evident why the Australian Greens, in particular, have concerns about this type of legislation. Every piece of legislation like this, not just in Australia but around the world, has been used against peaceful people who were protesting, whether they were trade unionists, student activists, or feminists who are locked up in Malaysia under the internal security act. The argument put forward for that legislation at the time was that it was about armed communist guerrillas in the mountains. The legislation was then used against a far wider group of people.
We recognise that this legislation will first be used against members of the Muslim community in Australia. It is also clear from the way in which this government is already using its national security powers that it will also be used against peaceful protesters, people like Scott Parkin and others. So we have particular concerns about this part of the legislation. It was something that we were not able to get clear statements on in relation to the government’s intention in this matter.
I now ask the minister about this part of the legislation, which seeks to label an organisation that is seen as praising, urging or counselling the doing of a terrorist act as a terrorist organisation. Could he outline for the chamber at what point the government defines an organisation as having that particular view. Is a statement by the leader of the organisation seen as an indication that the organisation supports, urges or praises the doing of a terrorist act? There was some comment during the committee inquiry that perhaps minutes of a meeting would be needed indicating that the organisation had that view. Other senators rightly pointed out that not every terrorist organisation in the world has meetings for which they keep minutes which could then be used as justification for the view of that particular organisation.
Could the minister indicate to the chamber what the government would require in order to make the determination that a particular organisation held a view about urging, praising or counselling the doing of a terrorist act? That would help the committee to understand the government’s intention behind this legislation, and behind this particular part of the legislation which the Greens now move to oppose.",SENATE,<title>ANTI-TERRORISM BILL (NO. 2) 2005</title>,<title>In Committee</title>,Bills,25,1
"Ellison, Sen Chris",LP,2005-12-06,"—At the outset I say that the government opposes the Australian Greens amendment (1) on sheet 4755. This amendment seeks to delete the definition of ‘advocates’ as defined in subsection 102.1(1). This deletion would create more uncertainty. The government took great care when drafting the definition of advocates to ensure that it was clear in its meaning, and deleting it would result in further uncertainty.
Senator Nettle has asked how you can evidence what an organisation says and does. Of course, that relies on organisational principles—that is, how it is structured and how the opinion is expressed. It would be determined on the facts of the case. The definition of advocates in the bill states:
In this Division, an organisation advocates the doing of a terrorist act if:
(a) the organisation directly or indirectly counsels or urges the doing of a terrorist act; or
(b) the organisation directly or indirectly provides instruction on the doing of a terrorist act; or
(c) the organisation directly praises the doing of a terrorist act.
That is fairly clear as to what amounts to advocating. It is spelt out there.
The question that Senator Nettle asked goes more to the question of the organisation itself: how do you attach the counselling or the expression to an organisation? I think that is where the Greens miss the point with their amendment. They seek to delete ‘counsels’ or ‘advocates’. With an organisation, a normal interpretation would apply. We understand what an organisation means in common parlance. It is usually a group of individuals who organise themselves, normally in a voluntary fashion, for a common purpose. That is something which I think would apply here.
I just want to correct something that Senator Nettle said—that is, that the evidence of the Attorney-General’s Department during the course of the committee inquiry was that a protest could be seen as a terrorist act. I am advised that Mr McDonald, who appeared for the Attorney-General’s Department, made it very clear that a normal political protest would not constitute a terrorist act. I just want to make that very clear as to the evidence that was given before the Senate committee.",SENATE,<title>ANTI-TERRORISM BILL (NO. 2) 2005</title>,<title>In Committee</title>,Bills,25,1
"Nettle, Sen Kerry",AG,2005-12-06,"—Just so the minister understands, I was not speaking about the comments of Mr McDonald at the latest Senate inquiry; it was a previous inquiry of the Senate Legal and Constitutional Legislation Committee in 2002 into the ASIO legislation at which Senator Scullion asked another representative of the Attorney-General whether the circumstances of Woomera would be considered a terrorist act. That was the instance to which I was referring, not the comments of Mr McDonald.",SENATE,<title>ANTI-TERRORISM BILL (NO. 2) 2005</title>,<title>In Committee</title>,Bills,25,1
"Ludwig, Sen Joe",ALP,2005-12-06,"—We are running out of time. I would have liked to have said a lot more about this particular amendment. The Labor Party will not be supporting this amendment. It is not consistent with the Senate Legal and Constitutional Legislation Committee’s findings or our subsequent amendments arising from those findings. The other problem with it goes back to the type of proscription regime that we have in place. We now have a process where those organisations which are proscribed do come back here to the parliament for a check, which I am sure Senator Brown has often recognised as the appropriate place for these things to be scrutinised. That is the system that we operate under. Sedition provisions should be reviewed. The government should also send this off to the Australian Law Reform Commission, but it is not going to do that.",SENATE,<title>ANTI-TERRORISM BILL (NO. 2) 2005</title>,<title>In Committee</title>,Bills,25,1
"Brown, Sen Bob",AG,2005-12-06,"—It goes without saying that what is happening here is that the opposition are saying, ‘We are bound within the limits of what the Senate committee recommended.’ Take that a step further and you see that the committee was represented on the government side by Senator Payne, Senator Mason and Senator Brandis. They made some very strong points, but the government rejected the whole pile of them. However, they did not go to the point of rejecting this legislation as they ought to have or to making the massive changes which would have made it somewhat consistent with international standards or to ensuring that domestic political rights and freedom of speech were assured. You only have to look at the comments from media organisations to see how far short of the mark those recommendations from the committee were in making this legislation safe in terms of protecting free speech and political standards.
What Senator Ludwig is saying is, ‘Our standard here is the same as Senator Brandis’s.’ Senator Brandis came over and congratulated Senator Conroy after his speech last night which, in effect, eulogised what the government is doing here. A senior frontbencher from Labor eulogised this legislation to the point where Senator Brandis and Senator Mason came over and shook hands with him and lauded that speech. It is remarkable politics and a remarkable capitulation by Labor to the government on this legislation. It is a remarkable failure by the Labor Party to stand up not just for international law but also for standards which media organisations, legal organisations and human rights organisations in this country have said are the limits in proportionality.
This is a disproportionate bill. It trespasses against protecting civil rights—that is, the right to free speech, the right not to be held for days, months, weeks and years without charge and the right to have the confidence of your lawyers. These things are broken by this Labor Party and by this government in this legislation. We are going to see the guillotine applied in 10 minutes and Labor collapse into the arms of the government on this sell-out of Australian and international standards in human rights and the right to freedom of speech. That is what we are now confronted with. Labor has aligned itself with Senator Brandis as the arbiter of where the line can be drawn on protecting the rights of Australians against the wishes of the government. Of course, Senator Brandis did not stand by the committee findings at all. Labor is saying it has. It is standing by Senator Brandis’s, Senator Mason’s and Senator Payne’s recommendations of a week ago, even though it will not go quite so far as to the point of their retreat this week at the hands of the executive of the government.
This is an appalling outcome. Both the process and the outcome are wrong. The Australian public expect an opposition with the gumption to stand up against this theft of rights, not least the right of freedom of speech, from the Australian people by the Howard government on this day in the Senate. Instead of that, Labor has capitulated.
Mr Beazley said, ‘We should have included locking down of suburbs when the time comes for a terrorist alert.’ That is in this legislation. Senator Ludwig said, ‘The Chief Minister of the ACT stood up for Labor.’ But we know that he has made it clear that this legislation does not stand by the ACT’s assurance that the International Covenant on Civil and Political Rights should be upheld. We have just had Labor vote against that, against Mr Stanhope’s line in the sand. Labor has sold out today, as the government erodes the rights of Australians. It is unforgivable. I think Labor sold out on its own history of defending those rights, on its own proud record, today in here. That does not excuse in any way the lead role taken by the coalition. This is the government and opposition versus the people of Australia, as I see it. The defence is on the crossbench, with the Greens and the Democrats. I think the Labor Party will come to rue the day it took the decision to fail to defend even international norms, now long established, in the Senate this evening.
The Scott Parkin affair that Senator Nettle referred to is a classic example of the misuse of laws against a person who was no threat to this country. He never was and never will be, but he was deported without any satisfactory trial because the government did not like his presence in this country. I remember very well Premier Gray bringing laws in to make it an arrestable offence to trespass. After hundreds of years of common law said that could not happen, that was brought in because people were going to protest in their own forests by the Franklin River. You know what? Within three years they were arresting unionists on the Burnie wharf under exactly the same legislation.
Let us make it clear to the opposition that this is done with eyes open, and when these laws are abused and used against people who are not planning, plotting or threatening terrorism in this country, it will be not only because the government brought them in today but because the opposition supported them. There should be a ferocious defence of the rights of people to free speech in this country and to vigorous political opposition, but those rights are being threatened by this legislation here today. It is appalling that the Labor Party under Kim Beazley has capitulated to the government because it is frightened to stand up against the use of fear in politics. This moment will pass and we will have more legislation in here and more erosion. While Mr Beazley leads this party, the opposition will continue to capitulate to the government.
This is an extraordinarily low point in the history of politics and the history of oppositional politics in Australia. It is proposed that an opposition, particularly a Labor opposition—a party of social justice—will stand up for justice and ensure that government does not intrude on the rights of individuals, and the Liberal philosophy says the rights of the individual will be protected, and the best the government, echoed by the opposition, can do in here is say: ‘Security first. The primary right is to safety.’ There has been no explanation in this debate justifying these laws. There has been no logic delivered which says, ‘This would have prevented, for example, the London terrorist attacks,’—we know it would not have—or, ‘This will in some way or other add meaningfully to the laws that we already have to surveil, track down, interrogate and arrest terrorists in our midst.’",SENATE,<title>ANTI-TERRORISM BILL (NO. 2) 2005</title>,<title>In Committee</title>,Bills,25,1
"Ludwig, Sen Joe",ALP,2005-12-06,"—We have just heard criticisms on a range of issues. Let me be quite clear about Labor’s position: we are tough on fighting terrorism but we also demand strong safeguards. In this debate we have used our time effectively to hold the government to account, to expose their weakness, to expose their backbench and to see through their rhetoric in the press. What they said in the press seems to be in part, although we had a personal explanation from Senator Brandis, different from what they then said in parliament. Mr Turnbull said one thing in the parliament and he went outside and said another.
The Senate is where you have the opportunity to say what you mean. In this place Labor have said that we oppose the sedition measures. We should divide on that issue. We should ensure that the government and its backbench are put to the test. Mr Turnbull in the other place will have an opportunity when these amendments go over there to also oppose that. I doubt he will. I doubt he will stare down Mr Ruddock, or the Prime Minister, for that matter.
Labor have through this process recognised that the environment in which we live is different, but we have also recognised that we need laws and our law enforcement agencies need the ability to utilise those laws, to ensure that we are free and continue to have the right to be free of terrorism. That is the purpose of this legislation—to ensure that those rights are also championed. Labor have been strong on UN conventions and principles. Bob Brown, you know that as well as anyone else in this chamber.

Senator Bob Brown interjecting—

—Labor have championed those principles over and over again. Labor are the only party that can hold this government to account and we have done so many times before today. Senator Brown, you know that and you continue to barb us, when in fact the coalition is the enemy in this. The coalition needs to listen to the debate here.

Senator Stott Despoja interjecting—

—Sorry, Senator Stott Despoja, the time allotted for the consideration of the remaining stages of the bill has expired.
—Can I seek leave?
—No, the guillotine cuts in now.
—There are 34 amendments. It is my third chance. That is not your decision. I just want to record my disgust.
—Senator Stott Despoja, as I said, the time for the consideration of the remaining stages of the bill has now expired.
—Mr Chairman, I rise on a point of order. I think Senator Stott Despoja has every right to seek leave. It is up to the government, if they want to, to deny that leave.
—Senator Brown, leave does not apply with the operation of the guillotine. The guillotine cuts in automatically. For the benefit of the committee I have had circulated a sheet which will outline the way the remaining stages of the bill and the outstanding amendments will be dealt with. Unless anyone has any objection, I intend to proceed down this path. The question is that item 9 of schedule 1, as amended, be agreed to.
Question agreed to.
—The question is that Australian Democrat amendments (17) and (18) on sheet 4764 revised be agreed to.
(17)  Schedule 4, item 24, page 72 (line 24), omit “but solely”, substitute “including”.
(18)  Schedule 4, item 24, page 74 (lines 8 to 27), omit subsections 105.38(1) to (4).
Question put.",SENATE,<title>ANTI-TERRORISM BILL (NO. 2) 2005</title>,<title>In Committee</title>,Bills,25,1
"Wong, Sen Penny",ALP,2005-12-06,"—Firstly, I will start with a number of questions for the minister, although I note that he does not appear to have any advisers here. I am not sure if he wants me to talk more generally for a period of time. I suppose the first issue would be the evidence that was presented to the Senate Community Affairs Legislation Committee inquiring into this legislation. A great many submitters discussed their concerns about the bill and, in particular, made the point that the government had not presented any evidence that shifting people onto a lower payment would in fact help them get a job or have any effect on increasing the participation rate.
The committee asked this question of the department on, I think, the Monday and the department took it on notice. On the Wednesday the department provided references to a few international studies—some of which looked at the effect of increasing income support payments and the effect that would have on labour force participation, which obviously in this situation is entirely irrelevant. The committee was also presented with evidence by the department of a study—which I understand the government does not rely on—on the possibility of theoretically abolishing the social security system and whether that would help people get work. Can the minister confirm that the government has undertaken no modelling, economic research or any research whatsoever that it is putting forward with this legislation to the Senate that demonstrates that a reduction in income support payments will actually lead to a rise in labour force participation?",SENATE,<title>EMPLOYMENT AND WORKPLACE RELATIONS LEGISLATION AMENDMENT (WELFARE TO WORK AND OTHER MEASURES) BILL 2005</title>,<title>In Committee</title>,Bills,26,1
"Abetz, Sen Eric",LP,2005-12-06,"—We have been through this during question time from time to time over the past few days and weeks. The answer will not surprise Senator Wong. It remains the same—that we as a government are committed to making the shift from welfare to work for many people in Australia who, unfortunately, are not engaged in the work force. Many people have spoken about it and everybody wrings their hands about it, but as yet nobody has come up with a policy to address it, other than the government.
The government’s approach is clear. One is an adjusted welfare payment and the other is to invest heavily in those individuals through the $3.6 billion fund that I have referred to previously, which will invest in those individuals’ futures and job readiness. Talking of job readiness does allow me to correct that which I think I have said a few times at question time—that is, that there is in fact a job shortage as opposed to a workers shortage. In this current environment where there is a jobs surplus and people are not being found to fill job vacancies, we are living in an ideal climate to assist people to make that important switch from welfare to work. As one former Labor leader once said, it is more important to talk about the people’s social interaction and engagement with the community at large, dealing with the issues of self-esteem and self-worth, than to talk about what material support is provided.
In relation to whether or not we have done modelling, I do not think any specific modelling has been done—but that of itself does not mean that the policy is necessarily wrong or flawed. As I indicated earlier, there has been no genuine model put forward by others in this place or in the community at large as to how we ought to be overcoming this huge dependence on welfare, where people are, on average, staying on welfare for, I think, 12 years or more. It seems to us as a government that that shift has to be made. We are seeking to address the situation. Will it be perfect? No, it will not be—but it is the only policy that is actually on the table to be discussed and considered. I would invite honourable senators to look at the policy and accept that it is the policy that is currently on the table. If others have better policies to offer, possibly now is the time to put those forward—rather than simply oppose, as we have so often seen with previous reform proposals that have come before this chamber.",SENATE,<title>EMPLOYMENT AND WORKPLACE RELATIONS LEGISLATION AMENDMENT (WELFARE TO WORK AND OTHER MEASURES) BILL 2005</title>,<title>In Committee</title>,Bills,26,1
