name,party,date,text,chamber,debate_title,subdebate_title,debate_type,debate_id,subdebate_id
"Eggleston, Sen Alan",LP,2005-12-06,"—The opposition is drawing a very long bow in trying to suggest that there is anything improper, wrong or unfair about the way this particular individual has been treated. In seeking to draw comparisons with the Alvarez and Rau cases I think Senator Ludwig is wide of the mark. We all know that Australia is a signatory to the United Nations convention on human rights, which was signed way back in the 1950s. We do offer people who have a genuine fear of persecution refuge in this country. I must say that we have a very fine record in that regard. Of the nations of the world, Australia has one of the highest percentages of refugees as a percentage of our migration intake. In fact, Australia takes around 13,000 refugees per year. Australia is consistently, in fact, ranked in the top three, along with the United States and Canada, for offering refugee resettlement. We work closely with the United Nations Commissioner for Refugees to determine the priority for resettlement. We do take care to ensure that we are fair in the way we operate our refugee program.
In this case, from what I can gather, Mr al-Tekriti came from Iraq to this country and was considered for a protection visa. People have raised some objections because it has been alleged that this individual was part of the protection detail or guard of Saddam Hussein. Nevertheless, he came to Australia and was assessed under the United Nations convention rules and against the requirement that he have a well-founded fear of persecution. He was found, in fact, to be a genuine case. As I understand it, this case was considered extensively by the Commonwealth Administrative Appeals Tribunal. He was not to be excluded from refugee protection. This conclusion is binding on the department of immigration. I think that we should remember that Australia is a country in which the rule of law prevails. We conduct our affairs under the rule of law. This man has the protection of Australian law and has been found to have a right as a refugee to claim a protection visa.
In this matter, I think the Labor Party are rushing judgment somewhat and being unfair to this individual because of the alleged connection that he has had with the regime of Saddam Hussein. I venture to speculate that even though persons who worked for the government of Saddam Hussein might have all been seen as fellow travellers of Saddam Hussein, many of them in fact disagreed with the policies of the Saddam Hussein government and probably lived in fear of their lives and were looking for ways to get away from the country. I read a story quite recently about the pilot of Saddam’s personal aircraft. He was in exactly that kind of situation, and he eventually absconded with the aircraft from Baghdad to a European airport and sought refugee status. So I would urge the ALP to be a little more open-minded about this, to accept the findings of the Administrative Appeals Tribunal and to respect our laws that have given this man refugee status.",SENATE,<title>QUESTIONS WITHOUT NOTICE: TAKE NOTE OF ANSWERS</title>,<title>Mr Oday Adnan al-Tekriti</title>,Questions Without Notice: Take Note of Answers,8,1
"Kirk, Sen Linda",ALP,2005-12-06,"—I rise this afternoon to take note of answers given to questions asked of Senator Vanstone in question time today. Senator Ludwig and I asked the minister questions in relation to Mr Oday al-Tekriti concerning his status here on a temporary protection visa. This is a matter that has received a great deal of attention in the last couple of days in the media. There have been concerns as to his activities prior to him coming to this country. He was previously a citizen of Iraq and he came here to this country in 1999 and now holds a temporary protection visa here.
Mr al-Tekriti fled Iraq in 1999. His father had been murdered for speaking out against the regime of Saddam Hussein. Mr al-Tekriti arrived here in Australia in 1999 on a boat from Indonesia. When he first arrived he sought a protection visa but this visa was refused because at the time there were ‘serious reasons for considering that he had committed war crimes or crimes against humanity’. So at the initial stage his protection visa was refused by the department. He appealed to the AAT, the Administrative Appeals Tribunal, against this decision and the decision was overturned in June 2001. The reason for it being overturned was that the AAT found that there was in fact no evidence that he had been involved in crimes against humanity. It is for this reason that he holds a temporary protection visa today.
In the last few days concerns have come to light that perhaps the decision made by the AAT may not have been the correct decision, and that is the reason this matter is being raised in the Senate today and in the newspapers. The reason it has been raised in the Senate and questions are being asked of Senator Vanstone is to see whether Senator Vanstone has been making inquiries in relation to this matter. That was the nature of the questioning here today: whether she had made any further inquiries of the department or whether she has any continuing concerns in relation to Mr al-Tekriti.
We are told that an appeal was lodged against the decision of the AAT but that it was withdrawn. This is where the concerns of the opposition lie. We would like to know the reasons for the withdrawal of the appeal. The problem we have is that this matter has not received the attention of the public. This information has not been released into the public domain. This is a matter which has been kept quiet and it is not something that the minister has made public. Assuming, of course, that it is something that is not going to breach the privacy of Mr al-Tekriti himself, this is something that ought to allay the concerns that there are in the community. Our shadow minister, Mr Burke, and the Premier of South Australia have said that this is a matter that should be made public. This is what we in the Labor opposition have also said. We believe that this is a matter that requires further investigation.
We are not saying at this stage that there is any suggestion that Mr al-Tekriti’s temporary protection visa ought to be cancelled. All we are suggesting is that it requires further investigation and that the reasons for the decision of the AAT ought to be further investigated and made public. This also has to be seen in the broader context. Coming from South Australia where individuals and groups such as the Bakhtiyaris were deported in circumstances where there seemed to be very little investigation, we would like to see this matter handled much more sensitively.",SENATE,<title>QUESTIONS WITHOUT NOTICE: TAKE NOTE OF ANSWERS</title>,<title>Mr Oday Adnan al-Tekriti</title>,Questions Without Notice: Take Note of Answers,8,1
"Barnett, Sen Guy",LP,2005-12-06,"—I stand to take note of the answers given by Senator Vanstone to the questions from the opposition which related to Mr al-Tekriti, who is from Iraq and who is now living in Australia. The answers also related to allegations made by the Labor Party about the government’s response to the Cornelia Rau case and the Vivian Alvarez case, and the role of DIMIA in those two particular matters. I wish to address both of the allegations made by the Labor Party, because they are potentially what you would call in politics ‘cheap shots’. These are matters which need very circumspect consideration.
Firstly, with respect to the al-Tekriti matter, this was a matter that was considered by the Administrative Appeals Tribunal at the Commonwealth level. The tribunal found that he was not excluded from refugee protection. That particular finding is binding on the Commonwealth and on the department of immigration. He was assessed as a person who had a well-founded fear of persecution—that is very important. In terms of the evidence put to the AAT, this was found to be justifiable; it was substantiated. The decisions made by the Administrative Appeals Tribunal, albeit that it is not a judicial body—as you would know, it is an administrative body—are taken objectively and are based on the facts put before the tribunal. In this case, the decision was made that he was entitled to the protection visa.
Senator Ludwig and Senator Kirk have asked why the minister or the government do not release further and better particulars and why they do not release more information. Let us be circumspect about this. We are talking about a protection visa for a man who is from Iraq and who has a well-founded fear of persecution. Where is he from? Iraq. Where is his family from? Iraq. Let us think of the potential concerns that could be facing his family in Iraq if those further and better particulars were made public. What sorts of concerns would they be facing? We in this chamber do not know. You want to make public and spray about all this information about this man’s family when he is under threat and has a well-founded fear of persecution. Releasing matters private to him and his family is entirely inappropriate.
In my view, the minister’s answers were entirely appropriate and proper. They put due consideration of family members first. This is an issue that the Labor opposition simply refuse to acknowledge. Those family members may be at home in Iraq and at risk of persecution. I do not know, but this is a matter that the minister needs to take into account. That is the point.
—It is because he is married to a Liberal member of parliament.
—No. You do not know the situation in Iraq. You do not know the details. I had a briefing on Monday of last week with a very senior military official from Iraq and I can assure you that his family’s position in that country—and that of many others—remains very much at risk and is of great concern. These are the issues that the Labor opposition ignore when they ask these questions. There is the possibility that this is a cheap shot. Maybe it is simply that they have gone overboard in wanting more information. The response has been given by the minister, and the minister’s response was appropriate.
In response to the opposition’s views with respect to Cornelia Rau and Vivian Alvarez, the government has provided an apology to both those people. Are they trying to stir the pot again and make false and misleading allegations against the minister? The minister responded with an apology on 6 October. (Time expired)
",SENATE,<title>QUESTIONS WITHOUT NOTICE: TAKE NOTE OF ANSWERS</title>,<title>Mr Oday Adnan al-Tekriti</title>,Questions Without Notice: Take Note of Answers,8,1
"Crossin, Sen Trish",ALP,2005-12-06,"—The real issue at stake in the debate today regarding the answers from Senator Vanstone is the fact that we do not have a minister who is in control of her department and who takes responsibility for her department’s actions. As we get to the end of the year, if we had to do a report card on the performance of this minister and her oversight of the department, we would only have to go and look back at the litany of press releases and press comments throughout the year. This department’s performance has been a litany of errors. There is example after example of mishaps, cover-ups and inconsistencies, and this is yet another example.
Back in July, we had the headline ‘Vanstone pressed to explain latest bungle’ in the Sydney Morning Herald over the Hwang children and the requirement to place them in a detention centre. If you remember, they were snatched from school. In July in the Australian, Mike Steketee wrote,  ‘Something rotten in Immigration’. Then in October in the Age, Michelle Grattan wrote, ‘No contrition from a joking Vanstone’. ‘Immigration reform reaches a dead end’ was a headline in the Sydney Morning Herald in October. The list goes on and on. And today we have critical comments about cultural problems in the department of immigration in a commentary about the state of the Public Service, and we have another comment in the Age about this minister and the way in which this department is being managed and handled badly.
There is a litany of evidence that shows us that this minister is not on top of the issues in her department and that she does not have a handle on the mishaps, mistakes and inconsistencies that come before the press on almost a weekly basis. This is a minister who presides over a department that has no consistent checks and balances. This is a minister who presides over a department that has systemic failures in its processes and procedures. The department has an inhumane culture, is resistant to scrutiny and resists any evidence or truth about matters being aired or made public. It has a culture of cover-up.
This is a department that has an attitude of indifference to human rights issues, and it is a department that has poor communication within the department, between the department and the minister’s office, and, more particularly, from the minister’s office down through the department levels. This is a minister who presides over a department that lacks integrity and accountability—a department where processes are ineffective, to the point where this department is now becoming incompetent. As Kim Beazley said and is reported as saying in the media today:
The immigration department is a turnstile of incompetence. There is just one event after the other.
What is the issue here today that we want to ask the minister about but she refuses to give us answers for? The bodyguard of Saddam Hussein entered this country and was denied a temporary protection visa in 2000—probably quite rightly so from the evidence that has come before the public in the last 48 hours. That decision was overturned by the Administrative Appeals Tribunal in 2001. We want to know why. On what basis was it overturned? Was there political interference in that decision? Were they directed to overturn that denial of a visa? Is it linked to any relationship with a particular person in the Liberal Party in this country? And why was there a decision to pull out of the appeal?
We are after some real answers to some questions. When we asked questions in relation to the Vivian Solon and Cornelia Rau cases, we got an international embarrassment. The answers highlighted international mismanagement regarding the way in which this minister cannot properly manage her department and is not on top of the issues. We want some more answers about this. We want to further expose and continue to expose a minister who is not competent in managing a department—a minister who refuses to take responsibility and accept responsibility for the continual mishaps, mistakes and cover-ups that this department presides over, and this is just one more example of that.",SENATE,<title>QUESTIONS WITHOUT NOTICE: TAKE NOTE OF ANSWERS</title>,<title>Mr Oday Adnan al-Tekriti</title>,Questions Without Notice: Take Note of Answers,8,1
"Bartlett, Sen Andrew",AD,2005-12-06,"—It is probably a noteworthy thing I am about to say—one that the sharp-eared media reporters in the gallery might listen to. I would like to defend Minister Vanstone in regard to this matter. That is not something I do terribly often in regard to visa controversies, but I have found some of the coverage of this particular issue in some of the press a bit confusing. That is not because I do not understand the issues—I think there is no area I know better than this area—but because the different concerns that are raised are almost conflicting. We can see that in the quite strange scenario we have had in the last 20 minutes or so.
We have had the quite unusual situation of conservative members of the government standing up and saying: ‘We can’t send people back to Iraq—it is too dangerous. We have a duty to protect people from refoulement and from being sent back to places where they mightn’t be safe.’ I could not agree more, but I wish I had heard it for the many other cases and examples where this department seems to have gone out of its way to ignore that very serious obligation just because the people they are sending back are a bit inconvenient.
I have no doubt that the issues surrounding this person who has got a lot of coverage are inconvenient, but, from the facts that I am aware of and that are on the public record, it is a case where the system seems to have worked. A person had allegations against them in regard to their activities in Iraq, and those allegations were deemed to be of some substance by the immigration department and were such that he was not granted a visa. He appealed that to the independent tribunal, as is his right—and, I would very strongly argue, as is absolutely essential—and that tribunal, in considering all the evidence independently, found that the evidence did not stack up and that the case was not such that he should be denied a visa under the exclusion provisions of the refugee convention. I argue that that is a sign of the system working well: the department do not like somebody because they are possibly a bit suss and there are some allegations around that do not sound good, but when the allegations are actually tested by an independent tribunal they have found that the evidence does not stack up.
I would contrast this case to—interestingly, a little curiously and slightly paradoxically, in that the same journalists who revealed this case in the Fairfax papers also revealed today this case—the case of Mr Noori, who has been in Villawood for the last six years and whom I have spoken of in this chamber a couple of times and written about on my web site. He was also denied a visa for the same sorts of reasons—allegations of inappropriate activities that meant he would be excluded from protection under article 1F of the refugee convention. That was on the basis of anonymous allegations made about his alleged involvement in a unit of the former communist Afghan government. The big problem with that was that, when he went to the AAT to appeal that, he was not given the opportunity to find out what those allegations were, to counter them or to defend himself.
It has taken six years, all the way up to the full bench of the Federal Court and back down to the AAT again—because the court found that he was denied natural justice—for him to now get the chance to answer the allegations and clearly demonstrate that he is not the person who allegedly committed the activities. The bizarre thing is that, despite that decision of the AAT, I think nearly two months ago, he is still in detention. His wife and his two or three children have been out in the community for six years. They are now Australian citizens. They have grown up without him. And he is still jailed nearly two months after the AAT found that he did not have a case to answer. My understanding is that that is because it is only now that ASIO has decided to do the character and security checks, when it has had the last six years to do that.
However, that is an example of what happens when the system goes wrong. I do not personally know this person who has had the coverage in the last day or two. I know a few people who do know him and vouch for him in terms of how he has behaved in Australia. I do not think any of us are in a position to judge one way or the other the full details of what he may or may not have done back in Iraq, but the fact is that those decisions about what he may or may not have done have to be based on solid evidence, not just hearsay or fearmongering. He has the right, the same as anybody else, to have that evidence tested independently in a tribunal. I would be very concerned if those sorts of rulings were undermined or potentially overturned because of political pressure about allegations that are proved not to stack up once they have been independently assessed. I also emphasise that, in the test under the refugee convention, the threshold for being suspected of being associated with a group of people who may have committed a war crime is much lower than the threshold under the Crimes Act for being personally responsible for committing one. It is a much lower threshold, and despite that this person has not reached it. (Time expired)

Question agreed to.",SENATE,<title>QUESTIONS WITHOUT NOTICE: TAKE NOTE OF ANSWERS</title>,<title>Mr Oday Adnan al-Tekriti</title>,Questions Without Notice: Take Note of Answers,8,1
"Brown, Sen Bob",AG,2005-12-06,"—Pursuant to contingent notice, I move:
That so much of the standing orders be suspended as would prevent me moving a motion relating to the conduct of the business of the Senate, namely a motion to give precedence to general business notice of motion no. 343.
I move this motion for the suspension of standing orders because the substantive motion is a straightforward motion which abhors the hanging of Van Nguyen in Singapore last Friday and reiterates the opposition of the Senate to the death penalty wherever in the world it may be invoked. I know the government has some difficulty with that wording, but I simply do not understand that. There can be no doubt from the debate that I have previously heard in this chamber that there is abhorrence on all sides at the hanging of Van Nguyen in Singapore in Changi Prison at 6 am, their time, last Friday. It was a cruel and unnecessary judicial murder and abhorrence of it has been expressed by many people in government as well as in opposition and in the community.
I know that the Attorney-General described the prospective hanging, as it was last week, as barbaric. Barbaric it was; barbaric the mandatory death penalty is. And it is very important that we say so. We will not change this barbarism if we do not call a spade a spade and do not express to our neighbours—particularly those who believe that a debate of this sort ends at borders and call for sovereignty to be respected—that we feel this way. And if the High Commissioner for Singapore thinks we should respect Singaporean sovereignty in the matter then so the Singaporean government should respect our sovereignty. In our sovereignty we, unlike Singapore, have a robust freedom of speech in this country. We respect oppositional politics but we respect the right of everybody to say what they think about the behaviour of government. Singapore does not do that but Australia does.
The second component of this motion is that the Senate reiterates its opposition to the death penalty wherever in the world it is invoked. Last week, we passed a motion, which I had originally cast in terms of ‘abhorring’ the death penalty, but which the government successfully changed to ‘opposing’ the death penalty. I do not know whether the government’s opposition is because of the extra words ‘wherever in the world it is invoked’. Obviously that includes countries like China, Indonesia and the United States of America, but opposition to the death penalty cannot be selective. It is a matter of morality that does not end at borders. It is a universal feeling that the death penalty should not be countenanced. That is written into international law, and Australia was a very early signatory to that law.
Australia has done away with the death penalty for many decades. I know that people think that it is a prerogative of Western countries, certainly of rich countries, to have done so. That is not so. Costa Rica, for example, did away with the death penalty a long time before Australia did. Costa Rica is a proudly democratic country, surrounded in the past by some very cruel dictatorships, which has held on to its democratic principle and the abolition of the death penalty for almost a century now. The United States has recently killed the 1,000th person since the suspension of the death penalty two decades ago. We must abhor that. On the figures I have heard, up to one-tenth of those people might have been innocent. It is a dreadful, unnecessary and pointless punishment, which does not bring people back. I commend this motion and I do not understand the government’s quarrel with it.",SENATE,<title>MR NGUYEN TUONG VAN</title>,<title>Suspension of Standing Orders</title>,Motions,20,1
