name,party,date,text,chamber,debate_title,subdebate_title,debate_type,debate_id,subdebate_id
"Evans, Sen Chris",ALP,2005-12-06,"—I want to make a short contribution to the debate and pick up some of the issues that Senator Bartlett has quite rightly put, but I want to come at it from a different angle. In a bit of a rare entree for me, I want to come at it from the right-wing perspective. My concern about the package is not just that it is unfair on those on welfare and that it seeks to punish some of the most disadvantaged in our community; my other concern is that in fact it does not meet the government’s own objectives, that it fails in its economic objectives. On that basis, I think the bills ought to be rejected. We have focused a lot on those who are disadvantaged by these changes. The government has said: ‘That’s not fair. You’ve got to look at the totality of the package.’ If Senator Abetz has said it once, he has said it a hundred times.
—It’s finally got through.
—That is right. In my speech in the second reading debate, I tried to focus on the totality of the package.

Senator Abetz interjecting—

—Well, you ought to read it. As Senator Bartlett quite rightly pointed out, the key issue and the thing that has got most people concerned is the change in welfare payments. After 1 July 2006, single parents or those who gain a disability are to be treated in a different way. The government said all through this debate up until the bills were finally introduced to the parliament, ‘We don’t want two classes of people.’ The mantra was: we do not want two classes. Mr Dutton was still running that line in March.
Of course, what did we get in May? We got a system that set up two classes of people—those on the DSP before the changes and those on it after and those on parenting payment before and those on it after. Clearly there are two different classes of people. What is missing from this government package that was there in 2002? I will tell you what is missing: the government proposed in 2002 that the work test measures et cetera would be applied to all recipients of DSP, but this package does not do that. The Treasurer lambasted Labor for three years over its failure to support the 2002 measures. He attacked us again and again because he said that reform of the DSP was central to welfare reform, that it was the reason the government was doing this. He said we have 708,000 on the DSP and they are a chain around the neck of the economy, that while some of them are genuine, there are real problems with this group. That was the rationale for welfare reform. He said at one stage:
There are now one in eight men over 55 in Australia on the disability support pension. Now there are men with bad backs who cannot work. I accept that and they should be on the disability support pension. But do you think that one in eight men over 55 in Australia is disabled?
That came in April this year just before the budget. He continued to attack Labor for its failure to support the 2002 reforms, he continued to complain that there were too many people on the DSP and he continued to say that the main reason for this whole reform was to deal with that problem. It is funny, isn’t it? That reform is not in this package. The main rationale for welfare reform is not here. I looked at what this did for the 708,000 people on the DSP and I could not find it. There is nothing here. Why? That is a good question.
It seems to me that at that fateful dinner on 2 May 2005, which we learnt about at estimates, when the Treasurer and Mr Howard sat down to dinner, they nutted out the welfare reform package, because what was presented by the department to that meeting was severely altered, as shown by the evidence given. Basically the Treasurer, with his history of being rolled, was rolled again. The Prime Minister said to him: ‘No, mate. There isn’t going to be any harm to us out of this. We are not going to bite the hard politics. We’re going to make it soft. All the victims will be after July 2006. I’m not having 708,000 disability support pensioners mobilised against us. There won’t be any ready victims. The victims will all be prospective victims. They’ll be people who get disabled after July 2006. They’ll be people who become single parents after July 2006.’ I am sure the Treasurer argued that what he had been saying for the last three or four years would be a nonsense. But Mr Howard insisted: ‘No. It’s a victory for politics over policy. We can’t have victims. We can’t have the churches and others mobilising these people.’
So what did we get? We got two categories each of DSP and parenting payment people. The attack was on the future recipients. Those that are currently on welfare would be grandfathered—1.3 million people currently on welfare are not contained in the major change in this package. Why? Because the government lacked the guts. It had said that that group was the economic problem, but it lacked the political courage. So what did it do? It grandfathered them. I am not arguing that they should have had their benefits reduced; quite the contrary. But, if the government’s claims for reform are to be sustained, it has to prove what it is doing about the problem, as it says it exists, in welfare in this country. And it has ducked it. What it is doing is attacking the problem that it says will emerge after July 2006. The economic credentials of the government in relation to welfare reform are in tatters because it went for the easy politics over the policy. The DSP recipients currently in the system will have no activity test, no change in their benefits and no extra assistance to move them off welfare and into work. That is 708,000 people on the scrap heap. Forget them—too hard. There will be no help, no assistance. The people who the Treasurer said were the cause of all the problems, the reason we had to have these bills, are pushed to one side. So they get no assistance, but they are left alone.
The interesting thing we learnt in recent times is that not only are there 708,000 people on the DSP but even under the government’s grand welfare reforms there will be an extra 53,000 people each and every year going onto the DSP. So not only has the DSP list not been tackled; it will continue to grow. That is welfare reform under the Howard government. This is great reform! The DSP rate of increase may slow slightly, but there will be 50,000 extra each year. Gee, they have really tackled the hard issues, haven’t they?
What do the government go for instead? They take the easy kicks. They will kick those who can least afford to protect themselves and will only kick those who come onto the system in the future because otherwise those pesky churches and those pesky social service organisations will organise them. There will be a public outcry. They will have victims. They will have mothers who cannot feed their kids. They will have example after example—people with a disability, people with kids who are being adversely affected. They will be able to point to each of them. The government say, ‘We can’t win that campaign. It’ll be like the IR campaign. Even if we spent $100 million, we couldn’t win that argument. They would have all these real live people with real live social problems struggling to live with a disability, struggling to bring up their kids, who could be shown to be clearly worse off and disadvantaged by the changes. So we’ll play the smart politics, the cunning politics. We’ll show them. We’ll grandfather the 1.3 million on welfare. We’ll put them to one side and we’ll attack those ones that come onto welfare from July.’
If you want further proof of why that is true, ask yourself this question: if being on Newstart is so beneficial, so helpful for getting a job and so central to the government’s objectives of moving people from welfare onto work, why didn’t they apply it to the 1.3 million already on welfare? If it is the magic bullet, if it is the solution, if reducing their benefits, putting them on the Newstart arrangements, putting them on the Newstart taper, is such a brilliant idea and is so essential for the movement from welfare to work, why wouldn’t you do it for the 1.3 million already stuck on welfare? Many of them are looking for an opportunity to get off, for some assistance, for some training and for some support. But the government say, ‘No, we don’t think it will solve their problems. It will only solve the problems of those who come after July 2006.’
I do not know about you but I am a bit puzzled by the logic. It seems to me that if this is the magic bullet and the solution to get people off welfare onto work, why wouldn’t you apply it to the 1.3 million currently on welfare? Why wouldn’t you cut their benefits? Because the government cannot win the politics. They would have to deal with victims. They would be seen as mean, cruel, arrogant and out of touch. They could not win the political argument, so they ducked the issue. They have got a magic solution—lower income for these people—but they have to quarantine the whole 1.3 million who are currently on the system because the politics are too hard.
If the government genuinely believed that putting people on lower welfare payments was a solution, they would do it for everybody. But they do not genuinely believe it. They have not got the political or policy courage to do it but, more importantly, the reason they do not do it is that they know it is not the solution. They have taken the soft option. Peter Costello was rolled by John Howard. The welfare reform package is a sham. There are some measures in it that will be useful for helping people on welfare into work, but the 1.3 million currently on welfare are exempted or grandfathered because the government did not have the political courage and they know their answer is not the answer. It is about punishing those on welfare. It is more about demonising those on welfare and it is about making their conditions worse.
Why? Despite all the talk about the $3.6 billion investment, work it out. I am no mathematician but, if you are paying people $30 to $80 a fortnight less, surely someone is saving a quid there somewhere. We learnt the other day that the government is saving about $1 billion over the out years, but you work it out: if you are paying beneficiaries less, there is a saving. I accept there is expenditure in the equation, but there are also savings. The government has been very coy about the savings. There is also a bit of a fiddle about the previous 2002 expenditure being counted as a saving, but I will leave that for another day.
The clear message I want to deliver is that not only is this opposed by the usual suspects because it is unfair, inequitable and it attacks those who are least able to defend themselves but it is cowardly, it is bad social policy and it is politics of the worst order. The government has chosen to attack those who come onto welfare after July next year because they are easy targets. If it genuinely believed in the solution it is offering, it would do the same for the 1.3 million currently on welfare. So, clearly, this is not about getting people jobs; it is as much about punishing them.
Quite frankly, the claims that Mr Costello makes in terms of his economic and his social credentials have been shown to be a complete failure. He got rolled. He has ducked the issue that he said must be the core of this package. The government has ducked it, and now he wants to take money off what he considers irresponsible parents. I do not know—maybe I am losing my marbles—but was this the same Treasurer who threw $600 per child at every family in Australia last year twice? Was this the same Treasurer who sent cheques of $3,000 to Aboriginal women in communities with five kids twice that led to an increase in alcohol abuse and domestic violence in those communities? Is that the same Treasurer? But now he does not want to—
—What cheques?
—Senator, you might recall that the family payment bonuses that were sent out last year led to a great deal of trouble in some Aboriginal and other communities because people suddenly got the biggest cheques of their lives. But now we want to decide who are good parents and who are bad parents. I do not mind—just have some consistency. If the Treasurer wants to have a foray into social policy, he ought to work out where he is coming from and where he is going. The key point in this debate is this: this is bad economics. The government has ducked the hard issues. This is not serious welfare reform; it is fiddling around the edges. Labor supports serious welfare reform, but the government has ducked the hard issues and gone for the soft option, which is punishing those who can least afford it and those people who come onto welfare after July 2006.
If the government believed in their package, they would have applied it to everybody, but they have not. This is about future victims, ensuring that there are not victims now because the government know they would not have won the debate. The only thing that allows the government to get this package through the parliament now is that there will be no victims until next year. If there had been victims, the government would never have carried their own backbench. Senator Bartlett is right to raise that issue. Judi Moylan did make a good point. I am sorry she did not oppose the bill but she did make a good point. What the government has done is cunning politics but bad social policy. We ought to reject the bill and we ought to hold the government up to account not only for its attack on the poor but for its failure to progress serious welfare reform.",SENATE,<title>EMPLOYMENT AND WORKPLACE RELATIONS LEGISLATION AMENDMENT (WELFARE TO WORK AND OTHER MEASURES) BILL 2005</title>,<title>In Committee</title>,Bills,26,1
