name,party,date,text,chamber,debate_title,subdebate_title,debate_type,debate_id,subdebate_id
"Ellison, Sen Chris",LP,2005-12-06,—I table a supplementary explanatory memorandum relating to the government amendments to be moved to this bill. The memorandum was circulated in the chamber on 5 December 2005.,SENATE,<title>ANTI-TERRORISM BILL (NO. 2) 2005</title>,<title>In Committee</title>,Bills,0,1
"Brown, Sen Bob",AG,2005-12-06,"—At this stage we are faced with a very large number of amendments. It is obvious that not all the amendments are going to be dealt with before the guillotine is applied. There will be different priorities regarding the amendments, and I am concerned that, if we now move seriatim into these, we will only get through a small proportion of them and the rest will not be debated at all. Thus, with the committee’s concurrence, we will make general contributions about the amendments that the various parties are bringing before this committee before moving to the specifics.
We only need to reiterate what a farce this committee faces. We have 3½ hours to debate not just extremely important amendments coming from the opposition and crossbenches but scores of amendments from the government itself, and they simply cannot be debated. So the Committee of the Whole is going to vote on amendments and, indeed, the legislation itself without having debated them. That is all the more poignant in view of the fact that we are talking about legislation which is to improve the security of this country and, according to the government, to balance the democratic values of this country with the right of people to have security.
That is not going to be balanced here. There is going to be no balance; there is going to be no adequate debate. What we have is the executive truncating the time for discussion in a way that is unprecedented in this parliament on a bill like this in the last 10 years. Moreover, the outcome of the debate is known before we get under way because every government member is going to support it and, what is more remarkable, the opposition is going to support it. The amendments will not get up. The final vote will be as the government has ordained it. That is the nature of the Senate in 2005.
Very early in the piece, the Greens will move an amendment to incorporate the International Covenant on Civil and Political Rights into this legislation as the measure by which courts might determine the fate of anybody brought forward for infringing this new security legislation. That is, Australia has ratified the International Covenant on Civil and Political Rights, and the Prime Minister, amongst others, has said, ‘This legislation does not infringe on it.’ The Greens are saying, ‘Then let the court take note of that by having the International Covenant on Civil and Political Rights incorporated into the legislation as a de facto bill of rights, and let’s also have the covenants which Australia has ratified or signed on the rights of the child and against torture brought into this legislation as well.’
Then there can be no doubt when a court is looking at the rights of somebody who, for example, is detained without charge over a prolonged period of time, and there is a challenge to that by lawyers who say the Australian norm has always been that a person is charged, and that a person has an opportunity to defend themselves and cannot be held for a prolonged period of time unless the charge that is made is warranted. The International Covenant on Civil and Political Rights makes it clear that people cannot be detained without knowing why they are being detained and without having an ability to defend themselves. The bill of rights in all countries which have bills of rights—and most countries similar to Australia do—outlines similar safeguards for citizens, but we do not have that in Australia.
The question to the minister is: what is the government’s objection to having the International Covenant on Civil and Political Rights referred to in the legislation as a measure by which the rest of the legislation may be adjudicated? What is the problem with having the international convention against torture and cruel and unusual treatment of citizens who are held referred to in this legislation so that courts may make sure we do not infringe that obligation under that international treaty? What is the problem for the government in citing in this legislation the rights of children, internationally adhered to? If the government has no intention of allowing, and does not want, this legislation to be inconsistent with that international obligation then the test for that, whatever the argument, will be the government agreeing or disagreeing with the Green amendment.
What is going to happen here, however, is that the government is going to vote against the international covenants which uphold the rights of all citizens in Australia. They are a bottom line in civilised society. The government is going to vote against those being incorporated in this legislation because the Howard government knows that this legislation infringes civil and political rights by national standards let alone international standards.
Dr Watchirs, who upholds this measure in the ACT, which is the only jurisdiction in Australia with a bill of rights, said this to the Senate Legal and Constitutional Legislation Committee:
The bill does not comply with the ICCPR in two main respects—the right to a fair trial and the right to liberty. Control orders may impinge on other rights, but I will concentrate on these ones. The fact that the person who is subject to a control order or preventative detention order does not have full access to the information means that they are not given a fair trial. The time frame for an ex parte control order not being limited, like seven days in the UK, but being up to a period of 12 months, depending on when the court confirms it, is also a breach of the right to a fair trial. The problem of confidentiality between a lawyer and a client in preventative detention is also a problem in relation to a fair trial. And, lastly, the lack of ability to communicate to third parties where the person is detained and the fact that they are detained under this act, goes much further than the UK act. I think the five-year penalty for breach of disclosure provisions and breach of control orders is grossly disproportionate. They are civil offences and a civil administrative process, particularly in preventative detention, and to have a criminal offence of five years is not proportionate.
What Dr Watchirs said was echoed by many other representatives coming before the committee, and we saw the advertisement from the Law Council of Australia yesterday.
This legislation breaches Australia’s international commitments, and the government knows it. The Prime Minister knows it. That is why the government will vote against the Green amendment to have the international covenants protecting the rights of Australians written into this legislation so that courts can make the decision about whether a person brought before the court is being treated in accordance with international conventions and a century of developing civilising law here in Australia. There is no doubt this is a reversal, an infringement, of international conventions and there is no doubt the government knows it. What is more extraordinary is that the opposition is going to support, at the end of the day, legislation which excludes reference to these conventions at the same time. That is extraordinary.
The remarkable fact is that we are going to get more of this further down the line. My colleague Senator Nettle will no doubt be drawing the committee’s attention to other matters. But let me say this: what a farce this Senate has been turned into by the Howard government. What a farce that we should be here today going through a process of a few hours debate on some of the most critical issues about how our democracy is defended. Australian citizens’ liberties, their freedom of speech and their right not to be detained without charge are to be stripped away without any guarantee that it is going to help defend us from terrorism. There is no guarantee at all; never has the government been able to cogently argue that this legislation is going to defend us from terrorism. Sure, it makes the bald statement but nowhere is the reasoned, logical argument that should come with that statement.
This legislation is a political document much more than a defence of Australians’ security document. A very dangerous slide to McCarthyism is involved in this legislation being slammed and sledgehammered through the Senate today. We are in a new period of McCarthyism and we need to know that and understand it, and to worry that this time it will not be turned around.
Using a law like this, citizens will be brought before courts for political reasons rather than security reasons. The reach of this law is not defined by and constricted to security. This law’s ability to truncate free speech is not defined by this legislation. We know that inherently this legislation, at the minimum, will lead to self-censorship in this country. Brains far more concentrated on this matter than the Prime Minister’s have made that abundantly clear in the public debate leading to this farce of a debate in the Senate.
The Prime Minister has turned this Senate into a rubber stamp—it is a Star Chamber as far as this legislation is concerned. The rights that we hold dear have been found convicted of infringing on security, as far as the Prime Minister is concerned. Australians’ ability for free-ranging and free speech has to be cut back, the Prime Minister has judged. We are now supposed to be debating whether that is a good thing or not, but the real fact of the matter is that the numbers are with the Prime Minister. What is more, he and this government claim that this is what the people of Australia want. That is not so, but it does not prevent the government from claiming that the people of Australia want their rights stripped back on trust, because there is no argument that in some way or other it is going to increase their security. We maintain that it does the reverse: it erodes the security of the Australian democracy. And we are particularly fearful of what is coming further down the line. This process has not stopped. Attorney-General Ruddock and Prime Minister Howard have more erosions of freedom coming down the line.
Freedom of speech, for goodness sake, is about to be taken away. And the Labor Party, which disagrees with the antisedition components, is going to vote for it. That is how manipulated this process is. I say to the Labor Party: change your mind. This is too important to signal to the government that the opposition is onside. What is more remarkable to me is that it seems that debate in the media has been shut down. Labor is onside; the government wants it—end of debate. We may well come to rue the day.
As far as the Greens are concerned, it is very important that people looking back on this moment know that the opposition caved in, to a government with a one-seat majority, to taking away Australians’ rights without any return defined in terms of security and to eroding those rights unnecessarily—in particular, the right to free speech and the right not to be held without charge, trial or the ability to have a defence. These are very serious matters, but this debate has been turned into a nothing, a farce and a joke. Where are the government defenders? The chamber is almost empty. I think there must be a great deal of a shame factor on the government side about the whole process. Whatever it is—
—You are talking—that’s why.
—Exactly. That is the point. It is because they cannot defend themselves against the point of view that is being put forward at the moment. (Time expired)
",SENATE,<title>ANTI-TERRORISM BILL (NO. 2) 2005</title>,<title>In Committee</title>,Bills,0,1
"Ludwig, Sen Joe",ALP,2005-12-06,"—What we have today is clearly a truncated debate for the committee stage. I have been in the Senate for six years, and this is the most obscene thing I have seen this government do. To truncate an important bill such as the antiterrorism bill in such a way is to allow only a farcical way of dealing with it in the committee stage. It would have been preferable, and within the government’s ability, to ensure that we could deal in seriatim with the various amendments, go through them, put the arguments, have the debate about the issue and not about the people or the party and then move forward. That is what we have always done in this place. That is what the strength of the Senate has always been.
Instead, the government yesterday put a guillotine motion in place, which effectively cut the second reading debate short and truncated the committee stage to ensure that we would have to, on the run, come up with a way of dealing with the hundreds of amendments that are now before us. We have almost half a book from the government to deal with. As well, there are new explanatory memoranda that they have put out. There are new amendments—at the last count I think there were 74. Some of those require reasonable consideration and explanation by this government, but we are not going to get that. We are going to have to rely on the explanatory memoranda to understand what the government’s position is. Or, hopefully, in the short time available to us, Senator Ellison can run through, as quickly as he can, the way those amendments will operate. That would provide us with an opportunity—only an opportunity—to deal with some of the more substantive issues that have come through.
The difficulty is that, by complaining about the process, I am eating into the time available to me to talk about the substantive matters. That is the difficulty we always face, especially with a government that is so arrogant and out of touch. It is bordering on an un-Australian way of dealing with the Senate that the government has chosen to use its numbers to both guillotine and gag its way through an antiterrorism bill. It is not acceptable. It should not be done. The government has the ability to ensure that there is proper debate but has chosen not to.
Let us look at the major issues that came out and see what the Senate Legal and Constitutional Legislation Committee found. Let us deal with them. We will look at the major issues and some of the minor issues as well. One of the major issues that the committee found was the sunset clause. This government has said that the period is 10 years. Ten years is a lifetime in politics, let me tell you. It is a farce to suggest that 10 years is a position that is going to be acceptable. The Labor Party have said—and we will move amendments to that effect, if we get the opportunity, but I will foreshadow them in any event—that a five-year sunset clause with a five-year review is a better outcome. It provides at least some certainty that (1) the legislation will be reviewed and (2) five years down the track we can look at the legislation and see whether it is still an appropriate, adapted and proportionate response to the security environment we then find ourselves in.
The second issue is in relation to sedition. The Labor Party have said right from day one that we oppose schedule 7. It should not be part of this process. Right from day one we have said that, in terms of the Anti-Terrorism Bill, we do recognise that there is a new security environment. We do think, unlike the Greens, that you have to take the fight to terrorists. You cannot take a backward step. You have to make sure that the people we entrust with our system to protect us and preserve our way of life have the necessary powers to ensure that they can root out these evildoers and put them behind bars and can prevent a terrorist attack so that we can have some measure of security and safety in Australia.
In relation to sedition we say that it was not part of COAG; it was not part of the original agreement. I suspect it is one of those things that Mr Ruddock has been kicking along, like a favourite football, rolling it along the paddock and thinking, ‘This is something that I would like to pick up and run with,’ and he has. He has flicked it up, put it under his arms at the available opportunity and decided to run with it. Well, it is not on. It should not be a part of this system, it should not be a part of this bill and Labor oppose it. We have said that from day one. We are fortified that the committee recommendations equally supported Labor’s position of saying, ‘That should not be here.’ Let us look at some of the comments that were made in the committee report. For example:
Mr Laurence Maher submitted that he had in the past advocated the repeal of the existing sedition provisions under the Crimes Act because they are:
… archaic and unnecessary and, more importantly, contrary to contemporary modern democratic principle as an unjustifiable burden on freedom of expression and freedom of association.
I think that sums it up in a very neat passage. The committee took cognisance of that and recommended that. I heard that some backbenchers got a bit divided about this issue, but at the end of the day they stuck with the government; they stuck with the line.
The committee did recommend an alternative, faced with the view that the government may not remove sedition. Let me make it plain: it was not an alternative in an equal sense. The first position recommended that schedule 7—sedition—be removed. The alternative was to ensure that it at least had some measure of support from the government’s own backbench. And that is what that was: a comfort recommendation for the backbench that they could slide back to, and that is in fact where they went. It was not a surprise to me to see the alternative. It is not an equal alternative. It is a backslide for the Liberal backbench who knew they would not be able to stare down Mr Ruddock. Mr Turnbull and Senator George Brandis knew they were not going to be able to stare down Mr Ruddock. They decided that the only way out was to ensure that they had a backslide position to give them a fig leaf of protection. They do not have to do that; they can take the first position. It is a much better position to adopt. Sedition is not necessary as part of this bill and should be removed.
The other areas that Labor has sought to amend and improve upon are not only the review and sunset provisions but also areas that I suspect Senator Bob Brown was talking about in part. He went to the issue of the ICCPR, the international obligations we have. The Labor Party takes those obligations very seriously. They exist as guiding principles to ensure that we act in a decent way. That is what they are there for. I was a participating member of the Senate Legal and Constitutional Legislation Committee and it was very pleased to hear from the Human Rights and Equal Opportunity Commission, who also take very seriously those principles and the International Covenant on Civil and Political Rights. What they said is instructive. In relation to issues regarding the right to liberty and the requirement of proportionality, they indicated:
A number of commentators  have suggested that the scheme for granting PDOs—
that is, preventative detention orders—
violates the rights conferred by article 9(1) of the ICCPR, which provides ...
I will not go into the quote; most people will be familiar with it. It goes to the issue of arbitrary arrest or detention. They then went on to say:
It is important to understand that article 9(1) does permit detention for security purposes. However, such detention must not be ‘arbitrary’. The term ‘arbitrary’ has been interpreted as requiring more than mere compliance with domestic law.
HREOC said that the best way to deal with that particular issue was in the recommendation they made. They did not recommend in their submission to the committee that we incorporate the UN convention. In recommendation 1 of their submission—and Labor has incorporated it into its amendments because it was a committee recommendation as well—they said:
The Commission therefore recommends that the Bill include additional sub-clauses (in s105.4(4) and (6)), which require the issuing authority to be satisfied that the purpose for which the order is made cannot be achieved by a less restrictive means.
The Liberal-National coalition have not picked that up. It is something that should be picked up. It is an amendment that we have sought, and I foreshadow that, if we get the opportunity, we will move it. It is one of those areas that provide a test of proportionality. It provides a way of ensuring that, in enacting this legislation and dealing with it, the government’s actions are proportional, appropriate and adapted to the purpose. That is what that clause does. It is one that Labor supports and will move in this committee stage. It is one that the Senate Legal and Constitutional Legislation Committee adopted and suggested that the Attorney-General, Mr Ruddock, should pick up.
He has not picked it up. He has not seen fit to include it in the legislation. That is a great pity, I must say. Obviously, there would have been an improvement to the legislation if Mr Ruddock had picked up all of the committee recommendations. At the end of the day he would have been able to say that he took on board the committee recommendations, was cognisant of the committee’s work and had ensured that there were safeguards and review and oversight arrangements contained within the bill. That is not something that the Attorney-General has decided to do. However—and sometimes in the heat of these debates we miss pointing this out—he did pick up a substantive number of the amendments that the committee recommended. A significant number of amendments have been incorporated into the legislation.
The legislation started from the Stanhope draft—if I can call it that—where this government took an extreme position. The government then removed the shoot to kill legislation. It provided a better and much improved version than that horrible piece of drafting that we originally saw. We then moved to the position where the committee had an opportunity to hear from submitters about the new draft of the bill. The position now is that there are another 74 amendments which will move the bill further along that continuum to ensure that it is appropriate and proportionate. They will ensure that there are some safeguards.
Right from day one Labor have been in a position to say that we support the antiterrorism laws. We wanted to then find out how we could work to improve them to ensure that they were not going to reduce people’s liberties or impinge upon their freedom of political communication. We wanted to ensure that this type of law would not be used arbitrarily. After the committee hearing, after the government and the backbench of the Liberal Party caved in, we have arrived at a position where we have a bill that is much improved.
There is still more work to be done. Of the issues that Labor has said right from day one still need improvement is that there should be greater scrutiny in this place of how these laws will operate. A fundamental difficulty that always besets us is not that the law may offend but that the way it may operate or be used may offend civil liberties, freedom of political communication and UN conventions. That is why Labor has said that the antiterrorism laws should be subject to greater review in this house. We should be told every three months how they are operating. The Senate Legal and Constitutional Legislation Committee recommended a six-monthly report. The government have stuck to a 12-monthly report. They still have an opportunity to accept further Labor amendments, but I doubt that they will. (Time expired)
",SENATE,<title>ANTI-TERRORISM BILL (NO. 2) 2005</title>,<title>In Committee</title>,Bills,0,1
