name,party,date,text,chamber,debate_title,subdebate_title,debate_type,debate_id,subdebate_id
"Ferguson, Martin, MP",ALP,2011-03-23,"—On behalf of the Minister for the Arts, I move:
That, in accordance with section 5 of the Parliament Act 1974, the House approve the following proposal for work in the Parliamentary Zone which was presented to the House on 21 March 2011, namely: Installation of “The Prime Ministers” artwork.
In doing so I indicate that the National Capital Authority has received a works approval application from Arts ACT for the installation of the Prime Ministers artwork to be located at the intersection of Walpole Crescent and Queen Victoria Terrace, Parkes in the Parliamentary Zone.
The artwork comprises a lifelike reproduction in bronze of a 1945 photograph of former prime ministers John Curtin and Ben Chifley as they walk from the Kurrajong Hotel in Barton to work at the provisional Parliament House, now known as Old Parliament House.
Approval of both houses is sought under section 5(1) of the Parliamentary Act 1974 for the proposed works in the Parliamentary Zone.
I commend this motion to the House.
Question agreed to.",REPS,<title>PARLIAMENTARY ZONE</title>,<title>Approval of Proposal</title>,Parliamentary Zone,12,1
"Ferguson, Martin, MP",ALP,2011-03-23,"—by leave—I move:
That the bill be referred to the Main Committee for further consideration.
Question agreed to.",REPS,<title>FAMILY ASSISTANCE AND OTHER LEGISLATION AMENDMENT (CHILD CARE AND OTHER MEASURES) BILL 2011</title>,<title>Referred to Main Committee</title>,Bills,13,1
"Fletcher, Paul, MP",LP,2011-03-23,"—When I was rudely interrupted last night, I was saying all of us in this place are united by our pride. That is the point at which I stopped—and obviously that sentence could admit of many possible ways in which it might be completed—but the particular aspect that I wish to point to, in which I say that all of us in this place are united by our pride, is our pride in the fact that Australia is one of the world’s great democracies. We are one of the world’s oldest democracies and we are one of the world’s most successful democracies. Clearly, at the base, at the foundation, of being a successful democracy is to have a voting system of integrity—a system in which the people can have confidence and a system which is beyond reproach in its operation in reflecting the people’s will in selecting their parliamentary representatives.
It follows from that that it is of the first importance to protect the integrity of the voting system by ensuring that persons who claim to be entitled to vote can demonstrate that entitlement and that there is no risk of persons who claim to be entitled to vote but are not in fact entitled to vote being able to lodge a vote and having that vote counted. It is of the first importance that there is no risk that such a scenario can come to pass.
When you consider that it is often the case that there are results in particular divisions determined by very narrow counts, it adds weight to the conclusion that we must be scrupulous in protecting the integrity of the voting system and scrupulous in ensuring that not one person who is not entitled to do so under the law is able to cast a vote. Let me instance just one recent result which demonstrates that proposition. In the seat of Bowman in the 2007 election, if a mere 33 votes had changed direction, the result would have been different—and, I venture to suggest, this parliament would have been a vastly poorer place had the present member for Bowman not been returned, as he happily was, albeit only very narrowly.
In the ordinary course of events, persons who are on the roll and can demonstrate that—because their name is there in front of the returning officer or AEC officer when they turn up to vote—are permitted to vote with no further formalities required. They have carried out the necessary formalities in the exercise of getting on the roll. But that is not the scenario we are talking about in this legislation. We are talking about people wishing to cast a provisional vote, and a provisional vote, if I may remind the House, is a vote cast in circumstances where an elector’s name cannot be found on the roll or the name has already been marked off the roll. The law as it stands states that, in these exceptional circumstances, there is a requirement that the person who has turned up at the polling booth asserting a right to cast a vote but whose name cannot be found on the roll or whose name is on the roll but is marked off as having already voted, is required to provide proof of identity.
As I have already observed in the earlier proportion of these bifurcated remarks, it is not unusual in our society to be asked to produce identification. Frankly, it is slightly surprising to see the confected indignation from the other side of the chamber at the requirement that identification be produced in the circumstances I have just described—circumstances I think we can all agree are exceptional and very much in the minority.
The proposition that I put to the House is, first of all, that it is very important that we protect the integrity of our voting system. That is of the first importance, given the reputation that this nation has as one of the world’s great democracies, a reputation that I am sure all of us in this place are united in our determination to protect. The second proposition I wish to put to the House is that the costs of requiring identification in these circumstances are modest and the benefits are significant. The report of the Joint Standing Committee on Electoral Matters concludes that some 80 per cent of persons in this category—that is, seeking to cast a provisional vote—were able to provide identification. In other words, the claimed burden of this requirement is nowhere near as great as those on the other side of the chamber would have us believe.
We also heard further confected indignation about the remarkably onerous nature of this obligation—again remembering that it is a relatively small proportion of people who face this obligation because either their name is not on the roll or it is on the roll but when the official goes to cross out the name he or she finds it has already been crossed out. It is not, I would submit, an unusually onerous requirement of people in these circumstances to provide identification. As a requirement in terms of individual responsibility, I suggest it is not an onerous one. The costs of the present arrangement in public policy terms and in terms of the imposition on individuals are modest indeed. The benefits are significant, because they go to preserving the confidence of all Australians in the integrity of our voting system and, in turn, in the integrity of our democracy.
The third point I wish to make—and I do so with some reluctance, but the historical record commands me to make it—is that there are reasons, regrettably, to raise questions about the rationale of those on the other side of the chamber for putting forward this change in the first place. It gives me no pleasure to note that the Labor Party has form in bringing forward changes to the electoral system, the voting system and much of the regulatory apparatus dealing with our democracy which are supposedly motivated by a high-minded concern for the public good but which are in fact substantively driven by a desire to achieve partisan political advantage. You would appreciate, Mr Deputy Speaker Thomson, that it gives me absolutely no pleasure to make this point, but unfortunately the historical record is simply impossible to ignore.
We saw some years ago in Queensland the unedifying spectacle of a former state secretary of the Australian Labor Party, then a serving member of the Queensland parliament, appearing before the Shepherdson inquiry. When he appeared, he was asked about the address at which he had enrolled some years before as a younger man, when he was starting out in the pursuit of his political ambitions. He initially attempted to avoid the question, but after taking a break, presumably to receive legal advice, he returned to the box to advise that it was in fact correct that his name appeared on the roll at that address but it was also correct that he had never actually lived at that address. It was apparently an unfortunate administrative error—such an unfortunate administrative error that the consequence was that he abruptly resigned as a member of the Queensland parliament.
So there is very clear evidence of the Labor Party—including its most senior officials and, indeed, Labor parliamentarians—seeking to play games with the electoral system in this country for partisan political advantage. It gives me no additional pleasure to note with some concern that this gentleman has now been appointed as a senior executive of the National Broadband Network company at a salary of well over $400,000 a year—
 (Mr KJ Thomson)—I would ask the member for Bradfield to relate his remarks to this bill.
—his principal qualification apparently being that he was a good mate of the Minister for Broadband, Communications and the Digital Economy.
—The member for Bradfield will cease speaking while I make the observation to him that he needs to relate his remarks to the bill before the House, which is a bill concerning provisional voting.
—Mr Deputy Speaker, you are quite right—it is a bill concerning provisional voting. And amongst the policy matters to consider as we assess whether the change which is proposed in this bill is good policy are the implications it will have for the integrity of our voting system, and that necessarily asks us to consider what might be the possible motives of the political party that has brought forward this amendment.
In the state of New South Wales we have also seen the Labor government, after spending years enthusiastically hoovering up donations from certain categories of donors, now banning those donations from tobacco companies, from alcohol companies and from gaming and gambling companies. This is a remarkably late conversion to this new-found standard of virtue, and it could cause any objective observer to ask, ‘How could they be so shameless and transparent?’ Yet this is the party which is putting forward the set of amendments in this bill.
Our voting system is of the highest importance to the integrity of our democracy. The measures which this bill puts forward are not in the public interest. They undermine a well-established and important safeguard, and on this side of the House we say they should be rejected.",REPS,<title>ELECTORAL AND REFERENDUM AMENDMENT (PROVISIONAL VOTING) BILL 2011</title>,<title>Second Reading</title>,Bills,14,1
"Brodtmann, Gai, MP",ALP,2011-03-23,"—I rise today to speak in favour of the Electoral and Referendum Amendment (Provisional Voting) Bill 2011. I do so because I fundamentally believe that what this bill will achieve is the correct and moral thing, despite the way that the former speaker was outrageously construing it. It is a fact that in the 2007 federal election over 27,000 votes were rejected at a preliminary scrutiny because of issues over the provision of identity. In 2010, more than 28,000 votes were eliminated—hardly the small number that was suggested by those opposite today. What concerns me about this figure is that, in a later examination of the votes, it was found that the name was in fact on the roll in over 12,000 cases.
I was also shocked to hear that the current state of provisional voting has not always prevailed. In the 2004 election, almost 50 per cent of provisional votes were included in the final count. In the 2007 election, this figure plummeted to 14 per cent. Of the more than 168,000 provisional votes cast, just over 24,000 were counted. Why was this so? Was there a sudden and dramatic increase in potential voter fraud? No, there was not. What actually happened was that the then Howard government decided to change the electoral laws. Perhaps, in a similar fashion to which it was motivated to make changes to laws on the closure of the electoral roll, the Howard government was motivated by the realisation that provisional voters have a tendency not to vote for the coalition. For example, following the 2004 election, the national two-party preferred vote was 53 per cent to 47 per cent in favour of the coalition. This contrasts with the exact opposite which is seen when analysing the two-party preferred breakdown of provisional votes.
Whether or not this was a conscious decision of the previous government to disenfranchise those voters who traditionally did not support them I do not know. What I do know is that, as a result of these changes to both provisional voting and the electoral roll, thousands of Australians who should have been given the chance to choose their government and their representatives were denied their political rights. The kinds of changes that came in 2006 disproportionably affected vulnerable groups—groups we should be encouraging to participate in our electoral system. These include the young, those voting for the first time and people with particular vulnerabilities: the marginalised. While I understand that there is a need to strike a balance between the integrity of the electoral system and the enfranchisement of the people, I do not believe those changes in 2006 were motivated by concerns of integrity, despite what the previous speaker was saying, and nor did they achieve it. It was not a victory for democracy in this country—quite the contrary.
It is a sad truth that in many countries various provisions have been used to disenfranchise voters at elections while still providing for universal suffrage in theory. I note in particular the various Jim Crow laws in the United States that were used so effectively in ensuring that African-Americans were prevented from enrolling and voting in elections. These kinds of laws create obstacle after obstacle that a potential voter must overcome in order to achieve what is a fundamental human right. Article 21.3 of the Universal Declaration of Human Rights states:
The will of the people shall be the basis of the authority of government; this will shall be expressed in periodic and genuine elections which shall be by universal and equal suffrage and shall be held by secret vote or by equivalent free voting procedures.
I believe it is our responsibility as members of this parliament to ensure that Australia lives up to this article. I believe we must, wherever we can, make such laws as enhance the enfranchisement of the Australian people.
There are a number of legitimate reasons why a voter may have to cast a provisional vote. First is if their name cannot be found on the certified list. Others are if their name is marked as already having voted, if there is some question about identity or if the voter is on the silent elector list. As the law stands, a voter is required to provide proof of identity by the first Friday following the polling day. If it is not provided, the vote is removed from consideration. There are any number of reasons why a voter may not be able to provide appropriate identity—for example, if they do not have a drivers licence or a passport and so have difficulty in supplying appropriate documentation. There is also a stunning contradiction at the heart of the law as it presently stands. This requirement to provide proof of identity applies only to provisional votes and to no other form of declaration vote. That is right: no other method of voting is subject to this rule. This leads to an absurd situation. If the voter had instead decided to lodge an absentee ballot, their vote would in fact have been counted. This contradiction exposes the incoherence of the provision and possibly also the discrimination that I fear lies behind it.
Significantly, the provision disproportionately affects more vulnerable groups compared to others in our society. There are those who for reasons of homelessness, disability or other vulnerability find it difficult to navigate the bureaucratic complexity of modern life. And it is not only the vulnerable who find this difficult; for many, the vicissitudes of life have placed burdens and responsibilities on them that consume all their energy. I have some sympathy for those labouring under the burdens of everyday life. Coming from the background that I do—being the daughter of a mother who single-handedly raised my sisters and me, I can readily understand that having the time to deal with bureaucratic niceties can be a bit of a luxury. For reasons that are sadly familiar, those who are in this situation are often, if not mostly, women. I can therefore understand why some people simply do not have the ability or time to provide the documentation required under the current legislation. This does not mean that they are any less deserving of a vote at our elections—any less entitled to that most fundamental of human rights: enfranchisement.
A number of organisations, including the Australian Electoral Commission, support this legislation. It would indeed be a cause for celebration if those opposite could bring themselves to join in with their support and atone for their imposition of a discriminatory obstacle to the exercise of a political right. Sadly, this does not seem to be the case. This legislation will enhance and modernise our electoral system and our democracy, and I commend it to the House.",REPS,<title>ELECTORAL AND REFERENDUM AMENDMENT (PROVISIONAL VOTING) BILL 2011</title>,<title>Second Reading</title>,Bills,14,1
"Briggs, Jamie, MP",LP,2011-03-23,"—I rise to speak on the Electoral and Referendum Amendment (Provisional Voting) Bill 2011 and follow the member for Canberra in doing so. I hate to disappoint the member opposite, but we will not be supporting the bill. We think it is a bad bill. We have thought it is a bad bill the couple of times it has been presented to the parliament, and that is because in 2006 the Howard government did the right thing and brought in provisions ensuring the integrity of the electoral roll—and that is ultimately the question that we are debating here. On this side of the House, the understanding is that you need to have an electoral roll that has the utmost integrity and that enfranchises as many people as it can but ensures there is no fraud. That is important because we are very fortunate to have the wonderful democracy that we do in Australia. We have arguably the best democracy in the world. We have free and open elections that are free from questions about corruption and legitimacy and that allow governments even in questionable circumstances like last year’s, where we had the situation of this parliament—a hung parliament. There has been no question put in relation to the legitimacy of the government.
Even in the great democracy of the United States we have seen presidential elections which have dragged on for weeks and months because of questions about their electoral system and their electoral rolls. And it is not just the events surrounding George W. Bush’s election; well back even to the famous John F. Kennedy election in the early sixties there were questions about Lyndon Johnson’s accession to the Senate. We do not suffer from those same problems because we have an electoral roll which is protected from question. It is held above accusations that it has been rorted in some way. The problem with lessening the protections in it is that you raise questions about the validity or integrity of the roll. It is interesting that at the 2010 election, of the provisional voters who voted in that fashion, 80 per cent of them provided evidence of their identity at the polling place on the election day and a following 16 per cent provided evidence of their identification in the required time frame afterwards. So we are talking about a very small percentage who did not meet those requirements. And I do not think the requirements as put by the members opposite are as onerous as they would like us to believe.
We of course need identification for various things in our society: to access government payments, to drive a car or to travel, you need a form of identification—and rightly so. And rightly so we also should for our electoral roll. I think there is a reasonable discussion, which we have had in this place previously, about the requirements for voter identification when enrolling and voting on election day. I think we should do everything we can to ensure the roll is protected in that way. So the bill is based on a premise from the Labor Party that the voters they are supposedly trying to enfranchise are more likely to vote for the Labor Party than they are for the Liberal Party, and that is what this is about. This is not about improving our election system or improving our electoral roll. This is some sort of political view that by opening this up and making it easier you have more opportunity for the Labor Party to get more votes than this side of the House.
This Saturday we have another election in Australia and I do not think there will be too many questions about the integrity of the result. I think it will be pretty clear—in fact, I think some betting agencies have already decided what the result will be, which does seem to be a little early. Again, it goes to the confidence that people have in our electoral system. At a time when we are talking about using the internet more often, the AEC is walking down the path—I think rightly—of looking at the way that people can enrol and keep their details updated. I am sure all members in this place would appreciate that the quicker we get updates the better it is for members of parliament, the better it is for people to have the most recent updates, particularly for young people who move around a bit. The easier we make it for people to keep the AEC updated with their movements the better.
Again, it has to be done in a fashion that does not question the integrity of the roll and does not raise the risk of an election being brought into question at some time. We have very good processes for dealing with questionable elections, but we do not face them very often. We do not face them to the point where a government’s or parliament’s legitimacy is questioned, because of the strength of our electoral system. This is something that we on this side of the House have had a commitment to for a very long time. As I said earlier, in 2006 we decided this was important because it added to the strength of commitment to ensuring the integrity of the roll.
I think members on the other side are ill advised to move down this path. This is a bad decision. It is a bad bill because it undoes good changes to a system which is working very well. We have seen that it is working very well from the field evidence. If we look at the results from provisional voting at the last election we can see it did not cause some great dislocation in people’s ability to cast a provisional vote, as the previous member said. There are circumstances where provisional votes are required, and that should continue. But it should continue with the added protection that is in the system today. Overturning this protection, based on what I think are very questionable motives, is something that we should not support.
On the side of the House, we do not support it. We have had a commitment to this issue and we continue to maintain that commitment. Personally I continue to maintain that commitment because there is no more important thing in our electoral system than the roll and making sure it is protected from questionable voting and questionable tactics. It must be above repudiation in all those ways, ensuring legitimacy for governments and for all of us who are elected to this place. That is why we stand for these protections. We stand for the protections that were put into this system in 2006. There is no great need for change. The Labor Party is taking an ideological position. This is an unfortunate bill and it should be opposed.",REPS,<title>ELECTORAL AND REFERENDUM AMENDMENT (PROVISIONAL VOTING) BILL 2011</title>,<title>Second Reading</title>,Bills,14,1
