name,party,date,text,chamber,debate_title,subdebate_title,debate_type,debate_id,subdebate_id
"Lundy, Sen Kate",ALP,2011-03-24,"—I will take this opportunity to outline the purpose and intent of amendments (14) to (27). These amendments clarify that the level playing field requirements apply to only local access lines that are part of a telecommunications network that is wholly or principally used or proposed to be used to supply eligible services to residential or small business customers and is capable of supplying a superfast carriage service.
Local access lines are part of the local access network, meaning that backhaul or transmission networks are not captured. Similarly, consistent with the original drafting of the bill, the restriction to networks supplying services to residential and small business customers makes it clear that networks supplying government and larger business customers will not be captured.
The amendments also change the date of effect of the level playing field provisions to 1 January 2011, rather than 25 November 2010, consistent with the government’s announcement of 20 December 2010. Proposed section 141A sets out powers for the minister to exempt a local access line, a network or a network owner from the provisions. Proposed section 141B provides important clarity on when a network extension or upgrade will be subject to the rules. This was a key theme in consultations with industry and in submissions to the Senate committee about the bill. Under proposed subsection 141B(1), if a network is altered or upgraded after 1 January 2011 with the result that a part of the network becomes capable of being used to supply a superfast carriage service then that part is viewed as a new network and will be subject to the provisions.
Furthermore, under proposed section 141B(2), if a network is extended after 1 January 2011 and the extended part is capable of being used to supply a superfast carriage service then that part is a new network and will be subject to the provisions. However, there are three categories of exemptions from this provision covering, firstly, extensions to other stages of real estate development projects that commenced before 1 January 2011; secondly, extensions made to a telecommunications network that existed before 1 January 2011 where no point on the infrastructure of the extension is located more than one kilometre from a point on the infrastructure of the network as in existence prior to 1 January 2011; and, thirdly, extensions specified in regulations.
Proposed section 141C also provides important clarity on the circumstances in which carriers can continue to connect customers to their existing superfast network. It ensures that lines installed to connect premises that are in close proximity to a line that forms part of the infrastructure of a network that came into existence before 1 January 2011 and is capable of being used to supply a superfast carriage service are not captured by the provisions.
Finally, these changes are carried through to the similar provisions in the Competition and Consumer Act 2010 that deal with the declaration of a layer-2 bitstream service by the ACCC. Where a network, local access line or network owner has been exempted, then the ACCC declaration will not apply.",SENATE,<title>NATIONAL BROADBAND NETWORK COMPANIES BILL 2010</title>,<title>In Committee</title>,Bills,32,1
"Ludlam, Sen Scott",AG,2011-03-24,"—I will just speak briefly to these amendments, and I thank Senator Lundy for that explanation of that batch of amendments. We will be supporting these. I understand that the government has moved them together with the ones we spoke on previously.
I think there has been some justifiable concern in the industry relating to the cherry picker provisions from incumbents, people who are already there, who do not want to be accused or fall foul of the cherry-picking provisions as a result of the fact that NBN will shortly be potentially overbuilding them. I think it has probably taken quite a bit of delicate negotiation here because of the definition of what constitutes a ‘network expansion’, in this instance by a new player seeking to genuinely cherry pick the NBN, as opposed to people who are already there running their business and have legitimate interests in not being treated unfairly.
We also recognise that the government has quite a delicate balancing act here, because we do support protecting the NBN Co. from being cherry picked. The underlying theory here I think is entirely sound, and this got a very good airing during the Senate committee hearings. The taxpayer is going to the trouble of rolling this network out to places where it has never gone before, providing services in potentially some very remote locations where there is going to be quite a high cost of service provision. When we consider things like water, electricity, the postal service and the road network, we do not ask people to pay more just because they happen to live a long way from the capital city. I think it is entirely appropriate that the government in this instance has moved to say, ‘If we’re providing this network to everyone in the country, we will need to cross-subsidise the difficult areas with the easy ones, and that means that a corporate player does not get to come in and cherry pick the easy ones,’ because there is no public obligation on the Optuses of the world or any of the other providers, if they are setting up a network in Melbourne, to move it out to regional Victoria or regional Western Australia, nor should there be. We have a universal service obligation to handle those sorts of issues. But if the NBN is going to be doing it, if it is going to be happening at taxpayers’ expense, then it should not be possible for a commercial player to simply dive in and grab the easy bits and leave the hard bits to the taxpayer. If that is the case then we need cherry-picking provisions, and then of course we need to work out how they do not penalise people who are already there or players who are acting in good faith. We are having this debate in Canberra. TransACT is the most obvious example.
I am pleased that the government has sought to clarify the way that these provisions will work. I think that, again, this is something that we are going to need to take a proper look at in the rear-view mirror and make sure that it has not ended up being a cause of disputation, but we will be supporting these amendments and we look forward to moving on.
 (Senator Marshall)—The question is that government amendments (12) to (27) be agreed to.
Question agreed to.",SENATE,<title>NATIONAL BROADBAND NETWORK COMPANIES BILL 2010</title>,<title>In Committee</title>,Bills,32,1
