name,party,date,text,chamber,debate_title,subdebate_title,debate_type,debate_id,subdebate_id
"Ludwig, Sen Joe (Manager of Government Business in the Senate)",ALP,2011-03-24,"—by leave—I move:
That senators be discharged from and appointed to committees as follows:

Finance and Public Administration References Committee––

Appointed––
Substitute member: Senator Stephens to replace Senator Polley from 3 May to 6 May 2011
Participating member: Senator Polley

National Broadband Network—Joint Standing Committee––

Appointed––
Senator Stephens
Participating members: Senators Bilyk, Bishop, Crossin, Faulkner, Forshaw, Furner, Hurley, Hutchins, Marshall, McEwen, Moore, O’Brien, Polley, Pratt, Sterle and Wortley

Rural Affairs and Transport References Committee––

Appointed––
Substitute member: Senator Siewert to replace Senator Milne for the committee’s inquiry into operational issues in export grain networks
Participating member: Senator Milne.
Question agreed to.",SENATE,<title>COMMITTEES</title>,<title>Membership</title>,Committees,0,1
"McLucas, Sen Jan",ALP,2011-03-24,"—I am pleased, as a North Queenslander, to be part of this debate on the Wild Rivers (Environmental Management) Bill 2011. At the outset, it is important to note that our government is committed to delivering economic development and jobs for Indigenous people and to honouring our environmental and heritage responsibilities in that respect. We are talking about Cape York Peninsula and the declaration of wild rivers in that area by the Queensland government. This private senator’s bill attempts to undermine the state legislation that has been put in place. I remind the Senate that the Queensland Wild Rivers Act 2005 was carried in the Queensland parliament with cross-party support. As I have stated in this chamber before, I am of the view that this private senator’s bill is a political stunt and has nothing at all to do with economic development and the achievement of the aspirations of the people of Cape York. Yet again we have the Liberal and National parties playing politics with the future of the people of Cape York.
Our government is undertaking a range of measures to support Indigenous economic development and to create jobs through the sustainable management of natural resources, such as the Working on Country program, and we are working with Indigenous people to close the gap in Indigenous disadvantage. We are out there talking the talk and walking the walk. We are out there trying to turn around the lives of people in Cape York, and those on the other side are once again playing politics with the aspirations of the people they purport to represent.
We know there is still more that we need to do, at both the federal and state level, but, with respect, the private senator’s bill currently before the Senate poses more questions and complexity than solutions for Indigenous people in either the Cape York region or Queensland as a whole. But it is form for the people on that side to play politics rather than to actually work with people to achieve an economic outcome. The government does not support this bill and has been strongly advocating that, because there are a range of technical problems, the bill would benefit from further consideration. That is why we support a reference to the Senate Legal and Constitutional Affairs Legislation Committee and consider today’s debate premature.
The opposition claim that this bill:
… will enable the Indigenous people of Cape York, the Queensland gulf region and other regions of Queensland, to use or develop their land as any other land holder may.
The government believe that this bill will not fulfil that claim and in fact may have a range of negative consequences for Indigenous people. With respect, the government will not be supporting such simplistic attempts to override the Queensland Wild Rivers Act 2005. Instead, we are committed to pursuing considered and inclusive solutions to properly address complex issues.
In his second reading speech, Senator Scullion stated:
This bill, the Wild Rivers (Environmental Management) Bill 2011, is the reintroduction of a bill of the same name that passed the Senate on the 22 June 2010.
                …            …            …
We as senators should again support this bill …
However, this bill is different to the bill previously passed by the Senate in several important respects. There are matters that should be given serious consideration before this bill goes to a vote.
In terms of substantive effect, the key changes are that the 2011 bill—that is, the new bill before the Senate—extends its coverage from native title land to various kinds of Aboriginal land. Another difference is that it prescribes a method by which the agreement of native title holders for a wild river declaration can be obtained and it requires the Commonwealth to provide employment to people assisting in the management of a wild rivers area who lose their jobs as a result of the legislation. It is substantially different to the bill that was passed in this Senate last year and in that respect warrants a full inquiry.
These are not minor changes, yet it is clear that Senator Scullion was relying on senators to take him at his word and rush the bill through thinking that it was unchanged. In its current form the bill raises a number of issues about its potential scope and application. It is not clear whether agreement is required of all persons defined as an owner of the land concerned or how disagreements between different groups of owners are to be resolved. It is clear that this bill requires careful scrutiny and it is important that the Senate fulfil its obligations as a house of review and agree to refer the legislation to the inquiry, as has been moved.
The government respects the views of Aboriginal leaders in the Cape York area. In his second reading speech Senator Scullion stated that this bill:
… will restore the economic potential of land subject to declarations and assessment under the Queensland wild rivers legislation to Aboriginal and Torres Strait Islander people.
As senators should be aware, the House of Representatives Standing Committee on Economics is currently conducting an inquiry into Indigenous economic development in Queensland and a review of the Wild Rivers (Environmental Management) Bill 2010.
A number of stakeholders, including traditional owners, have been actively engaged in that review. It is important that the views of Indigenous leaders and stakeholders are heard and that this bill is not rushed through while the House inquiry is underway because this would be dismissive of the genuine engagement that many Indigenous people have made with that process. As part of that inquiry the committee has received a submission from the Wild Rivers Interdepartmental Committee representing some 12 different government agencies. The submission contains a detailed analysis of the opportunities for and challenges to Indigenous economic development in Far North Queensland and, as the submission notes, there is a tremendous amount of government activity occurring in Far North Queensland. Indeed, the government is the largest employer in the region.
The submission also canvasses the wide range of private sector industries such as mining, agriculture and tourism and their potential to improve Indigenous economic development. These are the areas that should be investigated and debated if we really are serious about improving life for people on Cape York Peninsula and in the gulf. Overriding the Wild Rivers Act will not achieve lasting outcomes for Indigenous people. It will deliver more complexity and less security into the future. These are the areas that should be investigated and debated. Overriding the act will just not provide the solution.
The bill is not necessary to protect native title interests in the areas affected by wild river declarations because in our view the Queensland Wild Rivers Act 2005 does not affect native title rights and interests. The bill that passed through the Queensland parliament—and I again remind those sitting opposite that it passed with coalition support—explicitly says that native title interests are not affected. That is explicit in the bill and the legal advice to that effect supports that position.
Finally, if the opposition are serious about Indigenous economic development, surely it must be considered extraordinary that Senator Scullion has attempted to gloss over that this bill effectively acknowledges the potentially negative employment outcomes of the bill. It is in the bill. The bill recognises that there will be negative economic outcomes. I find it extraordinary that a senator from that side would acknowledge that a piece of legislation he is proposing will have negative economic outcomes for people of Cape York Peninsula and the gulf. That is why our government considers that the bill needs to be properly scrutinised. In that respect, I move by way of an amendment:
At the end of the motion, add: “the bill be referred to the Legal and Constitutional Affairs Legislation Committee for inquiry and report by 10 May 2011”.",SENATE,<title>WILD RIVERS (ENVIRONMENTAL MANAGEMENT) BILL 2010</title>,<title>Second Reading</title>,Bills,1,1
"Siewert, Sen Rachel",AG,2011-03-24,"—I want to start addressing the Wild Rivers (Environmental Management) Bill 2011 by stating the obvious—that is, the Greens care about and are deeply committed to the rights of Aboriginal and Torres Strait Islander peoples. We are a party that remains committed to the wider principle of self-determination, something other parties used to believe in before—in particular, the Labor Party—but seem to have now gone down the line of the new approach, which is a form of paternalism. The Greens care about and are deeply committed to protecting and conserving Australia’s biodiversity and natural heritage. For anyone who has paid attention to our efforts over the last few years and is aware of the significant work we have done both on Aboriginal and Torres Strait Islander peoples’ rights and on environmental conservation, this should be non-controversial and self-evident. However, some argue that you cannot have both environmental protection and conservation and economic development for Aboriginal communities. The Greens do not believe that this is the case. In fact I believe there is strong and compelling evidence that the two can go hand in hand.
It is fair to say there has been a concerted effort to try to reframe this debate, which is about how best to support Aboriginal communities and native title holders to exercise their underlying rights as the custodians of their lands and about how they can use their interests in the lands and see country as a basis for sustainable economic and community development, as a political wedge. They are trying to frame the debate such that the only choice is between mega-industrial development on the one hand, which we believe can ultimately end up in the interests of outside players and vested interests from the big end of town—there is plenty of evidence of that—or locking up land and ignoring people. We believe that is not true and there is plenty of evidence to show that conservation and development activities can in fact go hand in hand.
At the same time, there is also plenty of evidence of where an all-out approach to industrial development has totally failed to realise the hopes of Aboriginal landowners or deliver lasting benefits to their communities. I point to my home state of Western Australia and the Pilbara, where quite clearly the benefits developed from mining have not come to the Aboriginal people living in that area. There are also plenty of opportunities for sustainable development activities on Aboriginal lands which will include but are not limited to tourism and ranger programs. There is a lot of other potential for Aboriginal land.
In fact, the coexistence and interaction of development and conservation are explicitly recognised in the Declaration of the Rights of Indigenous Peoples. The declaration recognises and acknowledges both a right to conservation and environmental protection for Indigenous lands, in article 29, and a right to determine strategies and priorities for the development of Indigenous lands and resources, in article 32. These rights are not contradictory—they coexist and interact within the framework of both Indigenous rights and decision making and Australian law—as clearly articulated in article 46, which states that these rights:
… shall be subject only to such limitations as are determined by law and in accordance with international human rights obligations … Any such limitations shall be non-discriminatory and strictly necessary solely for the purpose of securing due recognition and respect for the rights and freedoms of others and for meeting the just and most compelling requirement of a democratic society.
The coexistence and interaction of human rights should not be news to anyone in this place. I will return to the declaration later.
In relation to how we strike the right balance to deliver the best possible outcomes for both community development and conservation, from my point of view the ideal way forward is one where Aboriginal communities are central players and the key decision makers in decisions about both conservation and development—where they are resourced and supported to make informed decisions about which areas of their land they want to protect and where they believe some sorts of development activities might be appropriate and beneficial.
How you strike the right balance between development and conservation is not a simple issue, and efforts to reduce this complexity into black and white terms can be misleading and counterproductive, and ultimately lead to poorer outcomes for both Aboriginal communities and natural heritage outcomes. The place to begin is not in simply overturning state rights and state conservation laws to allow unfettered access for the destructive exploitation of resources but in governments establishing true relationships with Aboriginal people, using public investment to seed new enterprises and industries that build on and respect Aboriginal land interests, providing incentives to private enterprises to partner with and deliver opportunities to those communities, recognising and valuing the existing customary economy, and finding innovative ways of making Indigenous knowledge, skills and culture and caring for country deliver economic benefits.
Irrespective of the wild rivers laws, Aboriginal communities seeking to undertake development on their lands face a whole lot of other barriers and challenges, including addressing the limitations and complexities of the Native Title Act and needing to comply with the EPBC Act and a significant list of state based development and conservation legislation. To this end, the Greens believe there needs to be much more funding to provide support and assistance to Aboriginal and Torres Strait Islander communities to help them deal with the procedural requirements for dealing with economic development proposals, conservation and heritage proposals and joint management agreements. There are of course state and federal limitations and guidelines that apply to all development activities in Australia, irrespective of whether the land is Aboriginal land, freehold or crown land.
It has long been recognised that state and federal laws concerning conservation and development need to respect and include the rights, interests and cultural heritage of Aboriginal and Torres Strait Islander peoples. While there has been some progress on these issues over the years, I am the first to admit we still have a way to go on getting this right. Nevertheless there is a clear differentiation of relationship between Indigenous rights in decision making across environmental and development regulation, and in my mind it makes perfect sense to recognise a continuum where the rights of traditional owners are strongest in relation to those activities which have the greatest impact on their pre-existing and underlying rights to their land.
Unfortunately, this bill seeks to turn this concept on its head. The place where these rights should have the strongest recognition and expression in law is where Aboriginal land and resources are threatened with destruction or appropriation. In native title law, the rights of traditional owners are expressed as rights to negotiate in relation to future acts where there is a change in tenure or land use that affects underlying native title rights, and the diminution of those rights is meant to be compensated in law.
If an act by a state government—for instance, in establishing or declaring a protected area—impacts on those native title rights then there is a right to negotiate and a right to compensation. There should be a clear obligation both to strongly take into account cultural heritage, values and Indigenous aspirations in the identification and declaration of those areas, and to support and resource Indigenous management or co-management of those areas. We believe this bill turns this approach on its head by giving individual ‘owners’ who are not necessarily traditional owners an absolute right of veto over conservation declarations which do not—as specified clearly in the provisions of the Queensland Wild Rivers Act—impact upon, effect or diminish those underlying native title rights but at the same time give them no rights of consent or veto, or to negotiate on destructive development activities which impact directly upon their native title rights and interests, and cultural and natural heritage values. We believe this is not the right approach.
Many arguments have been flung around during this debate. I do not have time to go into them, but let me say they are not true. We do not unthinkingly support the Queensland government or other organisations on this. We do not believe the Queensland government handled consultation on this in an exemplary manner.
—They are only doing it to get your preferences.
—If Senator Macdonald would let me speak uninterrupted that would be appreciated. At the same time we also do not offer unthinking support to anyone claiming to speak on behalf of Aboriginal rights or the interests of all Aboriginal people, but we do not believe this is the right way to go when you look at the details of the bill. This bill is different from the first one that went through this place not so long ago.
This week we have been hearing calls for a new intervention in Alice Springs. We have deep concerns that this sends a particular message about the way that certain members of the coalition and, unfortunately, the government still want to take top-down approaches to the way we deal with Aboriginal issues—that is, not including them, taking a new paternalistic approach, not adequately consulting and believing that, for example, just sending in more police will fix a particular problem. In other words, I am not convinced that the coalition has changed its approach to the way it addresses Aboriginal issues. I am concerned that the discussion implies that this is about free, prior and informed consent; it does not in fact do justice to free, prior and informed consent and is giving it to a certain group of people over limited decision making.
If you look at the Declaration of the Rights of Indigenous Peoples, you see that it very clearly intends to describe and invoke universal rights that necessarily apply to all Indigenous peoples, not a particular group of Indigenous people, which is what, unfortunately, this bill does. It gives a particular group of Indigenous people some right of veto over a particular declaration, but not over all developments of their land. Our reading of it is that it also means it gives a group of people the right of veto over a declaration in a particular area. If there is more development they cannot exercise that right. It also then overrides the rights of other people, for example, further down the catchment area, who have their traditional lands. Once the group has made a decision, the next group cannot make a decision. In other words, that group’s rights have been overtaken. That is our reading of the bill. There are very concerning aspects in this bill in that it does not coincide with the requirements under the Declaration of the Rights of Indigenous Peoples, to which I am very pleased to say Australia is a signatory.
These are the issues we believe need to be looked at because we believe there are significant problems in this bill, including that it fails to differentiate between the rights of different groups of traditional owners in relation to decision making concerning a river basin or floodplain and, as I said, that it impacts on other groups. We believe this bill has very major problems. We also believe that it needs to be sent to a committee so we will be supporting the second reading amendment. We believe these issues need to be looked at. They are new issues that have come up since the bill last went through this place. (Time expired)
",SENATE,<title>WILD RIVERS (ENVIRONMENTAL MANAGEMENT) BILL 2010</title>,<title>Second Reading</title>,Bills,1,1
"Macdonald, Sen Ian",LP,2011-03-24,"—Before my brief contribution to the Wild Rivers (Environmental Management) Bill 2010, I seek leave to incorporate a very learned, well researched and well argued speech by Senator Boswell, on the grounds that he is ill. The speech has been distributed.
Leave granted.",SENATE,<title>WILD RIVERS (ENVIRONMENTAL MANAGEMENT) BILL 2010</title>,<title>Second Reading</title>,Bills,1,1
