name,party,date,text,chamber,debate_title,subdebate_title,debate_type,debate_id,subdebate_id
"Whish-Wilson, Sen Peter",AG,2013-02-25,"



Senator WHISH-WILSON
 (Tasmania) (17:58):  I present the explanatory memorandum for the bill and move:


That this bill be now read a second time.


I seek leave to have the second reading speech incorporated in Hansard.


Leave granted.


The speech read as follows—


The Small Business Commissioner Bill 2013 ensures that the roles and responsibilities of the Federal Small Business Commissioner are set out in legislation. It also provides teeth to the Commissioner to ensure he or she can effectively carry out their role as an advocate and representative of small business. 


The Small Business Commissioner must be more than a symbolic position, the Commissioner and their office must be empowered to be effective advocates for small business. This bill provides the necessary capacity to move beyond the symbolism. 


Small Business is a crucial part of the Australian economy. According to the Australian Bureau of Statistics small businesses employ more than two million people; therefore they are a fundamental pillar of the Australian economy. The personal risks that people take when starting a small businesses and the challenges they face are immense. They deserve a champion at the Federal level to deal primarily with Commonwealth related issues and to complement the work of the small business commissioners in the States that have them. 


This is why the Australian Greens welcomed the decision of the Government in 2012 to appoint a small business commissioner. However this does not go far enough - currently the Commissioner has no legislated role. It has no power to ensure it can be an effective broker between small and big business. At the moment the Commissioner and their office don't have defined roles and responsibilities, the Commissioner can channel their office's resources and energy in whatever direction they choose.


Therefore legislation for the office of the small business commissioner is crucial to ensuring roles are defined and the Commissioner has the power to be effective. 


A legislated position will also make it more difficult for an incoming Government to abolish the position as happened recently in Queensland when the Newman Government abolished their Small Business Commissioner. 


The roles and responsibilities of the Small Business Commissioner as described in the bill cover a range of areas including assisting in dispute resolution and investigating complaints from small businesses about their commercial arrangements with Departments, Statutory Agencies or Executive Agencies of the Commonwealth. A recurring theme from small businesses that conduct business with Commonwealth Departments is the unnecessary complexity involved in winning and adhering to Government contracts. Some small businesses also claim that Commonwealth Government bodies can be particularly slow in paying their bills.


As cash flow is integral to a small business, delayed payments of bills can be quite destructive. In many ways just as crucial to small business owners is the time they use in following up late payments. This is time they can't use to grow and develop their business. 


Government agencies and departments should adhere to best practice in dealing with small businesses and many do. However for those who don't, small businesses will be able to contact the Office of the Small Business Commissioner for assistance and representation in their business dealings with Commonwealth Departments and Agencies. 


The Office of the Small Business Commissioner has the power to bring representatives of Commonwealth Departments and Agencies to the table to facilitate conflict resolution with a small business. Subject to constitutional constraints it also allows the Commissioner to facilitate resolution between larger businesses and small businesses. If Departments or businesses fail to attend in front of the Commissioner or provide documents as requested this Bills allows for the application of financial penalties. Based on my understanding of the operation of the small business commissioner in South Australia I anticipate that businesses will willingly attend resolution and mediation sessions with the Small business commissioner. Therefore the power is there to be used if necessary, but I hope it will be used minimally, if at all.


The Small Business Commissioner Bill also requires the Commissioner to monitor, investigate and report to the Minister on market practices that may adversely impact small businesses. This will provide a dedicated office of people who can undertake research and monitoring of issues and market practices that are key to the operation of small business and provide reports to the Minister for Small Business. The office of the Commissioner will also be able to prepare information for small business about entering into commercial arrangements with Commonwealth Departments.


This bill vests a research function within the Office of the Small Business Commissioner. This will ensure research on small business trends and growth is available to policy makers through an annual report. I also hope that research into the size and structure of the small business sector and emerging trends is carried out to help policy makers to better understand the sector. 


The Bill provides for cooperation between small business commissioners in the states and territories and other relevant Government agencies and the Commonwealth Small Business Commissioner on a voluntary basis in respect of any dispute that has national ramifications. I would think that the expertise and advice of a Federal Small Business commissioner would be valued across the country. I would also like to take this opportunity to call on the states and territories without small business commissioners – including my home state of Tasmania – to strongly consider their introduction.


The architecture is already in place. As previously outlined the Minister has appointed a Small Business Commissioner who started work in January. This Bill is not intended to undermine this position; its intention is to strengthen it. This Bill provides for a seamless transition, it explicitly states that the person known as the Federal Small Business Commissioner should be appointed as the first Small Business Commissioner once the legislation receives Royal Assent. 


Small businesses are a major contributor to the Australian economy and therefore employment. They deserve their own advocate and the legislation to back them up. This will help ensure small businesses are at the forefront of economic policy discussion and development in Australia. 


I commend the bill to the Senate. 



Debate adjourned.

",Senate,<title>BILLS</title>,<title>Small Business Commissioner Bill 2013</title>,BILLS,11,1
"McLucas, Sen Jan",ALP,2013-02-25,"



Senator McLUCAS
 (Queensland—Parliamentary Secretary for Disabilities and Carers and Parliamentary Secretary to the Prime Minister) (20:04):  I present ministerial statements as listed at item 11 on today's Order of Business:


Afghanistan Transition, made in the House of Representatives on 7 February 2013; and



Transport Safety and Security Cooperation with Indonesia, made in the House of Representatives on 7 February 2013.

",Senate,<title>MINISTERIAL STATEMENTS</title>,"<title>Afghanistan Transition, Transport Safety and Security Cooperation with Indonesia</title>",MINISTERIAL STATEMENTS,14,1
"Milne, Sen Christine",AG,2013-02-25,"



Senator MILNE
 (Tasmania—Leader of the Australian Greens) (20:04):  I seek leave to move a motion to take note of the ministerial statement regarding Afghanistan.


Leave granted. 




Senator MILNE:
  I move:


That the Senate take note of the document.


I note with interest that the minister says:



Australia must continue to be clear-sighted about our objective in Afghanistan.



But that is the problem: Australia has not been clear-sighted about our objective in Afghanistan for quite some time. 


There is no more grave responsibility or decision by any country's leader than to choose to send young men and women to war to risk their lives for our country. As Major-General Cantwell said in his book, which was published last year:


We need to have a crystal clear understanding of why we're getting into the fight, how long for, what we hope to achieve, how we will leave, and what conditions might prompt us to change strategy—this has let us down in Afghanistan. Human beings die as a result of warfare.


I want to come to the Australian government's decision to now be engaged in the transition out of Afghanistan. In particular, the minister said in his statement:


Our objective is to prevent Afghanistan from again becoming a safe haven for terrorists.


He then went on to talk about the transition and said:


Australia will continue to remain firm in our support to Afghan security forces and firm in our commitment to the transition strategy that Australia and the international community, acting under a United Nations mandate, have agreed to implement.


The point that I wanted to discuss tonight in particular is the situation of women in Afghanistan. As one such woman said recently:




You can't have a secure Afghanistan unless Afghan women are safe. The knowledge that there is a comprehensive plan to secure women's safety is what will enable Afghani women to actively participate in public life and shape their country's future.



Unfortunately, the Australian government has no such comprehensive plan. In Minister Smith's latest statement to the parliament, women are mentioned three times and only in relation to Australia's service men and women.


Not once are the women of Afghanistan mentioned in the government's statement of transition out of Afghanistan. Of course I support the references to supporting Australia's service men and women with as much capacity as we have, particularly servicing their physical and mental health needs on their return. But the women of Afghanistan deserve our consideration. 


Not once in the seven statements made to parliament or two speeches to NATO and ISAF has the minister ever talked about the vital importance of securing women's rights during the transition for the future prosperity of Afghanistan. And this is despite the fact that his department has signed up to the Australian National Action Plan on Women, Peace and Security 2012-2018 to support, and I quote, 'capacity building for women in fragile conflict or post-conflict settings', and for 'putting in place specific strategies to promote the participation and protection of women and girls'. There is no sign of any concrete implementation.


The minister's latest statement is focused on improvements in Afghanistan. For an honest assessment, it is just as important as discussing the data that shows deterioration. Violence against women is one of these crucial indices of progress, but it is not mentioned. The Afghanistan Independent Humans Rights Commission recorded 4,010 cases of violence against women in 2012, up from 2,299 in 2011. Perversely, this may be a sign of empowerment because more women are finding their voice to publicly register their humiliation. But what its absence from the minister's statement highlights is that women's rights are not seen as a guiding priority of Australia's involvement. The Greens find that shameful. We must make women's rights in Afghanistan a key component of Australia's contribution during this transition. 


The Afghan Australian Development Organisation, a fantastic NGO established through the hard work and dedication of Nouria Salehi, empowers women in Afghanistan through funds raised in Australia. They provide vocational training and literacy programs for women and young people in Kabul and nearby villages, as well as accredited formal training programs for science teachers. Back in Australia they assist Afghanis to settle into Australia and overcome the trauma experienced both in their home country and in our detention centres. They are a member of ACFID and have a local office in Afghanistan to support local community development. 


Last month, a delegation of 50 eminent Afghan MPs and Afghani Australian civil society leaders came together to develop recommendations for the Australian government. They then briefed both the government and the opposition spokeswoman, in that case Julie Bishop, on the overarching recommendations. The first one was that Australia use its place on the UN Security Council to ensure that women, peace and security provisions are entrenched in all resolutions dealing with Afghanistan. Most importantly for the purposes of the minister's statements is the upcoming mandate for NATO ISAFin October 2013. I would like to put the government on notice. It is essential that Australia use its place on the Security Council to highlight the role of women and to make sure that they are there in the peace and security provisions.


Secondly, make Afghanistan a priority country for national action plans for women, peace and security, with each government department implementing and monitoring a plan accompanied by a budget measure starting this May. You cannot say that you are serious as a government on national action plans for women, peace and security if you are not prepared to put a figure against it in the case of women in Afghanistan. Thirdly, the recommendation was that AusAID make gender equality the priority for their new country strategy, particularly focusing on the development within Afghan institutions and women's organisations. 


Certainly, the Greens support those recommendations. Why would we not provide support to Afghanistan to achieve 25 per cent representation of women at elected bodies as per the Afghanistan Constitution, as well as achieve 30 per cent representation of women in leadership in all government bodies as per Afghanistan's commitment to the Millennium Development Goals by 2020? Why would we not provide direct technical and capacity building support to women to facilitate their involvement at the table in the peace and reconciliation process? Women's presence is not enough to meaningfully participate; women need an enabling environment and capacity building support both at the national and at the provincial levels.


When we ensure the exit of combat troops, we need to make sure that that is matched by increased support to gender sensitivity training and mentoring of the Afghan National Army, in particular the Afghan National Police. The Australian security sector training and mentoring should specifically focus on Afghan laws that protect women, human rights law and gender sensitive reforms. We must provide funding to the forces in Afghanistan after the main withdrawal of international troops to make sure that we build the Afghanistan National Security Forces' capacity to implement laws that protect women. We need to make sure that we support increased participation of women in the Afghan National Security Forces in high-level and local level decision making and especially the National Security Council.


I cannot see why we would not, in Australia, also make sure that we continue to support and resource the increased participation and access of women and girls to education through literacy and accelerated learning programs. Of course, we should focus on eliminating violence against women in Afghanistan by supporting Afghan civil society in the elimination of violence against women in law in Afghanistan.


I put on the record my disappointment that the minister has not, again, mentioned the plight of women in Afghanistan in this transition. If we are serious about having a plan which secures Afghanistan in the long term then we must protect the rights of women and girls in Afghanistan to participation and education, and we must use some of our aid budget and our transition money to that end. I think we could expect from the government some outspoken support in the UN Security Council. Australia has now got a unique position in the UN Security Council to raise and support this issue of empowerment of women in Afghanistan.


Question agreed to.

",Senate,<title>MINISTERIAL STATEMENTS</title>,"<title>Afghanistan Transition, Transport Safety and Security Cooperation with Indonesia</title>",MINISTERIAL STATEMENTS,14,1
