name,party,date,text,chamber,debate_title,subdebate_title,debate_type,debate_id,subdebate_id,type
"Van Manen, Bert, MP",LP,2013-03-12,"



Mr VAN MANEN
 (Forde) (18:15):  I too rise to join everyone else that has spoken on this motion on the national disasters over the past few months. I wish to offer my sincere thanks and admiration to the people of Australia who have been affected by these natural disasters, but also those that have not and have made a wonderful effort to help those in need.


It is interesting to have listened to the member for Murray's contribution, and it reminds me of the words of Dorothea Mackellar's poem My Country. It goes, in part:


I love a sunburnt country,


A land of sweeping plains,


Of ragged mountain ranges,


Of droughts and flooding rains.


I think, given the events of the past two or three months, that is very relevant. It is certainly a country that has had many extremes: from the bushfires in Tasmania, Victoria, New South Wales and Western Australia to the drenching rains, the wild winds and the severe flooding unleashed on the eastern seaboard—not just once, but several times. Australians have definitely dealt with a range of natural challenges which have tested our resilience and resolve. For some people, the clean-up is a harsh reality, especially for those still rebuilding their lives following similar events in 2011. Once again, they have experienced the treacheries and trials of natural disasters and they have only recently been able to come up for air from the devastation that occurred previously. Many that we have spoken to have not yet even managed to complete renovations, repairs, replacements or relocations. They have yet again had to deal with the unpredictability of torrential summer rains. Following these recent events, particularly around Bundaberg and the Fraser Coast, people have still not been able to re-enter their homes or even to salvage what they can of their lifelong possessions. This in itself, I am assured, is most devastating.


We were fortunate once again in my electorate. Whilst there were widespread outages for our electricity et cetera, by and large we were spared the devastation of further up the coast and in the Logan, Albert and Coomera rivers. At last count, there were only some 15 houses that were inundated—some partially but some substantially—and the people in those places have lost almost all of their goods and possessions.


But through all of these fires, storms and floods, it is always heartening to watch that spirit of mateship—an unwritten Aussie code of conduct—that emanates across the country; whether it is Victorians heading to Tasmania or Tasmanians flying to Queensland to help out one disaster after another and to repay the favour of lending a hand to a mate when he is in dire straits. After recent floods in my electorate of Forde, which were some three inches or so below the 1991 flood—which was the last major flood that we had—I visited the Logan River Tree Farm, where they had at least 1½ metres of floodwaters through their mature tree nursery. When I visited, Ailsa Thompson and her staff were working frantically hand washing the leaves and stems of hundreds of trees with the few hoses they had. They were desperately trying to save seven years of hard work, which included the recovery from the 2011 floods.


My thanks go to the local council and the local fire station. After we contacted them and made them aware of the situation, they were able to make available a number of high-pressure water appliances to help make the job easier, particularly given that the trees were reasonably mature and on large concrete pads. Their main work was to clean the mud off those concrete pads to make access to the trees easier. My thanks also go to local councillor Jennie Breen for her effort in putting together a working bee, which was very well received by a number of people in our community, but there remains much work to be done.


As I said earlier, some 14 properties were affected by the floods and, in many cases, houses were also left without power for up to five days. One major piece of infrastructure that, fortunately, on this occasion was not damaged beyond repair—although it was significantly damaged in 2011—was the John Muntz Causeway at Upper Coomera. Fortunately, we have been able to reopen that piece of road, but it is operating on only one lane, as it has been since 2011. Thankfully, the federal government, out of the natural disaster relief funding, is contributing along with the state government to the replacement of that causeway. The result will be significantly better than what is currently there.


I remember the 1974 floods at my home in Waterford. It was interesting to see the current floods and note how much bigger the 1974 floods were than those we had recently. Thankfully, this year's flood level stayed well below the '74 levels; otherwise there would have been far more devastation. I saw a house that, on this occasion, had a small amount of water go through it, but I remember the effort involved in cleaning that up in 1974, when it was under about three metres of water that covered the roof.


I would like to commend the local councils, both the Gold Coast City Council and the Logan City Council, on the work that they did in trying to notify residents in at-risk areas. Also, as the water receded, they returned to each of these homes to assess the flood impact and offer clean-up assistance to affected homes. As with any of these things, some people were missed along the way, but this has been a great experience for the council to try to improve its processes. My thanks go to the SES, the local state MPs, the councillors and community groups, who were all out in force assisting affected people. I would also like to thank everybody on the Gold Coast weather website, which continued to put up information for people on what was happening around the neighbourhood, and also the people who started the Logan region weather and information page on Facebook. These same people also started a drop-in centre at Park Ridge for people who needed assistance. When people in the community are working together to help provide information to everyone else in the community and let them know what is happening locally, it makes dealing with these events so much easier for everybody involved.


The damage that has occurred during these natural disasters around the country has been phenomenal. Our thoughts go out to those people who have lost income, livelihoods and valuables, not only in my electorate but around the country. We thank the federal government for its support of those people in difficult times and also the various state governments, because they have their own disaster relief arrangements as well.


For those in my electorate of Forde, whilst Logan and the Gold Coast were not declared natural disaster areas for individuals, we have written to the Attorney-General on behalf of people and businesses affected for consideration on an individual basis. We do thank the government for the fact that a number of those people have already been assisted. We must not to forget them just because we are a month or two down the track. These people will take a long time to recover from what they have been through. I encourage people to continue to get behind those who have been through these disasters and assist them in rebuilding their lives.

",HoR,<title>STATEMENTS ON INDULGENCE</title>,<title>Australian Natural Disasters</title>,STATEMENTS ON INDULGENCE,19,1,speech
"Cobb, John, MP",Nats,2013-03-12,"



Mr JOHN COBB
 (Calare) (18:25):  I rise to speak on the natural disasters. As I was sitting here a while ago listening to my colleague speak, it struck me that it does not really matter what religion or god you believe in—if you are a farmer, you very definitely believe in Mother Nature. Just lately she has been a very, very tough lady. She can be absolutely wonderful, but just listening I realised that in the last month or so we have had fire, flood and drought all at the same time in our country. As the member for O'Connor will no doubt tell us shortly, we did have and still have very serious drought in WA. In western New South Wales, if you have not had the recent rain, you are still going into it. We have the repetition of floods in central and south-eastern Queensland and south-western Queensland. At the same time we have had fires in northern New South Wales, Victoria and Tasmania, as we just heard the member for Murray talking about. They are all horrible and they all have an incredible effect.


Strangely enough, the greatest stock losses, and probably the greatest loss of human life, is not normally due to fire, except where you get an incredibly quick one—which you would expect—or to drought, although it can be if it goes on long enough; normally it is flooding that seems to take the most in human life and in stock, I guess because we do not take it as seriously as fire. But, by heaven, in recent years it has caused an enormous loss of life in Queensland and enormous losses in terms of our animals.


On the Friday and Saturday just after the worst of the flooding had subsided in Bundaberg and up in that area, in North Burnett, Banana and Gladstone, I was up there with my leader, Warren Truss, Paul Neville and Kenny O'Dowd, the member for Flynn. In Bundaberg it was quite something. It was a record flood; it was beyond anything ever seen. Two years before it had gone up to just under eight metres. This time it went over nine. It was just an amazing thing. That last metre of water is one heck of a lot of water. When you think how flat it is there, you are talking an unbelievable amount of water. There were something like 2,500 homes inundated, and, if it had not been for the helicopters, undoubtedly people would have been in a lot more trouble than they were. The same thing occurred two or three years before up in central Queensland, and of course a couple of years before, almost to the day, down in the Lockyer Valley. You do not expect Mother Nature to be quite so severe so at times close together in pretty much the same places.


I saw things with dairy through North Burnett and areas up there, where people, for three, four and five days, were unable to milk their cows. For anyone who understands dairies at all—and obviously a lot do not—they are not going to milk again after going out for that time. They go dry and get incredible complications.


One family that we saw there were just at the end of their tether. It was a father and son, and they had an electrician there. He could hook the power up, but they could not make anything work because most of the motors were still under water. They had to hand milk something like 400 cows just to try to relieve them, and that does not work that well—not with today's number of people to do it.


That was a family I really worried about, but they were not the only ones. There were others that had gone for days without milking—others had gone five. One bloke had pigs for 30 or 40 kilometres around. He would get a phone call to say, 'There's a couple of pigs wandering around here—are they yours?' At least they were alive; a lot were not. There were permanent plantings in orchards where there was just nothing there. I am talking about serious citrus trees, and it looked like a desert. It was pretty horrendous stuff.


I think that everyone had to be commended for hooking into it; governments—local, state and federal. I think that, by and large, people did what they could and did the right thing. It got to the point where, particularly up there around north Burnett and further up, they could not even ring. It was mobile country—the standing lines were down. But after a couple of days the mobile towers do not work because their batteries go flat. Embarrassing as it might have been for Telstra, that was the case for quite some time.


Sometimes there is only so much that people can take. At least Emerald, Theodore and those that have been belted twice in a couple of years were spared this time, but Bundaberg and the horticulture there—not to mention the domestic side within the town—certainly had Mother Nature give them some hurry-up over those two or three years.


As I said, the fisheries were totally wiped out two years before; cattle had ended up on North Keppel Island that time, and it is away out on the Great Barrier Reef. Certainly, once again beef cattle, as well as dairy cattle, have been scattered across the countryside. There were people who were missing a thousand cattle. At times like this you wonder why we farmers do it. We deal with flood, fire and drought and, as I said, this particular time it was all happening in our country at the same time.


In my part of the world—I grew up in an area in the Cobar shire—through the fifties, sixties, seventies, eighties and into the nineties we had serious fires every 10 years. My electorate, Calare, was pretty lucky with the fires. It did have some small ones, but nothing like in the north of the state and certainly nothing like in Victoria and Tasmania—thank heaven! We had flood last year—Forbes was cut into three—but, once again, not like the sorts of floods that South-East and west Queensland had over the last few years. One would think that that part of the world at least is going to be spared a repetition of it in the near future; these things do seem to even out. But I think we have to take our hats off to the people who have marched through it.


As I said earlier, I think that by and large the right thing has been done by the various levels of government. Certainly, when called upon the armed forces did their job as professionally and competently as they always do when asked to do it. Wherever it happens—not just agriculturally, but in all ways—I think we have to admire the people who shrug and get on with it and who say, 'Next time we'll be luckier.'

",HoR,<title>STATEMENTS ON INDULGENCE</title>,<title>Australian Natural Disasters</title>,STATEMENTS ON INDULGENCE,19,1,speech
"Crook, Tony, MP",NatsWA,2013-03-12,"



Mr CROOK
 (O'Connor) (18:34):  Natural disasters like those in the Prime Minister's speech and those mentioned today by members in this place have also been affecting Western Australians, particularly in my electorate of O'Connor, where we lost a volunteer firefighter in the Two Peoples Bay bushfire west of Albany last October. Wendy Bearfoot suffered horrific burns to more than 60 per cent of her body when her truck was engulfed by flames caused by a freak wind change and, sadly, she passed away as a result of injuries. 25-year-old Charlene Hordyk was also badly injured with burns to 20 per cent of her body along with five other fellow firefighters.


I take this opportunity to acknowledge the bravery of these Australians who are risking their lives to help protect other people's lives and property. I would also like to offer my sincere condolences to Mrs Bearfoot's family including her husband of 30 years and her three children. To Charlene and the other injured firefighters I wish them a very speedy recovery and thank them for the outstanding contribution they have made to our community.


The Two Peoples Bay fire was only one of several bushfires around my electorate, with other major fires in Esperance on the South Coast, Bremer Bay on the mid-South Coast and Northcliffe last month. In all of the stories that members have contributed to this discussion there is a common theme and that is the remarkable work of emergency services personnel and the thousands of volunteers who support them.


Bushfires are not the only disasters to hit the O'Connor electorate, although they are the dramatic events that catch our attention most vividly and that demand our vigilance. Freak weather events are becoming more common across this vast electorate such as the storm that devastated the small community of Dudinin in the central wheat belt. While the east coast of Australia has been hit by similarly dramatic flood and fire, Western Australians and particularly Western Australian farmers have been suffering the much slower and less striking effects of drought and other unpredictable weather patterns.


I have been contacted by many of these farmers who are currently in dire straits. They have said that this season has been particularly difficult. In some parts of the state it is the culmination of five dry years in a row. Others are experiencing unseasonal rainfall patterns and freak storm events. WA farmers are under some of the most difficult agricultural conditions in the world, which appear to be getting more difficult with changing weather and increasing incidences of natural disaster.


As with all disasters there is one critical factor that enables us as individuals and as communities to prepare in advance, to manage the event while we experience it and to react to a worst-case scenario when it happens. That critical factor is information. Information is the key to working together in difficult situations. Information is the tool that allows us to assess past disasters and to plan for future disasters. The availability of information is a service we rely upon in the modern world to keep in touch with our loved ones, to make sure that they are all right and to check whether they need our help.


Information is critical for emergency services responding to big disaster events. It is also critical for farmers and communities struggling to cope with a series of lesser, progressive events that combine to create a disaster for their lives and livelihoods. Information is important for local governments, for health services including the Royal Flying Doctor Service, for the main roads, for industry, for tourists and travellers, and for people in their homes when these disasters strike. However information is the one thing that the firefighters at Two Peoples Bay were working without.


On 12 October 2012 Wendy Bearfoot and her colleagues were working in an area with limited radio network coverage and no mobile phone reception. There was little or no means of conveying critical information about changing conditions. There was little or no means of calling for help. In a dangerous situation where rapidly changing weather can make the difference between life and death, how can this be an acceptable set of circumstances for our emergency services to operating under? Yet this is the exact situation in many regional areas. In the Great Southern region around Albany, the local Chief Bushfire Control Officer, Mr Ross Fenwick, has been working with state member of the Legislative Council Mr Colin Holt to identify nine bushfire brigade sheds that receive no mobile phone coverage whatsoever and a further seven that can only access a signal via connection to an external antenna. These are the volunteer bushfire brigades that thousands of people are relying upon to protect them, their property and their livestock against bushfire events that are a serious threat, not just an outside possibility.


Again, it is not just the bushfire scenario we need to consider when we talk about the lack of critical information. The Bureau of Meteorology has recently decommissioned the Eucla weather radar on the Western Australian and South Australian border. I understand that the radio was old and that it was going to be costly to replace it, so it has been switched off. This is a service that provides critical weather information to emergency services, to the flying doctors, to the main roads, to the pastoralists and to the local and travelling community. It is a service that is seriously lacking in other parts of O'Connor as well, denying people the information they need to protect themselves and to defend themselves against weather events that can devastate their lives immediately in freak events or slowly over seasons and years.


My electorate offices have been approached time and time again by farmers crying out for government support. They tell me they need more information—critical weather information. They need to know when and where rain is falling so they can farm productively because, while the effects are not so obvious and not so immediately dramatic, drought is a natural disaster like flood and like fire. It has the power to take away people's lives and livelihoods. These farmers need to know what has happened in previous years so they can prepare for what seasons might look like in the years to come. They need weather radar so they can prepare for and respond to changing conditions so that those conditions do not become a disaster.


I understand that at least two weather radars are necessary, one in the wheat belt and one in the south-west. This is in addition to the existing weather services, which need to be protected and replaced when necessary. But what I am hearing is that the weather radar is being decommissioned, and it is not only Eucla that is getting the chop. I understand that the Bureau of Meteorology has undertaken a review recommending the enclosing of aerodrome forecasting equipment at 78 regional aerodromes around the country. This equipment, like the Eucla radar, is old and needs upgrading. I understand that the costs of upgrading these services is somewhere near $7 million. What I want to ask is: what is the cost of not upgrading this equipment? What is the cost of switching off these services and taking away this source of vital weather information for remote and regional areas? What is the cost to these communities that can no longer rely on the Royal Flying Doctor Service, because the flying doctor does not have the information required to get in and out of a particular aerodrome safely? What is the cost to the communities when the viability of their aerodrome services is questioned by operators that cannot afford the extra costs of contingency fuel supplies to make it into the next aerodrome in case the weather is found to be inclement upon arrival? And what is the cost of further isolation from emergency services, from essential services and from help? The cost is similar to that experienced by communities whose fire brigades cannot communicate effectively. It is a drastic and dangerous cost.


I implore members of this House to think more broadly about natural disasters, not just about how we help people to clean up and support them with crisis response initiatives and not just about how to assist communities struck by dramatic events. These communities are very worthy, and they must receive our help. But I implore the government and future governments to help and support the people on the ground who are preparing for, managing against and battling with the effects of all sorts of natural disasters, big and small, on a daily basis. In Western Australia this means that people in regional areas in O'Connor and across rural Western Australia must be provided with more information—equip them with the tools they require, arm them with the information they rely upon, provide them with critical information services and information communication services so that when things do go wrong they have the very best chances to survive and to carry on battling in the years to come. These people need mobile phone towers. They need weather radar and weather stations. They need to know that they will have the information they need when they need it. And they need to know now that the government takes the natural disasters they are experiencing seriously and will help them to protect themselves.


In 2013 in Australia, one of the most advanced, prosperous and privileged nations in the world, how can we justify denying a significant proportion of our population this kind of information? It is information that is so much more critical to those people living in remote and isolated communities amongst harsh and dangerous environments and far from major service provision centres. This information is taken for granted by the rest of the population and by populations across other developed nations. It is time that we brought our regional Australians up to date and provided them with these basic services. Australians in the regions need information and services for communication for their survival.


There is a huge anomaly in talking about supporting people in the face of weather driven natural disasters when we are taking away weather monitoring data services. There is a huge contradiction in providing services for emergency situations if those services cannot communicate effectively when the disaster strikes. The bottom line is always going to be very important, but in this instance the bottom line must not cost lives.

",HoR,<title>STATEMENTS ON INDULGENCE</title>,<title>Australian Natural Disasters</title>,STATEMENTS ON INDULGENCE,19,1,speech
