name,party,date,text,chamber,debate_title,subdebate_title,debate_type,debate_id,subdebate_id,type
"McCormack, Michael, MP",Nats,2013-03-12,"



Mr McCORMACK
 (Riverina) (20:59):  Mr Deputy Speaker Scott, you come from Maranoa and know how important the Export Market Development Grants Amendment Bill 2013 is to you. I am interested that the Parliamentary Secretary for Agriculture, Fisheries and Forestry is at the table, along with the former Speaker, the member for Scullin. I also note that the member for McEwen, who is another regional member, is sitting in the chamber, listening intently to my words. I also acknowledge the member for Wright, as well as the shadow parliamentary secretary for regional health, who is also sitting at the table. He was in Wagga Wagga just last week and would have no doubt heard many farmers complaining about how difficult the terms of trade are for them at the moment. It is always wonderful to follow the member for Forrest, Nola Marino, because she is so passionate and feisty about all of these important issues, which are central to trade. I know that the members in the House at the moment all appreciate just how important trade, agriculture and Australia's future food security are.


I note how few Labor speakers are on the speakers list. That is a shame, because perhaps if we were talking about unions or public servants at risk of losing their jobs—one of those sorts of issues—the speakers list would be full. It is just a shame that the speakers list is not full with government members talking about this very important issue, because we have just heard the member for Forrest talking about just how hard and how tough our agriculture producers are doing it at the moment. The shadow minister for agriculture, the member for Calare, told us yesterday in our party room that producers are doing it tougher in some circumstances than they were at the height of the drought—and that is a problem. And it is not just a problem for them; it is a problem for the regional communities that their hard work underpins. It is a problem for our nation because we cannot sell the amount of food that we rely on to help our balance of payments figures, our balance of trade.


We cannot continue to operate this way. Those farmers, let us face it, were once the backbone of this economy, and they still keep it going. Agriculture is still such an important component. Mining may well be one of the big dollar earners, but agriculture helps our balance of payments no end, and we all like to eat food. Only last week I spoke to representatives from the Leeton citrus growers. This organisation has been going since 1942. They are doing it really tough at the moment. They have lost 150 growers in less than a decade. That is the loss of 300 wages. Their costs are now going through the roof. Their power costs are exorbitant and are not helped by the carbon tax. Their wages have not become any cheaper. The high Australian dollar is really killing them, as well as so many other agriculture producers. Bad water policy is just another thing which they are trying to contend with.


I note that the member for Wills is now the Parliamentary Secretary for Trade and has been since 4 February 2013. It is an interesting position which the member for Wills finds himself in, given the fact that he was so stridently opposed to the live cattle export trade to Indonesia when that particular issue blew up after a Four Corners program. It was policy from this government based on a television program. It was a very savage knee-jerk reaction to a television program that saw the live cattle trade stop forthwith—bang—just like that, with no thought given to the cattle producers of Australia's west or north. Indeed, as the member for Forrest just indicated, the shock waves reverberated right throughout the cattle-producing industry and even beyond it. The markets in Wagga Wagga and elsewhere in the Riverina were affected because of it. There was a fear that they would not be able to export a lot of their cattle overseas and they would see them brought south. The people who built stock crates were also affected because orders were stopped.


I am pleased to say that the shadow minister for agriculture visited Indonesia last October, along with the opposition leader and the shadow foreign affairs minister, Julie Bishop, who has an intense interest in trade and certainly in helping our trading neighbours. The highlights of that trip were the sheer untapped potential, the member for Calare said, for our farm exports—and not just those of Northern Australia. The coalition took the extraordinary step of sending a delegation of senior shadow ministers to Indonesia because of the importance that this side of politics places on our northern neighbour as a valued trading partner—not somebody to whom we can just say, 'No more cattle.' They are not somebody whom we can just bring the gate down upon with our live exports but rather somebody whom we need to be friends with, somebody who is important to us, somebody whom we need to treat like a friend. You do not treat friends in the way that the Prime Minister did when she stopped the live cattle trade.


Indonesia has been vastly undervalued as a trading partner. While every nation across the globe is trying to capitalise on the Asian boom, there are a number of obvious reasons why Australia should be trying to make the most of the opportunities that exist within the Indonesian economy. Indonesia is not in great need of our coal because it has large deposits of its own, and some people foolishly dismiss Indonesia as a trading opportunity because of this. Australia has a unique opportunity to bolster our farm sector with Indonesia. It has 237 million people literally on our doorstep. It has a booming middle class of around 50 million strong and a high propensity for consumer spending. In short, it is an ideal destination for our farm produce. Our farm produce, as you know, Mr Deputy Speaker, as the member for Maranoa, is the best in the world bar none. I do not mind saying that. I am sure the parliamentary secretary for agriculture, who is sitting at the table, would agree with me.




Mr Sidebottom:
  Hear, hear.




Mr McCORMACK:
  'Hear, hear,' he says. Certainly that is the case. We have the best in the world and we need to protect and preserve it.


The changes proposed in the Export Market Development Grants Amendment Bill 2013 are to deliver on the recent Mid-Year Economic and Fiscal Outlook decision to concentrate the Export Market Development Grants Scheme more on small businesses exporting to East Asian and frontier and emerging markets. The MYEFO decision and associated policy changes in this proposal will deliver annual savings of $25 million.


Labor calls them savings. They really are cuts and taxes. Failed policy is what it really is, and it is having an effect in this particular instance on our trading relations. This is not the first time I have spoken today; I have spoken a number of times, and a number of times I have spoken about particular bills as being cost savings—as in the baby bonus, on which I spoke earlier this evening. Again, these are to try to help the Treasurer, our failed Treasurer, to try to balance his books. And it is not working. The Australian public are not fools; they are not buying it. The fact is that this government cannot properly fiscally manage our economy. And so many people I speak to cannot wait for the next election.


The EMDG Scheme, administered by Austrade, partially supports export promotion expenses of eligible enterprises in order to boost exports of Australian-produced goods and services, which are, as I say, so important for our balance-of-trade figures. The EMDG Scheme reimburses up to half of eligible export promotion expenses incurred by small- to medium-sized enterprises, and then the claims are reimbursed retrospectively for expenditure incurred in the previous financial year pro rata up to the particular cap. Around 5,100 enterprises per year apply for these grants. Prior to now, the scheme has been capped at $150 million per year since 1997, except in 2008-09 and 2009-10, when a $200 million cap applied.


The MYEFO decision late last year and associated policy changes in this bill are designed to deliver annual savings—again, that word 'savings'—of $25 million. According to Labor, the changes will better help Australian exporters maximise the potential of the Asian century by increasing the number of grants available in East Asian and frontier and emerging markets from seven years' worth to eight years. We all know that this is not right; this is just typical Labor spin—typical Labor claptrap. This is more policy on the run. We cannot afford, as the member for Forrest indicated, to hurt our exporters—particularly at this time, when our balance-of-trade figures are not that good, and particularly at a time when our budget is so much in the red.


To offset the additional grant expenditure associated with an enlarged number of grants to East Asian and frontier and emerging markets, the number of grants to the United States, Canada, the United Kingdom and the European Union are to be reduced. The government argues that in those markets the Australian brand is already well known and accepted, and small businesses typically face fewer barriers to doing business—and that may be so. But, even though the Australian brand may well be known, why not promote it even more? Why is it necessary to keep cutting, to keep cost-shifting, to try to balance the Treasurer's failed books? And why is it that all the time the ones who are getting hit in the neck the most are Australian farmers, Australian exporters—the people who put food on our plates and on the plates of so many foreigners as well?


The government argues that the increased focus of the EMDG Scheme on emerging and frontier markets brings the EMDGS into closer alignment with Austrade's broader trade priorities following its review in 2011 and the government's Asian century policy agenda. I will just repeat that: 'Australia's broader trade priorities'.


As to what our trade priorities are or should be: the Prime Minister only last year, in quite a groundbreaking speech, actually, in Melbourne, talked about promoting and strengthening irrigation so that we could grow more food to tap into those Asian markets, but every single policy initiative by her side of government, the government that she leads, does just the opposite. I cannot understand it, nor can the citrus growers and cattle producers, nor can those wonderful lamb producers in the Riverina, who grow the best lamb in the entire nation. They cannot understand it.


They simply cannot understand why this government is doing everything in its power to just stymie them whenever they try to develop export markets, to stymie them whenever they try to have the ability to grow more food to feed our nation and others. It is hurting our balance-of-trade figures. It is hurting our ability to do business in export markets such as Indonesia. And it is hurting our farmers' and agricultural producers' ability to make a profit.


And, when the farming sector is doing it tough, regional towns are doing it tough. You do not have to go too far into my electorate to see how tough they are doing it. Farmers are having to work at two jobs—they are having to source off-farm incomes—simply because there has been bad water policy enacted by this parliament. This government is just so bogged down in green tape. I know there has been a divorce between Labor and the Greens, but still they seem to be in cahoots with one another when it comes to policy, because so much of the policy that we see from that side of government is bogged down in green tape and so often we hear the Greens leader, Senator Milne, make the catchcry and Labor just follow suit. Their policies just follow suit, and it has to stop.


It has to stop because our farmers are the world's best. Our farmers are not asking for a handout; they are just asking for a hand up, a bit of assistance, a bit of an even go, a bit of a level playing field—something that I am sure that the parliamentary secretary for agriculture knows also. I know he has offered to come to my electorate, and I will welcome him soon to come and see for himself and to talk to the sorts of people whom I talk to, because I know he would be interested. I serve on the Standing Committee on Regional Australia, and I know the good work that he did there as the deputy chair. I know he certainly has his heart in the right place. I would certainly welcome him to come to the Riverina to hear firsthand from people. This piece of legislation is not good, and it will hurt our exporters. They are extremely valuable people. I will certainly welcome the member for Braddon to come to my part of the world, hear the sorts of complaints people have and hear of the sorts of ways forward they believe we should be adopting and the sorts of policy initiatives that his government could also be implementing to help them to make ends meet and to help them not just to survive but indeed to thrive as they should. Thank you for allowing me to make those comments, Mr Deputy Speaker.

",HoR,<title>BILLS</title>,<title>Export Market Development Grants Amendment Bill 2013</title>,BILLS,15,1,speech
"Kelly, Craig, MP",LP,2013-03-12,"



Mr CRAIG KELLY
 (Hughes) (21:14):  I rise tonight to speak on the Export Market Development Grants Amendment Bill 2013 and also to support the amendments moved by the deputy leader and member for Curtin. Just by way of background, the export market development grants scheme is administered by Austrade and it partly supports export promotion expenses of eligible enterprises in order to boost the exports of Australian produced goods and services. It is a scheme that reimburses up to 50 per cent of eligible export promotion expenditure incurred by small- and medium-sized enterprises. Claims are reimbursed retrospectively for expenditure incurred in the previous financial years, pro rata, up to the cap. Around 5,100 firms applied for grants.


The basic provisions of this bill—and what it actually does—exclude expenses of export promotion for grant years six, seven and eight for the major markets of the USA, Canada and the European Union. It makes a tokenistic adjustment by increasing the number of grants by one year—just one year against eight—to countries of East Asia. First and foremost, this bill is simply confirmation of yet another broken promise by this Labor government. We can add this one to the long, long list of broken promises by this government. It is just another reason why the public no longer believes a word that they say and why the public has lost complete trust in anything that comes out of the mouth of any member of this government.


We will go back to 2007: this Labor government, then in opposition, promised hand on heart that they would increase—that is right: increase—funding for the export market development scheme. They told us how they understood this scheme, how it was vital for small business and how they were really going out there to help small business with their exports. In the last year of the Howard government, 2006-07, the export market development scheme was funded to the tune of $154.4 million—it was $154.4 million back in 2006-07. Come to this financial year, and we have a government that told us they would increase funding. They have not only been too lousy to maintain real expenditure, they have actually slashed the expenditure by $25 million. So this financial year, the expenditure is down to just $125 million.


This is the lowest amount of expenditure under this scheme for over two decades. It simply shows that Labor cannot be trusted with their promises, but not only that: whatever they promise, we see them doing the exact opposite. We saw them promise, 'No carbon tax.' We not only ended up with a carbon tax, but we ended up with the largest carbon tax in the world. They promised to stop the boats and we have ended up with an absolute explosion of boat arrivals. They promised to return the budget to surplus, but we just get larger and larger deficits. Here we had them promising to increase expenditure for the export market developments and what do we see? It is being slashed—slashed to the lowest levels in decades.


It is not only that, it is the hypocrisy that we have had from this government. On this bill, we have had one measly speaker from the government. I see the member for McEwan over there. Perhaps he is going to stand up and make a contribution to this bill.




Mr Mitchell:
  You are hopeless!




Mr CRAIG KELLY:
  I think he is perhaps too embarrassed to walk around the exporters in his electorate and have to tell them that his government is cutting the funding for export development grants. What we have seen is not only the hypocrisy, it is the spin. They do not come in here and just be truthful, and say: 'Look, we have stuffed things up. We have wasted billions of dollars and we have to make some cuts.' Instead of saying that, what we get is this spin with the bill being dressed up as somehow tied to promotion in the Asian Century.


As ACCI have argued, there is no credible commercial analysis that shows export development grant money spent in the USA, Canada or the EU is any less valuable than that spent in East Asia, Africa or South America. It should be up to our Australian businesses to decide where they should spend their export marketing dollar, but those decisions are now going to be distorted by this government. It is not based on good policy or sound logic, but simply on spin. I would say, however, that there is perhaps one area in the world in which we as a nation need to increase our export marketing expenditure; that is Indonesia, following the debacle of this government's cut to the live cattle exports. Overnight, without any warning at all, they simply cut off the supply of live cattle to Indonesia. That has done almost irreparable damage to our relationship with Indonesia. If we are looking to increase our export marketing expenditure, Indonesia is perhaps one of the first places where we should start.


Not only is this spin, bad policy and broken promises: it is simply bad economics. Austrade undertook a study about the benefits of such schemes. They found that firms benefiting from export market development grants spent more on export promotion than did other exporters. In fact, they estimated that the grants payment of $156 million resulted in those exporters spending an additional $147 million on marketing. What they estimated is that that extra marketing expenditure resulted in an extra $1.4 billion of export sales. For $156 million worth of expenditure under this scheme, we were able to achieve as a nation an increase in our export sales of $1.4 billion.


But it is actually better than that because, you have to remember, the grants are taxable. When you look at the net cost after the tax subsidy comes back, you are looking at a much greater multiplier. Austrade worked out that, in most industries, a mature exporter will generate in additional exports 15 to 25 times the grants paid to them. If we want to increase the revenue of this nation—if we are looking at how we are going to pay back this mob's debt, how we are going to fund the NDIS, how we are going to fund the extra expenditure for schools and how we are going to fund the extra expenditure for hospitals—we should be increasing the expenditure under this scheme, not cutting it back to record lows as this government is doing. This mob simply does not get it.


Also, we should be out there trying to create a culture of exporting and exporters. I know from my own experience. Before entering parliament, I had travelled and exhibited at trade shows in Singapore, Malaysia and Dubai. One thing I found at those trade shows was how generous other countries are, compared to Australia, and how small our scheme is. At these trade shows we were able to find out that, rather than being given 50 per cent of their expenditure by their government as Australian firms were, the companies from the UK that we were competing against were getting the whole lot subsidised by their government. So the scheme we have is very modest to start with, and this mob is just cutting it back again.


This government is also kicking exporters when they are down. Australian exporters are currently struggling with the high level of the dollar. And they were promised a tax cut by this government, funded by the mining tax. We know where that has gone.



Government members interjecting—




Mr CRAIG KELLY:
  You have not got any money for it; that is the reason. You have not got any money to fund it; you have wasted it all. It was a concocted mining tax. You blokes were played off the break. It was a complete embarrassment to your lot. So not only were our exporters promised a company tax which has not eventuated but many of them are facing downturns in our export markets. And they are also struggling with the world's largest carbon tax. Under this Labor government, energy costs for Australian firms have risen faster than just about anywhere else in the world. This is putting Australian industry, and our exporters, at a competitive disadvantage. This is the very worst time to be cutting back their funding—and that is exactly what this government is doing.


We have to ask ourselves: why are they doing this? Why are they cutting back? Why are they slicing back money for export market development? It is because of their waste and mismanagement. This mob has run up the four largest deficits in our nation's history. To spin their way out of it they came up with the line 'returning the budget to surplus'. And one of the cuts they came up with was to cut back this very important scheme which we need to keep our economy going—a measly $25 million. It is interesting to see what industry experts say about these cuts. Warren Cross, a legal expert and director of a firm called Export Incentives, is quoted in Smart Company magazine as saying, 'It's frustrating and disappointing this scheme has been put on the chopping block again by Labor,' and he argues that the trade minister, Dr Emerson, 'does not have a clue'. I could not agree more. He also says of our trade minister: 'He has never been interested in the scheme from day one, so this isn't a surprise. They've been cutting this grant back for years.' That just about says it all.


But we should look at the important amendments moved by our deputy leader. Those amendments clearly denote the problems with this bill. We need to have another review of this scheme and, if the funding is available, we need to try and help develop our culture of exporting. The coalition in the past has funded this scheme at far greater levels than what the current government are doing. When the coalition government left office we had $150 million in the scheme. The current government are reducing that to $25 million. Again, that is the complete opposite of what they promised.


If we are going to move our country forward, if we are going to start paying the debt, a debt that we have to pay back, with interest, it is going to cost this nation $267 million a week, every week of the year, for the next 20 years. That is the funding that we have to find. We are looking at trying to find $8 billion to $10 million to fund the NDIS, which this mob on the other side loves to talk about but does not have a clue how we are going to fund. And we talk about the Gonski education reforms. To fund these things, we have to encourage exporters, we have to get our exporters out there. We make great products in Australia. That is the reason this scheme works. We want the government to encourage firms to get out there and get involved in exporting. We should not be cutting this scheme back. To cut the number of years back for the USA, for Canada and for the EU is completely the wrong direction. We should be looking at uncapping years. You cannot have just five years for marketing a product overseas. And we have to remember that these grants are not given per product, they are given per firm. (Time expired)


Debate interrupted.

",HoR,<title>BILLS</title>,<title>Export Market Development Grants Amendment Bill 2013</title>,BILLS,15,1,speech
