name,party,date,text,chamber,debate_title,subdebate_title,debate_type,debate_id,subdebate_id
"Leyonhjelm, Sen David",LDP,2014-12-04,"



Senator LEYONHJELM
 (New South Wales) (09:32):  The Family Tax Benefit (Tighter Income Test) Bill 2014 cuts government spending by more than $270 million a year by means-testing family tax benefit part A more rigorously. Both the coalition and Labor recognise that welfare payments should be means tested. This may seem an uncontroversial idea, but we should remember that some countries have welfare payments that are not means-tested, like universal age pensions, and we should remember that Labor have a troubled relationship with means-testing. They are proud of their changes in recent years to more rigorously means-test family payments and the private health insurance rebate, but they do not want to means-test access to Medicare, and they defend concessional loans for high-income beneficiaries of higher education. The coalition too have a troubled relationship with means-testing. They have loosened means-testing for the age pension and want the private health insurance rebate to be universal. And both sides have continued tied funding to the states that bans state owned hospitals and schools from imposing fees, even on high-income users of these services.


Thanks to this inconsistency on means-testing, I have no great hope of support from either the coalition or Labor. But let me go through the process of making the case for the bill. Family tax benefit part A is a welfare payment. Do not be fooled by the mention of tax in the name. It goes to families regardless of whether or not they pay tax. Current and previous governments have decided that families with the least income need this welfare payment of up to $6,723 per child but that a family's need for it reduces when family income exceeds around $50,000. For each dollar earned over that amount, the welfare payment is reduced by 20c. This arrangement is unremarkable and is unaffected by my bill.


However, in what is a bizarre and completely unwarranted quirk, when the welfare payment reaches $2,204.60, further rises in income do not prompt further reductions in the welfare payment. The welfare payment for a family with one child remains at $2,204.60 whether their income is around $70,000 or $90,000. So, once your family income exceeds around $50,000, you are sufficiently beyond the reach of poverty that your welfare payment can fall as your income rises, but, once your income exceeds around $70,000, somehow you are back in the clutches of poverty and it would be unjust for your welfare payment to fall as your income rises. You are finally considered to be free from this spasmodic grasp of poverty only when your income exceeds around $90,000, after which the welfare payment is reduced by 30c for each additional dollar earned. This arrangement is ridiculous.


My bill will get rid of the pause in the withdrawal of family tax benefit part A when the payment reaches $2,204. Instead, once your income exceeds around $50,000, so that the withdrawal arrangement has started, it continues until your payment reaches zero. There is no policy reason for a pause in means-testing arrangements. The only reason we have such a pause in current law is that, when John Howard rejigged tax and welfare arrangements as part of the introduction of the GST, he wanted to make sure that he could say there would be no losers and, in particular, he wanted to buy off the middle class so that they would vote for him in the 2001 election and beyond. So he put them on welfare. My bill essentially starts generating losers when family income reaches around $70,000, with most of the impact concentrated on families with incomes over $90,000. This means the impact of my bill falls on middle-income families and upper-income families. Those families who are earning these amounts but who think that they are low-income families do not realise that many people are worse off than they are. It may come as a shock, but at least a third of Australian families are worse off than they are. Low-income families are best served through rigorous means-testing, as this concentrates assistance where it is needed most, and middle- and upper-income families are best served through rigorous means-testing, as any welfare they receive is paid for by the taxes they pay now—or the taxes they will pay in the future when government debt is finally repaid—and any welfare they receive arrives only after they have spent hours listening to Centrelink's crummy hold music and after the bureaucracy has taken its cut.


The economic figures released yesterday are a grim reminder of the problem we face in Australia and that the budget is not going to repair itself. Recent estimates suggest the deficit will be $40 billion this year. Despite what some in Labor and the Greens suggest, this is not a problem of insufficient taxation; it is a matter of excessive expenditure. Paying welfare to people who are capable of looking after themselves is simply unsustainable. It also deprives those who genuinely need welfare to have a decent standard of living. If welfare can be limited to the truly needy, it will be possible to be more generous.


This bill is in the interests of all Australians, but it will take leadership for it to pass into law. I commend the bill to the Senate.

",Senate,<title>BILLS</title>,<title>Family Tax Benefit (Tighter Income Test) Bill 2014</title>,BILLS,2,1
"Cormann, Sen Mathias",LP,2014-12-04,"



Senator CORMANN
 (Western Australia—Minister for Finance) (09:38):  The government recognises that there are fundamental issues with the current design of the family tax benefits system which need to be addressed to ensure that the system can be sustainable into the future. That is why we have announced a number of reforms in the 2014-15 budget to better target those benefits. Reforms like those we announced in the budget are a necessary and important part of bringing the budget back under control and helping to rein in the fiscal gap between revenue and expenditure growth.


In 2014-15, the government will provide around $19 billion in family tax benefits. Family tax benefits should provide assistance to families who need it most while encouraging everyone who can work to do so. In the budget, we announced that we want to tighten eligibility for family payments to ensure they support those most in need of assistance. For example, families will continue to receive family tax benefit part B until one parent earns $100,000 per annum, families will receive family tax benefit B until their youngest child turns six and existing recipients would continue to receive payment for a further two years—the thinking here being that once the youngest child turns six the opportunity is there, when the child goes to school, for both parents to rejoin the workforce. Of course, if the choice is for that not to happen then it is not the taxpayers who should be asked to subsidise that choice. Low-income single parents will receive a new supplement of $750 per annum for each child aged between six and 12. 


I applaud the work of senators like Senator Leyonhjelm who have serious and positive ideas on how to contribute to the budget repair challenge and how to help rectify Labor's debt and deficit disaster. Senator Leyonhjelm and Senator Day deserve strong credit for laying out a number of savings proposals of their own that are wide-ranging and serious contributions to our debate about the budget. Senators do share a general responsibility to all Australian taxpayers to help with budget repair, and we welcome the kind of debate that we are having today.


There are some very commendable objectives in this bill, including the objective to improve the sustainability of social security; the objective of reducing the long-term taxation burden; and the objective of reducing the level of welfare churn, where cohorts of families are in a situation where they are both paying tax and getting some of it back in welfare payments. We believe that there are already good and viable reforms in the budget and that these should be considered and supported by the Senate in the first instance. There are approximately $11 billion worth of savings in the Social Services portfolio currently before the Senate. Approximately $4.8 billion of those savings relate to the family payments area within the Social Services and Other Legislation Amendment (2014 Budget Measures No. 4) Bill. The government believes that the Senate should first deal with the reforms in the budget bills—in particular, those reforms in budget bill No. 4—before pursuing any further reform proposals. To help ensure the long-term sustainability of supports for families, the Social Services and Other Legislation Amendment (2014 Budget Measures No. 4) Bill makes changes to the way in which family payments are made by continuing to support those most in need. 


The cost of changes to payment systems can be significant due to IT complexities and the need for significant customer interactions. The Department of Human Services is already working on a large number of significant ICT projects with similar scheduled start dates to those envisaged in this bill. These measures will ensure that the social security system in Australia is sustainable into the future. The long-term savings from these measures will help pay down the massive debt left by the previous Labor-Green government and ensure that the next generation is not left to pay off the Labor-Green debt. The government will continue to work constructively with senators across party lines to design solutions that have broad support, but, for the reasons that I have just outlined, the government will not be in a position to support this bill.

",Senate,<title>BILLS</title>,<title>Family Tax Benefit (Tighter Income Test) Bill 2014</title>,BILLS,2,1
