name,party,date,text,chamber,debate_title,subdebate_title,debate_type,debate_id,subdebate_id
"Randall, Don, MP",LP,2014-07-16,"



Mr RANDALL
 (Canning) (11:09):  It is my pleasure today to speak on the Defence Legislation (Woomera Prohibited Area) Amendment Bill 2014. I would like to concur with the member for Canberra's speech. This is an important bill, and she has essentially fleshed out the reasons for this bill as a coexistence model. But I need to say at the outset it has taken some time for this bill to eventually reach this parliament, and for that reason, I want to say that Senator David Johnston, the defence minister, should be applauded for bringing this forward and making it a priority.


I also concur with the member for Canberra about former Senator Don Farrell. He was a driving force. As a South Australian, he should be congratulated on making sure that this bill and this inquiry did not die. I hope that Senator Farrell, as a private citizen in South Australia now, will be able to continue his interest in this particular issue by being involved and working with the South Australian government to see that both federal and state governments pursue this bill in a way that will see it come to fruition as soon as possible for the benefit of South Australians in particular. South Australia is an economy that is under some stress so it does need to be prioritised.


This bill—I am obviously going to repeat some of the things that others have said—is a result of the investigation by the Hawke review. This Woomera Prohibited Area is in the national interest, as has been explained in the Hawke review. Let me just put it in context. Here I am, a Western Australian member of parliament, speaking about an area in South Australia. I note on the speakers list that there is not one South Australian speaking on this bill, which is quite strange when it is for the benefit of South Australians in particular. It is in the national interest, but for South Australia this project is massive.


We have already been told that $35 billion worth of potential mineral wealth will be uncovered in this Woomera Prohibited Area. Yet on either side—and I do not want to reflect badly on our colleagues—I find it passing strange that no South Australian member in this House is speaking on this bill today. I hope there is more interest shown when it gets to the Senate. I hope there is more interest shown when it eventually arrives at the feet of the South Australian government because it is particularly in their interests. In putting that on the table, I want to alert people to the fact that this is a national parliament but you would have thought a South Australian would be involved.


Ever since I was a child I have been aware of this huge area of South Australia that had been a no-go zone for everybody except Indigenous people. In some respects it was made a no-go zone for the Indigenous people of South Australia when we had the atomic testing at Maralinga. Australia has been the place that has been used by the British in particular for testing some of their weapons. The atomic testing done at Maralinga certainly degraded the area in terms of its atomic fallout. The Montebello Islands is an area that was a no-go zone for Australians for a long period. I noticed an article not so long ago which says that people are now going back to the Montebello Islands. Coral is growing back again after this area of Australia was also used for atomic testing by the British some time ago.


The half-life of uranium does not go off in 60-odd years, but it certainly makes it easier for us to re-enter those areas for short periods of time. Because of the long-term effect of the use of uranium in its weapons testing, this area is being sectioned off. I know that even the Indigenous landowners were not allowed near that degraded area, for obvious reasons. There were reports about Indigenous people who went back there and were having certain health issues—burns et cetera. That needs to be put into context here. The green zone, as the member for Canberra pointed out, is 75 per cent of this massive area, which is now going to be made available to a whole range of people, whether it be for tourism or other land use, but particularly for mining. 


We will not know what particular wealth is in this area until it has been drilled, but we do know that it is next door to the Olympic Dam area. The Olympic Dam is one of the treasure troves of minerals in Australia. Casey Gavin and Ted Mayman once wrote a book called The Mile That Midas Touched in terms of Kalgoorlie. It is a golden mile. There is Broken Hill, founded by a stockmen rounding up cattle, which turned into one of the other great mineral towns of this country. It is still going after all this time. Mount Isa is the other town. Potentially, this area of South Australia could be another one of those massive minerals deposits, which will benefit the South Australians of this nation in particular.


We know that South Australia has suffered some setbacks economically. One of the setbacks was the GFC and other factors saw the Olympic Dam expansion not go ahead. That was going to be worth billions of dollars, particularly to the South Australian economy. I notice that the member for Brand is here, so I will have to be a little bit gentle in relation to my comments about the mining tax. That is because there is no doubt in our minds that that was a negative factor for any expansion of mining ventures anywhere in Australia. As much as it has been denied and counterdenied, the expansion of Olympic Dam would have been a factor.


We have moved on since then and we hope to get rid of that tax in this parliament probably not this week but shortly, thanks to the changes in the Senate make-up. It is unfortunate that the Labor Party did not see the error of their ways and the error of having a mining tax that did not really collect any money and actually was a disincentive for people to be involved in this sector. Exploration was one of those areas. That is one of the downsides at the moment. This parliament needs to address it through such things as flowthrough shares or some other mechanism, because at the moment exploration in Australia has come to a sudden halt. We have seen today on the stock exchange that Boart, a mining services company, is under pressure because there is a lack of work for them. Drilling rigs lie idle and those involved in exploration need an incentive, because the lag time between finding a resource and producing it could be decades. I understand that Century zinc is called Century zinc because it took 100 years to bring it on. What we are doing in parliament today, in terms of this Woomera Prohibited Area, is trying to bring on a resource that could take years to develop. We will only know what is there once they start doing exploration work.


Other areas that have been mentioned, and I will just reconfirm them, are that there are going to be a lot of checks and balances which allow people to access this area. There will be penalties for those who access the area without permission, but the permission will be made far easier to access. The area contains recognised traditional owners, recognised areas for traditional owners and significant Indigenous sites. Under the bill, permit holders who gain access to the Woomera Prohibited Area will be required to protect these sites and comply with all relevant Native Title and Aboriginal heritage laws. Indigenous groups with current statutory access rights expressly retain these rights. They will not need to apply for access permission under this legislation, which does not disturb existing rights.


Section 400 is part of Maralinga Tjarutja lands. It was the site of atomic testing, as I said before, in the fifties and the sixties. In other words, access for the traditional owners—the Maralinga Tjarutja people—will not only be maintained but also will be enhanced. As I said, Defence has made it quite clear that the access through this area will come under the Minister for Defence and his department. They will take the necessary steps to excise section 400. Once completed, it will no longer be subject to the access restrictions that have applied under Defence Force Regulations 1952.


There is no point in repeating a whole lot of material that has been said by others. It is a very good coexistence model. This is jointly sponsored: it is a bipartisan piece of legislation that, as I have said, will enhance not only the South Australian and Australian economies but will also protect the rights of land owners. There will be a compensation regime in place for other land users. It will give miners greater surety to go in and spend the massive number of dollars to do exploration, which will be in the national interest.


As I said before the member for Grey came in and I will say it again, because the composure of this chamber has not changed, I find it passing strange that there is no South Australian here speaking on this bill. You would have thought that this was something exciting for those in South Australia. However, I understand that the member the Brand was born in South Australia, so there is some link there. It is a long bow, but I congratulate all those that are involved in supporting this bill and I recommend the bill to the House.



The DEPUTY SPEAKER:  I was going to add to the member for Canning that my parents met in Woomera. My grandfather was in the Army and my father was there working at Maralinga.

",HoR,<title>BILLS</title>,<title>Defence Legislation Amendment (Woomera Prohibited Area) Bill 2014</title>,BILLS,20,1
"Gray, Gary, MP",ALP,2014-07-16,"



Mr GRAY
 (Brand) (11:21):  I am tempted to suggest that if you parents met at Woomera, that must have been on the occasion that the various rockets were taking off and sparks were flying through the air!



The DEPUTY SPEAKER:  That is exactly right!




Mr GRAY:
  As the member for Canning reflects, I did grow up at Whyalla. I still remember evenings in the 1960s when we would go out, look into the horizon and know that a Skylark rocket was taking off. It was the original testing bed for those British-Australian cooperative rocketry research programs through the 1960s and 1970s. I also recall the great importance of the original discovery in the early 1970s of the Olympic Dam uranium find, which is one of the great finds that demonstrate the quality of Australian geophysical survey work and also shows the massive contribution to our economy—and in particular the South Australian economy—of that wonderful and innovative enterprise of Western Mining, which was under the leadership of Arvi Parbo. It found resources in remote parts of our country and helped build the magnificent, robust, reliable and innovative resources economy that we have today.


This piece of legislation, which opens the Woomera Prohibited Area for further minerals exploration and then potentially exploitation, is particularly important. It is particularly important in Adelaide but it is also important to our economy, as the mineralisation that we know exists through the Gawler Craton—which is expressed at what we now know as Roxby Downs, which is sometimes referred to as Olympic Dam—and those finds like the Carrapateena discovery in 2006 are all significant finds. They are all believed to be richly embedded in a uranium environment and all potentially highly productive for the South Australian economy and for our national economy.


This legislation saw its roots in a substantial piece of work commissioned by my predecessor, Martin Ferguson, and by the former Minister for Defence, Stephen Smith, in cooperation with the South Australian government. If I can just advise, I will speak for a short period of time to allow the member for Grey to speak on his own backyard. The work which had been done cooperatively and jointly in order to best utilise the highly prospective ground that formed the WPA is work that saw collaboration between the Department of Defence, the department of finance and the then Department of Resources, Energy and Tourism.


It is unfortunate that the final passage of that legislation through the Senate did not take place in the previous parliament. As we have been learning in recent weeks, and as I fear we will discover over the course of the next couple of years, the Senate can be a difficult place. This legislation was deliberately held up in the Senate in the previous parliament for no good purpose. We now see it here today and it is the fervent desire of the opposition to see this legislation enacted and receive royal assent as soon as possible in order for the best framework to be put in place cooperatively with the Department of Defence, the South Australian government, traditional owners and communities in this area of northern South Australia so that its mineral potential can be realised, so that that mineral potential can be understood and so that future companies can make decisions to extract those minerals and export them through the ports of South Australia.


It is highly likely that the minerals that will be discovered in this area will be metalliferous, it is highly likely that there will be uranium based metals, it is highly likely that there will be a lot of copper and it is a near certainty that there will be a lot of iron ore. But what is also certain is that the importance of this economic development to South Australia underwrites future generations of South Australians in employment and in wealth generation. So I commend this bill to the House. The opposition wholeheartedly supports this bill.


I will conclude by making one final point. All Australians were disappointed in 2012 when BHP announced that it would not be progressing with its then scheduled expansion of Roxby Downs. It was argued at the time that the overheated construction economy and the Japanese response to Fukushima had reduced the spot price of uranium to very low levels—and the uranium price today is less than half of what it was in those days of 2012. The reasons that were given were the high cap ex, the decisions in Japan on nuclear fuels demand and the overheated resource economy. It is our fervent hope that, at a time when the resources construction economy has substantially cooled, it will be possible to seek an expansion of Roxby Downs, further extraction of copper and uranium ores, further employment and further wealth creation. The Woomera Prohibited Area, the WPA, being brought into the exploration environment is a good thing for South Australia and a good thing for our nation. I commend this bill to the House.

",HoR,<title>BILLS</title>,<title>Defence Legislation Amendment (Woomera Prohibited Area) Bill 2014</title>,BILLS,20,1
"Ramsey, Rowan, MP",LP,2014-07-16,"



Mr RAMSEY
 (Grey) (11:28):  I thank the member for Brand for his comments and welcome the fact that this bill, the Defence Legislation Amendment (Woomera Prohibited Area) Bill 2014, has bipartisanship support. I would suggest that perhaps the member for Brand might read Senator Fawcett's speech on the hitches to the progress of this bill in the Senate. I do not think you will find they were of a partisan nature; in fact, it was more about Senate mechanisms than about any particular intent to hold this legislation up—because you are right, Member for Brand, this is very important for South Australia.


Unfortunately, South Australia leads the charge as the worst-performing state economically in the Commonwealth at the moment. As a South Australian, that is a great concern to me. I remember well when a number of the top 20 companies in Australia had their headquarters in South Australia. There was a time when South Australia was looked to for innovation and leadership throughout the nation. Unfortunately, our population growth has declined—and, in fact, in 2004 we lost another federal electorate. We went from 12 to 11. Unless population predictions change, we will lose another one in the next 15 years. That is not because our population is not growing; it is just not growing as fast as the rest of Australia.


You have to ask yourself why this is. Largely, we had industry based around manufacturing, where it is increasingly difficult for us to compete around the world—and when I say 'us' I mean Australia generally—and we relied on our agricultural products. Our agricultural industries are going well and still expanding and I think they offer great opportunity for the future. But it is in the mineral industries where South Australia, until relatively recent times, remained an unknown quantity. The geologists tell us now that the bulk of South Australia is covered by about 500 feet of sand and that has made it rather difficult to see what lies below. With the advent of magnetic surveys and other modern mineral detection methods we have found that in fact South Australia has a large number of very important resources. Quite often they are difficult to mine and expensive to get to because we have that overburden. The member for Brand mentioned the shelving of the expansion at Roxby Downs as an example of the impact that has had on South Australia and the disappointment it has caused, and that is true. Part of the reason for that is we have the best part of a kilometre of dirt to shift before we get to the ore body at Roxby Downs and that makes it a very expensive operation.


Roxby Downs is adjacent to the Woomera Prohibited Area—it is very close indeed. All the geologists believe there will be another Roxby Downs within the confines of the Woomera Prohibited Area. Already we have successfully mined Prominent Hill and three other iron ore mines with a significant upgrade at the moment of Southern Iron's, or Arrium's, northern province. About six million tonnes a year is currently being mined there and shifted by rail to Whyalla, where it is placed on barges and taken out to Cape-size vessels, adding to the six million tonnes that Arrium currently mines out of the Middleback Ranges.


I was very pleased when Dr Allan Hawke came to me, as the local member for the Woomera area, about two years ago and asked my advice on how we should open up this area for exploration and mining. I had met him and spoken to him about the review. He was very thankful that I was able to bring to the table, for the first time, the concerns and operations of the local pastoralists. We think about mining and sometimes forget about the people who are already making a living out of the land. In fact, he said some of the best advice he had came from the local pastoralists, who were able to tell him things about the land usage that others had not. So I was very pleased to be able to get their side of the argument into the equation.


The review sets up three different areas, which I think is a civilised and responsible way to give us an opportunity to open up new wealth for South Australia. As I said, we certainly need them. It seems that Defence has reached a very comfortable position in this area. There will, of course, be ongoing negotiation between those that choose to first explore the resource and then mine the resource, but we have a working paper from which we can launch ourselves forward. I hope it is going to lead definitely to more iron ore, because this is one of the keys to South Australia's future. I have mentioned the Arrium barging operation at Whyalla, but what we really need in South Australia is a genuine deep-sea port and we do not have one. Currently there is a large proposal on the Eyre Peninsula which has the ability to produce 20 million tonnes of ore a year and there is a proposal to build a port there. The rail system already runs past the Woomera region and the Braemar region, which is back up towards Broken Hill, all on the standard rail. If we can hook that back down to a new port development on the southern Eyre Peninsula we may have an iron ore industry in South Australia capable of producing between 60 million and 80 million tonnes a year. That is not the Pilbara, but let me tell you it is a seriously big pile of iron ore.


The opening up of the Woomera area actually feeds into that greater possibility for South Australia. As I said right at opening, it is difficult to see where South Australia is going to expand its economy if it is not going to come from the resources sector. Certainly we will continue to grow our aquaculture and agricultural sectors and we will learn to make more money out of what we already do. In fact, we will be able to downstream process and further add value to our agricultural products, but there is no doubt that the resources sector will play a very important part in South Australia's future. It is my belief the Woomera Prohibited Area will play a very important part within that.

",HoR,<title>BILLS</title>,<title>Defence Legislation Amendment (Woomera Prohibited Area) Bill 2014</title>,BILLS,20,1
"Robert, Stuart, MP",LP,2014-07-16,"



Mr ROBERT
 (Fadden—Assistant Minister for Defence) (11:35):  In summing up the debate on the Defence Legislation Amendment (Woomera Prohibited Area) Bill 2014 I thank the members for their contributions today, especially the member for Grey—the only South Australian to have spoken here today about one of the major areas for expansion of the South Australian economy. It is great to see South Australia being so ably represented by my good friend and colleague the member for Grey, Rowan Ramsey.


The Defence Legislation Amendment (Woomera Prohibited Area) Bill 2014 gives effect to the recommendations of the Hawke review. The aim of course was to investigate the best use of the world's greatest rocket range in the national interest and how two parties, Defence and non-Defence users, can coexist. I think the bill has arrived at a sensible, negotiated outcome. It is an outcome where defence can continue to operate a rocket range longer than the British Isles—the biggest one in the world—in support of the work that we do.


This legislation recognises existing users and it preserves existing users' right, which is important for those who already have a stake in the area. It establishes a framework for those non-Defence users to actually come within the WPA and gives a level of certainty over what we in Defence will do and how the non-Defence users can work within that so that they can account for sensibly in a commercial manner the restrictions that will be provided—and the restrictions are small and they are not onerous. It allows users to make sensible commercial decisions with assurance of when we will ask them to leave the area—because, frankly, defence is using it to test weapons. Lastly, it protects the safety of all users in the WPA and ensures that the appropriate national security protections for an area that is used to test defence capability are indeed in place.


It is a good, negotiated outcome between Defence and non-Defence users. I think it will be good for South Australia. I thank the member for Grey for his astute comments in terms of the South Australian economy and his continual work in improving the South Australian economy and what it is doing. I hope this bill will go some way to assist him with the great task that he has ahead. I therefore commend the bill to the House.


Question agreed to.


Bill read a second time.


Ordered that this bill be reported to the House without amendment.

",HoR,<title>BILLS</title>,<title>Defence Legislation Amendment (Woomera Prohibited Area) Bill 2014</title>,BILLS,20,1
