name,party,date,text,chamber,debate_title,subdebate_title,debate_type,debate_id,subdebate_id
"Feeney, David, MP",ALP,2014-07-16,"



Mr FEENEY
 (Batman) (10:10):  I rise to speak on the Defence Legislation Amendment (Woomera Prohibited Area) Bill 2014. While the content of the bill may be uncontroversial it is nonetheless very important, especially to those in the state of South Australia. I begin my remarks by reiterating the statement made by former Labor senator Don Farrell, who until recently had custody of this bill. He thanked the government for finally introducing this legislation, which is 'better late than never'.


The Woomera Prohibited Area is Australia's most important military testing range. It is used for the testing of war materiel under the control of the Royal Australian Air Force. The 127,000-kilometre expanse of northern South Australia, known as the Woomera Prohibited Area, is the world's largest overland long-range weapons testing facility and has been operational since 1947. However, from the 1980s onwards, areas of the land were made increasingly available to non-Defence users, including the resources sector. Local Indigenous groups and pastoral leaseholders also have an enduring presence across much of the WPA.


At the same time, the Woomera Prohibited Area overlaps a major part of South Australia's potential for significant mineral and energy resources, including 30 per cent of the Gawler Craton, one of the world's major mineral domains, and the Arckaringa, Officer and Eromanga basins for hydrocarbons and coal. Olympic Dam is adjacent to the Woomera Prohibited Area and is part of the same geological formations. The South Australian government has assessed that over the next decade some $35 billion worth of iron ore, gold and other minerals resources are potentially exploitable from within the Woomera Prohibited Area. So, clearly, we are talking here about a very significant resource indeed.


In order to assess the most effective use of the WPA for both Defence and non-Defence interests, on 17 May 2010 the then Minister for Defence, Senator John Faulkner, called for a review 'to make recommendations about the best use of the WPA in the national interest'. What ensued was the review of the Woomera Prohibited Area, which was led by Dr Allan Hawke. Its final report was published on 4 February 2011, and, critically for our purposes, it made 65 recommendations. Within its numerous recommendations, the Hawke review outlines a 'coexistence model' whereby Defence maintains primacy of the WPA, but non-Defence users have clarity and certainty regarding their access to specified areas of operation, incorporating both the available location and time of use.


In particular, recommendation 14 suggests the division of the WPA into three zones; a red zone for exclusive Defence use, an amber zone for regular Defence use, and a green zone for occasional Defence use. By implementing this zonal time-share arrangement, Defence is allocated exclusion windows throughout the year that limit the non-Defence use of the WPA. This ranges from new non-Defence users' total exclusion within the red zone, to up to 56 exclusion days in the green zone, pending notice. The excluded red zone comprises approximately eight per cent of the WPA, while the vast majority—some 75 per cent of the WPA area—is designated as the most accessible green zone. Importantly, the Hawke review recommended:


… that existing mining operations, environmental organisations, Indigenous groups and pastoralists with an extant presence on the WPA, should continue to operate under their current access arrangements unless they choose to be administered under the proposed coexistence model.


The provisions of the current bill give effect to that recommendation.


The Woomera Prohibited Area is larger than Tasmania and, indeed, larger than many states in Europe. Because it was used for very good, sensible defence purposes, it meant that a large portion of the state of South Australia was not open to mining. The Hawke review considered how to use the Woomera Prohibited Area in a way that ensured both its full national security and economic potential were realised. The review proposed a system to maximise the coexistence between Defence and non-Defence users of the area. Critically for the purposes of government—indeed, the previous government—the review recommended that Defence remain the primary user of the area but acknowledged that exploitation of the Woomera Prohibited Area's considerable minerals resources would bring significant economic benefit to South Australia in particular and of course the nation in general.


The review proposed that the Woomera Prohibited Area be opened up for resources exploration to the maximum extent possible but within the confines of its primary use for defence purposes. This will allow Australians to take advantage of the resources potential of the area while ensuring its future viability as the most important test and evaluation range that supports the Australian Defence Force remains preserved and intact.


The bill establishes a framework that provides all non-Defence users within the Woomera Prohibited Area with a greater level of certainty over Defence activity in the area and a greater certainty over access arrangements. It allows users to make commercial decisions with some assurance as to when they will be required to leave the area because of defence activity. The framework maintains the primacy of the Woomera Prohibited Area as a national security and Defence asset and sets up a coexistence scheme that allows access by non-Defence users, subject to conditions that protect the safety of all users in the Woomera Prohibited Area, and ensures the appropriate national security protections for an area used to test defence capability.


As recommended by the review, Indigenous landholders, pastoralists with an already established presence and existing mining operations in the Woomera Prohibited Area will continue to access and operate under their current arrangements. The coexistence scheme established by the bill will apply to new users of the Woomera Prohibited Area. Existing users of the area have the option of voluntarily joining the coexistence scheme established by these legislative measures if they so choose.


The Woomera Prohibited Area contains recognised traditional owners and significant Indigenous sites. Under the bill, permit holders who gain access to the Woomera Prohibited Area will be required to protect these sites and comply with all relevant native title and Aboriginal heritage laws. Indigenous groups with current statutory and access rights expressly retain these rights. They will not need to apply for permission under this legislation, which does not disturb existing rights.


Extensive consultation was undertaken by the former Labor government during the review process, which has given rise to this legislation and its various predecessor bills. Submissions were received from interested stakeholders, including the resources industry, Indigenous groups, pastoralists and environmental groups. Consultation on the bill included the release of an information paper on the proposed legislative framework for the Woomera Prohibited Area. The paper provided a general overview of the proposed policy framework proposed for implementation in the legislative package.


On 8 May 2013, an exposure draft of the previous bill introduced by Labor was released for stakeholder feedback. The South Australian government hosted a consultation workshop in Adelaide on 10 May 2013, chaired by the Woomera Prohibited Area Coordination Office, to discuss the bill. Stakeholders provided feedback through the workshop and by written submission. Feedback was considered and, where appropriate, the exposure bill was amended to take concerns into account. Amendments which occurred as a result of stakeholder feedback included express and specific recognition of the existing authorities for existing users, including Indigenous groups.


As the minister touched upon in his remarks, the government of South Australia raised concerns, in its submission to the committee and in the course of consultation, that the bill amendment to regulation 36 of the Defence Force Regulations 1952 will limit an individual's ability to claim compensation for loss or damage caused by Defence testing in the Woomera Prohibited Area. The committee report tabled on 13 May 2014 acknowledged the concerns expressed by the South Australian government and noted that the bill amendment to regulation 36:


… appears limited compared to the existing regulation 36 which provides a broader scope of compensation to those persons who 'suffer loss or damage' as a result of the use of regulation 34 and 35. 


The committee recommended that schedule 1, part 2, item 5 of the bill be removed from the bill or amended to maintain existing rights to compensation under regulation 36 of the Defence Force Regulations 1952. This amendment addresses the committee's recommendation and confirms that compensation will be available in the event that loss or damage is caused by Defence testing, or where there is an acquisition of property.


I congratulate the government on introducing this bill. As Don Farrell said previously: better late than never. Two previous versions of the current bill have been introduced into this parliament. The first was introduced by the former Labor government on 30 May 2013. That bill sadly lapsed when the 43rd Parliament was prorogued on 5 August 2013. Undeterred, however, a second version of the bill was put forward—which was in equivalent terms to the first version—introduced as a private senator's bill on 12 December 2013 by former Labor senator Don Farrell. That bill failed, tragically, because it was a Labor idea, and that excluded it from serious consideration by this government. But the government have now come forward with a bill essentially in precisely the same terms so that they can claim ownership of what is a very fine piece of work and a very important step forward for South Australia. There were a couple of minor changes in the legislation, and they have been spoken of. But, fundamentally, this is a very important bill for Australia.


Given the announcement earlier this year that Holden is going to close and many jobs will be lost in South Australia, I know that former senator Don Farrell was very keen for this bill to pass and for the economic opportunities that it unlocks to be realised in the state of South Australia. As discussed, there is estimated to be some $35 billion worth of resources able to be exploited, and the mining potential of South Australia is a very important part of that state's future. For that reason, I congratulate the government on bringing this idea forward. It is always a welcome thing when the policy vacuum of those opposite is filled with good Labor ideas. So, to have them come into this place and move Labor legislation is a welcome and happy circumstance. Indeed, this must be something that the honourable member for Fadden is getting used to in his Defence portfolio. I note that he is busy implementing Plan Suakin—a very important Labor initiative in the defence space—busy at the moment making sure that the budget settings in Defence that were established by Labor are carefully nurtured by this government and now of course busy making sure that fine Labor legislation passes this House. So to those extents I wish him the very best.


Debate adjourned.


Leave granted for second reading debate to resume at a later hour this day.

",HoR,<title>BILLS</title>,<title>Second Reading</title>,BILLS,4,2
"Vamvakinou, Maria, MP",ALP,2014-07-16,"



Ms VAMVAKINOU
 (Calwell) (13:30):  This July marks 10 years since the International Court of Justice handed down its advisory opinion on the legal consequences of the construction of Israel's wall in the occupied Palestinian territory. The court determined that the wall and all Israeli settlements in East Jerusalem and the West Bank are illegal, and that the fourth Geneva Convention applies to the Israeli-Palestinian conflict in full.


The Parliamentary Friends of Palestine hosted a forum yesterday commemorating the 10th anniversary of the ICJ, and our guest speaker was Professor Ben Saul from the University of Sydney. This event was timely, given the tragic situation in Gaza at the moment. It is devastating that Israel has decided to resume air strikes in the Gaza Strip following the collapse of the very short-lived ceasefire. Tragically for the people in Gaza, the eight-day conflict has already killed almost 200 Palestinians, 100 of whom were civilians, amongst them 31 children. With Hamas militants defying Arab and Western calls to cease rocket attacks, and with Israel threatening to step up an offensive that could include an invasion of this most densely populated enclave, it is imperative that both sides now show restraint in what is a devastating blow to peace prospects and what is also a predictable, disproportionate and cruel attack on the Palestinians in Gaza.


We as a parliament should all be very concerned about this situation. I also believe that we as a parliament should be speaking up and voicing our concern about a situation in the Middle East that could have tragic and dire consequences if it does not come to some sort of end.

",HoR,<title>STATEMENTS BY MEMBERS</title>,<title>Middle East</title>,STATEMENTS BY MEMBERS,5,1
"Bishop, Bronwyn, MP",LP,2014-07-16,"



The SPEAKER
 (14:00):  Before we go to questions without notice, I wish to inform the House that I have arranged for condolence sheets to be made available so that members will be able to signify their respects to the memory of his Excellency the Hon. Peter Underwood AC, former Governor of Tasmania, 2008 to 2014. The sheets will be available in the foyer of my office and will remain there today and tomorrow. I invite honourable members to sign the sheets at a time convenient to them.

",HoR,<title>STATEMENT BY THE SPEAKER</title>,"<title>Underwood, His Excellency the Hon. Peter George, AC</title>",STATEMENT BY THE SPEAKER,6,1
"Baldwin, Bob, MP",LP,2014-07-16,"



Mr BALDWIN
 (Paterson—Parliamentary Secretary to the Minister for Industry) (15:14):  by leave—I move:


That this bill be now read a third time.


Question agreed to.


Bill read a third time.

",HoR,<title>BILLS</title>,<title>Corporations Amendment (Simple Corporate Bonds and Other Measures) Bill 2014</title>,BILLS,15,1
"Thistlethwaite, Matt, MP",ALP,2014-07-16,"



Mr THISTLETHWAITE
 (Kingsford Smith) (19:30):  On 3 July our Prime Minister stated:


I guess our country owes its existence to a form of foreign investment by the British Government in the then unsettled or scarcely settled great south land.


Tonight I wish to explain why the Prime Minister's comments are wrong, are out of touch and are disrespectful to Aboriginal people in my community and throughout Australia.


Kingsford-Smith is blessed with some magnificent coastline and some of Australia's most famous beaches. One of those is the beautiful Coogee Beach. The name Coogee is said to derive from the Aboriginal word 'Koojah', which means the smell of the seaweed drying in Bidgigal language. It is a reference to decaying seaweed and kelp that throughout history and still to this day regularly washes up onto Coogee Beach. The place name of this beautiful little beach, and the suburb that surrounds it, indicates a settled Aboriginal term for this place—a name or a reference that clearly pre-dates English colonisation and is evidence of a well-established language in the area.


If you travel down the coast of my electorate, the next beach you encounter is Maroubra with its powerful surf and at times dangerous rips. The name Maroubra is believed to derive from 'Moorooberah', the name of the leader of the Aboriginal community who lived at a beach a few miles south of Koojah at the time of colonisation. Indeed, the bay in which the English first set foot on the Great South Land to establish a colony, and which remarkably the French entered a matter of days later—Botany Bay—has a local Aboriginal name, 'Kamay'. The wonderful suburb surrounding it of La Perouse, in the south of my electorate, is known as 'Curiwal' in local Aboriginal language.


These were, and in some cases still are, settled, customary, locally known terms to describe places in our community in a language that is older than the English language. How dare the Prime Minister deny that custom, that heritage, that culture and that language which have existed in our community for thousands of years and have been passed through generations—accepted, respected and adopted as the names of our communities' suburbs, beaches and bays. I recognise that Australia was settled prior to English colonisation and that Aboriginal culture, language and heritage is proof of this. We have the longest continuing culture in the world. We should be proud of this, and not deny it.


I was fortunate to be born and bred in Maroubra, as was my father, my grandfather and my great grandfather. Four generations of family connection make it my home, but that is not a patch on the family connections of local Aboriginal families, whose relatives have been living in our community for 7,000 years. Countless generations of people developed, nurtured, passed on customs, language, laws and heritage that importantly still exist today and which our community celebrated last week as part of NAIDOC Week.


These are principles that not only still exist today but have also been recognised by the High Court of Australia through the Mabo decision; have been enshrined in Australia's native title laws; and should be recognised in the Australian Constitution. This is why our Prime Minister was wrong when he stated that our land was not settled prior to English investment.


I pay tribute to the Aboriginal people of our community whose ancestors have called our area their home for thousands of years, whose language has given us our cherished suburb names and whose heritage and customs we respect. You deserve more from our nation's Prime Minister.

",HoR,<title>ADJOURNMENT</title>,<title>Indigenous Affairs</title>,ADJOURNMENT,16,1
"Ellis, Kate, MP",ALP,2014-07-16,"



Ms KATE ELLIS
 (Adelaide) (09:30):  I rise today to share with the parliament the experience of a recent visit that I undertook to Roma Mitchell Secondary College, a school in the inner northern part of Adelaide which is doing a remarkable job educating many of the students from my electorate. Earlier this year, I had the chance to visit with Bill Shorten as well as with the member for Makin, Tony Zappia, and see what incredible results this school was returning in just its fourth year since it opened. We know that this school has incredibly excellent facilities at three campuses—a co-ed campus, a girl's campus and a campus for students with disabilities. But we also know that since it opened in 2011, the team of dedicated leaders at the school, the passionate teachers at the school and the broader school community have been able to bring about some hugely impressive improvements. For example, in 2013, the SACE completion at the co-ed and the girls' campuses of Roma Mitchell Secondary College was 91.48 per cent. To put this into context, this is an improvement of 34.3 per cent over just three years, something which I would imagine would be unrivalled by schools around Australia.


In 2013, 12 of the students received an ATAR score in the 90s, and over 80 students received offers to university and TAFE. They offer specialist sport programs in cycling, in hockey and in soccer, an Aboriginal sports training academy, a gifted and talented program, international programs, vocational education and training programs and a range of other specialist services.


Last year a team made up of three year 8 and four year 9 students from the gifted and talented classes won the Tournament of the Minds engineering challenge that was held at Flinders University. They were the first public school students to win this challenge since 1994, something they should be absolutely congratulated for. We also know that this year they started to deliver the International Baccalaureate middle-years program to the year 8s. Within the next three years, all students in years 8 to 10 will be studying this program. This is a result of incredibly dedicated teachers and the school community.


I would like to thank principal, Sandy Richardson, and deputy principal, Karen Fitzpatrick, for hosting Bill Shorten, myself and Tony Zappia. I note the added challenges I gave them by having a freshly broken leg at the time and hobbling around on crutches and I thank them for their kindness. But even more so, I thank them for the incredible job that they are doing educating the students of our Adelaide community. These results speak of their dedication and their passion. They should be congratulated, and I wish them all the very best for continued success into the future.

",HoR,<title>CONSTITUENCY STATEMENTS</title>,<title>Adelaide Electorate: Roma Mitchell Secondary College</title>,CONSTITUENCY STATEMENTS,18,1
"Snowdon, Warren, MP",ALP,2014-07-16,"



Mr SNOWDON
 (Lingiari) (10:00):  It is with great sadness that I stand in this parliament today to express my, and I know the parliament's, condolences to the family, friends and comrades of Lance Corporal Todd Chidgey. Lance Corporal Todd Chidgey's service to the Australian Army included six tours to Afghanistan from 2008 through to this year. These were Operation Slipper, Afghanistan, May to July 2014; Operation Slipper, Afghanistan, March 2014; Operation Slipper, Afghanistan, October to November 2013; Operation Slipper, July to December 2012; Operation Slipper, February to July 2010; and Operation Slipper, June to November 2008.


I have spoken in this place many times now, sadly, about the death of Australian soldiers while on service overseas, and I do not think we should underestimate the work which this man has done. He was from the 2nd Commando Regiment, a special forces unit which does great and special work for us. Unfortunately, the broader Australian community have no real idea—and dare I say most members of this parliament have no real idea either. I am fortunate to have had an insight into the work of the commandos and other special forces units, as well as all of our men and women in uniform overseas, during the period in which I was a minister in the defence portfolio in the previous government. I have the utmost respect for these men and women who wear this uniform on our behalf, and particularly these men and women of the special forces who do such difficult, dangerous and often tragic work.


Can I express my condolences—and I know my family's and I am sure the parliament's—to Todd's family: his mum, Kerrie Baker; his dad, Wayne Chidgey; his partner, Karla Hosie; his brothers, Paul and Adam; and his niece, Kayla. Of course, I also express my deep condolences to his comrades in the 2nd Commando Regiment. That regiment, sadly, has had many losses during this war in the Middle East Area of Operations—in this case in Afghanistan—over what is now some years.


We know that Lance Corporal Todd Chidgey is now peaceful and at rest. He was farewelled by his mates during a private memorial service held at Kabul International Airport, and he is now being laid to rest at home on the Central Coast. The Prime Minister and the Leader of the Opposition, Bill Shorten, attended the funeral representing us and the people of Australia.


Everyone who knew Todd talks about his loyalty. His family have written a wonderful statement about their love for this brave young man. He was a loyal son; he was a loyal brother; he was an absolutely loyal teammate, a professional soldier from 2 Commando Regiment.


I know, having observed the reaction of 2nd Commando and other units across the Defence Force when one of their members is lost, they will continue to swing behind and give support to Lance Corporal Chidgey's family. He was a man who was very highly respected by his colleagues. They described him as:


… a brilliant bloke to know and work with, who was loyal to the core and would do anything for his mates. He was a consummate professional and a dedicated soldier. Lance Corporal Chidgey was one of the hardest working members of the Regiment, who never sought recognition or reward.


It may be true he never sought recognition or reward but it is worth stating what he was awarded because it says a lot about what he dedicated himself to and the service he gave.


Lance Corporal Chidgey was awarded: Australian Active Service Medal with Clasp International Coalition Against Terrorism; Afghanistan Campaign Medal; Australian Service Medal with Clasp Counter Terrorism/Special Recovery; Australian Defence Medal; NATO non-article 5 Medal with Clasp ISAF; Multiple Tour Indicator 3 North Atlantic Treaty Organisation, International Security Assistance Force; Soldiers Medallion; Infantry Combat Badge; and the Returned from Active Service Badge.


I think it is worth reflecting that as we approach the centenary of Anzac, we are now paying homage, giving our respect to and saying goodbye to another man who will join the great pantheon of those who have been lost to us while serving overseas proudly wearing an Australian uniform in the cause of peace and justice and in the knowledge that they are fighting to safeguard our national security. Todd, you have now returned to us from active service. We thank you for your service. Rest in peace.

",HoR,<title>CONDOLENCES</title>,"<title>Chidgey, Lance Corporal Todd</title>",CONDOLENCES,19,1
