name,party,date,text,chamber,debate_title,subdebate_title,debate_type,debate_id,subdebate_id,type
"Morrison, Scott, MP",LP,2014-03-06,"



Mr MORRISON
 (Cook—Minister for Immigration and Border Protection) (09:59):  I rise particularly today as the member for Cook, which represents the Sutherland shire—as does the member for Hughes in part. There are two things about my community that I think are very relevant to this debate. The first one is that in the shire we are a very self-reliant community. People work hard, they have started businesses, they have established family businesses that continue to this day employing hundreds if not thousands of people, and they have always understood that the hard work and the investment that they put in is where their reward comes from and where their future comes from. They have always understood that business can be tough, that markets can be tough, and the way they have always responded to this has not been to seek a handout but to put the work in and to apply themselves to the challenges before them, and this has created an incredibly strong community. This great strength that exists within our community, from an economic and small-business perspective in particular, translates into a strong social community as well—one of self-reliance, but also one of generosity to those around them. The other thing about my community is that it is arguable that it has the largest number of Qantas employees of any other electorate represented in this place. It is that resilience and self-reliance that I know my community will draw upon as they go through what I know is a very difficult time—and this is a difficult time for my community and for the many, many people in my electorate who are affected by what is happening with Qantas.


This has been happening for some time; this is not a new issue. There will be many newcomers to this debate today, I suspect, but in my community this has been a long-term debate. They have, for some period of time, watched as the commercial and international conditions that sit around how Qantas performs and is able to perform have changed. They have seen that change for them. They have seen the change in the market share, which the Treasurer spoke about in this place yesterday. They have seen these changes, and that has been an issue of concern for them for some time.


It is important that we understand and acknowledge in this debate, as I am sure those in my community would like to, that Qantas has played, and, indeed, continues to play, a central role in Australia's national life and in our economic life as well. It has served, and continues to serve, our country; all of its employees have served our country extremely well. In good times and bad, Qantas has always been a great Australian airline. And since 1992 it has been a great Australian company. Its traditions and its success are things I think all Australians should feel very proud of. It has set standards. It is innovative. It has been able to connect Australia with the world, and connect Australians with each other across this vast continent. It is an extraordinary story, an extraordinary Australian story, and I want that story to continue. I do not want it to come to the shuddering halt that would be the product of the way that those opposite would seek to see its future. I want to see a future for Qantas—for the people who work for Qantas, for the people who have always supported Qantas and for the future of our aviation industry—and a role for those many Australians who would like to play a part in that future in the years ahead.


I am a passionate advocate of Qantas, but I am a realist as well. I know that a government that is serious cannot govern by nostalgia and sentiment. It cannot govern by emotion. It must govern by the hard realities of the challenges that we face. Qantas is facing a difficult and challenging international aviation market. There is no doubt about that, and the shadow minister is right to point out that it has principally been government owned and supported carriers that have been the dominant force within the international aviation market for a long time. It is not a new phenomenon. Those who remember what happened with Ansett and other things many years ago will remember that as well. The commercial issues that go around these challenging issues in the aviation industry understand that. It is not new. And so the question for us today is: how do we make Qantas stronger? How do we equip it to be able to combat the challenges that it faces in the future and to succeed—as it always has succeeded?


I and my colleagues on this side of the House have faith in Qantas's ability, and particularly the ability of the people in Qantas, the people who have always worked within Qantas. I have faith that in whatever aspect of their operations, they have the passion for and commitment to this business to make it succeed in the future. And to allow them to do that, we have to remove the constraints that are placed upon it. We cannot just pretend that the environment they are facing is some sort of myth. It is not; it is real. What Qantas needs is the ability to be able to work with equity partners that can play the role in the future that it needs them to play. We cannot keep those potential partners locked behind closed doors, as the Qantas Sale Act 1992 does. It prevents them from being able to engage in Qantas's future and to provide the support for that future. And by continuing to lock them out, we deny the opportunities that the Qantas employees will need to be part of a very successful Qantas in the future.


Qantas has the job of running this airline, not the government. That was decided by this place in 1992. Those opposite seem to be wanting to govern retrospectively now. They want to take us back to 1992. In fact, they want to take us back to before 1992. They want to say that the equity partner—default equity partner even—in Qantas should be the taxpayer. But we decided that back in 1992. So unless those opposite are suggesting that we should buy back Qantas—as they did, in large part, in New Zealand—and for the government to now be the controlling interest in Qantas, as the member for Gorton seems to think that somehow we still are, then they should put that view. And I think that is exactly what the shadow minister was doing today. He is suggesting, and those opposite are suggesting, that the equity partner that Qantas needs is the Australian taxpayer. Not only do we not agree with that position, but this parliament also did not agree with that position in 1992 when it decided—when Labor in government decided—to sell Qantas. And when you make that decision and you go forward and you decide that Qantas is going to be on a private path and not a government-run airline like so many others are, then you have to commit to a success as a private business into the future, and you have to give it the options and the opportunities that it needs to be successful in that environment. That means passing the measures in the Qantas Sale Amendment Bill, which is before parliament today, to enable Qantas to attract the equity partners it will need in its long-term future. We have decided that will not be the government. Those opposite voted for that back in 1992—unless they are now saying that they are going to recant. Having made that decision, we now need to lift those restrictions to enable Qantas to have a future, which will mean Australian jobs within Qantas in the future. 


The other thing you have to do is to remove other restrictions that impede its ability to be profitable. The carbon tax bill for Qantas was $106 million—$106 million! The opposition sneezes that this is some trivial consequence for Qantas. Are they suggesting we should invest $106 million in Qantas? That is what the opposition seems to be suggesting. The opposition could do that effectively by getting rid of the carbon tax. There is $106 million support for Qantas today—year-on-year—$106 million and more because the amount will become greater under the previous government's carbon tax. There is some direct support, if you like, but delivered in a way that this government delivers support—by freeing up businesses in this country so that they are able to properly run their businesses. It is no different for Qantas than it is for the many thousands of Australian small businesses—I acknowledge the Minister for Small Business, Mr Billson, is here at the table—and the many small businesses in my community of the shire because they are doing the same thing. They do not come knocking on my door asking for a debt guarantee. They come to ask me to get regulation out of their way, which helps them to employ people and allows them to succeed. That is the spirit in small businesses in my electorate, as I know it is in small businesses around the country.


 We have to let Qantas and its management take responsibility for future decisions, give them the things they need, the options they need to be able to put forward their plans for the company. The Qantas board runs the company. Boards, like governments, will be responsible, and managements will be responsible for the decisions they take and the impact they have on their shareholders and on their employees. That is the way we run the economy in this country and that is the way we should run the economy in this country. If those opposite are somehow suggesting something different, they should be very clear about that. 


Qantas is a tremendous, wonderful, national airline. The good news is we have other national airlines today and Virgin is one of those. Protections already exist within the various legislation which governs aviation arrangements, which continue to apply equally not only to Qantas but also to any other national carriers that will be acting consistently with our international aviation agreements. The Navigation Act applies to other airlines including Virgin and Qantas' subsidiary Jetstar. Qantas international would stay majority Australian owned. As for their domestic operations, they are subject to review by the Foreign Investment Review Board—no changes there. Our international air service agreements impose ownership and control restrictions to ensure only Australian international airlines can access our traffic rights and under those restrictions, Australian international airlines must be substantially owned and effectively controlled by Australian nationals. At least two-thirds of the board members must be Australian citizens. The chairperson of the board must be an Australian citizen. The airline's head office must be in Australia. The airline's operation base must be in Australia. The government has no plans to change these criteria, which will continue to apply in Qantas' international operations—not to mention the Fair Work Act, the Corporations Act, immigration laws, for which I am responsible, and other regulations which affect every other Australian business. There are safeguards and there are protections regarding those operations. 


Those opposite seem to be arguing that a foreign equity provider and shareholder in Qantas domestic is somehow going to run Australian domestic operations in another country. Apparently they are going to run a domestic aviation service in Australia by flying around some other country, which is absurd. As the minister for transport has argued very well in this place in recent days, Virgin is employing Australians in Australia. Australians are on those planes every day, moving millions of people around every single week. That is the future I want for Qantas as well because that has been Qantas' past, it is its present and it will be its future—so long as this place and the other place decide to put a vote of confidence in Australian business and in Australian employees. Qantas is a great airline. As a former managing director of Tourism Australia, I know from first-hand experience that Qantas has given unparalleled support to the Australian tourism industry. Sadly, under the previous government that went array and it will be for those who were responsible to explain that one day. Qantas always stumped up when it was in my field of operations. That will continue. 


It will be a good future for Qantas. It will not be the same as its past. That is true for all businesses, as the Minister for Small Business would know. We cannot somehow wish away the circumstances that all businesses face today and pretend somehow we can be nostalgic and sentimental about these difficult decisions. For Qantas to go forward, this government and this parliament must get out of its way and free it up to find the partners in the future that it so richly deserves, its employees so richly deserve and await it. The only thing standing in between that is the Leader of the Opposition and his cohorts in the Senate. For my electors, I hope, the Leader of the Opposition will have a change of heart and will decide to support Qantas by supporting this bill.

",HoR,<title>BILLS</title>,<title>Second Reading</title>,BILLS,2,2,speech
"Jones, Stephen, MP",ALP,2014-03-06,"



Mr STEPHEN JONES
 (Throsby) (10:14):  We have seen an extraordinary passage of events in the parliament this morning, where the government clearly do not have the confidence of their own convictions. What we have seen this morning is the minister responsible for this piece of legislation come into the House, read the bill and then have the opportunity to have that bill debated in full—the opposition granted the government the opportunity to have that bill debated in full. The government then tried to move a gag motion on a debate on their own bill. They tried to gag debate on their own piece of legislation. What this shows is that they do not have confidence in their legislation. They do not have confidence in their ability to manage this debate. It shows that the government are struggling to convert their seductive three-word slogans into serious policy, legislation and a legislative agenda to bring before the House.


It is actually a reflection of the haphazard decision-making process that has typified this whole matter. We have seen question time after question time being concentrated on the future of Qantas. There has not been a question time this year where the future of Qantas has not been debated. You would think, given all of that, they would be prepared to come into the House and defend the legislation which we argue is not in the national interest. That has not been the case.


The government has had many positions on this, as we have seen from the comments by the minister himself. He has obviously had a range of different positions on this matter over the last five years. In 2009, the then shadow minister had a position which was once in the interests of regional Australia, once in the interests of jobs and once in interests of the future of Qantas. At that point in time he had this to say:


The Government’s decision to allow a single foreign investor to own 49 percent of Qantas would deliver effective control to a foreign investor, including possibly a competitor airline. Lost of effective Australian control could leave Australia without an airline primarily committed to our interests. 


What safeguards will be put in place for the Australian flying public, particularly those in regional areas?


That is a very good question: what safeguards will be put in place for the Australian flying public, particularly those in regional areas? We see nothing in the Qantas Sale Amendment Bill 2014 which would protect the interests of those who are in regional Australia and relying on the services of Qantas—the interests that the minister once protected, once stood for but is now selling out as he stands here and moves this legislation before the House today.


Of course, he is not alone. In 2009 the Treasurer, who has shown a great interest in this particular debate, had this to say when he was asked about the 25-35 rule for Qantas:


… this is something I have previously been on the record about.  Very concerned about any dilution of Australian control of Qantas  …  We have been very concerned for a number of reasons … Our experience has been that when companies have majority foreign ownership or majority foreign control … then it actually has an impact on the social responsibilities of those companies here in Australia.


That is what the Treasurer said in 2009. It is what he thought in 2009 and we would argue that he was spot-on. We would argue that both the Treasurer and the minister were spot-on in 2009 when they made those observations about the future of Qantas.


This has been a chaotic debate, and the way that this has been handled over the last month is nothing short of a disgrace. We have seen a cabinet minister backgrounding the media on what they intended to do. We have seen the Treasurer himself sending smoke signals about the possibility of a debt guarantee. Then we saw the Prime Minister himself on one day send signals about what they were intending to do, on the next day saying almost the exact opposite. So you can imagine what people in boardrooms around the country are thinking as they focus on this debate. They are very concerned, and they are right to be concerned, about the government's lack of consistency when it comes to handling issues like this.


In question time a few days ago we heard the Prime Minister pose the question: why should we do for one company what we are not prepared to do for another? What should we do for one company that we are not prepared to do for another? He said that in relation to government support for Qantas. You can only imagine the discussion that has gone on around the Qantas boardroom in the last 24 hours, trying to synchronise these two comments. You can only imagine the discussion that is going on around the Qantas boardroom. They would be saying to themselves: 'If only Qantas were a company that transported wheat and not people, then we would have a chance of government support. If only we were a company that transported wheat and not people, then we might have the support of the National Party on this issue.' We know that they went to the wall over the sale of GrainCorp. They went to the wall and they were the ones in the cabinet room and backgrounding the media saying it would be a national travesty if we allowed a foreign company to come in and take over GrainCorp because it would not be in the national interest.


In the boardrooms of Qantas today and around the executive hallways of Qantas they must be saying: 'If only we were a real transport company, transporting wheat and not people. Then we would have a chance of some government support.' You can imagine them saying: 'If only we were a real tourist business, then we would have a chance of government support. If only we were in the business of making chocolate instead of transporting people around the country and around the world to their holiday destinations, then we would have a chance of government support.' We know the government is willing to support a business that is in the tourism industry. 'Unfortunately, as a national airline, we're not in the tourism industry. We only transport people around the world and around the country to go on holidays. We're not making Freddo frogs or chocolate bars and therefore we're not going to get the sort of government support that Cadbury has been able to enjoy.'


You can imagine the conversations that are going on around their boardrooms today: government inconsistency; saying one thing before an election, doing another; setting out clear principles and then contradicting them; sending up smoke signals that we are willing to support Qantas, willing to give them a debt guarantee, only to have an unholy barney in the cabinet room with one cabinet minister backgrounding against another minister to undermine a position that would have been in Qantas's interest. We have seen an absolute shambles and absolute chaos. That is the background to the bill that has come before the House today.


We have heard the Prime Minister, the Treasurer and the transport minister stand in this place today and ask: why should the government come in and support Qantas when they are in direct competition with Virgin? Why should we do this? Why should we do one thing for Qantas? Why should the government come in and support Qantas and at the same time not be supporting Virgin? 


I have the highest regard for Virgin and the CEO of Virgin. I think he has done a fantastic job bringing that company, that airline, from nowhere to having a significant presence in this country. As a member of this place who, from time to time, has to travel for work, I make sure that I spend some of that time on a Virgin aircraft. I think they are a fine airline. I think they are doing a fine job. But the argument does not stack up, because if you look at the corporate ownership, if you look at the structure of the airline, you will see that Virgin, like the majority of airlines around the world, enjoys the backing of one, if not more, government. In Virgin's case, it enjoys the backing of three governments. So the difference between Virgin and Qantas is that Virgin enjoys the support of three governments and Qantas does not enjoy the support of any, so the argument of a level-playing field simply does not add up. It is just another of the inconsistencies that the government has stacked up in this debate.


The people are not buying it, because they know the consequences of this legislation which is before the House today. Because it is not just about the ownership, as important as that is; the Qantas Sale Act also has important protections about jobs. It has protections in it about where the headquarters will be. It has protections in it about the provision of certain functions within this country—maintenance functions, catering functions, reservations functions—to ensure that this iconic Australian business employs Australians, and it does that. The people of Australia are not going to be conned. They are seeing over 5,000 jobs going from this company. Just yesterday, they saw over 1,500 workers at Mascot headquarters being told that they are going to lose their jobs.


As the Prime Minister stands here and says, 'We're going to do nothing to help this airline and this industry,' those people will be going back to their homes and their electorates, saying: 'I am losing my job. It was a good job. It was a well-paid job in a great company. I am losing my job, and the government is doing absolutely nothing to assist me or my family.' This is important: over 35,000 Australians earn a living working for Qantas—good jobs, highly skilled jobs, the jobs of the future and jobs that we should be supporting. We should be doing everything we can as a government and, on this side of the House, as an opposition to ensure that we support those workers, that company and that industry. 


It is an important industry. I made light earlier in my contribution: if only Qantas were producing chocolate and not providing airline services then maybe they would get tourism support. But tourism is a critical industry in this country. It employs over half a million Australians. It is a $1 billion sector and it has been identified as one of the five supergrowth sectors that are going to backfill the economic hole in terms of employment and GDP as the mining boom comes off. So it is important to our future. It deserves our support and our attention, and those of us on this side of the House who are committed to ensuring that we have a vibrant company, a vibrant industry, are willing to work constructively with the government to ensure that Qantas remains a vibrant, Australian owned company, employing Australians and providing services throughout regional Australia and to the rest of the world. It is absolutely critical. 


We understand that the airline industry not only in Australia but around the world is going through a tremendous shake-up. There are not many airline businesses in the world that are actually making money at the moment—very few in fact; you could count on one hand the number of airline companies in the world that are actually making money at the moment—so in this respect Qantas and Virgin are with the pack, not outside it. 


But the people of Australia understand this. If this bill goes through the House with the government support then there will be one consequence and it will be on the heads of those opposite. There will be jobs lost. There will be jobs sent overseas. It will be inevitable that Qantas in two, three or four years time will be a company which is either owned directly or indirectly by a government of another country or the sovereign wealth fund of another country, and that will be a complete shame. We on this side of the House do not believe you can save jobs by sending them offshore. This legislation should be rejected.

",HoR,<title>BILLS</title>,<title>Second Reading</title>,BILLS,2,2,speech
