name,party,date,text,chamber,debate_title,subdebate_title,debate_type,debate_id,subdebate_id,type
"Bishop, Bronwyn, MP",LP,2014-10-23,"



The SPEAKER
 (15:12):  I have received a letter from the honourable member for Adelaide proposing that a definite matter of public importance be submitted to the House for discussion, namely: 


The government making life harder for Australian families by cutting funding to family day care.


I call upon those members who approve of the proposed discussion to rise in their places.




More than the number of members required by the standing orders having risen in their places—


",HoR,<title>MATTERS OF PUBLIC IMPORTANCE</title>,<title>Family Day Care</title>,MATTERS OF PUBLIC IMPORTANCE,9,1,speech
"Ellis, Kate, MP",ALP,2014-10-23,"



Ms KATE ELLIS
 (Adelaide) (15:12):  On this side of the House, we know that not just for years but for decades family day care has been a vital part of the support networks which Australian families rely upon in order to balance work and family. We know that there are literally hundreds of thousands of Australian families and Australian children who have received quality early childhood education and care over the decades from family day care. We stand in this matter of public importance to say that Labor will stand up against the Abbott government taking an axe to that sector by slashing their funding and the devastating consequences that that will have for the sector, for the children and for the educators who work each and every day.


Every day we come into this place we cite another example of a broken promise from this government, another example of this government saying very specifically to the Australian public before the election about what they would do if they were elected and then coming into this House after the election and doing the exact opposite. Sadly, today is no different. Just before the election Tony Abbott wrote to every single childcare centre in the nation and stated:


I am determined to help make child care more accessible and affordable for parents.


He also promised flexibility. The first two sentences of their childcare policy explains:


The Coalition believes Australian families deserve greater choice when it comes to child care. 


Our child care system should be responsive to the needs of today's families and today's economy, not the five-day, 9am to 5pm working week of the last century.


Well, haven't we seen something completely different since those opposite were elected. Since those opposite were elected, we have seen over a billion dollars in cuts to our childcare sector, impacting on the affordability for each and every family relying on assistance from government.


Sadly, when it comes to the family day care sector, we have seen that the Prime Minister's budget delivered to $157 million in cuts to family day care services. There is a long list of childcare services which have already been cut back or abolished completely by this government. They have already ripped $450 million out of outside school hours care. They have already cut support to help parents complete study to get back to work. They have already completely cut the program that was in place to increase childcare places in areas where parents face lengthy waiting lists. We know they have cut all of the funding from Indigenous child and family centres. We know they have reduced the funding for the child care rebate by $105 million, that they still have plans to cut $230 million out of the means tested child care benefit and, of course, now we focus on the $157 million being stripped out a family day care services.


Let us in this place make absolutely no mistake just to match that is going to hurt sector and, importantly, hurt the parents who rely upon the services each and every day. Based on information which has been provided by the government, we now learn that the cut will mean that over 80 per cent of the family day care services are likely to have their funding cut next year because of this one cruel attack. According to the most recent figures, there are 761 family day care services around the country. This means that over 600 of them will have their funding cut from next year. We know that in Western Sydney 100 per cent of family day care services will have their funding cut next year. We also know that instead the government seems determined to make family day care more expensive, less accessible and even harder for families to choose this as their flexible form of care.


Family Day Care Australia has outlined exactly what this will mean the sector and for parents when they said that these cuts will mean that family day care fees will be estimated to increase by $35 a week just to cover this one budget cut. In fact, CEO Carla Northam said:


Costs will ultimately have to be passed on to families, most of whom are already struggling to afford childcare fees. Without this funding it will be impossible for many family day care services to remain viable. 


So those opposite who, before the election, promised, directly from the Prime Minister, every childcare centre in the country they would make child care more affordable, have left just two doors open for these family day care services. They can hike their fees and slug parents $35 more per week or they can close their doors. We on this side of the House so that neither of those options are acceptable, that this government needs to get on with delivering what they said they would do not just be railroaded by the Treasury, having each and every one of their programs cut, equalling over $1 billion already.


Members and senators on both sides right around Australia would have received hundreds of letters and cards from parents urging them to stand up against these cuts, to review the proposed changes to this funding program. In most cases, we know that family day care services will be forced to increase their fees, but we also know that some are reconsidering the viability of their service. Cape York family day care at Weipa wrote to inform the government that its service was unsustainable without this funding. They stated in their media release:


Due to this impossible funding reduction the Weipa Community Care Association Management Committee—


who auspice the family day care scheme—


has determined to close the service as of 31st December.


Those opposite promised the world to parents and to the childcare sector but they are overseeing the shutting down of services. Last week I visited Aussom Family Day Care at Newington and talked with one of the educators, Helen, who told me she was really worried that her families will not be able to afford the inevitable fee hikes. Fairfield City Council says that families living in Fairfield include some of the most disadvantaged within the metropolitan area and:


Should these changes take effect in their current form and time frame, council will be required to make the difficult decision that may include significant fee increases to families, reduce support to the family day care educators and possibly even the closure of the services.


I hope those opposite feel proud about that. I hope those opposite feel proud that they promised one thing and they are doing exactly the opposite—they are cutting the vital services that all of these families rely upon. We know that family day care is a unique model of care, which allows the greater flexibility than many other sorts. Family day care does not need to be stuck in the hours nine to five. It has a flexibility that can help and match parents' working hours. In fact, when those opposite claim that they want to see increased flexibility—and we know that they are obsessed by nannies and au pairs—family day care has the capacity to deliver this increased flexibility but not if it is gutted first by the Abbott government and by the assistant minister who is consistently rolled to the point that she has now lost a billion dollars out of existing childcare programs. Isn't that something to be proud of?


We know that there is a pattern of attack from the Abbott government. Low- and middle-income families are doing the heavy lifting for this government in their unfair and heartless budget. We know that those opposite asked the Productivity Commission to completely redesign Australia's childcare system, promising all things to all people but only guaranteeing that there would be no additional money. The government simply cannot meet all of these expectations, but we know that the Productivity Commission has provided a draft report and just this week released analysis which shows that families earning as little as $40,000 you would you will solve under the PCs preferred model. This government which promised that child care would become more affordable have already cut a billion dollars, have already seen a system where $157 million being ripped out of family day car will see many services having to hike their fees by $35 a week and now they have set up a review which will is recommending changes which will see families on as little as $40,000 have their assistance cut. 


It is time to end their magic pudding statements and promises and for this government to level with the Australian public. It is time for those opposite to guarantee that they will not accept any proposals that will make child care less affordable for Australian families. They have said one thing and we will now hear from those opposite that they are actually unable to do anything other than point the finger at the Labor Party—blame it on me; blame it on Labor—but a billion dollars has been cut from the program under their watch and $157 million has been cut from family day care in their budget on their watch that they must justify.

",HoR,<title>MATTERS OF PUBLIC IMPORTANCE</title>,<title>Family Day Care</title>,MATTERS OF PUBLIC IMPORTANCE,9,1,speech
"Ley, Sussan, MP",LP,2014-10-23,"



Ms LEY
 (Farrer—Assistant Minister for Education) (15:22):  I cannot stand here as minister and be lectured by the previous childcare minister who saw under her watch childcare costs go up 53 per cent in six years and out-of-pocket costs for families go up 40 per cent in four years. This is the test by which the Labor government when in government will be judged.



Ms Kate Ellis interjecting—




Ms LEY:
  Member for Adelaide, I sat and listened to you and I think it is appropriate for you to either listen to me or you leave—I do not mind which.


Families measure these things by affordability: how much do I pay for my out-of-pocket costs after childcare benefit and rebate to my childcare centre? In four years under Labor, under the member for Adelaide as the minister, those costs went up 40 per cent.




Ms Kate Ellis:
  How much do you pay now?



The DEPUTY SPEAKER:  Member for Adelaide, you have had your opportunity.




Ms LEY:
  I want to make some remarks about the Community Support Program, which is the program under which the support for family day care has been delivered in the past and will continue to be delivered in the future. The purpose of this program is to help services in unviable areas, such as disadvantaged, regional and remote communities. But, unfortunately, this program has become yet another example of Labor's legacy of debt and financial mismanagement. 


The overspend in its budget allocation was $200 million over three years. Here we have a program, which is meant to help every single type of child care—family day care, out-of-school hours, long day care—that has blown its budget by over $200 million. Seventy per cent of that entire budget is going to one single type of child care. The point is this: the Auditor-General highlighted this to the member for Adelaide, as the minister, in 2012 and made specific recommendations contained within a performance audit. They said, 'Seventy-one per cent of community support funding is going to family day care, which accounts for just 10 per cent of children in care'—and Labor does nothing to fix the problem.


The changes we are making to the eligibility criteria bring this type of child care into line with other types of child care. A budget is blown by over $200 million, an Auditor-General warns the member for Adelaide as minister and, of course, she sits on her hands while out-of-pocket costs go up for families by 40 per cent. 


The member for Adelaide also mentioned in scoop-up of apparent cuts that we have made something that she made as minister—or her government made—which was the change to the childcare rebate. Remember the childcare rebate indexation pause—something announced by the Labor government but they did not have the guts to legislate it. They did not have the guts to carry it through, and they left it to us to pick up when we came into government—to fix up their mess. This is no different to all of the other Labor messes that we have inherited. The legacy of Labor is this messy concoction of red tape, band-aid solutions and, ultimately, the final test—it costs parents more. It is another example of Labor continuing to put politics before parents. 


While we are talking about promises and legacies, let's consider the hallmark policy of the member for Adelaide, who brings forth this motion—the Early Years Quality Fund; the dodgy slush fund designed to drive union membership in the sector; a short-term pay rise for just 15 per cent of the entire workforce, designed to shore up this member and the Labor Party in an absolutely shocking, dirty deal never before seen by anyone on either side of this House. That is the hallmark policy of this member for Adelaide as minister—completely irresponsible at the moment, as she was completely irresponsible in government.


The member for Adelaide raised concerns about the family day care sector, and I want to address those in all seriousness. I want to make clear that as minister, I support the family day care sector. I have used it as a mum, albeit many years ago. I visit family day care providers, educators and coordination units all around the country every day, every week. 


I am in touch with the educators. I am in touch with their services, and many come to my office to talk about the challenges that are before them. I do not downplay that in some cases there will be challenges; but let's remember an important feature: what we are doing is bringing this program back into line with its original intention. Seventy per cent of the funding of which the member Adelaide speaks, funding designated for disadvantaged rural and regional communities, ended up in our major cities, in major urbanised competitive markets. A funding stream designed to support market failure, if you like or rural, and regional and remote—an area I am very familiar with, as we all are on this side of the House—ended up landing and being paid to services in our major cities. Remember: the budget was well blown before this. 


What we are doing is bringing this back under control and, from 1 July next year, services will be able to apply for this funding. If they are experiencing those exceptional circumstances and if they are disadvantaged, there is every chance that they will receive it. 


The other important point I want to make—and I want to reassure families who might be listening to this broadcast who might be caught up in the scaremongering nonsense from the member Adelaide—is that the Community Support Program is not a fee assistance program. It is not money paid to educators. It is not money paid to parents. It does not alter the amount or the ability of parents using approved services to claim the childcare benefit and rebate. In fact, families using family day care still get the childcare benefit. They still get the childcare rebate—in fact, they get a childcare benefit that is 33 per cent higher than that of parents who use long day care. So they already recognise that there are additional supports for the parents who use these services. 


We have to recognise that, in making changes to the family day care sector, we are supporting the sector to put it on a more sustainable footing for the future.



Ms Kate Ellis interjecting—




Ms LEY:
  The member for Adelaide mentioned Weipa. After the article from which she quoted appeared in the press, it was in fact brought to my attention by the member for Leichhardt, who asked me to travel to Weipa, which I did at relatively short notice. I spoke to the centre involved—I also spoke to one at Cooktown on the way, and I have to say that there was a pretty amazing family day care educator there, as there are everywhere—and I said, 'We need to make changes to a system where the coordination unit has only one or two educators attached to it. We may not be able to continue making the same level of payment to a coordination unit designed to support a greater number of educators, but we do want family day care to continue in Weipa.'


I worked very closely—and I am still working closely—with the member for Leichhardt. In order to help the sector adjust to this change we are rolling out business advice across the country through the family day care peak bodies, because they have recognised that these are important changes that services may need to make to ensure that they are sustainable into the future. That business advice will be made available to the Weipa service and to every other service that puts up its hand and says, 'Look, we might need help.'


There are lots of different ways that you can run this model. Remember: a family day care educator in their home is a home based business, and the coordination unit, which does a great job in supporting them, can have a differing set of arrangements with them as we move forward into a new era for family day care. Let's not forget that family day care was recognised by the Productivity Commission inquiry, and is recognised by us in government, as a vital sector for the future. The member for Adelaide is quite right: the flexible care that families demand is often provided by family day care.


But I come back to my main point. We cannot stand here as the Liberal and National parties, understanding rural and regional communities as we do, and do nothing when this program, designed to support disadvantaged rural and regional communities, has overspent its budget by $200 million. The Labor Party were warned by the Auditor-General—who did a performance audit of this program—that this really was out of line, and they did nothing about it. They were too frightened to take action. They were too frightened to make the tough decisions, and they handballed it to us, just like all of the other decisions that were handballed to us, as we came into government. We are bringing that program back under control. We will continue to support the services for which the program was originally designed.


But remember this: under Labor, childcare costs went up 53 per cent, flexibility went down, affordability went down and availability went down. We inherited a system close to breaking point. This Labor party could not even support our Productivity Commission inquiry. They could not even say, 'Yes, it is a good idea to have a look at future arrangements and make changes for the benefit of families.' This Labor Party is a disgrace.

",HoR,<title>MATTERS OF PUBLIC IMPORTANCE</title>,<title>Family Day Care</title>,MATTERS OF PUBLIC IMPORTANCE,9,1,speech
"Owens, Julie, MP",ALP,2014-10-23,"



Ms OWENS
 (Parramatta) (15:32):  I would like to take up a few points that the Assistant Minister for Education just made, and I have to say that they are quite extraordinary. She said that she supports family day care. Well, not in my electorate and not in Western Sydney, where every single family day care service has been told that its funding will be cut—every single one. We know that many of those will be forced to close as a result of it. If that happens to even one family day care service, 1,700 families will be without a place. So how can the minister say that she supports family day care when in all of Western Sydney she is cutting it completely?


She says that, if there are people with genuine disadvantage, there will be family day care services for them. I suggest that the minister get out more. How can she possibly think that there are not casual cleaners in Western Sydney who need the flexibility of low-cost, affordable, quality family day care that starts at five in the morning? I know that a number of family day care providers in my electorate do just that. I fact, some of them even pick the children up at five in the morning because the parents work shiftwork. To assume that that does not happen in Western Sydney and to actually cut the funding from family day care and leave those families in the lurch and then you say you care is quite extraordinary.


A new era in family day care, which the assistant minister spruiks, is actually a loss of family day care. I want to talk about what it is actually worth in my community, because it is not just about affordability and flexibility in time in the area of Parramatta. In the community of Parramatta we also have family day care services that specialise in one language or another. For example, we have a group of Korean family day care educators who speak to their charges in Korean, because in those early years of their life their parents have made the choice as parents to have their children initially speak the language of their great-grandparents. Korean families do that quite frequently. We have women from the African community who have had themselves educated into this field and now operate family day care services in various African languages. We now have a group of 20 Hazara women who have put themselves through training so that they can work in this field and educate young children under the age of four in the language of those children's great-grandparents. 


This is an extraordinary thing. We have families in Parramatta who choose to have their children educated through this system because it allows the flexibility. These are not well-off parents. They are quite often working as casual cleaners, as nurses, as aged-care workers and are shiftworkers, who need the flexibility and have found a way to make a choice as parents to ensure that the culture of their children survives through the next generation and the next generation after that. That is a great gift to this nation. As the world becomes smaller, this is a major part of what they do.


We have families in my community who have dietary requirements. I have Hindus who are very strict—do not eat chili, garlic or onion. I have people who are vegetarians and I have people who eat halal. You name it, I have it. We have family day care providers in Parramatta who actually provide the flexibility to match the services they offer with the working hours of the parents and the cultural requirements of the child and the cultural decisions of their parents. I cannot imagine, as we look at Australia moving into the future, that this is the program that you would cut. Of all the things we do that prepare our children for the future world and what the world will look like, I cannot believe that this is the program that you cut.


I cannot believe that you can do this to people who are increasingly casualised, who do not have the certainty of working hours that we used to have, who cannot guarantee that they can get their child and keep their child in a standard nine-to-five five-day-a-week place. This service provides them with certainty. As their working hours shift from day to day, this provides them with the certainty of good quality care for their children. It provides parents with the flexibility they need when it comes to cultural diversity, including dietary requirements. Children who have hearing impairments or visual impairments can actually have family day care service providers who talk to them in Auslan or teach them braille.


This is the service that you want in modern Australia, and this is the service that we want as we prepare our children for the future. This is not the one that you would cut. It actually deserves the support of the minister and it deserves a new era. In Western Sydney it deserves a better one. (Time expired)

",HoR,<title>MATTERS OF PUBLIC IMPORTANCE</title>,<title>Family Day Care</title>,MATTERS OF PUBLIC IMPORTANCE,9,1,speech
