name,party,date,text,chamber,debate_title,subdebate_title,debate_type,debate_id,subdebate_id,type
"Nikolic, Andrew, MP",LP,2014-10-23,"



Mr NIKOLIC
 (Bass) (15:37):  This MPI could easily have included words like 'sanctimony' and 'hypocrisy', given Labor's record on the economy and in policy areas like child care. Consider that we have an MPI that talks about how hard life is for Australian families when we remember that those opposite gave Australian families the carbon tax and, on average, $550 costs on each and every Australian family.


The member for Adelaide had the audacity to talk about magic puddings—but we remember that those opposite, from 2008 to 2013, produced an economy that had $200 billion in achieved deficits, $123 billion of projected deficits across the forward estimates, and peak debt rising to $667 billion. So please do not talk to us about magic puddings, Member for Adelaide, when you have that sort of record to draw on.


The member for Adelaide also had the audacity to talk about promises relating to child care. I know you will be familiar, Mr Deputy Speaker, with the promises made during the 2007 election by Mr Rudd, who became Prime Minister. He talked about grand aspirations. There was GroceryWatch to make your groceries cheaper, there was Fuelwatch to make fuel cheaper, there was child care that was going to make childcare cheaper. Everything was going to be cheaper, better, brighter, more 'Kevin'. But, as we found out, it was a government long on aspiration and very, very short on delivery. Despite promising affordable child care, childcare fees skyrocketed by 53 per cent under the Labor government. There was $73 a week extra in fees, or around $3,500 more each year for a family, using the average hours of child care. What they left behind was grossly inefficient. I have seen it firsthand. I have seen that 1,200-kilometre screwdriver here in Canberra, with the member for Adelaide turning the screws on the childcare operators, who stand there filling in regulatory forms unnecessarily rather than doing their primary jobs. As I have gone around the childcare centres, they have told me a very different story to the one we heard from the member for Adelaide here today. We saw 21,000 new regulations under Labor, many of those impacting the childcare sector.


The member for Adelaide, who brought on this MPI, failed to discuss the elephant in the room. I have an article here from The Australian. It is headed, 'Rudd government scraps promise to build 260 childcare centres'. The member for Adelaide had a wonderful little media release which said that they were going to stop at 38. The lesson that I draw from that is that you take what the member for Adelaide says, you divide it by seven, and you are somewhere close to the truth—when you think about 38 achieved and 260 promised. 


When it comes to promises by the member for Adelaide and her colleagues, what we find is that Labor cut millions in funding for occasional care from July 2010. This was a cut that hit rural and regional areas particularly hard—including in my home state of Tasmania, where occasional care is often needed because of those seasonal work imperatives like harvesting and shearing. Labor pandered to their union mates, as you have heard from the minister, by creating a $300 million Early Years Quality Fund with taxpayers' money, which turned out to be nothing more than a union membership recruiting drive for United Voice. Now Labor continues their irresponsibility in opposition, blocking their own promises to pause indexation on the childcare rebate, despite banking $105 million of savings in their own election promises. They were eventually shamed into supporting their own budget measure; however, as we all know, they continue to block many, many other key savings measures across the government and particularly in the childcare portfolio. So spare us the sanctimonious MPI, Member for Adelaide, and reflect on the appalling mess that you and your colleagues have left.


I will finish by thanking the minister for repeatedly visiting northern Tasmania to consult and discuss these issues with childcare providers. Some family day care schemes have told us that they know Labor's magic pudding money would never have continued and that they are making transitional arrangements. They are listening to the minister's advice about a business development package that the government is developing for family day care services in partnership with the sector's peak bodies, and the minister is out there every day explaining how Labor's mismanagement caused this problem and what we are doing to fix the appalling mess left to us by the former government.

",HoR,<title>MATTERS OF PUBLIC IMPORTANCE</title>,<title>Family Day Care</title>,MATTERS OF PUBLIC IMPORTANCE,9,1,speech
"Giles, Andrew, MP",ALP,2014-10-23,"



Mr GILES
 (Scullin) (15:42):  I say to the member for Bass: thank you for that enlightening contribution. Thank you for that history lesson. One of the most interesting elements of the history lesson was the airbrushing out of Real Solutions. Rightly so. I would be embarrassed by its content and by the shameless way in which this government and its members have walked away from the promises contained within it. Let us never forget all the broken promises of our Prime Minister.



Ms Ryan interjecting—




Mr GILES:
  It's a contract, the member for Lalor reminds me. He promised to raise standards of public trust. Of all his broken promises, that is the most egregious. We are one year into this government and the member for Bass had nothing to say about its work. We heard supercharged rhetoric, as we have come to expect, about sanctimony and hypocrisy. These are terms that he should understand well. He talked about promises in the childcare space. I thought that was interesting—not the promises made by the then Leader of the Opposition, the now Prime Minister. Funny that. 


There is one thing I should touch on before going to the substance of this matter of public importance. The way in which members of this government treat our early childhood educators with contempt never fails to disappoint me. These are hardworking people doing important work. They can have a go at us; they can have a go at our policies, but the manner in which these workers have been treated by many members of this government is just shocking. This is a matter of public importance, and I am pleased to join the member for Parramatta and the member for Adelaide in arguing for family day centres and recognising the role they can play in making life easier for working families and doing great work in terms of the development of the children in those families.


Earlier today, Labor members spoke about the NATSEM modelling. The thing that struck me most about the NATSEM modelling was what it shows about the medium-term impact on low-income families, particularly single-parent families.



Ms Scott interjecting—




Mr GILES:
  It's funny, I understand? I am staggered by the contempt for working people that we get from members opposite. 


On Monday, the member for Charlton moved a motion that called on the government to reverse its cuts to the area of family day care. In that debate, I was again disappointed by the contribution of government members, who just hid behind a couple of furphies—the furphy that, because there apparently have been rorts, we should bring the whole thing to an end and the furphy that this is not a cut. Well, I do not think we need detain ourselves too long on that point.


Child care is vital for over one million Australian families, including my own. I was struck, as members on this side were, by the Grattan Institute's recent research findings that investment in child care is twice as effective in boosting employment participation as paid parental leave, the signature policy of this government. I am sure the legislation will be just around the corner! It is in this context that we see the government's promises and priorities at large, where PPL again is a significant priority, while promises to improve affordability and accessibility of child care have fallen away. Within this broader context, we note the savage cuts that are impacting on family day care—a $157 million broken promise, putting services at risk and asking hardworking families tough questions that they do not have good answers to, in many cases. 


The impact on Scullin will be very significant. There are nine centres operating, all of which are deeply concerned. I have been talking to parents to find out what family day care means to them, how it works for them, and I have been visiting centres. I was deeply affected by visiting Boori Children's Services in Epping, operated by the City of Whittlesea, facing an $85,000 cut. I would like to share with the House what that service being at risk means to the families there as well as to the 26 hardworking professional educators. One of them, Karen, has been there 20 years. She started as a parent herself and has maintained a close connection with all those families in the Epping community, giving them the benefit of the flexibility as well as the close relationship and the high-quality professional care and education that these educators can offer. These are so important to people in outer suburban communities like many in Scullin, including Epping and South Morang. 


Family day care has to be a critical part of meeting our childcare challenge. It has been for 35 years. Doing the best for all working families to have choices in respect of child care is fundamentally important to the wellbeing of those families now and to the future prospects of their children. (Time expired)

",HoR,<title>MATTERS OF PUBLIC IMPORTANCE</title>,<title>Family Day Care</title>,MATTERS OF PUBLIC IMPORTANCE,9,1,speech
"Scott, Fiona, MP",LP,2014-10-23,"



Ms SCOTT
 (Lindsay) (15:47):  Firstly, I would like to acknowledge the Assistant Minister for Education, who is here in the chamber with us today. The Assistant Minister for Education, I would like to advise the member for Parramatta, is actually no stranger to Western Sydney. In fact, the Assistant Minister for Education has been to Western Sydney on many, many occasions both before and after the election. I have taken her to childcare centres. I have actually had two lots of roundtable forums with the minister, before the election and after the election. She has met with childcare service providers right across the region. So the minister has been very helpful in this space. The minister truly understands the childcare concerns of the people in Western Sydney. Once again, Minister, I would really like to thank you for your encouragement and your support. The minister has worked very hard in that space. The minister has got together with the Productivity Commission on child care. 


Do you know what the people of Western Sydney demand? They demand affordable and flexible child care. Under those opposite, we saw of an increase of 53 per cent in the costs for child care. Two-thirds of the workforce of Lindsay have to commute for work every single day, in peak hour traffic there and peak hour traffic back. These are things that concern the people of my electorate of Lindsay. Fifty-three per cent increases in childcare costs do not help working families in Western Sydney—not at all. Those opposite are so sanctimonious about this. They are actually hurting the people of Western Sydney. Those opposite brought in 21,000 new regulations, many of them applying to child care. That hurt the people of Western Sydney. 


I have a letter here today from Steve Robinson, who runs a childcare centre in my electorate of Lindsay. Let me quote:


Since the Abbott government came to office, Little Cottage Pre-School are achieving 100% bookings every day for the first time in living memory. 


Steve Robinson advises that they even have advance bookings and a wait list. This is ensuring Steve can have a full complement of staff every day. It is a family owned and operated childcare centre which employs local people. I have visited this centre. Under those opposite, Steve actually worked for free at night to meet the demands of regulation that those opposite imposed on this childcare centre. The proximity of this childcare centre to the CBD of Penrith enables parents who work there to have easy access to their children. They can drop their kids off, get to work and come back again. In Steve's opinion, the assessment process instigated by the minister has been thorough and professional, delivering a childcare model aimed at assisting the industry to flourish and prosper. Steve's preschool is a lot more settled now and looking to a bright and long future providing care to children for parents who live and work in the Penrith region. 


One issue he did raise was the threats of unions to take strike action to have wages raised in the sector. Currently the payment guidelines help to ensure core costs are within a range that most people can afford. Any rise in wages would obviously have a massive impact on childcare costs and potentially a negative effect on the ability of some families to afford legitimate professional child care. That is directly from a service provider in my electorate of Lindsay who is caring for children every single day.




Ms Owens:
  Not a family day care provider.




Ms SCOTT:
  Those opposite can sit there and harp on, but at the end of the day they are solely responsible for a 53 per cent increase in cost of child care over the last six years.


In regard to further operational matters of family day care services, this is not a fee assistance program and is not paid directly to educators or parents. Labor really took their eye off the ball when it came to the Community Support Program. The budget blew out by $200 million. This included Labor ignoring the 2012 Australian National Audit Office report highlighting the growing problem with the Community Support Program and recommending its eligibility guidelines be reviewed. The Australian National Audit Office report further noted that family day care was receiving 71 per cent of the total Community Support Program budget despite only caring for about 10 per cent of the children. This is completely unsustainable, completely irrational and goes to show that those opposite had taken their eyes off the ball and were not providing true support for the people of Western Sydney.

",HoR,<title>MATTERS OF PUBLIC IMPORTANCE</title>,<title>Family Day Care</title>,MATTERS OF PUBLIC IMPORTANCE,9,1,speech
"Ryan, Joanne, MP",ALP,2014-10-23,"



Ms RYAN
 (Lalor—Opposition Whip) (15:52):  I relish the opportunity to speak this afternoon on this matter of public important. I am honoured to follow the speakers from this side who have spoken before me, because on this side of the chamber, as you can hear today in this debate, there is a passion fore child care—a passion that is sorely lacking on the other side of this chamber. It is to do with the way Labor develops policy—what drives us and motivates us when we develop and implement policy.


I want to talk today a little bit about a link back to the past. We heard in question time a lot of links back to the past—our past, Labor's past, celebration of Labor's achievements—and we have done a lot of that this week. Gough Whitlam's government changed the paradigm of tertiary education. Under the Whitlam government, we remember, free university education was introduced. It was introduced to shift people's thinking, to radically change the way people thought about tertiary education. It opened up that education system. It made it affordable. It created aspiration. It created access. It changed Australian in doing to. It meant an increased number of women. It increased participation rates of women. It increased participation rates of, critically, mature-age students who were women, and that changed children's lives.


Gough Whitlam's government changed lives and, like that, what the previous Labor government did in the childcare space was aiming to do a similar thing, to change that paradigm, to change child care from the cheap, cheerful model that those opposite would like us to have to one that is educative, where children get care and learning. It was huge. And what do we have today? We have an MPI where all they are talking about over there is money and all we are talking about over here is quality.


We introduced the quality framework and understand on this side of the chamber—and have done forever—that to change a paradigm you might need to kick in with some funding. We have lots of negatives from the other side of the House about budget blow-outs. You cannot change a paradigm without increasing participation in a program. The budget blow-out, as they call it, reflects increased participation from women in the workforce, something we celebrate on this side of the chamber.


We changed the way the service operated. Recently in my electorate I went to visit family day care centres like all of us have over here. We have 33 providers in Lalor, all of which have been told that they may be at risk of losing their funding. That is 33 providers across an enormous number of educators. When I went to visit a few of them, what struck me was how the sector had shifted. I was someone who used family day care when my children were young. I saw a marked difference. I met people who were running family day care in their homes who were incredibly proud of the work they had done in quality frameworks, who were incredibly proud of their qualifications, who talked as educators about the children they were looking after, who were able to take me to a visual that showed me what those children had been learning in the last three months and to plans for what they were going to put in place for each child into the future. That is what you call shifting a paradigm. That is not a cheap and cheerful model; that is the model we need for modern Australia.


I think one of the important things we have to note in this MPI is, of course, money. We have to talk about money because we have to talk about the fact that Labor built a changed expectation. Labor built aspiration. Labor provided money to family day care that allowed in my electorate shift workers like those who work in the prison system to have their children in family day care. I heard from families whose wives had been employed because they found this model locally. Family day care operators were working specifically with shift working families.


But we have had the cuts. We are going to pull this back because Labor builds and those opposite tear it down. The cuts they are introducing to child care will tear down this sector. We hear a lot about the unionisation of the workforce as if somehow that is a negative. The unionisation of the childcare workforce is about women—mostly—in the workforce collectively bargaining for a better deal for themselves and for the children they care for.

",HoR,<title>MATTERS OF PUBLIC IMPORTANCE</title>,<title>Family Day Care</title>,MATTERS OF PUBLIC IMPORTANCE,9,1,speech
"Williams, Matt, MP",LP,2014-10-23,"



Mr WILLIAMS
 (Hindmarsh) (15:58):  Let me start off by saying that we all care about child care. I find it offensive—and so do my colleagues—for the member for Lalor to say that we do not. We have children. The member for Corangamite has children. The member—my fine colleague here has children.




Mrs McNamara:
  Dobell.




Mr WILLIAMS:
  Dobell—thank you very much, Member for Dobell. Much more memorable than the previous member; how could I forget!


But, in all honesty, we are committed to child care and care deeply about children's development. Yes, we may differ on policy. Yes, we may have better ideas for execution and, as we have seen, we generally get the execution far better than those on the opposite side. We can go into history, because it is important to understand why we are in this situation at the moment. We know that Labor did not manage things well when they were in government. When I was out in the electorate for many months leading up to the last campaign I continually heard that they had been the worst government for many decades. They performed poorly across so many areas, and this is just another area where they did not get the execution right and let things get out of control. And it is not just us saying this; there were reports done by the National Audit Office, as we have heard before.


We also heard about NATSEM a far bit this week. I want to go back to the NATSEM comments in their report from June this year, where they mentioned childcare affordability in Australia in issue 35. This report highlighted Labor's failure to address the issue of child care during their six years in government:


… it is hard to escape the conclusion that they have also helped drive up prices and the cost to government. The higher prices go, the more financial assistance families will require and so the cycle continues. 


Yes, they can go on about NATSEM modelling in the 90 second statements and the MPIs and everything else, but let us take on board what NATSEM said just a few months ago. Labor fail to do the work needed to fix the child care challenges and even refused, as we know, to undertake a Productivity Commission inquiry. Instead, they kept topping up child care assistance on the nation's credit card and helped drive up prices, as NATSEM has informed us.


We have had plenty of figures thrown around, as usual, by the Labor Party. But let us take a look at a few figures that they need to take stock of. The $1 billion of interest repayments per month. We know how many child care centres and schools that could buy. The take no responsibility. There is no accountability for the financial mess they left. Yes, if you want to go to more figures, we have got over $30 million a day in interest repayments. Let us talk about support. What sort of support can that by? This is where your debt and financial mismanagement hits the road. This is where it affects individual families, individual communities. This is something they just do not get.


Let me go onto the CPS in a broader sense. We know that it provides good assistance to families in establishing and maintaining services in areas where they might otherwise be unviable or otherwise unable to meet the requirements. We have heard some of the merits of the changes that we are implementing so that those in regional, remote or disadvantaged communities can be better off in this respect. I know this point was made by the minister, who visited my electorate and went to a child care centre in Grange and was warmly received. This is a valid point about how we are helping the market more broadly—how we are helping communities across the state, across our great country.


This sensible and fair measure brings support for family day care services into line with other types of child care such as long day care and outside school hours care. Just in closing, a few comments about early childhood education. I do agree with him member for Scullin on this point. We know children's development and the transition to school in those early childhood years are extremely important. There are significant reasons to support those early years, not just at home but also in a more formal sense with experienced educators, because there are significant benefits for when they get older in terms of development and their vulnerabilities. Naturally there is support required and costs money. Australian government funding is going to around $7 billion per year, covering two-thirds of the early childhood education and care costs. This is a significant investment and significant commitment to early childhood development, notwithstanding the comments of our friends opposite. In closing, let's be honest about this: we all care about child care, we are all committed to it. Let's just find the money to get on and do a good job.

",HoR,<title>MATTERS OF PUBLIC IMPORTANCE</title>,<title>Family Day Care</title>,MATTERS OF PUBLIC IMPORTANCE,9,1,speech
