name,party,date,text,chamber,debate_title,subdebate_title,debate_type,debate_id,subdebate_id,type
"Birmingham, Sen Simon",LP,2016-05-03,"



Senator BIRMINGHAM
 (South Australia—Minister for Education and Training) (16:21):  I welcome the opportunity to discuss this matter of public importance in the Senate today. I welcome the opportunity to set the record straight, because we hear many mistruths spoken in relation to school funding. We hear many Labor lies in relation to school funding, and we heard a few just then from Senator Lines. We hear this talk that only the Labor Party is committed to school funding and we hear suggestions endlessly from Senator Lines, from Ms Ellis, from Mr Shorten and from others who all suggest that there are somehow cuts and reductions in relation to school funding.


I welcome the opportunity to put on the record, from the first full year of the coalition government to the last year of the budget that will be handed down tonight, exactly how much money is available for schools, which demonstrates that it goes up each and every year. For the record, in 2014 the Commonwealth provided $13.7 billion in school funding. In 2015 we provided $14.9 billion. In 2016 we are providing $16 billion. In 2017 we will provide $17.4 billion. In 2018 we will provide $18.2 billion. In 2019 we will provide $19.1 billion. In 2020 we will provide $20.1 billion. You do not need a particularly high level of numeracy understanding or mathematics to look at those figures and understand they go up each and every year.


Senator Lines finished by saying, 'It's a question of trust'. Well based on Labor's claims that school funding is somehow going backwards, you clearly cannot trust the Labor Party. The facts speak for themselves. The figures that have been paid to schools, that are being paid to schools and that are locked into the budget forward estimates demonstrate that funding goes up each and every year into the future. The funding equation is quite clear. Is the Labor Party promising that it will spend more into the future? Yes. I do not deny that. I also acknowledge that the Labor Party is proposing around $100 billion in new taxes into the future as well. The Labor Party's policy is clear. They can talk about their policy, but they should not mislead about the coalition's policy, which does ensure funding growth and growth that is well in excess of inflation.


Much ofSenator Lines's contribution was based on arguments of what the states say. Well, surprise, surprise: state and territory governments ask for more money. As sure as night follows day, through the history of the federation, state and territory governments have always asked for more money; as sure as night follows day, through the history of federation and into the future, state and territory governments will always ask for more money. What we see is that those opposite are apparently a pushover when it comes to simply handing over more money. They will hand over more money on a whim, regardless of the fact that it requires higher taxes and/or increased debt from them. In fact, what we see is that the Labor Party have found one magic formula. It is the magic formula of having higher taxes and increased debt, because they promise to increase taxes by a lot, then they realise that those tax rises do not raise as much as they promised, and, oops, suddenly debt and deficit levels have gone through the roof. We have seen that just in the last couple of days.


What is the Labor Party's promise in relation to school funding and school spending? They promise over the next decade to spend an extra $30 billion. They go well beyond the budget, because it is easier for them to fudge the figures that way. They promise that over a decade they will spend an extra $30 billion. In announcing that they would do that, they said that they would pay for it by increasing the tax on tobacco. They said that that would raise about $40 billion. That is fine. They say, 'This well and truly pays for our school funding commitment,' and this was the Labor commitment. Just yesterday in the House of Representatives Ms Ellis said that it was tobacco tax that was paying for school funding increases. As recently as yesterday she singled out one tax rise—one only. The tobacco tax was to pay for the school funding increase. Then what do we discover? We discover that Labor's tax rise in relation to school funding only raises half as much as they said. That in relation to the $30 billion that was going to be there for school funding, $20 billion of it will not be there. Two in every three dollars is actually missing. So we get the double whammy: we get the tax rise from Labor, if they are elected, and we also get the reality that we will end up with much bigger deficits into the future, because the tax they promise will not be there, just as it was not there for the mining tax. Classic Labor: higher taxes, higher deficit—higher debt to fuel higher spending. The real problem is that the spending is done with no real idea of how they want to see it used. No reforms are attached to the spending, just a desire to hand over billions of extra dollars to the states and territories.


We are committed, as I said at the outset and as I detailed in the figures, to growing school funding every single year into the future—growing it ahead of costs. We are determined that that funding will be distributed according to need. Let me make clear what we mean by that. We mean that schools in low socioeconomic areas should receive more funding than other schools. We mean that students with disability should receive adjustment funding more than other students. We mean that students of an Indigenous background should receive additional support. We mean that small schools in rural and regional areas should receive additional support. We are committed to needs-based principles in the distribution of school funding. That is exactly how we will make sure school funding is distributed into the future—not just when it comes to how a bureaucrat in Canberra carves up the funding, which is what happens at present. We want to make sure that flows through to how the states and territories distribute the money.


What many people do not appreciate, and what I do not think the Labor Party appreciate, is that the model they signed up to when they delivered so-called Gonski funding at the tail end of the Gillard government was actually 27 different funding agreements around the country. It was not a uniform model; it was 27 different agreements, with lots of different special deals built into that with different states and territories and different non-government jurisdictions. And once they write out a great big to cheque to a state or territory they cannot guarantee that the money is going according to need in any event. There is nothing in the way Labor has structured it that ensures states and territories deliver the moneys to schools according to need. The Commonwealth gives the money to the states, and states do what they want with it by and large. That is not good enough, and we will take a different approach to this in the future to ensure that we do fund according to need.


We will also make sure that we fund according to real reform for our schools. Over the last 20-odd years real funding for Australian schools has gone up by more than 100 per cent—it has more than doubled—and enrolments have only gone up by about 18 per cent in that time. So there is a lot of extra funding that has gone into our school system. Yet on good international measures, we see that our reading and literacy standards, our numeracy and mathematics standards, our science measures and our engagement in foreign language studies have all gone backwards. We have been spending a lot more and getting poorer results as a result. So it is not a question of how much money is being spent; it is a question of how well it is being spent. 


That is why we have detailed reforms that address, from the earliest years, the identification of reading deficiencies in young children; that ensure intervention occurs at those earliest years; that ensure that students who are completing high school should have minimum standards of mathematics, literacy and numeracy; that ensure that those going on to university are actually required to have ambitions in maths and science and in English and humanities; that, importantly, reward our most capable teachers—not performance-based pay, as some try to mislead in this debate, nor pay based on NAPLAN results or the like, but pay that recognises those most capable teachers, as independently assessed by their peers and by the experts; that ensures they get a reward, an encouragement to stay in the teaching profession; and that provides greater incentives to go and work in the most disadvantaged schools. We want to ensure we get the best teachers into those most disadvantaged schools. 


These are real reforms that can make a real difference to lift the outcomes for Australian students. They can ensure we actually turnaround the decline in performance and give us the best possible chance to raise our education standards in the future. It is real change rather than the hollow promises about more spending that we hear from those opposite.

",Senate,<title>MATTERS OF PUBLIC IMPORTANCE</title>,<title>Schools Funding</title>,MATTERS OF PUBLIC IMPORTANCE,16,1,speech
"McKim, Sen Nicholas",AG,2016-05-03,"



Senator McKIM
 (Tasmania) (16:31):  The Greens do not regard education funding as a cost. We regard education funding as an investment. We are proud to take to the Australia people a fully costed, fully funded platform that puts those offerings to date from either of the establishment parties represented in this place completely in the shade. We have said very clearly we will reverse the Liberals' $30 billion cuts to education over the next decade. We have said, and committed, to fully funding year 5 and 6 of the Gonski reforms. We have recently announced a package of $4.8 billion to support students with disability in our schools based on the nationally consistent collection of data which that minister is still sitting on and refusing, with his colleagues from around the country on the ministerial council, to release so the Australian people can have a look at it. 


I well remember the infamous unity ticket promised by former Prime Minister Tony Abbott prior to the 2013 election, where he said, in effect, there was not a wafer of difference between the coalition on one side and Labor and the Greens on the other side on school funding. I well remember the actual unity ticket that emerged after the 2013 election, when then Commonwealth Minister Christopher Pyne went back on the commitment given prior to the election by former PM Mr Abbott and attempted to walk away in totality from the Gonski funding. 


I well remember the ministerial council that I attended as a Greens minister on behalf of Tasmania, along with my Labor colleagues, a Liberal colleague and even a National Party colleague, when together we formed the real unity ticket on education. We rolled Mr Pyne at that meeting and forced him very soon afterwards to come out and at least commit to four years of Gonski funding on behalf of the Commonwealth. That was the real unity ticket on education. It was a Labor Liberal National Greens unity ticket on education, and that was the unity ticket that at least delivered the Commonwealth to a four-year Gonski funding commitment. It is worth putting on the record that two-thirds of the Gonski funding was due in year 5 and 6, and that is what the Commonwealth have walked away from in the context of the current debate and in the lead-up to this election.


We have costed our Gonski at $3.5 billion over the budget out years, over and above the coalition's current school's budget. That is about making sure that our kids who go to school have the supports they need, the resources they need and the investment in to teachers and school leaders that is so critical to delivering improved educational outcomes in Australia. But we have also committed $4.8 billion to students with disability in Australian schools, putting in the shade the just over $100 million recently announced by the Commonwealth in the lead-up to the budget and, quite frankly, the pittance of $375 million over the budget out years that Labor are offering students with disabilities. 


We want to invest in extra supports for students with disabilities, but we do not regard this as a disability policy; we regard it as an ability policy. Our goal is to allow students who have a disability to maximise their ability, so that they can achieve what they have dreams to achieve in their lives, to maximise their potential, to maximise their abilities and to give them every opportunity to put back into our community and to be constructive members of our society and of our economy. 


This is an investment unprecedented in Australian political history that the Greens are proposing to make. It is the single biggest investment into supporting students with disabilities and we are absolutely proud that we will back those kids and the people who teach and support those children in our schools to maximise their abilities. 


This funding will assist with the provision of teacher assistance, which parents of students with disabilities will know is an absolutely crucial way that schools can support students with disabilities. But it is not just about extra teacher assistance. It is not just about training up teachers. It is not just about training up school leaders and ensuring that school communities and school associations understand the challenges and the potential solutions for those challenges. It is also about ensuring proper infrastructure in our schools. That can be anything from wheelchair accessibility around a school through to accessibility for transport for students with disabilities. 


We are proud to have announced that funding. I was proud to announce it with our leader, Richard Di Natale, a few weeks ago in Melbourne. It is important because the NCCD data on students with disability has identified 467,000 students with disability across Australia. On the most recent figures, which are 2013 figures, 190,000 students received extra funding for their disabilities in Australian schools. That means we are currently directly supporting less than half of the students who have been identified through the NCCD process as needing supports due to their disabilities. Less than one in two students across all schools sectors in Australia are being recognised and appropriately resourced by governments. That is a shameful statistic. It is a national shame that we are not supporting those students to the degree that they need and deserve.


It is worth pointing out that nine out of 10 students with disability attend a mainstream school in our country and around three out of every four attend a public school. Nearly one in two come from families that live in or near poverty in Australia. They are 33 per cent more likely not to study beyond year 10 than students without a disability and they are nearly twice as likely not to complete year 12 than students without a disability. Again those are shameful statistics. It is truly a national shame the way we do not support students with disabilities to the extent that they need and deserve in our schools.


We are also proposing the development of a national strategy to improve the education of students with disability. That has been recommended by a Senate inquiry. The key features of our proposal around a national strategy include recognising all students with disability as learners, ensuring all students with disability benefit from evidence-based, best-practice programs, having best-practice ongoing professional development for teachers and school leaders—that is a critical part of our package, and funding announced in our $4.8 billion can be used for the professional development of teachers and school leaders—and, crucially, including students with disabilities and their parents and carers in the development of individual education plans for students with disabilities.


We have put together and released to date the most comprehensive funding commitments of any party represented in this Senate—much broader and more detailed than the establishment political parties represented in this place. That is because we do not regard funding education as a cost. We regard it as an investment not only in the future of our country but in the children and the families that have students in our schools today. We are proud to take these policies to the Australian people at this election. We will debate any time anywhere representatives of the establishment parties in this place. We will put up our policies before the Australian people and ask them to give them due consideration as they consider how they are going to vote in the election, which is coming up in a couple of months time.

",Senate,<title>MATTERS OF PUBLIC IMPORTANCE</title>,<title>Schools Funding</title>,MATTERS OF PUBLIC IMPORTANCE,16,1,speech
"Polley, Sen Helen",ALP,2016-05-03,"



Senator POLLEY
 (Tasmania) (16:41):  I rise to speak on the Turnbull government's broken promises on school funding. What is it with this government? They cannot make up their mind from one day to the next. As was said on ABC's Lateline recently, 'Between lunchtime and Lateline this government changes its agenda.' Whether it be on workplace relations, the economy, tax policy or education, all the government care about is theatrics. They are not interested in governing and they are not interested in ensuring our children get a quality education that will set them up for the future. 


The Turnbull government's inaction on the economy and taxation has been alarming. Last weekend we also saw alarming inaction when it comes to education. I might add that the only plan or strategy that Prime Minister Turnbull has is for his own re-election. With the election quite literally around the corner, let me remind those on the other side about the promise that they made to the Australian people at the last election. I suggest they listen because this is a really good one. 


This was a promise that we all saw plastered in polling booths around the country during the 2013 election. It was a promise that the Liberals have ignored for the past 2½ years. The promise that the Liberals made was to match Labor on education funding dollar for dollar. That was the election commitment that they gave in 2013 and the reminder they gave people as they went into the polling booths. But this was, quite frankly, a lie. At the first opportunity the Liberals cut funding for our schools by $30 billion. It was the biggest single cut to education in Australia's history. 


The community may be a little confused if they had listened to the contribution by the minister in this chamber a little while ago. They no longer trust this government when it comes to education. They no longer trust this government when they are looking to the future of their children. They do not trust this government. They know the government will not fund their children's education and make sure that the levers are in place to ensure that our economy grows in the future.


Over the weekend and as recently as yesterday Mr Turnbull and his Liberals changed their tune once again. This is what we have learnt: one, the Turnbull government does not have an education policy; two, if voters vote for the Liberal Party Australian schools will receive $3.5 billion less by 2020 than if Labor is elected; and, thirdly, the Abbott-Turnbull government cut $30 billion from Australian schools. Then on Sunday they went, 'Oops,' and they promised to reverse that funding cut by $1 billion. Surely not even the learned, agile 21st century Prime Minister could not possibly think that the Australian community are going to be fooled and sucked in to believing that that $1 billion reversal is going to wipe away the other $29 billion that they took out of education.


This is an arrogant out-of-touch government that cannot help themselves. The minister had ample opportunity in this chamber a little while ago to clarify where this government is heading and to reassure the Australian community, but he failed. This government has no policy and no agenda for anything more than getting themselves re-elected, and that will be borne out. I guarantee those listening and those who are in the chamber that tonight's budget will do nothing except try to buy them enough time to get themselves re-elected. That is what this budget will be about. But the choice at the election is going to be so clear. What the government say today and what they will deliver tomorrow will be extremely different. We know that, because that has been their track record. This is not just what we are saying; it is what they have delivered over the last 2½ years.


If the Australian people are, as I believe, concerned about their kids' future, they will vote Labor at this election—because they know we will deliver. It is a historic fact that Labor always delivers to the Australian people when it comes to education. We put people first. We put kids first. What we will not do is cut education funding. (Time expired)

",Senate,<title>MATTERS OF PUBLIC IMPORTANCE</title>,<title>Schools Funding</title>,MATTERS OF PUBLIC IMPORTANCE,16,1,speech
