name,party,date,text,chamber,debate_title,subdebate_title,debate_type,debate_id,subdebate_id,type
"Morrison, Scott, MP",LP,2018-02-08,"



Mr MORRISON
 (Cook—Treasurer) (10:14):  Firstly, I thank all the members who have contributed to this debate. This bill delivers on the remainder of the government's enterprise tax plan introduced in the 2016-17 budget. The first element of that plan, which has been previously legislated for firms earning up to $50 million in turnover each year, was a watershed change for businesses around this country, particularly for small businesses earning between $2 million and $10 million in turnover each year. Not only does that reduce the tax rate for those businesses but it also provides businesses that have a turnover up to $10 million access to the small business tax incentives: the instant asset write-off, pool depreciation and GST on a cash flow basis. All of these are important measures that assist genuine small businesses which, this government believes, are businesses with a turnover of up to $10 million. That is a different view to those who sit opposite.


The Labor Party believe a small business should only be defined as a business earning up to $2 million. The Henry review suggested it should have been up to $5 million, and we thought it should go further than that. A business earning up to $10 million can have some 22 employees. It is not Google or Microsoft or any of those sorts of businesses—they're genuine small businesses which we find in all of our electorates. This government provided those businesses with the most significant tax relief that those types of businesses have ever seen, because we understand small businesses. We know what a small business is. We know where they are, we know what they need, we know the support they need and we know the recognition they need. That's why we legislated tax relief—tax cuts—for small businesses, and the Labor Party opposed it. We know, because the Labor Party have said—in relation to these measures and in relation to the $65 billion of estimated revenue impacts over the 10 years, which includes the tax relief to not just businesses earning between $2 million and $10 million but businesses all the way to zero in turnover—that they have factored that into their costings. They've spent all that money and they still have a deficit which is greater than what the coalition put forward at the last election. They spent all that and then spent more and then had an even worse fiscal position.


It's clear that the Labor Party, if they are elected at the next election, have factored into their costings the reversal of tax cuts for small- and medium-sized businesses. The bill that's now before the House would see the next cab off the rank—businesses earning between $50 million and $100 million—get a tax cut. It's bad enough that the Labor Party would deny those businesses that. Again, they're not multinationals or even big domestic companies necessarily but businesses in South Australia, businesses in Tasmania—businesses all around the country—that are modest, growing and hungry businesses that want to put more and more Australians into jobs. I cannot understand how keeping taxes high for these businesses helps them employ more Australians or boost their wages. It doesn't make any sense. 


I know there are plenty of critics of the government's plan that we have consistently held to, that we took to an election and that we won an election on; it was confirmed by the Australian people. I know that. But what of the question put to the counterfactual? How on earth does keeping business taxes high help one business employ one more Australian or give one more Australian a wage rise or help them invest one more dollar in their business—in plant, in equipment, in technology, in training, in developing new products or in going after new markets? Keeping business taxes high is a complete numpty of an idea. It doesn't make any sense. Anyone who thinks that's good economic policy has absolutely lost their economic compass and cannot find their way around the economic debate in this country.


We're putting forward the continuation of our plan to continue to drive the jobs and the growth that we are seeing. Last year over 400,000 jobs were created. That was a record year for jobs growth, eclipsing all others since records were first taken for jobs in this country. It is stronger than the Rudd-Gillard-Rudd government's best years, stronger than the Howard government's best years, stronger than the Keating government's best years, stronger than the Hawke government's best years, stronger than the Fraser government's best years and stronger than the Whitlam government's best years—the strongest jobs growth on record.


It's part of a plan. It's not the whole plan. There's our $75 billion infrastructure investment, which we know is equally, for similar reasons, supporting investment in our economy, supporting growth and supporting the case for strong wage outcomes for Australians. There's our investment and stickability when it comes to the issue of opening up new markets through trade. That's something the Labor Party used to believe in but, like everything else, have changed their tune on. We stick to things, and we're sticking to this plan. We're sticking to this plan because we know it's in the economic interests of Australians.


It's often said to me, 'It's unpopular with some.' That may cause the Labor Party to lose their faith, to lose their belief and to lose their conviction that these things are good for the economy. But what I do know is popular is this: more and better paid jobs. As a government you've got to be prepared to do the things that achieve those outcomes and not go to water the first time that someone makes a criticism of your policy. This government will not relent to that. We stick to our plans, practically, to get the outcomes that we know produce more and better paid jobs.


That's why we're sticking to our plans on innovation. Just this morning we announced further changes, particularly to the early stage venture partnerships, which is part of that innovation agenda that continues to be rolled out by the government. The defence industry plan is supporting Australia's advanced manufacturing industry to transition. Our global economy is changing, and we're supporting our advanced manufacturing sector to change with it through the biggest recapitalisation of our defence forces since the Second World War, producing the two great dividends that coalition governments have always delivered—national economic security and national economic growth.


The importance of these reforms cannot be understated. The academic debate about this, I am sure, will continue, but Australians are interested in the results that the coalition government is delivering. And it's not just us; around the world, the global economic consensus of sensible governments is that we must reduce the tax burden on businesses that employ our citizens so as to give them the headroom to ensure that they can give our citizens more and better paid jobs.


The Labor Party have opposed us on this. They want Australia to be stranded on a high-tax island. They want to see jobs, investment, innovation and training—all of these things—go offshore. That's their choice and they must own the consequences for those decisions done on the basis of populism, not on economic policy. They have lost their economic compass in opposing this bill. We know that they once supported these measures. In government, many years ago, under treasurers and prime ministers, they implemented similar measures. So it is disturbing that we see this shift occurring in the Labor Party when it comes to economic policy and the re-education program that has been put on the Labor Party by the Greens in this country as they move ever closer to the cohabitation on economic policy with the Greens, which we will only see further fused in the upcoming by-election in Batman. It was the Leader of the Opposition, then Assistant Treasurer, who said on 30 March 2011:


… corporate tax reform helps Australia’s private sector grow and it creates jobs right up and down the income ladder.


… lowering the corporate rate for smaller businesses … creates an artificial incentive for Australian businesses to downsize.


In worse case scenarios some businesses might actually lay people off to get smaller—and the size based different tax treatment would create a glass ceiling on business workforce growth.


We know that the Labor Party have stood for these sorts of changes before, but today in this place they continue to make excuses as to why they will not vote for their previous convictions. Their convictions have evaporated in the face of having to actually stand for economic common sense.


The shadow Treasurer joins me at the table—not out of flattery but because he's on duty and he is welcome. With his leader, on 6 June 2016, he said: 'You'd need a microscope to find the impact of the corporate tax cut on economic growth.' But this stands in stark contradiction to what he said in his own book in 2013, where he said:


It is a Labor thing to have the ambition of reducing company tax, because it promotes investment, creates jobs and drives growth.


So Labor says that it can't be done because it cannot be afforded. What I don't understand, then, is what I said before: they reverse the company tax cuts and they end up with a bigger deficit. Explain that one to me. It can't be afforded, but, even when they get rid of them, they end up with a higher deficit. We know that the shadow Treasurer said in February this year: 'The objection to the corporate tax rate is that this nation, at this point, cannot afford it. It is the biggest single hit on the budget that either side will propose.' But in 2013 he said, 'The United Kingdom, facing a much tougher fiscal situation than Australia, has cut its company tax rate to 23 per cent in April 2013 to be further reduced to 21 per cent in April 2014.'


We know that the Leader of the Opposition talked about the need for company tax cuts to be part of an agenda for investment and growth when the deficit was at $41.5 billion and rising, back in 2011. In 2012, as Minister for Financial Services and Superannuation, the Leader of the Opposition said, 'Any student of Australian business and economic history since the eighties knows part of Australia's success was derived through the reduction in the company tax rate.' The deficit at that point was $37.1 billion and rising. The shadow Treasurer said on 22 September 2015: 'I would like to see the corporate tax rate come down over time'—which is what this bill proposes, by the way. 'I've previously said that the nation should be aiming for a 25 per cent corporate tax rate'—the deficit at that time was $35.1 billion. The problem is that the shadow Treasurer aims for this thing but can't hit it, because he's lost his conviction to follow through on the things he once believed in.


The shadow minister for financial services said on 2 February 2016 that Australia would go better with a lower company tax rate. The deficit at that point was $37.4 billion. Then there's the case regarding inequality. 'Recent trends,' the shadow Treasurer said in 2017, 'certainly don't inspire optimism when the government tells people to trust them that the tax rate cut for business will magically trickle down.' Yet his own leader said on 30 March 2011, in a speech to ACOSS, 'Reducing the corporate tax rate sees more capital flowing into our domestic economy, which will flow on to workers in the form of higher wages, thereby improving the standard of living.'


Finally, they say you can't have the AAA credit rating and a corporate tax cut. With no help from the opposition, Australia has retained the AAA credit rating from all three ratings agencies—that was confirmed in the last few weeks—and we're one of only 10 countries to do so.


These are excuses for why the Labor Party are not supporting this bill. As to whether they've changed their mind, never believed it in the first place or have lost their way, I'll let the Australian people decide. When they stand in this place today and vote against a plan that has already demonstrated in its first instalment its support for jobs growth in this country, and go against everything they've previously believed in government to court the chorus of populism, it's a sad day for the Labor Party. This is the day when in this place they will vote their economic credentials out of existence. This is why they cannot be trusted to manage our $1.8 trillion economy—because they have lost their economic compass. They don't know where they're going. They don't know how to drive growth in the economy. They have no plan to lift wages in this country. They have embarked on their voyage to the other side to cohabit with the Greens, who now write economic policy for the Labor Party. As I said the other day in this place, when it comes to economic policy, if you don't know what you believe, no-one will believe in you, and that's why no-one believes in the Labor Party's economic credentials anymore.



The SPEAKER:  The original question was that this bill be now read a second time. To this the honourable member for McMahon has moved as an amendment that certain words after 'That' be omitted with a view to substituting other words. The immediate question is that the amendment moved by the member for McMahon be agreed to. 

",HoR,<title>BILLS</title>,<title>Second Reading</title>,BILLS,4,2,speech
"Smith, Tony, MP",LP,2018-02-08,"



The SPEAKER
 (10:40):  The question is that this bill be read a second time.

",HoR,<title>BILLS</title>,<title>Second Reading</title>,BILLS,4,2,speech
"Hastie, Andrew, MP",LP,2018-02-08,"



Mr HASTIE
 (Canning) (10:55):  On behalf of the Parliamentary Joint Committee on Intelligence and Security, I present the committee's report entitled Review of the listing of Islamic State Khorasan Province and the re-listing of al-Murabitun as terrorist organisations under the Criminal Code.


Report made a parliamentary paper in accordance with standing order 39(e).




Mr HASTIE:
  by leave—I am pleased to present the committee's report on the listing of Islamic State Khorasan Province and the relisting of al-Murabitun as terrorist organisations under the Criminal Code.


The Criminal Code enables the committee to review the listing of terrorist organisations and report its findings to the parliament within the 15-day disallowance period.


This is the first time Islamic State Khorasan Province has been listed as a terrorist organisation. Islamic State Khorasan Province is a recognised partner of Islamic State with an estimated membership of up to 11,000 members. The group's primary objective is to establish the province of Khorasan (a region encompassing Afghanistan, Pakistan and Central Asia) as part of the global caliphate of Islamic State. Since 2015, the group has claimed responsibility for a number of attacks including suicide bomb attacks in Afghanistan and Pakistan.


Al-Murabitun is an al-Qaeda aligned Sunni Islamic terrorist group that is committed to enforcing sharia law in West Africa and uniting Muslims and Islamic movements across Africa against non-Muslim and secular influences.


The group was first declared a terrorist organisation by the Australian government in November 2014. Since then the group has reaffirmed its alliance to al-Qaeda and continues to conduct attacks in West Africa. The group funds its activities through smuggling, connections with other terrorist organisations and kidnappings for ransom. In 2016, the group kidnapped Australian citizens Jocelyn and Kenneth Elliott. The group claimed the primary motive for this kidnapping was to gain the release of their captives. Jocelyn Elliott was released but Kenneth Elliott, sadly, has not yet been recovered.


In conducting its review, the committee considered publicly available information and carefully reviewed the procedures followed by the government and the merits of the listings themselves.


The committee was satisfied that appropriate processes had been followed and that both organisations should be listed as terrorist organisations.


The committee therefore supports the listing of Islamic State Khorasan Province and the relisting of al-Murabitun, and finds no reason to disallow the legislative instruments.


I commend this report to the House.

",HoR,<title>COMMITTEES</title>,<title>Intelligence and Security Committee</title>,COMMITTEES,5,1,speech
"Hastie, Andrew, MP",LP,2018-02-08,"



Mr HASTIE
 (Canning) (10:55):  On behalf of the Parliamentary Joint Committee on Intelligence and Security, I present the committee's report entitled Review of the listing of Islamic State Khorasan Province and the re-listing of al-Murabitun as terrorist organisations under the Criminal Code.


Report made a parliamentary paper in accordance with standing order 39(e).




Mr HASTIE:
  by leave—I am pleased to present the committee's report on the listing of Islamic State Khorasan Province and the relisting of al-Murabitun as terrorist organisations under the Criminal Code.


The Criminal Code enables the committee to review the listing of terrorist organisations and report its findings to the parliament within the 15-day disallowance period.


This is the first time Islamic State Khorasan Province has been listed as a terrorist organisation. Islamic State Khorasan Province is a recognised partner of Islamic State with an estimated membership of up to 11,000 members. The group's primary objective is to establish the province of Khorasan (a region encompassing Afghanistan, Pakistan and Central Asia) as part of the global caliphate of Islamic State. Since 2015, the group has claimed responsibility for a number of attacks including suicide bomb attacks in Afghanistan and Pakistan.


Al-Murabitun is an al-Qaeda aligned Sunni Islamic terrorist group that is committed to enforcing sharia law in West Africa and uniting Muslims and Islamic movements across Africa against non-Muslim and secular influences.


The group was first declared a terrorist organisation by the Australian government in November 2014. Since then the group has reaffirmed its alliance to al-Qaeda and continues to conduct attacks in West Africa. The group funds its activities through smuggling, connections with other terrorist organisations and kidnappings for ransom. In 2016, the group kidnapped Australian citizens Jocelyn and Kenneth Elliott. The group claimed the primary motive for this kidnapping was to gain the release of their captives. Jocelyn Elliott was released but Kenneth Elliott, sadly, has not yet been recovered.


In conducting its review, the committee considered publicly available information and carefully reviewed the procedures followed by the government and the merits of the listings themselves.


The committee was satisfied that appropriate processes had been followed and that both organisations should be listed as terrorist organisations.


The committee therefore supports the listing of Islamic State Khorasan Province and the relisting of al-Murabitun, and finds no reason to disallow the legislative instruments.


I commend this report to the House.

",HoR,<title>COMMITTEES</title>,<title>Report</title>,COMMITTEES,5,2,speech
"O'Dwyer, Kelly, MP",LP,2018-02-08,"



Ms O'DWYER
 (Higgins—Minister for Revenue and Financial Services, Minister for Women and Minister Assisting the Prime Minister for the Public Service) (10:59):  by leave—I move:


That this bill be now read a third time.


Question agreed to.


Bill read a third time.

",HoR,<title>BILLS</title>,<title>National Health Amendment (Pharmaceutical Benefits—Budget and Other Measures) Bill 2017</title>,BILLS,6,1,speech
"O'Toole, Cathy, MP",ALP,2018-02-08,"



Ms O'TOOLE
 (Herbert) (13:30):  I stand in this place today to make it crystal clear that I will always fight for jobs for the people of my electorate of Herbert. My position on Adani has always been very clear: it must stack up both environmentally and commercially, and if it does it will go ahead, but I will never support giving a billion taxpayer dollars to a billionaire foreign company. I will fight every day in this place for real, quality and secure jobs for the people of Townsville. We suffered Clive Palmer from the Gold Coast axing 800 jobs from QNI, we suffered Campbell Newman's government in Brisbane slashing jobs in our community, and now we are suffering the Turnbull government in Canberra cutting jobs in Townsville in our schools and hospitals, more than in any southern capital city.



I am sick of these jobs cuts, and I am sick of the missed opportunities for Townsville. I will never back down from arguing for secure and quality jobs for the people of Townsville. I fought for the Townsville Stadium. Labor promised to deliver, and it is now delivering 750 local jobs. I fought for large infrastructure projects that Townsville needs to secure our energy and water future. Labor has provided $200 million to support hydro on the Burdekin Falls Dam, which will deliver 150 construction jobs. Labor will provide $100 million to ensure Townsville's water security. I will continue to fight for real, quality jobs in all sectors in our community. (Time expired)

",HoR,<title>STATEMENTS BY MEMBERS</title>,<title>Herbert Electorate: Employment</title>,STATEMENTS BY MEMBERS,7,1,speech
"Joyce, Barnaby, MP",Nats,2018-02-08,"



Mr JOYCE
 (New England—Deputy Prime Minister, Minister for Infrastructure and Transport and Leader of The Nationals) (14:01):  I inform the House that the honourable member for Capricornia has been appointed the Nationals Chief Whip and the honourable member for Page has been appointed the Nationals Whip.

",HoR,<title>PARTY OFFICE HOLDERS</title>,<title>The Nationals</title>,PARTY OFFICE HOLDERS,8,1,speech
"Shorten, Bill, MP",ALP,2018-02-08,"



Mr SHORTEN
 (Maribyrnong—Leader of the Opposition) (14:01):  My question is to the Prime Minister. A review by the Close the Gap Campaign Steering Committee has found that this government has effectively abandoned the Closing the Gap strategy. Given this damning indictment, how can the Prime Minister continue to justify half a billion dollars of cuts to Indigenous affairs?

",HoR,<title>QUESTIONS WITHOUT NOTICE</title>,<title>Indigenous Affairs</title>,QUESTIONS WITHOUT NOTICE,9,1,question
"Turnbull, Malcolm, MP",LP,2018-02-08,"



Mr TURNBULL
 (Wentworth—Prime Minister) (14:02):  I thank the honourable member for his question. The government is making substantial progress in Indigenous advancement and there is much more to be done. I will set out, on Monday, in the Closing the Gap report, where we are doing satisfactorily and where there is a lot more work to do.


I want to advise the House about the very real advances that have been made. We're making a $5 billion investment over four years to 2021 in the Indigenous Advancement Strategy—front line service funding that'll improve the lives of Aboriginal and Torres Strait Islander people. We're providing an estimated loading of $4.4 billion for Aboriginal and Torres Strait Islander students, with students with greater needs attracting a higher level of funding due to the implementation of the model that David Gonski designed and that we are delivering. In 2018, this additional funding will benefit over 200,000 Indigenous students.


Last year I announced a $138 million education package to further enable the economic and social inclusion for which the 1967 referendum campaigners fought, and that will include more opportunities for our First Australians to study science, technology, engineering and mathematics. We're empowering communities through our Indigenous Procurement Policy, with over half a billion dollars in Commonwealth spending going to 956 Indigenous businesses. This is a spectacular increase from just $6.2 million being won by Indigenous businesses in 2012-13 under former policies. We're investing $14 million in empowered communities to provide critical capability for Indigenous leaders as they work with their communities and partner organisations to identify local priorities, needs and aspirations.


Our Prison to work report commissioned in my 2016 Closing the Gap speech has since been delivered and released by COAG. From early this year a voluntary program will provide sentenced Indigenous people in prison with employment assistance to access the support they need on their release. That will prepare them better to find employment and transition back into the community. And of course last year we appointed June Oscar AO as the first female Aboriginal and Torres Strait Islander Social Justice Commissioner. We've got a lot more to do, but we are getting on with it. We are working with our First Australians. We are doing things with them, not doing things to them.

",HoR,<title>QUESTIONS WITHOUT NOTICE</title>,<title>Indigenous Affairs</title>,QUESTIONS WITHOUT NOTICE,9,1,answer
"Smith, Tony, MP",LP,2018-02-08,"



The SPEAKER
 (15:23):  I have received a letter from the honourable member for Fenner proposing that a definite matter of public importance be submitted to the House for discussion, namely:



The Government undermining Australia’s charities.


I call upon those members who approve of the proposed discussion to rise in their places.




More than the number of members required by the standing orders having risen in their places—


",HoR,<title>MATTERS OF PUBLIC IMPORTANCE</title>,<title>Charities</title>,MATTERS OF PUBLIC IMPORTANCE,11,1,speech
